ชิดชั้น,ว.,ดีเลิศ อย่างดี
ชิดชิน,ว.,ดีเลิศ ประเสริฐ
ชิดริด,ว.,กระจุ๋มกระจิ๋ม แรกรุ่น รุ่นหนุ่มรุ่นสาว
ชิดลิด,ว.,กระจุ๋มกระจิ๋ม แรกรุ่น รุ่นหนุ่มรุ่นสาว
ชิน,ว.,ดี งาม วิเศษ มักใช้กับคำ ชิด เป็น ชิดชิน
ชิ้น,น.,เนื้อ เนื้อสัตว์
ชิ้นก้น,น.,เนื้อสะโพก
ชิ้นกลม,น.,เนื้อเส้น
ชิ้นเกลือ,น.,เนื้อเค็ม
ชิ้นติดดูก,น.,เนื้อติดกระดูก
ชิ้นเถิบ,น.,เนื้อแผ่น โดยมากมีรสเค็ม
ชิ้นลาบ,น.,เนื้อสำหรับทำลาบ
ชิ้นลาบ,น.,ลาบ อาหารชนิดหนึ่งใช้เนื้อหมูดิบสับให้ละเอียดผสมด้วยเครื่องปรุง ประกอบด้วยพริกแดง เครื่องเทศชนิดต่างๆ
ชิ้นส้ม,น.,เนื้อส้ม มักหมายถึงแหนมที่ทำด้วยเนื้อหมู ถ้าเป็นแหนมที่ได้จากเนื้อสัตว์อื่นก็จะระบุไว้ด้วย เช่น ชิ้นส้มค่าง - แหนมที่ทำมาจากเนื้อค่าง เป็นต้น
ชิ้นแห้ง,น.,เนื้อแห้ง เนื้อย่าง
ชิม,ก.,จิบ ลิ้ม ลอง ดูรสด้วยปลายลิ้น
ชิ้วงัว,น.,เนื้อวัว
ชิววิว,ว.,แจ๋วแหวว ใส ไม่ข้น ใช้สำหรับสิ่งที่เห็นอยู่ไกลหรืออยู่เล็ก เช่น น้ำก้นบ่อ
ชิหลอบ,น.,ด้วงขี้ควาย
ชิหีด,น.,จิ้งหรีด
ชี,น.,พระ นักบวช
ชี,น.,เรียกต้นยี่หร่าหรือผักชีลาวว่า ผักชีเทียนแกลบ
ชี,ก.,ไช ปั่นเข้าไปเป็นรูด้วยสว่าน
ชี,ว.,ดี งาม มักใช้กับคำอื่น เช่น เชียงชี หรือ เดือนชีปีใหม่ - ปีใหม่อันเป็นปีเดือนที่ดี
ชี่,น.,น้ำมันในใบยาสูบ
ชี้,น.,คำนำหน้าแมลงบางชนิด
ชี้,ก.,แนะนำ บอกให้
ชี้,ว.,เหยียดตรง เช่น หางชี้
ชี้แจง,ก.,บอกให้ทราบโดยละเอียด
ชีผ้าขาว,น.,ชีปะขาว - นักบวชนุ่งขาวห่มขาว ใช้สำหรับเพศชาย
ชีไฟ,น.,กระบะดินสำหรับตั้งก้อนเส้าหรือตั้งเตา
ชีวิต,น.,ความเป็นอยู่ ตรงข้ามกับตาย
ชีโว,น.,หมวกชีโบ - หมวกที่มีขนสัตว์ปิดลงมาหุ้มหู เช่น หมวกจีน บางแห่งหมายถึงหมวกกะโล่
ชึ,ว.,แฉะ ชื้น มีน้ำซับ
ชึชะ,ว.,ลักษณะที่เป็นน้ำเยิ้ม เฉอะแฉะ
ชึม,ก.,ซึม - อาการที่น้ำหรือของเหลวไหลไปทีละน้อย
ชึมชัง,ก.,ชิงชัง แหนงหน่าย
ชืด,ก.,รู้สึกเย็น รู้สึกชา ครั่นเนื้อครั่นตัว ระโหย
ชืดเนื้อชืดตัว,ก.,ตะครั่นตะครอ รู้สึกเป็นไข้
ชืน,น.,ชิน ตะกั่ว
ชืน,น.,เรียกงูแสงอาทิตย์ว่า งูชืน
ชื่นชม,ก.,ชื่นชม ปลาบปลื้ม
ชื่นย้าว,ว.,เบิกบานใจ
ชื่นสู้,ว.,ปลาบปลื้ม พอใจ
ชื่อ,น.,ชื่อ คำที่ตั้งขึ้นเพื่อเรียกคน สัตว์ หรือสิ่งของ
ชื้อ,ว.,เยือกเย็น ชื้น ร่มครื้น มักใช้ประกอบคำอื่น เช่น เอยนชื้อ เยือกเย็น เย็นชื้น
ชื่อว่า,ก.,มีชื่อเรียกว่า
ชื่อว่า,สัน.,แม้นว่า หากว่า
ชุ,ก.,ตั้ง วาง รวม สุม ประชุม
ชุ,ว.,ฟกช้ำ ระบม ทุก ถ้วน ครบ เช่น ชุวัน - ทุกวัน
ชุ่งชา,น.,ชิงช้า
ชุ่งชาลิง,น.,เถาบอระเพ็ด
ชุช้ำ,ว.,ฟกช้ำ ระบม
ชุธาตุ,ก.,ความเชื่อที่ว่าก่อนการปฏิสนธิวิญญาณจะมาอยู่ที่พระธาตุ การที่ผู้เกิดในแต่ละปีจะต้องถือเอาพระพุทธรูปหรือปูชนียวัตถุหรือพระเจดีย์ที่จะต้องบูชาเป็นพิเศษเฉพาะตน โดยที่กำหนดไว้ดังนี้ ปีไจ้ (ชวด) - พระธาตุจอมทอง ปีเป้า (ปีฉลู) - พระธาตุลำปางหลวง ปียี (ขาล) - พระธาตุช่อแฮ ปีเหม้า (เถาะ) - พระธาตุแช่แห้ง ปีสี (มะโรง) - พระพุทธสิหิงค์ ปีไส้ (มะเส็ง) - สถานที่พระพุทธเจ้าตรัสรู้ ปีสะง้า (มะเมีย) - พระธาตุตะโค่ง (ร่างกุ้ง) ปีเม็ด (มะแม) - พระธาตุดอยสุเทพ ปีสัน (วอก) - พระธาตุพนม ปีเล้า (ระกา) - พระธาตุหริภุญชัย ปีเส็ด (จอ) – พระธาตุเกศแก้วจุฬามณี ปีไค้ (กุน) - พระธาตุดอยทุง (บุญคิด)
ชุน,ก.,เดิน เดินทาง
ชุน,ก.,ชักชวน (ธรรมราชานุวัตร)
ชุ่น,น.,โชงโลง - เครื่องมือสำหรับวิดน้ำสานด้วยไม้ไผ่ มีที่ถือเป็นคันยาว
ชุบ,ก.,ชุบ - จุ่ม ย้อม ปลอม ทำเทียม กะไหล่
ชุบชิง,ก.,แย่งชิง ปล้นสะดม ต่อสู้ด้วยกำลังไพร่พล
ชุบย้อม,ก.,เสริมแต่งเรื่องให้เกินจริง สร้างเรื่องเพื่อโกหก
ชุม,น.,พวก กลุ่ม ชุด
ชุ่ม,ว.,ชื้น เปียก มีน้ำหรือของเหลวซึมซาบเอิบอาบอยู่
ชุ่มใจ,ก.,อิ่มใจ สบายใจ
ชุ่มชาลิง,น.,เถาบอระเพ็ด
ชุ่มนุม,ก.,ชุมนุม ประชุม
ชุมพู,น.,ชมพูทวีป แผ่นดิน บ้านเมือง
ชุมพู,น.,ต้นชมพู่
ชุ่มยว้าย,ก.,ยิ้มแย้ม อิ่มเอม ปีติ
ชุ้ย,ก.,ยุ ทำให้กำเริบ เช่น ชุ้ยหมาไล่ขบ - ยุหมาให้ไล่กัด
ชุเยื่องชุประการ,ว.,ทุกเรื่องทุกประการ
ชู่,ว.,ทั้งหมด ถ้วน ครบ
ชู้,น.,ดักแด้
ชู้,น.,คนรัก ผู้ล่วงประเวณี
ชู้,น.,ของกินที่เข้าคู่กัน เช่น ยอดผักบุ้งเปนชู้ของส้มตำ
ชู้,น.,ชู้หมาก คือ ต้นหมากผู้หมากเมีย
ชู้,ว.,คล้าย แม้น เทียม
ชู ,ก.,ยอม ยอมรับ ตกลง ไปหา สมสู่ อยู่ด้วยกัน
ชู้เข้าหนม,น.,ห่อขนมหลอก วางบนห่อขนมเวลานึ่ง เชื่อว่าทำให้ขนมสุกทั่วกัน
ชูง่าย,ก.,ทึกทักเอา สรุปเอา ถือเอา ทำเพียงให้เสร็จสิ้นเท่านั้น
ชูที่,ว.,(ไปหา) ถึงที่
ชูบ,น.,รุ่น สมัย เช่น เช่นพ่อ เช่นแม่
ชูบ,ว.,รุ่นราว คราวเดียวกัน
ชู่ผู้ชู่ฅน ,ว.,ทั้งหมด ถ้วน ครบ
ชูเพิ่น,ก.,ยอมรับตามที่ผู้อื่นเสนอ ไปหาท่านผู้อื่น
ชูมือ,ก.,ถึงมือ มาสู่มือ
ชู้หมาก,น.,ต้นหมากผู้หมากเมีย
ชูหวิดชูคลาด,ว.,ถึงมิถึงแหล่ จวนจะครบ
เชกคาย,น.,นายทหาร (พม่า)
เช็ด,ก.,ขัด ถู ทำให้สะอาด
เช็ด,ก.,อาการที่ี่ผู้มีอาคมใช้ใบพลูเสกเช็ดไปตามร่างกายผู้ป่วยเพื่อรักษาโรค
เช็ดเรือน,ก.,ถูบ้าน
เช่น,น.,ระยะ รุ่น ชั่วอายุ ขนาด มาตรฐาน
เช่น,ว.,มาก มากยิ่ง
เช็น,น.,ฝาบ้าน ไม้ลูกตั้งสำหรับยึดฝาบ้าน
เช็น,น.,อารักษ์บ้านเมือง
เช่นกะเช่นยะ,น.,สมัยโบราณนานมาก
เช่นขระกูล,ล.,จำนวนชั่วโคตร เช่น ๗ เช่นขระกูล
เช่นขาธนู,ว.,ชั่วระยะของขาธนู
เช่นค้องดัง,ว.,ระยะที่ได้ยินเสียงฆ้อง
เช่นชั้น,ว.,สืบมาแต่โบราณ
เช่นตา,น.,ชั่วสายตา ระยะที่สายตามองเห็นได้
เช่นท้าว,ว.,ชั่วอายุกษัตริย์
เช่นร้อง,น.,ชั่วตะโกน ชั่วระยะที่สามารถตะโกนถึงกันได้
เช่นล้ำ,ว.,มากยิ่ง
เช่นหม้อเข้าเดือด,ว.,ชั่วหม้อข้าวที่ทำจากดินเดือด ประมาณครึ่งชั่วโมง
เชย,ก.,เบิกบาน อิ่มเอม ชุ่มชื่น
เชย,ก.,อาการที่ลมพัดโชย
เชย,ว.,ชื่นบาน แช่มชื่น
เชา,น.,ภาษี ส่วย
เช้า,น.,ระยะเวลาระหว่างรุ่งกับสาย
เช้า,ว.,เร็วกว่าเวลาที่กำหนดไว้
เช้าชี่,ว.,เช้ามาก เช้ามืด
เช้าเม้า,ว.,ลักษณะที่ี่งอหัก
เชาะ,ก.,น้ำกัดเซาะฝั่งหรือหิน
เชาะเลาะ,ว.,ลักษณะของขนาดเล็กที่ค้างคาอยู่ อย่างใบกล้วยอ่อนค้างคาอยู่ที่คอกล้วยหรือจิ้งหรีดคาอยู่ปากรู ถ้าของขนาดใหญ่ใช้ โชะโละ
เชิง,น.,แง่งอน กระบวน ท่าที เล่ห์เหลี่ยม อุบาย
เชิง,น.,เรียกการฟ้อนรำประกอบการตบไปตามส่วนต่างๆ ของร่างกายให้มีเสียงเพื่อนประกอบการ ฟ้อนดาบ เรียกว่า ฟ้องเชิง
เชิง,น.,บางครั้งหมายถึง ขุนเจือง
เชิ่ง,น.,ช่วง ระยะ ระหว่าง
เชิงฟ้า,น.,จอมฟ้า จอมสวรรค์ กษัตริย์
เชิงลาย,น.,แบบแผน ท่าทาง ลีลา
เชิน,ก.,เชิญ - แสดงความประสงค์เพื่อขอให้ทำอย่างใดอย่างหนึ่ง
เชิบ,น.,แถว แนว พืด
เชิม,ก.,ยินดี พอใจ อิ่มใจ (มักใช้เปน เชิมไจ)
เชียง,น.,นักบวช ภิกษุ
เชียง,น.,เมือง ละแวก บริเวณ
เชียง,ว.,อย่างดี พิเศษ
เชียงคราน,ว.,งดงาม สวยมาก ดียิ่ง
เชียงชิด,ว.,งดงาม ดียิ่ง ประเสริฐ
เชียงชิน,ว.,งดงาม ดียิ่ง ประเสริฐ
เชียงราย,น.,ชื่อเมืองโบราณที่ตั้งขึ้นเมื่อ พ.ศ. ๑๘๐๕ อยู่ในตัวจังหวัดเชียงรายปัจจุบัน
เชียงราย,น.,ชื่อกล้วยชนิดหนึ่งคล้ายกล้วยน้ำไทย
เชียงแสน,น.,ชื่อเมืองเก่าในเขตอำเภอเชียงแสน จังหวัดเชียงราย
เชียงแสน,น.,ชื่อสกุลช่างศิลปะแบบหนึ่ง
เชียงแสน,น.,ชื่อทำนองหรือระบำในการช้อยและการซอ
เชียงไหม่,น.,ชื่อเมืองที่พระยามังรายตั้งขึ้นเมื่อ พ.ศ. ๑๘๓๙ อยู่ในตัวจังหวัดเชียงใหม่ปัจจุบัน
เชียงไหม่,น.,เรียกชื่อทำนองหรือ ระบำที่ใช้เริ่มต้นในการซอ เรียกว่า ระบำขึ้นเชียงใหม่
เชียน,ว.,ว่องไว รวดเร็ว
เชี่ยว,ว.,ด่วน พลัน เร็ว มักใช้กับกระแสน้ำ
เชื่อ,ก.,เห็นตามด้วย มั่นใจ ไว้ใจ เลื่อมใส
เชื้อ,น.,พันธุ์ เช่น เชื้อเข้า - พันธุ์ข้าว
เชื้อ,น.,เรื่องราว เหตุการณ์
เชื้อ,น.,ชนิด ประเภท
เชือก,น.,เชือก - สิ่งที่ทำด้วยด้ายหรือป่านหรือปอ เป็นต้น มักฟั่นหรือตีเกลียวสำหรับผูกหรือมัด
เชือกกล้วย,น.,เชือกที่ทำจากกาบกล้วยแห้ง
เชือกเขา,น.,เถาวัลย์
เชือกคร้าว,น.,เชือกเส้นใหญ่ขนาดเส้นผ่าศูนย์กลางประมาณ ๑ เซนติเมตร
เชือกพัด,น.,เชือกที่ี่ใช้ส่งสัญญาณแก่สัตว์ เช่น เชือกที่ล่ามจากวัวหรือควายมายังคนที่ถือคันไถหรือบังคับเกวียนอยู่ เป็นต้น
เชือกล่าม,น.,เชือกที่ใช้ล่ามวัวหรือควายขณะกินหญ้าในที่จำกัดหรือใช้สำหรับจูงสัตว์เลี้ยงอย่างวัวหรือควาย เป็นต้น
เชือกสายดัง,น.,เชือกสำหรับสนตะพายวัวหรือควาย
เชือกสายอ้อม,น.,เชือกที่ผูกรอบคอวัวหรือควายเพื่อผูกล่ามสัตว์โดยผูกร่วมกับ สายดัง
เชือกเหล็ก,น.,โซ่เหล็ก
เชือกแหล่ง,น.,เชือกขนาดไม่ยาว ใช้ผูกล่ามวัวควายให้อยู่กับที่อยู่อทนที่จะขังไว้ในคอกสัตว์
เชื้อไก่ชนมันทึงดีด,สำนวน.,เลือดเนื้อเชื้อไขย่อมเหมือนบรรพบุรุษ
เชื่อใจ,ก.,เชื่อถือ มั่นใจ ไว้ใจ
เชื้อชาติ,น.,เผ่าพันธุ์
เชื้อดี,ว.,พันธุ์ดี
เชื่อถ้อยเชื่อคำ,ก.,เชื่่อฟัง
เชื้อบ่ดี,ว.,พันธุ์ไม่ดี
เชื่อไส,ก.,เลื่อมใส ศรัทธา
เชื่อหน้า,ก.,เชื่อถือ
แช,ก.,ติดสัด
แช,น.,อาการอ่อนเพลียมากอาจมีเหงื่อไหลด้วยอันเนื่องจากเสียเลือดไปมาห โหยหิว
แชก,น.,ภาชนะสายทรงสูงใช้สะพายหลัง
แชง,ก.,ระมัดระวัง
แช่ง,ก.,แช่ง
แชบ,ว.,รสดี อร่อย ดีงาม
แชบชิด,ว.,รสดี อร่อย ดีงาม
แช่ว,ว.,ด่วน พลัน เร็ว มักใช้กับกระแสน้ำ
แช่ว,ว.,เชี่ยว อย่างน้ำเชี่ยว
แชวแวว,ว.,แจ๋วแหวว ใส ไม่ข้น ใช้สำหรับสิ่งที่อยู่ใกล้หรือเห็นได้ชัด เช่น น้ำแกงไสแชวแวว - น้ำแกงใสแจ๋ว
แชวะ,ก.,แฉะ พุพอง
แชวะ,ว.,เฉอะแฉะ เปรอะ เฟอะ
โชก,น.,โชค
โชก,น.,ตะคร้อ
โชกลน,ว.,ทะลึ่ง สัปดน แสดงกริยาวาจาไม่สมควร
โชกโวก,ว.,สีขาวโพลน ใช้กับสิ่งของขนาดใหญ่
โชค,น.,โชค
โชค,น.,ตะคร้อ
โชง,ว.,สันทัด ปานกลางค่อนข้างจะสูง ระหง ครงงาม สูงพองาม
โชง,ว.,ระหง ทรงงาม
โช่ง,ก.,โยน ทิ้งให้ไปไกลจากตัวโดยโยนไปในวิถีโค้ง
โชงโอง,ว.,ลักษณะสิ่งที่สูงระหง
โชงโอง,ว.,สูง สูงชะลูด
โช่โล่,ว.,ชะลูด เรียวสูงขึ้นไป พุ่งพรวดขึ้นไป ใช้กับของขนาดใหญ่
โช่โล่,ว.,โชน โพลง ใช้เพื่อขยายลักษณะของไฟ อย่างไฟลุกโชน เรียกว่า ไฟลุกโช่โล่
โชะโมะ,ว.,คำประกอบที่ใช้อธิบายสิ่งของี่มีลักษณะกลมป้อม อ้วน นูนเหมือนหลังเต่า เช่น คนอ้วนนั่งโชะโมะ
โชะโละ,ก.,รี่เข้าหา ถลันเข้าหา โผล่ออกโดยเร็ว
โชะโละ,ว.,อาการค้างคาอยู่ ใช้สำหรับของใหญ่
ไช,ก.,ไปเยี่ยม ไปหา ไปดูแล ไปมาหาสู่
ไช่,ก.,ใช่ ถูก ตรง บางแห่งแปลว่าไม่ใช่ ไม่ถูกเมื่อออกเสียงเน้น
ไช้,ก.,บังคับให้ทำ เอามาทำเกิดประโยชน์ เช่น ใช้เงิน ตอบแทน ทดแทน
ไช่ช้า,ว.,มากยิ่ิ่งกว่าปกติ วันดีไช่ช้า งามดีไช่ช้า
ไช้ชาต,ก.,เรียกการที่พระพุทธเจ้าบำเพ็ญบารมีในชาติต่างๆ ว่า พระเจ้าไช้ชาต
ไชยบาน,น.,เครื่องดื่มแห่งความมีชัย คือสุรา
