คำ,POS,ความหมาย
ถก,ก.,ถลก ถอน ดึง ดึงรั้งให้สูงขึ้นหรือให้หลุดจากที่
ถง,น.,ถุง ย่าม
ถง,ว.,หมกมุ่นอยู่กับเรื่องใดเรื่องหนึ่งในทางที่ไม่ดี เช่น ถงเหล้า - นักเลงสุรา
ถง,น.,นักเลง เช่น โถงเหล้า - นักเลงสุรา
ถงกระหนัน,น.,การถักทำขึ้นสำหรับบรรจุพระเครื่องหรือวัตถุมงคลประจำตัวเรียกว่า ถงสะชา
ถงกระหนัน,น.,ถุงหรือย่ามที่ใส่วัตถุมงคลหรือเครื่องราง
ถงขนัน,น.,การถักทำขึ้นสำหรับบรรจุพระเครื่องหรือวัตถุมงคลประจำตัวเรียกว่า ถงสะชา
ถงขนัน,น.,ถุงหรือย่ามที่ใส่วัตถุมงคลหรือเครื่องราง
ถงคะชา,น.,ถุงตะเครียว ถุงที่ถักด้วยด้ายหรือไหมเป็นตาโปร่งมีหูรูด
ถงคะชา,น.,ถุงตะเครียว
ถงเงินถงฅำ,น.,ถุงใส่เงินทอง นิยมใช้เป็นของขวัญในโอกาสต่าง ๆ ที่เป็นมงคล บางครั้งใช้เป็นเงินขวัญถุงให้คู่บ่าวสาวมักใช้ผ้าแดงเย็บ
ถงตีน,น.,ถุงเท้า
ถงเตี่ยว,น.,กระเป๋ากางเกง
ถงน่อง,น.,ถุงเท้า ถุงเท้ายาว
ถงบาตร,น.,ถลงบาตร - ถุงสำหรับใส่บาตรมีสายโยง
ถงเป้ง,น.,ถุงหรือย่ามบรรจุเงิน หรือเงินก้นถุง ย่ามบรรจุเงินตราหรือของมีค่า (เป้ง -นํ้าหนักที่ใช้ถ่วงตาชั่งแบบตราชู)
ถงเปอ,น.,ย่าม ย่ามสะพายขนาดใหญ่
ถงภ้าย,น.,นักเลงไพ่
ถงแม่ยิง,น.,นักเลงผู้หญิงเจ้าชู้
ถงลัวะ,น.,ย่ามแบบชาวลัวะ
ถงสะชา,น.,ถุงตะเครียว ถุงที่ถักด้วยด้ายหรือไหมเป็นตาโปร่งมีหูรูด
ถงสะชา,น.,ถุงตะเครียว
ถงห่อเข้า,น.,ถุงผ้าใส่ห่อข้าวสำหรับเดินางไกล ๆ ถุงย่ามเย็บด้วยผ้าขาวสำหรับใส่ห่อข้าวและอาหารให้คนตาย ชาวล้านนาจะให้คนคอนหรือสะพายนำหน้าศพไปป่าช้า
ถงหิง,น.,ร่างแหแบบที่ใช้คลุมผมสตรี (หิง - ตาข่ายชนิดละเอียด)
ถงเหล้า,น.,ขี้เมา นักเลงสุรา
ถด,ก.,กระถด ถอยเลื่อนไปเล็กน้อย
ถนอม,ว.,หม่นหมอง เศร้าโศก
ถนัด,ว.,แม่นยำ หนัก เต็มที่
ถนี่,ก.,ตระหนี่ หวง
ถบ,น.,ของเล่นเด็กประกอบด้วยกระบอกไม้ไผ่ขนาดเล็ก มีแกนไม้ซึ่งเมื่อกระทุ้งแกนนั้น ก็จะส่งกระสุนด้วยแรงอัดอากาศและมีเสียงระเบิดดัง
ถบ,น.,เรียกกระบอกขนาดเล็กที่เด็กใช้ยิงกระสุนโดยวิธีการอัดลมซึ่งกระทุ้งด้วยแส้ ว่า บอกถบ เพราะมีเสียงระเบิดดังเช่นั้น เรียกประทัดว่า บ่าถบ หรือ ถบลม
ถบลม,น.,ประทัด
ถปนา,ก.,สถาปนา ตั้ง วาง แต่งตั้ง ถัปปนา ถัปปันนา
ถปนา,ก.,ยกย่องโดยแต่งตั้งขึ้นให้สูง จัดตั้ง จัดสร้าง
ถม,ก.,ถม - เอา ดินหรือสิ่งอื่นใส่ลงไปที่เป็นหลุม กองสุมไว้อย่างไม่เป็นระเบียบ
ถ่ม,ก.,ถ่ม - ทำให้ น้ำลายหรือสิ่งอื่น ๆ ออกจากปากโดยแรง
ถมโข่,ก.,เอากิ่งไม้ไปจัดวางไว้เป็นที่ๆ ในน้ำเพื่อล่อให้ปลาเข้าไปอยู่อาศัยโดยประสงค์จะจับปลา
ถมนาคุณ,ก.,สมนาคุณ ตอบแทนบุญคุณ
ถมหนาม,ก.,สะหนาม -ใช้หนามอย่างหนามไผ่ไปวางไว้เป็นที่ ๆ
ถมอ,น.,หิน (ปรากฏในโคลงนิราศหริภุญชัย)
ถ่วง,ก.,ถ่วงทำให้หนัก ทำให้ช้า
ถ้วน,น.,มาตราวัดความลึกแบบโบราณ เท่ากับความสูงท่วมหัว สุดมือเหยียด คือประมาณ ๒ เมตร
ถ้วน,ก.,ท่วมอย่างน้ำท่วม
ถ้วย,น.,จาน ชาม ภาชนะมีรูปร่างและขนาดต่างๆ เรียก ขนมถ้วยว่า เข้าหนมถ้วย
ถ้วยขาว,น.,ชามสีขาว กาละมังเคลือบ
ถวยใจ,ก.,หายใจ
ถ่วยไจ,ก.,หายใจ
ถ่วยไจออก,ก.,หายใจออก
ถ้วยตะไหล,น.,จาน จานแบน
ถ้วยไตร,น.,จาน จานแบน
ถ้วยถะไหล,น.,จาน จานแบน
ถ้วยบ้าง,น.,ถ้วยที่ปากแตกไปบางส่วน
ถ้วยบิ้ง,น.,ถ้วยที่ปากชำรุดเล็กน้อย
ถ้วยเบิ้ง,น.,ชามกระเบื้อง (ถ้า เบิ้งถ้วย แปลว่าเศษของชาม)
ถ้วยเบี้ยว,น.,ชามเปล มักจะหมายถึง จานสังกะสี
ถ้วยแบน,น.,จานแบน
ถ้วยแผ,น.,จานแบน
ถ้วยสาย,น.,ปิ่นโต ใช้ในบางท้องที่ ทั่วไปใช้ พินโท อ่านว่าปินโต
ถ้วยโห้ง,น.,ชามก้นลึก (โห้ง - เป็นแอ่ง)
ถ้วยอี่ปิก,น.,ถ้วยขนาดเล็กอย่างที่ใช้ใส่นํ้าจิ้ม
ถ้วยแอ่ง,น.,ชามอ่างขนาดไม่ใหญ่
ถวาย,ก.,ให้ มอบให้ ใช้แก่สงฆ์ หรือเจ้านาย
ถ่อ,น.,ถ่อ
ถ่อ,ก.,ถ่อ - ทำให้เรือแพเลื่อนไปด้วยการใช้ไม้ยัน
ถอก,ก.,เท ทำให้ตกหรือไหลอย่างเทน้ำ
ถอง,ก.,สึก กร่อน หมดสิ้นไปทีละน้อย
ถอง,ว.,ถึง จนถึง จนกระทั่ง
ถ่อง,ว.,ชัดเจน แน่แจ้ง สิ้นสงสัย
ถ้อง,น.,การขับซอโต้ตอบกันเรียกว่า ซอถ้อง
ถ้อง,ก.,โต้ตอบ ประชัน
ถองกลวง,สัน.,จนกระทั่งถึงภายใน
ถองแก่น,ว.,ถึงที่สุด ลึกซึ้ง ถี่ถ้วน
ถองแกะถองแกน,ว.,เปิดอก เปิดเผยจนไม่มีอะไรเหลือ แจ่มแจ้ง
ถ่องไจ,ว.,รู้ชัดแจ้ง เข้าใจแจ่มแจ้ง
ถ้องเถียง,ก.,ทุ่มเถียง โต้เถียง
ถองพื้น,ว.,จนกระทั่งถึงพื้น
ถอด,ก.,ถอด
ถ็อด ๆ แถ็ด ๆ,ก.,ขยับไปขยับมา ขยุกขยิก
ถ็อดแถ็ด,ก.,กระถด กระเถิบ เขยิบถัด
ถ็อดแถ็ด,ก.,กระถด กระเถิบ ถัด
ถ็อดแถ็ด,ก.,กระถด กระเถิบ ถัด ขยับ
ถอดหุ่น,ก.,ถ่ายรูป ถ่ายภาพคน
ถอน,ก.,ทำให้ลดลงหรือทำให้หมดไป เช่น ถอนไข้ ถอนพิษ
ถอบ,น.,เห็ดเผาะ
ถอบ,ว.,สำเนียงชัดเจน ออกเสียงได้ถูกตามความนิยม พูดได้คล่อง พูดได้ชัด ใช้ ปากถอบ
ถ็อบ,น.,เรียกเครื่องเล่นของเด็กที่เป็นกระบอกไม้มีแส้กระทุ้ง วัตถุอย่างก้อนกระดาษเปียกให้เกิดแรงอัดแล้วระเบิดออกมีเสียงดังเช่นนั้นว่า บอกถ็อบ
ถ่อม,ก.,อ่อนน้อม คล้อยตาม ติดตาม
ถ่อมถ้า,ก.,รอคอย
ถ่อมทวย,ก.,ตามไปทีหลังโดยไม่ให้รู้ตัว สะกดรอยตาม
ถ่อมทวยหลัง,ก.,ติดตามไปอย่างใกล้ชิด
ถอย,ก.,ถอย ย้อนกลับ
ถ่อย,ว.,ลามก ต่ำช้า
ถ่อย,ว.,ลามก ตํ่าช้า เลวทราม
ถ้อย,น.,คำพูดที่มีความหมาย
ถ้อย,น.,แถว แถบ
ถะ,ก.,ถาก
ถะล้อ,น.,เครื่องดนตรีชนิดหนึ่งคล้ายซออู้
ถะลาม,ว.,ทราม
ถะลาม,ว.,รุ่น
ถะลาม,ว.,กำลังพอดี
ถะเล,น.,ทะเล - ห้วงน้ำใหญ่
ถะเลิ้น,น.,ขั้น ชั้น ระดับ ทางลาดชัน
ถะหลอง,ก.,กรอง เกรอะ แยกนํ้าออกจากกาก คัดของบริสุทธิ์ออกจากที่ไม่บริสุทธิ์
ถะหลัดถะหลอง,ว.,ชัดเจน แจ่มแจ้ง แตกฉาน
ถะหลา,ว.,ตรา ตรึง มักใช้คู่กับ ตริง หรือ ถะหลิง เป็น ถะหลิงถะหลา หรือ ตริงตรา น่าจะเขียน ตรา
ถะหลาบ,ว.,ตราบ กระทั่ง จนถึง น่าจะเขียน ตราบ
ถะหลิ,ก.,แสร้ง เสแสร้ง แกล้งทำ น่าจะเขียน ตริ
ถะหลิง,ว.,ตรึง มักใช้คู่กับถะหลาเป็น ถะหลิงถะหลา คือตรึงตรา น่าจะเขียน ตริง
ถะหลุดถะลู่,ว.,ชักลากอย่างลำบาก
ถะหลุถะลาย,ว.,ทะลุ ทำลาย พังทลาย
ถะแหล,น.,แตร อย่างแตรงอน เรียก ถะแหลเหิน หรือ แตรเหิน
ถะแหล,ก.,แฉลบ เฉียง เลี่ยง หลีก ไม่ตรง ครูด
ถะแหลง,ก.,แปลงกายด้วยอำนาจฤทธิ์ แถลง ชี้แจง บอกกล่าว
ถะแหล็ด,ก.,กระถด กระเถิบ ถัด
ถะแหล็ด,ก.,กระถด กระเถิบ ถัด ขยับ
ถะแหล็ดถะแหล,ก.,กระถด กระเถิบ ถัด
ถะแหล็ดถะแหล,ก.,กระถด กระเถิบ ถัดไปกับพื้น
ถัก,ก.,ถัก
ถัก,ก.,ติดขัด
ถัง,น.,ภาชนะจำพวกหนึ่งทำด้วยไม้หรือโลหะ มีรูปร่างต่าง ๆ กัน โดยมากใช้บรรจุน้ำ
ถั่ง,ก.,พุ่ง พุ่งขึ้นอย่างบั้งไฟ พลั่ง ระบายไปอย่างรวดเร็ว เติบโตขึ้นอย่างรวดเร็ว
ถั่งเข้า,ก.,ไหลหลั่งเข้าไป
ถัด,ก.,ขยับไปทีละน้อย กระถด
ถัด,ว.,รองลงไป ต่อไป
ถัดถอง,ว.,ชัดเจน แจ่มแจ้ง แตกฉาน
ถัน,น.,เต้านม
ถับ,ว.,เรียงถันมาเป็นระเบียบ เช่น เป็นถับ หรือ เป็นถับเป็นถ้อย
ถัปปนา,ก.,ยกย่องโดยแต่งตั้งขึ้นให้สูง จัดตั้ง จัดสร้าง
ถัปปันนา,ก.,ยกย่องโดยแต่งตั้งขึ้นให้สูง จัดตั้ง จัดสร้าง
ถัว,ก.,ถัว - เฉลี่ยทำให้มีส่วนเสมอกัน
ถั่ว,น.,ถั่ว
ถั่วงอก,น.,ถั่วงอก
ถั่วชิ้น,น.,ถั่วพุงหมู
ถั่วซั้ง,น.,ถั่วฝักยาว
ถั่วดอ,น.,ถั่วพุงหมู
ถั่วถิม,น.,ถั่วเขียว ในบางท้องพี่ ถิม แปลว่า ถั่ว
ถั่วน้อย,น.,ถั่วลันเตา
ถั่วเน่า,น.,ถั่วเหลือง ถั่วเหลืองต้มเปื่อยหมักให้ขึ้นราเล็กน้อยแล้วตำให้ละเอียด จากนั้นจึงทำเป็นแผ่นบางกลม กว้างประมาณ ๓ นิ้ว ตากแดดให้แห้งเก็บไว้ปรุงอาหาร เรียกว่า ถั่วเน่าแข็บ ถ้านำมาห่อด้วยใบตองแล้วนึ่งหรือย่างไว้ปรุงอาหาร เรียกว่า ถั่วเน่าห่อ ปรกติ ถั่วเน่าข็บ จะเก็บได้นานกว่า ถั่วเน่าห่อ เรียก เห็ดน้ำหมึก
ถั่วเน่าแข็บ,น.,ถั่วเหลือง ถั่วเหลืองต้มเปื่อยหมักให้ขึ้นราเล็กน้อยแล้วตำให้ละเอียด จากนั้นจึงทำเป็นแผ่นบางกลม กว้างประมาณ ๓ นิ้ว ตากแดดให้แห้งเก็บไว้ปรุงอาหาร เรียกว่า ถั่วเน่าแข็บ ถ้านำมาห่อด้วยใบตองแล้วนึ่งหรือย่างไว้ปรุงอาหาร เรียกว่า ถั่วเน่าห่อ ปรกติ ถั่วเน่าข็บ จะเก็บได้นานกว่า ถั่วเน่าห่อ เรียก เห็ดน้ำหมึก
ถั่วเน่าเมอะ,น.,ถัวเน่า ชนิดที่เตรียมอย่าง ถั่วเน่าแข็บหรือถั่วเน่าห่อ แต่ในขณะที่ตำให้ละเอียดนั้นอาจปรุงรสให้จัดขึ้นแล้วนำมาห่อปิ้งไฟหรือนึ่งกินเป็นอาหาร อาจเติมไข่ลงไปด้วยก็ได้ ปรกติในขบวนการเตรียมถั่วเน่าไว้ปรุงอาหารนั้นชาวบ้านมักจะทำ ถั่วเน่าเมอะ กินเสมอ (เมอะ - เข้ม)
ถั่วบ่าแป,น.,ถั่วขาว เรียก ถั่วแดง ว่า ถั่วแป หรือ บ่าถั่วแป ก็ว่า
ถั่วปี,น.,ถั่วพุงหมู
ถั่วแปบ,น.,ถั่วแปบ
ถั่วแปบพร้าโต้,น.,ถั่วฝักพร้า ถั่วพร้า
ถั่วพู,น.,ถั่วพู
ถั่วแพยี,น.,ถั่วราชมาสชนิดที่แกะเปลือกออกและทอดแล้ว
ถั่วแพหล่อ,น.,ถั่วราชมาสที่คั่วกับทรายหยาบให้สุกแล้วแต่ไม่ได้แกะเปลือก
ถั่วมุม,น.,ถั่วเขียว ในบางท้องพี่ ถิม แปลว่า ถั่ว
ถั่วมุม,น.,ถั่วเขียว
ถั่วเรียน,น.,ทุเรียน
ถั่วไร่,น.,ถั่วฝักยาวชนิดหนึ่ง
ถั่วสายเสื้อ,น.,ถั่วพุงหมู
ถั่วไส้หมู,น.,ถั่วพุงหมู
ถั่วหมาเน่า,น.,ถั่วพุงหมู
ถา,น.,ดวงตรา - เครื่องหมายสำคัญที่มีลวดลายและทำเป็นรูปต่างๆ หรือเพื่อประทับ
ถา,น.,"ดวงตรา, ค่าธรรมเนียม"
ถา,ก.,ประทับตราเรียกว่า จํ้าถา หรือ จํ้ากา
ถ่า,น.,ครั้ง คราว เมื่อกำหนด
ถ้า,ก.,รอ รอคอย
ถ้า,สัน.,หากว่า แม้นว่า แสดงความหมายเชิงคาดคะเนหรือข้อแม้
ถาก,ก.,ถาก ทำให้เป็นรอยลึกลงไปเป็นทางยาว
ถ้าคอย,ก.,รอดู
ถาง,ก.,ถาง ทำให้เตียนโล่ง เช่น ถางหญ้า
ถ่าง,ก.,ทำให้ห่างออก แยกให้ห่างออกจากกัน
ถาด,น.,ถาด ภาชนะใส่ของลักษณะแบนตื้น
ถาน,น.,ส้วมของพระ
ถ่าน,น.,ถ่าน
ถ้าน,ว.,ขนาดเท่า ปาน เพียง
ถ้าน,*น.,ชั้น
ถ้าน,*น.,สถาน
ถ้าน,*น.,ขนาด
ถ้าน,*น.,ทำนอง
ถ้าน,*น.,ชนิด
ถ่านโคม,น.,ถ่านไฟฉาย
ถ้านตาย,*ว.,วง ปางตาย แทบตาย
ถ้านพอ,สัน.,จนกระทั่ง ถึงขนาด เช่น ถ้านพอจะดีเมือบ้าน ได้เวลาควรกลับบ้านแล้ว
ถ่านไฟ,น.,ถ่าน ถ่านที่มีไฟติด ถ่านไฟฉาย
ถ่านหมื้อ,น.,เชื้อไฟ รับประกายไฟจากการตีเหล็กกับหิน บางท้องที่เรียก ถ่านหมี้
ถานะ,น.,สถาน สถานที่
ถาบ,ก.,ตบ ตี
ถาบ,บ.,ริม จนถึง เมื่อ
ถาปนา,ก.,ยกย่องโดยแต่งตั้งขึ้นให้สูง จัดตั้ง จัดสร้าง
ถาปันนา,ก.,ยกย่องโดยแต่งตั้งขึ้นให้สูง จัดตั้ง จัดสร้าง
ถ้าผ่อ,ก.,คอยดู
ถาม,ก.,ถาม เจรจา ทาบทาม
ถ่าย,ก.,ผลัดเปลี่ยน เช่น ถ่ายเตี่ยว - ผลัดกางเกง เอาออกจากที่หนึ่งไปใส่อีกที่หนึ่ง ไถ่ - ถอนคืนสิ่งที่จำนำจำนองไว้ เสียเงินหรือสิ่งอื่นเพื่อให้พ้นโทษหรืออำนาจของผู้อื่น
ถ่ายน้อง,ก.,เปลี่ยนรุ่นใหม่ เปลี่ยนชุดใหม่ ใช้กับฟัน
ถ่ายผ้า,ก.,ผลัดเปลี่ยนผ้า
ถ่ายอยา,ก.,กิยาถ่ายตัวพยาธิ
ถ่าว,ว.,กำลังรุ่น วัยรุ่นหนุ่มสาว
ถาวรวัตถุ,น.,สิ่งก่อสร้างเพื่อให้มั่นคงยั่งยืน เช่น วิหาร
ถาวระ,ว.,มั่นคง
ถาวอร,ว.,มั่นคง
ถ้าหัน,ก.,รอท่าเพื่อจะดู
ถ้ำ,น.,ถ้ำ
ถิ,ก.,แกล้งทำ เสแสร้ง
ถิ่น,น.,ที่ แดน ที่อยู่
ถิ่น,น.,ชื่อคนเผ่าหนึ่ง
ถิม,น.,ถั่วเขียว ถั่วมักเรียกเป็น บ่าถั่วบ่าถิม
ถิ้ม,ก.,ทิ่ม - กระแทก ชน บางแห่งแปลว่า ทอดทิ้ง
ถิ้มตำ,ก.,ทิ่ม - กระแทก ชน
ถี่,ก.,ตระหนี่ หวง
ถี่,ก.,ตระหนี่ มัธยัสถ์ ประหยัด
ถี่,ว.,รอบคอบ รัดกุม ไม่เผลอ ถี่ถ้วน
ถี่,ว.,บ่อย ไม่ห่าง มีระยะหรือช่องว่างชิดกัน
ถีบ,น.,เรียกยาขับพิษไข้ว่า ยาถีบ
ถีบ,น.,เรียกจักรยานว่า รถถีบ
ถีบ,ก.,ถีบ ขับ ไหล พุ่งไป รีบเร่ง
ถีบรถ,ก.,ปั่นรถจักรยาน
ถี่ย่อย,ว.,ถี่ถ้วน ละเอียดรอบคอบ จู้จี้จุกจิก
ถึก,ว.,เปลี่ยวหนุ่ม มักใช้กับสัตว์ เช่น งัวถึก
ถึม,น.,แผ่นสี่เหลี่ยมขนาดประมาณ ๑ - ๒ เมตร ทำจากกาบไม้ไผ่ กาบหมาก หรือกระดาษใช้กั้นห้อง หรือใช้กำบัง
ถึ้ม,น.,โพรงชะวาก ช่องที่เป็นโพรงลึกเข้าไป
ถืด,ก.,พุ่ง พุ่งขึ้นอย่างบั้งไฟ พลั่ง ระบายไปอย่างรวดเร็ว เติบโตขึ้นอย่างรวดเร็ว
ถืด,ก.,เติบโตขึ้นอย่างรวดเร็ว
ถือ,ก.,ยึดเอา นับเอา เชื่อมั่น นับถือ
ถือ,ก.,จับยึดไว้ กุมไว้
ถือทือ,ก.,ถือสา ถือเอาเป็นโทษ
ถือแหวน,ก.,มีแหวนประดับที่นิ้ว
ถุ,น.,กรุ ยุ้ง ห้องเก็บของ
