ถุ,ก.,กรุ ปิดกันช่องโหว่หรือที่ว่าง รองไว้ข้างล่าง
ถุ,ก.,อาการที่นํ้าไหลหรือผลักดันสิ่งของให้เคลื่อนไปหรือไหลไปอย่างรวดเร็ว
ถุก ๆ ถิก ๆ,ก.,อิด ๆ ออด ๆ
ถุกถู,ก.,ถูไถ ลากดึงหรือฉุดอย่างไม่ปรานี
ถุกถู้ถุกถู,ว.,ลักษณะที่เคลื่อนไหวกลับไปกลับมา
ถุดถู้ถุดถุน,ว.,ลักษณะที่เคลื่อนไหวกลับไปกลับมา
ถุน,ก.,ดูด เช่น ถุนยา (ฝิ่น)
ถุ่ย,ก.,เกลี่ย กระจายให้เสมอกัน
ถู,ก.,สี เช็ด ขัด ลากฉุด
ถู,ว.,งาม งดงาม
ถูก,ก.,เข้ากันได้ดี เหมาะสมกัน ชอบอัธยาศัยกัน
ถูก,ก.,กระทบ โดน แตะต้อง สัมผัส
ถูก,ก.,จริง ชอบ เหมาะ ไม่ผิด งาม น่าดู
ถูก,ว.,ราคาไม่แพง
ถูกโล่งกัน,ก.,ชอบอัธยาศัยกัน เข้ากันได้ดี
ถูเถือ,ก.,ต่อสู้ติดพันกัน
ถูปะ,น.,สถูป เจดีย์บรรจุของที่ควรแก่การบูชา
ถูลู่,น.,เครื่องมือจับปลาชนิดหนึ่ง
ถูลู่,ก.,อาการเลื่อนไถลลงจากที่สูงอย่างรวดเร็ว
ถูลู่ถูกัง,ก.,กระชากลากถูโดยไม่ปรานีปราศรัย
เถ่,ก.,ทิ้ง รุ เอาออก ทิ้งไป ขับไสไล่ส่ง
เถ็ก,น.,คำอุทานที่ทำให้ผู้อื่นตกใจ
เถ็ก,น.,คำลงทับลงท้าย คาถาอาคม
เถ็ก,ก.,ขู่ให้ยยอมสารภาพ
เถรวาท,น.,ยาน อย่างแคบ - หมายถึงพุทธศาสนานิกายหนึ่ง ซึ่งนับถือกันในเขตลังกา พม่า และไทย
เถระ,น.,พระผู้ใหญ่ ตามพระวินัยกำหนดว่าพระที่บวชแล้วตั้งแต่ ๑๐ พรรษาขึ้นไป เรียกว่า เถระ
เถอละเอิก,ก.,ไถลลง
เถอะ,ว.,เถิก ถลอก เปิก
เถา,น.,เครือไม้ สำต้นของไม้เลื้อย
เถ้านั่งรุ่ง,น.,มหาเวสสันดรชาดกฉบับหนึ่ง เรียกว่า ฉบับเถ้านั่งรุ่ง
เถาะ,น.,ปีเถาะ - ชื่อปีที่ ๔ ของรอบปีนักษัตร มีกระต่ายเป็นเครื่องหมายปรากฏการใช้ในคัมภีร์ใบลานเพียงบางครั้ง ปรกติจะใช้ เหม้า
เถาะ,ก.,ขอด อย่างขอดเกล็ดปลา
เถาะ,ก.,รองท้อง
เถาะ,ก.,ถวายทานเป็นการลำลองเพื่อหาทุนเพิ่มในการก่อสร้างสิ่งใดสิ่งหนึ่ง
เถิก,ว.,เปลี่ยวหนุ่ม มักใช้กับสัตว์ เช่น งัวถึก
เถิก,ก.,ถลอก
เถิก,ว.,เบิก มักใช้กับหัวล้านว่า หัวเถิก
เถิง,ก.,บรรลุจุดหมาย ถึง
เถิง,ว.,มากพอ
เถิง,บุพ.,สู่ กระทั่ง
เถิงขนาด,ว.,ได้ขนาดเต็มที่ มากพอ
เถิงคราว,ก.,ถึงกำหนด ถึงคราวตาย
เถิงจิตเถิงใจ,ว.,ถึงใจ จุใจ สาแก่ใจ
เถิงที่,ว.,(ไปหา) ถึงที่
เถิงที่,ก.,ถึงคราวตาย บรรลุจุดหมาย
เถิงว่า,สัน.,หากว่า แม้นว่า
เถิงว่า,อุทาน.,มิน่าละ
เถิน,ว.,ไกล นาน มักใช้ประกอบคำอื่นเป็น เมื่อเนิ้นเมื่อเถิน - เมื่อครั้งกระโน้น
เถิ้นเหวิ้น,ว.,ลักษณะของสิ่งที่เป็นแผ่นกลมขนาดใหญ่
เถิบ,น.,เรียกเนื้อเค็มชนิดแผ่นว่า ชิ้นเถิบ
เถิบ,ลัก.,เรียกของที่เป็นชิ้นแบนที่มีขนาดใหญ่
เถิบ,ว.,เทื้อ แก่ เช่น ฅนเถ้าฅนเถิบ - คนแก่
เถิบเถิ้ง,ว.,มีลักษณะแบนและเหี่ยวหย่อนยาน ใช้กับสิ่งที่มีขนาดใหญ่
เถิ้ม,น.,ชะโงกผา
เถิ้มดอย,น.,ชะวากเขา ส่วนที่เว้าเข้าไปตามไหล่เขา
เถียง,น.,เพิง กระท่อม
เถียง,ก.,โต้แย้ง
เถี่ยง,ก.,แข่งขัน เอาชนะกัน
เถียงกาด,น.,เพิงขายของ
เถี่ยงท้า,ก.,แข่งขัน ประชัน พนัน
เถียงนา,น.,เพิงพักในทุ่งนา
เถียงแรง,น.,เพิงสำหรับพักผ่อนเอาแรง
เถียงเส่า,น.,เพิงที่มีสูบเป่าลมของช่างเหล็ก โรงตีเหล็ก
เถี่ยน,ล.,คำเรียกของใช้มีคม เช่น มีด หรือขวาน เป็นต้น
เถียว,ว.,เรียว เพรียว สลวย ต้นโตปลายเล็ก
เถือ,ก.,เถือ เชือดเฉือนลงไปอย่างแรงด้วยของมีคม
เถื่อน,น.,ป่า
เถื่อน,ว.,ห่างไกลความเจริญ
เถื่อน,ว.,ไม่ถูกต้องตามกฎหมาย อย่างเดหล้าเถื่อน
แถ,น.,แตร
แถ,ก.,ปาด เฉือน โกน ทำให้เตียน แฉลบ อาการที่นกบินฉวัดเฉวียนหรือเอียงปีกร่อนลง
แถก,ก.,เถือ เชือด ปาด
แถ้ง,ก.,ชดเชย เพิ่มเติม
แถ็ด,ก.,กระถด กระเถิบ ถัด
แถ็ด,ก.,กระถด กระเถิบ ถัด ขยับ
แถน,น.,เทวดา จอมเทพ บรรพบุรุษผู้ให้กำเนิดมนุษย์
แถนแบ่น,ว.,ลักษณะนอนหงาย มัก ตามหลังคำว่า แบ เช่น นอนแบแถ่นแบ่น -นอนหงายเหยียดยาว
แถบ,น.,เงินรูปีของประเทศอินเดีย เคยนิยมใช้ในภาคเหนือ
แถบ,ล.,ใช้เรียกเงินรูปีว่า แถบ
แถ็บ,ก.,ล็อค เช่นแถ็บกะแจ๋ - ล็อคกุญแจ แถ็บประดู
แถบแถ้ง,ว.,มีลักษณะแบน เหี่ยว ยานและบาง
แถม,ว.,เพิ่มขึ้น มากขึ้น
แถมถม,ว.,เพิ่มมากขึ้น
แถ้มแหล้ม,ว.,แบนและบางมาก มักใช้ตามหลังคำว่า แพบ เป็น แพบแถมแหล้ม
แถ่ว,ว.,วัยรุ่น
แถะ,ก.,ถาก ถ่ง ดาย ชำแหละ
แถะ,ว.,เกรียน เช่น คนหัวแถะ คือคนผมเกรียน
โถง,ว.,หมกมุ่นอยู่กับเรื่องใดเรื่องหนึ่งในทางที่ไม่ดี เช่น ถงเหล้า - นักเลงสุรา
โถง,น.,ถุง ย่าม
โถง,น.,นักเลง เช่น โถงเหล้า - นักเลงสุรา
ไถ,น.,เครื่องมือที่ใช้ในการทำนา
ไถ,ก.,ไถ
ไถ่,ก.,ไถ่ถอน
ไถ้,น.,ถุงยาวขนาดเล็กสำหรับบรรจุสิ่งของ เช่น ข้าวสาร ใช้คาดเอวหรือพาดบ่าเวลาเดินทาง
ไถ่ถ้อง,ก.,โอภาปราศรัย พูดคุย
