ท้องพลุ 0,น.,"ชื่อปลานํ้าจืดชนิด Machrochirichthys machrochirus Valenciennes ในวงศ์ Cyprinidae รูปร่างคล้ายปลาดาบลาว เว้นแต่มีเส้นข้างตัว อกเชิดขึ้นและต่อเนื่องกับคางซึ่งเงยขึ้นไปอีก ฟันเล็ก ด้านหลังลำตัวสีเขียวอมเหลือง ด้านข้างและท้องสีขาวเงิน พบตามแม่นํ้าและแหล่งนํ้าขนาดใหญ่ทั่วไป ขนาดยาวได้ถึง ๗๐ เซนติเมตร, ดาบ หรือ ฝักพร้า ก็เรียก, ชื่อนี้ยังใช้เรียกปลาแปบบางชนิด. (ดู แปบ ๒)."
ท้องพอง 0,ว.,"ท้องอืด, ใช้เข้าคู่กับคำ ท้องขึ้น เป็น ท้องขึ้นท้องพอง."
ทองพัดดึงส์ 0,น.,ค่ากำหนดแลกเปลี่ยนของเหรียญทองกระษาปณ์ในสมัยรัชกาลที่ ๔ เท่ากับ ๑ ใน ๓๒ ของชั่ง = ๒.๕๐ บาท.
ทองพันชั่ง 0,น.,ชื่อไม้พุ่มชนิด Rhinacanthus nasutus (L.) Kurz ในวงศ์ Acanthaceae ดอกสีขาว ใบและรากใช้ทำยาได้.
ทองพันดุล 0,น.,ชื่อไม้พุ่มชนิด Decaschistia parviflora Kurz ในวงศ์ Malvaceae ดอกสีชมพูอมส้ม.
ทองพิศ 0,น.,ค่ากำหนดแลกเปลี่ยนของเหรียญทองกระษาปณ์ในสมัยรัชกาลที่ ๔ เท่ากับ ๑ ใน ๒๐ ของชั่ง = ๔ บาท.
ท้องเฟ้อ 0,ว.,อาการที่มีแก๊สในกระเพาะอาหารและลำไส้เพราะอาหารไม่ย่อย เมื่อเรอจะมีแก๊สและกลิ่นเหม็น.
ทองภู 0,น.,ต้นไม้ชนิดหนึ่ง ใช้ทำยา.
ทองม้วน 0,น.,"ชื่อขนมชนิดหนึ่ง ทำด้วยแป้งประสมกับกะทิและไข่ เทราดลงในพิมพ์ซึ่งมักมีลักษณะกลมให้เป็นแผ่นบาง ๆ ผิงไฟให้สุกแล้วม้วนเป็นหลอด, ถ้าพับเป็นชิ้น เรียก ทองพับ, มีทั้งอย่างรสเค็มและรสหวาน."
ท้องมาน 0,น.,ชื่อโรคจำพวกหนึ่งที่มีสารน้ำอยู่ในท้องมาก ทำให้ท้องโตอย่างหญิงมีครรภ์ มักมีสาเหตุมาจากโรคตับ.
ท้องมือ 0,น.,ส่วนข้างของฝ่ามือด้านนิ้วก้อย ตั้งแต่โคนนิ้วก้อยถึงข้อมือ.
ท้องไม้ 0,น.,ส่วนกลางของฐานที่เป็นหน้าราบระหว่างบัวคว่ำกับบัวหงาย.
ทองไม่รู้ร้อน 0,ว.,"เฉยเมย, ไม่สะดุ้งสะเทือน."
ทองย้อย 0,น.,ชื่อทุเรียนพันธุ์หนึ่ง.
ท้องยุ้งพุงกระสอบ 0,น.,คนกินจุผิดปรกติ.
ท้องยุ้งพุงกระสอบ 1,ว.,ที่กินจุผิดปรกติ.
ท้องร่วง 0,ว.,อาการที่ท้องเดินอย่างแรง.
ท้องร่อง 0,น.,ทางน้ำที่เป็นทางยาวระหว่างสันดินของร่องสวนร่องผัก เพื่อขังน้ำไว้รดต้นพืช.
ทองระอา 0,น.,"ไม้เหลาอย่างรูปของลับชายขนาดต่าง ๆ ใช้เป็นของแก้บนตามศาลเจ้าแม่, ขุนเพ็ด ปลัดขิก หรือ ดอกไม้เจ้า ก็เรียก."
ทองรูปพรรณ 0,น.,ทองคำที่ทำสำเร็จเป็นเครื่องประดับและของใช้ต่าง ๆ.
ท้องเรื่อง 0,น.,เนื้อเรื่องที่ดำเนินไปตั้งแต่ต้นจนจบ.
ท้องลาน 0,น.,หน้าใบลาน.
ท้องลาน 1,ว.,มีรูปแบน ๆ เหมือนหน้าใบลาน อย่างรูปคันกระสุนด้านในที่เหลาแบน ๆ.
ทองลิน 0,น.,"ชื่อปลาน้ำจืดบางชนิดในสกุล Osteochilus และ Dangila วงศ์ Cyprinidae ที่มีจุดสีเข้มบนเกล็ด ทำให้เห็นเป็นแถวของจุดเรียงตามยาวอยู่ข้างตัวหลายแถว เหนือครีบอกหรือที่คอดหางมีแต้มหรือจุดสีดำใหญ่ โดยเฉพาะที่พบทั่วไปคือ ชนิด O. hasselti (Valenciennes) ที่ส่วนหลังมีสีเขียวหรือฟ้าเทา ด้านข้างสีนวลและท้องเป็นสีขาวเงิน และมีกลุ่มจุดสีแดงกระจายอยู่เหนือครีบอก ครีบต่าง ๆ ยกเว้นครีบอกมีสีแดงหรืออมแดง ในบางท้องที่ปลาชนิดนี้จะมีสีดังกล่าวจางมาก ขนาดยาวได้ถึง ๓๐ เซนติเมตร, ขี้ขม นกเขา ทองลิน หรือ ตูโบ ก็เรียก."
ท้องเล็น 0,ว.,เรียกข้าวสารที่หุงยังไม่สุกดี ยังมีแกนเมล็ดข้าวเหลืออยู่บ้าง ว่า ข้าวท้องเล็น.
ท้องเลว 0,ว.,"โซ, อดอยาก, เช่น ชะรอยผีท้องเลวในเหวถํ้า (ไกรทอง)."
ทองแล่ง 0,น.,ทองคำที่เอามาแผ่เป็นแผ่นบาง ๆ แล้วแล่งหรือตัดออกเป็นเส้นบาง ๆ ใช้สำหรับปักหรือทอผ้ายกทอง.
ทองวิทยาศาสตร์ 0,น.,"โลหะชุบทอง, ทองชุบ ก็เรียก."
ทองสักโก 0,น.,"ทองเหลืองที่ตีแผ่เป็นแผ่นบาง ลงรักแล้วปิดทองคำเปลว นิยมใช้หุ้มองค์พระเจดีย์ ป้องกันการผุกร่อน, ทองสักโก ก็ว่า."
ทองสัมฤทธิ์ 0,น.,"โลหะเจือชนิดหนึ่ง ส่วนใหญ่ประกอบด้วยทองแดงกับดีบุก, สัมฤทธิ์ หรือ ทองบรอนซ์ ก็เรียก."
ท้องสาว 0,น.,ท้องลูกคนแรก.
ท้องสำนวน 0,น.,เนื้อหาของเรื่อง.
ท่องสื่อ 0,น.,ตำแหน่งล่ามจีนครั้งโบราณ เช่น ขุนพจนาพิจิตร ท่องสื่อใหญ่ (พงศ. ร. ๓).
ท้องเสีย 0,ว.,อาการที่ถ่ายอุจจาระบ่อยกว่าปรกติหรือถ่ายกะปริบกะปรอย.
ทองหมั้น 0,น.,ทองคำที่ฝ่ายชายมอบให้ไว้แก่ฝ่ายหญิง แสดงความมั่นหมายว่าจะแต่งงานด้วย.
ท้องหมา 0,น.,"หน้าท้องแฟบ, เรียกครรภ์ของหญิงที่มีลักษณะเล็ก."
ท้องหมู 0,น.,"หน้าท้องมีไขมันมากอย่างท้องคนอ้วน, เรียกครรภ์ของหญิงที่มีลักษณะใหญ่ผิดปรกติ."
ทองหยอง 0,น.,ทองรูปพรรณ.
ทองหยอด 0,น.,"ชื่อขนมชนิดหนึ่ง ทำด้วยไข่แดงประสมแป้งเล็กน้อย หยอดเป็นลูกกลม ๆ อย่างหยดนํ้าในนํ้าเชื่อมเดือด ๆ, ลักษณนามว่า ลูก."
ทองหยิบ 0,น.,"ชื่อขนมชนิดหนึ่ง ทำด้วยไข่แดงตีให้ขึ้นเล็กน้อย หยอดเป็นแผ่นเล็ก ๆ ในนํ้าเชื่อมร้อน ๆ ตั้งไฟให้สุก แล้วช้อนออกมาหยิบเป็นกลีบ ๆ ๕ หรือ ๗ หยิบ ใส่ถ้วยตะไลทิ้งไว้ให้คงรูป, ลักษณนามว่า ดอก."
ทองหลาง 0,น.,"ชื่อไม้ต้นหลายชนิดในสกุล Erythrina วงศ์ Leguminosae เช่น ทองหลางนํ้าหรือทองโหลง ( E. fusca Lour.) ทองหลางป่า [ E. subumbrans (Hassk.) Merr.] ทองหลางลายหรือทองเผือก ( E. variegata L.), ดอกออกเป็นช่อสีแดง."
ทองเหลือง 0,น.,โลหะเจือชนิดหนึ่ง ประกอบด้วยทองแดงและสังกะสี ลักษณะเป็นโลหะสีเหลือง.
ท้องแห้ง 0,ก.,"ฝืดเคือง, อด."
ทองโหลง 0,น.,"ชื่อไม้ต้นหลายชนิดในสกุล Erythrina วงศ์ Leguminosae เช่น ทองหลางนํ้าหรือทองโหลง ( E. fusca Lour.) ทองหลางป่า [ E. subumbrans (Hassk.) Merr.] ทองหลางลายหรือทองเผือก ( E. variegata L.), ดอกออกเป็นช่อสีแดง."
ทองอังกฤษ 0,น.,เรียกโลหะชนิดหนึ่งเป็นแผ่นบาง ๆ สีคล้ายทองคำหรือสีอื่น ๆ ก็มี ใช้สลักหรือปรุเป็นลายประดับเครื่องศพเป็นต้น.
ท้องอัสดงคต 0,น.,"ลวดบัวประกอบฐานผนังโบสถ์ หัวท้ายงอนขึ้น อ่อนลงตรงกลาง, ตกท้องช้าง หรือ ตกท้องสะเภา ก็เรียก."
ท้องอืด 0,ว.,อาการที่รู้สึกอึดอัด เพราะมีแก๊สเกิดขึ้นจากการหมักหมมของอาหารในกระเพาะอาหารและลำไส้ เนื่องจากอาหารไม่ย่อยตามปรกติ.
ทองอุไร 0,น.,"ชื่อไม้พุ่มชนิด Tecoma stans (L.) Kunth ในวงศ์ Bignoniaceae ขอบใบหยัก ดอกสีเหลืองสด รูปแตร, พวงอุไร ก็เรียก."
ทองเอก 0,น.,ชื่อขนมชนิดหนึ่ง เคี่ยวน้ำกะทิกับน้ำตาลจนเหนียว ทิ้งไว้ให้เย็นแล้วใส่ไข่แดง แป้งสาลี ตั้งไฟกวนจนแป้งร่อน อัดใส่พิมพ์เป็นรูปต่าง ๆ แต่งหน้าด้วยทองคำเปลวแผ่นเล็ก ๆ.
ท้อใจ 0,ก.,ไม่มีกำลังใจจะสู้.
ทอด 0,ก.,ทำให้สุกด้วยนํ้ามันที่เดือด เช่น ทอดปลา ทอดเนื้อ.
ทอด 1,ว.,เรียกสิ่งที่ทำให้สุกเช่นนั้น เช่น ปลาทอด เนื้อทอด.
ทอด 2,ก.,"ทิ้ง เช่น มันทำชู้แล้วมันทอดหญิงนั้นเสีย (สามดวง), ปล่อย, วาง, เช่น ทอดธุระ ทอดทุ่น ทอดพระราชอาสน์"
ทอด 3,ก.,"ปล่อยลง, ทิ้งลง, เช่น ทอดหมากเก็บ ทอดลูกเต๋า"
ทอด 4,ก.,เหยียดยาวออกไป เช่น ทอดแขน ทอดขา
ทอด 5,ก.,พาดจากจุดหนึ่งไปยังอีกจุดหนึ่ง เช่น ทอดไม้หมากทำเป็นสะพานข้ามคู
ทอด 6,ก.,ลักษณนามเรียกระยะจากจุดหนึ่งถึงอีกจุดหนึ่งหรือจากเวลาหนึ่งถึงอีกเวลาหนึ่ง เช่น ขึ้นรถ ๒ ทอด นอนทอดเดียวตลอดคืน.
ทอดกฐิน 0,ก.,ทำพิธีถวายผ้ากฐินแก่พระสงฆ์.
ทอดโกลน 0,น.,เอาไม้ท่อนกลม ๆ วางเป็นระยะเพื่อลากของที่หนักมาบนนั้น.
ทอดข้าว 0,ก.,"จัดหาข้าวปลาอาหารมาเลี้ยงดู, ทอดสำรับ หรือ ทอดสำรับกับข้าว ก็เรียก."
ทอดตัว 0,ก.,เอนตัวลงนอน.
ทอดตา 0,ก.,"แลไป, มองดูในระยะไกล."
ทอดทฤษฎี 0,ก.,"มองไปรอบ ๆ, ตั้งใจดู, เช่น เวลาท่านทอดทฤษฎี (เสือโค)."
ทอดทิ้ง 0,ก.,"ละเลย, ทิ้งขว้าง, ไม่เอาเป็นธุระ, ไม่เอาใจใส่, ไม่นำพา."
ทอดที่ 0,ก.,จัดที่นั่งที่นอน เช่น ทอดที่พระราชอาสน์.
ทอดน่อง 0,ว.,อาการที่เดินช้า ๆ ตามสบาย.
ทอดน้ำ 0,ก.,วางนํ้าให้สัตว์เช่นช้างม้าเป็นต้นกิน.
ทอดผ้า 0,ก.,วางผ้าไตร สบง หรือจีวรไว้บนด้ายสายสิญจน์หรือภูษาโยง เพื่อให้พระภิกษุชักบังสุกุล.
ทอดผ้าป่า 0,ก.,"เอาผ้าถวายพระภิกษุโดยวางไว้บนกิ่งไม้เพื่อให้พระภิกษุชักเอาเอง, โดยปริยายหมายถึงอาการที่วางไว้อย่างนั้น เช่น ทอดผ้าป่าเรียงวางไว้กลางสนาม (อภัย)."
ทอดพระที่ 0,ก.,จัดที่บรรทม (ใช้แก่เจ้านาย).
ทอดพระเนตร 0,ก.,ดู.
ทอดมัน 0,น.,ของกินชนิดหนึ่ง เอาปลาหรือกุ้งผสมกับนํ้าพริกแกง โขลกให้เข้ากันจนเหนียวแล้วทอดในนํ้ามัน.
ทอดยอด 0,ก.,เลื้อยไป (ใช้แก่ยอดไม้เลื้อย).
ทอดยอด 1,น.,คำสุภาพของผักบุ้ง เรียกว่า ผักทอดยอด.
ทอดรวง 0,ก.,ออกรวง (ใช้แก่ต้นข้าว).
ทอดสกา 0,ก.,เทลูกเต๋าลงในเติ่ง.
ทอดสนิท 0,ก.,"ผูกไมตรี, สร้างความสัมพันธ์, เช่น ซื้อของมาฝากบ่อย ๆ เพื่อทอดสนิทให้เขารัก."
ทอดสมอ 0,ก.,ทิ้งสมอลงไปในนํ้าเพื่อให้เรือจอดอยู่กับที่.
ทอดสะพาน 0,ก.,แสดงกิริยาท่าทางเป็นทำนองอยากติดต่อด้วย
ทอดสะพาน 1,ก.,ใช้ผู้อื่นเป็นสื่อเข้าไปติดต่อทำความสนิทสนมกับผู้ที่ตนต้องการคุ้นเคย.
ทอดสายตา 0,ก.,มองด้วยอาการสำรวม
ทอดสายตา 1,ก.,ใช้สายตาเป็นสื่อ.
ทอดสำรับ 0,ก.,"จัดหาข้าวปลาอาหารมาเลี้ยงดู, ทอดข้าว ก็เรียก."
ทอดสำรับกับข้าว 0,ก.,"จัดหาข้าวปลาอาหารมาเลี้ยงดู, ทอดข้าว ก็เรียก."
ทอดเสียง 0,ก.,เอื้อนเสียงให้ยาวกว่าปรกติ.
ทอดหญ้า 0,ก.,วางหญ้าให้สัตว์เช่นช้างม้าเป็นต้นกิน.
ทอดหุ่ย 0,ว.,"อาการที่ไม่เอาธุระปล่อยให้เป็นไปตามเรื่องตามราว, อาการที่ปล่อยอารมณ์ตามสบาย, มักใช้ประกอบคำ นอน ว่า นอนทอดหุ่ย."
ทอดแห 0,ก.,เหวี่ยงแหให้แผ่กว้างออกไปเพื่อจับปลาเป็นต้น.
ทอดอาลัย 0,ก.,ปล่อยไปตามบุญตามกรรมทั้ง ๆ ที่ยังมีใจผูกพันหรือมีความเสียดายอยู่.
ท่อถ้อย 0,น.,คำโต้.
ท่อถ้อย 1,ก.,"กล่าวโต้, กล่าวประชัน, ใช้ว่า ถ้อถ้อย หรือ ท้อถ้อย ก็มี."
ท้อถอย 0,ก.,มีความพยายามลดน้อยถอยลง.
ท้อถ้อย 0,น.,คำโต้.
ท้อถ้อย 1,ก.,"กล่าวโต้, กล่าวประชัน, ใช้ว่า ถ้อถ้อย หรือ ท่อถ้อย ก็มี."
ท้อแท้ 0,ก.,อ่อนเปลี้ยเพลียใจ.
ทอน 0,ก.,"ตัดหรือฟันให้เป็นท่อน ๆ เช่น ทอนฟืน, ทำให้ลดลงหรือให้สั้นลง เช่น ทอนกำลัง ทอนอายุ, รอน ก็ว่า"
ทอน 1,ก.,หักจำนวนเงินตามราคาแล้วคืนส่วนที่เหลือไป เช่น ทอนเงิน ทอนสตางค์.
ท่อน 0,น.,"ส่วนที่ตัดหรือทอนออกเป็นตอน ๆ เช่น ท่อนหัว ท่อนกลาง ท่อนหาง, ส่วนหนึ่งของเพลงซึ่งมีความสมบูรณ์ในตัวเอง จะเป็นทำนองหรือบทร้องก็ได้ จะเป็นท่อนสั้นหรือท่อนยาวก็ได้ เพลงหนึ่งอาจมีท่อนเดียวหรือหลายท่อนก็ได้"
ท่อน 1,น.,ลักษณนามเรียกสิ่งที่ตัดแบ่งหรือทอนออกเป็นท่อน ๆ เช่น ฟืนท่อนหนึ่ง ฟืน ๒ ท่อน เพลง ๓ ท่อน.
ทอนซิล 0,น.,ปุ่มเนื้อเยื่อนํ้าเหลือง อยู่ในบริเวณลำคอข้างละปุ่ม มีหน้าที่ช่วยป้องกันการแผ่กระจายของแบคทีเรียที่เข้าสู่ร่างกายผ่านทางลำคอ.
ทอฟฟี่ 0,น.,ของหวานแบบฝรั่ง ใช้อม ทำด้วยนํ้าตาลกวนกับนมหรือเนยเป็นต้น มักปั้นเป็นก้อนห่อกระดาษแก้วบิดหัวท้าย.
ท่อม ๆ 0,ว.,อาการที่เดินก้ม ๆ เงย ๆ ไปเรื่อย ๆ มักไม่มีจุดหมาย.
ทอย 0,ก.,"โยนให้เรียดหรือเรี่ยดินไปให้ถูกเป้าหรือไปยังตำแหน่งที่ต้องการ เช่น ทอยเบี้ยในการเล่นทอยกอง ทอยเบี้ยเล่นต้องเต, ปาให้ถูกเป้า เช่น ทอยลูกข่าง."
ทอย 1,ก.,กิริยาที่ตอกลูกประสักหรือตะปูเป็นต้นให้หลุดออกมาจากที่เดิม.
ทอย 2,น.,"เรียกไม้แหลมสำหรับตอกต้นไม้เป็นระยะ ๆ เพื่อเหยียบขึ้นไป ว่า ลูกทอย, เรียกกิริยาที่ตอกลูกทอยอย่างนั้น ว่า ตอกทอย."
ทอย ๆ 0,ว.,ทยอยติด ๆ กันไปไม่ขาดระยะ เช่น เดินทอย ๆ กันเข้าไป.
ทอยกอง 0,น.,ชื่อการเล่นพนันอย่างหนึ่ง ใช้สตางค์หรือสิ่งอื่นตั้งซ้อน ๆ กันแล้วทอยให้ล้ม.
ทอร์นาโด 0,น.,"ชื่อพายุประจำถิ่นชนิดหนึ่ง มีความรุนแรงมาก มีขนาดเส้นผ่าศูนย์กลาง ๒-๓ กิโลเมตร บริเวณศูนย์กลางพายุมีความกดอากาศต่ำมาก จึงทำให้อากาศรอบนอกที่พัดเข้าหาศูนย์กลางพายุมีความเร็วสูงมาก เมื่อเริ่มเกิดเมฆจะม้วนตัวเป็นรูปกรวยหรืองวงยื่นออกมาจากฐานเมฆ ส่วนมากเกิดในบริเวณตอนกลางของสหรัฐอเมริกาและทางตะวันตกของออสเตรเลีย, ลมงวง หรือ ลมงวงช้าง ก็เรียก."
ทอเรียม 0,น.,ธาตุลำดับที่ ๙๐ สัญลักษณ์ Th เป็นโลหะ ลักษณะเป็นของแข็ง สีเทาเข้ม หลอมละลายที่ ๑๗๕๐ ° ซ. เป็นธาตุกัมมันตรังสี ใช้ประโยชน์นำไปผสมกับโลหะอื่นให้เป็นโลหะเจือ.
