อุทธรณ์ 1,น.,ชื่อศาลสูงถัดจากศาลชั้นต้นซึ่งมีอำนาจพิจารณาพิพากษาบรรดาคดีที่อุทธรณ์คำพิพากษาหรือคำสั่งของศาลชั้นต้น เรียกว่า ศาลอุทธรณ์.
อุทธรณ์ 2,ก.,ยื่นฟ้องหรือยื่นคำร้องต่อศาลสูงคัดค้านคำพิพากษาหรือคำสั่งของศาลชั้นต้น
อุทธรณ์ 3,ก.,ยื่นคำร้องคัดค้านคำสั่งหรือคำวินิจฉัยของพนักงานเจ้าหน้าที่
อุทธรณ์ 4,ก.,"ร้องเรียน, ร้องทุกข์, เช่น ร้องอุทธรณ์."
อุทธัจ 0,น.,ความฟุ้งซ่าน
อุทธัจ 1,น.,"ความประหม่า, ความขวยเขิน"
อุทธัจ 2,น.,อุธัจ ก็ว่า.
อุทบาตร 0,น.,หม้อนํ้า.
อุทบาน 0,น.,"บ่อนํ้า, สระน้ำ."
อุทพินทุ์ 0,น.,หยาดนํ้า.
อุทยาน 0,น.,สวน.
อุทยานแห่งชาติ 0,น.,พื้นที่บริเวณใดบริเวณหนึ่งที่ได้สงวนรักษาไว้ให้คงอยู่ในสภาพธรรมชาติเดิม เพื่อให้เป็นประโยชน์แก่การศึกษาและความรื่นรมย์ของประชาชน โดยมีพระราชกฤษฎีกาประกาศกำหนดให้เป็น อุทยานแห่งชาติ ตามกฎหมายว่าด้วยอุทยานแห่งชาติ.
อุทร 0,น.,ท้อง.
อุทริยะ 0,น.,อาหารที่กินเข้าไปใหม่ ๆ.
อุทลุม 0,ว.,"ผิดประเพณี, ผิดธรรมะ, นอกแบบ, นอกทาง, เช่น คดีอุทลุม คือคดีที่ลูกหลานฟ้องบุพการีของตนต่อศาล, เรียกลูกหลานที่ฟ้องบุพการีของตนต่อศาล ว่า คนอุทลุม เช่น ผู้ใดเปนคนอุทลุมหมีได้รู้คุณบิดามานดาปู่หญ้าตายาย แลมันมาฟ้องร้องให้เรียกบิดามานดาปู่ญ่าตายายมัน ท่านให้มีโทษทวนมันด้วยลวดหนังโดยฉกัน (สามดวง)."
อุทัช 0,ว.,เกิดในนํ้า.
อุทัย 0,น.,"การเกิดขึ้น เช่น สุโขทัย = การเกิดขึ้นแห่งความสุข, การตั้งขึ้น เช่น อรุโณทัย = การตั้งขึ้นแห่งอรุณ."
อุทัย 1,ก.,เริ่มส่องแสง ในคำว่า อาทิตย์อุทัย.
อุทาน 0,น.,เสียงหรือคำที่เปล่งออกมาเวลาตกใจ ดีใจ หรือเสียใจ เป็นต้น
อุทาน 1,น.,ในไวยากรณ์เรียกคำหรือเสียงที่เปล่งออกมาเช่นนั้น ว่า คำอุทาน.
อุทาน 2,น.,ชื่อคัมภีร์ในพระพุทธศาสนา เป็น ๑ ใน ๙ ส่วนของคัมภีร์นวังคสัตถุศาสน์. (ป.). (ดู นวังคสัตถุศาสน์ ประกอบ).
อุทาร 0,ว.,"สูง, เลิศ, ประเสริฐ, ยิ่งใหญ่"
อุทาร 1,ว.,"ซื่อตรง, มีความจริงใจ"
อุทาร 2,ว.,สุภาพ
อุทาร 3,ว.,ถูกต้อง.
อุทาหรณ์ 0,น.,"ตัวอย่างที่ยกขึ้นมาอ้างให้เห็น, สิ่งหรือเรื่องที่ยกขึ้นมาเทียบเคียงเป็นตัวอย่าง."
อุทิศ 0,ก.,"ให้, ยกให้, เช่น อุทิศส่วนบุญให้แก่ผู้ตายตามประเพณี"
อุทิศ 1,ก.,"ทำเพื่อ, สละให้โดยเจาะจง."
อุทุมพร 0,น.,ชื่อมะเดื่อชนิดหนึ่ง. (ดู มะเดื่อ).
อุเทศ 0,น.,"การยกขึ้นแสดง, การยกขึ้นชี้แจง."
อุเทศ 1,ว.,"ที่ยกขึ้นแสดง, ที่ยกขึ้นชี้แจง"
อุเทศ 2,ว.,ที่อ้างอิง เช่น หนังสืออุเทศ.
อุเทสิกเจดีย์ 0,น.,เจดีย์ที่สร้างอุทิศพระพุทธเจ้า ได้แก่ พระพุทธรูป.
อุธัจ 0,น.,ความฟุ้งซ่าน
อุธัจ 1,น.,"ความประหม่า, ความขวยเขิน"
อุธัจ 2,น.,อุทธัจ ก็ว่า.
อุ่น 0,ก.,ทำให้ร้อน เช่น อุ่นแกง.
อุ่น 1,ว.,"ค่อนข้างร้อน เช่น ตัวอุ่น, ไม่ร้อนนักไม่หนาวนัก เช่น อากาศอุ่น, อุ่น ๆ ก็ว่า."
อุ่นกายสบายใจ 0,ว.,มีความรู้สึกสุขสบายทั้งกายและใจ.
อุ่นเครื่อง 0,ก.,เดินเครื่องยนต์ไว้จนถึงระดับที่เครื่องจะทำงานได้ดี
อุ่นเครื่อง 1,ก.,"ออกกำลังกายหรือฝึกซ้อมชั่วขณะก่อนเริ่มการแข่งขัน, ฝึกซ้อมก่อนแข่งขันจริง."
อุ่นใจ 0,ว.,"มีความรู้สึกสบายใจขึ้น, มีความมั่นใจ, ไม่มีกังวล, เช่น มีเงินมากอยู่ในกระเป๋าทำให้อุ่นใจ."
อุ่นหนาฝาคั่ง 0,ว.,"มั่นคง, มีหลักฐานเป็นที่พักพิงมั่นคง, เช่น มีฐานะอุ่นหนาฝาคั่ง"
อุ่นหนาฝาคั่ง 1,ว.,มากมายคับคั่ง เช่น งานนี้มีผู้คนมาอุ่นหนาฝาคั่ง.
อุ่นอกอุ่นใจ 0,ว.,มีความรู้สึกสบายอกสบายใจและมีความมั่นใจขึ้น เช่น อยู่ใกล้ ๆ ผู้ใหญ่รู้สึกอุ่นอกอุ่นใจ.
อุนากัน 0,ว.,เล็บยาว.
อุบ 0,ว.,"ชื่อปลาไม่มีเกล็ดชนิด Batrachoides grunniers (Bloch) และ Batrachomoeus trispinosus (Günther) ในวงศ์ Batrachoididae ปากกว้าง หัวทู่แบนลง ลำตัวกลมยาว มีสีนํ้าตาลเป็นด่างดวงทั่วไป ขนาดยาวได้ถึง ๓๐ เซนติเมตร ครีบท้องอยู่เยื้องไปข้างหน้าครีบอก หางกลม เฉพาะชนิดแรกมีรูที่มุมบนด้านในของครีบอก อาศัยอยู่ตามพื้นท้องทะเล, กบ บู่ทะเล ผีหลอก หรือ อุบ ก็เรียก."
อุบ 1,ก.,นิ่งไว้ไม่เปิดเผย เช่น เรื่องนี้อุบไว้ก่อน
อุบ 2,ก.,"ถือเอา, ริบเอา, เช่น อุบเอามาเป็นของตน, ไม่ยอมให้เปลี่ยนแปลง เช่น ที่รับปากไว้แล้ว อุบละนะ."
อุบ 3,ว.,"อาการที่พูดหรือบ่นเบา ๆ เป็นต้น เช่น ด่าอุบ บ่นอุบ, อุบอิบ อุบอิบ ๆ หรือ อุบ ๆ อิบ ๆ ก็ว่า."
อุบ ๆ อิบ ๆ 0,ว.,"อาการที่พูดหรือบ่นเบา ๆ เป็นต้น เช่น ด่าอุบอิบ พูดอุบอิบ ๆ บ่นอุบ ๆ อิบ ๆ, อุบ ก็ว่า."
อุบไต๋ 0,ก.,"ปกปิดไพ่ตัวสำคัญไว้ไม่ให้คู่แข่งรู้, ปกปิดกลเม็ด ทีเด็ด ความลับ หรือเจตนาไว้, กลบไต๋ ก็ว่า."
อุบล 0,น.,บัวสาย.
อุบอิบ 0,ว.,"อาการที่พูดหรือบ่นเบา ๆ เป็นต้น เช่น ด่าอุบอิบ พูดอุบอิบ ๆ บ่นอุบ ๆ อิบ ๆ, อุบ ก็ว่า."
อุบอิบ ๆ 0,ว.,"อาการที่พูดหรือบ่นเบา ๆ เป็นต้น เช่น ด่าอุบอิบ พูดอุบอิบ ๆ บ่นอุบ ๆ อิบ ๆ, อุบ ก็ว่า."
อุบะ 0,น.,เป็นดอกไม้ที่ร้อยเป็นสายแล้วเข้าพวงอย่างพู่สำหรับห้อยกับมาลัย ห้อยระหว่างเฟื่อง หรือห้อยประดับข้างหูเป็นต้น.
อุบ๊ะ 0,อ.,"คำที่เปล่งออกมาแสดงความไม่พอใจหรือประหลาดใจเป็นต้น, บ๊ะ ก็ว่า."
อุบัติ 0,น.,"การเกิดขึ้น, กำเนิด, การบังเกิด"
อุบัติ 1,น.,"รากเหง้า, เหตุ."
อุบัติ 2,ก.,"เกิด, เกิดขึ้น."
อุบัติ- 0,น.,"การเกิดขึ้น, กำเนิด, การบังเกิด"
อุบัติ- 1,น.,"รากเหง้า, เหตุ."
อุบัติ- 2,ก.,"เกิด, เกิดขึ้น."
อุบัติภัย 0,น.,ภัยที่เกิดจากอุบัติเหตุ.
อุบัติเหตุ 0,น.,"เหตุที่เกิดขึ้นโดยไม่คาดคิด, ความบังเอิญเป็น."
อุบาท 0,น.,"การบังเกิด, กำเนิด, มักใช้เป็นส่วนท้ายสมาส เช่น พุทธุบาท (พุทธ + อุบาท), พุทธุปบาท (พุทธ + อุปบาท)."
อุบาทว์ 0,ว.,"อัปรีย์, จัญไร, ไม่เป็นมงคล."
อุบาย 0,น.,วิธีการอันแยบคาย
อุบาย 1,น.,"เล่ห์กล, เล่ห์เหลี่ยม."
อุบาสก 0,น.,คฤหัสถ์ผู้ชายที่นับถือพระพุทธศาสนาอย่างมั่นคง.
อุบาสิกา 0,น.,คฤหัสถ์ผู้หญิงที่นับถือพระพุทธศาสนาอย่างมั่นคง.
อุเบกขา 0,น.,"ความวางใจเฉยอยู่, ความเที่ยงธรรม, ความวางตัวเป็นกลาง, เป็นข้อ ๑ ในพรหมวิหาร ๔ คือ เมตตา กรุณา มุทิตา อุเบกขา."
อุโบสถ 0,น.,"เรียกสถานที่ที่พระสงฆ์ประชุมกันทำสังฆกรรมเช่นสวดพระปาติโมกข์ อุปสมบท ว่า โรงอุโบสถ หรือ อุโบสถ, เรียกย่อว่า โบสถ์"
อุโบสถ 1,น.,เรียกวันพระ ว่า วันอุโบสถ
อุโบสถ 2,น.,เรียกการแสดงพระปาติโมกข์ของพระสงฆ์ทุก ๆ กึ่งเดือน คือ ในวันขึ้น ๑๕ ค่ำ และวันแรม ๑๕ ค่ำ หรือวันแรม ๑๔ ค่ำ ในเดือนขาด ว่า การทำอุโบสถ
อุโบสถ 3,น.,เรียกการรักษาศีล ๘ ของคฤหัสถ์ ว่า การรักษาอุโบสถ.
อุโบสถ 4,น.,"ชื่อช้างตระกูล ๑ ใน ๑๐ ตระกูล กายสีทองคำ, ช้าง ๑๐ ตระกูล คือ ๑. กาฬาวกหัตถี ๒. คังไคยหัตถี ๓. ปัณฑรหัตถี ๔. ตามพหัตถี ๕. ปิงคลหัตถี ๖. คันธหัตถี ๗. มงคลหัตถี ๘. เหมหัตถี ๙. อุโบสถหัตถี ๑๐. ฉัททันตหัตถี."
อุโบสถกรรม 0,น.,การทำอุโบสถ.
อุโบสถหัตถี 0,น.,"ชื่อช้างตระกูล ๑ ใน ๑๐ ตระกูล กายสีทองคำ, ช้าง ๑๐ ตระกูล คือ ๑. กาฬาวกหัตถี ๒. คังไคยหัตถี ๓. ปัณฑรหัตถี ๔. ตามพหัตถี ๕. ปิงคลหัตถี ๖. คันธหัตถี ๗. มงคลหัตถี ๘. เหมหัตถี ๙. อุโบสถหัตถี ๑๐. ฉัททันตหัตถี."
อุปกรณ์ 0,น.,"เครื่องมือ, เครื่องใช้, เครื่องช่วย, เครื่องประกอบ"
อุปกรณ์ 1,น.,สังหาริมทรัพย์ซึ่งโดยปรกตินิยมเฉพาะถิ่นหรือโดยเจตนาชัดแจ้งของเจ้าของทรัพย์ที่เป็นประธาน เป็นของใช้ประจำอยู่กับทรัพย์ที่เป็นประธานเป็นอาจิณเพื่อประโยชน์แก่การจัดดูแล ใช้สอย หรือรักษาทรัพย์ที่เป็นประธาน และเจ้าของทรัพย์ได้นำมาสู่ทรัพย์ที่เป็นประธานโดยการนำมาติดต่อหรือปรับเข้าไว้ หรือทำโดยประการอื่นใดในฐานะเป็นของใช้ประกอบกับทรัพย์ที่เป็นประธานนั้น เช่น ยางอะไหล่.
อุปกรม 0,น.,"การเข้าใกล้, การตั้งต้น, การพยายาม."
อุปการ- 0,น.,"ความช่วยเหลือเกื้อกูล, ความอุดหนุน, คู่กับ ปฏิการะ = การสนองคุณ, การตอบแทนคุณ."
อุปการ- 1,ก.,"ช่วยเหลือเกื้อกูล, อุดหนุน."
อุปการ 0,น.,เรียกม้าที่ปล่อยในพิธีอัศวเมธ ว่า ม้าอุปการ.
อุปการะ 0,น.,"ความช่วยเหลือเกื้อกูล, ความอุดหนุน, คู่กับ ปฏิการะ = การสนองคุณ, การตอบแทนคุณ."
อุปการะ 1,ก.,"ช่วยเหลือเกื้อกูล, อุดหนุน."
อุปการี 0,น.,"ผู้ช่วยเหลือ, ผู้อุดหนุน, หญิงใช้ว่า อุปการิณี."
อุปกาศ 0,ก.,"แจ้งข่าว เรื่อง หรือข้อความ เช่น เขือไปอุปกาศแล้ว เขือมา (ลอ), ร้องอุปกาศสารแก่กรุงสญชัยปิตุราช (ม. ร่ายยาว หิมพานต์)."
อุปกิณณะ 0,ว.,"ปกคลุมไว้, ปิดบังอยู่."
อุปกิเลส 0,น.,เครื่องทำใจให้เศร้าหมอง มี ๑๖ อย่าง มี อภิชฌาวิสมโลภ เป็นต้น.
อุปจาร 0,น.,"การเข้าใกล้, ที่ใกล้, บริเวณรอบ ๆ เช่น อุปจารวัด."
อุปถัมภ์ 0,น.,"การคํ้าจุน, การคํ้าชู, การสนับสนุน, การเลี้ยงดู."
อุปถัมภ์ 1,ก.,"คํ้าจุน, คํ้าชู, สนับสนุน, เลี้ยงดู."
อุปถัมภก 0,น.,"ผู้คํ้าจุน, ผู้ค้ำชู, ผู้สนับสนุน, ผู้เลี้ยงดู."
อุปทม 0,น.,กามโรค.
อุปทูต 0,น.,ผู้รักษาการในตำแหน่งหรือรักษาการแทนหัวหน้าสถานเอกอัครราชทูตหรือหัวหน้าคณะผู้แทนทางการทูต
อุปทูต 1,น.,ตำแหน่งรองจากราชทูต.
อุปเทศ 0,น.,"การชี้แจง, การสั่งสอน, การแนะนำ"
อุปเทศ 1,น.,"คำสั่งสอน, คำชี้แจง, คำแนะนำ."
อุปเทศ 2,ก.,"สอน, ชี้แจง, แนะนำ."
อุปเท่ห์ 0,น.,"อุบายดำเนินการ, วิธีดำเนินการ."
อุปธิ 0,น.,"กิเลส, ความพัวพัน, เหตุแห่งการเวียนเกิด"
อุปธิ 1,น.,"ขันธ์ ๕, ร่างกาย."
อุปนัย 0,น.,"วิธีการใช้เหตุผลที่ดำเนินจากส่วนย่อยไปหาส่วนรวม เช่น นาย ก. เกิดมาแล้วต้องตาย นาย ข. เกิดมาแล้วต้องตาย นาย ค. เกิดมาแล้วต้องตาย เพราะฉะนั้นมนุษย์ทุกคนเกิดมาแล้วต้องตาย, ตรงข้ามกับ นิรนัย."
อุปนิกขิต 0,ก.,"เก็บไว้, รักษาไว้."
อุปนิกขิต 1,น.,"คนสอดแนม, จารชน."
อุปนิกษิต 0,ก.,"เก็บไว้, รักษาไว้."
อุปนิกษิต 1,น.,"คนสอดแนม, จารชน."
อุปนิษัท 0,น.,ชื่อคัมภีร์ภาษาสันสกฤตกลุ่มหนึ่ง คัมภีร์อุปนิษัทรุ่นแรกเป็นพื้นฐานของศาสนาพราหมณ์ที่สอนว่าทุกสิ่งทุกอย่างออกมาจากอาตมัน.
อุปนิสัย 0,น.,"ความประพฤติที่เคยชินเป็นพื้นมาในสันดาน เช่น ก่อนที่พระพุทธเจ้าจะเสด็จไปเทศน์โปรดผู้ใดจะต้องทรงพิจารณาถึงอุปนิสัยของผู้นั้นก่อน, ความประพฤติที่เคยชินจนเกือบเป็นนิสัย เช่น นักเรียนคนนี้มีอุปนิสัยดี."
อุปบล 0,น.,"อุบล, บัวสาย, ดอกบัว, มักใช้เป็นส่วนท้ายของสมาส เช่น นีลุปบล ว่า บัวขาบ."
อุปบัติ 0,น.,"การเข้าถึง เช่น คติอุปบัติ = การเข้าถึงคติ, การเกิด."
อุปบาท 0,น.,"การบังเกิด, กำเนิด, มักใช้เป็นส่วนท้ายสมาส เช่น พุทธุบาท (พุทธ + อุบาท), พุทธุปบาท (พุทธ + อุปบาท)."
อุปปาติกะ 0,น.,"ผู้เกิดผุดขึ้นโดยไม่ต้องอาศัยพ่อแม่ อาศัยอดีตกรรม ได้แก่เทวดา พรหม สัตว์นรก เปรต อสุรกาย, โอปปาติกะ ก็เรียก."
อุปพัทธ์ 0,ก.,"เนื่อง, เนื่องกัน."
อุปพัทธ์ 1,ว.,ที่เนื่องกัน.
อุปพันธ์ 0,น.,"การติดต่อ, การร่วม"
อุปพันธ์ 1,น.,"เยื่อใย, เครื่องผูกพัน."
อุปโภค 0,ก.,"เอามาใช้ให้เกิดประโยชน์, คู่กับ บริโภค."
อุปโภค 1,ว.,ที่เอามาใช้ให้เกิดประโยชน์ ในคำว่า เครื่องอุปโภค.
อุปมา 0,น.,"สิ่งหรือข้อความที่ยกมาเปรียบ, มักใช้เข้าคู่กับ อุปไมย ในประโยคเช่น เรื่องนี้มีอุปมาฉันใด อุปไมยก็ฉันนั้น."
อุปมา 1,ก.,เปรียบเทียบ.
อุปมาน 0,น.,การเปรียบเทียบสิ่งที่มีลักษณะคล้ายคลึงกัน.
อุปมาโวหาร 0,น.,สำนวนเขียนที่กล่าวถึงเรื่องราวโดยยกสิ่งต่าง ๆ ขึ้นมาเปรียบเทียบประกอบ.
อุปมาอุปไมย 0,น.,การเปรียบเทียบกัน.
อุปไมย 0,น.,"สิ่งหรือข้อความที่พึงเปรียบเทียบกับสิ่งอื่นเพื่อให้เข้าใจแจ่มแจ้ง, คู่กับ อุปมา."
อุปยุวราช 0,น.,ตำแหน่งเจ้าในนครล้านช้างรองพระเจ้าแผ่นดิน แต่อยู่เหนืออุปราช.
อุปโยค 0,น.,"การใช้สอย, การทำให้เกิดประโยชน์."
อุปโยคบุรพบท 0,น.,ในไวยากรณ์หมายถึงคำนำหน้ากรรมการก.
อุปรากร 0,น.,ละครเพลงประเภทหนึ่ง ดำเนินเรื่องด้วยการร้องเพลงผสมผสานการบรรเลงจากวงดุริยางค์.
อุปราคา 0,น.,"การทำให้ดำ, การทำให้มีมลทิน, ในคำว่า จันทรุปราคา สุริยุปราคา."
อุปราช 0,น.,ผู้สำเร็จราชการต่างพระองค์ประจำภาคหนึ่ง ๆ ในอาณาจักร.
อุปริ 0,*ว.,คำประกอบหน้าศัพท์ภาษาบาลีและสันสกฤต แปลว่า เบื้องบน ข้างบน.
อุปริจร 0,ว.,เคลื่อนไปในอากาศ.
