ซาวเสียง 0,ก.,"ลองพูดหรือทำอย่างใดอย่างหนึ่งเพื่อฟังความคิดเห็นจากผู้อื่นหรือคนจำนวนมาก, หยั่งเสียง ก็ว่า."
ซาหริ่ม 0,น.,ชื่อขนมอย่างหนึ่ง ทำด้วยแป้งถั่วเขียว ลักษณะเป็นเส้นเล็กและยาว มีหลายสี กินกับนํ้ากะทิผสมนํ้าเชื่อมใส่น้ำแข็ง.
ซ่าหริ่ม 0,น.,ชื่อขนมอย่างหนึ่ง ทำด้วยแป้งถั่วเขียว ลักษณะเป็นเส้นเล็กและยาว มีหลายสี กินกับนํ้ากะทิผสมนํ้าเชื่อมใส่น้ำแข็ง.
ซำ 0,น.,"ที่น้ำซับ, ซับ."
ซ้ำ 0,ว.,มีหรือทำอย่างเดียวกันอีกครั้งหนึ่งหรือหลาย ๆ ครั้ง เช่น ฉันมีชุดน้ำชาซ้ำกัน ๒ ชุด พูดซํ้า ตีซํ้า.
ซ้ำซ้อน 0,ว.,"ลักษณะที่ทำหรือมีหลายอย่างที่คล้ายกันหรือเหมือนกัน เช่น ลงทะเบียนซ้ำซ้อน พิการซ้ำซ้อน, ลักษณะของงานอย่างเดียวกันหรือคล้ายกันแต่ทำหลายครั้งหรือในหลายหน่วยงาน เช่น งานซ้ำซ้อน โครงการซ้ำซ้อน."
ซ้ำซาก 0,ว.,"ทำแล้วทำอีกหรือเป็นแล้วเป็นอีกอย่างเดียวกันรํ่าไป, จำเจ, เช่น เขาชอบพูดจาซ้ำซาก บางจังหวัดทางภาคอีสานเกิดภัยแล้งซ้ำซาก."
ซ้ำเติม 0,ก.,เพิ่มเติมให้หนักหรือให้มากขึ้น.
ซ้ำร้าย 0,ว.,ร้ายยิ่งขึ้นไปอีก.
ซ้ำสาม 0,น.,คำว่าคนตํ่าช้าไม่มีตระกูล เช่น ทั้งนี้ก็เพราะใครเล่า เพราะอีสาวซ้ำสามซัดเซบ้าน (ม. ร่ายยาว ชูชก).
ซิ 0,*ว.,"คำประกอบท้ายประโยคเพื่อเสริมข้อความให้เด่น ให้ชัด เป็นต้น, โดยมากใช้กับกริยาเป็นเชิงบังคับ เชิงชวน หรือรับคำเป็นต้น เช่น ไปซิ มาซิ ไปซิ่ มาซิ่ ไปซี มาซี, สิ ก็ว่า."
ซิ่ 0,*ว.,"คำประกอบท้ายประโยคเพื่อเสริมข้อความให้เด่น ให้ชัด เป็นต้น, โดยมากใช้กับกริยาเป็นเชิงบังคับ เชิงชวน หรือรับคำเป็นต้น เช่น ไปซิ มาซิ ไปซิ่ มาซิ่ ไปซี มาซี, สิ ก็ว่า."
ซิ่ก 0,ว.,เรียกอาการที่เหงื่อไหลซึมออกมาตามตัว ว่า เหงื่อไหลซิก เหงื่อไหลซิ่ก.
ซิก 0,ว.,เรียกอาการที่เหงื่อไหลซึมออกมาตามตัว ว่า เหงื่อไหลซิก เหงื่อไหลซิ่ก.
ซิก 1,น.,ชื่อศาสนาหนึ่งในอินเดีย มีปฐมศาสดาชื่อ คุรุนานัก
ซิก 2,น.,ชื่อชาวอินเดียพวกหนึ่งที่นับถือศาสนาซิกข์ส่วนมากอยู่ในแคว้นปัญจาบ ประเทศอินเดีย
ซิก 3,น.,สิกข์ หรือ สิข ก็ว่า.
ซิก 4,น.,"ชื่อไม้ต้นชนิด Albizia lebbeck (L.) Benth. ในวงศ์ Leguminosae ดอก (เกสร) อ่อนมีสีเขียวและขาว เมื่อดอก (เกสร) แก่เปลี่ยนเป็นสีเหลือง ใกล้โรยเปลี่ยนเป็นสีเหลืองอมแสด ฝักแบนยาวกว้าง ฝักอ่อนสีเขียว เมื่อแก่สีนํ้าตาลอ่อน ไม่มีรส, พฤกษ์ ซึก หรือ ซิก ก็เรียก, มักเรียกต้นก้ามปูหรือต้นจามจุรีแดง [ Samanea saman (Jacq.) Merr.] ซึ่งเป็นไม้ต่างชนิดกันว่า ต้นจามจุรี."
ซิก ๆ 0,ว.,"เรียกอาการที่ร้องไห้ค่อย ๆ ว่า ร้องไห้ซิก ๆ, กระซิก ๆ ก็ว่า."
ซิกข์ 0,น.,ชื่อศาสนาหนึ่งในอินเดีย มีปฐมศาสดาชื่อ คุรุนานัก
ซิกข์ 1,น.,ชื่อชาวอินเดียพวกหนึ่งที่นับถือศาสนาซิกข์ส่วนมากอยู่ในแคว้นปัญจาบ ประเทศอินเดีย
ซิกข์ 2,น.,สิกข์ หรือ สิข ก็ว่า.
ซิกซี้ 0,ก.,"หัวเราะเย้าหยอกกัน, ระริก, กระซิกกระซี้ ก็ว่า."
ซิกแซ็ก 0,ว.,"คดไปคดมา, เลี้ยวไปเลี้ยวมา, เฉียงไปเฉียงมา, สลับฟันปลา"
ซิกแซ็ก 1,ว.,ลดเลี้ยวสลับซับซ้อน.
ซิกแซ็ก 2,น.,"เรียกกรรไกรตัดผ้าให้มีรูปอย่างฟันปลา ว่า กรรไกรซิกแซ็ก, เรียกการเย็บผ้าด้วยด้ายให้มีรูปอย่างฟันปลา ว่า การเย็บซิกแซ็ก."
ซิการ์ 0,น.,ใบยาสูบซึ่งมวนแน่น มีขนาดโตกว่าบุหรี่ ปลาย ๒ ข้างค่อนข้างเรียว.
ซิกาแร็ต 0,น.,ใบยาสูบที่หั่นเป็นเส้น แล้วมวนด้วยกระดาษ หัวท้ายตัด.
ซิงโคนา 0,น.,ชื่อไม้ต้นหลายชนิดในสกุล Cinchona วงศ์ Rubiaceae เปลือกมีควินินใช้เป็นยาแก้ไข้จับสั่น.
ซิ่น 0,น.,ผ้าอย่างหนึ่งที่ผู้หญิงนุ่ง มักยาวกรอมข้อเท้า.
ซินนามิก 0,น.,กรดอินทรีย์ชนิดหนึ่ง มีสูตร C_6H_5CH : CHCOOH เป็นของแข็ง ลักษณะเป็นผลึก ไม่มีสี ละลายนํ้าได้บ้างเล็กน้อย มีปรากฏในธรรมชาติทั้งในภาวะอิสระ และในภาวะรวมตัวเป็นสารประกอบกับสารอื่น มี ๒ ชนิด ชนิดหนึ่งหลอมละลายที่ ๔๒ ^ºซ. อีกชนิดหนึ่งหลอมละลายที่ ๑๓๓ ^ºซ. โดยทั่วไปหมายถึงชนิดหลัง ใช้ประโยชน์ในอุตสาหกรรมเครื่องหอม.
ซินแส 0,น.,"หมอ, ครู, จีนแส ก็ว่า."
ซิบ 0,ว.,อาการที่เลือดไหลออกน้อย ๆ.
ซิบ ๆ 0,ว.,อาการที่เลือดไหลออกน้อย ๆ.
ซิบซับ 0,ก.,"พูดซุบซิบ, พูดกระซิบ."
ซิป 0,น.,เครื่องรูดปิดให้ริมผ้าหรือวัสดุ ๒ ชิ้นประสานกัน ประกอบด้วยฟันเล็ก ๆ ๒ แถว มีที่จับเพื่อรูดให้ฟันยึดกันหรือแยกออกจากกันได้.
ซิฟิลิส 0,น.,กามโรคชนิดหนึ่ง เกิดจากเชื้อแบคทีเรียชื่อ Treponema pallidum ติดต่อโดยการสัมผัสหรือร่วมประเวณีกับผู้ป่วยที่เป็นโรคนี้.
ซิลิคอน 0,น.,ธาตุลำดับที่ ๑๔ สัญลักษณ์ Si เป็นอโลหะ ลักษณะเป็นของแข็ง หลอมละลายที่ ๑๔๑๐ ^ºซ. เปลือกโลกประกอบด้วยธาตุนี้ประมาณร้อยละ ๒๕.
ซิว 0,น.,"ชื่อปลานํ้าจืดหลายสกุลในวงศ์ Cyprinidae มีขนาดเล็ก ปากเล็กเชิดขึ้น ตาโต เกล็ดโตหลุดง่าย อาศัยใกล้ผิวนํ้า เมื่อถูกจับขึ้นพ้นน้ำแล้วจะตายได้ง่าย ที่รู้จักกันทั่วไปและพบทั่วประเทศ ได้แก่ ซิวหนวดยาว ( Esomus metallicus Ahl) ซิวอ้าว อ้ายอ้าว อ้าว หรือ ซิวควาย ในสกุล Luciosoma, ซิวใบไผ่ ในสกุล Danio, ซิวหัวตะกั่ว ในสกุล Chela และ ซิว ในสกุล Rasbora"
ซิว 1,น.,เรียกหางปลาที่มีลักษณะตีบเหมือนปลาซิวว่า หางปลาซิว
ซิว 2,น.,เรียกคนที่ใจเสาะ ไม่สู้หรือไม่อดทน ว่า ใจปลาซิว.
ซี 0,*ว.,"คำประกอบท้ายประโยคเพื่อเสริมข้อความให้เด่น ให้ชัด เป็นต้น, โดยมากใช้กับกริยาเป็นเชิงบังคับ เชิงชวน หรือรับคำเป็นต้น เช่น ไปซิ มาซิ ไปซิ่ มาซิ่ ไปซี มาซี, สิ ก็ว่า."
ซี่ 0,น.,"คำเรียกของเล็ก ๆ ยาว ๆ ที่เรียงกันเป็นแถวเป็นแนวอย่างฟันหรือลูกกรง, ลักษณนามเรียกของเช่นนั้น เช่น ฟันซี่หนึ่ง ฟัน ๒ ซี่."
ซีก 0,น.,"ส่วนที่ผ่าครึ่ง, ส่วนของสิ่งบางอย่างเช่นไม้ไผ่หรือแตงโมที่ผ่าออกโดยปรกติตามยาว, โดยปริยายหมายความว่า ด้าน, ส่วน, เช่น ร่างกายตายไปซีกหนึ่ง ปลาทูซีกนี้"
ซีก 1,น.,ลักษณนามเรียกส่วนที่แยกออกนั้น เช่น มะม่วงซีกหนึ่ง แตงโม ๒ ซีก
ซีก 2,น.,ใช้สำหรับมาตราเงินโบราณเท่ากับครึ่งเฟื้อง.
ซีกเดียว 0,น.,ชื่อปลาในอันดับ Pleuronectiformes มีหลายชนิด หลายสกุล พบทั้งในทะเล นํ้ากร่อย และนํ้าจืด เมื่อเกิดใหม่ตาจะอยู่คนละข้างกันเหมือนลูกปลาทั่วไป แต่เมื่อเจริญเติบโตขึ้นกะโหลกจะบิดไปข้างใดข้างหนึ่ง เป็นผลให้กล้ามเนื้อข้างหนึ่งบิดตามไปด้วย จึงทำให้ตาทั้ง ๒ ข้างเหนี่ยวกันมาหรือเคลื่อนมาอยู่ด้านเดียวกัน มีชื่อเรียกต่าง ๆ กัน เช่น ลิ้นหมา ลิ้นสุนัข ยอดม่วง ลิ้นควาย ลิ้นเสือ ลิ้นหมาหงอนยาว ใบไม้ ใบขนุน ซีกเดียว จักรผาน.
ซี่โครง 0,น.,กระดูกโครงอกลักษณะเป็นท่อนแบนยาวและโค้ง เรียงเป็นคู่ ๆ ลงมา ๑๒ คู่ ส่วนโคนติดกับด้านข้างของกระดูกสันหลังแต่ละข้อ ส่วนปลาย ๑๐ คู่ ติดกับด้านข้างของกระดูกหน้าอก.
ซี้ซอน 0,ว.,"ซอกซอน, ลี้ลับ."
ซีเซียม 0,น.,ธาตุลำดับที่ ๕๕ สัญลักษณ์ Cs เป็นโลหะสีเงิน ไวต่อปฏิกิริยาเคมีมาก หลอมละลายที่ ๒๘.๗ ^ºซ.
ซีด 0,ว.,"ไม่สดใสเพราะสีจางไป เช่น รูปนี้สีซีด, ไม่มีเลือดฝาด เช่น มือซีด ปากซีด, ขาวอย่างไม่มีเลือดฝาด เรียกว่า ขาวซีด."
ซี้ด 0,ว.,เสียงอย่างเสียงสูดปากเช่นกินอาหารเผ็ดเป็นต้น.
ซีดเซียว 0,ว.,"ไม่แจ่มใส, ไม่สดชื่น"
ซีดเซียว 1,ว.,ไม่มีเลือดฝาด.
ซีนอน 0,น.,ธาตุลำดับที่ ๕๔ สัญลักษณ์ Xe เป็นแก๊สเฉื่อย มีปรากฏเพียง ๐.๐๐๖ ใน ๑ ล้านส่วนในบรรยากาศ.
ซีป่าย 0,น.,ชื่อกองทหารแบบอังกฤษกองหนึ่งในรัชกาลที่ ๔ เอาแบบมาจากทหารซีปอยของกองทัพอังกฤษในอินเดีย.
ซีเมนต์ 0,น.,วัสดุใช้ในการก่อสร้างชนิดหนึ่ง ลักษณะเป็นผง เมื่อผสมคลุกกับนํ้าแล้วทิ้งไว้จะเกิดปฏิกิริยาเคมีเป็นผลให้เกิดการก่อตัวและแข็งตัวได้ องค์ประกอบเคมีที่สำคัญของซีเมนต์ คือ แคลเซียมซิลิเกต แคลเซียมอะลูมิเนต และแคลเซียมอะลูมิโนเฟอร์ไรต์ ใช้ประโยชน์เพื่อทำคอนกรีต ปูนฉาบ หรือ ปูนก่อเป็นต้น เรียกว่า ปูนซีเมนต์.
ซีเรียม 0,น.,ธาตุลำดับที่ ๕๘ สัญลักษณ์ Ce เป็นโลหะสีเทา เนื้ออ่อน หลอมละลายที่ ๘๐๔ ^ºซ.
ซีลีเนียม 0,น.,ธาตุลำดับที่ ๓๔ สัญลักษณ์ Se เป็นอโลหะ มีสมบัติทางเคมีคล้ายกับธาตุกำมะถัน ลักษณะเป็นของแข็ง หลอมละลายที่ ๒๑๗ ^ºซ. ใช้ประโยชน์ทำเซลล์ไฟฟ้าชนิดที่ใช้พลังงานแสง.
ซีอิ๊ว 0,น.,"เครื่องปรุงรสอย่างน้ำปลา ทำด้วยถั่วเหลืองหมัก, น้ำปลาถั่วเหลือง ก็เรียก, อย่างใสเรียกว่า ซีอิ๊วขาว, อย่างข้นมีรสเค็มเรียกว่า ซีอิ๊วดำ, ถ้าใส่น้ำตาลทรายแดง เรียกว่า ซีอิ๊วหวาน."
ซึก 0,น.,"ชื่อไม้ต้นชนิด Albizia lebbeck (L.) Benth. ในวงศ์ Leguminosae ดอก (เกสร) อ่อนมีสีเขียวและขาว เมื่อดอก (เกสร) แก่เปลี่ยนเป็นสีเหลือง ใกล้โรยเปลี่ยนเป็นสีเหลืองอมแสด ฝักแบนยาวกว้าง ฝักอ่อนสีเขียว เมื่อแก่สีนํ้าตาลอ่อน ไม่มีรส, พฤกษ์ ซึก หรือ ซิก ก็เรียก, มักเรียกต้นก้ามปูหรือต้นจามจุรีแดง [ Samanea saman (Jacq.) Merr.] ซึ่งเป็นไม้ต่างชนิดกันว่า ต้นจามจุรี."
ซึก 1,ว.,"แทรกอยู่, ซึ้งเข้าไป."
ซึง 0,น.,เครื่องดนตรีประเภทเครื่องดีดของไทยภาคเหนือ ตัวเป็นโพรง รูปกลมแบน เจาะรูตรงกลางเพื่อให้เกิดเสียงก้อง มีคันต่อจากตัวซึงขึ้นไปยาวประมาณ ๖๐ เซนติเมตร มีสายดีด ๒ คู่.
ซึ่ง 0,ส.,คำใช้แทนนามหรือข้อความที่อยู่ข้างหน้า เช่น บ้านของเขาอยู่ในป่าซึ่งห่างจากชุมชน.
ซึ่ง 1,บ.,คำสำหรับนำหน้านามที่เป็นผู้ถูกกระทำ เช่น รักษาไว้ซึ่งความยุติธรรม.
ซึ้ง 0,น.,"ภาชนะสำหรับนึ่งของ ทำด้วยโลหะมีลักษณะทรงกระบอกเตี้ย ๆ ซ้อนกันเป็นชั้น ๆ ๒-๓ ชั้น ชั้นล่างใส่น้ำสำหรับต้มให้มีไอน้ำร้อน ชั้นที่ซ้อนข้างบนเจาะเป็นรู ๆ ที่ก้น เพื่อให้ไอน้ำร้อนผ่านให้ของในชั้นที่ซ้อนสุก มีฝาครอบคล้ายฝาชี, ลังถึง หรือ ถึง ก็ว่า."
ซึ้ง 1,ว.,รู้สึกเอิบอาบซาบซ่านแผ่ไปทั่วร่างกายและจิตใจ เช่น ภาพนี้มองดูซึ้ง ฟังเขาพูดแล้วรู้สึกซึ้งมาก.
ซึ้ง 2,ว.,"ลึก เช่น น้ำลึกพานเชี่ยวซึ้ง สุดพาย (โลกนิติ), เขียนเป็น ซรึ้ง ก็มี เช่น คูคอบสามชั้นซรึ้ง ขวากแขวง (ยวนพ่าย)."
ซึ่ง ๆ หน้า 0,ว.,ต่อหน้า เช่น กระทำความผิดซึ่งหน้า.
ซึ่งหน้า 0,ว.,ต่อหน้า เช่น กระทำความผิดซึ่งหน้า.
ซึม 0,ก.,"กิริยาของนํ้าหรือของเหลวที่ไหลไปตามรูเล็ก ๆ อย่างช้า ๆ เช่น เหงื่อซึม นํ้าซึม ปากกาหมึกซึม, โดยปริยายหมายถึงกิริยาที่คล้ายคลึงเช่นนั้น เช่น ยางรถซึม."
ซึม 1,ว.,"เหงาหงอยไม่ค่อยพูดจา, ไม่เบิกบาน, เช่น นั่งซึม."
ซึมกะทือ 0,ว.,ซึมเซา ง่วงเหงา หรือเกียจคร้าน.
ซึมซาบ 0,ก.,เอิบอาบเข้าไปทั่วถึง.
ซึมเซา 0,ว.,มีลักษณะเหงาหงอยง่วงซึมไม่กระปรี้กระเปร่า เช่น วันนี้รู้สึกซึมเซาไม่อยากทำงานเลย.
ซึมทราบ 0,ก.,รู้ละเอียด.
ซึมเศร้า 0,ว.,"อาการที่รู้สึกเศร้าหมอง ว้าเหว่ หรือสิ้นหวัง, เศร้าซึม ก็ว่า"
ซึมเศร้า 1,ว.,อาการที่มีอารมณ์เศร้า หดหู่ ว้าเหว่ ซึม มีความรู้สึกท้อถอย สิ้นหวัง เป็นต้น.
ซื่อ 0,ว.,"ตรง เช่น คนซื่อ, ไม่มีเล่ห์เหลี่ยม เช่น พูดซื่อ ๆ, ไม่คดโกง เช่น หน้าซื่อ"
ซื่อ 1,ว.,"นิ่งเฉยอยู่ไม่กระดุกกระดิกเหมือนสิ่งไม่มีชีวิต เช่น แข็งซื่อ, ทื่อ ก็ว่า."
ซื้อ 0,ก.,เอาเงินตราแลกกับสิ่งของ.
ซื่อ ๆ 0,ว.,"ตรง เช่น คนซื่อ, ไม่มีเล่ห์เหลี่ยม เช่น พูดซื่อ ๆ, ไม่คดโกง เช่น หน้าซื่อ"
ซื่อ ๆ 1,ว.,"นิ่งเฉยอยู่ไม่กระดุกกระดิกเหมือนสิ่งไม่มีชีวิต เช่น แข็งซื่อ, ทื่อ ก็ว่า."
ซื้อขาย 0,น.,ชื่อสัญญาซึ่งบุคคลฝ่ายหนึ่ง เรียกว่า ผู้ขาย โอนกรรมสิทธิ์แห่งทรัพย์สินให้แก่บุคคลอีกฝ่ายหนึ่ง เรียกว่า ผู้ซื้อ และผู้ซื้อตกลงจะใช้ราคาทรัพย์สินนั้นให้แก่ผู้ขาย.
ซื้อควายหน้านาซื้อผ้าหน้าตรุษ 0,ก.,"ซื้อของไม่คำนึงถึงกาลเวลา ย่อมได้ของแพง, ทำอะไรไม่เหมาะกับกาลเวลา ย่อมได้รับความเดือดร้อน."
ซื้องัวหน้านา ซื้อผ้าหน้าหนาว 0,ก.,"ซื้อของไม่คำนึงถึงกาลเวลา ย่อมได้ของแพง, ทำอะไรไม่เหมาะกับกาลเวลา ย่อมได้รับความเดือดร้อน."
ซื่อตรง 0,ก.,"ประพฤติตรงไม่เอนเอียง เช่น ซื่อตรงต่อหน้าที่, ไม่คดโกง เช่น เขาเป็นคนซื่อตรง."
