ฟ้าเคืองสันหลัง 0,น.,เคราะห์กรรมหรือโทษทัณฑ์ร้ายแรงที่เกิดจากอำนาจเบื้องบนหรือผู้ปกครอง เช่น ต่อฟ้าเคืองสันหลังจึงรำพัน (ขุนช้างขุนแผน).
ฟ่าง 0,น.,ข้าวฟ่าง. (ดู ข้าวฟ่าง ที่ ข้าว).
ฟาง 0,น.,ต้นข้าวที่เกี่ยว นวด หรือฟาดเอาเมล็ดออกแล้ว.
ฟาง 1,น.,"ฟันที่เข้าใจว่าขึ้นแทนฟันแท้ที่หักไป, มักใช้เข้าคู่กับคำ ฟัน เป็น ฟันฟาง."
ฟาง 2,ว.,"เห็นไม่ถนัด, ทำให้เห็นไม่ถนัด, เช่น ตาฟาง."
ฟางลอย 0,น.,"นาป่าที่เจ้าของได้เสียค่านาตามเนื้อที่ที่ได้ปลูกข้าว เรียกว่า นาฟางลอย, ผิดกับนาคู่โค ซึ่งต้องเสียค่านาเต็มตามโฉนด."
ฟาด 0,ก.,"หวด, เหวี่ยง, เช่น ฟาดด้วยไม้เรียว ฟาดผ้า จระเข้ฟาดหาง"
ฟาด 1,ก.,กินอย่างเต็มที่ เช่น ฟาดข้าวเสีย ๓ ชาม.
ฟาดเคราะห์ 0,ก.,"ทำพิธีปัดสิ่งชั่วร้ายให้ไปจากตัว, สละสิ่งใดสิ่งหนึ่งเพื่อให้เคราะห์สูญหายไป"
ฟาดเคราะห์ 1,ก.,ตัดใจยอมเสียสิ่งใดสิ่งหนึ่งไปเพื่อให้หมดเคราะห์ หรือตัดใจคิดว่าสิ่งที่เสียไปแล้วเป็นการทำให้หมดเคราะห์ ในความเช่น นึกว่าฟาดเคราะห์.
ฟาดหัว 0,ก.,"ให้เพื่อตัดความรำคาญเป็นต้น, ให้เพราะดูถูก, เช่น เอาเงินฟาดหัวไป."
ฟาดหัวฟาดหาง 0,ก.,อาละวาด.
ฟาทอม 0,น.,มาตราวัดระยะทาง เท่ากับ ๖ ฟุต หรือ ๑.๘ เมตร มักนิยมใช้วัดความลึกของทะเล.
ฟาน 0,น.,ชื่อกวางในสกุล Muntiacusวงศ์ Cervidae เป็นกวางขนาดเล็ก ขนสีนํ้าตาลอมเหลืองจนถึงนํ้าตาลเข้ม หน้าผากเป็นสันเห็นได้ชัดเจน ตัวผู้มีเขาและเขี้ยว ในประเทศไทยมี ๒ ชนิด คือ อีเก้งหรือฟาน [ M. muntjak (Zimmermann)] และเก้งหม้อ เก้งดำ ฟานดำ หรือกวางจุก [ M. Feae (Tomas & Doria)] ตัวโตกว่าชนิดแรก ขนสีนํ้าตาลแก่เกือบดำ หัวมีขนลักษณะคล้ายจุกสีเหลืองแซมดำ.
ฟานดำ 0,น.,ชื่อกวางในสกุล Muntiacusวงศ์ Cervidae เป็นกวางขนาดเล็ก ขนสีนํ้าตาลอมเหลืองจนถึงนํ้าตาลเข้ม หน้าผากเป็นสันเห็นได้ชัดเจน ตัวผู้มีเขาและเขี้ยว ในประเทศไทยมี ๒ ชนิด คือ อีเก้งหรือฟาน [ M. muntjak (Zimmermann)] และเก้งหม้อ เก้งดำ ฟานดำ หรือกวางจุก [ M. Feae (Tomas & Doria)] ตัวโตกว่าชนิดแรก ขนสีนํ้าตาลแก่เกือบดำ หัวมีขนลักษณะคล้ายจุกสีเหลืองแซมดำ.
ฟ้าผ่า 0,น.,ปรากฏการณ์ที่เกิดขึ้นเนื่องจากอิเล็กตรอนจำนวนมากเคลื่อนที่ระหว่างเมฆกับพื้นโลก เกิดพลังงานสูงมากจนสามารถทำลายสิ่งที่กีดขวาง เช่น คน สัตว์ ต้นไม้ บ้านเรือน
ฟ้าผ่า 1,น.,โดยปริยายหมายความว่า คำสั่งด่วนที่ออกมาโดยไม่คาดหมายและไม่รู้เหตุผล.
ฟ้าฝ่อ 0,น.,"พระพ่อ, ผู้เป็นใหญ่, เจ้าเมือง."
ฟ่าม 0,ว.,"ฟุ, ไม่แน่นเพราะแก่เกินกำหนด, (มักใช้แก่ผลไม้) เช่น ส้มเนื้อฟ่าม."
ฟ้ามุ่ย 0,น.,"ชื่อกล้วยไม้ชนิด Vanda coerulea Griff. ในวงศ์ Orchidaceae ดอกสีฟ้าอมม่วง กลิ่นหอมอ่อน, เอื้องฟ้ามุ่ย ก็เรียก."
ฟ้าไม่กระเทือนสันหลัง 0,น.,อำนาจเบื้องบนหรือผู้ปกครองยังไม่ลงโทษทัณฑ์ ใช้ในสำนวนว่า ถ้าฟ้าไม่กระเทือนสันหลังก็ยังไม่รู้สึก.
ฟาย 0,ก.,เอาอุ้งมือตัก.
ฟายน้ำตา 0,ก.,เอามือเช็ดน้ำตาที่อาบหน้าอยู่.
ฟายมือ 0,ว.,"เต็มอุ้งมือ, เรียกของที่เต็มฝ่ามือที่ห่อเข้า ว่า ฟายมือหนึ่ง."
ฟายมือ 1,น.,ชื่อมาตราตวง ๘ ฟายมือ เป็น ๑ ทะนาน.
ฟาร์ม 0,น.,อาณาบริเวณที่ใช้ทำการเกษตรกรรม มีเพาะปลูก เลี้ยงสัตว์ เช่น ทำฟาร์มปลูกข้าวโพดข้าวฟ่าง เลี้ยงไก่เลี้ยงปลาเป็นต้น.
ฟ้าร้อง 0,น.,เสียงที่เกิดขึ้นเนื่องจากอากาศขยายตัวเคลื่อนที่อย่างรวดเร็วเพราะความร้อนที่เกิดจากฟ้าแลบ.
ฟ้าแลบ 0,น.,แสงที่เกิดวาบขึ้นในท้องฟ้าลักษณะเป็นเส้นหรือแผ่น เกิดขึ้นเนื่องจากอิเล็กตรอนจำนวนมากเคลื่อนที่ผ่านอากาศเป็นเหตุให้เกิดความร้อนสูงมากจนปรากฏเป็นแสงสว่างวาบขึ้น.
ฟาสซิสต์ 0,น.,"ลัทธิการเมืองที่ผู้นำรวบอำนาจทั้งทางการเมือง เศรษฐกิจ และสังคมไว้หมด และมีนโยบายชาตินิยมอย่างรุนแรง แต่เคารพในกรรมสิทธิ์ของเอกชน, ผู้ที่นิยมลัทธินั้น."
ฟาสซิสต์ 1,ว.,เกี่ยวกับลัทธิฟาสซิสต์.
ฟ้าหลัว 0,น.,อากาศมัวเนื่องจากในอากาศขณะนั้นมีอนุภาคที่มองไม่เห็น เช่น เกลือจากทะเล ควันไฟ ฝุ่นละอองปะปนอยู่เป็นจำนวนมาก.
ฟิด 0,ว.,เสียงอย่างเสียงจาม.
ฟิต 0,ว.,คับจนรัดรูป เช่น เสื้อฟิต กางเกงฟิต
ฟิต 1,ว.,"แข็งแรง, กระปรี้กระเปร่า, เช่น ร่างกายกำลังฟิต. (อ. fit)."
ฟิต 2,ก.,ฝึกซ้อม เช่น ฟิตเต็มที่.
ฟิตเครื่อง 0,ก.,"ปรับเครื่องยนต์ให้กระชับหรืออยู่ในสภาพปรกติ, เรียกช่างแก้เครื่องยนต์ว่า ช่างฟิต."
ฟิบ 0,ว.,อาการที่ปลายจมูกแฟบลงเล็กน้อย.
ฟิล์ม 0,น.,แผ่นวัตถุบางประเภทพลาสติกชนิดหนึ่ง ฉาบผิวด้วยสารเคมีที่ไวต่อแสง ใช้สำหรับถ่ายรูป ถ่ายภาพยนตร์.
ฟิวส์ 0,น.,อุปกรณ์ไฟฟ้าชนิดหนึ่ง ลักษณะเป็นโลหะเจือที่มีขีดหลอมตัวตํ่า เช่น โลหะดีบุกเจือตะกั่ว ใช้ต่อเข้ากับวงจรไฟฟ้าเพื่อป้องกันมิให้กระแสไฟฟ้าที่มีขนาดเกินกำหนดเคลื่อนที่เข้าวงจรไฟฟ้าได้.
ฟิสิกส์ 0,น.,วิทยาศาสตร์กายภาพแขนงหนึ่งซึ่งกล่าวถึงสมบัติทางกายภาพของสารต่าง ๆ และพลังงาน.
ฟี่ 0,ว.,เสียงอย่างเสียงลมรั่วออกจากที่อัดลมไว้ เช่น เสียงปล่อยลมดังฟี้ นอนกรนฟี้.
ฟี้ 0,ว.,เสียงอย่างเสียงลมรั่วออกจากที่อัดลมไว้ เช่น เสียงปล่อยลมดังฟี้ นอนกรนฟี้.
ฟีก 0,ก.,แฝง
ฟีก 1,ก.,อิง
ฟีก 2,ก.,หลีก.
ฟืดฟาด 0,ว.,"เสียงอย่างเสียงหายใจแรง ๆ เวลาเหนื่อยมาก ๆ, ฟูดฟาด ก็ว่า."
ฟืน 0,น.,"ไม้สำหรับใช้เป็นเชื้อไฟ, ลักษณนามเรียกตามลักษณะ เช่น ดุ้น อัน ท่อน ชิ้น."
ฟื้น 0,ก.,"กลับคืนมาใหม่ เช่น ฟื้นความทรงจำ ฟื้นสติ, คืนความรู้สึก เช่น ฟื้นจากสลบ, พลิกกลับขึ้นมา เช่น ฟื้นดิน"
ฟื้น 1,ก.,ถอนขึ้น เช่น ฟื้นมัน.
ฟื้นไข้ 0,ก.,"หายไข้ใหม่ ๆ, เพิ่งจะหายไข้."
ฟื้นตัว 0,ก.,กลับมีฐานะดีขึ้น.
ฟื้นฝอย 0,ก.,"คุ้ยเขี่ยหาความที่ควรจะสงบแล้วให้กลับเกิดเป็นเรื่องขึ้นมาอีก, มักใช้ว่า ฟื้นฝอยหาตะเข็บ."
ฟื้นฟู 0,ก.,ทำให้กลับเจริญงอกงามขึ้นมาใหม่ เช่น ฟื้นฟูศิลป-วัฒนธรรมไทย ฟื้นฟูการละเล่นของไทย.
ฟื้นองค์ 0,ก.,ตื่น (ใช้แก่พระมหากษัตริย์).
ฟืม 0,น.,อุปกรณ์ชิ้นหนึ่งของกี่ทอผ้า มีฟันเป็นซี่ ๆ คล้ายหวี สำหรับสอดเส้นด้ายหรือไหมใช้กระทกเส้นพุ่งให้แน่น.
ฟุ 0,ว.,"ฉุ, น่วม ๆ, ไม่แน่น, เช่น แอปเปิลเนื้อฟุ ขนมถ้วยฟู (แบบจีน) เนื้อฟุ."
ฟุ ๆ 0,ว.,"ฉุ, น่วม ๆ, ไม่แน่น, เช่น แอปเปิลเนื้อฟุ ขนมถ้วยฟู (แบบจีน) เนื้อฟุ."
ฟุ้ง 0,ก.,"ตลบไป เช่น หอมฟุ้ง กลิ่นฟุ้ง, ปลิวไป, กระจายไป, เช่น ฝุ่นฟุ้ง."
ฟุ้ง 1,ว.,มากเกินควร (ใช้แก่กริยาคุย) เช่น คุยฟุ้ง.
ฟุ้งซ่าน 0,ก.,"ไม่สงบ, พล่านไป, ส่ายไป, (ใช้แก่จิต)."
ฟุ้งเฟ้อ 0,ว.,"คะนอง, ได้ใจ, เห่อเหิม"
ฟุ้งเฟ้อ 1,ว.,"ใช้จ่ายเกินควรเกินฐานะ, ใช้จ่ายในสิ่งที่ไม่สมควร."
ฟุ้งเฟื่อง 0,ก.,"ขจรไป, แพร่หลาย, (ใช้แก่เกียรติคุณ), เฟื่องฟุ้ง ก็ว่า."
ฟุ้งเฟื่อง 1,ว.,"เชี่ยวชาญ, ชำนิชำนาญ, (ใช้แก่สติปัญญา), เฟื่องฟุ้ง ก็ว่า."
ฟุต 0,น.,มาตราวัดของอังกฤษ ๑ ฟุต เท่ากับ ๑๒ นิ้ว.
ฟุตบอล 0,น.,"ชื่อกีฬาชนิดหนึ่ง แบ่งผู้เล่นเป็น ๒ ฝ่าย ฝ่ายละ ๑๑ คน รวมทั้งผู้รักษาประตู ผู้เล่นแต่ละฝ่ายต้องเตะลูกบอลให้เข้าประตูของฝ่ายตรงข้าม ฝ่ายที่ได้ประตูมากกว่าจะเป็นฝ่ายชนะ, เรียกลูกกลมทำด้วยวัสดุต่าง ๆ เช่น หนัง ยาง พลาสติก ภายในมีลมอัด ใช้ในการเล่นฟุตบอล ว่า ลูกฟุตบอล."
ฟุน 0,ก.,"ลุกฮือ (ใช้แก่ไฟ), โกรธเป็นไฟ, มักใช้เข้าคู่กับคำ ไฟ เป็น ฟุนไฟ หรือ ไฟฟุน."
ฟุบ 0,ก.,"หมอบลง, ยอบลง, เช่น ฟุบตัวลงกราบ เป็นลมฟุบไป, ยุบลงอย่างจมูกยุบ"
ฟุบ 1,ก.,"ลักษณะที่ปริมาณเงินหมุนเวียนในประเทศมีน้อย ทำให้สินค้าราคาตก เรียกว่า เงินฟุบ, ตรงข้ามกับ เงินเฟ้อ."
ฟุ่บ 0,ว.,เสียงดังอย่างเสียงดินปืนที่จุดแล้วลุกไหม้ทันทีทันใด.
ฟุฟะ 0,ว.,"ไม่แน่น, พอง ๆ เช่น เสื้อติดระบายฟุฟะ."
ฟุ่มเฟือย 0,ว.,"สุรุ่ยสุร่าย, ใช้จ่ายโดยไม่คำนึงถึงความสิ้นเปลือง, เกินความจำเป็น เช่น ใช้ถ้อยคำฟุ่มเฟือย."
ฟุลสแก๊ป 0,น.,กระดาษสีขาว มีเส้นบรรทัด ขนาดประมาณ ๔๓ x ๓๔ เซนติเมตร พับทบกลางใช้สำหรับเขียนหนังสือเป็นต้น.
ฟู 0,ก.,"พองตัวขึ้น, ขยายตัวนูนขึ้น, เช่น ขนมสาลี่ฟูมาก ปลาดุกฟู, อูดขึ้น เช่น แป้งหมักฟูขึ้น, พองโป่งขึ้นมา เช่น ผมฟู ปุยนุ่นฟู สุนัขขนฟู."
ฟู่ 0,ว.,เสียงดังเช่นนั้น.
ฟู่ 1,น.,เรียกเตาที่ใช้สูบลมพ่นน้ำมันให้ขึ้นไปถูกไฟลุกเป็นเปลว ว่า เตาฟู่.
ฟูก 0,น.,ที่นอนที่ยัดด้วยนุ่นเป็นต้น มักทำเป็นลูกฟูก.
ฟูด 0,ก.,"อูดขึ้น, ล้นขึ้น."
ฟูด 1,ว.,เสียงดังเช่นนั้น.
ฟูดฟาด 0,ว.,"เสียงอย่างเสียงหายใจแรง ๆ เวลาเหนื่อยมาก ๆ, ฟืดฟาด ก็ว่า."
ฟูฟ่อง 0,ก.,"กระเตื้องขึ้น, ดีขึ้น, เจริญขึ้น, ฟุ้งกระจายไปด้วยความดี, ฟ่องฟู ก็ว่า."
ฟูเฟื่อง 0,ว.,"เจริญ, มั่งคั่ง, รุ่งเรือง, เฟื่องฟู ก็ว่า."
ฟูม 0,ว.,"อาบ, โซม, ท่วม, อูม"
ฟูม 1,ว.,"เฟ้อ, มาก เช่น น้ำลายฟูมปาก."
ฟูมน้ำ 0,ก.,ลุยนํ้า.
ฟูมฟัก 0,ก.,"ทะนุถนอม, ประคับประคอง, เช่น พ่อแม่ฟูมฟักลูก, ฟักฟูม ก็ว่า."
ฟูมฟาย 0,ก.,"ทำฟองให้มาก, เล่นฟองนํ้า."
ฟูมฟาย 1,ว.,อาการที่มีนํ้าตานองหน้า เช่น ร้องไห้ฟูมฟาย
ฟูมฟาย 2,ว.,"มากมาย, ล้นเหลือ, สุรุ่ยสุร่าย เช่น ใช้เงินฟูมฟาย คือ จับจ่ายใช้สอยเกินสมควร."
ฟูมฟายน้ำตา 0,ก.,เอามือทั้ง ๒ ข้างเช็ดน้ำตาที่ไหลอาบหน้าเพราะความเศร้าโศกเสียใจอย่างหนัก.
ฟูมเลี้ยง 0,ก.,ดูแลรักษา.
เฟ็ด 0,ว.,"แฟบ, หด, สั้น, ถลกขึ้นสูง (ใช้แก่ผ้านุ่ง)"
เฟ็ด 1,ว.,"เล็ด เช่น พระพรุณรายเรื่อฟ้า เฟ็ดโพยม (ทวาทศมาส), ลวงแส้งเฟ็ดไพ่อ้อม เอาชัย (ยวนพ่าย)."
เฟ้น 0,ก.,"คัดเอาแต่ที่ดี, คัดเอาแต่ที่ต้องการ, เลือกเฟ้น ก็ว่า."
เฟ้น 1,ก.,"บีบนวด, นวดเฟ้น ก็ว่า."
เฟลด์สปาร์ 0,น.,"ชื่อแร่ประกอบหินชนิดหนึ่ง มีหลายสี ส่วนมากมักมีสีขาวขุ่นคล้ายฟันม้า, ชาวบ้านมักเรียกกันว่า หินฟันม้า."
เฟ้อ 0,ก.,"ฟุ้ง, ฟุ้งซ่าน, เหลิง"
เฟ้อ 1,ก.,"อืดขึ้น, พองขึ้น."
เฟ้อ 2,ว.,"มากเกินควร, มากเกินไป, เช่น คะแนนเฟ้อ"
เฟ้อ 3,ว.,เรียกอาการที่ลมในกระเพาะตีขึ้นเพราะอาหารไม่ย่อยและเป็นพิษว่า ท้องเฟ้อ
เฟ้อ 4,ว.,เรียกภาวะทางเศรษฐกิจที่ปริมาณเงินหมุนเวียนในประเทศมากเกินไป ทำให้ราคาสินค้าแพงและเงินเสื่อมค่า ว่า เงินเฟ้อ.
เฟอร์เมียม 0,น.,ธาตุลำดับที่ ๑๐๐ สัญลักษณ์ Fm เป็นธาตุกัมมันตรังสีที่นักวิทยาศาสตร์สร้างขึ้น ไม่มีปรากฏในธรรมชาติ.
เฟอะ 0,ว.,เลอะ เช่น แผลมีหนองเฟอะ.
เฟอะฟะ 0,ว.,เลอะเทอะ เช่น น้ำเหลืองไหลเฟอะฟะ
เฟอะฟะ 1,ว.,ไม่เข้าท่า เช่น แต่งตัวเฟอะฟะ.
เฟะ 0,ว.,"เละ, เปื่อยหรือแหลกเหลวจนไม่เป็นรูปเป็นร่าง, เช่น เน่าเฟะ."
เฟะฟะ 0,ว.,เละละ.
เฟิน 0,น.,"ชื่อพืชไร้ดอกพวกผักกูด (Pteridophytes), ใช้ว่า เฟิร์น ก็มี."
เฟี้ยม 0,น.,ฝาที่ทำเป็นบาน ๆ พับได้.
เฟี้ยม 1,ก.,"ปิด, กั้น, บัง."
เฟี้ยมเฝ้า 0,ก.,เฝ้าโดยก้มหน้า.
เฟี้ยว 0,ว.,อาการที่แสดงหรือทำผาดโผนให้เป็นที่สะดุดตาผู้อื่น เช่น แต่งตัวเฟี้ยว ขับรถเฟี้ยว.
เฟือ 0,ก.,"เหลือมาก, มักใช้ประกอบกับคำ เหลือ เป็น เหลือเฟือ."
เฟื่อ 0,ก.,เกื้อกูล เช่น ช่วยเหนือเฟื่อกู้มัน (จารึกสยาม).
เฟื้อ 0,ก.,เกื้อกูล.
เฟื้อ 1,ก.,"ชื่อไม้ล้มลุกชนิด Typha angustifolia L. ในวงศ์ Typhaceae ขึ้นในนํ้า ช่อดอกคล้ายธูปขนาดใหญ่, กกธูป ธูปฤๅษี ปรือ หรือ เฟื้อ ก็เรียก."
เฟือง 0,น.,มะเฟือง
เฟือง 1,น.,"พู, เหลี่ยม, เช่น เฟืองมะยม"
เฟือง 2,น.,ล้อที่มีฟันเพื่อให้ประสานกับฟันของล้อตัวอื่นเป็นต้น.
เฟื้อง 0,น.,"มาตราเงินตามวิธีประเพณี ๘ อัฐ เท่ากับ ๑ เฟื้อง, เขียนตามวิธีโบราณดังนี้ หมายความว่า ๑ เฟื้อง."
เฟื่อง 0,น.,เครื่องประดับอย่างหนึ่ง ทำเป็นสายห้อยโยงเป็นช่วง ๆ มีอุบะห้อยระหว่างเฟื่อง
เฟื่อง 1,น.,เรียกโรคที่มีเสมหะกำเริบ ว่า เสมหะเฟื่อง.
เฟื่อง 2,ก.,"เจริญรุ่งเรือง, รุ่งโรจน์, มีชื่อเสียงโด่งดัง, เช่น เขากำลังเฟื่อง ความคิดเฟื่อง ชื่อเสียงเฟื่อง"
เฟื่อง 3,ก.,"คล่องแคล่ว, แม่นยำ, เช่น จบปริญญาเอกมาใหม่ ๆ ความรู้กำลังเฟื่อง."
เฟื่องฟ้า 0,น.,ชื่อไม้พุ่มรอเลื้อยชนิด Bougainvillea spectabilis Willd. ในวงศ์ Nyctaginaceae ดอกสีต่าง ๆ เช่น แดง เหลือง ชมพู ปลูกเป็นไม้ประดับ.
เฟื่องฟุ้ง 0,ก.,"ขจรไป, แพร่หลาย, (ใช้แก่เกียรติคุณ), ฟุ้งเฟื่อง ก็ว่า."
