ทุนสำรองเงินตรา 0,น.,กองทุนสินทรัพย์ที่ธนาคารแห่งประเทศไทยรักษาไว้ เพื่อดำรงไว้ซึ่งเสถียรภาพของเงินตรา.
ทุนหมุนเวียน 0,น.,ทุนที่ตั้งขึ้นเพื่อกิจการซึ่งอนุญาตให้นำรายรับสมทบทุนไว้ใช้จ่ายได้โดยการตั้งทุนหมุนเวียนจะทำได้ก็แต่โดยกฎหมาย.
ทุ่นอวน 0,น.,ทุ่นสำหรับผูกอวนไม่ให้จม.
ทุนิยม 0,น.,ทฤษฎีที่ถือว่า โลก ชีวิตและมนุษย์ เป็นสิ่งเลวร้ายที่สุด
ทุนิยม 1,น.,การมองโลกในแง่ร้าย.
ทุบ 0,ก.,"ใช้ของแข็งเช่นค้อนหรือสิ่งที่มีลักษณะกลม ๆ เป็นต้นตีลงไปบนสิ่งใดสิ่งหนึ่งเพื่อให้แตก เช่น ทุบมะพร้าว ทุบอิฐ ทุบหิน หรือเพื่อให้นุ่มให้แหลก เช่น ทุบเนื้อวัว ทุบเนื้อหมู หรือเพื่อให้ตาย เช่น ทุบหัวปลา, โดยปริยายหมายถึงอาการที่คล้ายคลึงเช่นนั้น เช่น เอากำปั้นทุบหลัง เอามือทุบโต๊ะ."
ทุบตี 0,ก.,ทำร้ายร่างกายด้วยการทุบ ตี เตะ ต่อย เป็นต้น.
ทุบทู 0,น.,เครื่องบังตัวป้องกันอาวุธอย่างหนึ่ง ใช้ไม้ไผ่สานขัดกันเป็นผืนย่อม ๆ คล้ายฝาขัดแตะ ยกย้ายได้.
ทุบหม้อข้าว 0,ก.,"ตัดอาชีพ, ทำลายหนทางทำมาหากิน."
ทุปปัญญา 0,น.,"ปัญญาทราม, ปัญญาทึบ."
ทุพพรรณ 0,ว.,"มีสีไม่งาม, มีผิวไม่งาม."
ทุพพล 0,ว.,"มีกำลังน้อย, อ่อนแอ, ท้อแท้, ทุรพล ก็ว่า."
ทุพพลภาพ 0,ว.,หย่อนกำลังความสามารถที่จะประกอบการงานตามปรกติได้.
ทุพภาษิต 0,น.,ชื่ออาบัติจำพวกหนึ่งในอาบัติทั้ง ๗ จัดไว้ในพวกลหุกาบัติคืออาบัติเบาที่เปรียบด้วยลหุโทษ.
ทุพภิกขภัย 0,น.,ภัยอันเกิดจากข้าวยากหมากแพงหรือการขาดแคลนอาหารในบ้านเมือง.
ทุพภิกขันดร 0,น.,ระยะเวลาที่กำหนดไว้ว่าเป็นตอนที่ขาดแคลนอาหาร เกิดขึ้นเมื่อมนุษย์มีโลภะหนา. (ป.). (ดู อันตรกัป ประกอบ).
ทุพภิกขันดรกัป 0,น.,ระยะเวลาที่กำหนดไว้ว่าเป็นตอนที่ขาดแคลนอาหาร เกิดขึ้นเมื่อมนุษย์มีโลภะหนา. (ป.). (ดู อันตรกัป ประกอบ).
ทุพภิกษา 0,น.,"การอัตคัดเสบียง, ทุรภิกษ์ ก็ว่า."
ทุม 0,น.,ต้นไม้.
ทุม- 0,น.,ต้นไม้.
ทุ่ม 0,ก.,"เอาของหนัก ๆ ทิ้งลงไป เช่น เอาก้อนหินทุ่มลงไปในนํ้า, ทิ้งทับลง, ทิ้งถมลง, โดยปริยายหมายถึงอาการที่คล้ายคลึงเช่นนั้น เช่น ทุ่มเงิน"
ทุ่ม 1,ก.,ตี เช่น กระทุ่มดั่งทุ่มกร ตีอก เรียมฤๅ (ตะเลงพ่าย).
ทุ่ม 2,น.,"วิธีนับเวลาตามประเพณีสำหรับ ๖ ชั่วโมงแรกของกลางคืน ตั้งแต่ ๑๙ นาฬิกา ถึง ๒๔ นาฬิกา เรียกว่า ๑ ทุ่ม ถึง ๖ ทุ่ม, แต่ ๖ ทุ่ม นิยมเรียกว่า สองยาม, (โบ) วิธีนับเวลาตามประเพณีสำหรับกลางคืน ตั้งแต่ ๑๙ นาฬิกา ถึง ๖ นาฬิกาของอีกวันหนึ่ง."
ทุ้ม 0,ว.,"ไม่แหลม, ตํ่าแต่มีความนุ่มนวลไม่แกร่งกร้าว, (ใช้แก่เสียง)."
ทุ่มตลาด 0,ก.,นำสินค้าจำนวนมากออกขายในราคาที่ตํ่ากว่าราคาปรกติ
ทุ่มตลาด 1,ก.,การส่งสินค้าเข้ามาในประเทศไทยเพื่อประโยชน์ในทางพาณิชย์ โดยมีราคาส่งออกที่ตํ่ากว่ามูลค่าปรกติของสินค้าชนิดเดียวกัน.
ทุ่มเถียง 0,ก.,เถียงกันรุนแรงอย่างทะเลาะ.
ทุ่มเท 0,ก.,ให้อย่างเต็มที่หรือเต็มกำลังความสามารถ เช่น ทุ่มเทเงินทอง ทุ่มเทกำลังความคิด.
ทุมโน 0,ก.,เสียใจ เช่น จะทุมโนโทมนัสน้อยใจไปไยนะน้องหญิง (ม. ร่ายยาว ชูชก).
ทุมราชา 0,น.,"พญาไม้, ชื่อต้นไม้ชนิดหนึ่งใช้ทำยาได้ ใช้ว่า ไม้โพ ก็มี."
ทุย 0,ว.,กลมรีอย่างผลมะตูม เช่น หัวทุย
ทุย 1,ว.,เรียกผลมะพร้าวที่เจริญเติบโตตามปรกติจนเปลือกแห้ง รูปรี ๆ กะลาลีบ นํ้าหนักเบาเพราะไม่มีเนื้อและนํ้า ว่า มะพร้าวทุย นิยมตัดครึ่งท่อนเพื่อทำกราดวงถูบ้านเป็นต้น
ทุย 2,ว.,คำเรียกควายที่มีเขาสั้นหรือหงิก ว่า ควายทุย.
ทุ้ย 0,ก.,"พูดเดาส่ง, พูดส่ง ๆ."
ทุร- 0,ว.,"คำประกอบหน้าคำศัพท์ หมายความว่า ชั่ว, ยาก, ลำบาก, น้อย, ไม่มี, เช่น ทุรค ว่า ที่ไปถึงยาก, ทางลำบาก."
ทุรกันดาร 0,ว.,"ที่ไปมาลำบากมาก, ที่ห่างไกลความเจริญ."
ทุรคม 0,ก.,"ไปลำบาก, ไปถึงยาก."
ทุรชน 0,น.,"ทรชน, คนชั่วร้าย."
ทุรชาติ 0,น.,ชาติชั่ว.
ทุรน 0,ก.,"เดือดร้อน, ดิ้นรน, เช่น ราชาธิราชอาณา ทั่วสีมามณฑล จะทุรนเดือดแด แปรบเห็นที่พึ่ง (นิทราชาคริต)."
ทุรนทุราย 0,ก.,"กระวนกระวาย, กระสับกระส่าย, ดิ้นรนจะให้พ้นจากทรมาน."
ทุรพล 0,ว.,"มีกำลังน้อย, อ่อนแอ, ท้อแท้, ทุพพล ก็ว่า."
ทุรภิกษ์ 0,น.,"การอัตคัดเสบียง, ทุพภิกษา ก็ว่า."
ทุรลักษณ์ 0,ว.,"ทรลักษณ์, มีลักษณะที่ถือว่าไม่ดี."
ทุรัถยา 0,น.,ทางไกล.
ทุรัศ 0,ว.,ไกล เช่น อนนอาคฤดาโดยสวัสดี แต่ทุรัศทุราไลยลิ่วลี่ ถับถึงที่สถานศาลสถิตน้นน (ม. คำหลวง ฉกษัตริย์).
ทุราคม 0,น.,"การถึงลำบาก, การอยู่ทางไกล, เช่น ต้องทนทุราคมทุเรศ ดลเขตรคิรีไกล (ดุษฎีสังเวย)."
ทุราจาร 0,น.,ความประพฤติชั่วช้าเลวทรามในที่ซึ่งไม่ควร.
ทุราธวา 0,น.,"ทางลำบาก, ทางไกลและทุรกันดาร. [ส. ทุรธฺวา, ทุรฺ- (ยาก, ลำบาก) + อธฺวนฺ (ทางไกล)]."
ทุเรศ 0,ว.,"ลักษณะที่ขัดหูขัดตา น่ารังเกียจ หรือน่าสมเพช เป็นต้น, (ปาก) คำที่เปล่งออกมาแสดงการไม่ยอมรับหรือแสดงความรังเกียจ."
ทุเรศ 1,ว.,ไกล เช่น ต้องทนทุราคมทุเรศ ดลเขตรคิรีไกล (ดุษฎีสังเวย).
ทุเรียน 0,น.,ชื่อไม้ต้นชนิด Durio zibethinusMurr. ในวงศ์ Bombacaceae ผลเป็นพู ๆ มีหนามแข็งเต็มทั่วลูก เนื้อมีรสหวานมัน มีหลายพันธุ์ เช่น กบ ก้านยาว กำปั่น ทองย้อย หมอนทอง.
ทุเรียนแขก 0,น.,"ชื่อไม้ต้นขนาดเล็กชนิด Annona muricata L. ในวงศ์ Annonaceae ผลมีหนามขรุขระ รสหวานอมเปรี้ยว กินได้, ทุเรียนแขก ก็เรียก."
ทุเรียนเทศ 0,น.,"ชื่อไม้ต้นขนาดเล็กชนิด Annona muricata L. ในวงศ์ Annonaceae ผลมีหนามขรุขระ รสหวานอมเปรี้ยว กินได้, ทุเรียนแขก ก็เรียก."
ทุลักทุเล 0,ว.,อาการที่เป็นไปอย่างขลุกขลัก ยุ่งยาก วุ่นวาย ไม่เป็นระเบียบ.
ทุเลา 0,ก.,ค่อยยังชั่ว เช่น ไข้ทุเลา
ทุเลา 1,ก.,ผ่อนผัน เช่น ขอทุเลาไปอีกสัก ๒-๓ วัน.
ทุวิธะ 0,ว.,๒ อย่าง.
ทุศีล 0,ว.,ล่วงละเมิดศีลหรือวินัย (มักใช้แก่นักบวชนักพรต).
ทุษฐ- 0,ก.,ประทุษร้าย.
ทุษฐจิต 0,น.,จิตที่คิดประทุษร้าย.
ทุส- 0,น.,ผ้า เช่น กฐินทุสทาน ว่า ถวายผ้ากฐิน.
ทุสสะ 0,น.,ผ้า เช่น กฐินทุสทาน ว่า ถวายผ้ากฐิน.
ทุสสีล 0,ว.,ทุศีล.
ทู่ 0,ว.,ไม่แหลม (ใช้แก่ของที่มีลักษณะยาวแหลม แต่ขาดความแหลมไปเพราะความสึกกร่อนด้วยการใช้เป็นต้น) เช่น ดินสอทู่ เข็มทู่.
ทู้ 0,ก.,ยอมอยู่ในอำนาจ.
ทู 0,ว.,สอง เช่น ลูกเสือสนองคำโคทู ว่าถ้าแม่กู กระทำวิบัติเบียดเบียน (เสือโค).
ทู 1,น.,ชื่อปลาทะเลชนิด Rastrelliger brachysoma (Bleeker) ในวงศ์ Scombridae หัวท้ายเรียว ลำตัวแบนข้าง เกล็ดเล็กบาง ด้านหลังสีน้ำเงินอมเขียว ปากกว้างเอียงขึ้นเล็กน้อย มีครีบหลัง ๒ ตอน ตอนที่ ๒ อยู่ตรงข้ามกับครีบก้น โดยต่างก็มีครีบย่อย ๕ อัน เรียงต่ออยู่ข้างท้าย ชิดโคนครีบหลังตอนแรกมีจุดสีดำ ๓-๖ จุด เรียงอยู่ ๑ แถว ข้างท้องสีขาวเงิน คอดหางแคบ อาศัยรวมกันเป็นฝูงใหญ่ใกล้ผิวนํ้า.
ทูกัง 0,น.,"ชื่อปลากดทะเลชนิด Arius leiotetocephalus Bleeker ในวงศ์ Ariidae ไม่มีเกล็ด มีหนวด ส่วนหน้าของครีบหลังและครีบอกมีก้านครีบเป็นเงี่ยง จัดอยู่ในพวกปลากดขนาดใหญ่ แต่แตกต่างจากปลาชนิดอื่นในสกุลเดียวกัน โดยมีกระดูกบริเวณท้ายทอยเป็นแผ่นกลมรีใหญ่กว่าชนิดอื่น ๆ อาศัยอยู่ตามชายฝั่งทะเลหรือนํ้ากร่อยโดยเฉพาะบริเวณปากแม่นํ้า, ทุกัง ก็เรียก."
ทู่ซี้ 0,ก.,"ทนไปจนกว่าจะตาย, ทนไปเพราะความจำเป็นหรือเพื่อให้สมประสงค์."
ทูต 0,น.,"ผู้นำข้อความไปแจ้งทั้ง ๒ ฝ่าย, ผู้รับใช้ไปเจรจาแทน, ผู้สื่อสาร, ผู้ที่ได้รับมอบหมายให้เป็นผู้แทนไปยังต่างประเทศ เพื่อเจรจาหรือเจริญสัมพันธไมตรีเป็นทางราชการ."
ทูตานุทูต 0,น.,"ทูตใหญ่น้อย, คณะทูต."
ทูน 0,ก.,"เทิน, เอาของไว้บนศีรษะ, เช่น เอาของทูนหัว."
ทูน 1,ก.,ชิดซ้าย (บอกวัวควายเวลาไถนา พร้อมดึงเชือก).
ทูนหัว 0,น.,คำพูดแสดงความรักใคร่หรือยกย่อง เช่น พ่อทูนหัว แม่ทูนหัว.
ทูบ 0,น.,ไม้แม่แคร่เกวียน โคนทั้งคู่พาดอยู่บนเพลา ปลายยื่นออกไปติดกับแอก.
ทูม 0,ก.,"บวม, อูม, ในคำว่า คางทูม หมายถึงโรคที่ทำให้คางบวม."
ทูมทาม 0,ว.,เทิบทาบ.
ทูโม่ง 0,น.,"ชื่อปลาทะเลชนิด Rastrelliger kanagurta (Cuvier) ในวงศ์ Scombridae รูปร่างและลักษณะทั่วไปคล้ายปลาทู แต่ขนาดใหญ่และลำตัวเพรียวกว่าเล็กน้อย ปากกว้าง ลำตัวสีน้ำเงินปนเทาและมีแถวจุดบริเวณ ๒ ข้างของครีบหลังเข้มกว่าปลาทู มีลายเส้นสีทึบพาดตามยาวข้างลำตัว ๒-๓ เส้น มีชุกชุมโดยอยู่รวมกันเป็นฝูงในบริเวณห่างฝั่งมากกว่าปลาทู, ทูโม่ง หรือ ทูลัง ก็เรียก."
ทูร- 0,ว.,"คำประกอบหน้าคำศัพท์ หมายความว่า ไกล เช่น ทูรบถ ทูรมรรคา ว่า ทางยาว, ทางไกล."
ทูล 0,ก.,"บอก, กล่าว, (ใช้แก่เจ้านาย)."
ทูลกระหม่อม 0,น.,คำที่พระราช-โอรสพระราชธิดาทรงเรียกพระราชบิดาที่เป็นพระมหากษัตริย์
ทูลกระหม่อม 1,น.,"คำเรียกพระราชโอรสพระราชธิดาซึ่งเป็นเจ้าฟ้าชั้นเอก ประสูติแต่พระอัครมเหสี, ใช้ว่า ทูลหม่อม ก็มี, หากเจ้านายทรงเรียกพระประยูรญาติที่เป็นเจ้าฟ้าชั้นเอก จะระบุคำแสดงความเป็นเครือญาติท้ายคำว่า ทูลกระหม่อม เช่น ทูลกระหม่อมปู่ ทูลกระหม่อมพ่อ ทูลกระหม่อมลุง ทูลกระหม่อมป้า ทูลกระหม่อมอา."
ทูลกระหม่อม 2,น.,ชื่อปูน้ำจืดชนิด Thaipotamon chulabhorn Naiyanetr ในวงศ์ Potamidae กระดองสีม่วงเข้มคล้ายสีเปลือกมังคุด ขาและขาก้ามสีเหลืองอมส้ม ปลายก้ามและขาสีขาว ขุดรูอยู่ พบในป่าดูนลำพัน อำเภอนาเชือก จังหวัดมหาสารคาม.
ทูลเกล้าทูลกระหม่อมถวาย 0,ก.,"ถวาย (ใช้แก่สิ่งของเล็กหรือของที่ยกได้ที่ถวายแด่พระบาทสมเด็จพระเจ้าอยู่หัว สมเด็จพระบรมราชินีนาถ สมเด็จพระบรมราชินี สมเด็จพระบรมโอรสาธิราช สยามมกุฎราชกุมาร และสมเด็จพระเทพรัตนราชสุดาฯ สยามบรมราชกุมารี), เขียนว่า ทูลเกล้าฯ ถวาย ก็ได้ แต่ต้องอ่านว่า ทูลเกล้าทูลกระหม่อมถวาย."
ทูลัง 0,น.,"ชื่อปลาทะเลชนิด Rastrelliger kanagurta (Cuvier) ในวงศ์ Scombridae รูปร่างและลักษณะทั่วไปคล้ายปลาทู แต่ขนาดใหญ่และลำตัวเพรียวกว่าเล็กน้อย ปากกว้าง ลำตัวสีน้ำเงินปนเทาและมีแถวจุดบริเวณ ๒ ข้างของครีบหลังเข้มกว่าปลาทู มีลายเส้นสีทึบพาดตามยาวข้างลำตัว ๒-๓ เส้น มีชุกชุมโดยอยู่รวมกันเป็นฝูงในบริเวณห่างฝั่งมากกว่าปลาทู, ทูโม่ง หรือ ทูลัง ก็เรียก."
ทูเลียม 0,น.,ธาตุลำดับที่ ๖๙ สัญลักษณ์ Tm เป็นโลหะ ลักษณะเป็นของแข็ง หลอมละลายที่ ๑๕๔๕ °ซ.
ทูษก 0,น.,ผู้ประทุษร้าย.
เท 0,ก.,"ตะแคงหรือเอียงภาชนะเพื่อให้สิ่งที่อยู่ในนั้นไหลลงไปหรือออกไป เช่น เทนํ้า เทขยะ, โดยปริยายหมายถึงกิริยาอาการคล้ายคลึงเช่นนั้น เช่น ฝนตกลงมามาก ๆ อย่างเทนํ้า ก็เรียกว่า ฝนเทลงมา, อาการที่คนจำนวนมาก ๆ เคลื่อนไปรวมกันตามแนวเท เช่น คนเทไปทางกราบซ้ายเมื่อเรือเอียงซ้าย."
เท 1,ว.,เอียงหรือตะแคงไปข้างหนึ่ง เช่น เรือเท พื้นเท.
เท 2,น.,ชื่อมาตราตวงเหล้าตามวิธีประเพณี ๑ เท เท่ากับ ๒๐ ทะนาน.
เท่ 0,ว.,เอียงน้อย ๆ (มักใช้แก่การสวมหมวก)
เท่ 1,ว.,โก้เก๋ เช่น แต่งตัวเท่.
เทกระจาด 0,ก.,อาการที่รถบรรทุกหรือรถโดยสารคว่ำทำให้ผู้โดยสารตายหรือได้รับบาดเจ็บหรือข้าวของต้องเสียหายไปทั้งคัน.
เทกระเป๋า 0,ก.,จ่ายเงินจนหมดกระเป๋าหรือเท่าที่ติดตัวไป.
เทคนิค 0,น.,ศิลปะหรือกลวิธีเฉพาะวิชานั้น ๆ.
เทคนีเชียม 0,น.,ธาตุลำดับที่ ๔๓ สัญลักษณ์ Tc เป็นธาตุกัมมันตรังสีที่นักวิทยาศาสตร์สร้างขึ้น ไม่มีปรากฏในธรรมชาติ.
เทคโนโลยี 0,น.,วิทยาการที่นำเอาความรู้ทางวิทยาศาสตร์มาใช้ให้เกิดประโยชน์ในทางปฏิบัติ อุตสาหกรรม เป็นต้น.
เทครัว 0,ก.,"อพยพครอบครัว, กวาดต้อนผู้คนพลเมืองจากถิ่นฐานเดิมไปไว้ที่อื่น, เช่น ในปีเดียวนั้นให้เทครัวเมืองเหนือทั้งปวงลงมายังกรุงพระนครศรีอยุทธยา (พงศ. ประเสริฐ)"
เทครัว 1,ก.,โดยปริยายเรียกชายที่ได้หญิงเป็นภรรยาทั้งแม่ทั้งลูกหรือทั้งพี่ทั้งน้อง ว่า พระยาเทครัว.
เทคอนกรีต 0,ก.,เอาปูนซีเมนต์ ทราย และกรวดหรือหินผสมกับนํ้า แล้วเทให้จับตัวแข็งเป็นพื้นหรือทำถนนเป็นต้น.
เทง 0,ก.,"ทุบ, เคาะ, เช่น อันว่าพระมหาสัตว์ก็ถามเพื่อว่าดึกดื่น ตื่นนอนใครแลมาเทงทรวารพระกุฎีกูดังนี้ (ม. คำหลวง กุมาร), ตระบัดก็ให้เท้ง กระทุ่มเภรียครืนเครง กึกก้องบันลือเลวง (อนิรุทธ์)."
