ผิวหนัง 1,น.,ชื่อโรคชนิดหนึ่งก่อให้เกิดการเปลี่ยนแปลงขึ้นที่ส่วนต่าง ๆ ของผิวหนัง.
ผิว่า 0,สัน.,"ถ้าว่า, หากว่า, แม้นว่า."
ผี 0,น.,"สิ่งที่มนุษย์เชื่อว่าเป็นสภาพลึกลับ มองไม่เห็นตัว แต่อาจจะปรากฏเหมือนมีตัวตนได้ อาจให้คุณหรือโทษได้ มีทั้งดีและร้าย เช่น ผีปู่ย่าตายาย ผีเรือน ผีห่า, เรียกคนที่ตายไปแล้ว"
ผี 1,น.,เทวดา
ผี 2,น.,โดยปริยายหมายความว่า เลว เช่น คนผี
ผี 3,น.,เรียกบุคคลที่หมกมุ่นในการพนัน ว่า ผีการพนันเข้าสิง.
ผีกระสือ 0,น.,"ผีชนิดหนึ่งที่ถือว่าเข้าสิงในตัวผู้หญิง ชอบกินของโสโครก, คู่กับ ผีกระหัง ซึ่งเป็นผีผู้ชาย. (ดู กระสือ ๑)."
ผีกระหัง 0,น.,"ผีชนิดหนึ่งที่ถือว่าเข้าสิงในตัวผู้ชาย เชื่อกันว่าเดิมเป็นผู้ชายที่เรียนวิชาอาคมแก่กล้าเข้าก็มีปีกมีหาง จะไปไหนก็ใช้กระด้งต่างปีก สากตำข้าวต่างขา สากกะเบือต่างหาง ชอบกินของโสโครก, คู่กับ ผีกระสือ ซึ่งเป็นผีผู้หญิง."
ผีกองกอย 0,น.,ผีชนิดหนึ่ง เชื่อกันว่ามีตีนเดียว ไม่มีสะบ้าหัวเข่า จึงต้องเดินเขย่งเกงกอย ชอบออกมาดูดเลือดที่หัวแม่เท้าของคนที่นอนหลับพักแรมในป่า.
ผีเข้าผีออก 0,ว.,"เดี๋ยวดีเดี๋ยวร้าย, ไม่คงที่."
ผีโขมด 0,น.,ผีชนิดหนึ่งในพวกผีกระสือหรือผีโพง เห็นเป็นแสงเรืองวาวในเวลากลางคืน ทำให้หลงผิดนึกว่ามีคนถือไฟหรือจุดไฟอยู่ข้างหน้า พอเข้าไปใกล้ก็หายไป. (ดู โขมด ๑).
ผีซ้ำด้ำพลอย 0,น.,เคราะห์เดิมร้ายหนักอยู่แล้ว ยังมีเคราะห์อื่นซ้ำเข้ามา ทำให้เคราะห์หนักยิ่งขึ้น เช่น เขาตกงานแล้วขโมยยังขึ้นบ้านเอาข้าวของไปหมดอีก ผีซ้ำด้ำพลอยจริง ๆ.
ผีดิบ 0,น.,"ศพที่ฝังไว้ไม่นิยมเผา เช่น ผีตายโหง, ผีชนิดหนึ่งเป็นศพเดินได้."
ผีตองเหลือง 0,น.,"ชนชาติข่าพวกหนึ่ง, ตองเหลือง ก็เรียก."
ผีตะ 0,ว.,"มั่งคั่ง, ผึ่งผาย, กว้างขวาง."
ผีตากผ้าอ้อม 0,น.,แสงแดดที่สะท้อนกลับมาสว่างในเวลาจวนพลบในบางคราว.
ผีตายซาก 0,น.,"ซากศพที่แห้งจนมีแต่หนังหุ้มกระดูก, คำเปรียบคนที่ผอมแห้งเห็นแต่หนังหุ้มกระดูก ว่า ผอมอย่างกับผีตายซาก."
ผีตายทั้งกลม 0,น.,หญิงที่ตายในขณะที่ลูกยังอยู่ในท้อง.
ผีตายโหง 0,น.,คนที่ตายผิดธรรมดาโดยอาการร้ายเช่นถูกฆ่าตาย ตกน้ำตาย.
ผีถ้วยแก้ว 0,น.,เรียกการเล่นทรงเจ้าเข้าผีวิธีหนึ่ง โดยผู้เล่นเอานิ้วแตะที่ถ้วยแก้วแล้วถ้วยแก้วจะเคลื่อนไปตามตัวอักษรต่าง ๆ ให้ผู้เล่นอ่านเอาความได้.
ผีถึงป่าช้า 0,*สำ.,ต้องยอมทำด้วยความจำใจหรือไม่มีทางเลือก.
ผีแถน 0,น.,ผีฟ้า.
ผีทะเล 0,ว.,เลวมาก เช่น คนผีทะเล.
ผีบ้านไม่ดี ผีป่าก็พลอย 0,น.,คนในบ้านเป็นใจช่วยให้คนนอกบ้านเข้ามาทำความเสียหายได้.
ผีบุญ 0,น.,ผู้อวดคุณวิเศษว่ามีฤทธิ์ทำได้ต่าง ๆ อย่างผีสางเทวดาให้คนหลงเชื่อ.
ผีปอบ 0,น.,ผีชนิดหนึ่งเชื่อกันว่าสิงอยู่ในตัวคน กินตับไตไส้พุงจนหมดแล้วออกไป คนนั้นก็ตาย.
ผีโป่ง 0,น.,ผีที่อยู่ในป่าโป่ง.
ผีโป่งค่าง 0,น.,สัตว์ชนิดหนึ่งมีรูปร่างคล้ายค่างแต่ใหญ่กว่ามาก ชอบออกมาดูดเลือดที่หัวแม่เท้าของคนที่นอนหลับพักแรมในป่า เชื่อกันว่าเป็นผีโป่งชนิดหนึ่ง.
ผีพุ่งไต้ 0,น.,"เทหวัตถุแข็งจากอวกาศ มี ๒ ชนิด ชนิดหนึ่งประกอบด้วยหินเป็นส่วนใหญ่ อีกชนิดหนึ่งประกอบด้วยเหล็กเป็นส่วนใหญ่ เมื่อเคลื่อนที่ผ่านบรรยากาศสู่ผิวโลก จะลุกไหม้ให้แสงสว่างจ้าเนื่องจากเสียดสีกับอากาศ ถ้ามีขนาดเล็กก็จะไหม้หมดก่อนถึงผิวโลก ถ้ามีขนาดใหญ่ก็จะตกถึงผิวโลกและเรียกว่า อุกกาบาต, ดาวตก ก็เรียก."
ผีเพลีย 0,น.,ดิถีวันห้ามไม่ให้แรกนา.
ผีโพง 0,น.,ผีชนิดหนึ่งกล่าวกันว่าชอบกินของสดคาว.
ผีฟ้า 0,น.,เทวดาพวกหนึ่ง.
ผีไม่มีศาล 0,ว.,ไม่มีที่อยู่เป็นหลักแหล่ง.
ผีเรือน 0,น.,ผีที่อยู่ประจำเรือน.
ผีเรือนไม่ดี ผีป่าก็พลอย 0,น.,คนในบ้านเป็นใจช่วยให้คนนอกบ้านเข้ามาทำความเสียหายได้.
ผี้ว์ 0,สัน.,"ผิว, ผิว่า, ถ้าว่า, หากว่า, แม้นว่า."
ผีสัง 0,น.,"ผี, บางทีใช้นำหน้าชื่อคนที่ตายแล้ว เช่น ผีสางยายเขียว ผีสางตาขำ."
ผีสาง 0,น.,"ผี, บางทีใช้นำหน้าชื่อคนที่ตายแล้ว เช่น ผีสางยายเขียว ผีสางตาขำ."
ผีเสื้อ 0,น.,"ชื่อแมลงอันดับ Lepidoptera มีปีกเป็นแผ่นบาง ๒ คู่ ลำตัว ปีก และขาปกคลุมด้วยเกล็ดขนาดเล็กมาก คล้ายฝุ่นเมื่อมองด้วยตาเปล่า เกล็ดเหล่านี้ทำให้เกิดสีต่าง ๆ กัน ปากเป็นงวงยาวม้วนได้ มีทั้งชนิดหากินในเวลากลางวัน มีหนวดแบบเส้นด้าย ปลายหนวดเป็นปุ่ม เรียก ผีเสื้อกลางวัน และชนิดหากินในเวลากลางคืน หนวดมีหลายแบบ ปลายหนวดไม่เป็นปุ่ม เรียก ผีเสื้อกลางคืน, พายัพเรียก กะเบ้อ, อีสานเรียก กะเบ้อ กะเบี้ย ก่ำบี้ หรือ กะบี้."
ผีเสื้อ 1,น.,ชื่อปลาทะเลทุกชนิดในวงศ์ Chaetodontidae ยกเว้นปลาโนรี ( Heniochusspp.) ลำตัวสั้น กว้าง แบนข้างมาก ปากเล็ก บางชนิดปากยื่นยาวเป็นท่ออยู่ปลายสุดของหัว มีเกล็ดหนามคลุมถึงบนครีบหลัง ครีบก้น และครีบหาง สีสวยสด แตกต่างกันตามชนิด มักเป็นบั้ง แถบ หรือจุดคละกันหลายสี อาศัยอยู่ตามแนวหินปะการัง กินสัตว์น้ำขนาดเล็กหรือสาหร่าย ขนาดยาวตั้งแต่ ๑๐-๓๐ เซนติเมตร มีการนำมาเลี้ยงเป็นปลาสวยงาม.
ผีเสื้อกะโหลก 0,น.,"ชื่อผีเสื้อกลางคืนหลายชนิด ในสกุล Acherontiaวงศ์ Sphingidae บริเวณด้านบนของส่วนอกมีลายรูปคล้ายหัวกะโหลก พบทั่วไป เช่น ชนิด A. lachesis (Fabricius) ความกว้างเมื่อกางปีกวัดจากปลายปีกข้างหนึ่งถึงปลายปีกอีกข้างหนึ่งยาว ๘-๑๓ เซนติเมตร, ชนิด A. styx (Westwood) ความกว้างเมื่อกางปีกยาว ๘-๑๒ เซนติเมตร."
ผีเสื้อเงิน 0,น.,"ชื่อปลาทะเลชนิด Monodactylus argenteus (Linn.) ในวงศ์ Monodactylidae ลำตัวสั้นมาก รูปไข่แบนข้าง ฐานครีบหลังและครีบก้นยาวทั้งคู่มีปลายครีบตอนหน้ามน พื้นลำตัวและครีบสีเทาเงิน มีแถบสีดำพาดขวางผ่านตา ๑ เส้นและอีกเส้นโค้งผ่านแผ่นปิดเหงือกไปยังขอบหน้าของครีบหลังและครีบก้น ขนาดยาวได้ถึง ๒๕ เซนติเมตร อยู่ในนํ้าจืดได้, โสร่งแขก ก็เรียก."
ผีเสื้อน้อย 0,น.,ต้นคนทีสอ. (ดู คนทีสอ ที่ คนที ๒).
ผีเสื้อน้ำ 0,น.,"เทวดาที่รักษาน่านนํ้า, เสื้อนํ้า ก็เรียก."
ผีเสื้อเมือง 0,น.,"เทวดาที่รักษาบ้านเมือง, พระเสื้อเมือง หรือ เสื้อเมือง ก็เรียก, (โบ) พระเชื้อเมือง."
ผีเสื้อยักษ์ 0,น.,ผีหรืออมนุษย์จำพวกหนึ่งที่เป็นยักษ์.
ผีเสื้อยักษ์ 1,น.,ชื่อผีเสื้อกลางคืนขนาดใหญ่ ๒ ชนิด ในวงศ์ Saturniidae ความกว้างเมื่อกางปีก วัดจากปลายปีกข้างหนึ่งถึงปลายปีกอีกข้างหนึ่งยาว ๒๑-๒๗ เซนติเมตร ลำตัวและอกปกคลุมด้วยขนสีนํ้าตาลแดง ปีกสีนํ้าตาลแดงมีลวดลาย บริเวณเกือบกึ่งกลางปีกมีลักษณะบางใส เช่น ชนิด Attacus atlas (Linn.) ปลายปีกคู่หน้ามีจุดสีน้ำตาลดำ ๑ จุด พบทั่วไป ส่วนใหญ่กินใบกระท้อนและฝรั่ง และชนิด Archaeoattacus edwardsiiWhite ปลายปีกคู่หน้ามีจุดสีน้ำตาลดำ ๓ จุด พบที่จังหวัดเชียงใหม่.
ผีเสื้อราตรี 0,น.,เรียกผู้หญิงที่มีอาชีพให้บริการในสถานบันเทิงในเวลากลางคืน.
ผีเสื้อสมุทร 0,น.,ยักษ์พวกหนึ่ง เชื่อกันว่าสิงอยู่ในทะเล.
ผีเสื้อหัวกะโหลก 0,น.,"ชื่อผีเสื้อกลางคืนหลายชนิด ในสกุล Acherontiaวงศ์ Sphingidae บริเวณด้านบนของส่วนอกมีลายรูปคล้ายหัวกะโหลก พบทั่วไป เช่น ชนิด A. lachesis (Fabricius) ความกว้างเมื่อกางปีกวัดจากปลายปีกข้างหนึ่งถึงปลายปีกอีกข้างหนึ่งยาว ๘-๑๓ เซนติเมตร, ชนิด A. styx (Westwood) ความกว้างเมื่อกางปีกยาว ๘-๑๒ เซนติเมตร."
ผีหลอก 0,น.,เรือแจวจับสัตว์นํ้าในลำคลองและลำนํ้าชนิดหนึ่ง จับได้ทั้งปลาและกุ้ง กราบเรือด้านหนึ่งติดแผ่นกระดานทาสีขาว ปล่อยริมข้างหนึ่งให้ลงนํ้า กราบอีกด้านหนึ่งมีตาข่ายกันมิให้ปลาและกุ้งกระโดดข้าม ใช้จับเวลากลางคืน ปลาตกใจจะกระโดดเข้ามาหาเรือเอง.
ผีหลอก 1,น.,"ชื่อปลาไม่มีเกล็ดชนิด Batrachoides grunniers (Bloch) และ Batrachomoeus trispinosus (Günther) ในวงศ์ Batrachoididae ปากกว้าง หัวทู่แบนลง ลำตัวกลมยาว มีสีนํ้าตาลเป็นด่างดวงทั่วไป ขนาดยาวได้ถึง ๓๐ เซนติเมตร ครีบท้องอยู่เยื้องไปข้างหน้าครีบอก หางกลม เฉพาะชนิดแรกมีรูที่มุมบนด้านในของครีบอก อาศัยอยู่ตามพื้นท้องทะเล, กบ บู่ทะเล ผีหลอก หรือ อุบ ก็เรียก."
ผีห่า 0,น.,"ผีจำพวกหนึ่งถือกันว่าทำให้เกิดโรคระบาดอย่างร้ายแรงเช่น อหิวาตกโรค กาฬโรค, เรียกโรคเช่นนั้นว่า โรคห่า."
ผีอำ 0,ก.,อาการที่ปรากฏเมื่อเวลานอนเคลิ้มไปว่ามีคนปลุกปลํ้าหรือยึดคร่าให้มีอาการเหนื่อยหอบจนตื่นขึ้น.
ผึง 0,ว.,เสียงดังเช่นนั้น เช่น เชือกขาดดังผึง
ผึง 1,ว.,อาการที่เป็นไปอย่างรวดเร็วทันทีทันใด เช่น ขาดผึง ดีดผึง
ผึง 2,ว.,ใช้ประกอบคำ แห้ง ว่า แห้งผึง หมายความว่า แห้งสนิท เช่น ปลักควายแห้งผึง.
ผึ่ง 0,น.,ชื่อเครื่องมือสำหรับถากไม้ชนิดหนึ่ง รูปคล้ายจอบ.
ผึ้ง 0,น.,"ชื่อแมลงหลายชนิดในวงศ์ Apidae มีปีกบางใส ๒ คู่ ปีกคู่หลังเล็กกว่าปีกคู่หน้า ปากใช้ทั้งกัดอาหารและดูดกินของเหลวได้ ปล้องท้องที่อยู่ติดกับส่วนอกเล็กมาก มีขนปกคลุมตามลำตัว เป็นแมลงสังคม อยู่รวมกันเป็นฝูง แบ่งชั้นวรรณะเป็นผึ้งนางพญา ผึ้งผู้ และผึ้งงาน ผึ้งงานมีถุงสำหรับเก็บเกสรดอกไม้ที่ขาหลัง และมีเหล็กในสำหรับต่อยปล่อยน้ำพิษ ทำให้เจ็บปวด ชนิดที่รู้จักกันแพร่หลายในประเทศไทย มี ๕ ชนิด เป็นผึ้งพื้นเมืองของประเทศไทย ๔ ชนิด คือ ผึ้งหลวง ( Apis dorsataFabricius) ผึ้งโพรง ( A. cerana Fabricius) ผึ้งมิ้ม ( A. florea Fabricius) และผึ้งม้าน ( A. andrenitormis Smith) ส่วนผึ้งที่เลี้ยงกันทั่วไปนำมาจากต่างประเทศ คือผึ้งพันธุ์ (A. mellifera Linn.), เผิ้ง ก็เรียก."
ผึ่ง 1,ก.,เอาไว้หรือให้อยู่อย่างเปิดเผย เพื่อให้ได้รับแดด ลม นํ้าค้าง เป็นต้น เช่น ผึ่งแดด ผึ่งลม.
ผึ่ง 2,ว.,"ที่กางออก, ที่ผายออก, เช่น อกผายไหล่ผึ่ง"
ผึ่ง 3,ว.,"แสดงท่าทางว่าเป็นคนสำคัญหรือใหญ่โต, มักใช้ประกอบคำอื่น เช่น ทำผึ่ง นั่งผึ่ง วางผึ่ง."
ผึ้ง 1,น.,"ชื่อปลาน้ำจืดชนิด Gyrinocheilus aymonieri (Tirant) และชนิด G. pennocki (Fowler) ในวงศ์ Gyrinocheilidae ลำตัวทรงกระบอก คอดหางใหญ่ ครีบหางเว้าตื้น ปลายหัวมน งุ้ม ตาเล็กอยู่ค่อนไปทางด้านบน ที่สำคัญคือ มีรูน้ำเข้า ๑ รูอยู่เหนือแผ่นปิดเหงือก บริเวณจะงอยปากมีตุ่มเนื้อขนาดเล็ก ไม่มีหนวด พื้นลำตัวมีสีน้ำตาลคล้ำ ข้างตัวมีจุดสีดำเรียงสลับกันตามยาวอยู่ ๒ แถว จุดสีดำยังอาจพบบนครีบ อาศัยตามที่ลุ่มน้ำต้นฤดูน้ำ หรือตามลำธารบนภูเขา กินสาหร่ายและพืชน้ำอื่น ๆ ปรกติใช้ปากดูดเกาะห้อยตัวอยู่กับวัตถุใต้น้ำหรืออยู่ตามพื้นท้องน้ำ ขนาดยาวได้ถึง ๒๘ เซนติเมตร, สร้อยน้ำผึ้ง ปากใต้ ลูกผึ้ง ผึ้ง หรือ อีดูด ก็เรียก."
ผึ้งโก๋น 0,น.,"ชื่อผึ้งโพรง ( Apis cerana Fabricius) ในวงศ์ Apidae เป็นผึ้งขนาดกลาง ผึ้งงานลำตัวยาวประมาณ ๑ เซนติเมตร อาศัยอยู่เป็นฝูง ทำรังซ้อนกันหลายชั้นเรียงขนานกันอยู่ในโพรงไม้ กระบอกไม้ ซอกหิน หรือซอกหลังคาบ้านที่ปิดมิดชิด ขนาดเส้นผ่าศูนย์กลางของรัง ประมาณ ๓๐ เซนติเมตร นำมาเลี้ยงได้เช่นเดียวกับผึ้งพันธุ์, พายัพและอีสานเรียก ผึ้งโก๋น, ผึ้งรวง ก็เรียก."
ผึ่งผาย 0,ว.,"มีรูปตรงไหล่กางอย่างสง่า ไม่คู้ค้อม, มีท่าทางเป็นสง่าผ่าเผย."
ผึ้งรวง 0,น.,"ชื่อผึ้งโพรง ( Apis cerana Fabricius) ในวงศ์ Apidae เป็นผึ้งขนาดกลาง ผึ้งงานลำตัวยาวประมาณ ๑ เซนติเมตร อาศัยอยู่เป็นฝูง ทำรังซ้อนกันหลายชั้นเรียงขนานกันอยู่ในโพรงไม้ กระบอกไม้ ซอกหิน หรือซอกหลังคาบ้านที่ปิดมิดชิด ขนาดเส้นผ่าศูนย์กลางของรัง ประมาณ ๓๐ เซนติเมตร นำมาเลี้ยงได้เช่นเดียวกับผึ้งพันธุ์, พายัพและอีสานเรียก ผึ้งโก๋น, ผึ้งรวง ก็เรียก."
ผืน 0,น.,เรียกสิ่งที่มีลักษณะแบนเป็นแผ่นอย่างผ้า หนัง หรือเสื่อ เป็นต้น มีขนาดเต็มตามกำหนดและอาจม้วนหรือพับได้เช่นผ้านุ่ง ผ้าห่ม เสื่อ พรม และหนัง ว่า ผืนผ้า ผืนหนัง เป็นต้น
ผืน 1,น.,ใช้เป็นลักษณนาม เช่น ผ้า ๓ ผืน เสื่อ ๒ ผืน
ผืน 2,น.,เรียกแผ่นดินทั้งหมดหรือส่วนใดส่วนหนึ่ง เช่น ผืนแผ่นดิน แผ่นดินผืนนี้ ที่ดินผืนนั้น.
ผื่น 0,น.,เม็ดตุ่มหรือแถบที่ผุดขึ้นเป็นพืดบนผิวหนัง.
ผุ 0,ก.,"กร่อนอย่างฟันผุ, ร่วนหรือยุ่ย เช่น กระดูกผุ ไม้ผุ."
