อสงไขย 1,น.,ชื่อมาตรานับจำนวนใหญ่ที่สุด คือ โกฏิยกกำลัง ๒๐.
อสนี 0,น.,"สายฟ้า, อาวุธพระอินทร์."
อสนีบาต 0,น.,"ฟ้าผ่า, อสุนีบาต ก็ว่า."
อสภะ 0,น.,เรียกซากศพ ว่า อสุภ และเลือนไปเป็น อสภ และ อาสภ ก็มี.
อสมการ 0,น.,ข้อความที่แสดงการไม่เท่ากันของนิพจน์ ๒ นิพจน์ที่ปรากฏอยู่ทางด้านซ้ายและด้านขวาของเครื่องหมาย < หรือ >.
อสมมาตร 0,ว.,ไม่สมมาตร.
อสรพิษ 0,น.,"สัตว์มีพิษในเขี้ยว มักหมายถึง งูพิษ, โดยปริยายหมายถึงคนที่ลอบทำร้ายหรือให้ร้ายผู้มีคุณหรือผู้อื่นด้วยความอิจฉาริษยาเป็นต้น."
อสังกมทรัพย์ 0,น.,"สังหาริมทรัพย์ซึ่งไม่อาจใช้ของอื่นที่เป็นประเภทและชนิดเดียวกันมีปริมาณเท่ากันแทนได้, ตรงข้ามกับ สังกมทรัพย์."
อสังหาริม- 0,ว.,"ซึ่งนำเอาไปไม่ได้, เคลื่อนที่ไม่ได้."
อสังหาริมทรัพย์ 0,น.,ทรัพย์ที่นำไปไม่ได้ คือ ทรัพย์ที่ติดกับที่ เช่น ที่ดิน
อสังหาริมทรัพย์ 1,น.,"ที่ดินและทรัพย์อันติดอยู่กับที่ดินมีลักษณะเป็นการถาวรหรือประกอบเป็นอันเดียวกับที่ดินนั้น และหมายความรวมถึงทรัพยสิทธิอันเกี่ยวกับที่ดินหรือทรัพย์อันติดอยู่กับที่ดินหรือประกอบเป็นอันเดียวกับที่ดินนั้นด้วย, คู่กับ สังหาริมทรัพย์."
อสังหาริมะ 0,ว.,"ซึ่งนำเอาไปไม่ได้, เคลื่อนที่ไม่ได้."
อสัญ- 0,ว.,"ไม่รู้สึกตัว, สิ้นสติ."
อสัญกรรม 0,น.,"ความตาย, ใช้แก่ผู้ตายที่มีบรรดาศักดิ์เป็นเจ้าพระยา หรือผู้ที่ดำรงตำแหน่งประธานองคมนตรี องคมนตรี นายกรัฐมนตรี ประธานสภา หรือผู้ได้รับพระราชทานเครื่องราชอิสริยาภรณ์ชั้นปฐมจุลจอมเกล้าว่า ถึงแก่อสัญกรรม."
อสัญญี 0,ว.,"ไม่มีสัญญา, หมดความรู้สึก, สลบ."
อสัญญีสัตว์ 0,น.,พรหมพวกหนึ่งมีรูปแต่ไม่มีสัญญา ดังมีกล่าวไว้ในไตรภูมิกถา.
อสัญแดหวา 0,น.,"เทวดาต้นตระกูลของกษัตริย์ ๔ นครในบทละครเรื่องอิเหนา คือ องค์ปะตาระกาหลา, ชื่อวงศ์กษัตริย์ผู้ครอง ๔ นครในบทละครเรื่องอิเหนา ได้แก่ กุเรปัน ดาหา กาหลัง และสิงหัดส่าหรี."
อสัตถพฤกษ์ 0,น.,ชื่อต้นไม้ที่พระโคตมพุทธเจ้าประทับอยู่ใต้ต้นแล้วได้ตรัสรู้ เรียกว่า ต้นพระศรีมหาโพธิ์ หรือเรียกสั้น ๆ ว่า ต้นโพธิ์.
อสัตย์ 0,ว.,"ไม่ซื่อสัตย์, ไม่ซื่อตรง, กลับกลอก, เช่น คนอสัตย์, อาสัตย์ ก็ว่า."
อสัมภิน- 0,ว.,"ไม่แตกต่าง, ไม่เจือปน."
อสัมภินพงศ์ 0,น.,เชื้อสายที่ไม่เจือปน.
อสัมภินวงศ์ 0,น.,เชื้อสายที่ไม่เจือปน.
อสาธร 0,ว.,อสาธุ.
อสาธุ 0,ว.,"ไม่ดี, ไม่งาม, เลว, ชั่วช้า"
อสาธุ 1,ว.,น่าละอาย
อสาธุ 2,ว.,แผลงใช้ว่า อสาธร ก็ได้.
อสิ 0,น.,"ดาบ, มีด, กระบี่."
อสิจรรยาการ 0,น.,"การฝึกหัดเพลงดาบ, การฝึกหัดเพลงศัสตรา."
อสิตะ 0,ว.,"มีสีดำ, มีสีคลํ้า, มีสีแก่."
อสิธารา 0,น.,"คมดาบ, คมศัสตรา."
อสิเลสะ 0,น.,"ดาวฤกษ์ที่ ๙ มี ๕ ดวง เห็นเป็นรูปแขนคู้หรือพ้อม, ดาวเรือน หรือ ดาวนกอยู่ในปล่อง ก็เรียก."
อสีตยานุพยัญชนะ 0,น.,ลักษณะน้อย ๆ ในร่างกายของผู้ที่เป็นพระมหาบุรุษมี ๘๐ อย่าง คือ ผู้ที่จะเป็นพระมหาบุรุษต้องสมบูรณ์ด้วยลักษณะสำคัญ ๓๒ อย่าง ซึ่งเรียกว่า มหาปุริสลักษณะ มีรอยพระบาทเป็นลายรูปจักรและอื่น ๆ ตามแบบเป็นต้น และสมบูรณ์ด้วยอสีตยานุพยัญชนะ.
อสีติ 0,ว.,แปดสิบ.
อสีติมหาสาวก 0,น.,สาวกใหญ่ ๘๐ องค์ของพระพุทธเจ้า.
อสุ 0,น.,"ลมหายใจ, ชีวิต."
อสุจิ 0,ว.,"ไม่สะอาด, ไม่บริสุทธิ์"
อสุจิ 1,ว.,เรียกนํ้ากาม ว่า นํ้าอสุจิ.
อสุนีบาต 0,น.,"ฟ้าผ่า, อสนีบาต ก็ว่า."
อสุภ 0,ว.,"ไม่งาม, ไม่สวย, ไม่ดี."
อสุภ 1,น.,เรียกซากศพ ว่า อสุภ และเลือนไปเป็น อสภ และ อาสภ ก็มี.
อสุภ- 0,ว.,"ไม่งาม, ไม่สวย, ไม่ดี."
อสุภ- 1,น.,เรียกซากศพ ว่า อสุภ และเลือนไปเป็น อสภ และ อาสภ ก็มี.
อสุภกรรมฐาน 0,น.,กรรมฐานที่ยึดเอาซากศพเป็นอารมณ์ เพื่อพิจารณาให้เห็นความไม่งามความไม่เที่ยงแท้ของสังขาร.
อสุภสัญญา 0,น.,การกำหนดรู้ว่าเป็นของไม่สวยงาม.
อสุร- 0,น.,"อมนุษย์พวกหนึ่งเป็นศัตรูต่อเทวดา, แทตย์, ยักษ์, มาร, ผี."
อสุรกาย 0,น.,"สัตว์เกิดในอบายภูมิพวกหนึ่ง เชื่อกันว่าชอบเที่ยวหลอกหลอนคน, คู่กับ เปรต."
อสุรา 0,น.,"อสูร, ยักษ์."
อสุรี 0,น.,"อสูร, ยักษ์."
อสุเรศ 0,น.,"อสูร, ยักษ์."
อสูร 0,น.,"ยักษ์, ในบทกลอนใช้ว่า อสุรา อสุรี หรือ อสุเรศ ก็มี."
อเส 0,น.,ตัวไม้ซึ่งประกอบยึดเสาส่วนบนของเรือน
อเส 1,น.,ไม้ยึดหัวกงเรือ.
อเสกข- 0,น.,ผู้ที่ไม่ต้องศึกษาอีก หมายถึง พระอรหันต์.
อเสกขบุคคล 0,น.,ผู้ที่ไม่ต้องศึกษาอีก หมายถึง พระอรหันต์.
อเสกขะ 0,น.,ผู้ที่ไม่ต้องศึกษาอีก หมายถึง พระอรหันต์.
อเสข- 0,น.,อเสกขะ.
อเสขบุคคล 0,น.,ผู้ที่ไม่ต้องศึกษาอีก หมายถึง พระอรหันต์.
อเสข-บุคคล 0,น.,ผู้ที่ไม่ต้องศึกษาอีก หมายถึง พระอรหันต์.
อเสขะ 0,น.,อเสกขะ.
อห 0,น.,"วัน, วันหนึ่ง, มักใช้เป็นส่วนท้ายของสมาสในคำที่มาจากภาษาบาลีและสันสกฤต เช่น สัปดาห์ มาจาก ส. สปฺต + อห = ๗ วัน."
อหังการ 0,น.,การยึดว่าเป็นตัวเรา
อหังการ 1,น.,"ความเย่อหยิ่งจองหอง, ความทะนงตัว, ความก้าวร้าวด้วยการถือว่าตนเองสำคัญ."
อหังการ 2,ก.,"หยิ่ง, จองหอง, อวดดี."
อหิ 0,น.,งู.
อหิงสา 0,น.,"ความไม่เบียดเบียน, การเว้นจากการทำร้าย."
อหิวาต์ 0,น.,ชื่อโรคระบาดชนิดหนึ่ง มีอาการลงราก.
อหิวาตกโรค 0,น.,ชื่อโรคระบาดชนิดหนึ่ง มีอาการลงราก.
อหึงสา 0,น.,"ความไม่เบียดเบียน, การเว้นจากการทำร้าย."
อเหตุกทิฐิ 0,น.,ความเห็นว่าบาปบุญในโลกไม่มีเหตุไม่มีปัจจัย เป็นความเห็นของเดียรถีย์พวกหนึ่ง.
อโหสิ 0,ก.,"เลิกแล้วต่อกัน, ยกโทษให้."
อโหสิกรรม 0,น.,กรรมที่เลิกให้ผล
อโหสิกรรม 1,น.,"การเลิกแล้วต่อกัน, การไม่เอาโทษแก่กัน."
ออ 0,ก.,"รวมกันเป็นกลุ่ม, คั่งกันอยู่, เช่น คนอออยู่หน้าประตู."
อ้อ 0,น.,ชื่อหญ้าชนิด Arundo donaxL. ในวงศ์ Gramineae ขึ้นเป็นกอในที่ชื้นแฉะ ลำต้นแข็งเป็นปล้อง ข้างในกลวง.
อ๋อ 0,น.,"ชื่อวิธีแทงโปกำและโปปั่นวิธีหนึ่ง มีถูกประตูเดียว กิน ๓ ประตู คือ ถ้าลูกค้าแทงอ๋อประตูเดียว โปออกประตูที่แทงนั้น เจ้ามือต้องจ่าย ๓ ต่อ ถ้าออกประตูอื่น เจ้ามือกิน, เรียกกิริยาที่แทงเช่นนั้น ว่า แทงอ๋อ."
ออ 1,น.,คำนำหน้าชื่อผู้ชายที่ตนพูดด้วยหรือพูดถึง เช่น ออมั่น ออคง.
อ้อ 1,อ.,"คำที่เปล่งออกมาแสดงว่ารู้แล้ว เข้าใจแล้ว หรือนึกได้, อ๋อ ก็ว่า."
อ๋อ 1,อ.,"คำที่เปล่งออกมาแสดงว่ารู้แล้ว เข้าใจแล้ว หรือนึกได้, อ้อ ก็ว่า."
ออก 0,น.,คำนำหน้าบรรดาศักดิ์ เช่น ออกพระ ออกหลวง ออกขุน
ออก 1,น.,เรียกพ่อแม่ผู้ให้กำเนิด ว่า พ่อออก แม่ออก
ออก 2,น.,เรียกเมืองที่สวามิภักดิ์ ว่า เมืองออก.
ออก 3,น.,ชื่อเหยี่ยวขนาดใหญ่ชนิด Haliaeetus leucogaster (Gmelin) ในวงศ์ Accipitridae หัวและด้านล่างของลำตัวสีขาว ปีกสีเทา ทำรังแบบง่าย ๆ ด้วยกิ่งไม้บนชะง่อนหินหรือหน้าผา หากินใกล้แหล่งน้ำ กินปลาและงูทะเล.
ออก 4,ก.,"อาการที่เคลื่อนไปข้างนอกหรือพ้นจากที่ปิดบัง เช่น เลือดออก แดดออก, เคลื่อนจากที่ เช่น รถออก"
ออก 5,ก.,ทำให้ปรากฏ เช่น ออกภาพทางโทรทัศน์ ออกลอตเตอรี่ ลอตเตอรี่ออก
ออก 6,ก.,ทำให้เกิดขึ้น มีขึ้น เช่น ออกกฎหมาย
ออก 7,ก.,พ้นภาวะ เช่น ออกจากงาน
ออก 8,ก.,"แตก, ผลิ, งอก, เช่น ออกกิ่ง ออกใบอ่อน ออกราก"
ออก 9,ก.,จ่าย เช่น ออกเงิน
ออก 10,ก.,แสดง เช่น ออกท่า
ออก 11,ก.,นำ เช่น ออกหน้า
ออก 12,ก.,เปลี่ยนการบรรเลงจากเพลงหนึ่งไปเป็นอีกเพลงหนึ่ง เช่น บรรเลงเพลงลมพัดชายเขาจบ ออกเพลงลมหวน
ออก 13,ก.,เป็นกริยาช่วย หมายความว่า ค่อนข้าง เช่น ใจออกจะโกรธ ออกฉุน.
ออก 14,ว.,ตรงข้ามกับ เข้า เช่น ทางออก
ออก 15,ว.,"ขยาย, แยกเป็นคนละส่วน, เช่น คลี่ออก แบ่งออก"
ออก 16,ว.,"หลุดไปได้, สำเร็จไปได้, เช่น ร้องออก ถอนออก"
ออก 17,ว.,"ได้, ทำได้, เช่น อ่านออก นึกออก คิดออก"
ออก 18,ว.,คำประกอบหลังคำอื่นเพื่อเน้นให้ความเด่นขึ้น เช่น ดำออกอย่างนี้
ออก 19,ว.,ขึ้น เช่น ตะวันออก เมืองออก.
ออกกำลัง 0,ก.,ใช้กำลัง
ออกกำลัง 1,ก.,บริหารร่างกายเพื่อให้แข็งแรง.
ออกของ 0,ก.,ติดต่อขอรับสิ่งของที่ส่งมาจากต่างประเทศจากกรมศุลกากร เช่น ไปออกของที่กรมศุลกากร.
ออกขุนนาง 0,ก.,เสด็จออกว่าราชการแผ่นดิน (ใช้เฉพาะพระมหากษัตริย์).
ออกแขก 0,ก.,ต้อนรับแขก
ออกแขก 1,ก.,"แสดงต่อหน้าแขก, แสดงตัวในสังคม"
ออกแขก 2,ก.,อาการที่ลิเกตัวแขกออกมาบอกเรื่องที่จะแสดง.
ออกแขก 3,น.,การแสดงลิเกตอนที่มีตัวแขกออกมาบอกเรื่องที่จะแสดง.
ออกโขน 0,ก.,"กระโดดโลดเต้นอึกทึกครึกโครมอย่างเล่นโขน, ทำท่าและออกเสียงเอะอะด้วยความโกรธ, มักใช้เข้าคู่กับคำ ออกยักษ์ เป็น ออกยักษ์ออกโขน."
ออกไข้หัว 0,ก.,"อาการที่ไข้หัวผุดขึ้นมา, เป็นไข้หัว."
ออกงาน 0,ก.,ไปปรากฏตัวในงานสังคม
ออกงาน 1,ก.,แสดงแก่ประชาชนหรือสังคมครั้งแรก (ใช้แก่วงมหรสพ โขน ละคร สตรีสาว).
ออกงิ้ว 0,ก.,แสดงอาการโกรธโดยทำท่าทางและส่งเสียงเอะอะตึงตังอย่างเล่นงิ้ว.
ออกจะ 0,ว.,ค่อนข้างจะ เช่น เธอออกจะอ้วน ของออกจะแพง.
ออกชื่อ 0,ก.,"บอกชื่อ, ขานชื่อ, แสดงชื่อ."
ออกซิเจน 0,น.,ธาตุลำดับที่ ๘ สัญลักษณ์ O เป็นแก๊ส มีปนอยู่ในอากาศประมาณร้อยละ ๒๐ โดยปริมาตร ไม่มีสี ไม่มีกลิ่น ไม่มีรส ไม่ติดไฟ แต่ช่วยให้ไฟติด มีประโยชน์อย่างยิ่งต่อการหายใจและการเผาไหม้เป็นต้น ใช้จุดกับแก๊สอะเซทิลีนเพื่อเชื่อมหรือตัดโลหะ ในทางแพทย์ใช้ช่วยการหายใจของคนไข้.
ออกซิเดชัน 0,น.,"ปฏิกิริยาเคมีที่ทำให้สารได้รับธาตุออกซิเจนมารวมตัวด้วย หรือทำให้สารสูญเสียธาตุไฮโดรเจนไป, ปฏิกิริยาเคมีที่ทำให้อะตอมของธาตุสูญเสียอิเล็กตรอนไป."
ออกซุ้ม 0,ก.,บรรเลงทำนองเพลงสำเนียงลาวต่อท้ายเพลงเดี่ยวลาวแพนโดยเฉพาะ.
ออกไซด์ 0,น.,สารประกอบที่มีองค์ประกอบเป็นธาตุออกซิเจนกับธาตุอื่น.
ออกญา 0,น.,บรรดาศักดิ์ชั้นสูงที่พระราชทานในสมัยอยุธยา สูงกว่าออกพระ เข้าใจว่ามาจากเขมร.
ออกดอก 0,ก.,"เกิดเป็นเม็ดตามผิวหนังเนื่องจากกามโรคเรื้อรัง, มักใช้เข้าคู่กับคำ เข้าข้อ เป็น เข้าข้อออกดอก"
ออกดอก 1,ก.,เอาเงินให้กู้เพื่อเก็บดอกเบี้ย.
ออกดอกออกผล 0,ก.,ทำให้เกิดผลประโยชน์หรือกำไรเพิ่มพูนขึ้น.
ออกเดือน 0,น.,กำหนดเวลาที่ไพร่หลวงไพร่สมไม่ต้องมาทำงานให้ทางราชการหลังจากการเข้าเดือนในแต่ละปี เป็นจำนวนเดือน มากหรือน้อยเปลี่ยนแปลงไปตามสมัย เช่น เข้าเดือน ออกเดือน เข้าเดือน ออก ๒ เดือน เข้าเดือน ออก ๓ เดือน. (ดู เข้าเดือน ประกอบ).
ออกตัว 0,ก.,พูดกันตัวหรือแก้ตัวไว้ก่อน
ออกตัว 1,ก.,ปลดเปลื้องสิ่งที่ตกหนักแก่ตัว
ออกตัว 2,ก.,เริ่มเคลื่อนที่ครั้งแรก (ใช้แก่การแข่งขัน)
ออกตัว 3,ก.,เอาไปทำผลประโยชน์ได้ เช่น ซื้อทองดีกว่าเพราะออกตัวได้ง่าย.
ออกท่า 0,ก.,แสดงกิริยาอาการเป็นท่าทางต่าง ๆ.
ออกท่าออกทาง 0,ก.,แสดงกิริยาอาการเป็นท่าทางต่าง ๆ.
ออกทุกข์ 0,ก.,เลิกไว้ทุกข์.
ออกทุน 0,ก.,"ลงทุน, จ่ายเงินทำทุน."
ออกโทรทัศน์ 0,ก.,ปรากฏตัวหรือแพร่ภาพทางโทรทัศน์.
ออกไท้ 0,น.,คำเรียกผู้เป็นใหญ่ หมายถึง กษัตริย์ เช่น คิดปรานีออกไท้ รอยราชละห้อยไห้ ถึงลูกแลนะหัว ลูกเอยฯ (ลอ).
ออกนอกหน้า 0,ว.,"แสดงความรู้สึกให้ปรากฏทางสีหน้า, แสดงอาการให้ปรากฏอย่างชัดแจ้ง."
ออกนาม 0,ก.,"บอกชื่อ, ขานชื่อ, แสดงชื่อ."
ออกบวช 0,ก.,ไปถือเพศเป็นพระหรือนักพรตอื่น ๆ
ออกบวช 1,ก.,ทางศาสนาอิสลาม หมายถึง เลิกถือศีลอด.
ออกเบอร์ 0,น.,วิธีการขายของด้วยการทำสลาก กำหนดตัวเลข มักใช้เลขท้าย ๒ ตัวของลอตเตอรี่รางวัลที่ ๑ เป็นเลขที่ได้รับของ.
ออกปาก 0,ก.,พูดขอความช่วยเหลือ เช่น ออกปากขอแรงชาวบ้านมาช่วยงาน
ออกปาก 1,ก.,พูดเชิงตำหนิ เช่น เขาใช้เงินเปลืองจนแม่ออกปาก.
ออกผื่น 0,ว.,มีผื่นขึ้นตามตัว.
ออกฝี 0,ก.,"เป็นฝีดาษ, (โบ) ออกไข้หัว."
ออกฝีดาษ 0,ก.,"เป็นฝีดาษ, (โบ) ออกไข้หัว."
ออกพรรษา 0,น.,"เรียกวันที่สิ้นสุดการจำพรรษาแห่งพระสงฆ์ คือ วันขึ้น ๑๕ คํ่าเดือน ๑๑ ว่า วันออกพรรษา, วันปวารณา หรือ วันมหาปวารณา ก็เรียก."
ออกเพลงเร็ว 0,ก.,บรรเลงเพลงช้าแล้วเปลี่ยนเป็นเพลงเร็ว.
ออกไฟ 0,ก.,เลิกอยู่ไฟ.
