เฟื่องฟุ้ง 1,ว.,"เชี่ยวชาญ, ชำนิชำนาญ, (ใช้แก่สติปัญญา), ฟุ้งเฟื่อง ก็ว่า."
เฟื่องฟู 0,ว.,"เจริญ, มั่งคั่ง, รุ่งเรือง, เช่น ฐานะกำลังเฟื่องฟู, ฟูเฟื่อง ก็ว่า."
เฟือน 0,ว.,"หลง ๆ ลืม ๆ, เลือน."
เฟือย 0,น.,"ริมนํ้าที่มีหญ้ารก ๆ หรือมีไม้น้ำปกคลุม, ชายเฟือย ก็ว่า."
เฟื้อย 0,ว.,ลักษณะของสิ่งที่ยาวมาก ในคำว่า ยาวเฟื้อย.
แฟ่ 0,ว.,เสียงดังเช่นนั้นอย่างเสียงจุดไม้ขีดไฟติด
แฟ่ 1,ว.,มาก ในคำว่า หรูแฟ่.
แฟง 0,น.,"ชื่อไม้เถาชนิด Benincasa hispida (Thunb.) Cogn. ในวงศ์ Cucurbitaceae ผลใหญ่รูปกลมหรือรี เมื่อแก่ผิวแข็งมีคราบขาว กินได้ เมล็ดใช้ทำยา มีหลายพันธุ์ ต่างกันที่ลักษณะของผล, พันธุ์ผลเล็ก ผิวบางมีขน เรียก แฟง, พันธุ์ที่ผลมีรสขม ใช้ทำยาได้ เรียก ฟักขม."
แฟชั่น 0,น.,"สมัยนิยม, แบบหรือวิธีการที่นิยมกันทั่วไปในชั่วระยะเวลาหนึ่ง."
แฟน 0,น.,"ผู้นิยมชมชอบ เช่น แฟนเพลง แฟนภาพยนตร์ แฟนมวย, ผู้เป็นที่ชอบพอรักใคร่, คู่รัก, สามีหรือภรรยา."
แฟบ 0,ว.,อาการของสิ่งที่ตามปรกติควรจะโป่งหรือพอง แต่ได้ยุบหรือแบนลงไป เช่น ยางรถแฟบ ท้องแฟบ อกแฟบ จมูกแฟบ.
แฟ้ม 0,น.,ภาชนะชนิดหนึ่ง สานด้วยไม้ไผ่หรือหวาย รูปร่างคล้ายฝาหอยแครงประกบเป็นคู่ ขอบปากตอนบนมีหูสำหรับสอดไม้คานเพื่อหาบไป ใต้หูมีห่วงและลูกสลักสำหรับขัดปาก ขอบด้านล่างถักพันให้ติดกันอย่างบานพับ ใช้ใส่เสบียงกรัง เช่น ปลาย่าง เนื้อเค็ม พริกแห้ง
แฟ้ม 1,น.,"ที่สำหรับเก็บแผ่นกระดาษ มีปกหน้าปกหลังทำด้วยกระดาษแข็งเป็นต้น มีหลายชนิด เช่น ชนิดเจาะข้าง ชนิดมีสปริงสำหรับหนีบกระดาษ ชนิดมีซองสำหรับใส่เอกสาร, กระเป๋าหิ้วสำหรับใส่เอกสาร."
แฟรนเซียม 0,น.,ธาตุลำดับที่ ๘๗ สัญลักษณ์ Fr เป็นโลหะ ลักษณะเป็นของแข็ง หลอมละลายที่ ๒๗ °ซ. เป็นธาตุกัมมันตรังสี.
แฟลกซ์ 0,น.,"ชื่อไม้ล้มลุกชนิด Linum usitatissimumL. ในวงศ์ Linaceae ต้นตรง ใบแคบและยาว ดอกสีนํ้าเงิน ใยจากลำต้นใช้ทอเป็นผ้าเรียก ผ้าลินิน, เมล็ดให้นํ้ามันเรียก นํ้ามันลินสีด, ลินิน ก็เรียก."
แฟลต 0,น.,ห้องชุด ตามปรกติประกอบด้วยห้องนอน ห้องรับแขก ห้องครัว ห้องนํ้า พร้อมอยู่ในชั้นเดียวกันและรวมอยู่ในตึกหลังใหญ่ สำหรับอยู่อาศัยหรือให้เช่า.
แฟะ 0,ว.,เละ.
โฟกัส 0,น.,จุดที่แนวแสงลู่เข้าทั้งหมดไปตัดกัน หรือจุดที่แนวแสงลู่ออกทั้งหมดต่อย้อนหลังไปตัดกัน กรณีแรก เรียกว่า โฟกัสจริง กรณีหลัง เรียกว่า โฟกัสเสมือน
โฟกัส 1,น.,จุดที่ตรึงอยู่กับที่ซึ่งคู่กับเส้นไดเรกตริกซ์ ใช้กำหนดบังคับเซตของจุดชุดหนึ่งให้เรียงกันเป็นเส้นโค้งในระบบภาคตัดกรวย.
ไฟ 0,น.,ชื่อธาตุอย่างหนึ่งในธาตุทั้ง ๔ คือ ดิน น้ำ ไฟ ลม
ไฟ 1,น.,ผลจากปฏิกิริยาเคมีซึ่งก่อให้เกิดความร้อน แสงสว่าง และเปลว คือ กลุ่มแก๊สที่กำลังลุกไหม้ ทำให้ไหม้สิ่งต่าง ๆ ได้
ไฟ 2,น.,ผ่านการอยู่ไฟมาแล้ว เช่น สามไฟ คือ อยู่ไฟมาแล้ว ๓ ครั้ง
ไฟ 3,น.,"ไฟฟ้า เช่น ไฟสว่าง, โดยปริยายหมายถึง ความเดือดร้อน เช่น ตอนนี้บ้านเมืองกำลังเป็นไฟ."
ไฟกัลป์ 0,น.,"ไฟล้างโลกเมื่อสิ้นกัป, ไฟบรรลัยกัลป์ หรือ ไฟประลัยกัลป์ ก็ว่า."
ไฟกิเลส 0,น.,กิเลสที่เปรียบเสมือนไฟเพราะทำให้จิตใจเร่าร้อน ได้แก่ ราคะ โทสะ และโมหะ.
ไฟจุกตูด 0,ว.,มีธุระร้อนมาก.
ไฟฉาย 0,น.,เครื่องทำความสว่าง ประกอบด้วยอุปกรณ์สำคัญ คือ จานฉายรูปโค้งสำหรับสะท้อนแสงและหลอดไฟฟ้า ซึ่งบรรจุอยู่ในเรือนกรอบกับสิ่งให้พลังงานที่ก่อให้เกิดแสงสว่าง มีหลายชนิด ชนิดที่ถือติดตัวไปมาได้ มักทำเป็นรูปทรงกระบอก.
ไฟแช็ก 0,น.,เครื่องขีดไฟชนิดหนึ่ง เวลาใช้ต้องทำให้จักรโลหะครูดกับถ่านไฟแช็ก เกิดประกายไฟติดไส้ที่ชุ่มด้วยนํ้ามันหรือแก๊สที่บรรจุอยู่ลุกเป็นเปลวไฟขึ้น.
ไฟธาตุ 0,น.,ไฟที่โบราณถือว่ามีในร่างกายมนุษย์และสัตว์ สำหรับให้ความอบอุ่นแก่ร่างกายและย่อยอาหาร.
ไฟบรรลัยกัลป์ 0,น.,ไฟกัลป์.
ไฟประลัยกัลป์ 0,น.,ไฟกัลป์.
ไฟฟ้า 0,น.,พลังงานรูปหนึ่งซึ่งเกี่ยวข้องกับการแยกตัวออกมา หรือการเคลื่อนที่ของอิเล็กตรอนหรือโปรตอนหรืออนุภาคอื่นที่มีสมบัติแสดงอำนาจคล้ายคลึงกับอิเล็กตรอนหรือโปรตอน ใช้ประโยชน์ก่อให้เกิดพลังงานอื่น เช่น ความร้อน แสงสว่าง การเคลื่อนที่.
ไฟฟ้ากระแส 0,น.,ไฟฟ้าที่เกิดขึ้นเนื่องจากอิเล็กตรอนปรากฏเป็นอิสระอยู่บนวัตถุ และเคลื่อนที่เป็นกระแส.
ไฟฟ้าสถิต 0,น.,ไฟฟ้าที่เกิดขึ้นเนื่องจากอิเล็กตรอนหรือโปรตอนปรากฏเป็นอิสระอยู่บนวัตถุ และไม่เคลื่อนที่เป็นกระแส.
ไฟลามทุ่ง 0,น.,ชื่อโรคผิวหนังชนิดหนึ่ง มีลักษณะลามออกไป.
ไฟสุมขอน 0,น.,"ไฟที่คุกรุ่นอยู่ในขอนไม้ขนาดใหญ่ ดับยาก, โดยปริยายหมายถึง อารมณ์รัก โกรธ หรือแค้นเป็นต้นที่ร้อนรุ่มอยู่ในใจ."
