เซอร์โคเนียม 0,น.,ธาตุลำดับที่ ๔๐ สัญลักษณ์ Zr เป็นโลหะหายาก ลักษณะเป็นของแข็ง หลอมละลายที่ ๑๘๕๒ ^ºซ.
เซอะ 0,ว.,เซ่อมาก.
เซอะซะ 0,ว.,เซ่อซ่า.
เซา 0,น.,เสียงบอกให้วัวหรือควายหยุด.
เซา 1,ก.,"หย่อนลงกว่าเดิม, เพลาลง, เช่น ความนิยมในดาราคนนี้เริ่มเซาลง."
เซา 2,ว.,"ง่วงงุน เช่น ขี้เซา ซึมเซา, เหงาหงอย เช่น ซบเซา."
เซ้าซี้ 0,ก.,"พูดรบเร้ารํ่าไรเพื่อให้ได้ตามที่ต้องการ, กระเซ้ากระซี้ ก็ว่า."
เซาะ 0,ก.,ทำให้กร่อนหรือร่อยหรอเข้าไปทีละน้อย เช่น นํ้าเซาะตลิ่ง เซาะรูให้กว้าง.
เซาะ 1,น.,ซอกเขาเล็ก ๆ ที่นํ้าเซาะให้เป็นทางลงมา.
เซาะลาย 0,ก.,ใช้สิ่วทำให้เป็นลวดลายหรือรอยลึก.
เซิ้ง 0,ก.,รำแบบชาวอีสานตามจังหวะเสียงขับ เช่น เซิ้งกระติบข้าว.
เซิง 0,น.,ที่รกเป็นสุมทุมพุ่มไม้หรือมีไม้เถาปกคลุมอยู่ข้างบน เช่น เซิงฟัก.
เซิง 1,น.,ลมที่พัดจากตะวันตกมาตะวันออก เรียกว่า ลมเซิง.
เซิง 2,ก.,"ยก, ยกย่อง."
เซียน 0,น.,"ผู้บำเพ็ญพรตจนมีอิทธิฤทธิ์, ผู้วิเศษ"
เซียน 1,น.,โดยปริยายหมายความว่า ผู้ที่เก่งหรือชำนาญในทางใดทางหนึ่งเป็นพิเศษ เช่น เซียนการพนัน เซียนกล้วยไม้.
เซียบ 0,ว.,"เงียบ, สงัด."
เซียมซี 0,น.,ใบทำนายโชคชะตาตามศาลเจ้าหรือวัดเป็นต้น มีเลขหมายเทียบกับเลขหมายบนติ้วที่เสี่ยงได้.
เซี่ยว 0,ว.,"เฉไม่ตรงแนวมีรูปเรียวปลายคล้ายรูปชายธง, เช่น ผ้าเซี่ยว ใบตองเซี่ยว ตัดเซี่ยว."
เซี้ยว 0,ว.,"ไม่เต็มบาท, บ๊อง ๆ, เพี้ยน ๆ."
เซียว 0,ว.,มีเนื้อแข็งเป็นแกน (ใช้แก่หัวเผือกหัวมัน).
เซียว 1,ว.,"ซีดเพราะป่วยไข้เป็นต้น, ไม่สดใส, ไม่สดชื่น, (ใช้แก่หน้า)."
เซี่ยวกาง 0,น.,รูปอารักษ์แบบจีนผู้รักษาประตูวัด วัง หรือศาลเจ้า มักเขียน สลัก หรือปั้นไว้ที่บานประตูหรือ ๒ ข้างช่องประตู.
เซื่อง 0,ว.,"เงื่องหงอย, ซึม, มักใช้เข้าคู่กับคำ ซึม เป็น ซึมเซื่อง หรือ เซื่องซึม."
เซือม 0,น.,"ชื่อปลานํ้าจืดขนาดกลางหลายชนิดในวงศ์ Siluridae ไม่มีเกล็ด มีฟันเล็กแต่แหลมคม ลำตัวแบนข้างมากบ้างน้อยบ้าง เช่น ชนิด Phalacronotus apogon (Bleeker), P. bleekeri (Günther), Kryptopterus cryptopterus (Bleeker), K. limpok (Bleeker), Ompok bimaculatus (Bloch), O. hypophthalmus (Bleeker), Ceratoglanis scleronemus (Bleeker), ข้างท้องมักเป็นสีเงิน ขนาดแตกต่างกันตั้งแต่ ๒๐-๗๗ เซนติเมตร อาจมีหรือไม่มีครีบหลังก็ได้ บางชนิดลำตัวด้านหลังสีเทาอมเขียวหรือสีนํ้าตาล, มีชื่อไทยที่เรียกแตกต่างกันหรือซํ้าซ้อนกันระหว่างชนิด ได้แก่ ชะโอน โอน แดง นาง เกด ปีกไก่ นํ้าเงิน หน้าสั้น สยุมพร หรือ เซือม."
แซ 0,น.,เรือที่ขุดขึ้นจากซุงทั้งต้น รูปร่างเช่นเดียวกับเรือกราบแต่เพรียวน้อยกว่า ใช้ในการลำเลียงพล ศัสตราวุธ ยุทโธปกรณ์ และเสบียงกรัง อาจใช้เป็นเรือทุ่นหรือทำหน้าที่อื่นได้.
แซ่ 0,ว.,"มีเสียงอื้ออึงจนฟังไม่ได้ศัพท์, โจษกันแพร่หลาย."
แซ่ 1,น.,ชื่อสกุลวงศ์ของจีน.
แซก 0,น.,"ชื่อเพลงไทยทำนองหนึ่ง, เดิมเขียนเป็น แซก."
แซ็กคาริน 0,น.,ชื่อสารประกอบเคมี มีสูตร C_6H_4SO_2·CONH ลักษณะเป็นผลึกสีขาว ละลายนํ้าได้เล็กน้อย มีความหวานประมาณ ๕๕๐ เท่าของนํ้าตาลทราย ไม่มีคุณค่าทางอาหาร ในทางแพทย์ใช้แทนนํ้าตาลทรายสำหรับคนไข้ที่เป็นโรคเบาหวานและคนที่อ้วนมาก.
แซ็กคารินโซเดียม 0,น.,แซ็กคารินซึ่งผลิตออกในรูปสารประกอบโซเดียม ละลายนํ้าได้ดี มีความหวานประมาณ ๔๐๐ เท่าของนํ้าตาลทราย ไม่มีคุณค่าทางอาหาร ใช้ได้อย่างแซ็กคาริน.
แซง 0,น.,ต้นไม้ชนิดหนึ่งคล้ายต้นปรือ.
แซง 1,น.,"เรียกม้าหลวงหรือช้างหลวงพวกหนึ่งที่จัดให้เดินเลียบไปข้าง ๆ กระบวนแห่หรือกองทัพ ว่า ม้าแซง ช้างแซง, เรียกเรือกราบซึ่งจัดเข้าร่วมไปในกระบวนเรือหลวง มีหน้าที่ป้องกันภัยกระบวนเรือพระที่นั่งโดยแซงขนาบอยู่ ๒ ข้างกระบวน ว่า เรือแซง."
แซง 2,ก.,เบียดหรือเฉียดเพื่อจะขึ้นหน้า เช่น เดินแซง ขับรถแซง แซงคิว
แซง 3,ก.,สอดแทรกเข้ามาในระหว่าง เช่น พูดแซง.
แซงแซว 0,น.,"ชื่อนกขนาดเล็กในวงศ์ Dicruridae ตาสีแดง ขนสีดำหรือเทาเป็นมัน หางเรียวยาว เว้าตื้นหรือเว้าลึก กินแมลง ในประเทศไทยมีหลายชนิด เช่น แซงแซวหางปลา[ Dicrurus macrocercus (Vieillot)] แซงแซวสีเทา ( D. leucophaeus Vieillot), ชนิดที่มีขนหาง ๑ คู่ เป็นก้านยาวออกไป ตรงปลายแผ่ออกเป็นแผงขน มี ๒ ชนิด เรียกกันทั่วไปว่า แซงแซวหางบ่วง คือ แซงแซวหางบ่วงใหญ่ [ D. paradiseus (Linn.)] และแซงแซวหางบ่วงเล็ก [ D. remifer (Temminck)], เรียกสิ่งเช่นธงที่มีรูปเป็นแฉกเหมือนหางนกแซงแซว ว่า ธงหางแซงแซว."
แซ่ซ้อง 0,ก.,เปล่งเสียงแสดงความนิยมยินดีหรือสรรเสริญกันทั่วไป.
แซ่ด 0,ว.,มีเสียงเซ็งแซ่จนฟังไม่ได้ศัพท์ เช่น คุยกันแซ่ด.
แซ่ด ๆ 0,ก.,อาการที่เซไปทรงตัวไม่อยู่ เช่น เซแซ่ด ๆ.
แซ่บ 0,ว.,อร่อย.
แซม 0,ก.,"แทรกขึ้นมาในระหว่าง เช่น ฟันแซม ขนแซม, เสียบเข้าไปในระหว่าง เช่น เด็ดดอกไม้แซมผม, เอาสิ่งใดสิ่งหนึ่งเหน็บแทรกหรือสอดเข้าไปเพื่อแทนสิ่งที่ชำรุดให้ดีขึ้น เช่น แซมกระบุง แซมหลังคา."
แซม 1,น.,เรียกม้าที่มีขนสีอื่นแทรกขึ้นมาในระหว่างขนที่เป็นพื้น ว่า ม้าแซม.
แซยิด 0,น.,"วันที่มีอายุครบ ๕ รอบนักษัตร คือ ๖๐ ปีบริบูรณ์ตามคติของจีน, เรียกการทำบุญในวันเช่นนั้นว่า ทำบุญแซยิด."
แซว 0,ก.,กระเซ้า.
แซ่ว 0,ว.,"อาการที่นอนนิ่งอยู่กับที่เคลื่อนไหวไปไหนไม่ได้ในลักษณะที่หมดกำลังหรือเจ็บป่วยเป็นต้น ในคำว่า นอนแซ่ว, แอ้วแซ่ว ก็ว่า."
แซะ 0,ก.,"เอาเครื่องมือแบน ๆ เช่นตะหลิวหรือเสียมแทงเบา ๆ โดยรอบแล้วช้อนขึ้นให้หลุดล่อนจากที่เดิม เช่น แซะขนมเบื้อง, โดยปริยายหมายความว่า เร่งรัด เช่น ต้องคอยแซะให้ทำงานอยู่เรื่อย."
แซะ 1,น.,ชื่อกล้วยไม้ชนิด Dendrobium scabrilingue Lindl. ในวงศ์ Orchidaceae กลีบดอกสีขาว กลีบกระเป๋าสีเขียวอ่อนถึงเหลือง กลิ่นหอม.
โซ 0,ว.,"อดอยาก เช่น อดโซ ผอมโซ หิวโซ, ยากจน เช่น ผัวข้าหาปลาประสาโซ แต่จมูกไม่โหว่เหมือนผู้ดี (สังข์ทอง)."
โซ 1,ก.,หิว เช่น โซก็เสาะใส่ท้อง จับเนื้อกินเอง (โลกนิติ).
โซ่ 0,น.,กะเหรี่ยง.
โซ่ 1,น.,โลหะมีเหล็กเป็นต้นลักษณะเป็นห่วงหรือวงรีที่เกี่ยวกันเป็นข้อ ๆ เป็นสายยาวสำหรับผูกล่ามแทนเชือก.
โซก 0,ก.,เปียกมากจนไหลอาบไปทั่ว เช่น เหงื่อโซก.
โซ่ง 0,น.,"ชาวไทพวกหนึ่ง ผู้ชายนุ่งกางเกงสีดำหรือสีครามแก่ ผู้หญิงนุ่งซิ่นสีดำหรือสีครามแก่มีลายขาวเป็นทาง ๆ ลงมา เรียกว่า ลายแตงโม, ซ่ง ซงดำ หรือ ไทดำ ก็เรียก."
โซงโขดง 0,น.,"ทรงผมของหญิงไทยสมัยโบราณ ซึ่งรวบเข้าไปเกล้าไว้บนขม่อมเป็นห่วงยาว ๆ โดยมากมีเกี้ยวหรือพวงมาลัยสวม, โองโขดง ก็ว่า."
โซซัดโซเซ 0,ก.,"ไปหรือมาอย่างอ่อนแรงอ่อนกำลัง เช่น โซซัดโซเซกลับบ้าน, ไปอย่างไม่มีจุดหมาย เช่น ตั้งแต่ตกงานเขาก็เที่ยวโซซัดโซเซอยู่นาน."
โซเซ 0,ว.,กิริยาที่เดินเป๋ไปเป๋มา ทรงตัวไม่อยู่เพราะอ่อนแรงหรือเมาเหล้าเป็นต้น.
โซดา 0,น.,นํ้าที่อัดแก๊สคาร์บอนไดออกไซด์ด้วยความดัน บรรจุไว้ในขวดหรือกระป๋อง เมื่อเปิดภาชนะบรรจุมีฟองแก๊สผุดขึ้นมา.
โซดาแผดเผา 0,น.,"สารประกอบชนิดหนึ่ง ชื่อโซเดียมไฮดรอกไซด์ (NaOH) เป็นของแข็งสีขาว ดูดความชื้นดีมาก ละลายนํ้าได้ดี ใช้ประโยชน์ในอุตสาหกรรมทำสบู่ ไหมเรยอง, โซดาไฟ หรือ คอสติกโซดา ก็เรียก."
โซดาไฟ 0,น.,โซดาแผดเผา.
โซเดียม 0,น.,ธาตุลำดับที่ ๑๑ สัญลักษณ์ Na เป็นโลหะสีขาวคล้ายโลหะเงิน เนื้ออ่อน หลอมละลายที่ ๙๗.๘ ^ºซ. สารประกอบสำคัญของธาตุนี้ที่พบมาก คือ เกลือแกง.
โซเดียมคาร์บอเนต 0,น.,เกลือปรกติชนิดหนึ่ง มีสูตร Na_2CO_3 เมื่อเป็นผลึกมีสูตร Na_2CO_3·10H_2O ลักษณะเป็นผลึกสีขาว ละลายนํ้าได้ ใช้ประโยชน์ในอุตสาหกรรมทำแก้ว สบู่ กระดาษ ทำลายความกระด้างของนํ้า.
โซเดียมซัลเฟต 0,น.,เกลือปรกติชนิดหนึ่ง มีสูตร Na_2SO_4 เมื่อเป็นผลึกมีสูตร Na_2SO_4·10H_2O ลักษณะเป็นผลึกสีขาว ละลายนํ้าได้ มีสมบัติเป็นยาถ่าย ใช้ประโยชน์ในอุตสาหกรรมทำสบู่ ผงซักฟอก สีย้อม แก้ว กระดาษ.
โซเดียมไซคลาเมต 0,น.,ชื่อสารประกอบเคมี มีสูตร C_6H_11NHSO_3Na ลักษณะเป็นผงสีขาว ละลายนํ้าได้ มีรสหวานกว่านํ้าตาลทรายมาก ใช้เป็นตัวให้ความหวานในเครื่องดื่ม มีหลักฐานว่าสารนี้ก่อให้เกิดโรคมะเร็งได้.
โซเดียมไฮโดรเจนกลูทาเมต 0,น.,เกลือกรดชนิดหนึ่ง มีสูตร HOOC·(CH_2)_2·CH(NH_2) COONa ลักษณะเป็นผลึกสีขาว ละลายนํ้าได้ ใช้ประโยชน์ชูรสอาหาร มักเรียกกันว่า ผงชูรส.
โซเดียมไฮโดรเจนคาร์บอเนต 0,น.,เกลือกรดชนิดหนึ่ง มีสูตร NaHCO_3 ลักษณะเป็นผงสีขาว ใช้ประโยชน์เป็นตัวทำให้ขนมมีลักษณะฟูพรุน เช่น ขนมปัง ใช้เป็นองค์ประกอบเคมีในเครื่องดับเพลิง ทางแพทย์ใช้เป็นตัวลดกรดในกระเพาะอาหาร.
โซเดียมไฮโดรเจนซัลเฟต 0,น.,เกลือกรดชนิดหนึ่ง มีสูตร NaHSO_4 ลักษณะเป็นของแข็ง ละลายนํ้าได้ ใช้ประโยชน์เป็นสารทำความสะอาดแผ่นเหล็กก่อนที่จะฉาบด้วยดีบุก.
โซ่ตรวน 0,น.,เครื่องจองจำที่มีโซ่และตรวน.
โซม 0,ก.,เปียกทั่ว เช่น เหงื่อโซมตัว.
โซม 1,น.,คำบอกให้ช้างย่อตัว.
โซรม 0,ก.,"รุมกัน, ช่วยกัน, เช่น จึ่งจะรุมโรมโซรมปรทยด (ม. คำหลวง ชูชก), เลือดไหลคือโชรเซราะธาร ยักษาพลพาน โซรมก็ผาดผลาญผลง (อนิรุทธ์)."
โซรมโรม 0,ก.,"รุมรบกัน, เขียนเป็น โซรมรโรม ก็มี เช่น ศรสาตรสาตรา- วุธโซรมรโรมแทง (อนิรุทธ์)."
โซรมศัสตราวุธ 0,ก.,"โทรมศัสตราวุธ, ระดมฟันแทงพุ่งศัสตราวุธเข้าไป."
โซลา 0,น.,"นํ้ามันเชื้อเพลิงชนิดหนึ่ง ซึ่งใช้กับเครื่องยนต์ดีเซลชนิดหมุนเร็ว โดยใช้ความร้อนซึ่งเกิดจากกำลังอัดของลูกสูบจุดระเบิด, ทางการเรียกว่า นํ้ามันดีเซลหมุนเร็ว."
โซ่ลาน 0,น.,โซ่เหล็กกว้างประมาณ ๔ มิลลิเมตร หนา ๐.๕ มิลลิเมตร ไม่ยืดหรือหดในทุกอุณหภูมิ มี ๒ ขนาด คือ ยาว ๔๐ เมตร และ ๕๐ เมตร ทั้ง ๒ ขนาด แบ่งออกเป็น ๑๐๐ ข้อต่อกัน ใช้วัดที่ดิน.
ไซ 0,น.,เครื่องสานสำหรับดักปลา มีหลายชนิด เช่น ไซตั้ง ไซนอน.
ไซ้ 0,ก.,"กิริยาที่นกหรือเป็ดเอาปากยํ้า ๆ ขนหรือหาอาหาร, ซุกซอนไปเรื่อย ๆ เช่น เด็กไซ้อกแม่หานมกิน."
ไซ 1,น.,ชื่องูน้ำจืดขนาดกลางชนิด Enhydris bocourti Jan ในวงศ์ Colubridae หัวป้อมใหญ่ ปลายปากมน คอไม่คอด ลำตัวอ้วนกลมสีน้ำตาลเหลืองหรือน้ำตาลแดง บนหลังมีลายเป็นปล้องใหญ่ หางสั้น มีพิษอ่อนมาก ผู้ถูกกัดมักไม่มีปฏิกิริยาต่อพิษงูชนิดนี้.
ไซ้ 1,ว.,"คำสำหรับเน้นความหมายของคำหน้า มีความหมายไปในทางว่า อย่างนั้น, เช่นนั้น, ทีเดียว, เช่น ผลเดื่อเมื่อสุกไซร้ มีพรรณ ภายนอกแดงดูฉัน ชาดบ้าย (โลกนิติ), ไซ้ ก็ว่า."
ไซ 2,น.,"ชื่อหนึ่งของดาวฤกษ์ธนิษฐา มี ๔ ดวง, ดาวกา ดาวเศรษฐี ดาวศรวิษฐา หรือดาวธนิษฐะ ก็เรียก."
ไซ 3,น.,ชื่อหญ้าชนิด Leersia hexandraSw. ในวงศ์ Gramineae ชอบขึ้นในที่ลุ่ม ใบยาวแหลมคม.
ไซเกิล 0,น.,"ชุดของการเปลี่ยนแปลงที่เกิดขึ้นจากภาวะหนึ่งจนกระทั่งกลับคืนมาสู่ภาวะแท้จริงเดิมอีก เช่น การเปลี่ยนแปลงในการเคลื่อนที่ของไฟฟ้ากระแสสลับเริ่มจากภาวะที่ไม่มีกระแสจนกระทั่งกระแสทวีค่าสูงสุดในทิศทางหนึ่ง แล้วลดลงจนไม่มีกระแส จากนี้กระแสทวีค่าขึ้นอีก จนสูงสุดในทิศทางตรงข้าม แล้วจึงกลับลดลงจนสู่ภาวะไม่มีกระแสอีก ดังนี้เรียกว่า กระแสไฟฟ้าเคลื่อนที่ครบ ๑ ไซเกิล จึงใช้จำนวนไซเกิลต่อวินาทีเป็นหน่วยวัดความถี่ของกระแสไฟฟ้าสลับและความถี่ของคลื่นแม่เหล็กไฟฟ้า, ปัจจุบันใช้ เฮิรตซ์ แทน ไซเกิล."
ไซโคลน 0,น.,ชื่อพายุหมุนที่มีกำลังแรงจัด ทำให้มีฝนตกหนักมาก เกิดขึ้นในมหาสมุทรอินเดีย ทะเลอาหรับ และอ่าวเบงกอล มีความเร็วลมใกล้บริเวณศูนย์กลางตั้งแต่ ๖๕ นอต หรือ ๑๒๐ กิโลเมตรต่อชั่วโมงขึ้นไป.
ไซ้ท้อง 0,ก.,ทำให้รู้สึกปวดจี๊ด ๆ หลายที่ในท้อง เช่น ยาดำไซ้ท้อง.
ไซน์ 0,น.,ไซน์ของมุมใดคืออัตราส่วน ในเมื่อถือเอารูปสามเหลี่ยมมุมฉาก (ที่มีมุมนั้น) เป็นหลัก.
ไซยาไนด์ 0,น.,เกลือปรกติของกรดไฮโดรไซยานิก (HCN) เช่น โพแทสเซียมไซยาไนด์ (KCN) โซเดียมไซยาไนด์ (NaCN) เกลือไซยาไนด์ทั้งหมดเป็นพิษอย่างร้ายแรง.
ไซร้ 0,ว.,"คำสำหรับเน้นความหมายของคำหน้า มีความหมายไปในทางว่า อย่างนั้น, เช่นนั้น, ทีเดียว, เช่น ผลเดื่อเมื่อสุกไซร้ มีพรรณ ภายนอกแดงดูฉัน ชาดบ้าย (โลกนิติ), ไซ้ ก็ว่า."
