ซอส 0,น.,เครื่องปรุงรส มีลักษณะเหลวหรือค่อนข้างข้น ใช้จิ้มหรือปรุงอาหารเพื่อให้มีรสชาติดีขึ้น.
ซอสามสาย 0,น.,ชื่อซอชนิดหนึ่ง มีสาย ๓ สาย กะโหลกซอทำด้วยกะลามะพร้าว มีลักษณะเป็น ๓ พู มีเสียงไพเราะนุ่มนวล ใช้บรรเลงคลอเสียงผู้ขับร้อง บรรเลงร่วมในวงมโหรี หรือบรรเลงเดี่ยว.
ซออู้ 0,น.,ชื่อซอชนิดหนึ่ง มีสาย ๒ สาย กะโหลกซอตัดจากกะโหลกมะพร้าว มีเสียงทุ้มกังวาน ใช้บรรเลงรวมอยู่ในวงเครื่องสาย วงมโหรี วงปี่พาทย์ไม้นวม และวงปี่พาทย์ดึกดำบรรพ์.
ซอโอก 0,น.,ชื่อซอชนิดหนึ่ง มี ๒ สาย ลักษณะคล้ายซอด้วงแต่ใหญ่กว่ามาก เวลาสีตั้งซอขึ้นจากพื้น.
ซะซร้าว 0,ว.,เสียงร้องเซ็งแซ่.
ซะซ่อง 0,ว.,"ซ่องซ่อง, เงื่อง, เซื่อง, บางทีเขียนเป็น ซซ่อง ก็มี เช่น เถ้าก็ชุลมุนไปซซ่อง ยังช้นนช่องดงดอย (ม. คำหลวง มหาพน)."
ซะซอเซีย 0,ว.,"เสียงนกร้องจอแจ, บางทีเขียนเป็น ซซอเซีย ก็มี เช่น นกจอกนกจาบมีทงงนกจิบ เยียซซิบซซอเซีย (ม. คำหลวง มหาพน)."
ซะซิกซะแซ 0,ว.,"เสียงร้องไห้มีสะอื้น, บางทีเขียนเป็น ซซิกซแซ ก็มี เช่น ก็พร้อมกนนกล้นนน้ำตามิได้ ไห้ซซิกซแซไปในที่น้นน (ม. คำหลวง ทานกัณฑ์)."
ซะซิบ 0,ว.,"เสียงเช่นเสียงนกเล็ก ๆ ร้อง, บางทีเขียนเป็น ซซิบ ก็มี เช่น นกจอกนกจาบมีทงงนกจิบ เยียซซิบซซอเซีย (ม. คำหลวง มหาพน)."
ซะเซาะ 0,ก.,"เซาะ, ทำให้แหว่งเข้าไป, ทำให้พังเข้าไป."
ซะเซียบ 0,ว.,เงียบเชียบ.
ซัก 0,ก.,ทำให้สิ่งที่ทำด้วยเส้นใยเช่นผ้า สะอาดด้วยการขยี้ในน้ำหรือใช้แปรง มักใช้สบู่หรือผงซักฟอกด้วย.
ซัก 1,ก.,ไล่เลียงให้กระจ่างแจ้ง เช่น ทนายซักพยาน ซักถาม.
ซักค้าน 0,ก.,"การที่คู่ความอีกฝ่ายหนึ่งซักถามพยาน เมื่อคู่ความฝ่ายที่อ้างพยานได้ซักถามพยานเสร็จแล้ว, ซักค้าน ก็ใช้."
ซักซ้อม 0,ก.,"สอบให้แม่นยำ, สอบให้คล่อง, แนะกันไว้ล่วงหน้า, ซ้อมซัก ก็ว่า."
ซักไซ้ 0,ก.,ไต่ถามไล่เลียงให้ถี่ถ้วน.
ซักถาม 0,ก.,ถามและไล่เลียงให้ตอบ.
ซักฟอก 0,ก.,ชำระให้หมดมลทิน.
ซักฟอก 1,ก.,ซักถามให้ได้ความจะแจ้ง.
ซักส้าว 0,น.,ชื่อการเล่นชนิดหนึ่งของเด็กโดยจับแขนดึงกันไปมา.
ซักแห้ง 0,ก.,ทำความสะอาดเสื้อผ้าหรือสิ่งทอต่าง ๆ ด้วยวิธีพิเศษ เช่นใช้สารเคมีโรยบนรอยเปื้อนแล้วปัดออก หรือแช่ลงในสารละลายเคมี.
ซัง 0,น.,ตอข้าวที่เกี่ยวรวงแล้ว
ซัง 1,น.,สิ่งที่เป็นเส้น ๆ หุ้มยวงขนุน
ซัง 2,น.,ฝักข้าวโพดที่เอาเมล็ดออกหมดแล้ว
ซัง 3,น.,ตาที่อยู่ตามมุมของกระดานดวด เป็นที่ที่ปลอดภัย ซึ่งหมากไม่ถูกฝ่ายตรงข้ามกินและสามารถกินหมากของฝ่ายตรงข้ามได้.
ซั้ง 0,น.,"ที่ล่อปลาให้เข้าไปอยู่ ใช้ไม้ปักตามชายฝั่งลำแม่นํ้า เป็นรูปกลมบ้างรีบ้าง ภายในสุมด้วยกิ่งไม้เพื่อล่อปลาให้เข้าอาศัย เมื่อเวลาจะจับปลาก็เอาเฝือกหรืออวนล้อมแล้วเอาไม้ที่สุมนั้นออก, กรํ่า หรือ กลํ่า ก็ว่า."
ซังกะตาย 0,ว.,"ไม่เต็มใจ, ฝืนใจ, อย่างเสียไม่ได้, เช่น ซังกะตายกิน ซังกะตายทำ."
ซังตาย 0,ว.,"ไม่เต็มใจ, ฝืนใจ, อย่างเสียไม่ได้, เช่น ซังกะตายกิน ซังกะตายทำ."
ซัด 0,น.,ชื่อไม้ล้มลุกชนิด Trigonella foenumgraecumL. ในวงศ์ Leguminosae เมล็ดใช้ทำยาได้ และใช้ต้มชุบผ้าให้มีกลิ่นหอม เรียกว่า ลูกซัด.
ซัด 1,ก.,"สาดโดยแรง เช่น ซัดทราย, สาดไปทั่ว ๆ เช่น ซัดปูนก่อนจะแต่งผิวให้เป็นมัน, เหวี่ยงไปโดยแรง เช่น ซัดหอก ซัดเชือกบาศ, ปล่อยลง, ทิ้งลง, เช่น ซัดลูกบาศก์, อาการที่คลื่นเหวี่ยงตัวเข้ากระทบโดยแรง เช่น คลื่นซัดฝั่ง คลื่นซัดเรือจนเรือโคลง, โยนความผิดไปให้คนอื่น เช่น นายดำซัดนายขาวว่าเป็นคนทำผิด, รำทิ้งแขนออกไปข้างหน้าหรือด้านข้าง เช่น ซัดแขน"
ซัด 2,ก.,วิถีดวงอาทิตย์จากเหนือไปใต้ เช่น พระอาทิตย์ซัดไปซัดมา (ศริพจน์)
ซัด 3,ก.,คำค่อนว่าหมายความว่า แต่งตัวเกินพอดี เช่น ไปงานแค่นี้ไม่ต้องซัดชุดหรูก็ได้.
ซัด 4,ก.,กิน เช่น ซัดก๋วยเตี๋ยวไป ๓ ชาม
ซัด 5,ก.,ทำร้าย โดยการชก ตบ ตี เป็นต้น เช่น พูดไม่ดีระวังจะถูกซัดปาก.
ซัด 6,ก.,"ละ, ทิ้ง, หลบหนี, เช่น แม้นซัดพลัดหนีไปตายแห่งอื่นเปนพับทังสองข้าง ต่างคนต่างจะเอาเงินอันยังเหลืออยู่แก่กันนั้นมิได้เลย (สามดวง)."
ซัดข้าวสาร 0,ก.,สาดข้าวสารในการขับไล่ผีเป็นต้น.
ซัดชาตรี 0,น.,การรำไหว้ครูก่อนที่จะแสดงละครชาตรี.
ซัดเซ 0,ก.,"ไปอย่างไม่มีจุดหมาย, มักใช้เข้าคู่กับคำ พเนจร เป็น ซัดเซพเนจร."
ซัดทราย 0,ก.,"สาดทรายที่คั่วจนร้อนเทลงมาจากกำแพงให้ถูกข้าศึก, สาดทรายที่ปลุกเสกแล้วไปรอบ ๆ บริเวณ เพื่อให้เป็นสิริมงคล."
ซัดทอด 0,ก.,"อ้างถึง, บ่งถึง"
ซัดทอด 1,ก.,ให้การพาดพิงถึงบุคคลอื่นว่าได้ร่วมหรือมีส่วนในการกระทำความผิดหรือเป็นผู้กระทำความผิด.
ซัดน้ำ 0,ก.,สาดนํ้าในพิธีแต่งงานบ่าวสาว.
ซัดยา 0,ก.,ใส่ยาลงในเบ้าที่หลอมโลหะในการเล่นแร่แปรธาตุ.
ซั้น 0,ว.,นั้น
ซั้น 1,ว.,"รีบ, เร็ว, ถี่, ติด ๆ กัน, เช่น เชอญเสด็จภักพลหมั้น แต่งทับซั้นไปหน่วง (ตะเลงพ่าย)."
ซับ 0,ก.,เอาของเช่นผ้าหรือกระดาษทาบลงที่นํ้าหรือที่เปียกหรือสิ่งที่มีลักษณะคล้ายคลึงเช่นนั้นเพื่อให้ดูดน้ำขึ้นมาหรือเพื่อให้แห้ง เช่น ซับเหงื่อ
ซับ 1,ก.,"ซึมซาบ, กำซาบ."
ซับ 2,น.,สีที่ใช้รองในกระเปาะแหวนในการฝังเพชรหรือพลอย
ซับ 3,น.,เรียกกระดาษที่ใช้ซับหมึกให้แห้ง ว่า กระดาษซับ
ซับ 4,น.,เรียกที่ที่มีน้ำซึมซาบอยู่ภายใต้ ว่า ที่น้ำซับ.
ซับขนุน 0,น.,"ชื่อปลาทะเลขนาดเล็กถึงขนาดกลางชนิด Lactarius lactarius (Bloch & Schneider) ในวงศ์ Lactariidae ลำตัวกว้าง แบนข้าง หัวโต ปากกว้างและเชิดขึ้น เกล็ดหลุดง่าย มีครีบหลัง ๒ ตอน ตอนที่ ๒ ยาวและมีลักษณะคล้ายครีบก้นซึ่งอยู่ตรงข้ามและยาวกว่าเล็กน้อย ลำตัวสีเงินตลอด ที่ขอบด้านบนของแผ่นปิดเหงือกมีจุดสีดำเด่น ครีบต่าง ๆ สีเหลืองอ่อน พบตลอดชายฝั่ง ขนาดยาวได้ถึง ๔๐ เซนติเมตร, ขนุน ญวน ซับขนุน หรือ สาบขนุน ก็เรียก."
ซับซ้อน 0,ก.,"ปะปนทับกันอยู่หลายชั้น เช่น เอกสารกองซับซ้อนอยู่บนโต๊ะ, ยุ่งยากสับสนสะสางยาก เช่น คดีซับซ้อน."
ซับซาบ 0,ก.,ซึมซาบ.
ซับซี่ 0,ก.,"ซุบซิบพูดจากัน, กระซิบกัน, เช่น ความขำเขาซับซี่ในวัดที่ดรธานปล่ยวน้นน (ม. คำหลวง ชูชก)."
ซับใน 0,น.,ผ้าที่เย็บทาบอยู่ชั้นในของเครื่องแต่งกาย.
ซับใน 1,ก.,เย็บผ้าทาบอยู่ชั้นในของเครื่องแต่งกาย เช่น ซับในเสื้อตัวนี้ให้ด้วย.
ซับพระพักตร์ 0,น.,ผ้าเช็ดหน้า.
ซัลฟา 0,น.,ชื่อยาประเภทหนึ่ง มีสมบัติหยุดยั้งการเจริญเติบโตของแบคทีเรีย.
ซั้ว 0,ว.,คำร้องตวาดเสียงดังอย่างนั้น เป็นเสียงสำหรับไล่ไก่เป็นต้น.
ซั้ว 1,น.,ชื่อแกงชนิดหนึ่ง มักต้มผักหลายชนิดและเนื้อสัตว์ให้สุกก่อนแล้วจึงนำมาหั่นหรือฉีกเป็นชิ้นเล็ก ๆ ใส่ลงในหม้อต้มใหม่พร้อมกับเครื่องปรุงประสมปลาร้า เช่น ซั้วไก่ ซั้วกบ.
ซา 0,น.,ชื่อเรือโบราณชนิดหนึ่ง.
ซ่า 0,น.,ส้มซ่า. (ดู ส้ม ๑).
ซา 1,ก.,"ลดน้อยลงกว่าที่เป็นอยู่, บรรเทาเบาลงกว่าที่เป็นอยู่, เช่น ฝนซา คนซา."
ซ่า 1,น.,ชื่อปลานํ้าจืดหลายสกุลในวงศ์ Cyprinidae บางชนิดมีจุดสีดำบนเกล็ดข้างตัวจนเห็นเป็นลาย ๖-๑๐ เส้น ที่โคนหางมีจุดสีดำ ขนาดยาวได้ถึง ๓๐ เซนติเมตร เช่น ขี้ขม [ Osteochilus hasselti (Valenciennes)] สร้อยลูกกล้วย ( Dangila spilopleura Smith).
ซ่า 2,ว.,อาการที่ปรากฏแก่ร่างกายเมื่อเวลาขนลุกหรือเป็นเหน็บเป็นต้น
ซ่า 3,ว.,เสียงดังอย่างเสียงนํ้าแตกกระจาย.
ซ่า 4,น.,เรียกผักบุ้งซอยต้มสุก โรยด้วยน้ำมันงากับถั่วงา ว่า ผักซ่า.
ซาก 0,น.,"ร่างของคนหรือสัตว์ที่ตายจนโทรมเหลือพอเป็นเค้าให้รู้ว่าเคยเป็นอะไร, สิ่งก่อสร้างที่ปรักหักพังแล้วเหลือพอเป็นเค้าให้รู้ว่าเคยเป็นอะไร."
ซาก 1,น.,"ชื่อไม้ต้นขนาดใหญ่ชนิด Erythrophleum succirubrum Gagnep. และชนิด E. teysmannii (Kurz) Craib ในวงศ์ Leguminosae ขึ้นในป่าเบญจพรรณ เนื้อแข็งและหนัก ใช้เผาถ่านได้ดี ทุกส่วนมีพิษ กินตาย ชนิดแรกใบเกลี้ยง ชนิดหลังใบมีขน, อีสานเรียก ซาด หรือ พันซาด."
ซากดึกดำบรรพ์ 0,น.,ซากของพืชหรือสัตว์ที่ฝังอยู่เป็นเวลานานมาก จนกระทั่งกลายเป็นหิน.
ซากศพ 0,น.,"ศพ เช่น แม้นพระองค์ไม่ทรงเลี้ยงมัทรีไว้ จะนิ่งมัธยัสถ์ตัดเยื่อใยไม่โปรดบ้าง ก็จะเห็นแต่กเลวระร่างซากศพของมัทรี (ม. ร่ายยาว มัทรี), เจ้าพี่เอ๋ยอุตส่าห์พาซากศพ มาให้พบผัวรักเมื่อเป็นผี (ตับนางลอย), บางทีเขียนเป็น ทรากศพ ก็มี เช่น พระบาทเจ้าจะได้ทอดทัศนา ซึ่งทรากศพสาธารณนอนตาย (ม. คำหลวง มัทรี), ร่างของคนที่ตายมานานแล้วแต่มีเค้าพอให้สันนิษฐานได้ว่าเป็นผู้ชายหรือผู้หญิงเป็นต้น."
ซาง 0,น.,ชื่อไผ่หลายชนิดในสกุล Dendrocalamus วงศ์ Gramineae ชนิดปล้องเล็กยาว เนื้อบาง ใช้เป็นลำกล้องเป่าลูกดอกหรือลูกดินเหนียวปั้นกลมเป็นต้น เรียกว่า ไม้ซาง.
ซ่าง 0,น.,บ่อนํ้า.
ซาง 1,น.,ชื่อโรคชนิดหนึ่ง ตามตำราแพทย์แผนโบราณว่าเป็นแก่เด็กเล็ก มีลักษณะเกิดเป็นเม็ดขึ้นในปากในคอ ลิ้นเป็นฝ้า มีอาการ เช่น ไม่กินนม ไม่กินข้าว ปวดหัวตัวร้อน มีชื่อต่าง ๆ เช่น ซางเพลิง ซางนํ้า ซางขโมย ซางโจร ซางโค.
ซ่าง 1,น.,"สิ่งปลูกสร้างชั่วคราวขนาดย่อม ยกพื้น และดาดหลังคา สำหรับพระสงฆ์นั่งสวดพระอภิธรรมในงานออกพระเมรุ ตั้งอยู่ ๔ มุมพระเมรุ, คดซ่าง คดสร้าง สร้าง ส้าง สำซ่าง หรือ สำสร้าง ก็เรียก."
ซาง 2,น.,บ่อนํ้า.
ซาด 0,น.,ต้นซาก. (ดู ซาก ๒).
ซาน 0,ก.,"ไปหาที่พึ่งหรือที่พักพิง เพราะความบอบช้ำ หมดแรงหรือหมดหนทาง, ซมซาน หรือ ซานซม ก็ว่า."
ซ่าน 0,ก.,แล่นกระจายไปทั่วตัวเหมือนอย่างพิษซ่าน เสียวซ่าน.
ซานซม 0,ก.,"ไปหาที่พึ่งหรือที่พักพิง เพราะความบอบช้ำ หมดแรงหรือหมดหนทาง เช่น ในที่สุดเขาก็ซานซมกลับบ้านเกิด, ซาน หรือ ซมซาน ก็ว่า."
ซานซม 1,ว.,"งมงาย, ไม่รู้อะไร, เช่น โง่ซานซม, ซมซาน ก็ว่า."
ซ่านเซ็น 0,ก.,"กระจัดกระจาย, มักใช้เข้าคู่กับคำ แตกฉาน เป็น แตกฉานซ่านเซ็น."
ซาบซ่าน 0,ก.,แล่นไปทั่วร่างกาย เช่น ปีติซาบซ่าน.
ซาบซึ้ง 0,ว.,"อาการที่รู้สึกจับใจอย่างลึกซึ้ง, อาการที่รู้สึกปีติปลาบปลื้มมาก."
ซาบะ 0,น.,ชื่อปลาทะเลขนาดกลาง มี ๓ ชนิด คือ ชนิด Scomber australasicus Cuvier ชนิด S. japonicas Houttuyn และชนิด S. scombrus Linn. ในวงศ์ Scombridae ลำตัวกลมยาว เรียวไปทางคอดหาง ชนิดแรกมีลวดลายสีน้ำเงินเข้มเป็นเส้นทะแยงหยักเรียงขนานชิดกันเป็นระเบียบอยู่เหนือเส้นข้างตัว ที่ต่ำลงไปจนถึงท้องลวดลายจะแตกเป็นจุดประสีเทาจางกระจายอยู่ทั่วไป ส่วนชนิดที่ ๒ มีลวดลายหยิกหยักสีน้ำเงินจางกว่า และกินบริเวณเกือบถึงแนวกลางลำตัว ๒ ชนิดแรกเป็นปลาฝูง พบกระจายพันธุ์อยู่ในเขตมหาสมุทรแปซิฟิกและอินเดีย ชนิดที่ ๓ มีลายสีน้ำเงินเป็นริ้วขวางอยู่ครึ่งบนของลำตัว พบอยู่ในมหาสมุทรแอตแลนติกตอนเหนือและทะเลเมดิเตอร์เรเนียน.
ซ่าโบะ 0,น.,"ผ้าห่มอย่างผ้าสไบ เช่น ซ่าโบะกรองสุวรรณพรรณราย (ดาหลัง), อันซ่าโบะรอยทรงจงพระทัย จะขอเปลี่ยนสไบโฉมเฉลา (อิเหนา)."
ซาแมเรียม 0,น.,ธาตุลำดับที่ ๖๒ สัญลักษณ์ Sm เป็นโลหะหายาก ลักษณะเป็นของแข็ง หลอมละลายที่ ๑๐๗๒ ^ºซ.
ซ้าย 0,ว.,"ตรงข้ามกับ ขวา, ถ้าหันหน้าไปทางทิศตะวันออก ด้านทิศเหนือ เรียกว่า ด้านซ้ายมือ ด้านทิศใต้ เรียกว่า ด้านขวามือ, ถ้าหันหลังไปทางต้นนํ้าหรือยอดนํ้า ด้านซ้ายมือ เรียกว่า ฝั่งซ้าย ด้านขวามือ เรียกว่า ฝั่งขวา เช่น ฝั่งพระนครอยู่ฝั่งซ้ายของแม่น้ำเจ้าพระยา"
ซ้าย 1,ว.,"เรียกกลุ่มที่มีอุดมคติเพื่อลดช่องว่างระหว่างชนชั้นในด้านเศรษฐกิจและการเมือง เป็นต้น มักใช้วิธีการที่รุนแรงและรวดเร็ว ว่า ฝ่ายซ้าย, โดยทั่วไปใช้หมายถึงกลุ่มที่นิยมลัทธิสังคมนิยมและคอมมิวนิสต์."
ซาลาเปา 0,น.,ของกินอย่างหนึ่งของจีน ทำด้วยแป้งสาลีปั้นเป็นลูกกลม ข้างในใส่ไส้ นึ่งให้สุก มีทั้งไส้หวานและไส้เค็ม.
ซาว 0,ก.,เอาข้าวสารล้างนํ้าด้วยวิธีใช้มือคนให้ทั่วเพื่อให้สะอาดก่อนหุงต้ม เรียกว่า ซาวข้าว.
ซาว 1,ว.,ยี่สิบ.
ซาวน้ำ 0,น.,ของกินอย่างหนึ่ง มีขนมจีน กุ้งแห้งป่น กระเทียมซอย ขิงซอย สับปะรดสับ เป็นต้น กับเครื่องปรุงรส ราดด้วยหัวกะทิหรือแจงลอน เรียกว่า ขนมจีนซาวนํ้า.
