อาทิตย์ 3,น.,ชื่อวันที่ ๑ ของสัปดาห์
อาทิตย์ 4,น.,รอบ ๗ วัน เช่น ไม่ว่างตลอดอาทิตย์.
อาทิตย- 0,น.,“เชื้ออทิติ” คือ เทวดาพวกหนึ่งซึ่งเป็นลูกนางอทิติผู้เป็นชายาพระกัศยปประชาบดี เทวดาพวกนี้มีจำนวนกล่าวไว้ต่างกัน บ้างว่ามี ๕ องค์ บ้างว่ามี ๗ องค์ บ้างว่ามี ๑๒ องค์ ได้แก่ อินทราทิตย์ (พระอินทร์) วรุณาทิตย์ (พระพิรุณ) ฯลฯ สูรยาทิตย์ (พระอาทิตย์ที่ส่องโลก)
อาทิตย- 1,น.,ชื่อเทวดาพระเคราะห์ คือ สูรยาทิตย์
อาทิตย- 2,น.,"ดวงตะวัน (ชื่อเทวดาองค์หนึ่งในนิยาย), ในตำรานพเคราะห์นับเอาเป็นดาวพระเคราะห์ที่ ๑"
อาทิตย- 3,น.,ชื่อวันที่ ๑ ของสัปดาห์
อาทิตย- 4,น.,รอบ ๗ วัน เช่น ไม่ว่างตลอดอาทิตย์.
อาทิตยมณฑล 0,น.,"ดวงอาทิตย์, รูปที่แลดูแบนแห่งดวงอาทิตย์."
อาทิตย-วาร 0,น.,"วันอาทิตย์, สูรยวาร หรือ อาทิจจวาร ก็ว่า."
อาทีนพ 0,น.,โทษ (บางทีใช้ควบกันว่า อาทีนพโทษ หรือ อาทีนวโทษ)
อาทีนพ 1,น.,"ผลร้าย, บางทีใช้เป็นส่วนท้ายของคำสมาส เช่น กามาทีนพ = โทษของกาม."
อาทีนวะ 0,น.,โทษ (บางทีใช้ควบกันว่า อาทีนพโทษ หรือ อาทีนวโทษ)
อาทีนวะ 1,น.,"ผลร้าย, บางทีใช้เป็นส่วนท้ายของคำสมาส เช่น กามาทีนพ = โทษของกาม."
อาทึก 0,ว.,"เป็นที่ต้น, ก่อน, แรก, เบื้องต้น."
อาเทศ 0,น.,"การแนะนำ, คำชี้แจง, คำบอกเล่า, คำสั่ง, กฎ."
อาเทศ 1,น.,"การแปลงหรือแผลงพยัญชนะและสระตามข้อบังคับแห่งไวยากรณ์บาลีและสันสกฤต เช่น สมบัติ + อภิบาล อาเทศสระอิ ที่ ติ เป็น ย แล้วสนธิกับ อภิบาล เป็น สมบัตยาภิบาล, ธนุ + อาคม อาเทศสระอุ ที่ นุ เป็น ว แล้วสนธิกับ อาคม เป็น ธันวาคม, อธิ + อาสัย อาเทศอธิ เป็น อัชฌ แล้วสนธิกับ อาสัย เป็น อัชฌาสัย."
อาเทสนาปาฏิหาริย์ 0,น.,"การดักใจเป็นอัศจรรย์ หมายถึง การดักใจทายใจคนได้อย่างน่าอัศจรรย์, เป็นปาฏิหาริย์อย่าง ๑ ในปาฏิหาริย์ ๓ ได้แก่ อิทธิปาฏิหาริย์ อาเทสนาปาฏิหาริย์ และอนุสาสนีปาฏิหาริย์."
อาธรรม์ 0,ว.,"ชั่ว, ไม่เป็นธรรม, ไม่เที่ยงธรรม, ไม่ยุติธรรม."
อาธรรม 0,ว.,"ชั่ว, ไม่เป็นธรรม, ไม่เที่ยงธรรม, ไม่ยุติธรรม."
อาธรรมิก 0,ว.,"ชั่ว, ไม่เป็นธรรม, ไม่เที่ยงธรรม, ไม่ยุติธรรม."
อาธรรมึก 0,ว.,"ชั่ว, ไม่เป็นธรรม, ไม่เที่ยงธรรม, ไม่ยุติธรรม."
อาธาน 0,น.,"การตั้งไว้, การวางไว้, มักใช้เป็นส่วนท้ายของสมาส เช่น จิตกาธาน."
อาธาร 0,น.,"เครื่องคํ้าจุน, ฐานที่รองรับ, เช่น ปัตตาธาร = เชิงบาตร, ตีนบาตร คุณาธาร = ฐานที่รองรับคุณความดี"
อาธาร 1,น.,การอุปถัมภ์
อาธาร 2,น.,"อ่าง, หม้อนํ้า, ที่ขังนํ้า, สระ."
อ่าน 0,ก.,"ว่าตามตัวหนังสือ, ถ้าออกเสียงด้วย เรียกว่า อ่านออกเสียง, ถ้าไม่ต้องออกเสียง เรียกว่า อ่านในใจ"
อ่าน 1,ก.,สังเกตหรือพิจารณาดูเพื่อให้เข้าใจ เช่น อ่านสีหน้า อ่านริมฝีปาก อ่านใจ
อ่าน 2,ก.,ตีความ เช่น อ่านรหัส อ่านลายแทง
อ่าน 3,ก.,"คิด, นับ."
อาน 0,น.,เครื่องรองนั่งบนหลังสัตว์พาหนะหรือยานพาหนะบางชนิด เช่น อานม้า อานรถจักรยาน.
อาน 1,ว.,"บอบชํ้า เช่น ถูกตีเสียอาน, โดยปริยายหมายความว่า อย่างหนัก, อย่างมาก, เช่น ถูกต่อว่าอานเลย."
อาน 2,ก.,"ลับมีดหรืออาวุธให้คม เช่น อานดาบ อานอาวุธ, ใช้มีดหรืออาวุธถูกับหินให้เรียบหรือให้คม เช่น อานมีด อานหอก."
อาน 3,ก.,"กิน, เซ่น, เช่น เครื่องอาน ว่า เครื่องกินหรือเครื่องเซ่น."
อาน 4,ว.,"เป็นหมัน, ไม่มีลูก, (ใช้เฉพาะสัตว์)."
อาน- 0,น.,"ลมหายใจเข้า, นิยมใช้เข้าคู่กับ อปานะ คือ ลมหายใจออก เป็น อานาปานะ = ลมหายใจเข้าและลมหายใจออก ในคำว่า อานาปานัสสติ = สติที่กำหนดลมหายใจเข้าและลมหายใจออก."
อานก 0,ก.,"เอ็นดู, รักใคร่."
อานน 0,น.,"ปาก, หน้า"
อานน 1,น.,"ช่อง, ประตู."
อานนท์ 0,น.,"ความเพลิดเพลิน, ความยินดี, ความปลื้มใจ, มักใช้เป็นส่วนท้ายของคำสมาส เช่น จิตกานนท์."
อานนท์ 1,น.,"ชื่อปลา ๑ ใน ๗ ตัว ในหนังสือไตรภูมิกถา, ชื่อปลาใหญ่ในวรรณคดี เชื่อกันว่าหนุนแผ่นดิน เมื่อปลานี้พลิกตัวจะทำให้เกิดแผ่นดินไหว, อนนต์ ก็ว่า."
อานม้า 0,น.,"ชื่อหอยทะเลกาบคู่ชนิด Placuna ephippium (Philipsson) ในวงศ์ Placunidae เปลือกแบนค่อนข้างกลม โค้งเล็กน้อยคล้ายอานม้า สีนํ้าตาลเข้มหรือม่วงเข้ม, อานม้า ก็เรียก."
อ่านเล่น 0,ก.,อ่านเพื่อความเพลิดเพลิน เช่น เอาหนังสือไปอ่านเล่นสัก ๒ เล่มซิ.
อ่านเล่น 1,ว.,ที่แต่งขึ้นให้อ่านเพื่อความเพลิดเพลิน ในคำว่า หนังสืออ่านเล่น.
อ่านโองการ 0,ก.,ประกาศในพิธีพราหมณ์เพื่อสรรเสริญและอัญเชิญเทพเจ้า.
อานะ 0,น.,"ลูก, น้อง, (ใช้เป็นคำเรียกแสดงความรู้สึกรักและเอ็นดู), อะนะ หรือ อะหนะ ก็ว่า. [ช. anak ว่า ลูก (ใช้ได้ทั้งลูกคนและลูกสัตว์)]."
อานันท์ 0,น.,"ความเพลิดเพลิน, ความยินดี, ความปลื้มใจ, มักใช้เป็นส่วนท้ายของคำสมาส เช่น จิตกานนท์."
อานันทนะ 0,น.,"การรื่นเริง, การทำให้เพลิดเพลิน."
อานัม 0,น.,"ญวน, ใช้ว่า อนำ อนัม หรือ อานำ ก็มี."
อานาปาน- 0,น.,ลมหายใจเข้าออก ในคำว่า อานาปานัสสติ.
อานาปานะ 0,น.,ลมหายใจเข้าออก ในคำว่า อานาปานัสสติ.
อานาปานัสสติ 0,น.,สติที่กำหนดลมหายใจเข้าและลมหายใจออก.
อานำ 0,น.,"ญวน, ใช้ว่า อนำ อนัม หรือ อานัม ก็มี."
อานิก 0,ก.,"เอ็นดู, รักใคร่."
อานิสงส์ 0,น.,"ผลแห่งกุศลกรรม, ผลบุญ"
อานิสงส์ 1,น.,ประโยชน์ เช่น อานิสงส์กฐิน.
อานุภาพ 0,น.,"อำนาจ, ฤทธิ์เดช, ความยิ่งใหญ่."
อานุภาวะ 0,น.,"อำนาจ, ฤทธิ์เดช, ความยิ่งใหญ่."
อาบ 0,ก.,เอานํ้ารดตัวหรือลงในนํ้าทั้งตัว เพื่อแก้ร้อนหรือชำระล้างเหงื่อไคลเป็นต้น เรียกว่า อาบนํ้า
อาบ 1,ก.,"ชโลม, ทา, ทำให้ซึมซาบ, เช่น อาบนํ้ารัก ลูกศรอาบยาพิษ"
อาบ 2,ก.,ไหลโซม เช่น เหงื่ออาบหน้า.
อาบแดด 0,ก.,ให้ผิวกายส่วนใดส่วนหนึ่งหรือทั้งหมดถูกแดด เพื่อสุขภาพหรือความงาม.
อาบน้ำร้อนมาก่อน 0,ก.,เกิดก่อนจึงมีประสบการณ์มากกว่า.
อาบเหงื่อต่างน้ำ 0,ก.,ตรากตรำทำงานด้วยความเหนื่อยยาก.
อาบเอิบ 0,ก.,"อาบทั่วไป, ซึมซาบ"
อาบเอิบ 1,ก.,"ซาบซ่าน, เอิบอาบ ก็ว่า."
อาบัติ 0,น.,โทษที่เกิดจากการล่วงละเมิดสิกขาบทหรือข้อห้ามแห่งภิกษุ มี ๗ อย่าง คือ ปาราชิก สังฆาทิเสส ถุลลัจจัย ปาจิตตีย์ ปาฏิเทสนียะ ทุกกฎ ทุพภาษิต มีโทษ ๓ สถาน คือ ๑. โทษสถานหนัก เรียกว่า ครุโทษ หรือ มหันตโทษ ทำให้ภิกษุผู้ต้องอาบัติขาดจากความเป็นภิกษุ ได้แก่ อาบัติปาราชิก ซึ่งเรียกว่า ครุกาบัติ ๒. โทษสถานกลาง เรียกว่า มัชฌิมโทษ ทำให้ภิกษุผู้ต้องอาบัติต้องอยู่กรรมก่อนจึงจะพ้นโทษ ได้แก่ อาบัติสังฆาทิเสส และ ๓. โทษสถานเบา เรียกว่า ลหุโทษ ทำให้ภิกษุผู้ต้องอาบัติที่ตํ่ากว่าอาบัติสังฆาทิเสสต้องปลงอาบัติ คือ บอกอาบัติของตนแก่ภิกษุด้วยกัน ได้แก่ อาบัติถุลลัจจัย ปาจิตตีย์ ปาฏิเทสนียะ ทุกกฏ และทุพภาษิต ซึ่งเรียกว่า ลหุกาบัติ.
อาบัน 0,ก.,ต้อง เช่น อาบัติอาบัน ว่า ต้องอาบัติ
อาบัน 1,ก.,"ถึง, ลุ, เช่น โสดาบัน ว่า ถึงโสตธรรม คือ กระแสพระนิพพาน."
อาปณ- 0,น.,"ตลาด, ร้านขายของ."
อาปณกะ 0,น.,พ่อค้า.
อาปณะ 0,น.,"ตลาด, ร้านขายของ."
อาปะ 0,น.,"นํ้า, เมื่อใช้เป็นส่วนหน้าของสมาสมักใช้ว่า อาโป เช่น อาโปกสิณ อาโปธาตุ."
อาปาน- 0,น.,"การดื่ม, การเลี้ยง."
อาปานภูมิ 0,น.,"ห้องดื่ม, สถานที่เลี้ยงดูกัน."
อาปานศาลา 0,น.,ห้องเครื่องดื่ม.
อาปานะ 0,น.,"การดื่ม, การเลี้ยง."
อาโป 0,น.,"นํ้า, เมื่อใช้เป็นส่วนหน้าของสมาสมักใช้ว่า อาโป เช่น อาโปกสิณ อาโปธาตุ."
อาโปกสิณ 0,น.,วิธีเจริญสมถกรรมฐานโดยยึดหน่วงเอาธาตุนํ้าเป็นอารมณ์.
อาโปธาตุ 0,น.,ของเหลวที่เอิบอาบซาบซึมไปได้ เป็นธาตุ ๑ ในธาตุทั้ง ๔ คือ ๑. ปฐวีธาตุ = ธาตุดิน ๒. อาโปธาตุ = ธาตุนํ้า ๓. เตโชธาตุ = ธาตุไฟ ๔. วาโยธาตุ = ธาตุลม.
อาพัด 0,ก.,เสกเหล้ากินเพื่อให้คงกระพัน เรียกว่า อาพัดเหล้า.
อาพัทธ์ 0,ก.,"ผูกพัน, ติดพัน, เกี่ยวพัน."
อาพันธ์ 0,น.,"เครื่องผูก, การผูก."
อาพันธนะ 0,น.,"เครื่องผูก, การผูก."
อาพาธ 0,ก.,เจ็บป่วย (ใช้แก่ภิกษุสามเณร).
อาพาธิก 0,ว.,"เป็นไข้, เจ็บป่วย, เป็นโรค."
อาพาธึก 0,ว.,"เป็นไข้, เจ็บป่วย, เป็นโรค."
อาพิล 0,ว.,"ขุ่นมัว, เศร้าหมอง."
อาเพศ 0,น.,เหตุที่เกิดขึ้นอย่างผิดปรกติวิสัย ถือว่าเป็นลางไม่ดี.
อาภรณ์ 0,น.,"เครื่องประดับ, บางทีก็ใช้เป็นส่วนท้ายของคำสมาส เช่น พัสตราภรณ์ = เครื่องประดับคือเสื้อผ้า สิราภรณ์ = เครื่องประดับศีรษะ คชาภรณ์ = เครื่องประดับช้าง พิมพาภรณ์ = เครื่องประดับร่างกาย ในคำว่า ถนิมพิมพาภรณ์ ธรรมาภรณ์ = มีธรรมะเป็นเครื่องประดับ."
อาภัพ 0,ว.,"ปราศจากโชค, เคราะห์ร้าย, วาสนาน้อย, ตกอับ."
อาภัพเหมือนปูน 0,*ว.,ทำดีแต่มักถูกมองข้ามไปหรือไม่มีใครมองเห็น คล้ายในการกินหมาก จะต้องมีหมาก พลู ปูน ๓ อย่างประกอบกัน แต่คนมักพูดว่า กินหมากกินพลู โดยมิได้พูดถึงปูนเลย จะพูดถึงบ้างก็เป็นไปในทางที่ไม่ดีว่า ปูนกัดปาก.
อาภัสระ 0,น.,"ชื่อพรหมโลกชั้น ๑ ในรูปพรหม ๑๖ ชั้น, เรียกพรหมซึ่งอยู่ชั้นนี้ ว่า อาภัสรพรหม."
อาภัสระ 1,ว.,"สว่าง, สุกใส, เปล่งปลั่ง."
อาภา 0,น.,"แสง, รัศมี, ความสว่าง."
อาภากร 0,น.,พระอาทิตย์.
อาภาส 0,น.,"รัศมี, แสงสว่าง."
อ่าม 0,ว.,"ไม่ เช่น เลี้ยงลาอามสาย, หนึ่งจงเลี้ยงม่ามอ่ามสาย (ไตรภูมิ)."
อาม 0,ว.,"ไม่ เช่น เลี้ยงลาอามสาย, หนึ่งจงเลี้ยงม่ามอ่ามสาย (ไตรภูมิ)."
อาม 1,น.,เรียกลูกสาวคนที่ ๓ ว่า ลูกอาม.
อามลกะ 0,น.,มะขามป้อม.
อามัย 0,น.,"ความป่วยไข้, โรค, ความไม่สบาย, ตรงข้ามกับ อนามัย คือ ความสบาย ความไม่มีโรค."
อามิษ 0,น.,"สิ่งของวัตถุเครื่องล่อใจมีเงินเป็นต้น, เช่น อย่าเห็นแก่อามิสสินจ้าง."
อามิส 0,น.,"สิ่งของวัตถุเครื่องล่อใจมีเงินเป็นต้น, เช่น อย่าเห็นแก่อามิสสินจ้าง."
อามิส- 0,น.,"สิ่งของวัตถุเครื่องล่อใจมีเงินเป็นต้น, เช่น อย่าเห็นแก่อามิสสินจ้าง."
อามิสบูชา 0,น.,"การบูชาด้วยสิ่งของ, คู่กับ ปฏิบัติบูชา ซึ่งเป็นการบูชาด้วยการปฏิบัติตามคำสั่งสอน."
อาย 0,ก.,"รู้สึกกระดาก, รู้สึกขายหน้า."
อ้าย 0,น.,"เรียกลูกชายคนที่ ๑ ว่า ลูกอ้าย, คู่กับ ลูกหญิงคนที่ ๑ ว่า ลูกเอื้อย. (สามดวง)"
อ้าย 1,น.,โดยปริยายอนุโลมเรียกพี่ชายคนโต ว่า พี่อ้าย.
อ้าย 2,ว.,"ต้น, หนึ่ง, ในคำว่า เดือนอ้าย."
อาย 1,น.,"กลิ่น, มักใช้เข้าคู่กับคำ กลิ่น เป็น กลิ่นอาย."
อ้าย 3,น.,"คำประกอบคำอื่นบอกให้รู้ว่าเป็นเพศชายหรือสัตว์ตัวผู้ เช่น อ้ายหนุ่ม อ้ายด่าง, คำประกอบหน้าชื่อผู้ชายที่มีฐานะตํ่ากว่า อย่างนายเรียกคนใช้, คำประกอบหน้าชื่อเพื่อนฝูงแสดงว่ามีความสนิทสนมมาก มักใช้กันในหมู่เด็กผู้ชาย, คำใช้ประกอบหน้าชื่อผู้ชายแสดงความดูหมิ่นเหยียดหยาม, คำประกอบคำบางคำที่ผู้ใหญ่ใช้เรียกเด็กผู้ชายหรือผู้ชายที่อายุน้อยกว่ามากด้วยความเอ็นดูหรือสนิทสนมเป็นกันเอง เช่น อ้ายหนู อ้ายน้องชาย, คำประกอบหน้าคำบางคำเพื่อเน้น เช่น อ้ายเราก็ไม่ดี อ้ายจะไปก็ไม่มีที่จะไป อ้ายจะอยู่หรือก็คับใจ, คำประกอบหน้าชื่อสัตว์บางชนิดโดยไม่เน้นเพศ เช่น อ้ายเหลือม อ้ายทุย, คำประกอบหน้าคำบางคำเพื่อเน้นในเชิงบริภาษ เช่น อ้ายทึ่ม อ้ายโง่ อ้ายควาย, คำใช้แทนสิ่งที่กล่าวถึงและเป็นที่เข้าใจกัน เช่น อ้ายนั่น อ้ายนี่, เขียนเป็น ไอ้ ก็มี, (โบ) คำนำหน้าชื่อผู้ชาย มักใช้ในทางไม่ดี เช่น อ้ายดีผู้ร้ายรับเปนสัจให้การซัดพวกเพื่อนถึงอ้ายเชด อ้ายแสน อ้ายคง อ้ายมั้น (สามดวง)."
อ้ายโกร่ง 0,น.,"ชื่อจิ้งหรีดชนิด Brachytrypes portentosus (Lichtenstein) เป็นจิ้งหรีดที่มีขนาดใหญ่ที่สุด ยาวประมาณ ๔.๕ เซนติเมตร สีน้ำตาลตลอดทั้งตัว, อ้ายโกร่ง หรือ หัวตะกั่ว ก็เรียก, พายัพเรียก จี้กุ่ง หรือ ขี้กุ่ง, อีสานเรียก จิโป่ม จี่นายโม้ จี่ป่ม หรือ จี่โป่ง."
อ้ายขิก 0,น.,"ขิก, เขียนเป็น ไอ้ขิก ก็มี."
