คำ,POS,ความหมาย
ฟ 0,?,พยัญชนะตัวที่ ๓๑ เรียกว่า ฟอ ฟัน เป็นอักษรตํ่า ใช้เป็นพยัญชนะต้น และเป็นตัวสะกดในมาตรากบหรือแม่กบ เช่น เสิร์ฟ ไมโครเวฟ.
ฟก 0,ว.,"บวมชํ้า, บอบช้ำ."
ฟกช้ำ 0,ว.,"บวมชํ้า, บอบช้ำ."
ฟกช้ำดำเขียว 0,ว.,บวมชํ้าตามร่างกายเพราะถูกกระทบกระแทกอย่างแรง.
ฟ้ง 0,ก.,ฟุ้ง.
ฟรักโทส 0,น.,"นํ้าตาลชนิดหนึ่ง ประเภทโมโนแซ็กคาไรด์ ชนิดคีโทเฮ็กโซส ลักษณะเป็นของแข็ง สีขาว หลอมละลายที่ ๑๐๒ °ซ. มีปรากฏในผลไม้สุกที่มีรสหวาน นํ้าผึ้ง นํ้าต้อยของดอกไม้ มีรสหวานมากกว่านํ้าตาลทราย, เลวูโลส ก็เรียก."
ฟรี 0,ว.,ไม่เสียมูลค่าหรือไม่ได้ค่าตอบแทนใด ๆ เช่น เรียนฟรี ทำงานฟรี
ฟรี 1,ว.,ว่างจากงาน เช่น วันนี้ฟรี
ฟรี 2,ว.,อิสระ เช่น ล้อฟรี.
ฟรีบาร์ 0,ว.,เปิดบาร์ให้กินฟรีโดยไม่จำกัด ในคำว่า เปิดฟรีบาร์ (มักใช้แก่การเลี้ยงสุราเมรัย).
ฟลูออรีน 0,น.,ธาตุลำดับที่ ๙ สัญลักษณ์ F เป็นอโลหะ ลักษณะเป็นแก๊สสีเขียวแกมเหลือง มีสมบัติคล้ายคลอรีนแต่ให้ปฏิกิริยาเคมีไวกว่า.
ฟ่อ 0,ว.,เสียงดังเช่นนั้นอย่างงูเห่าขู่.
ฟ้อ 0,ว.,เสียงดังเช่นนั้นอย่างงูเห่าขู่.
ฟ้อ 1,ว.,"เพริศพริ้ง, กระชุ่มกระชวย, สดชื่น, เช่น หนุ่มฟ้อ ยังฟ้ออยู่."
ฟอก 0,ก.,ทำให้สะอาดหมดจด เช่น ฟอกผ้า ฟอกจิตใจ.
ฟอกเงิน 0,ก.,การโอน รับโอน หรือเปลี่ยนสภาพทรัพย์สินที่เกี่ยวกับการกระทำความผิดบางประการ เพื่อซุกซ่อนหรือปกปิดแหล่งที่มาของทรัพย์สินนั้น หรือเพื่อช่วยเหลือผู้อื่นมิให้ต้องรับโทษหรือรับโทษน้อยลง หรือการปกปิดอำพรางการได้มา ฯลฯ ซึ่งทรัพย์สินที่เกี่ยวกับการกระทำความผิด.
ฟอกน้ำตาล 0,ก.,เอาเปลือกไข่ใส่ลงไปในขณะเชื่อมน้ำตาล เพื่อให้น้ำเชื่อมใสสะอาด.
ฟอกผ้า 0,ก.,เอาสบู่เป็นต้นถูผ้าเพื่อให้สะอาด.
ฟอกพยาน 0,ก.,ไต่ถามไล่เลียงพยาน.
ฟอกโลหิต 0,ก.,อาการที่แก๊สออกซิเจนซึ่งหายใจเข้าไปแล้วเปลี่ยนเลือดดำเป็นเลือดแดง.
ฟอกหนัง 0,ก.,เอาหนังดิบมาแช่นํ้าแล้วหมักไว้เพื่อทำเป็นหนังฟอก.
ฟ่อง 0,ว.,"อาการที่ลอยสูง เด่น หรืออยู่ตามลำพัง, มักใช้เข้าคู่กับคำ ลอย เป็น ลอยฟ่อง, เช่น หมาตายลอยฟ่อง ลูกโป่งลอยฟ่องอยู่บนท้องฟ้า."
ฟ้อง 0,ก.,"กล่าวหาหรือกล่าวโทษต่อผู้ใหญ่หรือต่อศาล เช่น ฟ้องครู ฟ้องศาล, แสดงให้รู้ เช่น มีหลักฐานฟ้องอยู่ในตัว"
ฟ้อง 1,ก.,"โดยปริยายหมายความว่า ขัดกัน, ไม่ตรงกัน, เช่น ข้อความข้างต้นกับข้างปลายฟ้องกันเอง."
ฟ้อง 2,น.,คำฟ้อง.
ฟอง 0,น.,ต่อมนํ้าที่ผุดหรือปุดขึ้นเป็นรูปโป่ง ๆ อาจเป็นต่อมเดียว หรือรวมกันเป็นแพก็ได้.
ฟอง 1,น.,ไข่ เช่น ไก่ตกฟอง
ฟอง 2,น.,ลักษณนามใช้เรียกไข่เป็ดหรือไข่ไก่เป็นต้น เช่น ไข่ฟองหนึ่ง ไข่ ๒ ฟอง.
ฟอง 3,ก.,"คะนอง, กำเริบ."
ฟอง 4,น.,คลื่น เช่น ฟองฟัดซัดดลกรรทบนาวี (สรรพสิทธิ์).
ฟ้องกลับ 0,ก.,ฟ้องให้โจทก์กลับตกเป็นจำเลยในคดีอาญาด้วยเรื่องที่โจทก์ฟ้องมาก่อน เช่น ฟ้องกลับว่าฟ้องเท็จหรือเบิกความเท็จ.
ฟองกาม 0,ก.,กำเริบกาม.
ฟ้องตัวเอง 0,ก.,"แสดงความผิดของตนออกมาให้ผู้อื่นรู้โดยไม่ได้ตั้งใจ, แสดงความเท็จออกมาให้ปรากฏ."
ฟองเต้าหู้ 0,น.,"ชื่อหนึ่งของหินยิปซัม เรียกว่า หินฟองเต้าหู้, เกลือจืด ก็ว่า."
ฟองเต้าหู้ 1,น.,ฝ้าหรือเยื่อที่ลอยอยู่บนน้ำเต้าหู้แล้วนำมาตากแห้ง ใช้เป็นอาหาร.
ฟองทะเล 0,น.,หินที่ปรุเป็นรู ๆ อยู่ในทะเล.
ฟองน้ำ 0,น.,ต่อมนํ้าที่ผุดหรือปุดขึ้นเป็นรูปโป่ง ๆ อาจเป็นต่อมเดียว หรือรวมกันเป็นแพก็ได้.
ฟองน้ำ 1,น.,ต่อมนํ้าที่ผุดหรือปุดขึ้นเป็นรูปโป่ง ๆ อาจเป็นต่อมเดียว หรือรวมกันเป็นแพก็ได้.
ฟองน้ำ 2,น.,"ชื่อสัตว์นํ้าไม่มีกระดูกสันหลังไฟลัม Porifera มีเนื้อเยื่อ ๒ ชั้นลักษณะเป็นรูพรุน มีทั้งโครงสร้างแข็งและอ่อนนุ่ม ส่วนใหญ่พบในทะเล ที่พบในนํ้าจืดเรียก ฟองนํ้านํ้าจืด จำพวกที่มีโครงสร้างอ่อนนุ่มซึ่งพบในทะเลนำมาใช้ถูตัวได้, โดยปริยายใช้เรียกสิ่งที่มีลักษณะเป็นรูพรุนอ่อนนุ่ม และซับนํ้าได้ดี."
ฟองฟอด 0,ว.,ลักษณะที่มีฟองมาก เช่น แกงบูดเป็นฟองฟอด ย่ำน้ำโคลนเป็นฟองฟอด.
ฟ่องฟู 0,ก.,ฟูฟ่อง.
ฟองมัน 0,น.,"ชื่อเครื่องหมายชนิดหนึ่ง มีรูปอย่างนี้ ๏ ในหนังสือเก่า สำหรับเขียนขึ้นต้นวรรคหรือต้นบรรทัด, ตาไก่ ก็เรียก."
ฟ้องแย้ง 0,ก.,การที่จำเลยฟ้องโจทก์มาในคำให้การในเรื่องที่เกี่ยวกับคำฟ้องเดิมของโจทก์.
ฟ้องแย้ง 1,น.,คำฟ้องแย้ง.
ฟ้องร้อง 0,ก.,"กล่าวโทษ, กล่าวหา."
ฟอด 0,ก.,น่วมฟ่ามอยู่ข้างใน.
ฟอด 1,ว.,เสียงดังเช่นนั้น.
ฟอด 2,น.,"เรียกดินเลนที่ฟูดโป่งขึ้นมา เช่น ฟอดปลาไหล คือ ดินที่โป่งขึ้นมา ซึ่งเป็นที่มีปลาไหล, พรอด ก็ว่า."
ฟอดแฟด 0,ก.,น่วมฟ่ามอยู่ข้างใน.
ฟอดแฟด 1,ว.,เสียงดังเช่นนั้น เช่น เสียงย่ำโคลนดังฟอดแฟด
ฟอดแฟด 2,ว.,อาการที่โกรธกระฟัดกระเฟียด.
ฟอน 0,ก.,"บ่อน, กินพรุนข้างใน, พลอนทั่ว, เช่น หนอนฟอนชมพู่"
ฟอน 1,ก.,ค้นหา เช่น ฟอนจนทั่ว ฟอนหาของสกปรกกิน.
ฟอน 2,ว.,"ย่อยยับ, แหลก, เช่น ฟันฟอน คือ ฟันให้ยับย่อย ฟันให้แหลก"
ฟอน 3,ว.,"ที่ไหม้เป็นจุรณ, ที่ไหม้เป็นขี้เถ้า, เช่น กองฟอน."
ฟ่อน 0,น.,หญ้าหรือต้นข้าวจำนวนมากที่เอามารวมกันเป็นมัดใหญ่ ๆ.
ฟ้อน 0,ก.,"รำของทางภาคเหนือและภาคอีสาน, กราย."
ฟ้อนแพน 0,น.,"การจับระบำชนิดหนึ่ง ใช้ผู้แสดงชายหญิงคู่หนึ่งหรือมากกว่า แต่งกายอย่างไทยภาคเหนือ รำออกท่าหยอกเอินประกอบคำร้องและดนตรี, ฟ้อนลาวแพน หรือ รำลาวแพน ก็เรียก."
ฟอนเฟะ 0,ว.,"เละเทะ, เป็นที่น่ารังเกียจ, เช่น มีความประพฤติฟอนเฟะ สังคมฟอนเฟะ."
ฟ้อนลาวแพน 0,น.,"การจับระบำชนิดหนึ่ง ใช้ผู้แสดงชายหญิงคู่หนึ่งหรือมากกว่า แต่งกายอย่างไทยภาคเหนือ รำออกท่าหยอกเอินประกอบคำร้องและดนตรี, ฟ้อนแพน หรือ รำลาวแพน ก็เรียก."
ฟ้อแฟ้ 0,ว.,"เพริศพริ้ง, กระชุ่มกระชวย, สดชื่น, เช่น หนุ่มฟ้อ ยังฟ้ออยู่."
ฟอร์มาลดีไฮด์ 0,น.,แก๊สชนิดหนึ่ง มีสูตร HCHO มีกลิ่นฉุนระคายเยื่อจมูกและเยื่อตา ละลายนํ้าได้ใช้ประโยชน์นำไปทำฟอร์มาลิน พลาสติก สี เป็นต้น.
ฟอร์มาลิน 0,น.,สารละลายซึ่งมีแก๊สฟอร์มาลดีไฮด์ละลายอยู่ร้อยละ ๔๐ ใช้ประโยชน์เป็นยาล้างเชื้อโรคและดองซากศพ.
ฟอสฟอรัส 0,น.,"ธาตุลำดับที่ ๑๕ สัญลักษณ์ P เป็นอโลหะ ลักษณะเป็นของแข็ง มีหลายอัญรูป อัญรูปที่สำคัญ คือ ฟอสฟอรัสขาว (บางทีก็เรียกว่า ฟอสฟอรัสเหลือง) ลักษณะอ่อนคล้ายขี้ผึ้ง หลอมละลายที่ ๔๔ °ซ. ติดไฟง่าย เมื่อกระทบอากาศจะให้แสงเรือง เป็นพิษอย่างแรง, ฟอสฟอรัสแดง ลักษณะเป็นผงสีแดงแกมม่วง เมื่อกระทบอากาศไม่ให้แสงเรือง ติดไฟยาก ไม่เป็นพิษเหมือนฟอสฟอรัสขาว."
ฟอสเฟต 0,น.,เกลือของกรดฟอสฟอริก (H_3PO_4) ใช้ประโยชน์เป็นปุ๋ย.
ฟะฟัด 0,ก.,"ฟัด, ฟาด."
ฟะฟั่น 0,ว.,"เฝือ, เฟือน, มากจนเฝือ"
ฟะฟั่น 1,ว.,มืดมัว
ฟะฟั่น 2,ว.,ยุ่งเหยิง
ฟะฟั่น 3,ว.,"สั่น, สะเทือน."
ฟะฟ่าย 0,ว.,"เฟื้อย, เลื้อย."
ฟัก 0,น.,"ชื่อไม้เถาชนิด Benincasa hispida (Thunb.) Cogn. ในวงศ์ Cucurbitaceae ผลใหญ่รูปกลมหรือรี เมื่อแก่ผิวแข็งมีคราบขาว กินได้ เมล็ดใช้ทำยา มีหลายพันธุ์ ต่างกันที่ลักษณะของผล, พันธุ์ผลเล็ก ผิวบางมีขน เรียก แฟง, พันธุ์ที่ผลมีรสขม ใช้ทำยาได้ เรียก ฟักขม."
ฟัก 1,ก.,"กกไข่ให้เป็นตัว, ทำให้ไข่อบอุ่นเพื่อให้เป็นตัว."
ฟักข้าว 0,น.,ชื่อไม้เถาชนิด Momordica cochinchinensis (Lour.) Spreng. ในวงศ์ Cucurbitaceae ดอกสีนวล ผลมีหนามสั้น ๆ กินได้และใช้ทำยาได้.
ฟักตัว 0,ก.,ก่อให้เกิดให้เป็นขึ้นอย่างแพร่หลาย.
ฟักทอง 0,น.,ชื่อไม้เถาชนิด Cucurbita moschata Duchesne ในวงศ์ Cucurbitaceae ผลแป้นเป็นพูโดยรอบ เนื้อในสีเหลือง กินได้ เมล็ดใช้ทำยาได้.
ฟักฟุ้น 0,ว.,"อ่อน, นุ่ม."
ฟักฟูม 0,ก.,"ทะนุถนอม, ประคับประคอง, ฟูมฟัก ก็ว่า."
ฟักเหลือง 0,น.,ชื่อไม้เถาชนิด Cucurbita moschata Duchesne ในวงศ์ Cucurbitaceae ผลแป้นเป็นพูโดยรอบ เนื้อในสีเหลือง กินได้ เมล็ดใช้ทำยาได้.
ฟัง 0,ก.,"ตั้งใจสดับ, คอยรับเสียงด้วยหู, ได้ยิน"
ฟัง 1,ก.,"เชื่อ, ทำตามถ้อยคำ เช่น ให้ฟังคำสั่งผู้บังคับบัญชา."
ฟังก์ชัน 0,น.,เซตของคู่ลำดับโดยที่คู่ลำดับทุกคู่ไม่มีสมาชิกตัวหน้าซํ้ากัน.
ฟังขึ้น 0,ว.,พอจะยึดถือได้ (มักใช้ในความปฏิเสธ) เช่น เหตุผลฟังไม่ขึ้น.
ฟังความข้างเดียว 0,ก.,เชื่อถือแต่ฝ่ายเดียวโดยไม่ฟังความอีกฝ่ายหนึ่ง.
ฟังได้ 0,ว.,"พอเชื่อถือได้ เช่น ที่พยานให้การมานั้นฟังได้, ไม่ขัดหู เช่น เพลงไพเราะพอฟังได้."
ฟังไม่ได้ศัพท์ จับไปกระเดียด 0,ก.,ฟังไม่ได้ความแจ่มชัด แล้วเอาไปพูดต่อหรือทำผิด ๆ พลาด ๆ.
ฟังหูไว้หู 0,ก.,รับฟังไว้แต่ไม่เชื่อทั้งหมด.
ฟังออก 0,ก.,"เข้าใจ, รู้เรื่อง."
ฟัด 0,ก.,"กัดเหวี่ยงหรือสะบัดไปมา เช่น แมวฟัดหนู, เหวี่ยง เช่น ถูกรถฟัดเสียสะบักสะบอม"
ฟัด 1,ก.,กระทบ เช่น ท้ายเรือฟัดกัน นมยานฟัดอก
ฟัด 2,ก.,"คล้องจองกัน, สัมผัสกัน, เช่น กลอนฟัดกัน"
ฟัด 3,ก.,ต่อสู้ เช่น เด็กฟัดกัน
ฟัด 4,ก.,กิน เช่น วันนี้ฟัดก๋วยเตี๋ยวไปซะ ๓ ชาม.
ฟัด 5,ว.,"เรียกกุ้งแห้งที่เอาเปลือกออกแล้ว ว่า กุ้งฟัด, กุ้งฝัด ก็ว่า."
ฟัดเฟียด 0,ว.,"กระฟัดกระเฟียด, อาการที่ทำโกรธสะบัดกระฟัดกระเฟียด."
ฟั้น 0,ก.,"นวด, ขยำ."
ฟัน 0,ก.,"เอาของมีคมเช่นดาบฟาดลงไป, โดยปริยายหมายถึง อาการที่คล้ายคลึงเช่นนั้น เช่น เอาสันมือฟันอิฐ."
ฟั่น 0,ก.,"คลึงสิ่งเป็นเส้นหลายเส้นให้เข้าเกลียวกัน เช่น ฟั่นด้าย, นำป่านหรือปอเป็นต้นมาตีเกลียวให้เป็นเชือก เรียกว่า ฟั่นเชือก, คลึงขี้ผึ้งที่มีไส้อยู่ภายในให้เป็นเล่มเทียน เรียกว่า ฟั่นเทียน."
ฟัน 1,น.,"กระดูกเป็นซี่ ๆ อยู่ในปากสำหรับกัด ฉีกเคี้ยวอาหาร, โดยปริยายหมายถึง สิ่งที่มีลักษณะคล้ายคลึงเช่นนั้น เช่น ฟันเลื่อย ฟันจักร."
ฟั่น 1,ก.,"มืดมัว, ยุ่งเหยิง, ปะปน."
ฟันคลื่น 0,ก.,แล่นเอาหัวเรือตัดคลื่นไป.
ฟันช้าง 0,น.,"ชื่อหอยทะเลหลายชนิดในชั้น Scaphopoda เปลือกลักษณะคล้ายงาช้าง ส่วนมากสีขาว เช่น ชนิด Dentalium aprinumLinn ., D. longitrorsumReeve, ฟันช้าง ก็เรียก."
ฟันดาบ 0,น.,การต่อสู้กันด้วยดาบ เช่น เขาเก่งในทางฟันดาบ.
ฟันถาวร 0,น.,ฟันชุดที่ ๒ ซึ่งขึ้นภายหลังฟันนํ้านม.
ฟันแท้ 0,น.,ฟันชุดที่ ๒ ซึ่งขึ้นภายหลังฟันนํ้านม.
ฟันน้ำนม 0,น.,ฟันชุดแรก.
ฟันปลา 0,น.,"เรียกสิ่งที่มีรูปอย่างฟันปลา, เรียกลักษณะที่สับหว่างสลับเยื้องกันอย่างฟันปลา ว่า สลับฟันปลา เช่น นั่งสลับฟันปลา ยืนสลับฟันปลา"
ฟันปลา 1,น.,"ลายคดกริช รูปดังนี้ เรียก ลายฟันปลา, ลายฟันเลื่อย ก็เรียก."
ฟันฝ่า 0,ก.,"บุกตะลุยสิ่งที่ต้านทานเข้าไป, ผจญสิ่งที่ขัดขวาง."
ฟั่นเฝือ 0,ว.,"รกชัฏ, ยุ่งเหยิง, ปนคละกันยุ่ง, เคลือบคลุม เช่น สำนวนฟั่นเฝือ."
ฟันฟาง 0,น.,"ฟาง, ฟันที่เข้าใจว่าขึ้นแทนฟันแท้ที่หักไป, ฟัน เช่น ฟันฟางไม่ค่อยดี กินของเหนียวของแข็งไม่ได้."
ฟันเฟือง 0,น.,ล้อหรือวงจักรที่มีซี่โดยรอบ.
ฟั่นเฟือน 0,ว.,"หลงใหล, เคลิบเคลิ้ม, เผลอสติ, คุ้มดีคุ้มร้าย, เช่น มีสติฟั่นเฟือน จิตใจฟั่นเฟือน."
ฟันม้า 0,น.,ชื่อแร่ประกอบหินชนิดหนึ่ง มีหลายสี ส่วนมากมักมีสีขาวขุ่นคล้ายฟันม้า ชาวบ้านจึงเรียกกันว่า หินฟันม้า. (ดู เฟลด์สปาร์).
ฟันเลื่อย 0,น.,ลายคดกริชอย่างลายฟันปลา.
ฟันหนู 0,น.,"ชื่อเครื่องหมาย ๒ ขีด รูปดังนี้ ^' สำหรับเขียนบนสระ  ให้เป็น สระ  , มูสิกทันต์ ก็ว่า."
ฟันหลอ 0,น.,ฟันที่มีช่องว่างระหว่างฟันซึ่งเกิดจากฟันหลุด กร่อน หรือหักจนถึงโคนฟัน เป็นต้น.
ฟ้า 0,น.,"ส่วนเบื้องบนที่มองเห็นครอบแผ่นดินอยู่ เช่น ดาวเต็มฟ้า, อากาศ เช่น ฟ้าครึ้ม ยิงปืนขึ้นฟ้า"
ฟ้า 1,น.,สวรรค์ เช่น นางฟ้า ฟ้าดินเป็นพยาน
ฟ้า 2,น.,เจ้าฟ้า.
ฟ้า 3,ว.,สีน้ำเงินอ่อนอย่างสีท้องฟ้าในเวลามีแดด เรียกว่า สีฟ้า.
ฟาก 0,น.,"ลำไม้ไผ่เป็นต้นที่ผ่าแล้วสับให้แตกออกเป็นอันเล็ก ๆ แต่ไม่ขาดจากกัน แล้วแบคว่ำออกเป็นแผ่น โดยมากใช้ปูเป็นพื้นเรือน เรียกว่า ฟากสับ, ส่วนที่ทำเป็นซี่แล้วใช้หวายหรือเถาวัลย์ถักให้ติดกันเป็นผืน เรียกว่า ฟากซี่ หรือ ซี่ฟาก."
ฟาก 1,น.,"ฝั่ง, ข้าง, เช่น อยู่ฟากนี้ เรือข้ามฟาก ฟากฟ้า."
ฟากฟ้า 0,น.,ท้องฟ้า.
ฟ้าคะนอง 0,น.,ฟ้าลั่นติดต่อกัน.
