ทาฒะ 0,น.,เขี้ยว เช่น พระทาฐธาตุ คือ พระเขี้ยวแก้ว.
ทาฒิกะ 0,น.,เครา.
ท่าดีทีเหลว 0,ว.,มีท่าทางดี แต่ทำอะไรไม่ได้เรื่อง.
ท่าเดียว 0,ว.,"อย่างเดียว, ประการเดียว, ถ่ายเดียว, เช่น วัน ๆ จะเอาแต่กินท่าเดียว."
ท่าทาง 0,ว.,"กิริยาอาการที่ปรากฏให้เห็น เช่น ท่าทางดี ท่าทางไม่ดี, บางทีใช้ว่า ท่า ก็มี."
ท้าทาย 0,ก.,ชวนวิวาท เช่น เพราะเขาว่าท้าทายว่าจะทำอันตรายแก่ท่านไท้บรมนาถราชบิดา (ม. ร่ายยาว วนปเวสน์)
ท้าทาย 1,ก.,ชวนให้ทดลองความรู้ความสามารถ เช่น ท้าทายปัญญา ท้าทายความสามารถ.
ท่าที 0,น.,"ความเป็นไปของสถานการณ์หรือบุคคลเป็นต้น, ทีท่า ก็ว่า."
ทาน- 0,น.,"การให้, มักใช้ประกอบท้ายคำอื่น เช่น ธรรมทาน วิทยาทาน"
ทาน- 1,น.,"สิ่งที่ให้ มักหมายถึงเงินหรือสิ่งของที่คนให้แก่คนยากจน, เป็นธรรมข้อ ๑ ในสังคหวัตถุและทศพิธราชธรรม. (ดู สังคหวัตถุและทศพิธราชธรรม)."
ท่าน 0,ส.,"คำใช้แทนผู้ที่เราพูดด้วย เป็นคำกลาง ๆ หรือแสดงความเคารพ เป็นสรรพนามบุรุษที่ ๒, ใช้แทนผู้ที่เราพูดถึงด้วยความเคารพ เช่น ท่านไม่อยู่ คุณพ่อท่านหลับแล้ว หรือโดยไม่เจาะจง เช่น อย่าลักทรัพย์ท่าน เป็นสรรพนามบุรุษที่ ๓."
ท่าน 1,น.,คำที่ใช้ประกอบหน้าชื่อบรรดาศักดิ์หรือตำแหน่งแสดงความยกย่อง เช่น ท่านขุน ท่านอาจารย์ ท่านเจ้าอาวาส.
ทาน 0,น.,"การให้, มักใช้ประกอบท้ายคำอื่น เช่น ธรรมทาน วิทยาทาน"
ทาน 1,น.,"สิ่งที่ให้ มักหมายถึงเงินหรือสิ่งของที่คนให้แก่คนยากจน, เป็นธรรมข้อ ๑ ในสังคหวัตถุและทศพิธราชธรรม. (ดู สังคหวัตถุและทศพิธราชธรรม)."
ทาน 2,ก.,"ยันหรือรับไว้ เช่น ทานน้ำหนักไม่ไหว, มักใช้เข้าคู่กับคำ ต้าน เป็น ต้านทาน."
ทาน 3,ก.,"สอบหนังสือให้ถูกต้องหรือให้ตรงกับต้นฉบับ, ตรวจทาน ก็ว่า."
ทานกัณฑ์ 0,น.,ชื่อกัณฑ์ที่ ๓ ในมหาชาติ.
ท่านชาย 0,น.,คำเรียกหม่อมเจ้าชาย.
ทานต์ 0,ว.,"ที่ฝึกแล้ว, เชื่อง, ใจเย็น, ใจดี."
ทานตะวัน 0,น.,ชื่อไม้ล้มลุกชนิด Helianthus annuus L. ในวงศ์ Compositae ช่อดอกกลมใหญ่สีเหลือง ดอกเรียงซ้อนกันเป็นระเบียบ เมล็ดให้นํ้ามัน กินได้.
ทานบดี 0,น.,เจ้าของทาน.
ทานบน 0,น.,"ทัณฑ์บน, ถ้อยคำหรือหนังสือสัญญาว่าจะไม่ประพฤติละเมิดตามเงื่อนไขที่ได้ให้ไว้, เช่น ให้เอาตัวมาสบถษาบานเฉพาะพระพุทธพระธรรมพระสงฆเจ้าจงหนักหนา แล้วให้เรียกเอาทานบนไว้ครั้งหนึ่งก่อน ถ้าผู้นั้นมิละพะยศยังทำอยู่อิกไซ้ ก็ให้จับเอาตัวมาส่งให้ผู้รักษาเมืองผู้รั้งกรมการ (สามดวง)."
ทานบารมี 0,น.,คุณความดีที่ควรบำเพ็ญ คือ ทาน.
ท่านผู้หญิง 0,น.,"คำนำหน้าชื่อสตรีที่สมรสแล้วและได้รับพระราชทานเครื่องราชอิสริยาภรณ์จุลจอมเกล้าฝ่ายในชั้นทุติยจุลจอมเกล้าวิเศษขึ้นไป, ถ้ายังไม่ได้สมรสเรียกว่า คุณ, (โบ) คำนำหน้าชื่อสตรีที่เป็นภรรยาเอกของเจ้าพระยาและเป็นผู้ที่ได้รับพระราชทานเครื่องยศท่านผู้หญิง."
ทานพ 0,น.,อสูรจำพวกหนึ่งในนิยาย.
ทานมัย 0,ว.,"สำเร็จด้วยทาน, แล้วไปด้วยทาน, เป็นธรรมข้อ ๑ ในบุญกิริยาวัตถุ."
ท่านหญิง 0,น.,คำเรียกหม่อมเจ้าหญิง.
ท่านั้นท่านี้ 0,ว.,"อย่างนั้นอย่างนี้, โยกโย้, เช่น พูดท่านั้นท่านี้."
ทานาธิบดี 0,น.,"เจ้าของทาน, ผู้เป็นใหญ่ในการให้, เช่น ขอกุศลผลบุญจงบังเกิดแก่ทานาธิบดีในการทอดกฐินครั้งนี้."
ทาบ 0,ก.,"วางวัตถุสิ่งหนึ่งแนบกับอีกสิ่งหนึ่ง เช่น เอาผ้าทาบตัว เอามือทาบอก, (ปาก) เปรียบ, เทียบ, เช่น เรามีความรู้น้อยจะไปทาบท่านผู้รู้ได้อย่างไร"
ทาบ 1,ก.,"ตบ, ตี, เช่น นกทาบปีก, ถาบ ก็ใช้."
ทาบกิ่ง 0,น.,วิธีขยายพันธุ์ต้นไม้แบบหนึ่ง โดยใช้ต้นตอที่เพาะไว้ตัดให้สูงจากโคนต้นเล็กน้อยในลักษณะแฉลบ แล้วนำไปทาบที่กิ่งของอีกต้นหนึ่งซึ่งปาดให้แฉลบเช่นเดียวกับต้นตอที่จะทาบ ใช้แถบพลาสติกพันบริเวณที่ทาบให้แน่น.
ทาบกิ่ง 1,ก.,ขยายพันธุ์ด้วยวิธีการเช่นนั้น.
ทาบทาม 0,ว.,"หยั่งใจเขาดู, ลองหยั่งเสียงดู."
ทาบทาม 1,ก.,ติดต่อสอบถามเพื่อฟังความเห็นก่อนที่จะตกลงกัน.
ทาม 0,น.,"อุปกรณ์ที่มีลักษณะเป็นแผ่นคล้ายเข็มขัด ปลาย ๒ ข้างเป็นห่วงคาดอยู่ที่ต้นคอของวัวหรือควาย ปลายนั้นมีเชือกขึ้นไปผูกปลายตะโกกหรือแอกทั้ง ๒ ข้าง, เชือกหนังทำเป็นบ่วงสำหรับคล้องคอช้างที่จับใหม่ แล้วโยงมาผูกกับคอช้างต่อ, สายเชือกหรือหนังที่รั้งพวงมาลัยสวมคอม้าไปผูกกับรถ."
ทาม 1,ก.,ดาม
ทาม 2,ก.,"ลองดู, เลียบเคียง."
ทาม 3,น.,บึงหรือที่ราบลุ่ม มีนํ้าท่วมเป็นครั้งคราว.
ท่ามกลาง 0,น.,ที่ซึ่งอยู่ระหว่างกลางสิ่งแวดล้อม เช่น อยู่ในท่ามกลางประชาชน.
ท่ามกลาง 1,ว.,ระหว่างกลางสิ่งแวดล้อม เช่น อยู่ท่ามกลางอันตราย.
ท้าย 0,น.,"ส่วนที่อยู่สุดด้านหนึ่ง, ตรงข้ามกับ ด้านหัว เช่น ท้ายเรือ, ตรงข้ามกับ ด้านหน้า เช่น ท้ายวัง, ตรงข้ามกับ ต้น เช่น ท้ายฤดู."
ทาย 0,ก.,"บอกเหตุการณ์หรือความเป็นไปที่จะเกิดในเบื้องหน้า, ทำนาย ก็ว่า"
ทาย 1,ก.,"ถาม เช่น ทายปัญหา, ลองหาคำตอบ เช่น ทายสิว่ามีอะไรอยู่ในมือ."
ทาย 2,ก.,ยก เช่น ทายกรอำรุงรักษ์ รมเจด งามเอย (นิ. หริภุญชัย)
ทาย 3,ก.,ถือ เช่น ทายธนู ว่า ถือธนู.
ทาย- 0,ก.,ให้ ในคำว่า ทายสมบัติ คือ สมบัติที่ให้มาแล้ว ได้แก่ พรสวรรค์.
ทายก 0,น.,"ผู้ถวายจตุปัจจัยแก่ภิกษุสามเณร, ถ้าเป็นเพศหญิงเรียกว่า ทายิกา."
ท้ายเขื่อน 0,น.,ท้ายนํ้า.
ท้ายครัว 0,ว.,ทางภรรยา เช่น เข้าท้ายครัว หมายความว่า เข้าทางภรรยา.
ท้ายโต่ง 0,น.,ท้ายที่สูงโด่งขึ้นไป (ใช้แก่เรือ).
ท้ายทอย 0,น.,"ส่วนสุดของกะโหลกศีรษะด้านหลัง, กำด้น."
ท้ายน้ำ 0,น.,"บริเวณที่ระบายนํ้าออกทางด้านล่างของตัวเขื่อน, ท้ายเขื่อน ก็เรียก."
ท้ายฝน 0,น.,ปลายฤดูฝน.
ท้ายสังข์ 0,น.,ท้ายสุดของปืนใหญ่แบบไทย มีลักษณะงอนคล้ายก้นของหอยสังข์.
ทายัช 0,น.,ทรัพย์มรดก.
ทายาด 0,ว.,ยิ่งยวด เช่น ทนทายาด.
ทายาท 0,น.,"ผู้สืบสันดาน, ผู้สืบสกุล, โดยปริยายหมายถึงผู้รับหรือผู้อยู่ในฐานะที่จะรับตำแหน่งหน้าที่ต่อจากบุคคลอื่น เช่น ทายาททางการเมือง"
ทายาท 1,น.,บุคคลรวมทั้งทารกในครรภ์มารดาซึ่งมีสิทธิได้รับมรดกของผู้ตาย ถ้าสิทธินั้นเกิดขึ้นตามกฎหมาย เรียกว่า ทายาทโดยธรรม ถ้าสิทธินั้นเกิดขึ้นตามพินัยกรรม เรียกว่า ผู้รับพินัยกรรม.
ทายาทโดยธรรม 0,น.,ทายาทที่มีสิทธิตามกฎหมายในมรดกของผู้ตาย ได้แก่ คู่สมรสที่ยังมีชีวิตอยู่ ผู้สืบสันดาน บิดามารดา พี่น้องร่วมบิดามารดาเดียวกัน พี่น้องร่วมบิดาหรือร่วมมารดาเดียวกัน ปู่ ย่า ตา ยาย ลุง ป้า น้า อา ตามลำดับและส่วนแบ่งที่กฎหมายกำหนดไว้.
ทายิกา 0,น.,"ผู้ถวายจตุปัจจัยแก่ภิกษุสามเณร, ถ้าเป็นเพศหญิงเรียกว่า ทายิกา."
ทาร- 0,น.,เมีย เช่น สทารสันโดษ คือ การยินดีเฉพาะเมียของตน.
ทารก 0,น.,"เด็กที่ยังอยู่ในครรภ์, เด็กแบเบาะ, เด็กเล็ก ๆ, เด็กที่ยังไม่เดียงสา."
ท่ารถ 0,น.,ที่จอดรถโดยสารต้นทางและปลายทาง.
ทารพี 0,น.,"ทัพพี, ทรพี, เช่น จัดแจงข้าวปลาทารพี (ขุนช้างขุนแผน)."
ทาริกา 0,น.,เด็กหญิง.
ทารุ 0,น.,"ท่อนไม้, ฟืน, ชิ้นไม้."
ทารุณ 0,ว.,"ดุร้าย, โหดร้าย, ร้ายกาจ."
ทารุณ- 0,ว.,"ดุร้าย, โหดร้าย, ร้ายกาจ."
ทารุณกรรม 0,น.,การกระทำอย่างโหดร้าย.
ท่าเรือ 0,น.,"ที่จอดเรือ, สถานที่สำหรับให้บริการแก่เรือในการจอด เทียบบรรทุก หรือขนถ่ายของ."
ท่าว 0,ก.,"ล้ม, ทบ, ยอบลง, เช่น ก็กรลับกรลอกแทง ทีเดียวก็ท่าวล้มในกลางแปลง (อนิรุทธ์), ซ้ำ เช่น ก้มเกล้าท่าวทวน ทำนูญบำบวงสรวลเสร (อนิรุทธ์)"
ท่าว 1,ก.,เดิน
ท่าว 2,ก.,ทอดทิ้ง.
ท้าว 0,น.,"ผู้เป็นใหญ่, พระเจ้าแผ่นดิน, (โดยมากใช้ในบทกลอน), เช่น ท้าวยศวิมล"
ท้าว 1,น.,"ตำแหน่งหญิงอาวุโส ซึ่งเป็นเจ้าจอม เจ้าจอมมารดาในรัชกาลก่อนหรือหญิงราชนิกุล ซึ่งพระเจ้าแผ่นดินโปรดเกล้าฯ ตั้งไว้ในตำแหน่งสำหรับดูแลราชกิจฝ่ายในพระราชวัง เช่น ท้าวทรงกันดาล ท้าวสมศักดิ์, (ปาก) คุณท้าว นางท้าว"
ท้าว 2,น.,คำประกอบชื่อผู้ชายที่เป็นเชื้อสายเจ้าหรือขุนนาง.
ท่าว 3,ว.,"เท่า,ราวกับ, เช่น กูเปนใหญ่บังคับ ให้เขาจับทำโพย โดยพลการเขาหลาย ผิดเชิงนายกับบ่าว ท่าวจักทอดธุระ กะว่าฝันเป็นแน่ (นิทราชาคริต)."
ท้าว 3,ว.,อาการสั่นรัว ๆ เช่น ความกลัวตัวสั่นอยู่ท้าวท้าว (สังข์ทอง).
ท่าวกำลัง 0,ก.,เดินพล.
ท่าวทบระนับ 0,ก.,ล้มหกคะเมนทับกัน.
ท้าวนาง 0,น.,หญิงซึ่งรับบรรดาศักดิ์และมีหน้าที่รับราชการฝ่ายในในพระบรมมหาราชวัง
ท้าวนาง 1,น.,นางพญา.
ท้าวพญา 0,น.,กษัตริย์.
ท้าวพระยา 0,น.,กษัตริย์.
ทาษ 0,น.,ทาส.
ทาส 0,น.,"ผู้ที่ขายตัวลงเป็นคนรับใช้หรือที่นายเงินไถ่ค่าตัวมา เรียกว่า ทาสนํ้าเงิน, ผู้ที่เป็นลูกของทาสนํ้าเงิน เรียกว่า ทาสเรือนเบี้ย หรือ ทาสในเรือนเบี้ย, ทาสที่เอาเงินไปซื้อมา เรียกว่า ทาสสินไถ่, ผู้ที่เป็นคนเชลย เรียกว่า ทาสเชลย, ถ้าใช้คู่กันว่า ทาสทาสี ก็หมายความว่า ทาส เป็นบ่าวผู้ชาย และ ทาสี เป็นบ่าวผู้หญิง"
ทาส 1,น.,"ผู้ที่ยอมตนให้ตกอยู่ในอำนาจสิ่งใดสิ่งหนึ่ง เช่น เป็นทาสการพนัน เป็นทาสยาเสพติด เป็นทาสความรัก เป็นทาสเงิน, ผู้ที่อุทิศตนแก่สิ่งที่เลื่อมใสศรัทธา เช่น เป็นทาสความรู้."
ทาส- 0,น.,"ผู้ที่ขายตัวลงเป็นคนรับใช้หรือที่นายเงินไถ่ค่าตัวมา เรียกว่า ทาสนํ้าเงิน, ผู้ที่เป็นลูกของทาสนํ้าเงิน เรียกว่า ทาสเรือนเบี้ย หรือ ทาสในเรือนเบี้ย, ทาสที่เอาเงินไปซื้อมา เรียกว่า ทาสสินไถ่, ผู้ที่เป็นคนเชลย เรียกว่า ทาสเชลย, ถ้าใช้คู่กันว่า ทาสทาสี ก็หมายความว่า ทาส เป็นบ่าวผู้ชาย และ ทาสี เป็นบ่าวผู้หญิง"
ทาส- 1,น.,"ผู้ที่ยอมตนให้ตกอยู่ในอำนาจสิ่งใดสิ่งหนึ่ง เช่น เป็นทาสการพนัน เป็นทาสยาเสพติด เป็นทาสความรัก เป็นทาสเงิน, ผู้ที่อุทิศตนแก่สิ่งที่เลื่อมใสศรัทธา เช่น เป็นทาสความรู้."
ทาสทาน 0,น.,ทานอย่างเลว คือ อาการที่โยนให้หรือให้โดยไม่เต็มใจ.
ทาสน้ำเงิน 0,น.,ทาสที่ขายตัวแก่นายเงิน หรือที่นายเงินไถ่ค่าตัวมา.
ทาสปัญญา 0,น.,"“ปัญญาอย่างทาส”, ความคิดตํ่า."
ทาสปัญญา 1,ว.,"โง่เขลาเบาปัญญา, มีสติปัญญาน้อย, เช่น คนทาสปัญญา."
ทาสี 0,น.,"ทาสผู้หญิง, บ่าวผู้หญิง."
ท่าอากาศยาน 0,น.,"ที่สำหรับเครื่องบินขึ้นลง ประกอบด้วยลานจอดเครื่องบิน ลู่เครื่องบินขึ้นลง โรงเก็บอุปกรณ์การบิน หอบังคับการบิน ที่ทำการของเจ้าหน้าที่ และที่พักผู้โดยสารเข้าออกเป็นต้น, (ปาก) สนามบิน."
ทำ 0,ก.,"กระทำ, ประกอบขึ้น, ผลิตขึ้น, สร้างขึ้น, ก่อขึ้น, เช่น ทำเก้าอี้ ทำโต๊ะ ทำรองเท้า ทำรัง"
ทำ 1,ก.,ประกอบการงาน เช่น ทำนา ทำสวน ทำโป๊ะ
ทำ 2,ก.,"ดำเนินการ, ปฏิบัติงาน, เช่น ทำหน้าที่ประธาน ทำตามคำสั่ง ทำตามกฎหมาย"
ทำ 3,ก.,แต่งให้งาม เช่น ทำผม ทำนัยน์ตา ทำจมูก
ทำ 4,ก.,"คิดและปฏิบัติไปตามกฎเกณฑ์ที่กำหนดไว้ เช่น ทำเลข ทำการฝีมือ, ประกอบพิธีกรรมเกี่ยวกับการนั้น ๆ เช่น ทำวัตร ทำศพ"
ทำ 5,ก.,แสดง เช่น ทำเบ่ง
ทำ 6,ก.,ศึกษาในระดับปริญญา เช่น ทำปริญญา ทำดอกเตอร์.
ทำกรรม 0,ก.,ทำสิ่งที่เป็นทุกข์เป็นโทษ.
ทำกรรมทำเวร 0,ก.,ทำสิ่งที่เป็นทุกข์เป็นโทษ.
ทำการบ้าน 0,ก.,ทำงานหรือทำแบบฝึกหัดตามที่ครูอาจารย์สั่งให้ทำนอกเวลาเรียน.
ทำขวัญ 0,ก.,ทำพิธีเชิญขวัญหรือเรียกขวัญมาอยู่กับตัว เช่น ทำขวัญนาค ทำขวัญเรือน
ทำขวัญ 1,ก.,"ให้เงินหรือสิ่งของเพื่อปลอบใจ หรือเพื่อชดใช้ค่าเสียหายให้แก่ผู้อื่น, เสียเงินค่าปรับให้แก่ผู้ถูกทำร้ายหรือถูกหมิ่นประมาท."
ทำครัว 0,ก.,หุงหาอาหาร.
ทำคลอด 0,ก.,ช่วยให้ทารกคลอดจากครรภ์มารดา.
ทำความ 0,ก.,"ก่อเหตุขึ้น, ก่อเรื่องขึ้น."
ทำคุณ 0,ก.,"ประกอบพิธีเพื่อทำร้ายฝ่ายตรงข้ามโดยใช้เวทมนตร์คาถาเสกสิ่งใดสิ่งหนึ่งให้เข้าไปอยู่ในตัวของอีกฝ่ายหนึ่งเป็นต้น, ทำคุณทำไสย ก็ว่า."
ทำคุณแก่ใคร เหมือนไฟตกน้ำ 0,ก.,ทำความดีต่อผู้อื่น แต่ผู้นั้นไม่ตอบสนองในทางที่ดี.
ทำคุณทำไสย 0,ก.,"ประกอบพิธีเพื่อทำร้ายฝ่ายตรงข้ามโดยใช้เวทมนตร์คาถาเสกสิ่งใดสิ่งหนึ่งให้เข้าไปอยู่ในตัวของอีกฝ่ายหนึ่งเป็นต้น, ทำคุณไสย หรือ ทำคุณ ก็ว่า."
