ผุด 0,ก.,"ขึ้นมาให้ปรากฏ เช่น ปลาผุด ผุดลุกผุดนั่ง, โผล่ให้เห็น เช่น น้ำลดตอผุด."
ผุดผ่อง 0,ว.,"ผ่องใส, เป็นนํ้านวล."
ผุดผาด 0,ว.,"งามน่ารัก, ผ่องใส."
ผุดผาย 0,ก.,ลุกไป.
ผุดผ้าย 0,ก.,ลุกไป.
ผุดลุกผุดนั่ง 0,ก.,"เดี๋ยวลุกเดี๋ยวนั่ง, มีอาการลุกลนนั่งนิ่งไม่ได้นาน."
ผุยผง 0,น.,"ละอองละเอียด, ผงละเอียด."
ผุสราคา 0,น.,บุษปราค.
ผู้ 0,น.,คำใช้แทนบุคคล เช่น นายกรัฐมนตรีเป็นผู้รับสนองพระบรมราชโองการ หรือใช้แทนคำว่า คน เช่น ผู้นั้น ผู้นี้ ทุกผู้ทุกนาม หรือใช้แทนสิ่งที่ถือเสมือนคน เช่น ศาลเป็นผู้ตัดสิน
ผู้ 1,น.,คำใช้ประกอบคำกริยาหรือประกอบคำวิเศษณ์ให้เป็นนามขึ้น เช่น ผู้กิน ผู้ดี.
ผู้ 2,ว.,คำบอกเพศ หมายความว่า ตัวผู้ เช่น ม้าผู้ วัวผู้.
ผู้ 3,ส.,"ที่, ซึ่ง, เช่น บุคคลผู้กระทำความดีย่อมได้รับความสุข."
ผูก 0,ก.,"เอาเชือกเป็นต้นสอดคล้องกันให้เกิดเป็นเงื่อน เพื่อทำให้มั่นหรือติดต่อกันในตัวหรือกับสิ่งอื่น เช่น ผูกเชือก ผูกลวด ผูกโบ, ติดต่อหรือติดพันกันแน่นกับสิ่งใดสิ่งหนึ่ง เช่น ผูกใจ ผูกโกรธ ผูกมิตร, ประกอบเข้า เช่น ผูกประโยค ผูกปริศนา ผูกลาย, ติดพันกันด้วยเรื่องสิทธิและหน้าที่ตามที่ตกลงกัน เช่น ผูกตลาด ผูกท่า"
ผูก 1,ก.,คุ้มครอง (ใช้ในการเล่นหมากรุก) เช่น เอาม้าผูกโคน เอาเรือผูกม้า
ผูก 2,ก.,ขมวด เช่น ผูกคิ้วนิ่วหน้าไม่พาที (นิ. นรินทร์)
ผูก 3,ก.,จอง เช่น ผูกเวร
ผูก 4,ก.,ตรงข้ามกับ แก้.
ผูก 5,น.,ลักษณนามเรียกหนังสือใบลานที่ร้อยหูไว้มัดหนึ่ง ๆ ว่า คัมภีร์เทศนาผูกหนึ่ง.
ผูกกระได 0,ก.,ทอดสะพานเข้าไปสืบข่าว เช่น ก็ให้ผูกกระไดข่าวคอย (ลอ).
ผูกขวัญ 0,ก.,เอาเส้นด้ายผูกข้อมือเด็กแล้วกล่าวเรียกขวัญว่า “ขวัญเอ๋ย มาอยู่กับเนื้อกับตัว” แล้วกล่าวให้พรต่อไปตามสมควร.
ผูกขาด 0,ก.,สงวนสิทธิไว้แต่ผู้เดียว.
ผูกดวง 0,ก.,นำเครื่องหมายแทนพระเคราะห์มีอาทิตย์ จันทร์ อังคาร พุธ เสาร์ พฤหัสบดี ศุกร์ เป็นต้น บรรจุลงในดวงตามช่องจักรราศีทั้ง ๑๒ ที่โคจรมาสถิตตามวัน เดือน ปี และเวลาตกฟากของเจ้าของชะตานั้น ดูว่าอาทิตย์ตกอยู่ในราศีใด แล้วเอาองศาอาทิตย์ของวันเกิดเจ้าของชะตามาคำนวณว่า เมื่อเวลา ๖.๐๐ นาฬิกา อาทิตย์อยู่ในราศีดังกล่าวมาแล้วนานเท่าใด เรียกว่า อดีตอุทัย และเวลาเหลืออีกนานเท่าใดจึงจะพ้นไปจากราศีนั้น เรียกว่า อนาคตอุทัย แล้วเอาเวลาตกฟากตั้งลบด้วย ๖.๐๐ นาฬิกา และอนาคตอุทัย ต่อไปเอาอันโตนาทีของราศีถัด ๆ ไปลบทีละราศี ถ้าเวลาหรือเลขที่เหลือไม่พอให้อันโตนาทีของราศีใดลบได้ ลัคนาก็อยู่ที่ราศีนั้น การผูกดวงนี้เพื่อทำนายโชคชะตาเป็นต้น.
ผูกดอก 0,ก.,ทำหนังสือสัญญาเป็นลูกจ้างรับเงินล่วงหน้าแล้วให้ดอกเบี้ยแทนรับใช้การงาน.
ผูกปิ่นโต 0,ก.,"ว่าจ้างให้ทำอาหารใส่ปิ่นโตส่งให้ตามที่ตกลงกัน, (ปาก) ว่าปิ่นโต, กินปิ่นโต ก็ว่า."
ผูกพัทธสีมา 0,น.,เรียกพิธีสังฆกรรมที่สงฆ์กำหนดเขตแดนขึ้น โดยมีหินเป็นต้นเป็นเครื่องหมาย ว่า พิธีผูกพัทธสีมา.
ผูกพัน 0,ก.,มีความเป็นห่วงกังวลเพราะรักใคร่เป็นต้น
ผูกพัน 1,ก.,ก่อให้เกิดพันธะที่จะต้องปฏิบัติตาม
ผูกพัน 2,ก.,ก่อหนี้สินผูกมัดรัฐบาลให้ต้องจ่ายในงบประมาณแผ่นดินต่อ ๆ ไป เช่น หนี้ผูกพัน งบประมาณผูกพัน รายจ่ายผูกพัน.
ผูกภาษี 0,ก.,ว่าเหมาการเก็บภาษีไปทำเองแล้วให้เงินแก่หลวงตามสัญญา.
ผูกมัด 0,ก.,ผูกพันไว้แน่น.
ผู้กว้างขวาง 0,น.,"นักเลงใหญ่, ผู้มีอิทธิพล."
ผูกเวร 0,ก.,จองเวร.
ผูกหู 0,ก.,"ทำเครื่องหมายกำหนดไว้เพื่อกรรมสิทธิ์หรือประโยชน์อย่างใดอย่างหนึ่ง, กำหนดไว้, จองไว้."
ผู้ก่อการร้าย 0,น.,บุคคลที่ตั้งตนเป็นปฏิปักษ์ต่อรัฐบาลและพยายามก่อความไม่สงบขึ้นในที่ต่าง ๆ.
ผู้ขนส่ง 0,น.,บุคคลผู้รับขนส่งของหรือคนโดยสารเพื่อบำเหน็จเป็นทางค้าปรกติของตน.
ผู้ขับขี่ 0,น.,ผู้ขับรถ ผู้ประจำเครื่องอุปกรณ์การขนส่งตามกฎหมายว่าด้วยการขนส่ง ผู้ลากเข็นยานพาหนะ.
ผู้คน 0,น.,คนทั่วไป.
ผู้ครอบครอง 0,น.,ผู้ยึดถือทรัพย์สินไว้เพื่อตนหรือมีบุคคลอื่นยึดถือทรัพย์สินไว้แทน.
ผู้ค้ำประกัน 0,น.,ผู้ให้คำรับรองต่อเจ้าหนี้เพื่อชำระหนี้ในเมื่อลูกหนี้ไม่ชำระหนี้นั้น
ผู้ค้ำประกัน 1,น.,ผู้ที่ทำสัญญาผูกพันตนต่อเจ้าหนี้ เพื่อชำระหนี้ในเมื่อลูกหนี้ไม่ชำระหนี้นั้น.
ผู้คุม 0,น.,เจ้าพนักงานผู้ควบคุมดูแลนักโทษ.
ผู้โฆษณา 0,น.,บุคคลซึ่งรับผิดชอบในการจัดให้สิ่งพิมพ์นั้นแพร่หลายด้วยประการใด ๆ ไม่ว่าจะเป็นการขายหรือให้เปล่า.
ผู้จัดการ 0,น.,บุคคลที่มีหน้าที่บริหารและควบคุมดูแลกิจการ.
ผู้จัดการมรดก 0,น.,บุคคลที่ตั้งขึ้นโดยพินัยกรรมหรือโดยคำสั่งศาลให้มีสิทธิและหน้าที่จัดการมรดกโดยทั่วไป หรือเพื่อแบ่งปันทรัพย์มรดก.
ผู้ชาย 0,น.,"มนุษย์เพศผู้ซึ่งโดยกำเนิดมีลึงค์เป็นอวัยวะสืบพันธุ์, ชาย ก็ว่า"
ผู้ชายพายเรือ 0,น.,"ผู้ชายทั่วไป เช่น ผู้ชายพายเรืออยู่เต็มไป (ขุนช้างขุนแผน), ผู้ชายรายเรือ ก็ว่า เช่น ดิฉันเป็นผู้หญิงสาว ไม่เหมือนผู้ชายรายเรือ (มิตรสภา)."
ผู้ใช้อำนาจปกครอง 0,น.,บิดามารดาที่มีอำนาจปกครองบุตรซึ่งยังไม่บรรลุนิติภาวะ.
ผู้ญาณ 0,น.,พยาน.
ผู้ดำรงตำแหน่งทางการเมือง 0,น.,ผู้ซึ่งได้รับเลือกตั้งหรือแต่งตั้งให้ปฏิบัติหน้าที่ในตำแหน่งทางการเมือง เช่น สมาชิกสภาผู้แทนราษฎร นายกรัฐมนตรี รัฐมนตรี นายกเทศมนตรี.
ผู้ดี 0,น.,"คนที่เกิดในตระกูลดี, คนที่มีมารยาทดีงาม."
ผู้ดีแปดสาแหรก 0,น.,ผู้ดีที่สืบทอดกันลงมาตั้งแต่ต้นวงศ์สกุลคือบิดามารดาของปู่และย่า ๔ บิดามารดาของตาและยาย ๔ รวมเป็น ๘
ผู้ดีแปดสาแหรก 1,น.,โดยปริยายหมายถึง คนที่ทำกรีดกรายเอาอย่างผู้ดี. (ดู แปดสาแหรก ประกอบ).
ผู้ดูแลนักเรียน 0,น.,ข้าราชการที่ทำหน้าที่เป็นผู้ปกครองนักเรียนในต่างประเทศ.
ผู้โดยสาร 0,น.,ผู้ใช้บริการยานพาหนะเช่นรถ เรือ โดยเสียค่าบริการ
ผู้โดยสาร 1,น.,ผู้อาศัยไปด้วย.
ผู้ตรวจการแผ่นดิน 0,น.,องค์กรอิสระตามรัฐธรรมนูญ มีหน้าที่สอบสวนข้อเท็จจริงเกี่ยวกับการไม่ปฏิบัติตามกฎหมาย หรือปฏิบัตินอกเหนืออำนาจหน้าที่ตามกฎหมาย หรือการละเลยไม่ปฏิบัติหน้าที่ของเจ้าหน้าที่ของรัฐหรือหน่วยงานของรัฐ รวมทั้งอำนาจหน้าที่ในการเสนอเรื่องต่อศาลปกครองหรือศาลรัฐธรรมนูญเมื่อเห็นว่ากฎหมาย กฎ ข้อบังคับ หรือการกระทำใดของบุคคลใดมีปัญหาเกี่ยวกับความชอบด้วยรัฐธรรมนูญ.
ผู้ตรวจสอบภายใน 0,น.,เจ้าหน้าที่ซึ่งทำหน้าที่ตรวจสอบการดำเนินการเป็นการภายในขององค์กร เช่น ตรวจสอบการปฏิบัติงาน การใช้จ่าย การปฏิบัติตามคำสั่ง.
ผู้ตราส่ง 0,น.,บุคคลผู้ทำความตกลงกับผู้ขนส่งเพื่อให้ขนส่งของไป.
ผู้ต้องกักขัง 0,น.,ผู้ที่ถูกกักขังตามหมายกักขังของศาล. (ดู กักขัง ประกอบ).
ผู้ต้องขัง 0,น.,บุคคลที่ถูกขังอยู่ในเรือนจำ.
ผู้ต้องโทษ 0,น.,ผู้ต้องคำพิพากษาหรือคำสั่งของศาลให้ลงโทษหรือให้กักกัน.
ผู้ต้องหา 0,น.,บุคคลผู้ถูกหาว่าได้กระทำความผิด แต่ยังมิได้ถูกฟ้องต่อศาล.
ผู้ถูกกล่าวหา 0,น.,บุคคลผู้ถูกกล่าวหาว่ากระทำความผิดในทางอาญา ทางวินัยหรือจรรยาบรรณ หรือกระทำการอันฝ่าฝืนกฎหมายอื่น.
ผู้ถูกกักกัน 0,น.,ผู้ซึ่งถูกศาลพิพากษาให้กักกัน. (ดู กักกัน ประกอบ).
ผู้ทรง 0,น.,บุคคลผู้มีตั๋วเงินไว้ในครอบครอง ในฐานะที่เป็นผู้รับเงิน ผู้รับสลักหลัง หรือผู้ถือสำหรับตั๋วเงินที่สั่งจ่ายให้แก่ผู้ถือ.
ผู้แทน 0,น.,ผู้ที่ทำหน้าที่ในฐานะเป็นตัวแทนของบุคคล หน่วยราชการ หรือหน่วยงาน
ผู้แทน 1,น.,ผู้แทนราษฎร.
ผู้แทนของนิติบุคคล 0,น.,บุคคลธรรมดาคนเดียวหรือหลายคนตามที่กฎหมาย ข้อบังคับ หรือตราสารจัดตั้งได้กำหนดไว้ให้เป็นผู้แสดงออกถึงเจตนาของนิติบุคคล.
ผู้แทนโดยชอบธรรม 0,น.,บุคคลซึ่งตามกฎหมายมีสิทธิที่จะทำการแทน ให้คำอนุญาต หรือให้ความยินยอม แก่บุคคลผู้มีความสามารถบกพร่อง ในอันที่จะทำการอย่างใดอย่างหนึ่ง.
ผู้แทนราษฎร 0,น.,"บุคคลที่ได้รับเลือกตั้งจากประชาชนผู้มีสิทธิเลือกตั้งให้ทำหน้าที่นิติบัญญัติในสภา, (ปาก) ผู้แทน."
ผู้ไทย 0,น.,ชนชาติไทยสาขาหนึ่งแถวสิบสองจุไทย.
ผู้น้อย 0,น.,"คนที่มีอายุน้อย, ผู้ที่ถือกันว่ามีสถานภาพด้อยกว่า, คนที่อยู่ใต้บังคับบัญชา."
ผู้นำจับ 0,น.,บุคคลผู้มิใช่พนักงานเจ้าหน้าที่ซึ่งนำความมาแจ้งต่อพนักงานเจ้าหน้าที่ให้ทำการจับกุมผู้กระทำความผิด.
ผู้นำฝ่ายค้านในสภาผู้แทนราษฎร 0,น.,สมาชิกสภาผู้แทนราษฎรซึ่งพระมหากษัตริย์ทรงแต่งตั้งจากหัวหน้าพรรคการเมืองในสภาผู้แทนราษฎรที่สมาชิกในสังกัดของพรรคตนมิได้ดำรงตำแหน่งรัฐมนตรี ตามหลักเกณฑ์ที่กำหนดไว้ในรัฐธรรมนูญ.
ผู้เนื่องในพระราชวงศ์ 0,น.,ราชนิกุลรวมทั้งสตรีที่สมรสกับราชนิกุล.
ผู้บริโภค 0,น.,ผู้ซื้อหรือผู้ได้รับบริการจากผู้ประกอบธุรกิจหรือผู้ซึ่งได้รับการเสนอหรือการชักชวนจากผู้ประกอบธุรกิจเพื่อให้ซื้อสินค้าหรือรับบริการ รวมถึงผู้ใช้สินค้าหรือผู้ได้รับบริการจากผู้ประกอบธุรกิจโดยชอบ.(อ. consumer).
ผู้บริหารท้องถิ่น 0,น.,ผู้ซึ่งได้รับเลือกตั้ง หรือแต่งตั้งโดยความเห็นชอบของสภาท้องถิ่นให้ทำหน้าที่บริหารกิจการขององค์กรปกครองส่วนท้องถิ่น เช่น นายกองค์การบริหารส่วนจังหวัด นายกเทศมนตรี.
ผู้บังคับบัญชา 0,น.,ข้าราชการหรือพนักงานรัฐวิสาหกิจที่มีอำนาจปกครองดูแลผู้ใต้บังคับบัญชา.
ผู้บุพการี 0,น.,ผู้ที่ทำอุปการะมาก่อน ได้แก่ บิดา มารดา ปู่ ย่า ตา ยาย ทวด
ผู้บุพการี 1,น.,ผู้ที่ทำอุปการะมาก่อน เช่น บิดามารดาเป็นบุพการีของบุตรธิดา. (ป. ปุพฺพการี)
ผู้ปกครอง 0,น.,ผู้ที่ทำหน้าที่ปกครองดูแล
ผู้ปกครอง 1,น.,บุคคลซึ่งศาลตั้งให้ใช้อำนาจปกครองผู้เยาว์ที่ยังไม่บรรลุนิติภาวะและไม่มีบิดามารดา หรือบิดามารดาถูกถอนอำนาจปกครอง.
ผู้ประกันตน 0,น.,ผู้ซึ่งจ่ายเงินสมทบอันก่อให้เกิดสิทธิได้รับประโยชน์ทดแทนตามกฎหมายประกันสังคม.
ผู้ประพันธ์เพลง 0,น.,"ผู้แต่งทำนองเพลง, ผู้แต่งเนื้อร้องและทำนองเพลง, นักแต่งเพลง ก็เรียก."
ผู้ป่วย 0,น.,"ผู้ที่ไม่สบายเพราะโรคหรือความไข้หรือเหตุอื่น, คนไข้ ก็ว่า."
ผู้ป่วยนอก 0,น.,"ผู้ป่วยที่มารับการตรวจรักษาที่โรงพยาบาล แต่ไม่ได้นอนพักรักษาตัวในโรงพยาบาล, คนไข้นอก ก็ว่า."
ผู้ป่วยใน 0,น.,"ผู้ป่วยที่พักรักษาตัวอยู่ในโรงพยาบาล, คนไข้ใน ก็ว่า."
ผู้พิทักษ์ 0,น.,บุคคลซึ่งศาลมีคำสั่งตั้งให้เป็นผู้ปกครองดูแลคนเสมือนไร้ความสามารถ.
ผู้พิทักษ์สันติราษฎร์ 0,น.,ตำรวจ.
ผู้พิพากษา 0,น.,ผู้มีอำนาจและหน้าที่ในการพิจารณาพิพากษาอรรถ-คดีในศาล.
ผู้พิพากษาสมทบ 0,น.,บุคคลซึ่งได้รับแต่งตั้งตามกฎหมายจัดตั้งศาลชำนัญพิเศษ ให้เป็นองค์คณะร่วมกับผู้พิพากษาซึ่งเป็นข้าราชการตุลาการ มีอำนาจและหน้าที่ในการพิจารณาพิพากษาคดี เช่น ผู้พิพากษาสมทบในศาลเยาวชนและครอบครัว ผู้พิพากษาสมทบในศาลแรงงาน.
ผู้พิมพ์ 0,น.,บุคคลซึ่งจัดการและรับผิดชอบในการพิมพ์.
ผู้เยาว์ 0,น.,บุคคลผู้ยังไม่บรรลุนิติภาวะ.
ผู้รั้ง 0,น.,ผู้รักษาการ.
ผู้รับจำนำ 0,น.,ผู้รับมอบสังหาริมทรัพย์จากผู้จำนำเพื่อเป็นประกันการชำระหนี้.
ผู้รับตราส่ง 0,น.,บุคคลผู้ซึ่งผู้ตราส่งส่งของไปถึง.
ผู้รับบุตรบุญธรรม 0,น.,ผู้ที่ได้จดทะเบียนบุคคลอื่นมาเป็นบุตรของตน.
ผู้รับประกันภัย 0,น.,คู่สัญญาฝ่ายซึ่งตกลงจะใช้ค่าสินไหมทดแทน หรือใช้เงินจำนวนหนึ่งให้ตามสัญญาประกันภัย.
ผู้รับประโยชน์ 0,น.,บุคคลผู้จะพึงได้รับค่าสินไหมทดแทน หรือรับจำนวนเงินใช้ให้ตามสัญญาประกันภัย.
ผู้รับพินัยกรรม 0,น.,ทายาทผู้มีสิทธิรับมรดกโดยพินัยกรรม.
ผู้รับรอง 0,น.,ผู้รับประกัน
ผู้รับรอง 1,น.,ผู้ต้อนรับ.
ผู้รับเรือน 0,น.,บุคคลที่เข้าทำสัญญาคํ้าประกันผู้คํ้าประกันอีกชั้นหนึ่ง.
