คำ,POS,ความหมาย
ลก ๑,น.,คอกสำหรับให้เป็ด ไก่ อยู่อาศัย = เล้า
ลก ๒,ว.,จำนวนนับแบบโบราณต่างจาก ห้า = หก เช่น พระราชโอรสของขุนบรม (บูฮม) องค์ที่ ๖ ชื่อ ลกกม
ลกงก,ว.,"ลักษณะสิ่งของขนาดใหญ่ที่ยื่นงอออกมา เช่น งูยอคอซกงก = งูชูคอขึ้นสูง, ถ้าขนาดเล็ก เรียก ซ็อกง็อก"
ลกจ๊ก,ว.,"อาการเดินของคนขาแข็ง สำหรับตัวใหญ่, สำหรับตัวเล็ก ว่าล็อกจ๊อก"
ลง,ก.,ไปสู่เบื้องต่ำ ตรงข้ามกับขึ้น
ล่ง,ว.,"ว่าง, เปล่า, ไม่มีเครื่องกำบัง, ไม่ฝืด, สะดวก เช่น หัวใจล่ง = หายใจสะดวก"
ลงข่วง,ก.,หญิงสาวลงไปทำงานรวมกัน เช่น ปั่นด้าย เป็นต้น ที่ลานบ้านในเวลากลางคืน
ลงแขก,ก.,ร่วมกันทำงานโดยขอแรงกัน
ลงโขง,ก.,เสด็จออกว่าราชการ
ลงคอ,สำ.,ทำได้โดยไม่ตะขิดะตะขวง
ลงเงิน,ก.,พนันกัน วางเงินเป็นเดิมพัน
ล้งจ้ง,ว.,"คดมาก, ไม่ตรง, เก, เช่น คดล้งจ้ง"
ลงแดง,ก.,ท้องเดินถ่ายอุจจาระเป็นโลหิต
ลงโต ๑,ก.,ซูบผอมลง
ลงโต ๒,ก.,หารเลขไม่มีเศษ = ลงตัว
ลงท้อง,ก.,ท้องเดินหรือท้องร่วง
ลงทางขว้ำ,ก.,อาการที่ล้มคว่ำ
ลงทางข้าง,ก.,อาการที่ล้มตะแคง
ลงทางหงาย,ก.,อาการที่ล้มหงาย
ลงทึน,ก.,ลงทุน
ลงโทษ,ก.,ทำโทษผู้ทำผิดกฎ
ลงไท้,ก.,เข้าทรงผีฟ้าเพื่อขับไล่ผีที่สิงคนหรือพิธีไหว้ครูของหมอไท้
ลงธรรม,ก.,ทำพิธีกรรมทางไสยศาสตร์เพื่อขับผี
ลงนา,ก.,ลงมือทำนาในฤดูฝน
ลงเลข,ก.,ดูหมอ ด้วยเลขโบราณ ๗ ตัว เพื่อทำนายโชคเคราะห์
ลงวัด,ก.,ชาวบ้านชุมนุมกันทำงานบางอย่าง หรือหารืองานบุญที่วัดเวลากลางคืน
ลงศาล,ก.,กระทำการพิจารณาตัดสินคดีที่ศาล
ลงสรง,ก.,อาบน้ำ ใช้สำหรับพระสงฆ์และกษัตริย์
ลงแส้ ๑,ก.,ตีม้าด้วยแส้ เพื่อให้วิ่งหรือเฆี่ยนผู้ทำผิด
ลงแส้ ๒,สำ.,ลงโทษผู้ทำผิดด้วยวิธีใดวิธีหนึ่ง
ลงอาญา,ก.,ทำโทษผู้ทำผิดกฎ
ลด ๑,ก.,ถอยต่ำ
ลด ๒,ว.,ต่ำ
ลดคราบ,ก.,ตาย
ลดชั่ว,ก.,ตาย เช่น มรณาลดชั่ว
ลดเลี้ยว,ว.,"กลับกลอก, ไม่ซื่อตรง"
ลดา,ก.,"ทำให้อ่อนด้วยไฟ, เอาไฟเผาให้เกรียมที่ผิว"
ล้น ๑,ก.,เต็มเกินไป จนคงอยู่ไม่ได้ ต้องออกนอกขอบเขต
ล้น ๒,ว.,"มากมาย, หลายหลากมักพูดคู่กับคำว่าลื่น, เช่น ลื่นล้นพ้นประมาณ"
ลน ๆ,ว.,พูดพล่ามไม่หยุดปาก เช่น เว้าลน ๆ = พูดพล่าม
ลบ,ก.,"หักออก, ชักออก (ใช้ในวิธีเลข)"
ลบ,ก.,เอาฝ่ามือทาบลงแล้วเลื่อนไปมาเป็นต้น
ลม,น.,"ธาตุชนิดหนึ่งในธาตุ ๔ มีลักษณะเคลื่อนไหวพัดไปมา, โรคชนิดหนึ่งทำให้หน้ามืด เวียนศีรษะ บางครั้งจนถึงสลบ"
ล้ม ๑,ก.,กิริยาที่เอนลงถึงพื้นตั้งอยู่ไม่ได้
ล้ม ๒,สำ.,"ฆ่า เช่น ล้มวัว, ล้มควาย"
ลมกรรมชวาต (...ชะหวาด),น.,ลมเบ่ง เวลาคลอดบุตร
ลมขึ้น ๑,น.,ลมที่พัดจากทิศใต้ไปทิศเหนือในฤดูฝน
ลมขึ้น ๒,ก.,อาการที่ลมดันออกจากภายในกาย ทำให้หาวเรอ มีอาการหน้ามืดอาเจียน
ลมขึ้นเบื้องสูง,ก.,อาการที่ลมดันออกจากภายในกาย ทำให้หาวเรอ มีอาการหน้ามืดอาเจียน
ลมงวง,น.,ลมชนิดหนึ่ง เมื่อเริ่มเกิดจะให้เป็นลำยื่นลงมาจากใต้ฐานเมฆ มีลักษณะคล้ายงวงช้าง ถ้ามีกำลังแรงมาก ลำนี้จะยาวลงมามาก
ลมงวงช้าง,น.,ลมชนิดหนึ่ง เมื่อเริ่มเกิดจะให้เป็นลำยื่นลงมาจากใต้ฐานเมฆ มีลักษณะคล้ายงวงช้าง ถ้ามีกำลังแรงมาก ลำนี้จะยาวลงมามาก
ลมแดง,น.,ลมพายุใหญ่มองเห็นท้องฟ้าเป็นสีแดง มักเกิดในเวลาบ่ายถึงเย็น
ลมปัสวาส (ปัดสะหวาด),น.,"ลมหายใจออก (ส.,ป.)"
ลมลง,น.,ลมที่พัดจากทิศเหนือลงทิศใต้ในฤดูหนาว
ลมว่าว,น.,ลมที่พัดจากทิศเหนือลงทิศใต้ในฤดูหนาว
ลมหัวกุด,น.,ลมหมุนขนาดเบา = ลมบ้าหมู
ลมออน,น.,"พายุ, พระพาย, มารุตเทพ"
ลมอัสวาส,น.,"ลมหายใจเข้า (ส.,ป.)"
ลวก ๑,ก.,"กิริยาที่ถูกของเหลวที่ร้อนจัดหรือไฟ, กิริยาที่ถูฏไฟพลุ่งออกมากระทบผิว, รดหรือแช่ด้วยน้ำร้อน"
ลวก ๒,ว.,"อย่างหยาบ ๆ , มักง่าย, คร่าว ๆ , ยังไม่เรียบร้อย"
ลวง ๑,น.,"ที่พิกัดแห่งใดแห่งหนึ่ง เช่น ลวงต้อน, ลวงลี่"
ลวง ๑,น.,"นาค, มังกร"
ล่วง ๑,ก.,"พ้นไป เช่น สามปีล่วงแล้ว, ตาย, เช่น ล่วงหน้าไปก่อน, ทะลุถึงกัน, เช่น ล่วงใส่กัน, ละเมิดสิทธิหรือประเพณี, เช่น ล่วงเรือน"
ลวง ๒,ก.,"ทำให้หลงเชื่อ, ทำให้เชื่อว่าเป็นจริง"
ล่วง ๒,ว.,เกินเลยไป เช่น เป็นคนล่วง
ลวง ๓,ว.,"ทาง, ด้าน, ขนาด, เช่น ลวงกว้าง, ลวงยาว, ลวงหน้า"
ล่วงเกิน,ก.,"สบประมาท, ดูหมิ่น"
ล่วงข้าง,ก.,เกินพอดี
ล่วงล้ำ,ก.,เลขเขตที่กำหนดไว้
ล่วงลุ,ก.,เสร็จสิ้นไป
ล่วงส้าว,ก.,เกินพอดี
ล่วงหน้า,ว.,ก่อนกำหนด
ลวด ๑,น.,"โลหะทำเป็นเส้นยาว, ครั้ง, คราว, ทอดระยะ, เช่น นอนลวดเดียวตื่น, พร้อมกันทั้งหมด, เช่น ตายลวด"
ลวด ๒,ว.,"เลย, นั่นเที่ยว, ทีเดียว"
ลวด ๓,ว.,"ตลอด, กระทั่ง, เช่น เฮ็ดลวดตาย, ทั้งหมด, เช่น ตายลวด"
ลวดลาด,ว.,"ผิวเผิน, มักง่าย, สุดเอาเผากิน"
ลวดเลียด,ว.,"ผิวเผิน, มักง่าย, สุดเอาเผากิน"
ลวดแล้ว,ว.,แล้วเสร็จ
ลวน,ก.,"ทะลึ่ง, ตีเสมอ"
ล้วน,ว.,"แท้, ไม่มีอะไรเจือปน, เบี้ยคว่ำขึ้นดำทั้ง ๔"
ล้วน ๆ,ว.,"แท้ ๆ , ไม่มีอะไรเจือปนเลย"
ล้วนค้วน,ว.,"อาการขดเป็นวงอยู่อย่างงูใหญ่ขด (เอก.), ล้วนค้วน เลี้ยนเคี้ยน (พหู.), ถ้าขนาดเล็กว่า ล้องค้อง (เอก.), ล้องค้อง แล้งแค้ง (พหู.)"
ล้วนแต่,ว.,ทั้งหมด
ลวนลาม,ก.,ล่วงเกินผู้อื่นเกินสมควรจนขาดความสุภาพ
ล้วนแล้ว,ว.,ทั้งหมด
ลวบ ๑,ก.,ลวก ใช้กับเปลวไฟ เช่น ไฟลวบ
ลวบ ๒,ก.,"รวมเอาทั้งหมด, อาการที่เอาสิ่งต่าง ๆ เข้ามาไว้ด้วยกัน, เช่น รวบผม"
ลวบ ๆ,ว.,"ซ้ำ ๆ ซาก ๆ เช่น เลียลวบ ๆ , เว้าลวบ ๆ"
ลวา,น.,ลา
ลวาด,ว.,"เลย, นั่นเที่ยว, ทีเดียว"
ลวาด ๑,ก.,"ทา, เท, ลาด, เช่น ลวาดพื้น, ถ้าทาบาง ๆ หรือเพียงเล็กน้อยว่า แลด"
ลวาด ๒,ว.,"เสมอ, เต็ม, เช่น น้ำลวาดฝั่ง, ท่วม, เช่น ลวาดกูม = การดื่มน้ำในขัน หรือกระบอกให้ท่วมริมฝีปาก, ตีลวดกวาดเพียง สำ. ยกตนข่มท่าน, ตีตนเสมอผู้ใหญ่"
ลหุ,ว.,"เบา, เร็ว, ฉับไว (ป.)"
ลหุกะ,ว.,"เบา, เล็กน้อย (ป.)"
ลหุกาบัติ,น.,"อาบัติเบา (ป.), อาบัติเล็กน้อย"
ลหุโทษ,น.,โทษสถานเบา
ลอ,ว.,"ลักษณะของตาส่อน หรือตาถั่วเล็กน้อย, ถ้าขาวทั่วทั้งตาและโปนออกมาว่า โล"
ล้อ ๑,ก.,"ยั่วเย้า, เลียนแบบ"
ล้อ ๒,น.,"ท่อนไม้กลม ที่ตัดออกเป็นแว่น ๆ เหมือนล้อรถ เจาะรูกลางสำหรับใส่เพลา มีคันชักลาก ใช้สำหรับลากไม้ซุง, ชนิดเล็กสำหรับเด็กเล่น, ส่วนมากเรียก หมากล้อ"
ล้อ ๓,น.,ส่วนของรถ หรือเกวียนซึ่งเป็นวงกลม สำหรับหมุนเคลื่อนพารถ หรือเกวียนไป
ลอก,ก.,"เอาเปลือก หรือหนัง หรือเยื่อหุ้มออก, กิริยาที่เปลือก หรือผิวหลุดออกเป็ฯแผ่น ๆ , เช่น หนังลอก"
ลอกคราบ,ก.,ถ่ายหนัง หรือเปลือกเก่าออก เช่น งูหรือปูลอกคราบ
ลอกเชือก,น.,ชื่องูไม่มีพิษชนิดหนึ่ง
ลอกแลก,ว.,แสดงอาการหลุกหลิกเหลียวซ้ายแลขวาอยู่ตลอดเวลาถือกันว่าเป็นกิริยาไม่สุภาพ
ล็อกแล็ก ๆ,ว.,โยกคลอนไปมา
ลอกหนังสือ,ก.,เขียน หรือจำลองออกมา
ลอง,ก.,"ทำดูก่อน, สอบดู, พิสูจน์ดู, ทำคุณไสยศาสตร์ ใช้คู่กับคำว่าใส่ เป็นใส่ลอง"
ล่อง,ก.,"ลงไปตามน้ำ เช่น ล่องเฮือ, ล่องแพ, แหย่หรือแยงช่อง หรือรูที่อุดตัน ด้วยของแข้งให้ทะลุ"
ล่องขวง,น.,ลำทำนองหนึ่งมีการขึ้นเสียงสูง-ต่ำ เอื้อนเสียงยาวกว่าปกติลำทางยาวอ่านหนังสือหรือ
ล่องของ,น.,ทำนองแว่วอย่างหนึ่ง หรือลำยาวพรรณนาเรื่องล่องแม่น้ำโขง
ล้องค้อง,ว.,อาการขดของสัตว์ หรือสิ่งที่เล็ก (ดู ล้วนค้วน)
ล่องช่อง,ว.,"เข้าคู่กันอย่างเจาะ, ไปกันได้, เข้ากันได้ดี"
ลองซอย,ว.,อาการนั่งบนหลังสัตว์ โดยการเหยียดเท้าทั้ง ๒ ลงทางเดียวกัน
ลองเบิ่ง,ก.,ทดลองดูก่อน
ล่องพุ,ก.,ทะลุทะลวงไม้ลอมลอกให้เป็นรู ด้วยเหล็กหมาดเผาไฟให้แดง เพื่อใช้ยิงด้วยลูกดอก
ลอด,ก.,"ผ่านช่องไป เช่น ลอดถ้ำ, ไปใต้สิ่งใดสิ่งหนึ่ง, เช่น ลอดพื้น, ลอดรั้ว, พ้น, เช่น ลอดหาย = รอด"
ลอดช่อง,น.,ชื่อขนมอย่างหนึ่ง ทำด้วยแป้ง ใช้กดลงในกระโหลกที่มีช่องไหลออกเป็นตัว ๆ กินกับน้ำกะทิ
ลอน ๑,ก.,บังอาจ เช่น อย่าลอนมาสู้
ลอน ๒,ว.,"เลย, เป็นอันขาด, เช่น อย่าลอนมาต้าน"
ลอนท่อ,สัน.,"เพียงแต่, เหมือนกัน, เช่น ""ลอนท่อธาตุสี่ตั้งลมปากเป็นเสียง"""
ลอนท่อ,สัน.,"เพียงแต่, แต่ว่า"
ลอนวา,สัน.,"ผิว่า, หากว่า"
ลอนว่า,สัน.,"คงจะ, หากว่า, เผื่อว่า, อาจจะ, บางที"
ลอบ ๑,น.,ชื่อเครื่องดักปลาชนิดหนึ่ง
ลอบ ๒,ก.,"ทำ, ดู, ไปโดยไม่ให้อีกฝ่ายหนึ่งรู้ตัว"
ลอบเลือน,ก.,ลักพา
ลอม,น.,ฟ่อนข้าวที่เกี่ยวแล้ว เก็บมากองเรียงเป็นระเบียบไว้ เช่น ลอมเข้า
ลอมคอม,น.,ไม้พุ่มมีหนาม ผลคล้ายพุทรา แต่กินไม่ได้
ลอมคอม,น.,ต้นไม้ชนิดหนึ่ง ผลเล้กกลมรสเปรี้ยว
ลอย,ก.,"ทรงตัวอยู่ในน้ำ ไม่จม, อยู่กลางอากาศ ไม่ตก, เด่นขึ้น, ไม่อยู่กับที่, เช่น ใจลอย"
ล่อย,ว.,"ง่อย, เปลี้ย แขนขาไม่มีกำลัง, เช่น เป็ฯโรคเหน็บชาว่า เป็นล่อย"
ล้อยซ้อย,ว.,"อาการสิ่งของที่มีลักษณะเคียงขนานกันอย่างมีระเบียบสวยงามเรียบร้อย เช่น นั่งเหยียดขาเฮียงกันว้อยล้อย, วางเฮียงกันซ้อยล้อย"
ล้อยซ้อย,ว.,เรียงราย
ลออ,ว.,"งาม, สวย, ดี (ข.)"
ละ,ก.,"ปล่อย, วาง, ทิ้ง, สละ"
ละคราบ,ก.,ตาย
ละคอน,น.,มหรสพอย่างหนึ่ง แสดงเรื่องต่าง ๆ โบราณเรียก ละเม็ง
ละโงก,น.,เห็ดอย่างหนึ่งเกิดในป่ามีดอกใหญ่กินได้มี ๒ ชนิด คือ เห็ดละโงกขาว เห็ดละโงกเหลือง (เรียกชื่อตามสีของมัน)
ละบัด,น.,"หญ้าอ่อน (ส่วย. บัด), ส่วนมากเรียก หญ้าบัดป่ง"
ละบือ ๑,ก.,"ลือ, เลื่องลือ"
ละบือ ๒,ว.,"แผ่ขยาย, กระจายไปตามเสียงบอกเล่า"
ละมั่ง,น.,"สัตว์ป่าจะพวกกวางแต่มีจุดสีขาวทั้งตัว, ส่วนมากเรียก มั่ง"
ละมุ,?,ดู ถ่ำ ๑.
ละมุ,น.,การสะกิ่งไม้ใบไม้ไว้ในน้ำเพื่อล่อปลา
ละมุด,น.,ต้นไม้ผลชนิดหนึ่งเมื่อผลสุกรับประทานมีรสหวาน
ละมุน ๑,น.,กลุ่มพืชที่เกิดตามชายหนองบคง = ละเมาะ
ละมุน ๒,ว.,"อ่อน, นุ่มนวล, ไม่กระด้าง"
ละเม็ง,?,ดู ละคอน
ละเมิด,ก.,"ล่วงเกิน, ฝ่าฝืน, ทำโดยพลการ"
ละโมบ,ว.,"มักได้, มักกิน"
ละไม,ว.,"งาม, ชวนดู"
ละลวย ๑,ก.,"งงงวย, ทำให้รักให้หลง"
ละลวย ๒,น.,ชื่อคาถาอย่างหนึ่ง กล่าวว่า ทำให้คนหลงรัก
ละลา,น.,หนาม (เยอ.)
ละลาย,ก.,"เหลว, ทำให้เหลว, ซาบซึมไปในน้ำหรือของเหลว"
ละไล้,ก.,"ลูบ, ทา, โลม, ส่วนมากว่า ไล้"
ละว้า,น.,ชนชาวเขาเผ่าหนึ่งในตระกูลมอญ
ละโว้,น.,ชื่อเก่าเมืองลพบุรี
ละหาน,น.,ที่ลุ่มน้ำขัง เป็นต้นน้ำ ลำธารหรือห้วย
ละเหย,ก.,"ระเหย, ส่วนมากว่า เหย"
ละออง,น.,"ฝุ่น, ผงละเอียด, เกสร"
ละอาย,ก.,"กระดาก, อายใจ, ขวยเขิน, ส่วนมากว่า อายหรืออยากอาย"
ลัก,ก.,"เอาสิ่งของที่เขาไม่ได้ให้เมื่อเขาไม่รู้ไม่เห็น, ขโมย, ลอบทำ"
ลักขณา,ว.,มีลักษณะดี
ลักขะ,น.,"เครื่องหมาย, เป้าหมาย, จำนวนแสนหนึ่ง"
ลักลอบ,ก.,ลอบเอาไปหรือเอามา
ลักลั่น,ว.,ขาดความมีระเบียบทำให้เกิดความเหลื่อมล้ำ
ลักลืน,น.,ขุมเห็ดไทย
ลักเฮ็ด,ก.,"ลอบทำ, แอบทำ, ลักหลับ"
ลัง,ก.,"แสดงอาการไม่ทำตามด้วยการเล่นตัว, ขี้อ้อน = พยศ"
ลังกา,ว.,"ลักลั่น, หยุมหยิม, ไม่เป็นระเบียบ"
ลังล้าว,ก.,"แสนงอน, เล่นแง่กัน"
ลัชชี,น.,ผู้มีความละอาย (ป.)
ลัด,ก.,"ตัดตรงไป เช่น ย่างลัดท่ง, คอดักรอ, เช่น ไปลัดกลางทาง, กั้น, ขวาง, เช่น ไปลัดปลา, แล่นลัดงัว"
ลัทธิ,น.,คติความเชื่อ หรือความคิดเห็นเกี่ยวกับศาสนาหรือการเมือง
ลัน,น.,เครื่องดักปลาไหล ทำด้วยกระบอกไม้ไผ่ มีงาที่ปากกระบอก
ลั่น,ก.,"ดัง เช่นฟ้าลั่น, ตี, ทำให้ดัง, เช่น ลั่นฆ้อง, เหนี่ยวให้หลุดจากที่บังคับ, เช่น ลั่นไก, พูดตกปากรับคำ, เช่น ลั่นวาจา"
ลั่นกระดูก,น.,การเก็บอัฐิ ที่เผาแล้วฝังหรือบรรจุไว้แล้วบำเพ็ญกุศลอุทิศให้
ลั่นดูก,น.,การเก็บอัฐิ ที่เผาแล้วฝังหรือบรรจุไว้แล้วบำเพ็ญกุศลอุทิศให้
ลันเตา,น.,ถั่วชนิดหนึ่ง มีฝักแบนไม่ยาวนัก
ลับ,ว.,ไม่เปิดเผย
ลับตา,ว.,มองไม่เห็นกัน
ลับลี้,ว.,"เร้นลับ, ซ่อนเร้น"
ลับลืน,น.,ขุมเห็ดไทย
ลับแล ๑,น.,ฉากกั้น ที่ยกไปมาได้ ถ้าทำไว้ที่ช่องประตูเรียกบาน
ลับแล ๒,น.,ชื่อเมืองที่เร้นลับ
ลับหลัง,ว.,ตรงข้ามกับต่อหน้า
ลัว,น.,ลา
ลั่ว,ก.,"พูดปด, พราง, หลอกลวง, เช่น ลั่วกิน (ส่วย.)"
ลัว ๑,น.,ลูกสะใภ้คนเล็ก
ลั้ว ๑,น.,บ่างชนิดใหญ่ (ดู บ่าง)
ลัว ๒,น.,หญิงรุ่นป้า
ลัว ๒,น.,ลูกสะใภ้คนเล็ก
ลั้ว ๒,น.,แพรชนิดหนาลื่นเป็นมัน
ลัว ๆ,ว.,ไม่ชัดเจน เช่น เว้าลัว ๆ คือ พูดไม่ชัดเพราะลิ้นแข็ง
ลัวะ,ก.,"ลุทิ้ง, ทำให้ไหลออก, เช่น ลัวะหนองผี"
