บุพพัณหชาติ,น.,พืชที่จะพึงกินก่อน หมายถึงเข้า = ข้าว
บุพพัณหสมัย,น.,เวลาเช้า
บุพพาจารย์,น.,"บิดา, มารดา ผู้อบรมสั่งสอนลูกก่อนคนอื่น หรือ หมายถึง ครู อาจารย์ ผู้เริ่มต้นการสอนในอดีต"
บุพเพสันนิวาส,น.,การอยู่ร่วมกันที่เป็นสามีภรรยาในชาติก่อน
บุพโพ,น.,"น้ำเหลือง, น้ำหนอง"
บุเพนิวาสานุสติญาณ,น.,ความรู้ที่เป็นเครื่องระลึก ได้ถึงขั้นที่อยู่อาศัยอยู่ก่อนในอดีตชาติ = ระลึกชาติได้
บุ้ม,ว.,ยุบ = บุ๋ม เช่น แก้มบุ้ม = แก้มบุ๋ม
บุ๋ม,ว.,เสียงที่ฟังแล้วดัง บุ๋ม ๆ
บุ้ย,ก.,"อาการที่ยื่นริมฝีปากออกท่าพะยักพะเยิด, ทำปากบอกใบ้ = บุ้ยปาก"
บุรณะ,ก.,"ปฏิสังขรณ์, ซ่อมแซม"
บุรพ (บุรพะ),ว.,"เบื้องหน้า, ส่วนมากว่า บูรพา"
บุระ,น.,"ป้อม, หอ, วัง, เมือง"
บุรัตถิมทิศ,น.,"ทิศเบื้องหน้า, ทิสตะวันออก"
บุรัมสิทธิ,น.,สิธิเรียกร้องได้ก่อนสิทธิธรรมดา
บุราณ,ว.,"เก่า, ก่อน"
บุราณทุติยิกา,น.,เมียที่มีอยู่ก่อนออกบวช
บุริน,น.,เมือง
บุรินทร์,น.,"เมือง, เจ้าเมือง"
บุรี,น.,เมือง
บุรุษ,น.,ผู้ชาย
บุษกร,น.,ดอกบัวสีน้ำเงิน
บุษกร,บ.,ข้าง (ส.)
บุษบก,น.,เรือนยอดขนาดเล็ก ซึ่งอาจย้ายเคลื่อนที่ได้
บุษบง,น.,ดอกไม้
บุษบัน,น.,"ดอกไม้, ดอกบัวเผื่อน"
บุษบา,น.,ดอกไม้ (ส.)
บุษย,น.,ชื่อดาวนักษัตรที่ ๘
บุษยมาส,น.,เดือนอันมีจันทร์เพ็ญเสวยนักษัตรบุษยในเดือนยี่ราวมกราคม
บุษราคัม,น.,พลอยสีเหลือง
บุหรี่,น.,ยามวน = กอกยา
บุฮาน,ว.,"เก่า, ก่อน"
บู,น.,ชื่อปลาชนิดหนึ่งรูปร่างคล้ายปลาช่อนแต่เกล็ดเล็กกว่า
บูชา,น.,"ให้ความนับถือ, สักการะ เช่น บูชาพระ"
บูชิต,ว.,บูชาแล้ว
บูด,ว.,อาหารเสีย รสกลิ่นผิดปกติรับประทานไม่ได้
บูธม,ว.,ยิ่ง = บรม
บูรณ์,ว.,เต็ม (ส.)
บูรณะ,ก.,"ปฏิสังขรณ์, ซ่อมแซม"
บูรณะ,ก.,ซ่อมแซมทำให้กลับคืนดีเหมือนเดิม
บูรพา,น.,"ทิศเบื้องหน้า, ทิสตะวันออก"
บูรม,ว.,ยิ่ง = บรม
บูฮาน,ว.,"เก่า, ก่อน"
เบ,ว.,แบมือ
เบ้,ว.,"บิด, เบี้ยว, เช่น ทำหน้าเบ้"
เบ่ง,ก.,"ทำให้พองตัว, ดันออก"
เบ็งจ์,ว.,ห้า = เบญจ เช่น ขันหมากเบ็ญจ์ = ขันบายศรี
เบ็งช์,น.,บัญชา
เบ็งชร,น.,หน้าต่าง = บัญชร
เบญจมาส,น.,ดอกไม้ชนิดหนึ่ง
เบญจศีล,น.,ศีลห้า
เบญจางคประดิษฐ,น.,การกราบลงกับพื้น ให้หน้าผาก มือทั้ง ๒ และเข่าจรดพื้น
เบ็ด ๑,น.,เครื่องมือสำหรับตกปลา รูปเป็นขออปลายแหลม
เบ็ด ๒,ก.,ดัดให้ตรง เช่น เบ็ดให้ซื่อ
เบ็ดซิด,น.,เบ็ด มีคันและสายยาว ผูกทุ่น เรียก เบ็ดหวีด
เบ็ดเตล็ด,ว.,สิ่งเล็ก ๆ น้อย ๆ
เบน,ก.,"เอน, เอียง, เบี่ยง"
เบ็น,น.,ต้นไม้ชนิดหนึ่ง ตามต้นมีหนามยาวแหลม ลูกสุกสีช้ำรสหวาน อมฝาด
เบนซิน,น.,น้ำมันสำหรับเครื่องยนต์ รถยนต์
เบา,ว.,"ไม่หนัก เช่น เบาใจ = ไม่หนักใจ, เบาบาง = ลดน้อยลง, เบาปัญญา = หย่อนสติปัญญา, เบามือ = ไม่หนักมือ"
เบ้า,น.,แมลงชนิดหนึ่งเกิดจากกองขี้ควาย ตัวขนาดใหญ่ ทำเบ้าวางไข่เป็นตัวอ่อนก่อน แล้วจึงกลายเป็นตัวแมลง
เบ้า ๑,น.,รังของด้วงชนิดหนึ่ง ก่อตัวขึ้นใต้กองขี้ควายแล้ว ตัวด้วงก็คุดอยู่ภายในเบ้านั้น
เบ้า ๒,น.,"ดิน หรือโลหะทำเป็นรูปเตาทนความร้อนสูงลักษณะเป็นก้นถ้วยใช้สำหรับหลอมโลหะ เช่น เงิน, ทอง"
เบ้าตา,น.,คะโมงตา
เบาราณ,น.,โบราณ
เบาะ,น.,ที่รองนั่งเย็บด้วยผ้า ยัดนุ่น หรือฟองน้ำ
เบิก ๑,น.,คำกำกับชื่อ เบญจศก ในวิธีนับศักราช เช่น เบิกไว้ = ปีชวดเบญจศก
เบิก ๒,ก.,"เปิด, ทำให้กว้าง, เปิดออก"
เบิ่ง,ก.,"ดู, มอง, เหลี่ยวดู"
เบิ้ง,ว.,บ้าง (นม.)
เบิด,ก.,แหงนหน้าดู = เบิ่ง เช่น ควายเบิด = ควายเบิ่ง คือแสดงอาการเชิดคอสูงขึ้น ตามองไปข้างหน้า
เบิดแถ้แหล้,ว.,"อาการเดินเชิดหน้าเพื่อให้คนที่ตนไปพบนั้น ได้มองเห็น, ทำหน้าตาให้เขาเห็น"
เบิดแฮง,ว.,"เพลีย, ล้า"
เบี้ย,ว.,"เตี้ย, ง่อย"
เบี้ย,น.,"หอยจำพวกหนึ่ง มีเปลือกแข็ง โบราณใช้เป็นสิ่งอุปกรณ์ซื้อจ่ายมีอัตรา ๑๐๐ เบี้ย เป็น ๑ อัฐ ในปัจจุบัน ยังนิยมใช้คำว่าเบี้ยนำหน้าคำอื่น เช่น เบี้ยบำนาญ = เงินบำนาญ, เบี้ยโบก = การพนันเบี้ยโบก, เบี้ยเลี้ยง = เงิน เบี้ยเลี้ยง"
เบี่ยง,น.,"กลับ, ชิ้น"
เบี่ยง,น.,เรียกผ้าอังสะสำหรับพระภิกษุ สามเณรใช้คลุมร่างขณะอยู่ตามปกติในกุฏิวิหารภายในขอบเขตวัด
เบียด,ก.,"ชิดเข้า, เฉียดเข้า"
เบียดบัง,ก.,"ยักยอด, ปิดบังเอาไว้"
เบี่ยนหมากเขือ,น.,ชื่ออาหารชนิดหนึ่งปรุงด้วยมะเขือต้มหรือเผา ผสมปลาป่น น้ำปลาร้า พริก หอมกระเทียม ใบสะระแหน่
เบียร์,น.,น้ำเมาชนิดหนึ่ง เป็นชนิดเมรัย (อ.)
เบี้ยว,ว.,ลักษณะที่บิดเบี้ยวไม่กลม
เบือ,ก.,"ฉาบ, ทา"
เบือ ๑,น.,ข้าวสารแช่น้ำแล้วนำไปบดใส่ลงในแกง ทำให้มีรส อร่อยขึ้น เรียกว่า เข้าเบือ
เบื้อ ๑,น.,สัตว์ป่าชนิดหนึ่ง กล่าวกันว่ารูปร่างคล้ายคนแต่ไม่มีสะบ้าหัวเข่า ถิ่นอีสานเรียกว่า ถักแถ่ ปัจจุบันนี้ไม่มีผู้พบเห็นอีก คงจะสูญพันธุ์ไปแล้ว เนื่องจากไม่สามารถต่อสู้กับธรรมชาติได้ เพราะเวลาหกล้มแล้วลุกไม่ขึ้น ต้องเกาะกิ่งไม้ ต้นไม้ จึงจะยืนได้ เมื่อมีความอ่อนแอ ก็จะตกเป็นอาหารของเสือหมดพันธุ์ไปในที่สุด
เบือ ๒,ก.,วางยาพิษ = เบื่อ เช่น เบือปลา = เบื่อปลา
เบื้อ ๒,ว.,"อ่อนแรง, อ่อนเปลี้ย, เพลีย, ละเหี่ย"
เบื้อง,น.,"ข้าง, ฝ่าย, ส่วน, แถบ"
เบื้องถ้วย,น.,ชิ้นส่วนของถ้วยดินที่แตกแล้ว
เบื้องหม้อ,น.,ชิ้นส่วนของถ้วยดินที่แตกแล้ว
เบือน ๑,ก.,"บิด, หัน, ผัน, เหไป"
เบือน ๒,ว.,"คด, ไม่ตรง, เช่น ตาเบือน = ตาเข คือ มองไม่ตรงทิศทาง"
แบ้,น.,บัวชนิดหนึ่ง = บัวผัน
แบ้ ๑,น.,บัวผัน = บัวขี้แบ้
แบ้ ๒,น.,แพะ
แบก ๑,ก.,รองรับของไว้บนบ่า = แบกของ
แบก ๒,ก.,"ตวัด, รัดเข้ากับกิ่งไม้ ตอไม้ เช่น เมื่อดึงเชือกผูกคอวัวไม่อยู่ให้แบงไว้"
แบ่ง,ก.,"แยกออกเป็นส่วน ๆ = แบ่งเบา, แบ่งปัน"
แบ้ง,น.,ธนบัตร
แบ่น,ว.,"เล็ง, หมายตา, เช่น แบ่นปืน = เล็งปืน"
แบ้น,น.,อวัยวะเพศชาย
แบน ๑,ก.,"แบ, แผ่, เช่น แบนมือ = แบมือออก"
แบน ๒,ว.,ลักษณะสิ่งของที่กลม ก้นตืน เช่น จาน
แบบ,น.,"ฉบับ, ตัวอย่าง, ตำรา, เช่น แบบเรียน, แบบพิมพ์"
แบ้ว,ว.,ช่าง เช่น แบ้วเถอะ = ช่างเถอะ
แบะ,ก.,"แยกออก, แตกออก"
โบ,น.,ผ้าที่ผูกให้เป็นหูกระต่าย
โบก ๑,น.,การพนันเบี้ยโบก = เล่นโบก
โบก ๒,น.,กระบอกไม้ไผ่ตัดให้สั้น ๆ ใช้แทนจอกสำหรับตักรองน้ำรับประทาน
โบกขรณี,น.,สระบัว (ป.)
โบกขรพรรษ,น.,ฝนที่ตกค้างบนใบบัว มีสีแดง (ป.)
โบกไม้เจีย,น.,กระบอกไม้ไผ่ที่ทะลุปล้อง ๒-๓ ปล้อง หรือบากส่วนหนึ่งออกใช้เก็บของได้
โบกไหม,น.,กระบอกม้วนไหม
โบด,น.,เครื่องเป่าชนิดหนึ่งทำด้วยกระบอกไม้ไผ่ที่เหลาให้บางหรือไม้ซางตัดให้สั้นยาวตามเสียงที่ต้องการมัดติดกันโดยรอบมีแกนอยู่ตรงกลาง มีชนิดเป่าเล่นและชนิดเหวี่ยง
โบนัส,น.,"เงินปันผล หรือเงินบำเหน็จรางวัล ที่ได้รับต่างหากจากบริษัทหุ้นส่วน, นายทุน"
โบย,ก.,"ตี, คว่ำเฆี่ยน"
โบราณ,ว.,"เก่า, ก่อน"
โบราณ,ว.,"เก่าแก่ เช่น คนโบราณ, วัตถุโบราณ, โบราณคดี, โบราณสถาน"
โบส,ว.,ผู้ชาย
โบสถ,น.,"อาคารที่ก่อสร้างเป็นแบบฉบับ หรือศิลปโดยเฉพาะ คือมีหลังคา ช่อฟ้า ใบระกา ตามแบบของพุทธศาสนา ซึ่งจะเป็นที่ประชุมสงฆ์ทำสังฆกรรมต่อหน้าพระประธาน, ส่วนมากเรียกว่า สิม"
โบฮาน,น.,โบราณ
ใบ,น.,ส่วนของพฤกษ์ที่ทำหน้าที่ปรุงอาหาร เพื่อไปหล่อเลี้ยงลำต้นลักษณะแบนสำหรับรับแสงแดดเป็นส่วนที่ติดกับสิ่งหรือปลายกิ่งของต้นไม้ทั่วไป
ใบ้ ๑,น.,"คนที่พูดไม่เป็นสำเนียงภาษา, ส่วนมากเรียก กืก = คนใบ้"
ใบ้ ๒,ก.,บอกโดยใช้มือ หรืออาการส่วยศีรษะ เป็นสื่อความหมายแทนคำพูด = บอกใบ้
ใบไถ,น.,ด้านหน้าของหัวหมูสำหรับไถนา
ใบมน,น.,ชื่อผักชนิดหนึ่ง = สะระแหน่
ใบระกา,น.,ไม้ หรือวัสดุอื่นเป็นส่วนประกอบกับช่อฟ้าและหางหงส์ติดที่จั่วหลังคาพระอุโบสถ
ใบรับรอง,น.,เอกสารที่แสดงข้อเท็จจริงไว้เป็นหลักฐานยืนยัน
ใบสุทธิ ๑,น.,หนังสือแสดงเป็นหลักฐานของพระภิกษุที่ ได้บวชมาโดยถูกต้อง
ใบสุทธิ ๒,น.,หนังสือแสดงหลักฐานของนักเรียนแจ้งผลการสอบซึ่งโรงเรียนเป็นผู้ออกให้
ใบเสร็จ,น.,"ใบสำคัญรับเงินที่ผู้รับได้ออกให้ไว้เป็นหลักฐานการชำระหนี้, ค่าสิ่งของ เป็นต้น"
ใบเหยียบย่ำ,น.,เอกสารสิทธิ์อย่างหนึ่งที่เจ้าพนักงานที่ดิน ออกให้แก่ผู้จับจองที่ดินเพื่อทำประโยชน์
ไบ้,ก.,"คัดออก, เลือกออก, เช่น ไบ้ก้างออก = คัดเอาก้างออก"
