มอน ๑,น.,ต้นหม่อน ใบหม่อน
มอน ๒,น.,เครื่องสำหรับอัดดินปืนในลำกล้องให้แน่น = หมอน
ม้อนเต้อ,น.,ตัวไหมที่ไม่สมบูรณ์ มีสีเหลือง
ม่อนล่อน,ว.,ลักษณะใบหน้าที่เกลี้ยงเกลาสวยงาม เรียกว่าหน้าเกลี้ยง ป่อนล่อน
มอบ ๑,ก.,"เวนให้, สละให้, ยกให้"
มอบ ๒,ก.,ทำให้เรียบ เช่น มอบตากล้า หรือ มอบข้าที่ออกรวงจนสุกแล้ว เพื่อไม่ให้ล้มระเกะระกะ เรียก มอบเข้า
มอบ ๓,ก.,ทำให้ด้วยการหุ้มหรือขลิบตามริม เช่น มอบปากกระบุง
มอบฉันทะ,ก.,ยินยอมให้ทำแทนโดยมีหลักฐาน
มอบหมาย,ก.,"สั่งเสีย, กะให้, กำหนดให้"
มอม ๑,น.,"สิงห์ดำ หรือกาฬสิงห์, สัตว์ในเทพนิยาย ตัวเป็นม้ามีเขาเดียว, รอยสักรูปสัตว์ชนิดนี้ที่ผิวหนัง"
มอม ๒,ก.,ทำให้เปรอะเปื้อนเพื่อให้แปลก เช่น เอาดินหม้อ มอมหน้าไก่
มอม ๓,ว.,"เปื้อนเปรอะ, สกปรก"
มอม ๔,อุ.,คำอุทานปลอบเด็กเมื่อเสียขวัญ
มอมแมม,ว.,"เปื้อนเปรอะ, สกปรก"
มอย,ก.,"มอง ๆ , ด้อม ๆ มอง ๆ"
ม่อย,ก.,"แอบฉวยเอาไป, แอบหนีไปเงียบ ๆ , ฉวยโอกาส"
ม้อย,ว.,"อาการเหนื่อยอ่อน, หมดกำลัง, อาการค่อย ๆ งีบหลับทีละน้อย"
มะ ๑,น.,"เป็นคำนำหน้าผลไม้หรือต้นไม้บางอย่างกร่อนมาจากคำหมากโบราณ แปลว่า ลูกไม้, ผลไม้ เช่น มะขาม, มะนาว, มะม่วง, มะเขือ (ผู้ไทยและพวน)"
มะ ๒,น.,คนขี่ท้ายช้างต่อคู่กับหมอขี่คอ
มะเคาะมะแคะ,ว.,"ไม่จริง, ไม่เต็มที่"
มะงอมะง้อง,ว.,คด ๆ งอ ๆ ใช้สำหรับของเล็ก
มะงอมะแง้ง,ว.,คด ๆ งอ ๆ ใช้สำหรับของเล็ก
มะโง้งมะเง้ก,ว.,คด ๆ งอ ๆ ใช้สำหรับของเล็ก
มะโงมะโง้ง,ว.,คด ๆ งอ ๆ ใช้สำหรับของเล็ก
มะนึงทึงทืด,ว.,"ติดกันเป็นพืด, ยุ่งระโยงระยาง"
มะนึงพึงพืด,ว.,"ติดกันเป็นพืด, ยุ่งระโยงระยาง"
มะไม,น.,เส้นไหมต่างสีที่ปั่นฟั่นให้เป็นเส้นเดียว แล้วจึงทอเป็นผ้า
มะยุ้มมะย้วย,ว.,มูมมามไม่เรียบร้อย
มะลองจ็องจอย,ว.,"ขี้ริ้ว, เศร้าหมอง, ไม่ภาคภูมิ"
มะลองตองตอย,ว.,"ขี้ริ้ว, เศร้าหมอง, ไม่ภาคภูมิ"
มะลององ้อง,ว.,คด ๆ งอ ๆ ใช้สำหรับของเล็ก
มะล้อนต้อนแต้น,ว.,อาการแกว่งของวัตถุที่แขวนไว้หลาย ๆ อัน ใช้สำหรับขนาดเล็ก ขนาดใหญ่ มะโล้นโต้นเต้น
มะละชำชอย,ว.,"นอกรีดนอกรอย ทำตามใจชอบ, ตามอำเภอใจ"
มะลังจังเจียว,ว.,เกี่ยวพันกันจนยุ่งเหยิง
มะลามจามจ่า,ว.,"ไม่เป็นระเบียบ, สับสนปนเป, ผิด ๆ ถูก ๆ"
มะลำชำแชะ,ว.,"นอกรีดนอกรอย ทำตามใจชอบ, ตามอำเภอใจ"
มะลำมะลอย,ว.,"นอกรีดนอกรอย ทำตามใจชอบ, ตามอำเภอใจ"
มะลึ้งทึ้งทั้ง,ว.,"ขัดข้อง, ติดขัด, พัวพัน"
มะลึงพึงพืด,ว.,"ติดกันเป็นพืด, ยุ่งระโยงระยาง"
มะลุยซุยฮึม,ว.,สกปรกมอมแมม
มะโลโงโง้ง,ว.,คด ๆ งอ ๆ ใช้สำหรับของเล็ก
มะหวาด,น.,ชื่อต้นไม้ชนิดหนึ่งเป็นเถายืนต้นต้นและกิ่งก้านสาขา เต็มไปด้วยหนามแหลมคม ใบเล็ก คล้ายใบมะเกลือ ดอกสีเหลืองออกเป็นช่อเล็ก ยาวราว ๑๕ - ๒๕ ซม. เม็ดกลมเปลือกแข็งสีเทาเจอเขียว
มะฮาม,น.,"อาราม, ที่สวนบริเวณวัด"
มะฮาม,น.,อาราม
มัก,ก.,"ชอบ, พอใจ, รักใคร่ระหว่างหนุ่มสาว"
มักกั๊ก,ว.,"ต่ำ, เตี้ย, ล่ำสัน = มักขั้ก"
มักกั๊ก,ว.,ลักษณะอ้วนเตี้ยม่อต้อขนาดเล็ก
มักขะ,น.,ความลบหลู่คุณท่าน (ป.)
มักขิกา,น.,แมลงวัน (ป.)
มักขิกาชาติ,น.,แมลงวัน (ป.)
มักใคร่,ก.,"นึกชอบ, นึกอยาก"
มักง่าย,ก.,"มีนิสัยชอบเอาแต่ความสะดวกเข้าว่า, สะเพร่า, ไม่รอบคอบ"
มักโฎ,น.,ลิง (ป.)
มักฏะ,น.,ลิง (ป.)
มักว่า,สัน.,คือว่า
มักใหญ่,ก.,"ใฝ่สูง, อยากเป็นใหญ่เป็นโต"
มัคคะ,น.,ทาง (ป.)
มัคคุเทศก์,น.,"ผู้นำทาง, ผู้ชี้ทาง, ผู้นำเที่ยว (ป.)"
มัคนายก,*น.,"ผู้นำทาง คือ ผู้จัดการทางกุศล, หัวหน้าอุบาสกอุบาสิกาประจำวัด"
มัคสิระ,น.,"ดาวฤกษ์ดวงที่ ๕, เดือนที่ ๑ แห่งจันทรคติ, เดือนอ้าย ตกราวเดือน ธันวาคม (ป.)"
มัฆวา,น.,"พระอินทร์ (ป., ส.)"
มัฆวาน,น.,"พระอินทร์ (ป., ส.)"
มัง,ก.,"กิริยาที่ไก่กรีดปีกป้อ, ใจจดใจจ่อ, แข็งขันกระฉับกระเฉง"
มั่ง ๑,น.,ละมั่งตัวเมีย
มั่ง ๒,ก.,"มี, มีมาก"
มังกร,น.,สัตว์ในนิยายจีนรูปร่างคล้ายงู แต่มีตีนและเขา
มังกร,น.,ชื่อดาวราศีที่ ๑๐ ใน ๑๒ ราศี
มังกุ,ว.,"เก้อ, กระดาก (ป.)"
มังคละ,น.,"มงคล (ป., ส.)"
มังมอ,ว.,"กุลีกุจอ, ขมีขมันทำเป็นเจ้ากี้เจ้าการ"
มังมอ,ก.,"ขันแข็ง, ขมีขมัน, ใจจดใจจ่อ"
มั่งมี,ว.,มีมาก
มังสะวิรัติ,น.,การงดเว้นกินเนื้อสัตว์ เรียกอาหารที่ไม่มีเนื้อสัตว์ว่าอาหารมังสวิรัติ (ป.)
มังสัง,น.,เนื้อของคนและสัตว์ (ป.)
มังสา,น.,เนื้อของคนและสัตว์ (ป.)
มัจจะ,น.,ผู้ที่ต้องตาย ได้แก่ คนและสัตว์
มัจจุ,น.,"ความตาย (ป., ส.)"
มัจจุราช,น.,เจ้าแห่งความตาย คือ พญายม (ป.)
มัจฉริยะ,น.,ความตระหนี่
มัจฉะ,น.,"ปลา (ป., ส.)"
มัจฉา,น.,"ปลา (ป., ส.)"
มัจฉาชาติ,น.,พวกปลา
มัชชะ,น.,"น้ำเมา, ขอเมา (ป.)"
มัชฌิมประเทศ,น.,"ประเทศอินเดีย, ชมพูทวีป"
มัชฌิมภูมิ,น.,"ภูมิหรือชั้นของคนชั้นกลาง, ในคณะสงฆ์ หมายถึง ภิกษุที่มีพรรษาตั้งแต่ ๕ ถึง ๙, ภิกษุจัดเป็น ๓ ชั้น ชั้นต้น คือ นวกภูมิ (ชั้นใหม่) มีพรรษาต่ำกว่า ๕, ชั้นกลาง คือ มัชฌิมภูมิ, และชั้นสูง คือ เถรภูมิ (ชั้นพระเถระ) มีพรรษาตั้งแต่ ๑๐ ขึ้นไป (ป.)"
มัชฌิมยาม,น.,"ยามท่ามกลาง, ในบาลีแบ่งกลางคืนเป็น ๓ ยาม ยามหนึ่งเป็น ๔ ชั่วโมง เรียกว่า ปฐมยาม มัชฌิมยาม ปัจฉิมยาม (ป.)"
มัชฌิมวัย,น.,วัยกลางคน
มัชฌิมะ,ว.,ปานกลาง (ป.) ส่วนมากว่า มัชฌิมา
มัชฌิมา,ว.,ปานกลาง
มัชฌิมาปฏิปทา,น.,ทางสายกลาง (ป.)
มัชวิรัติ,น.,การงดเว้นของมึนเมา
มัญจกา,น.,"เตียง, ที่นอน"
มัญจา,น.,"เตียง, ที่นอน"
มัณฑนา,น.,"เครื่องประดับ, การแต่ง (ป., ส.)"
มัณฑุกา,น.,"กบ (ป., ส.)"
มัด ๑,น.,ลักษณะนามเรียกของบางอย่างที่ผูกรัดเข้าด้วยกัน เช่น กล้า ๒ มัด
มัด ๒,ก.,"ผูกรัดเข้าด้วยกัน, ผูกรัดให้แน่น"
มัดจำ,น.,เงินที่มอบไว้แก่คู่สัญญา โดยตกลงว่าถ้าตนไม่ทำตามสัญญาให้ริบเงินนั้นเสีย เรียกว่า เงินวางประจำ
มัตตัญญู,น.,ผู้รู้ประมาณ คือ พอเหมาะพอดี (ป.)
มัตสยา,น.,"ปลา (ส., ป.)"
มัธยม,ว.,"กลาง, ปานกลาง (ส.)"
มัธยมศึกษา,น.,การศึกษาระหว่างประถทศึกษากับอุดมศึกษา
มัธยัสถ์,ก.,ใช้จ่ายอย่างประหยัด (ส.)
มั่น,ก.,"เสก, บริกรรมคาถา"
มั้น,ก.,สำรวมจิตร่ายเวทมนต์คาถาเสกน้ำหรือน้ำมันเพื่อให้ขลัง
มัน ๑,น.,"ชื่อเรียกไม้เถาหรือต้นไม้หลายสกุลที่หัวใช้เป็นอาหาร เช่น มันแกว, มันกะทาด, มันเทศ, มันต้น, มันเทียน, มันนุก, มันน้ำ, มันเสา, มันฮึบ"
มัน ๒,น.,"ส่วนที่อยู่ภายในร่างกายคนหรือสัตว์ มีลักษณะนุ่ม, หยุ่นมีน้ำมันอยู่ในตัว เช่น มันหมู, มันไก่"
มัน ๓,ส.,"สรรพนามบุรุษที่ ๓ เป็นคำที่ผู้ใหญ่เรียกผู้น้อยกับเด็ก เป็นต้น ตามสถานะที่ควร, ใช้เรียกผู้อื่นอย่างไม่ยกย่อง และใช้เรียกสัตว์ หรือสิ่งอื่นทั่ว ๆ ไป ตามที่ควร"
มันขาช้าง,น.,มันชนิดหนึ่ง เรียกมันเสา
มันสมอง,น.,ส่วนที่อยู่ภายในกระโหลกศีรษะ มีลักษณะนุ่ม ๆ หยุ่น ๆ เป็นลูกคลื่น เป็นที่รวมประสาทให้เกิดความรู้สึก
มันออง,น.,มันสมอง
มับ ๑,ก.,ตาย
มับ ๒,ว.,อาการคว้าเอาโดยฉับไวไม่รีรอ เช่น จับมับ
มับ ๒,ว.,"เต็มที่ เช่น เต็มมับ, พอดี เช่น อิ่มมับ, เข้ากันได้สนิท เช่น จำมับ"
มับ ๆ,ว.,อาการปวดแต่น้อย ถ้าปวดมากว่า มุบ ๆ
มับ ๆ,ว.,อาการเคลื่อนไหวของปาก เป็นต้น เป็นจังหวะต่อเนื่องกันโดยเร็ว
มับมั้ง,ก.,ตาย
มับมับแมบแมบ,ว.,"มุบมิบ, งุบงิบ, ทำลับ ๆ ล่อ ๆ, วับแวม"
มับม้าย,ว.,อาการเห็นลาง ๆ ไม่ชัดเจน
มับแมบ,ว.,ลับ ๆ ล่อ ๆ รวดเร็วมาก
มับแมบ,ว.,"มุบมิบ, งุบงิบ, ทำลับ ๆ ล่อ ๆ, วับแวม"
มับไม,น.,เส้นไหมต่างสีที่ปั่นฟั่นให้เป็นเส้นเดียว แล้วจึงทอเป็นผ้า
มับหมา,สำ.,ตาย
มัย ๑,น.,"ม้า, ลา"
มัย ๒,ว.,"สำเร็จด้วย, แล้วด้วย, ประกอบด้วย (ใช้ประกอบท้ายสมาส เช่น กุศลมัย = แล้วด้วยกุศล, ตฤนมัย = ประกอบดวยหญ้า, มโนมัย = สำเร็จด้วยใจ) (ป., ส.)"
มัลลิกา,น.,"ดอกมะลิ (ป., ส.)"
มัว ๑,ก.,"เพลิน, หมกหมุ่น, มัวเมา เช่น มัวแต่เหล้น = เล่นจนเพลิน, ส่วนมากว่า เมา"
มั้ว ๑,ก.,"สร่าง, รู้สึกตัว เช่น ""ทุกข์บ่มั้วนำใช้ ชาติเลิง"" (ปัสเสนทิ์)"
มัว ๒,ว.,"ไม่แจ่ม, ไม่กระจ่าง, ไม่ผ่องใส, พะวงในกิริยานั้น"
มั้ว ๒,ว.,"มืด, มัว"
มัวเมา,ก.,หลงระเริง
มัวหมอง,ว.,"มีมลทิล, ไม่บริสุทธิ์"
มา ๑,ก.,"เคลื่อนออกจากที่, ตรงข้ามกันไป"
ม้า ๑,น.,สัตว์เลี้ยงลูกด้วยนม เป็นสัตว์กีบเดียว รูปร่างสูงใหญ่ ขายาวหางเป็นภู่ มีแผงคอยาว ใช้เป็นพาหนะขับขี่และเทียมรถ
มา ๒,ว.,ใช้ประกอบคำกริยา หมายถึงอาการที่ต่อเนื่องเรื่องมาถึงปัจจุบัน หรือสู่จุดหมาย
ม้า ๒,น.,ปูน้ำเค็มกระดองสาก ตัวผู้สีออกน้ำเงิน ตัวเมียสีออกน้ำตาล
มาก,ว.,หลาย ตรงข้ามกับ น้อย
มากว่า,สัน.,คือว่า
มากหลาย,ว.,"มากมาย, ล้นหลาม"
มาคสิระ,น.,"ดาวฤกษ์ดวงที่ ๕, เดือนที่ ๑ แห่งจันทรคติ, เดือนอ้าย ตกราวเดือน ธันวาคม (ป.)"
มาฆ-,น.,"เดือนที่ ๓ แห่งจันทรคติคกราวเดือนกุมภาพันธ์ (ป., ส.)"
มาฆบูชา,น.,"การทำบุญพิเศษทางพระพุทธศาสนาในวันเพ็ญเดือน ๓ เพื่อระลึกถึงเหตุการณ์สำคัญซึ่งประกอบด้วยองค์ ๔ ประการ คือ ๑. วันเพ็ญดวงจันทร์ เสวยมาฆฤกษ์ (ดวงจันทร์เดินมาถึงดาวฤกษ์ ชื่อ มฆะ) ๒. พระสงฆ์ ๑,๒๕๐ รูป ประชุมกันดดยมิได้นัดหมาย ๓. พระสงฆ์ที่มาประชุมนั้นล้วนได้รับเอหิภิกขุอุปสัมปทา ๔. ท่านเหล่านั้นเป็นพระอรหันต์ทั้งสิ้น"
มาฆะ,น.,"เดือนที่ ๓ แห่งจันทรคติคกราวเดือนกุมภาพันธ์ (ป., ส.)"
ม้าง,ก.,"ล้าง, ทำลาย, รื้อ, มล้าง"
ม่าง ๑,ว.,"เสียงดังอย่างนั้น เช่น ดังม่าง ๆ ใช้กับขนาดใหญ่, ขนาดเล็กว่า แม่ง ๆ"
ม่าง ๒,ว.,"ตกสี, ซีด"
ม่าง ๓,ว.,"ลักษณะหน้าผู้มีอำนาจ, เบิกบาน, แจ่มใส"
ม้างก้าง,ว.,ลักษณะกลม หรือมนแบนขนาดใหญ่
มางสะ,น.,"เนื้อของคนและสัตว์ (ส., ป.)"
ม้าจ็อก,น.,ม้าแกลบ = ม้ากระจอก
ม้าใช้,น.,"คนขี่ม้าสำหรับใช้, คนเร็วสำหรับส่งข่าวสาร, คนรับใช่ติดต่อ"
มาณพ,น.,"ชายหนุ่ม, ชายรุ่น"
มาณวะ,น.,"ชายหนุ่ม, ชายรุ่น"
มาณวิกา,น.,"หญิงสาว, หญิงรุ่น (ป., ส.)"
มาณะ,น.,"ความตาย, การตาย (ป., ส.)"
มาด,น.,กำมะถัน
มาดา,น.,แม่ (ป.)
มาตงค์,น.,ข้าง (ป.)
ม้าต้น,น.,ม้าพระที่นั่งโดยเฉพาะ
มาตร,น.,"เครื่องวัดต่าง ๆ เช่ วัดขนาด,จำนวน, เวลา และมุม (ส.)"
มาตร,สัน.,"สักว่า, แม้ว่า"
มาตร-,น.,"เครื่องวัดต่าง ๆ เช่ วัดขนาด,จำนวน, เวลา และมุม (ส.)"
มาตรการ,น.,วิธีการตัดสิน
มาตรฐาน,น.,สิ่งที่ถือเอาเป็นหลักสำหรับเทียบกำหนด
มาตรแม้น,สัน.,ถึงแม้น
มาตรว่า,สัน.,"สักว่า, ถึงว่า"
มาตรา,น.,หลักกำหนดการวัดต่าง ๆ
มาตังคะ,น.,ข้าง (ป.)
มาตา,น.,"แม่ (ป., ส.)"
มาติกา,น.,"บาลีที่เป็นแม่บท, แม่บท"
มาตุ,น.,แม่ (ป.)
มาตุคาม,น.,"ผู้หญิง, เพศหญิง (ป.)"
มาตุฆาต,น.,การฆ่าแม่ (ป.)
มาตุจฉา,น.,"ลุง, น้า (ฝ่ายแม่), น้าผู้หญิง (ฟ.)"
มาตุภูมิ,น.,"บ้านเกิด, เมืองเกิด"
ม้าเทศ,น.,ม้าขนาดใหญ่ที่มาจากต่างประเทศ
ม้าน,ก.,"เหี่ยวแห้ง, ครึ่งแห่งครึ่งสด, ด้าน (ใช้แก่ข้าว)"
ม้าน,ก.,"ไม่สดชื่น, เฝือดด้วยความอาย (ใช้แก่หน้า)"
มาน ๑,น.,"โรคที่ทำให้ท้องพองโต มีหลายชนิด เช่น มานน้ำ, มานหิน, มานเลือด"
ม่าน ๑,น.,เครื่องกั้นบังโดยปกติทำด้วยผ้า
มาน ๒,ก.,"ดวงใจ เรียก ดวงมาน (ป., ส.)"
ม่าน ๒,น.,ชนชาติพม่า
มาน ๓,ก.,ตั้งท้องหรือตั้งครรภ์ เช่น แม่มาน หรือ ธัญพืชกำลังจะตกรวง
ม้าน ๆ,ว.,อาการเหลือบมอง ๆ อาการตาเหลือกเต็มที่ ถ้าเหลือกแต่น้อยว่า แม้น ๆ
มานทาง,ก.,ท้องนอกสมรส
มานพ,น.,"คน (ป., ส.)"
มานะ,น.,"ความพยายาม, ความตั้งใจจริง (ป.)"
มานัต,น.,วินัยกรรมที่สงฆ์ทำแก่ภิกษุผู้ต้องอาบัติสังฆาทิเสสเพื่อให้เป็นภิกษุที่นับเข้าในหมู่สงฆ์ได้
มานัส,น.,"ใจ (ป., ส.)"
ม้าน้ำ,น.,ปลาทะเลชนิดเล็ก ตอนหัวคล้ายม้า ตัวยาวหางงอ มีเกล็ดหุ้มตัวเป็นแผ่น
มานิต,ว.,"ผู้ที่คนยอย่องนับถือ (ป., ส.)"
มาบ ๑,น.,ที่ราบกว้างใหญ่ที่มีลำลาบ
มาบ ๒,ว.,มีประกายแสง เลื่อมพราย
มาบ ๆ,ว.,มีประกายแสง เลื่อมพราย
ม้าบักผ่าน,ว.,ลายขาวพาดขวาง
ม่าม,ก.,ป้อนหรือเลี้ยง (ใช้แก่เด็ก)
ม้าม,น.,อวัยวะภายในร่างกายริมกระเพาะอาหารด้านซ้ายมีหน้าที่ทำลายเม็ดโลหิตแดง สร้างเม็ด้ำเหลืองและสร้างภูมิคุ้มกันของร่างกาย
ม่าย,ก.,"กรีดกรายไปมา, ทำอาการเมิน ๆ มอง ๆ (ใช้แก่สัตว์ที่ป้อจะผสมพันธุ์หรือจะต่อสู้กัน) = ม่ายเมียง"
ม้าย,ว.,"คล้ายคลึง, เกือบเหมือน = ละม้าย"
มาย ๑,ก.,"คลี่ออก, ขยายออก, คลาย มลาย"
มาย ๒,ว.,"สมบูรณ์ขึ้น, สบายขึ้น พูดคู่กับคำว่ามุกเป็นมุกมายขึ้น"
