คำ,POS,ความหมาย
ม,ว.,ไม่
มก ๆ,ว.,อาการผงกหัวขึ้นลง เช่น กะปอมสั่นหัวมก ๆ
มกราคม,น.,ชื่อเดือนที่ ๑ ตามสุรยคติ มี ๓๑ วัน
มกุฏ ๑,น.,มงกุฏ
มกุฏ ๒,ว.,"สูงสุด, ยอดเยี่ยม (ป., ส.)"
มคธ,น.,"แคว้นใหญ่ในอินเดียครั้งพุทธกาล ในปัจจุบันเรียกว่า พิหาร (ป., ส.)"
มฆวัน,น.,พระอินทร์ (ส.)
มฆวา,น.,พระอินทร์ (ส.)
มฆวาน,น.,พระอินทร์ (ส.)
ม่ง,ว.,เสียงดังอย่างเสียงฆ้องขนาดกลาง
มง ๆ,ว.,"สว่าง, สุกใส"
ม้ง ๆ,ว.,"สว่าง, สุกใส"
ม้ง ๆ,ว.,"แจ้ง, ลักษณะของแสงไฟสว่างโพลง"
ม้งก้ง,ว.,"ลักษณะสิ่งของที่กลม หรือมนใหญ่ เช่น มึนตาม้งก้ง = เบิกตากว้าง, ถ้าขนาดเล็กว่า ม้องก้อง, ขนาดจิ๋วว่า มิ้งกิ้ง"
มงคล,น.,"เหตุที่นำมาซึ่งความเจิญ, ส่วนมากว่า มุงคุล, เรียกด้ายที่ทำเป็นวงสำหรับสวมศีรษะเพื่อเป็นสิริมงคลว่า ด้ายมงคล"
มณฑป,น.,"เรือนยอดที่มีรูปสี่เหลี่ยม (ป., ส.)"
มณฑล,น.,"บริเวณ, แคว้น, เขตปกครอง (ป., ส.)"
มณฑา,น.,ไม้ต้นชนิดหนึ่ง ใบใหญ่ ดอกสีเหลือกนวลกลิ่นหอม
มณเฑียร,น.,เรือนหลวง = ในเทียร
มณี,น.,"แก้วหินสีแดงในจำพวกนพรัตน์ (ป., ส.)"
มณีกาบ,น.,ม้าในวรรณคดี มีปีกบินได้
มณีรัตน์,น.,"แก้วมณี (ป., ส.)"
มด ๑,น.,แมลงมีหลายชนิด เช่น มดดำ มดแดง มดตะนอย
มด ๒,น.,"หมอเวทมนต์, หมอผี, ถ้าเป็นผู้ชายเรียกว่าพ่อมด, ถ้าเป็นผู้หญิงเรียกว่า แม่มด"
มตกภัต,น.,ข้าวที่ทำบุญอุทิศให้คนตาย (ป.)
มตกา,น.,"คนตายแล้ว, ผู้ตายแล้ว (ป.)"
มตา,ก.,ตายแล้ว (ป.)
มติ,น.,"ความคิด, ความเห็น, ความรู้ (ป., ส.)"
มธุ,น.,"น้ำผึ้ง, น้ำหวาน (ป.)"
มธุรส,น.,"น้ำผึ้ง, ของที่มีรสหวาน (ป., ส.)"
มธู,น.,"น้ำผึ้ง, น้ำหวาน (ป.)"
มธูปายาส,น.,ข้าวปายาสเจือน้ำผึ้ง ใช้เป็นของหวานในงานเทศกาล
มธูรส,น.,"น้ำผึ้ง, ของที่มีรสหวาน (ป., ส.)"
ม้น,ว.,"ยุ่ง, สับสน เช่น ไหมหรือด้ายที่หลุดออกจากกลุ่มที่หาเงื่อนไม่พบ"
มน ๑,ว.,"กลม ๆ , โค้ง ๆ , ไม่เป็นเหลี่ยม, เรียกผ้าเช็ดหน้าว่า ผ้ามน"
มน ๒,ก.,"อยู่กับที่ (ใช้แก่ดาวพนเคราะห์ ซึ่งปรากฎเห็นเป็น ๓ ทาง คือ เสริด ว่าไปข้างหน้า, พัก ว่าถอยหลัง, มน ว่าอยู่กับที่)"
มนต์ ๑,น.,"คำศักดิ์สิทธิ์, คำสำหรับสวดหรือเสกเป่า (ป., ส.)"
มนต์ ๒,ก.,"นิมนต์, เชื้อเชิญ (ใช้สำหรับพระภิกษุสามเณร) (ป.)"
มนตรี ๑,?,ดู มนต์
มนตรี ๒,น.,"ที่ปรึกษา, ผู้แนะนำ, ที่ปรึกษาราชการ, ข้าราชการชั้นผู้ใหญ่ (ป., ส.) ส่วนมากว่า มุนตรี"
มนเทียร,น.,เรือนหลวง
มนสิการ,น.,"การกำหนดไว้ในใจ (ป., ส.)"
มนะ,น.,"ใจ (ป., ส.)"
มนัส,น.,ใจ
มนิมนา,ว.,"เร็วด่วน, ขมีขมัน เช่น ก็มนิมนามาสู่สาลวีน"
มนุมนา,ว.,"เร็วด่วน, ขมีขมัน เช่น ก็มนิมนามาสู่สาลวีน"
มนุษย์,น.,"สัตว์ที่รู้จักใช้เหตุผล สัตว์ที่มีจิตใจสูง, คน (ส.)"
มนุษยชาติ,น.,จำพวกคน (ส.)
มนุษยเทพ,น.,กษัตริย์ (ส.)
มนุษยธรรม,น.,"ธรรมของคน (ส.), ธรรมที่ทำให้เป็นคน"
มนุษยโลก,น.,โลกมนุษย์ (ส.)
มโน,น.,"ใจ (ป., ส.)"
มโนกรรม,น.,"การคิด, ความคิด (ป.)"
มโนคติ,น.,ความคิด (ส.)
มโนธรรม,น.,"ความรู้สึกผิดชอบชั่วดี, ความรู้สึกว่าอะไรควรทำอะไรไม่ควรทำ"
มโนภาพ,น.,ความคิดเห็นเป็นภาพขึ้นใจ
มโนมัย,ว.,"สำเร็จด้วยใจ, ใช้ประกอบกับ ม้า หมายความว่า ม้าที่ขับขี่รวดเร็วได้ดั่งใจ (ป., ส.)"
มโนรถ,น.,"ความหวัง, ความประสงค์, ความใฝ่ฝัน (ป., ส.)"
มโนรม,ว.,"เป็นที่ชอบใจ, เป็นที่รื่นรมย์ใจ (ป., ส.)"
มโนราห์,น.,ชื่อหญิงในวรรณคดีเรื่องท้าวสุทนต์ (ส.)
มโนศิลา,น.,"ศิลาอ่อนที่ย่อยให้ละเอียดประสมเป็นสีทาสิ่งอื่นได้, สารหนูแดง, ปรอทแดง, ศิลาแดง"
ม้ม,ก.,"พ้น, รอดพ้น"
มมังการ,น.,"ความถือว่าเป็นของเรา (ป.), ความถือว่าของเราหรือฝ่ายเราถือหรือดี"
มยุรา,น.,นกยูง (กลอน) (ป.)
มยุรี,น.,นกยูงตัวเมีย (ป.)
มยุเรศ,น.,นกยูง (กลอน) (ป.)
มร,ก.,ตาย (ป.)
มรกต,น.,แก้วหินสีเขียวใบไม้จำพวกนพรัตน์
มรคา,น.,"ทาง, ช่อง, ถนน (ส.)"
มรณ์ ๑,น.,"ความตาย, การตาย (ป., ส.)"
มรณ์ ๒,ก.,"ตาย (ป., ส.)"
มรณกรรม,น.,ความตาย
มรณภัย,น.,ภัยที่เป็นอันตรายถึงตาย (ป.)
มรณภาพ ๑,น.,ความตาย (ใช้แก่พระสงฆ์)
มรณภาพ ๒,ก.,ตาย (ใช้แก่พระสงฆ์)
มรณา,น.,"ความตาย, การตาย (ป., ส.)"
มรดก,น.,ทรัพย์สมบัติของผู้ตาย
มรเมี้ยน,ก.,ตาย
มรรค,น.,"ทาง, เหตุ, ใช้คู่กับผลว่า เป็นมรรคเป็นผล, ในทางพระพุททธศาสนาเป็นชื่อแห่งโลกุตรธรรม คู่กับ ผล มี ๔ ชั้น คือ โสดาปัตติมรรค สกิทาคามิมรรค อนาคามิมรรค อรหัตตมรรค"
มรรคา,น.,"ทาง, เหตุ, ใช้คู่กับผลว่า เป็นมรรคเป็นผล, ในทางพระพุททธศาสนาเป็นชื่อแห่งโลกุตรธรรม คู่กับ ผล มี ๔ ชั้น คือ โสดาปัตติมรรค สกิทาคามิมรรค อนาคามิมรรค อรหัตตมรรค"
มรรยาท (มันยาด),น.,การแสดงออกทางกายและวาจาที่มีความหมายว่า เรียบร้อย (ส.)
มรสุม (มอระ-),น.,"คราวลม, คราวพายุ, ลมฝน"
มฤตยู,น.,"ความตาย, ดาวเคราะห์ดวงที่ ๗ ในระบบสุริยะ = ดาวยูเรนัส (ส.)"
มลทิน,น.,"ความเศร้าหมอง, ความไม่บริสุทธิ์, ส่วนมากว่า มึนทึน"
มลาย,ก.,"ทำลาย, แตก, คลายออก (ดู มาย)"
มลายู,น.,"ชนชาติหนึ่งอยู่ในประเทศมาเลเซีย, ชาวมาเลเซีย"
มวก ๑,น.,แอ่ง = บวก หรือ บ่อ
มวก ๒,น.,น้ำแช่ข้าวเหนียวท่ทิ้วไว้จนเปรี้ยว หรือน้ำที่มีสีขาวมัว
มวก ๓,ว.,"ขุ่น, มัว, เช่น ตาเป็นน้ำมวก"
มวก ๓,ว.,"ยัดเยียด, ออกันอยู่, คลั่ก เช่น อึ่งตามวก"
ม่วง ๑,น.,มะม่วง
ม่วง ๒,ว.,"สีครามปนแดง, เรียกผ้าไหมสำหรับนุ่งที่มีสีอย่างนั้น หรือสีอย่างอื่นว่า ผ้าม่วง"
ม่วน,ว.,"ไพเราะ, เสนาะ, สนุก"
มวน ๑,น.,"ลักษณะนามของบุหรี่, ส่วนมากว่า กอก"
ม้วน ๑,น.,ลักษณะนามของสิ่งของที่ขด หรือพันห่อตัวอยู่
มวน ๒,ก.,"ม้วนเส้นยาสูบด้วยใบตองเป็นต้น ให้เป็นบุหรี่, ส่วนมากว่าพัน"
ม้วน ๒,ก.,หมุนพับเข้าไปให้เป็นวงกลม เช่น ม้วนเชือก
ม้วน ๓,ก.,"รวบรวมเข้าเป็นครั้งสุดท้าย, สรุปเรื่อง, ทำให้จบ เช่น ม้วนชากดก, ม้วนชาติ"
ม้วน ๔,ก.,อมน้ำกลั้วปากแล้วบ้วนทิ้ง = บ้วน
ม้วนปาก,ก.,อาการคลายน้ำลาย น้ำออกจากปาก
ม้วย,ก.,"ตาย, สิ้นสุด, มอดหมด"
มวย ๑,น.,หวดสำหรับนึ่งข้าวขนิดหนึ่ง รูปทรงกระบอก
มวย ๒,น.,"พยากรณ์, ทำนาย, คาดคะเน"
มวย ๒,น.,การชกกันด้วยหมัด
มวย ๓,น.,ผมที่มุ่นขมวดให้เป็นกลุ่มเป็นกระจุก เรียก ผมมวย
มวย ๔,ก.,ม้วนผมขึ้นไปมุ่นขมวดเป็นกลุ่มเป็นกระจุก
มวล,ว.,"ทั้งหมด, ทั้งสิ้น, ทั้งปวง"
มหรสพ,น.,การเล่นรื่นเริงมีดขนละคร หรือสิ่งที่คล้ายคลึงกันโบราณเรียก มโหสพ (ป.)
มหัณณพ,น.,"ทะเลใหญ่, ห้วยน้ำใหญ่ = มหรรณพ (ป., ส.)"
มหัทธนะ,น.,"ผู้มั่งคั่ง, คนมั่งมี (ป., ส.)"
มหันต์,ว.,"ใหญ่, มาก, มหา (ป.)"
มหันตโทษ,ว.,โทษหนัก คู่กับ ลหุโทษ คือ โทษเบา
มหัพภาค,น.,เครื่องหมายวรรคตอนเป็นจุด (.)
มหัศจรรย์,ว.,"แปลกประหลาดมาก, น่าพิศวงม่ก (ส.)"
มหา ๑,น.,สมณศักดิ์ที่ใช้นำหน้าชื่อพระภิกษุที่สอบไล่ได้ตั้งแต่เปรียญธรรม ๓ ประโยคขึ้นไป
มหา ๒,ว.,"ใหญ่, ยิ่งใหญ่, ใช้นำหน้าศัพท์อื่น ๆ (ป., ส.)"
มหากาฬ,น.,ยาไทยชนิดหนึ่ง สำหรับแก้โรคปากเปื่อย คอเปื่อย ลิ้นเปื่อย (ป.)
มหาขันธกะ,น.,คัมภีร์พระวินัยหมวดหนึ่ง (ป.)
มหาจักร,น.,ดาวหมู่หนึ่งในตำราโหราศาสตร์
มหาชน,น.,"ชนหมู่มาก (ป., ส.)"
มหาชาติ,น.,"เรียกเวสสันดรชาดกว่า มหาชาติ, การมีเทศน์เรื่องมหาเวสสันดรชาดก เรียกว่า มีเทศน์มหาชาติ ส่วนมากว่าเรื่องพระเวส (ป.)"
มหาดไทย,น.,กระทรวงที่ทำหน้าที่ฝ่ายปกครอง
มหาดมุนตรี,น.,"ที่ปรึกษาราชการแผ่นดิน, มนตรีผู้ใหญ่, ข้ามหาดมนตรี หรือมหาดม์มุนตรี"
มหาดเล็ก,น.,"ข้าราชการในราชสำนัก มีหน้าที่รับใช้พระเจ้าแผ่นดิน, ผู้ที่รับใช้ประจำเจ้านาย หรือผู้ที่ถวายตัวเป็นผู้รับใช้เจ้านาย"
มหาเทพ,น.,เทวดาผู้ใหญ่ โดยมากใช้เรียกพระอิศวร (ส.)
มหาเทพี,น.,พระอุมา ชายาพระอิศวร
มหาธาตุ,น.,"ทองคำ, เรียกสถูปซึ่งบรรจุพระบรมธาตุ"
มหานิกาย,น.,คณะสงฆ์นิกายหนึ่ง คู่กับ ธรรมยุติกนิกาย
มหานิล,น.,แก้วสีดำมีค่ามาก
มหาบพิตร,น.,เดิมเป็นคำพระสงฆ์ใช้สำหรับแทนพระนามพระเจ้าแผ่นดินหรือพระมเหสี ปัจจุบันใช้บรมบพิตร
มหาบัณฑิต,น.,ผู้ได้รับปริญญาโท
มหาพน,น.,กัณฑ์ที่ ๗ ของมหาชาติ ว่าด้วยเรื่องป่า
มหาพรหม,น.,พรหมชั้นที่ ๓ ในรูปพรหม ๑๖ ชั้น
มหาภารตะ,น.,"บทประพันธ์มหากาพย์เรื่องใหญ่เรื่องหนึ่งของอินเดีย, คู่กับรามเกียรติ์ (ส.)"
มหาภูต,น.,"ธาตุทั้ง ๔ คือ ดิน น้ำ ลม ไฟ (ป., ส.)"
มหายาน,น.,"นิกายในพระพุทธศาสนาฝ่ายเหนือ มีในทิเบต, จีน, ญี่ปุ่น เป็นต้น (ป., ส.)"
มหาราช ๑,น.,คำซึ่งมหาชนถวายเพื่อเฉลิมพระเกียรติพระเจ้าแผ่นดิน
มหาราช ๒,น.,ชื่อกัณฑ์ที่ ๑๐ ของมหาชาติ มักเรียกย่อว่า มราช
มหาฤกษ์,น.,เพลงไทยทำนองหนึ่ง ใช้บรรเลงในเวลาได้ฤกษ์เปิดงานเป็นพิธีใหญ่
มหาละลวย,น.,มนต์สำหรับเป่าให้คนหลงรัก
มหาวงศ์,น.,หนังสือพงศาวดารลังกา คู่กับจุลวงศ์
มหาวรรค,น.,คัมภีร์พระวินัยปิฎกคัมภีร์หนึ่ง
มหาวิทยาลัย,น.,สถานศึกษาชั้นอุดมศึกษาซึ่งมีหลายคณะด้วยกันและมีอำนาจที่ประสาทปริญญาให้แก่ผู้ที่สำเร็จวิชาในคณะนั้น ๆ
มหาศาล ๑,น.,"ผู้มั่งคั่ง, ผู้มีทรัพย์สมบัติมาก (ส.)"
มหาศาล ๒,ว.,มีทรัพย์สมบัติมาก (ส.)
มหาสงกรานต์,น.,นักขัตฤกษ์ขึ้นปีใหม่แบบเก่า เริ่มแต่พระอาทิตย์ย่างเข้าสู่ราศีเมษ คือ วันที่ ๑๓ เมษายน เรียกว่า วันมหาสงกรานต์
มหาสมุทร,น.,ทะเลใหญ่ (ส.)
มหาสาวก,น.,"พระสาวกชั้นผู้ใหญ่ของพระพุทธเจ้า ๘๐ องค์ (ป., ส.)"
มหาหิงค์,น.,ยางไม้ชนิดหนึ่งกลิ่นฉุนเหม็นใช้ทำยา
มหาหิงส์,น.,"ยางไม้ล้มลุกมีกลิ่นฉุนและเหม็น นิยมใช้เป็นยาทาภายนอก เรียก หมากหางหิง ก็มี (ป., ส.)"
มหาเหนียว,น.,ต้นกระเชา
มหาอุด,น.,เครื่องรางของขลัง ที่ช่วยให้ผู้ใช้อยู่ยง คงกระพัน
มหิงส์,น.,ควาย (ป.)
มหิทธิ,ว.,มีฤทธิ์มาก (ป.)
มหินท์,น.,พระอินทร์ (ป.)
มหิมา,ว.,"ใหญ่, โต (ป., ส.)"
มหูฬาร,ว.,"ยิ่งใหญ่, กว้างใหญ่"
มเหศวร,น.,"พระอิศวร, พระเจ้าแผ่นดิน (ส.)"
มเหสักข์ ๑,น.,เทวดาผู้ใหญ่ (ป.)
มเหสักข์ ๒,น.,เจ้าผีซึ่งเป็นเจ้าเมืองในถิ่นนั้น (ส.)
มเหสี,น.,ชายาพระเจ้าแผ่นดิน
มเหาฬาร,ว.,"ยิ่งใหญ่, กว้างใหญ่"
มโหรี,น.,วงเครื่องดีดสีตีเป่าที่มีขับร้องเป็นพวกเดียวกัน
มโหฬาร,ว.,"ยิ่งใหญ่, กว้างใหญ่"
มไหศวรรย์,น.,"อำนาจใหญ่, สมบัติใหญ่, ความเป็นใหญ่ในแผ่นดิน (ป.)"
ม่อ,ว.,"ใกล้, กระชั้นชิด, ริม, จวนเวลา, หมิ่นเหม่ โดยปริยายหมายถึง ตื้น, ง่าย เช่น เว้าม่อ ๆ = พูดตื้น ๆ ง่าย ๆ"
มอ ๑,น.,"หมอดูด้วยการเสี่ยงทาย เช่น หมอดูหักไม้, หมอดูคืบ, เรียกหมอมอ"
มอ ๒,น.,"ที่สูง เนิ่นดินสูง, ส่วนมากใช้แก่ถนนหนทาง เช่น รถขึ้นมอ"
มอ ๓,น.,ลูกวัว เรียกตามเสียงร้องของลูกวัว มักเรียกว่า งัวมอ
มอก ๑,น.,กระพี้
มอก ๒,น.,ต้นไม้ชนิดหนึ่งคล้ายต้นโมก
มอก ๓,ก.,"หมัก, หมักหมม, หมก"
ม็อก ๆ,ว.,อาการผงกหัวขึ้นลง เช่น กะปอมสั่นหัวมก ๆ
มอกก้อก,ว.,หน้าตาชื่นมื่น ผ่องใส
ม็อกก็อก,ว.,หน้าตาชื่นมื่น ผ่องใส
มอกลอก,ว.,"ไม่ผ่องใส, หม่นหมอง = มอซอ"
มอกลอกแมกแลก,ว.,"ไม่ผ่องใส, หม่นหมอง = มอซอ"
มอง ๑,น.,คนหรือสัตว์ที่ไม่ปรากฎว่าเป็นหญิงหรือชาย = กะเทย
ม่อง ๑,น.,ฆ้องขนาดเล็ก เรียก ฆ้องม่อง ใช้ตีนำขบวนเวลาไปเรี่ยไรเงินตามบ้านเพื่อการกุศล เช่น ไปม่องผ้า = น้ำผ้าไตรไปให้คนอนุโมทนา
มอง ๒,น.,"เครื่องจับสัตว์น้ำพวกอวน, ดาง ก็เรียด มี ๓ ชนิด คือ มองซัด ใชเชือกสำหรับน้ำลึก, มองปลิว ใช้ เรือลากสำหรับน้ำตื้น และมองอยังใช้ขึงไว้กับที่"
ม่อง ๒,ว.,เสียงดังอย่างนั้น
มอง ๓,น.,ครกกระเดื่อง
มอง ๔,น.,มุ่งดู
ม้อง ๆ,ว.,"สว่าง, สุกใส"
ม้องก้อง,ว.,"ลักษณะสิ่งของที่กลม หรือมนใหญ่ เช่น มึนตาม้งก้ง = เบิกตากว้าง, ถ้าขนาดเล็กว่า ม้องก้อง, ขนาดจิ๋วว่า มิ้งกิ้ง"
ม้องก้อง,ว.,ลักษณะกลม หรือมนแบนขนาดใหญ่
มอญ,น.,ชนชาติหนึ่งในตระกูลภาษามอญ - เขมร อยู่ตอนใต้ของพม่า
มอญซ่อนผ้า,น.,การเล่นของเด็กอย่างหนึ่ง
มอด ๑,น.,ชื่อเรียกแมลงปีกแข็งขนาดเล็กชนิดหนึ่ง ชอบเจาะกินเข้าไปในวัสดุต่า ๆ ทำให้เกิดเป็นรูพรุนทั่วไป
มอด ๒,ก.,"ดับ เช่น มอดไฟ, ตาย เช่น ม้วยมอด"
มอด ๓,ว.,เรียกหน้าที่เป็นรอย ๆ อย่ามอดเจาะ เช่น หน้าคนที่เป็นผีดาษว่า หน้ามอด
มอดญอด,ว.,เปียกปอน
มอดเมือง,สำ.,พวกหัวขโมย
มอดยอด,ว.,เปียกโชก
มอดฮู้สอดเห็น,ก.,แอบรู้เห็น
ม้อต้อ,ว.,"อ้วนเตี้ย, ส่วนมากว่า อ้อป้อ"
ม่อตื้น,ว.,ง่าย ๆ ไม่ลึกซึ้ง
ม่อน,ว.,"คล่อง, สะดวก, ราบรื่น, อ่อนละมุน เช่น กินข้าวม่อนคอ"
ม้อน,น.,ตัวไหม
