คำ,POS,ความหมาย
ฮก,ว.,"รก, รุงรัง, ไม่เตียน"
ฮ้ง,ก.,อาการช้ำของหัวแม่มือ
ฮ้ง,ก.,อาการที่น้ำไหลลอดคันนาหรือทำนบ
ฮง ๑,ก.,"พุง, ทะลาย ใช้แก่เขื่อนหรือดินที่ถูกน้ำเซาะ"
ฮง ๒,ว.,"ร้อนเต็มที่, ระอุ เช่น เตากำลังฮง"
ฮง ๆ,ว.,"สุกใส, แวววาวเป็นประกาย ใช้สำหรับขนาดใหญ่, ถ้าขนาดเล็กว่า ฮอง ๆ"
ฮด,ก.,"รดน้ำ, ราดน้ำ"
ฮดฮ่วง,ว.,หอมตลบอบอวล
ฮดฮ่วงเฮ้า,ว.,หอมตลบอบอวล
ฮน,ก.,"ดิ้นรน, เร่าร้อน, รน"
ฮนฮวาย,ก.,"ทุรนทุราย, กระสับกระส่าย"
ฮนฮ้อน,*ก.,"ร้อนรน, กระวนกระวาย"
ฮบ,ก.,"รบ, ต่อสู้กัน, ชน (ใช้แก่ไก่และสัตว์ปีกอื่น ๆ )"
ฮบงัน,ก.,"ฉลอง, สมโภช"
ฮ่ม ๑,น.,ร่มเงา
ฮ่ม ๒,น.,ร่มกันแดดกันฝน ส่วนมากเรียก คันฮ่ม (เป็นคำรวมทั้งร่มที่ทำด้วยผ้าและทำด้วยกระดาษ)
ฮ่มเพิง,ก.,"รำพึง, รำพัน"
ฮมมนา,ก.,"ปั่นป่วนใจ, ปวดร้าวใจ, เร่าร้อนใจ"
ฮมมเนส,ก.,"ปั่นป่วนใจ, ปวดร้าวใจ, เร่าร้อนใจ"
ฮมมฺนัง,ก.,"ปั่นป่วนใจ, ปวดร้าวใจ, เร่าร้อนใจ"
ฮมย์,ว.,"ยินดี, พอใจ = อภิรมย์"
ฮวก ๑,*น.,ลูกกบลูกเขียดเมื่อยังเล็ก ๆ = ลูกอ๊อด
ฮวก ๒,ก.,ไม้รวก
ฮวง,น.,ส่วนที่ยื่นโค้งเป็นวงสำหรับหิ้ว หรือถือสิ่งของอย่างตะกร้า เป็นต้น เช่น งวงคุ
ฮ่วง,?,ดู ห่วง ๒
ฮ่วง,ก.,ร่วงโรย
ฮวง ๑,น.,"พวง เช่น ฮวงดอกไม้, ร่วง เช่น ฮวงข้าว, รัง เช่น ฮวงเผิ้ง, ช่อ เช่น ฮวงหมากเดือย"
ฮวง ๒,น.,หูหิ้ว เช่น ฮวงกะต่า = หูตะกร้า
ฮวงช้าง,น.,พืชล้มลุกชนิดหนึ่ง มีดอกสีขาว ช่อของดอกมีสัณฐานคล้ายงวงช้าง
ฮ่วงโฮย,ก.,ร่วงโรย
ฮวด ๑,น.,พวงดอกไม้หรือพวงปลาที่ถูกร้อยรวมกัน
ฮวด ๒,*ก.,"ราดน้ำ, ราดน้ำแกง"
ฮ่วน ๑,ก.,"ครวญ, คำราม (ใช้แก่ฟ้า เช่น ฟ้าฮ่วน หรือฟ้าฮ้องฮ่วน)"
ฮ่วน ๒,ว.,"เสีย, เน่าใน เช่น ไข่ฮวน, กลัดหนอง เช่น ฝีฮ่วน, รวน เช่น ความที่ถูกล่ามไว้ มีอาการกระวนกระวาย เรียก ความฮ่วน"
ฮวน ๆ,ว.,ลักษณะของสีแดงเรื่อเด่นชัด เช่น ตาเวนแดงฮวน ๆ
ฮ่วน ๆ,ว.,"ลักษณะกลุ่มควันจำนวนมากลอยพุ่งขึ้นไปในอากาศ, ถ้าจำนวนน้อยว่า ฮิ่น ๆ"
ฮ้วนหมูู,น.,ไม้เถาชนิดหนึ่ง มียางขาวเป็นพิษ ใบมนหรือรูปไข่ปลายแหลม ฐานใบเว้าหรือป้านออกเป็นคู่ตรงข้ามกันตามลำต้นดอกสีเขียวอ่อนเป็นพวงกลม ใช้ทำยา
ฮ่วนฮน,ว.,"เสีย, เน่าใน เช่น ไข่ฮวน, กลัดหนอง เช่น ฝีฮ่วน, รวน เช่น ความที่ถูกล่ามไว้ มีอาการกระวนกระวาย เรียก ความฮ่วน"
ฮวบ,ก.,"รวบหรือกวาดเข้าหากัน, ส่วนมากว่าโฮบ"
ฮ่วม,ก.,"ร่วมกัน, บรรจบกัน, เข้าด้วยกัน"
ฮ้วม,ก.,เอาเนื้อหรือปลาสดต้มหรือคั่วพอให้สุกเพื่อเก็บไว้ปรุงอาหารภายหลัง = รวน
ฮ่วย,ว.,"อาการที่มีกลิ่นหอมมากระทบจมูก,หอมโชย, หอมระรื่น"
ฮ้วย,อุ.,"เสียงแสดงความฉงนหรือตกใจ, เอ๊ะ, อุวะ"
ฮวย ๑,ก.,"อ่าน, ร่าย, เสกคาถา เช่น ฮวยมนต์, ฮวายมนต์"
ฮวย ๒,น.,"โรย, พรำ ใช้แก่ฝน เช่น ฝนตกฮวย"
ฮ้วย ๆ,ว.,"อาการเดินลอยชาย, ลักษณะการลากของสิ่งที่เป็นเส้นยาวไป เช่น แก้เชือกฮ้วย ๆ"
ฮวยไข่,น.,รังไข่ของสัตว์ที่ตกลูกเป็นฟอง
ฮวยลูก,น.,รังไข่คนหรือสัตว์ที่ออกลูกเป็นตัว
ฮวาด,*ก.,"ราดน้ำ, ราดน้ำแกง"
ฮวาน,ว.,ลักษณะของสีแดงเรื่อเด่นชัด เช่น ตาเวนแดงฮวน ๆ
ฮวาย,ก.,"อ่าน, ร่าย, เสกคาถา เช่น ฮวยมนต์, ฮวายมนต์"
ฮว้าย,อุ.,"เสียงแสดงความฉงนหรือตกใจ, เอ๊ะ, อุวะ"
ฮว้าย ๆ,ว.,"อาการเดินลอยชาย, ลักษณะการลากของสิ่งที่เป็นเส้นยาวไป เช่น แก้เชือกฮ้วย ๆ"
ฮวายไข่,น.,รังไข่ของสัตว์ที่ตกลูกเป็นฟอง
ฮวายลูก,น.,รังไข่คนหรือสัตว์ที่ออกลูกเป็นตัว
ฮส,น.,รส
ฮส,น.,สิ่งที่รู้ได้ด้วยลิ้น = รส
ฮอ,น.,เครื่องสำหรับฝนยาสมุนไพรหรือสิ่งอื่น เพื่อให้เป็นผงละเอียด
ฮอขี้หมิ้น,น.,เครื่องสำหรับฝนขมิ้น
ฮอเข้าหมิ้น,น.,เครื่องสำหรับฝนขมิ้น
ฮอง,ก.,"รอง, รองรับ, ถัดกันลงไป"
ฮ่อง,น.,"ร่อง, ช่อง, เหมือง"
ฮ้อง,ก.,ส่งเสียงร้องดัง ๆ
ฮอง ๆ,ว.,"สุกใส, แวววาวเป็นประกาย ใช้สำหรับขนาดใหญ่, ถ้าขนาดเล็กว่า ฮอง ๆ"
ฮ่องขี้ไถ,น.,รอยไถ
ฮองคอ,น.,"รองประธาน, รองเจ้าอาวาส, คอสอง"
ฮองหัวโป่,น.,รองหัวหน้า
ฮ้องไห้,ก.,ร้องไห้
ฮ่องฮอย,น.,"เค้า, เงื่อน, ทาง = ร่องรอย"
ฮ้องเฮียก,ก.,ร้องเรียก
ฮ้องโฮโพสังกา,สำ.,ร้อง แรกแหกกะเฌอ
ฮอด,ก.,"ลุ, ถึง"
ฮอด ๑,น.,วิธีจับปลาแบบหนึ่ง ใช้เผือกกั้นทางน้ำไหลตื้นๆ ตอนล่างไว้จนริมฝั่งทั้งสองข้าง โดยเอาดินหรือทรายกั้นทำนบทางน้ำไหลตอนบนไว้ชั่วคราว ทำให้บริเวณพื้นที่ตอนกลางที่กั้นไว้แห้งโดยเร็วเพราะน้ำไหลผ่านไปหมด เหลือแต่ปลากองอยู่ให้จับเอาโดยเร็วก่อนที่น้ำจะไหลล้นทำนบมาจากตอนบน การจับปลาวิธีนี้เรียกว่า ลงฮอด
ฮอด ๒,ก.,"ถึง เช่น ไปฮอด = ไปถึง, คิดฮอด = คิดถึง"
ฮอน,ก.,"ตัด, ทอน รอน"
ฮ่อน,ก.,"ร่อน, เขย่า"
ฮ้อน,ว.,ร้อน
ฮ้อนฮน,*ก.,"ร้อนรน, กระวนกระวาย"
ฮอบ,ว.,รอบ
ฮอม,ว.,เป็นวงโค้งเข้าหากันใช้สำหรับเขาสัตว์
ฮอม,ก.,"จวน, เกือบ, ใกล้, เช่น ฮอมชิแจ้ง, แคบ เช่น หน้าผากฮอม"
ฮ่อม,น.,"ช่องทาง, ทาง ร่องน้ำ"
ฮ่อมความคิด,น.,แนวทางแห่งความคิด
ฮ่อมน้ำ,น.,ร่องน้ำหรือทางน้ำ
ฮ่อมผา,น.,ทางแคบระหว่างหน้าผา ๒ ด้าน
ฮอย,น.,สิ่งที่ปรากฏดตราติดอยู่ = รอย
ฮ่อย ๑,น.,ชื่อนกชนิดหนึ่ง เรียก นกกดฮ่อย
ฮ้อย ๑,น.,มาตราชั่งแบบโบราณ เท่ากับน้ำหนักสิบบาทเป็นหนึ่งฮ้อย แปดฮ้อยเป็นหนึ่งชั่ง สิบชั่งเป็นหนึ่งหมื่น สิบหมื่นเป็นหนึ่งแสน
ฮ่อย ๒,ว.,ไม่คม = ร่อย
ฮ้อย ๒,ว.,จำนวนนับ ๑๐ สิบหน เป็นหนึ่งฮ้อย.
ฮ้อย ๓,ก.,"สอด, สอดด้วยด้ายหรือสิ่งอื่น = ร้อย"
ฮ่อย ๆ,ว.,อาการที่เอามือลูบไปมาเมื่อรู้สึกเจ็บแสบ
ฮ้อยปลา,น.,ชื่อเถาวัลย์ชนิดหนึ่ง เรียก เครือฮ้อยปลา
ฮะ,ก.,"ถู, สี, ระ"
ฮัก ๑,น.,พรรณไม้ดอกชนิดหนึ่ง = ต้นดอกรัก
ฮัก ๒,ก.,"รัก, มีเมตตาต่อ"
ฮักพิ่ง,ก.,รักอย่างลำเอียง
ฮักแพง,ก.,รักใคร่และทะนุถนอม
ฮักษา,ก.,รักษา
ฮัง ๑,น.,ไม้ต้นเนื้อแข็งชนิดหนึ่ง = ไม้รัง
ฮัง ๒,น.,ที่อยู่อาศัยของนกและแมลง = รัง
ฮั่งมี,ว.,มีมาก
ฮั่งมี,ว.,"มีมาก, มีทรัพย์มา"
ฮังมีด,น.,ชื่อพรรณไม้ชนิดหนึ่ง
ฮั่งแฮ้ง,น.,ชื่อพรรณไม้ชนิดหนึ่ง = ทองระอา
ฮังโฮม,ก.,"ชุมนุม, รวมกัน เช่น กฐินฮังโฮม = กฐินสามัคคี"
ฮัด,ก.,"รัด, มัดให้แน่น"
ฮัดฮิง,ก.,ผูกเป็นรูปตาข่ายให้แน่น
ฮัน,ก.,ตี
ฮัน,ก.,เร่งให้เร็ว เช่น ฮันลวา = เร่งม้าหรือลาให้เร็วขึ้น
ฮับ,ก.,"รับ, ยื่นมือออกมารองรับสิ่งของที่ผู้อื่นส่งให้หรือโยนให้"
ฮั่ว,ก.,มีรอยแตกหรือมีรูที่อากาศหรือของเหลวเข้าออกได้
ฮั้ว,น.,"รั้ว, เครื่องล้อมหรือกั้นเขตของบ้าน เป็นต้น"
ฮั่วแคร่,น.,แผงขัดแตะสำหรับล้อมสวนครัว หรือใช้เป็นรั้วล้อมสถานที่ประกอบพิธี เป็นต้น
ฮัวะ,ก.,ส่งเสียงดังให้ตกใจ
ฮา,น.,เครื่องมือป้องกันอาวุธชนิดหนึ่ง ใช้สอดเข้ากับท่อนแขนเวลาประจัญบานกับคู่ต่อสู้
ฮา,น.,เครื่องป้องกันอาวุธรูปสี่เหลี่ยมผืนผ้า
ฮ่า,ก.,อ้าปากพ่นลม
ฮ้า,ว.,"ใหญ่มาก, เช่นไฟกองฮา = ไฟกองใหญ่"
ฮ้า,ว.,"เปลี่ยว, เปรียว, ดู เรียก ควายที่ปล่อยดไปนาน ๆ เกือบจะเป็นควายป่า ว่าควายฮ้า"
ฮา ๑,น.,เครื่องป้องกันอาวุธรูปสี่เหลี่ยมผืนผ้า
ฮา ๒,ส.,"เราทั้งสอง, เราทั้งหลาย"
ฮาก ๑,น.,ส่วนของต้นไม้ที่อยู่ในดิน = ราก
ฮาก ๒,ก.,อาเจียน
ฮากกล้วย,น.,ชื่อปลาชนิดหนึ่ง = ปลาช่อนทราย
ฮากเหง้า,น.,ต้นตอของพืช
ฮ่าง,น.,"ร่าง, รูปร่าง, ตัว, โครง"
ฮ้าง,ก.,"ทอดทิ้งไว้, ว่างเปล่า, ร้าง, เรียกคู่สมาสที่หย่าร้างกันว่า พ่อฮ้าง, แม่ฮ้าง"
ฮาง ๑,น.,"ราง, ไม้หรือวัตถุอื่นทำเป็นร่องสำหรับใส่อาหารเลี้ยงสัตว์ เช่น ฮางหมู"
ฮาง ๒,น.,ข้าวเหนียวยังไม่แก่จัดนำมาคั่ว หรือนึ่งแล้วตาก ตำให้เป็นข้าวสาร หรือข้าวเปลือกแช่น้ำนำมาคั่วแล้วตำเป็นข้าวสารเก็บไว้เพื่อนึ่งรับประทาน
ฮาง ๓,น.,เงินตราโบราณ ทำด้วยเงินหนัก ๖ ตำลึง กับ ๖ สลึง มีตรารูปอักษรตีน ๒ ตัว
ฮ่างคีง,น.,ร่างกาย
ฮ่างมี,ว.,"มีมาก, มีทรัพย์มา"
ฮางริน,น.,รางรองน้ำใต้ชายคาเพื่อให้น้ำไหลไปตามที่ต้องการ = รางริน
ฮางวัล,น.,ของที่ให้ตอบแทนความชอบ = รางวัล
ฮ่างฮะ,น.,ไม้สามขาสำหรับผูกแขนโซงโลงเวลนาวิดน้ำ
ฮ่างฮาย,ว.,ลักษณะการแต่งกายโอ้อวด = สุรุ่ยสุร่าย
ฮาช,น.,ราช
ฮาด ๑,ก.,เทของเหลว ๆ เช่น โคล่นหรือน้ำรดลงไป = ราด
ฮาด ๒,ว.,"ไม่ได้ผล, ไม่สมบูรณ์ เช่น งัวฮาด หรือ งัวตอนฮาด = วันที่ตอนแล้วไม่ได้ผล"
ฮาด ๓,ว.,"สุก ๆ ดิบ ๆ, ไม่เต็มที่ เช่น หนึ้งผักฮาด"
ฮาดซะฮาดซาย,ว.,เรี่ยราดเลอะเทอะ
ฮาธนา (ฮาดทะนา),ก.,นิมนต์พระสงฆ์ = อาราธนา (ป.)
ฮ้าน,น.,"สิ่งที่ปลูกยกพื้นขึ้นจากพื้นดิน, สิ่งที่ทำขึ้นเพื่อให้พืชเถาเกาะเลื้อย = ร้าน"
ฮาน ๑,น.,"โรคกษัยมีอาการแสบร้อนหลังปัสสาวะ, โรคผอมแห้ง"
ฮ่าน ๑,น.,ยุงป่าชนิดหนึ่ง
ฮาน ๒,ก.,"ราน, ลิดรอน, ตัด เช่น ฮานง่าไม้"
ฮ่าน ๒,ว.,เป็นรอยร้าว
ฮาน ๓,ก.,กิริยาที่วัวหรือควายขวิดดินหรือพุ่มไม้ด้วยความคึกคะนอง
ฮาน ๔,ก.,"ทำลาย, ทำให้เสียหาย เช่นฮานเรือน, ฮานซาน = ทำลายข้าวของในเรือนเวลาโกรธจัด"
ฮาบ,ว.,"ราบ, เรียบ, เสมอ"
ฮาม ๑,ก.,"ข้ามไป, เลยไป, เว้น, ห่างเหิน, เช่น ไถนาฮาม = ไถข้ามร่อง"
ฮาม ๒,ว.,"เขื่อง, รุ่น เช่น สาวฮาม = เด็กสาวรุ่น ๆ , ถ้าเป็นสิ่งของหมายถึงขนาดกลาง"
ฮามแลงฮามงาย,ว.,เว้นมื้อกินมื้อ
ฮามสูร,น.,ชื่อยักษ์ตนหนึ่ง (เลือนมาจาก รามปรศุ อันเป็นชื่อพราหมณ์ดุร้าย) ถือขวาน เมื่อขว้างไปเกิดเป็นเสียงฟ้าร้อง
ฮ่าย ๑,น.,ชื่อบทประพันธ์ประเภทหนึ่ง = ร่าย
ฮ้าย ๑,ก.,"ทักท้วงด้วยความโกรธ, ว่ากล่าวด้วยความรุนแรง, ด่า, ดุ"
ฮ่าย ๒,ก.,"กิริยาที่นกหรือสัตว์ป่าส่งเสียงหรือร้องถี่ ๆ ติดต่อกันคราวละนาน ๆ , ส่งเสียงกระหน่ำ เช่น นกฮ่ายคอน"
ฮ้าย ๒,ว.,"ชั่วร้าย, เหี้ยมโหด, ร้าย"
ฮ่าย ๓,ก.,เทของลงไปในภาชนะที่แคบ ๆ = กรอก
ฮ่ายเข้าสารใส่ไท่,ก.,กรอกข้าวสารใส่ไถ้
ฮ่ายน้ำ,ก.,กรอกน้ำใส่ขวด
ฮ้ายเว้าฮุน,ก.,พูดรุนแรงมาก
ฮ้าว,ก.,กำรวบเข้ากันแล้วดึงหรือถอนขึ้น
ฮาว ๑,น.,"ราว เช่น ฮาวบันได, ฮาวตากผ้า"
ฮ่าว ๑,น.,เครื่องดักลัตว์ประกอบด้วยตาข่ายและหลาว
ฮ้าว ๑,น.,ชื่อพันธุ์ข้าวเหนียวชนิดหนึ่ง เวลาสุกแล้วเมล็ดร่วงง่าย
ฮาว ๒,ว.,"ประมาณ, เพียง, ขนาด, เท่า, ราวกะ"
ฮ่าว ๒,ก.,"ทำโดยไม่ตั้งใจ, อุตริ, เสี่ยงโชคเสี่ยงภัย"
ฮ้าว ๒,ก.,"เหนี่ยวเข้ามา, ดึงเข้ามา เช่น ฮ้าวแห = ดึงจอมแห"
ฮ้าว ๓,ว.,"ถึง, คัด เช่น หน้าฮ้าว = ใบหน้าตึงเพราะ ลมหรืออากาศหนาว, นมฮ้าว = นมคัด"
ฮ้าว ๔,ว.,ร้าว
ฮาวเขา,น.,เทือกเขา
ฮาวไพร,น.,ราวป่า
ฮ้าวมันโลด,สำ.,"ซัดมันเลย, ตีมันเลย"
ฮ่าวเว้า,ก.,พูดส่งเดช หรือ พูดบ้า ๆ บอ ๆ
ฮ้าวหน้า,ก.,เหนี่ยวสายหน้าไม้เพื่อขึ้นไกยิง
ฮ่าวเฮ็ด,ก.,"ทำส่งเดช, เดาสุ่ม"
ฮ่าวเฮ้า,ว.,หอมตลบอบอวล
ฮาวี,ก.,"ราวี, รังแก, รบกวน, เบียดเบียน"
ฮำ ๑,น.,ผงเยื่อเมล็ดข้าวลาร = รำ
ฮ่ำ ๑,ก.,"พูดหรือดิดซ้ำ ๆ , ร่ำ"
ฮำ ๒,ก.,ทำให้เปียกชุ่ม (ใช้แก่หมอกและฝน.)
ฮ่ำ ๒,ก.,"ตีอย่างแรง, กระหน่ำ"
ฮำ ๓,ก.,"ม้วน, มวน, พัน, เช่น ฮำกอกยา = มวนบุหรี่"
ฮำ ๆ,ว.,"ร่ำ ๆ , ซ้ำ ๆ , บ่อย ๆ"
ฮ่ำทวง ๑,ก.,ตีอกด้วยความเสียใจ
ฮ่ำเพิ่ง,ก.,"รำพึง, รำพัน"
ฮ่ำเพิง ๒,ก.,"รำพึง, พินิจพิจารณา"
ฮำมะหยี่,น.,ผ้าเทสชนิดหนึ่งเป็นขนนุ่ม
ฮำสาด,ก.,ม้วนเสื่อ
ฮ่ำฮอง ๓,ก.,"ร่ำร้อง, ส่งเสียงร้อง"
ฮ่ำฮอน ๔,ก.,"ตรึกตรอง, พร่ำบ่นคิดถึง"
ฮ่ำฮี่ฮ่ำไฮ ๕,ก.,ร่ำรี้ร่ำไร
ฮ่ำไฮ ๖,ก.,"ร่ำไร, พิรี้พิไร, รำพัน"
ฮิ,ว.,"ลักษณะของคนที่ติดนิสัยเลือกหรือรังเกียจ เช่ร ฮิเวียก = คนเลือกงาน, ฮิกิน = คนเลือกคน"
ฮิง,ก.,"รัด, มัดให้แน่น"
ฮิด ๆ,ว.,อากที่รู้สึกปวดเล็กน้อย ถ้าปวดมากว่า ฮึด ๆ
ฮิ่น,ก.,ค่อย ๆ รินเอาแต่น้ำ (แยกออกจากเนื้อ)
ฮิ้น,น.,แมลงตัวเล็ก ๆ คล้ายแมลงหวี่ ชอบกัดกินเลือดคนและสัตว์
ฮิ่น ๆ,ว.,มีควันเล็กน้อย ถ้ามากว่า ฮ้วน ๆ
ฮิ่นตรอง,ก.,"ตึกตรอง, พิจารณาให้ถ้วนถี่"
ฮิบ ๑,ก.,"ริบ, รวบรวมเอาหมดโดยพลการหรือโดยอำนาจกฎหมาย"
ฮิบ ๒,ก.,"ทำให้แคบ, ทำให้แสงน้อยลง เช่น ฮิบตา = หรี่ตา"
ฮิบฮี่,ว.,"ริบหรี่, เกือบดับ"
ฮิบโฮม,ก.,"เก็บรวบรวมไว้, ออมไว้"
ฮิม,น.,"ชาย, ขอบ, ริม, ที่ใกล้ ๆ"
ฮี,ว.,"รี, เรียว, เล็กลงไปตามลำดับ"
ฮีด ๑,ก.,"ปีบรูด, บีบเค้นให้ยืดยาวออกไป = รีด"
ฮีด ๒,ก.,ตี
ฮีต,น.,"เยี่ยงอย่าง, แบบแผน = จารีต"
ฮีตสิบสอง,น.,ประเพณีประจำเดือน
ฮีน,น.,ยุ้งเก็บข้าวเปลือกที่สานด้วยไม้ไผ่
