ลัวะ ๆ,ว.,"พรั่งพรูออกมา, ไหลออกมาก, เช่น เลือดไหวลัวะ ๆ"
ล่า,ว.,"ซีด, เผือด, เช่น หน้าล่า ตาตี่ หรือหน้าล่าตาเหลือง"
ลา ๑,น.,สัตว์พาหนะชนิดหนึ่ง รูปคล้ายม้าแต่หางเป็นพวงที่ปลาย
ล้า ๑,ก.,"อยู่ข้างหลัง, ไปไม่ทันข้างหน้า"
ลา ๒,ก.,"กิริยาท่าทาง หรือคำบอกกล่าวว่าจะไป, ถ่างออก, เช่น ลาออก, ปล่อย, ละ, ทิ้ง, เช่น กำไว้อย่าลา"
ล้า ๒,*ว.,"เมื่อย, หมดแรง, ช้า"
ล้า ๆ,ว.,"เฉย ๆ, ไม่ทำอะไรเลย, ซังกะตาย, เช่น อยู่ล้า ๆ"
ลาก,ก.,ดึงไป เช่น ลากคอมันไป
ลาก,ก.,"ดึงไป, ฉุดไป, ส่วนมากว่า แก่"
ลากเชือก,น.,ชื่องูไม่มีพิษชนิดหนึ่ง
ล่าง,ว.,"ใต้, ต่ำ, ตรงกันข้ามกับเทิง คือ บนหรือเหนือ"
ล้าง,ก.,"ชำระให้สะอาดด้วยน้ำ เช่น ล้างมือ, ทำลาย, เช่น ล้างป่า, ล้างโลก"
ลาง ๑,น.,"สัญญาณบอกเหตุร้าย, ขนบประเพณี เช่น ของเก่าลาวลาง"
ลาง ๒,ว.,"บาง, บ้าง, เช่น ลางเถ้าก็ตาย ลางยายก็อยู่"
ลางเค็ด,น.,นกชนิดหนึ่ง คล้ายนกกระไน = สาลิกาดง
ลางเชือก,น.,ชื่องูไม่มีพิษชนิดหนึ่ง
ล่างซ่าง,ว.,ถ่างออกไปมาก เช่น อ้าล่างซ่าง
ล่างซ่าง,ว.,ลักษณะสิ่งของที่เป็นคู่ยาวสูงขึ้น ส่วนล่างแคบ ส่วนบนกว้างออก
ลางเทื่อ,ว.,"ลางที, บางที"
ลาด ๑,น.,"ลานดิน หรือลานหินที่มีลักษณะเอียงเล็กน้อย ไม่เสมอ เช่น ลาดแดง, ลาดตาจ้าย, ตลาด, เช่น ลาดใหญ่ตั้งเต็มด้วยเครื่องควน"
ลาด ๒,ว.,ลักษณะของพื้นที่หรือภูเขาที่เทหรือเอียงต่ำลงไปทีละน้อยจนถึงที่ราบ เช่น ผาลาด
ลาดฟาด,ว.,ระเนระนาด เช่น ต้นเข้าล้มลาดฟาด
ลาดเลา,น.,"ลู่ทาง, เค้าเงื่อน, ท่าที"
ลาน ๑,น.,ที่สำหรับนวดข้าว
ล้าน ๑,น.,จำนวนนับเท่ากับ ๑๐ แสน
ลาน ๒,น.,ต้นไม้ชนิดหนึ่ง ใบคล้ายใบตาล ใบอ่อนตากแห้งแล้วใช้จารหนังสือ
ล้าน ๒,ว.,ลักษณะหัวที่มีผมหรือขนน้อย
ลาน ๓,น.,เหล็กแผ่นบางยาว ม้วนให้แน่น เพื่อให้คล้ายออก ทำให้ตัวจักรหมุน เช่น ลานนาฬิกา
ลาน ๔,น.,ต่างหูโบราณชนิดหนึ่ง ทำด้วยแผ่นเงินหรือทองบาง ๆ ม้วนให้กลมสอดใส่รูที่เจาะไว้ที่หู
ลาน ๕,ว.,มีขาวนวล คล้ายสีใบลานอ่อน ที่ตากแห้งแล้ว
ล้านช้าง,น.,ชื่อประเทศลาวสมัยก่อน
ล้านนา,น.,ชื่อประเทศโยนกสมัยโบราณ คือ เชียงแสน
ลาบ,น.,อาหารประเภท พร่าและยำ ทำด้วยเนื้อสัตว์หรือปลาที่สับละเอียดแล้วปรุงด้วยเครื่อง
ลาบซาบ,ว.,ลักษณะของสิ่งของที่แขวน หรือตั้งเรียงกันอยู่เป็ฯแถว
ลาภ,น.,"สิ่งที่ได้มาด้วยความพอใจ, โชค, ของที่ได้โดยไม่คาดฝันมาก่อน"
ลาม,ก.,"ติดต่อไป, ขยายออกไป, เช่น ไฟลาม"
ล่าม ๑,ก.,ผูกไว้ด้วยเชือกหรือโซ่ เช่น ล่ามงัว
ล่าม ๒,ว.,"ยาว, รุ่มร่าม, กรอมเท้า, เช่น ปกล่ามปลายตีน"
ลามก,ว.,"ชั่ว, เลวทราม, ต่ำช้า, สกปรก (ป.)"
ล่าย,ก.,"ปด, หลอกลวง, อำพรางความจริง"
ล้าย,น.,แจวเรือขนาดใหญ่ ใช้เหมือนตีกันเชียง
ลาย ๑,น.,"เส้นที่เขียน หรือแกะสลักให้เป็นรูปต่าง ๆ , สีขาว, ดำ, เหลือง, แดง เป็ฯต้น ที่สลับกัน ตามขนสัตว์หรือผ้า"
ลาย ๒,น.,สิ่งที่แยกกล่าวเป็นอย่าง ๆ ไป = ราย
ล้าย ๆ,ว.,"อาการเดินตามกันเป็นทิวแถว, ถ้าเดินขวักไขว่ว่า ล้วยล้าย หรือลุ้ยล้าย"
ลายขัด,น.,"ลายสานที่ขัดกันยกเส้นข่มเส้น, โดยปริยายหมายถึง ลายถักหรือทำขัดกัน"
ลายขัดตาแหลว,น.,ลายสานขัดเฉลว
ลายคราม,น.,ลายที่เขียนโดยช่างจีน ตามถ้วยชามหรือกระเบื้องจีน
ลายคอกหมู,น.,ลายสองที่เป็นรูปข้าวหลามตัด
ลายคุบ,น.,ลายสานเสื่อลำแพน ยกสีข่มสาม ยกสองข่มสาม สลับกันไป
ลายเครือ,น.,ลายเขียน หรือแกะสลัก เป็นรูปเถาวัลย์
ลายแคน,น.,"ทำนองแคนแบบต่าง ๆ เช่น ลายน้อย, ลายใหญ่, ลายล่อง, ลายส้อง, ลายสุดสะแนน"
ลายจีน,น.,ลายที่เขียนโดยช่างจีน ตามถ้วยชามหรือกระเบื้องจีน
ลายจุ้ม,น.,"ตราสาร, หมายรับส่ง"
ลายเฉลี่ย,น.,ส่วนแบ่งที่เฉลี่ยเป็นรายบุคคล
ล้ายซ้าย,?,ดู ซ้ายล้าย
ล้ายซ้าย,ว.,เรียงราย
ลายดอก,น.,ลายเขียนหรือแกะสลัก เป็นรูปดอกไม้ เช่น ลายดอกผัดแว่น
ลายตา,ว.,มองเลือนหรือพร่าไป
ลายต่าง,ว.,"แปลกไป, ผิดไป, นอกเรื่อง, นอกลู่นอกทาง, เช่น ลงลายต่างแล้ว"
ลายเถลีย,น.,ส่วนแบ่งที่เฉลี่ยเป็นรายบุคคล
ลายแทง,น.,ข้อความ หรือแผนที่ที่เป็นปริศนา บอกขุมทรัพย์ หรือของมีค่าที่ซุกซ่อนไว้
ลายโปงลาง,น.,"ทำนองโปงลาง เช่น ลายช้างขว้ามภู, ลายนกไส่บินขว้ามทุ่ง, ลายแม่ฮ้างกล่อมลูก"
ลายมัดหมี่,น.,ลายผ้าที่ทอด้วยด้าย หรือไหมที่มัดหมี่ เช่น ลายหมี่ขอ
ลายมือ,น.,รอยเส้นที่ปรากฏฝ่ามือและนิ้วมือ
ลายลักษณ์,น.,"ลายที่เขียน หรือแกะสลักเป็นรูปต่าง ๆ คู่กับอักษร, ส่วนมากมักพูดคู่กันว่า ลายลักษณ์อักษร ซึ่งหมายถึง หนังสือที่ใช้เป็นหลักฐาน"
ลายสอง,น.,"ลายสานที่ยกสองข่มสอง, ชื่อผ้าชนิดหนึ่งที่ทออย่างนั้น"
ลายสองขัดดี,น.,ลายสองที่เป็นรูปข้าวหลามตัด
ลายสองล้มเข้า,น.,ลายสองที่เป็นรูปข้าวหลามตัด
ลายสองล้มออก,น.,ลายสองขัดดีแต่ถ่างออก ตรงข้ามกับลายสองล้มเข้า
ลายสาม,น.,ลายสานที่ยกสามข่มสาม ถ้าขัดดีเป็นลายล้มเข้า เรียกลายสามล้มเข้า ถ้าลายถ่างออก เรียก ลายสามล้อออก
ลายสือ,น.,ลายที่เป็นสื่อให้รู้ความประสงค์ของกัน = หนังสือ
ลายใส่กัน,ก.,คิดเฉลี่ยกัน
ลายหยวก,น.,ลายสลักที่หยวกกล้วย ประดับปราสาทผึ้ง
ล่าว,ว.,อาการล้มระเนระนาด เช่น ต้นไม้ล้มล่าว
ลาว ๑,น.,ชื่อประเทศสาธารณรัฐประชาธิปไตยประชาชนลาว หรือชื่อชนชาติลาว
ล้าว ๑,ก.,กำรวบเข้ากันแล้วดึงหรือถอนขึ้น
ลาว ๒,ส.,บุรุษที่ ๓ = เขา
ล้าว ๒,ก.,"แสดงอาการไม่ตามใจ, ขัดใจกัน, กินใจกัน, มักใช้คู่กับคำว่า ลังเป็นลังล้าว, เช่น ลังล้าวเข้าใส่กัน"
ล้าว ๓,ว.,"ต่าง ๆ , แปลก, ผิดปกติ, เช่น ""เดินทางมาต่างตาคูล้าว"""
ลาวเก่า,น.,ไทยสิบสองปันนา ตามคำเรียกของชาวหลวงพระบาง
ลาวเก่า,น.,ไทพวกหนึ่งอยู่ในแคว้นสิบสองปันนา
ลาวลาง,น.,ขนบประเพณีของลาว
ลาวส้ง,น.,"ไทยดำ, ไทยขาว คือไทยหรือลาวสาขาหนึ่ง, ผู้ชายชอบนุ่งส้ง (กางเกง) เหมือนจีน = ลาวโซ่ง"
ล้าวอ้าว,ว.,"บิดตะแคง, ไม่กินเกลียวกัน, เช่น บิดล้าวอ้าว ใช้สำหรับของใหญ่, ถ้าของเล็กว่า แล้วแอ้ว"
ลาวัณย์,น.,"ความงาม, ความน่ารัก (ส.)"
ล้าหลัง,ก.,"อยู่ข้างหลัง, ไปไม่ทันข้างหน้า"
ล่ำ,ก.,"มอง, ดู, ส่วนมากว่า แล"
ลำ ๑,น.,"เรื่องที่แต่งตามระเบียบฉันทลักษณ์ เช่น ลำพระเวส, ตัวของคนหรือสัตว์, หรือต้นไม้ ไม่นับส่วนที่เป็นแขนขา หรือกิ่งก้าน, เช่น ลำโต, ลำไผ่, ลักษณะนามเรียก ต้นไม้ หรือเรือ เช่น ไม้ไผ่หนึ่งลำ, เรือ ๒ ลำ"
ล้ำ ๑,ก.,"ล่วงเกินเข้าไป, พ้น, เหลือ, เลย, ตีกระหน่ำ, ตีอย่างแรง, เช่น ล้ำหัวมันโลด"
ลำ ๒,น.,การขับร้องอย่างหนึ่งมีแคนเป็นดนตรีประกอบมีหลายทำนอง = แอ่ว
ล้ำ ๒,ว.,"ประเสริฐ, ยิ่ง, ใหญ่, ล้น"
ลำกลอน,น.,การลำทำนองจังหวะสั้นทั่วไป
ลำเกี้ยว,น.,การลำกลอนสั้นเกี้ยวกันระหว่างหญิงชายฝ่ายละคน
ลำเข็ญ,ว.,"ลำบาก, ยากแค้น, = ลำเค็ญ"
ลำคีง,น.,ลำตัว
ลำโจทย์-แก้,น.,"การลำทำนองสั้น ถาม- แก้ กลอน, โต้ตอบปัญหาต่าง ๆ ทั้งทางคดีโลก คดีธรรม"
ลำชิงชู้,น.,การลำแย่งชิงหญิง-ชายด้วยกลอนระหว่างคน ๓ คน คือ หญิงหนึ่งชายสอง หรือหญิงสองชายหนึ่ง
ลำดวน,น.,ชื่อไม้ต้นชนิดหนึ่ง ดอกคล้ายดอกนมแมว แต่กลีบหนาแข็ง กลิ่นหอม
ลำดวน,น.,ต้นไม้ชนิดหนึ่ง ดอกเป็นกลีบหนาและสั้น มีกลิ่นหอม
ลำดับ ๑,*น.,"อันดับ, การเรียงไว้ตามตำแหน่ง"
ลำดับ ๒,ว.,เรียงถัดกันไป
ลำเต้ย,น.,"การลำทำนองหนึ่งมีการเอื้อนลากเสียง เลียนทำนองมาจากเจรียงของเขมรบ้าง ค่าวของไทยเหนือบ้าง เช่น เต้ยชัยภูมิ, เต้ยสีภูมิเดิม, เต้ยพม่า, เต้ยหัวดอนตาล"
ลำทางสั้น,น.,การลำด้วยทำนองและจังหวะสั้น หรือลำกลอนทั่วไป
ลำธาร,น.,"ทางน้ำเล็ก ๆ ไลตามหุบเขา, ต้นน้ำ"
ลำเนา,น.,"แนว, แถว, แถบ, ถิ่น"
ลำบาก,ว.,"ยาก, ไม่สะดวก"
ลำพญา,น.,ลำเกี้ยวกันระหว่างหญิงกับชายทำนองเต้ยหัวดอนตาล
ลำพัง,ว.,"เฉพาะตน, ไม่เกี่ยวกับผู้อื่น, เดี่ยว"
ลำพื้น,น.,การลำเล่านิทานหรือประวัติต่าง ๆ โดยใช้ทำนองหนึ่งเป็นการลำคนเดียว
ลำเพลิน,น.,ลำจังหวะเร็ว ทำนองคล้ายเพลงเต้นรำ ประกอบด้วยกลอง แคนและฉิ่ง จะลำคนเดียวหรือหลายคนก็ได้ลักษณะคล้ายลำหมู่ ปัจจุบันนี้มีการแทรกเพลงไทยเข้าไปด้วย
ลำเพา,ว.,โฉมงาม
ลำแพง,น.,หอก (ข.)
ลำโพง,น.,เรียกสิ่งซึ่งมีรูปคล้ายดอกลำโพงว่า ลำโพง
ลำยาว,น.,ลำทำนองหนึ่งมีการขึ้นเสียงสูง-ต่ำ เอื้อนเสียงยาวกว่าปกติลำทางยาวอ่านหนังสือหรือ
ล่ำแยง,ก.,"ดูแล, รักษา, คุ้มครอง, พินิจพิจารณา"
ลำใย,น.,ไม้ผลชนิดหนึ่ง ผลกลมรสหวาน
ลำเรื่อง,น.,การลำอย่างเดียวกับลำพื้น แต่ใช้ทำนองลำเหมือนลำสั้นทั่วไป ลำคนเดียวตัดเสียงเป็นหญิงเป็นชายตามเนื้อเรื่อง
ล่ำลา,ก.,ลาจากไป
ลำเลิก,ก.,ฟื้นเอาเรื่องเก่าขึ้นมาพูด
ล้ำเลิศ,ว.,ประเสริฐยิ่ง
ล่ำแล,ก.,"ดูแล, รักษา, คุ้มครอง, พินิจพิจารณา"
ลำสั้น,น.,การลำด้วยทำนองและจังหวะสั้น หรือลำกลอนทั่วไป
ลำหมู่,น.,การลำอย่างเดียวกับลำเรื่อง แต่ใช้คนลำหลายคนเหมือนลิเก ใช้กลอนเดินดง กลอนเกี้ยว กลอนโศก ตามเนื้อเรื่องที่แสดง
ลำห้วย,น.,ทางน้ำไหล ใหญ่กว่าลำธารเล็กกว่าแม่น้ำ
ลำเอียง,ก.,เข้ากับฝ่ายใดฝ่ายหนึ่งไม่วางตัวเป็ฯกลาง
ล่ำเอฺยี้ยม,ก.,เยี่ยมเยียน
ลิ,ก.,"ดึงหรือลิดใบไม้จากกิ่ง, ใบไม้หรือแขนงขนาดเล็กหัวฉีกจากกิ่งก้าน, อวัยวะบางส่วนฉีก, เช่น ใบหูลิ"
ลิเกลาว,น.,การลำอย่างเดียวกับลำเรื่อง แต่ใช้คนลำหลายคนเหมือนลิเก ใช้กลอนเดินดง กลอนเกี้ยว กลอนโศก ตามเนื้อเรื่องที่แสดง
ลิขสิทธิ์,น.,การสงวนสิทธิในทางวรรณกรรมและศิลปกรรมตามกฎหมาย
ลิขิต ๑,น.,"หนังสือ, จดหมาย (ป.)"
ลิขิต ๒,ก.,เขียน (ป.)
ลิง,น.,สัตว์เลี้ยงลูกด้วยนมลักษณะคล้ายคน ปกติอาศัยอยู่ในป่ามีหลายชนิด เช่น ลิงกัง (ลิงวอก) ลิงโทน ลิงลม (นางอาย)
ลิงค์,น.,"เพศ, ลักษณะ, เครื่องหมาย, ประเภทของคำในไวยากรณ์ (ป.,ส.)"
ลิงยอก,น.,โคกกระสุน
ลิงลาย,น.,ลวดลายที่เขียน หรือแกะสลักเป็นรูปต่าง ๆ
ลิด ๆ,ว.,อาการที่น้ำไหลเบา ๆ ไม่แรง
ลิดแลด,ว.,อาการที่มองเห็นเพียงแวบเดียว เช่น เห็นพอลิดแลด
ลิตร,น.,"หน่วยของมาตราตามวิธีเมตริก เท่ากับ ๑,๐๐๐ ลูกบาศก์เซนติเมตร (อัง)"
ลิน,ก.,"ตอนปรอย ๆ, พรำ ๆ , เช่น ฝนลิน, ไหลไม่ขาด, เช่น ไหลลินหรือลินไหล"
ลิ่น,น.,สัตว์ ๔ เท้า ประเภทเลื้อยคลาน หนังมีเกล็ดแข็งหุ้มทั่วตัวม้วนตัวเอง หลบภัยได้ = นิ่ม
ลิ้น ๑,น.,อวัยวะที่อยู๋ในปากมีหน้าที่รับรู้รส ช่วยในการออกเสียง และช่วยเขี่ยอาหารให้ฟันเคี้ยว
ลิ้น ๒,น.,ใช้เรียกส่วนของสิ่งต่าง ๆ ที่อยู่ข้างใน มีรูปแบน ๆ ยาว ๆ
ลิ้นไก่,น.,เนื้อในลำคอที่ยื่นจากเพดานอ่อนสำหรับปิดช่องขึ้นรูจมูกเมื่อเวลากลืนอาหาร
ลิ้นแคน,น.,"แผ่นทองเหลืองหรือแผ่นเงินบาง ๆ อยู่ในลูกแคนเพื่อให้เกิดเสียงเวลาเป่า, อยู่ในเลาปี่เรียกลิ้นปี่"
ลิ้นจี่,น.,ชื่อต้นไม้ชนิดหนึ่ง ผลกลมสีแดง มีรสเปรี้ยว ๆ หวาน ๆ
ลิ้นชัก,น.,ส่วนประกอบของโต๊ะและตู้สำหรับเก็บสิ่งของผลักเข้าออกได้
ลิ้นทอง,น.,"นกชิ้นหนึ่ง, วรรณคดีอีสานเรื่องหนึ่ง"
ลิ้นทะเล,น.,กระดอกปลาหมึกชนิดหนึ่ง ใช้ประกอบยาไทย
ลิ้นฟ้า,น.,เพากา
ลิ้นฟาน,น.,พืชน้ำชนิดหนึ่ง ขึ้นอยู่ตามลำห้วย สายและใบคล้ยบัว แต่ใบยาวเล็ก กินได้จัดเข้าประเภทผัก
ลิ้นไม้,น.,เพากา
ลิ้นหมา,น.,ทากตัวแบนอาศัยอยู่ในที่ชื้นเย็น
ลิ้นแฮด,น.,ไม้เถามีกลิ่นหอม = สุคนธ์
ลิบ,ว.,มาก ใช้ประกอบไกลและสูง เช่น ไกลลิบล สูงลิบ
ลิบ ๆ,ว.,"ไกลมาก ๆ , สูงมาก ๆ"
ลิลากลิเลือ,ว.,"กระเสือกระสน เช่น ลิลากลิเลือมา, กลิ้งเกลือก, คลุก"
ลิเลื่อ,ก.,กิริยาที่เคี้ยวอาหารไม่ละเอียด กระเดือกกลินลงไป หรือกล้อมแกล้มกลืน
ลิ้ว,น.,"เส้น, แนว, รอย = ริ้ว เช่น แล่หนังออกเป็นริ้ว ๆ"
ลิว ๑,ก.,แล่เป็นริ้ว หรือเป็นเส้น เช่น ลิวหนังควายที่ตายแล้วให้เป็นเชือกหนัง
ลิว ๒,ว.,"เร็ว, รีบเร่ง, เช่น ลิวไปลิวมา"
ลิว ๆ,ว.,เร็ว ๆ
ลิวลี่,ว.,ไปอย่างรีบเร่ง ถ้ามีอาการเหนื่อยอ่อนด้วยว่า อิดหิวลิวลี่
ลี่,น.,"ที่ที่ทำขึ้นสำหรับดักปลา คล้ายต้อนแต่มีหางเป็นทางน้ำไหล, มีที่รองรับปลาอยู่ท้าย"
ลี้,ก.,"ซ่อน, หลบหนี, ซุกซ่อน"
