บังอร,น.,"เด็กสาว, หรือใช้แทนผู้หญิง"
บังอาจ,ว.,"อาจเอื้อม, ไม่ยำเกรง, ล่วงเกิน"
บังเอิญ,ว.,เกิดเป็นโดยไม่รู้ตัว หรือใช้ว่า เผอิญ
บัชญา,น.,คำสั่ง
บัญชี,น.,ที่จดรายการรายรับ รายจ่าย กำไร ขาดทุนไว้เพื่อทราบจำนวนเงิน หรือสิ่งของไว้เป็นหลักฐาน
บัญญัติ,น.,"ข้อกำหนดเกณฑ์ต่าง ๆ ที่เขียนขึ้นให้คนปฏิบัติ เช่น เทศบัญญัติ, พระราชบัญญัติ"
บัณฑิต,น.,"ผู้รู้, ผู้เรียนจบชั้นปริญญา"
บัณฑิตา,น.,"ผู้รู้, ผู้เรียนจบชั้นปริญญา"
บัณฑุ,ว.,"เหลืองอ่อน, ขาวเหลือง"
บัณฑุกัมพล,น.,ผ้าขนสัตว์สีเหลือง
บัด ๑,น.,"หญ้าอ่อน, หญ้าที่งอกขึ้นใหม่เมื่อมีฝนต้นฤดู เรียกว่า หญ้าบัดป่ง (ส่วย)"
บัด ๒,ก.,สลบ เช่น บัดไป = สลบไป
บัด ๓,ว.,ไม่ได้ที่ เช่น เข้าหม่า คือ ข้าวเหนียว ต้องแช่น้ำก่อนนึ่งถ้าแช่เร็วไปไม่พอดี
บัดนี้,ว.,เดี๋ยวนี้
บัตร,น.,"ผืนผ้า, แผ่นเจี้ย = กระดาษ สำหรับเขียนข้อความ เช่น นามบัตร"
บัทม์,น.,บัวหลวงสีแดง กลิ่นหอม ส่วนมากใช้ บัทุมา หรือปทุมา
บั่น,ก.,ตัดให้สั้น เช่น บั่นฟืน
บั้น,น.,"ขั้นตอนของหนังสือ เช่น บั้นต้น, บั้นปลาย"
บั้นท้าย,น.,สะโพก
บั้นโท้ย,น.,สะโพก
บัพพา,น.,พระอุมาเทวี เป็นภริยาของพระศิวะ
บัพพาชน์,น.,การขับไล่
บัพพาวดี,น.,พระอุมาเทวี เป็นภริยาของพระศิวะ
บัลลังก์ ๑,น.,"แท่น, ราชบัลลังก์ = ที่ประทับของพระเจ้าแผ่นดิน"
บัลลังก์ ๒,ก.,ที่นั่งของผู้พิพากษาที่อยู่ห้องพิจารณาตัดสินคดี
บัว,น.,"ชื่อพืชน้ำ ขึ้นในน้ำ นิยมใช้บูชาพระ, บางชนิดก็ใช้ปรุงอาหารจากสายบัวได้ บัวมีหลายชนิด เช่น บัวแดง หรือบัวทอง = บัวสาย, บัวแบ้ = บัวผัน, บัวโป้ง = บัวหลวง, บัวแหล้ = บัวเผื่อน"
บั่ว ๑,น.,"ต้นหอม หรือหัวหอม, ส่วนมากเรียกผักบั่ว มีหลายพันธุ์ เช่น บั่วเลย = หอมชนิดใบใหญ่ไม่มีหัว, บั่วหัว = หอมแดง, บั่วใหญ่ = หอมหัวใหญ่"
บั่ว ๒,น.,หญ้าชนิดหนึ่งเกิดตามหนองน้ำ ลักษณะคล้ายใบหอม
บั่ว ๓,น.,"ขนอุย, ขนอ่อน = ขนบั่ว"
บัวนาง,น.,"นางสนม, นางบำเรอ"
บัวบก,น.,พืชชนิดหนึ่งใบคล้ายใบบัว แต่เล็กกว่ามีหัวใช้ปรุงอาหารและทำยาได้
บัวบาท,น.,"นางสนม, นางบำเรอ"
บัวระบัด,น.,"ปรนนิบัติ, เฝ้ารักษา, ดูแล"
บา,ก.,"บน, บนบานเทพารักษ์ เจ้าป่า เจ้าเขา เพื่อให้ได้สิ่งที่ต้องการ"
บ่า,น.,อวัยวะส่วนที่อยู่บนโคกแขนขวาและซ้าย หรือส่วนที่แบกหามสิ่งของ = บ่า
บา ๑,น.,"หนุ่ม, นายใช้แก่ผู้มีศักดิ์สูง หรือตัวเอกที่มีความสามารถสูง. มักใช้เป็นคำนำหน้าชื่อบุคคลในวรรณคดี เช่น บาคานท้าว, บาบ่าวขูลู, บาเจือง"
บ้า ๑,น.,"พันธุ์ไม้เถาอยู่ในป่า มี ๒ ชนิด คือ ชนิดผลกลม ได้แก่ บ้าบนขาว = กะดังขาว, บ้าบนแดง = กะดังแดง, ชนิดผลแบน ได้แก่ บ้าใหญ่ = สะบ้า, บ้าลาย = สะบ้าธรรมดา แต่เล็กมีลายคล้ายไข่นกกะทา"
บา ๒,ก.,"เว้น, เช่น บามื้อไข้ หรือไข้บา = ไข้วันเว้นวัน"
บ้า ๒,ว.,"สติฟั่นเฟือน, ปราศจากความรู้สึกผิด = ชอบ"
บาก ๑,น.,พันธุ์ไม้ยืนต้นขนาดใหญ่ชนิดหนึ่ง = กะบาก
บาก ๒,ก.,"ฟันไม่ให้เป็นรอยกว้าง, ส่วนมากว่า บัก"
บากบั่น,ก.,"ตั้งอกตั้งใจทำ, มีความพยายาม, พากเพียร"
บาคราญ,น.,"หนุ่ม, นายใช้แก่ผู้มีศักดิ์สูง หรือตัวเอกที่มีความสามารถสูง. มักใช้เป็นคำนำหน้าชื่อบุคคลในวรรณคดี เช่น บาคานท้าว, บาบ่าวขูลู, บาเจือง"
บาง,น.,"ลำห้วย, คลอง, เช่น บังอี, บังมุกต์, บังทราย"
บ่าง,น.,สัตว์ ๔ เท้า อาศัยอยู่ตามต้นไม้ใหญ่ในป่าสูง สีข้างมีแผ่นหลังกางออกคล้ายปีกร่อนออกไปได้มี ๒ ชนิด คือ บ่างตอง และบ่างลั้ว แต่บางตอนมีขนาดเล็กกว่า
บ้าง,น.,สิ่งที่มีรูกลวงคล้ายกระบอก เช่น บ้างตา = ขอบตาโดยรอบหรือรอยบั้งตามตัวปลาก่อนทอด หรือปิ้ง
บาง ๑,น.,"ลำห้วย, คลอง, เช่น บังอี, บังมุกต์, บังทราย"
บาง ๒,ว.,ไม่หนา
บางผ่อง,ว.,"บ้าง, บางสิ่ง, บางคน"
บางพ่อง,ว.,"บ้าง, บางสิ่ง, บางคน"
บาด ๑,น.,แผล
บาด ๒,ก.,ทำให้เกิดเป็นแผลหรือรอยขีดข่วนอ่างของมีคม
บาด ๓,ว.,"ครั้น, เมื่อ, คราว, ยาม, คู่ เช่น คอขาดบาดตาย = เรื่องที่จะมีโทษถึงตาย, เรื่องอันตรายถึงชีวิต"
บาดนี้,ว.,เดี๋ยวนี้
บาดหมาง,ก.,หมองใจกัน
บาดหู,ก.,ไม่ถูกหู
บาดาล,น.,"ใต้พื้นดิน, นาคพิภพ, หรือเมืองบาดาล เพราะสมัยโบราณ นั้นเห็นว่าฟ้าและใต้ดินเป็นสิ่งลี้ลับ"
บาต,ก.,"ตก, ตกไป, เช่น อสุนีบาต = ฟ้าผ่า, บิณฑบาต = ข้าวตก"
บาตร,น.,ภาชนะทำด้วยโลหะทรงกลมสีดำสำหรับพระสงฆ์ สามเณรใช้บิณฑบาต รับภัตตาหารจากผู็เลื่อมใสถวายหรือตักบาตรให้
บาท ๑,น.,มาตราเงินบาทของไทย ๑ บาท = ๔ สลึง
บาท ๒,น.,โคลงบทหนึ่งมี ๔ บาท
บาทบงสุ์,น.,ละอองเท้า
บาทบริจาริกา,น.,หญิงที่ปฏิบัติพระเจ้าแผ่นดิน
บาทหลวง,น.,นักบวชศาสนาคอธอลิก
บาทุกา,น.,รองเท้า (ป.)
บ่าน,ก.,"แตกออก, หลุดออก, เช่น มัดบ่าน, ขนาดเล็กเรียก บิ่น"
บ้าน,น.,"บริเวณที่เรือนตั้งอยู่, ถิ่นที่อยู่อาศัย ถ้ามีบ้านเรือนมากก็เรียกว่าหมู่บ้านและเรียกคนที่อยู่ในหมู่บ้านว่าชาวบ้าน ส่วนบ้านที่อยู่ในบนบทเรียกว่า บ้านนอก"
บาน ๑,น.,"น้ำดื่ม, เครื่องดื่ม, เช่น น้ำอัฐบาน, สุราบาน"
บาน ๒,น.,ลักษณะนามใช้เรียกหน้าต่าง ประตู ว่า บาน และเรียกเหล็กยึดหน้าต่าง ประตู ว่า บานพับ
บาน ๓,ก.,"เผยออก, คลี่ออก, ขยายออก, เช่น ดอกไม้บาน"
บาน ๔,ว.,"ชื่นบาน, เบิกบาน"
บาป,น.,ความชั่วร้ายต่าง ๆ ที่ตรงข้ามกับบุญ
บ้าปาก,ก.,ละเมอ
บาย,ก.,ใช้มือแตะสิ่งใดสิ่งหนึ่งตลอดจนกำยืดได้
บาย ๑,น.,เข้า = ข้าว (ข.)
บ่าย ๑,น.,เวลาหลังเที่ยงไปถึงเย็น
บ้าย ๑,ก.,"ทำให้ติด, ไล้, ส่วนมากว่าป้าย"
บาย ๒,ก.,"จับต้อง, หยิบฉวยเอา"
บ่าย ๒,ก.,เอาอาหารอย่างใดอย่างหนึ่งใส่ข้างในข้าวเหนียวปั้นคล้ายทำขนมยัดไส้สำหรับใช้ป้อนเด็ก ๆ เช่น เข้าบ่ายไข่ = ข้าวมีไข่เป็นไส้ข้างใน
บ้าย ๒,ก.,"เบี่ยง, เฉียง, เช่น ห่มผ้าเบี่ยงบ้าย = ห่มผ้าเฉียงบ่า"
บารมี,น.,"การบำเพ็ญคุณงามความดี ๑๐ ประการ คือ ทาน, ศีล, เนกขัมมะ, ปัญญา, วิริยะ, ขันติ, สัจจะ, อธิษฐาน, เมตตา, อุเบกขา"
บาเรียน,น.,ผู้เรียนจบธรรมะขั้นมหา = เปรียญ
บาล,ก.,เลี้ยงดู อุปการะ
บาลี,น.,ภาษาที่ใช้เป็นหลักในพุทธศาสนา
บ้าเลือด,น.,โรคบ้าชนิดหนึ่งเมื่อมองเห็นเลือดแล้วเกิดอาการฮึดสู้อย่างไม่คิดชีวิต หรือคนตกเลือดตกใจเสียสติคุมสติไม่อยู่
บ่าว,น.,เครื่องเล่นทำด้วยโครงไม้ เอากระดาษ หรือผ้าบาง ๆ ติดมีสายป่าน หรือเชือกเส้นเล็ก ๆ ผูกโยงไว้กับตัวว่าวเพื่อชักให้ลอยขึ้นไปในอากาศ
บ่าว,น.,ชายหนุ่ม
บาศ,น.,บ่วง
บาศรี,น.,"พิธีสู่ขวัญบายศรีนิยมกันมากในหมู่ชนชาวอีสาน ประกอบพิธีขึ้นเรียกขวัญ = บำรุงขวัญให้แก่ทหารผู้กลับจากสนามรบที่ประสบผลสำเร็จใหญ่ ๆ โต ๆ , ข้าราชการชั้นผู้ใหญ่"
บาศรี,ว.,ห้า = เบญจ เช่น ขันหมากเบ็ญจ์ = ขันบายศรี
บ่าหลอด,น.,ปรอท
บ่าไหล,น.,อวัยวะส่วนที่อยู่บนโคกแขนขวาและซ้าย หรือส่วนที่แบกหามสิ่งของ = บ่า
บ่าไหล่,น.,อวัยวะส่วนที่อยู่บนโคกแขนขวาและซ้าย หรือส่วนที่แบกหามสิ่งของ = บ่า
บ่าแอว,?,ดู เข็มขัด
บ้ำ,ว.,บุ่มลงไป
บ๋ำ,ว.,บุ่มลงไป
บำเทิง,ก.,บันเทิง
บำนาญ,ก.,เงินเดือนของข้าราชการที่เกษียณอายุแล้ว
บำเพ็ญ,ก.,"ทำให้มีขึ้น, ทำให้สำเร็จ"
บำรุง,ก.,"เลี้ยงดู, รักษา, ทำให้เจริญ"
บำเรอ,ก.,"คอยรับใช้, บริการ"
บำเหน็จ,น.,เงินเป็นค่าตอบแทนจากผลการทำงานของข้าราชการมอบให้เป็นเงินก้อนสุดท้ายครั้งเดียว
บิ,ก.,"หักออก, ทำให้หลุดออกด้วยมือ"
บิง,น.,ผ้าแพรสำหรับห่มเฉียง หรือเฉวียง
บิ้ง ๑,น.,ค้างคาวชนิดหนึ่งตัวเล็ก
บิ้ง ๒,น.,"เสี้ยว, ส่วน"
บิด,น.,โรคชนิดหนึ่งมีอาการปวดมวนท้อง อุจจาระบ่อย ถ้าเป็นมากอุจจาระจะเป็นมกเลือด
บิดร,น.,พ่อ
บิดา,น.,พ่อ (ป. ปิตา)
บิตรงค์,น.,พ่อ
บิตเรศ,น.,พ่อ
บิน,ก.,พุ่งไปในอากาศโดยใช้ปีก
บิ่น,ก.,"ฉีก, แหว่ง"
บิ้น,ว.,อาการเคลื่อนไหลของของเหลวทีละน้อย ๆ ถ้ามากเรียก บุ้น ๆ
บี,น.,ถุงน้ำดี
บี่,ก.,"คลี่ออก, เปิดออก"
บี้ ๑,น.,ผีเสื้อที่เกิดจากรังไหม
บี้ ๒,น.,ตัวหนอนที่เกิดจากไหมสีขาว
บี้ ๓,ก.,"กดลง, บีบ, บังคับ"
บีคน,น.,พันธุ์ไม้ชนิดหนึ่งรสขมจัด ใช้ทำยา
บีแค่ง,น.,ปลีน่อง
บีแค่ง,น.,"กล้ามเนื้อ, ก้อนเนื้อที่อยู่หลังหน้าแข้ง = ปลีแข้ง"
บีง,น.,พันธุ์ไม้ชนิดหนึ่งใช้ทำยา
บีฑา (แบบ),ก.,"เบียดเบียน, บีบคั้น, เจ็บปวด (ส.)"
บีบ,ก.,"กดสองข้างอย่างแรง, คั้นด้วยมือ"
บีบคั้น,ก.,"เคี่ยวเข็ญ, รังแก, นวดเฟ้น"
บีบบังคับ,ก.,"เคี่ยวเข็ญ, กดขี่อย่างรุนแรง"
บีบบี้,ก.,"เคี่ยวเข็ญ, กดขี่ไม่ให้โงหัวได้เลย"
บีพพาชนียกรรม,น.,ความผิดที่ควรแก่การขับไล่ สำหรับภิกษุ สามเณร
บึก,น.,ชื่อปลาน้ำจืดชนิดหนึ่ง ไม่มีเกล็ดตัวโตมากมีในแม่น้ำโขง
บึกบาง,น.,แหล่งน้ำใหญ่ที่มีทางน้ำติดต่อไปแห่งอื่นอีก
บึ่ง ๑,ก.,ไปโดยเร็ว
บึ้ง ๑,น.,สัตว์ชนิดหนึ่งรูปร่างคล้ายแมงมุม สีดำ อยู่ในรูตามป่า
บึ่ง ๒,ว.,เสียงดัง บึ่ง ๆ หรือ หึ่ง ๆ
บึ้ง ๒,ว.,"ไม่ยิ้มแย้ม, บูดเบี้ยว แสดงออกทางหน้าตาดุ"
บึด,ว.,"ครู่หนึ่ง, เดี๋ยวเดียว"
บึดเดียว,ว.,ประเดี๋ยว
บึ้น ๆ,ว.,อาการสั่น
บืน,ก.,"คืบไป, ปีนป่าย มีความหมายว่า ฝ่าความยากลำบากไปในการต่อสู้"
บื้น ๆ,ว.,อาการสั่นเทา เช่น หนาวสั่นบื้น ๆ
บือ,น.,สะดือ
บือสิม,น.,หลุมลูกนิมิตลูกกลางโบสถ์
บุ ๑,น.,"ไร่, นา ที่เลิกทำแล้วเป็นปีขึ้นไป เรียกว่า ไฮ่บุ นาบุ"
บุ ๒,ก.,โผล่ขึ้นจากดิน เช่น เห็ดบุขึ้นมา = เห็ดผุดขึ้นมา
บุ ๓,ก.,"ลุย, ฝ่าไป, เช่น บุกเข้าไปในป่า"
บุ ๔,ก.,"ใช้แผ่นโละบาง ๆ เช่น เงิน, ทอง เป็นต้น หุ้มข้างนอกให้เข้ารูป เช่น บุเงิน"
บุ ๕,ก.,"เผา, สุมไฟ (ส่วย)"
บุก,น.,พืชล้มลุกชนิดหนึ่ง หัวกินได้
บุก ๑,น.,พืชชนิดหนึ่งคล้ายบอนชอบขึ้นอยู่ตามป่า มีหัวอยู่ในดินแต่รับประทานไม่ได้
บุก ๒,น.,"พืชลำต้นตรงมีลายปล้องเหมือนงูใช้ทำยา เรียก บุกดอ, บุกรอ"
บุคคล,น.,"บุคคลธรรมดามีเพศชายเพศหญิง และนิติบุคคล ได้แก่ กิจการ เช่น ห้างหุ้นส่วน, บริษัท จำกัด ที่จดทะเบียนถูกตามกฎหมายและหน่วยงานของรัฐ มีกระทรวง, ทบวง, กรม เป็นต้น"
บุคลิก,ว.,เฉพาะคน เช่น บุคลิกภาพ = สภาพนิสัยจำเพาะคน
บุง,น.,ภาชนะสานรูปกลมทึบ พื้นก้นเป็นสี่เหลี่ยม มีตีน
บุง,น.,เครื่องสานชนิดหนึ่งสำหรับใส่ของ = กระบุง
บุ่ง,น.,"บริเวณที่ดินที่ลุ่มต่ำติดกับลำน้ำ, ลำคลอง"
บุ้ง,น.,"ตัวบุ้ง มีหลายชนิด เช่น บ้งกือ, บ้งขน, บ้งคืบ, บ้งเล็น"
บุ้งกล้วย,น.,ตัวด้วงชนิดหนึ่ง ชอบกัดใบกล้วย ม้วนทำรังแขวนอยู่กับใบกล้วย บางถิ่นเรียก ด้วงกล้วย
บุญ,น.,"ความดี, กุศล ตรงข้ามกับบาป"
บุญข้าวสากน้อย,น.,ชื่องานบุญสิ้นเดือน ๙
บุณฑริก (บุนทะริก),น.,บัวขาว
บุด,ว.,เสียงที่ฟังแล้วดัง บุด ๆ
บุตร,น.,ลูก
บุตรี,น.,ลูกผู้หญิง
บุถุชน,น.,คน หรือ ชน ที่ยังไม่พ้นกิเลส
บุ้น,ว.,อาการเคลื่อนไหลของของเหลวทีละน้อย ๆ ถ้ามากเรียก บุ้น ๆ
บุ่น ๑,น.,ต้นไม้ชนิดหนึ่งขึ้นอยู่ตามป่า มียอดอ่อน คล้ายหน่อไม้ใช้แกงได้
บุ่น ๒,น.,"ใช้ประกอบหลังคำว่า บอก เช่น บอกบุ่น = กระบอกที่ทำด้วยโลหะทองเหลืองสำหรับตำหมาก ให้คนแก่ที่ไม่มีฟันรับประทาน, หรือเคี้ยวหมาก"
บุ่น ๓,ก.,เจาะรู
บุ่น ๔,ว.,"ตุย, ยุ้ย, เช่น แก้มบุ่น"
บุนนาก,น.,ไม้ดอกชนิดหนึ่งดอกคล้ายสารภีแต่โตกว่า
บุ่นวาย,ก.,"ยุ่งเหยิง, อลหม่าน, เดือดร้อน"
บุบ,ก.,ตีด้วยกำปั้น หรือของแข็ง เช่น ค้อน ทำให้ยุบลง
บุบผะ,น.,ดอกไม้ (ป.) เช่น บุบผชาติ = บรรดาดอกไม้
บุบผา,น.,ดอกไม้ (ป.) เช่น บุบผชาติ = บรรดาดอกไม้
บุบราคา,ก.,ทำให้ราคาลดลง
บุบหัว,ก.,ตีหัว
บุพ,ว.,"ก่อน, ทีแรก, เบื้องต้น, ทิศตะวันออก, เช่น บุพกรรม = กรรมเก่า, บุพการี = บิดา, มารดา บุพกิจ = กิจที่ต้องทำก่อน, บุพนิมิต = ลางบอกเหตุ, บุพบท คำที่อยู่หน้านาม เช่น ใน ซึ่ง อัน สู่ บุพเปตพลี = อุทิศบุญให้แก่ญาติผู้เสียชีวิตแล้ว, บุพภาค = ส่วนเบื้องต้น, บุพเวเทห์ = ชื่อทวีปใหญ่ทั้ง ๔"
บุพพ,ว.,"ก่อน, ทีแรก, เบื้องต้น, ทิศตะวันออก, เช่น บุพกรรม = กรรมเก่า, บุพการี = บิดา, มารดา บุพกิจ = กิจที่ต้องทำก่อน, บุพนิมิต = ลางบอกเหตุ, บุพบท คำที่อยู่หน้านาม เช่น ใน ซึ่ง อัน สู่ บุพเปตพลี = อุทิศบุญให้แก่ญาติผู้เสียชีวิตแล้ว, บุพภาค = ส่วนเบื้องต้น, บุพเวเทห์ = ชื่อทวีปใหญ่ทั้ง ๔"
