คำ,POS,ความหมาย
งก ๑,น.,ไม่รูปคล้ายตะลุมพุกสำหรับควาญท้ายตีช้างเมื่อต้องการให้ช้างไปเร็ว หรือในเวลาคล้องช้าง เรียกว่า ไม้งก
งก ๒,ก.,แสดงอาการอยากได้ หรือไม่อยากเสียจนเกินควร
งก ๓,ว.,"ปิด, ไม่ตรง"
งก ๆ,ว.,อาการผงกหัวขึ้นลง เช่น กะปอมสั่นหัวมก ๆ
งก ๆ,ว.,"มีอาการสั่นอย่างคนแก่ หรืออย่างกลัวหรืออย่างหนาวมากกว่า สั่นงก ๆ ใช้สำหรับสิ่งใหญ่, ถ้าสิ่งเล็กว่า ง็อก ๆ"
งก ๆ งัก ๆ,ว.,อาการสั่นที่เกิดจากความหนาว เป็นต้น ใช้สำหรับคนหรือสัตว์ขนาดใหญ่ ถ้าขนาดเล็กว่า วัก ๆ
งง ๑,ก.,"คิดไม่ออก, ฉงน"
งง ๒,ว.,"กง, งอน, แอ่น, ส่วนมากว่า โงง"
งงงวย,ก.,"เคลิบเคลิ้ม, หลงไหล"
งด,ก.,"หยุดหรือเว้น, ส่วนมากว่า โจะ"
งด ๆ,ว.,"หนาวจนสั่น, อาการที่สะท้าน, เช่น สั่นหงด ๆ"
งบ ๑,น.,"จำนวนที่รวมแล้ว, กำหนดหรือประมาณการที่ตั้งเป็นรายรับ หรือรายจ่าย อย่างงบเงินรายรับ งบเงินรายจ่าย เป็นต้น"
งบ ๒,ก.,"ปิด, รวม"
งม,ก.,ควานหาของในน้ำหรือในที่มืด
งมงมซาวซาว,สำ.,"ลองผิดลองถูก, ทำโดยไม่สันทัด, ไม่ชำนาญ, ทำสุ่มไป, ทำอย่างงก ๆ เงิ่น ๆ"
งมงมทาวทาว,สำ.,"ลองผิดลองถูก, ทำโดยไม่สันทัด, ไม่ชำนาญ, ทำสุ่มไป, ทำอย่างงก ๆ เงิ่น ๆ"
งมงำ,สำ.,เอาใจใส่
งวก,ก.,"ผิน, หันขวับ, เช่น งวกซ้ายแลขวา"
งวก,ก.,"หัน, ผินอย่างเร็ว"
งวง ๑,น.,ส่วนที่ยื่นโค้งเป็นวงสำหรับหิ้ว หรือถือสิ่งของอย่างตะกร้า เป็นต้น เช่น งวงคุ
ง้วง ๑,น.,แมลงชนิดหนึ่งในจำพวกจักจั่นแต่ตัวใหญ่กว่า ปีกยาว โปร่งแสง ตัวสีน้ำตาล หัวเขียว ๆ ตาแดง
งวง ๒,น.,"จมูกของช้างที่ยื่นยาวออกไป ตรงปลายมีจะงอยสำหรับจับของอย่างมือ, เรียกสิ่งที่ห้อยเป็นงวงออกมาจากคอตาลมะพร้าว เป็นต้นว่า งวง เช่น งวงตาล, งวงมะพร้าว, เรียกสิ่งที่่มีลักษณะคล้ายคลึงเช่นนั้น เช่น งวงครุ, งวงผีเสื้อ"
ง้วง ๒,ก.,อาการที่ร่างกายอ่อนเพลีย อยากนอนหลับ = ง่วง
ง้วงกลางดง,น.,งูชนิดหนึ่งคล้ายงูเขียว แต่ตัวเล็กและยาวกว่าเลื้อยตามพุ่มไม้อย่างเชื่องช้ากว่างูชนิดหนึ่งอื่น
ง้วงเงี้ยง ๆ,ว.,"อาการเลื้อยคดไปมาช้า ๆ อย่างงูถูกตีสันหลังเดาะ, สำหรับขนาดเล็กว่าง้องแง้ง ๆ"
งวงช้าง,น.,พืชล้มลุกชนิดหนึ่ง มีดอกสีขาว ช่อของดอกมีสัณฐานคล้ายงวงช้าง
ง่วงเหงา,ว.,"อาการเศร้าซึม, เหงาหงอย, โศกเศร้า"
งวด ๑,น.,คราวที่กำหนด
งวด ๒,น.,"ลดลงไป, พร่องลงไป, แห้งลงไป"
งวด ๓,ว.,จวนแจ้ง
ง้วน ๑,น.,เศษละอองดอกไม้ที่สัตว์จำพวกผึ้ง หรือชันโรงนำมาสะสมและกลั่นเป็นน้ำหวานแล้ว
ง้วน ๒,น.,ต้นไม้ชนิดหนึ่ง ยางมีพิษ ใบเหมือนใบเงิน ดอกสีแดง ต้นคล้ายต้นสลอด
ง้วน ๓,น.,ยาพิษ เช่น เอาง้วนใส่ปลา เอายาใส่เข้า (ให้กิน)
ง้วนดิน,น.,ดินที่มีกลิ่นหอม รสมัน กินได้
ง้วนหมู,น.,ไม้เถาชนิดหนึ่ง มียางขาวเป็นพิษ ใบมนหรือรูปไข่ปลายแหลม ฐานใบเว้าหรือป้านออกเป็นคู่ตรงข้ามกันตามลำต้นดอกสีเขียวอ่อนเป็นพวงกลม ใช้ทำยา
งวม,ก.,"คว่ำ, ครอบ, ปิด, ส่วนมากว่า งุม"
ง่วม,ว.,งองุ้มลง เช่น ควายเขาง่วม ควายเขางุ้ม
งวาก,ก.,"ผิน, หันขวับ, เช่น งวกซ้ายแลขวา"
งวาก,ก.,"หัน, ผินอย่างเร็ว"
งว้าง,?,ดู ง้วง
งว้างกลางดง,น.,งูชนิดหนึ่งคล้ายงูเขียว แต่ตัวเล็กและยาวกว่าเลื้อยตามพุ่มไม้อย่างเชื่องช้ากว่างูชนิดหนึ่งอื่น
งวำ,ก.,"กลับ, คว่ำ, ครอบ (ดูงำ)"
งวำ,ก.,"ปกปิด, ไม่แพร่งพราย, มักใช้คู่เป็น ปิดงำ, ครอบงำ, เงื่อนงำ"
ง้อ,ก.,"ขอคืนดีด้วย, ขอพึ่งพาอาศัย, สนใจ, เอาใจใส่"
งอ ๑,น.,กีฬาในน้ำชนิดหนึ่ง ซึ่งผู้เล่นงอนิ้วมือเป็นสัญญาณให้อีกฝ่ายหนึ่งไล่แล้วดำน้ำหนี ถ้าไล่ทันถือว่าแพ้ มักเล่นในที่น้ำลึก
งอ ๒,ว.,"ลักษณะที่มีส่วนปลายหักโค้งเข้าหาตัวมันเอง เช่น รูปอย่างขอ, เรียกลักษณะที่ทำหน้าแสดงอาการไม่พอใจ คิ้วขมวดว่า หน้างอ"
งอก ๑,ก.,"อาการที่เมล็ดผลไม้แตกเป็นต้นขึ้น ผลิดอก, แตกออก, แตกหน่อ"
งอก ๒,ว.,"คด, งอ ใช้เฉพาะแขนอย่างเดียว เช่น แขนงอกแขนคอก"
ง็อก ๆ,ว.,อาการผงกหัวขึ้นลง เช่น กะปอมสั่นหัวมก ๆ
งอกแงก ๑,ก.,โยกคลอนไปมา
งอกแงก ๒,ว.,"อ่อน, ไม่แน่น, ไม่มั่นคง, ง่อนแง่น"
งอง,ก.,"คอย, รอท่า"
งอง,ก.,คอย
งอง,ก.,ลอยขึ้นเหนือน้ำเพราะอ่อนกำลังใช้สำหรับปลา หรือกุ้งที่เมาน้ำ หรือเมาแดดแล้วลอยเป็นแพบนผิวน้ำ
ง่อง,ก.,คอย
ง้อง,ว.,งองุ้มลง เช่น ควายเขาง่วม ควายเขางุ้ม
ง่อง ๑,ก.,คอยอย่างในจดจ่อ
ง้อง ๑,น.,เหล็กแหลมงอ มีด้ามถือใช้แกว่งครูดในโคลนเพื่อจับปลาหลด
ง่อง ๒,ว.,เศร้าซึม
ง้อง ๒,*น.,เหล็กงอมีด้ามถือหรือผิวไม้ไผ่ใช้สำหรับขูดมะพร้าวแตง หรือผลไม้อื่นให้เป็นเส้นยาว เช่น ง้อขูดหมากพร้าว กระต่ายขูดมะพร้าว
ง้อง ๓,ว.,"คดงอ, สำหรับสิ่งใหญ่ว่า โง้ง"
ง้องแง้ง,น.,"ลูกอ่อนของยุงที่ยังอาศัยอยู่ในน้ำเมื่อแก่เข้าหลุดจากปลอกเป็นยุงเรียกแมงง้องแง้ง = ลูกน้ำ, บางถิ่นเรียก แมงดุกดิก"
ง้องแง้ง ๆๆ,ว.,"อาการเคลื่อนไหวคดไปงอมาอย่างลูกน้ำหรือเลื้อยคดไปงอมาอย่างไส้เดือนหรืองูตัวเล็ก ๆ , สำหรับขนาดใหญ่ว่า โง้งเง้ง ๆ"
ง้องแง้งไฟ,น.,เขม่าที่ติดอยู่ตามหิ้งบนเตาไฟ
ง้องแง้งหิ้ง,น.,เขม่าที่ติดอยู่ตามหิ้งบนเตาไฟ
ง้องแง้งหิ้ง,น.,เขม่าไฟเกาะติดกันเป็นกลุ่มตามหญ้า หรือเชือกในครัวหรือใกล้เตาไฟ = สมอร่องแร่ง
ง้องอน,ว.,ขอคืนดีด้วยโดยไม่มีทิฐิมานะถือโกรธ
งอแง้ว,น.,"พืชที่มีมือเกาะประเภทแตงกวา, แตงร้าน"
งอด ๑,น.,แมลงป่อง
งอด ๒,น.,งูเล็ก ๆ ชนิดหนึ่ง เรียก งูงอด
งอด ๓,ว.,อาการแสดงสีหน้าไม่พอใจ คิ้วขมวด เรียกว่า หน้างอด หรือ หน้าเง้าหน้างอด
ง้อน,น.,หางไถตอนที่มือถือ หางยาม
งอน ๑,น.,"ส่วนปลายแห่งของบางอย่างที่รูปยาวเรียวและช้อยขึ้น เช่น งอนไถ, ควายบักงอน เป็นต้น"
ง่อน ๑,น.,ท้ายทอย
งอน ๒,ว.,"ช้อยขึ้น, โง้งขึ้น, โป่งยื่นออกมา, สำหรับขนาดใหญ่ว่าโงน"
ง่อนง่อ,ก.,"คู้ตัวหรืองอตัวเข้า หรือห่อตัวเข้า, เป็นอาการของคนที่กลัวมาก หรือหนาวมาก เป็นต้น"
ง่อนด้น,น.,ท้ายทอย
ง่อนต่อ,น.,ส่วนของศีรษะบริเวณเหนือตีนผมด้านหลังหรือท้ายทอย
ง้อนไถ,น.,หางไถตอนที่มือถือ หางยาม
ง้อนหมู,น.,ชื่อไม้ล้มลุกมีหัวชนิดหนึ่ง หัวมีกลิ่นฉุนใช้ทำยาได้ หมูชอบกิน
งอบ,น.,"เครื่องสวมหัวสำหรับแดดและฝน สานด้วยตอก ไม้ไผ่ กรุด้านนอกด้วยใบลาน รูปคล้ายกระจาดคว่ำ มีรังสำหรับสวม, ส่วนมากว่า กุบ"
งอบ ๆ,ว.,"อาการเคลื่อนไปของสัตว์ที่มีกระดองแข็ง ครอมบางชนิด เช่น ปู หรือเต่า ใช้ว่า ไต่งอบ ๆ หรือ คลานงอบ ๆ ใช้สำหรับขนาดเล็ก ขนาดใหญ่ว่า โงบ ๆ, ปลาตัวโต ที่ลอยเหนือน้ำจนเห็นหัว และสันหลังเพราะอ่อนกำลัง เรียกว่า งอมโงบ ๆ"
ง่อม,ว.,"ค่อม, โกง, ใช้สำหรับหลังว่าหลังง่อม = หลังค่อม"
ง้อม,ว.,"ง้ำ, ค่อม, ค้อม, งาม"
งอม ๑,ก.,ลอยขึ้นเหนือน้ำเพราะอ่อนกำลังใช้สำหรับปลา หรือกุ้งที่เมาน้ำ หรือเมาแดดแล้วลอยเป็นแพบนผิวน้ำ
งอม ๒,ว.,"สุดจัดจนเกือบเน่าหรือเละโดยปรยายหมายความว่าแย่, บอบช้ำ หรือได้รับทุกข์ทรมานมาก"
งอม ๆ ๑,ว.,"อาการเดินหรือไต่ของคนหรือของสัตว์ตัวเล็ก ๆ หรือใหญ่แต่อยู่ในระยะไกลว่า ย่างงอม ๆ (เอก.), งอม ๆ แงม ๆ (พหู.), ถ้าตัวใหญ่และเห็นในระยะใกล้ว่า โงม ๆ (เอก.), โงม ๆ เงม ๆ (พหู.)"
งอม ๆ ๒,ว.,ลักษณะการกระทำที่ต่อเนื่อง เช่น เฮ็ดเวียกอยู่งอม ๆ
ง่อมเงาะ,ว.,"งอ, คด, ใช้สำหรับสิ่งของหรือกิ่งไม้ว่า งอง่อมเงาะ"
งอย,ก.,"เกาะ, จับ, นั่ง, ห้อย, ส่วนมากใช้สำหรับสัตว์จำพวกนก"
ง่อย,ก.,อาการที่แขนหรือขาพิการเคลื่อนไหวไม่ได้อย่างปกติ
งะ,ก.,"ถ่างออก, ง้างออก"
งัก ๆ,ว.,อาการสั่นด้วยความหนาว
งัก ๆ,ว.,อาการที่สั่นสะท้านจนขากรรไกรกระทบการ
งักแง้น,น.,"อาการสั่นไปมา, อาการชักดิ้นชักงอ"
งัง,ว.,"งอ, ใช้สำหรับนิ้วมือว่า มืองัง"
งัง ๆ,ว.,"อาการที่เดินโดยด่วน, อาการเห่าของหมาเสียงเล็ก"
งัด,ก.,"ทำให้เผยอ หรือเคลื่อนที่โดยใช้วัตถุยาวคัด เช่น งัดตะปู, งัดซุง"
งัน ๑,น.,ข้าวหนัก
งัน ๒,ก.,"ทำให้เอิกเกริก, สมโภช, ฉลอง"
งัน ๓,ก.,"หยุดชะงัก, จังงัง, ไม่งอกงาม"
งัน ๔,ว.,"อึดทึก, อึงมี่"
งันกำ,ก.,การชุมนุมแสดงความยินดีแก่พ่อแม่ที่ได้ลุกใหม่
งันเฮือนดี,ก.,การชุมนุมละเล่นกันที่บ้านคนตายในเวลากลางคืน เพื่อเป็นเพื่อนญาติผู้ตาย
งับ ๑,น.,มีดพับได้ชนิดหนึ่ง เรียก มีดงับ = มีดพับ
งับ ๒,ก.,"ปิดอย่างไม่สนิท หรือปิดอย่างไม่ลงกลอน, อาการที่อ้าปาก คาบหรือกัดโดยเร็ว"
งับ ๆ,ว.,ทำปากงับ ๆ
งับขั้นได,ก.,พาดบันไดกับตัวเรือน
งับแงบ,น.,กรับ
งัว (โบ) ๒,น.,ลูกชายคนที่ห้า
งัว ๑,น.,"วัว, โค, บางถิ่นเรียก มอ"
งัว ๆ เงีย ๆ,ว.,อาการง่วง ๆ งง ๆ เพราะนอนไม่เต็มตื่น
งัวงามคู่,สำ.,"เสมอกัน, เท่าเทียมกัน, ทัดเทียมกัน, เข้ากันได เหมาะเจาะ"
งัวเงีย,ก.,อาการคนแรกตื่นยังง่วงอยู่
งัวชัง,น.,ชื่อไม้พุ่มชนิดหนึ่ง ลำต้นมีหนามโค้ง ดอกสีชมพู
งัวต่าง ๑,น.,วัวบรรทุกต่าง
งัวต่าง ๒,น.,การเล่นอย่างหนึ่งของเด็ก เป็นการเอาอย่างโคต่างคือให้คนหนึ่งคลาน อีกสองคนอยู่คนละข้าง ใช้ขาเกี่ยวกันพาดบนหลังคนคลาน แล้วคลานไปถึงจุดที่กำหนด
งัวโทน,น.,วัวถึก หรือโคเพลาะ (วัวที่โดดเดี่ยว)
งัวบา,น.,วัวป่า เพศผู้
งัวพอน,น.,วัวสีขาว
งัวแพว,น.,วัวสำรองไว้สำหรับเปลี่ยนตัวอื่น เวลาเดินทางไกล
งัวมอ,น.,ลูกวัว
งัวเลีย,น.,พืชล้มลุกชนิดหนึ่ง มีดอกสีขาว ช่อของดอกมีสัณฐานคล้ายงวงช้าง
งัวเลีย,น.,ชื่อไม้พุ่มชนิดหนึ่ง ลำต้นมีหนามโค้ง ดอกสีชมพู
งัวเลีย ๑,น.,เรียกผมที่หน้าผากซึ่งตั้งขึ้นไปแล้วปลายย้อนกลับลงมา
งัวเลีย ๒,น.,ชื่อไม้พุ่มชนิดหนึ่ง ลำต้นมีหนามโค้ง ดอกสีชมพู
งัวอิน,น.,ชื่อลูกชายคนที่ห้าในวรรณกรรมเรื่องขุนบรม
ง่า,น.,"กิ่ง, แขนง, ค่าคบไม้, ใช้สำหรับต้นไม้ว่า, ง่าไม้, ง่าเค้า, ง่าพราก หรือง่าภาค = ค่าคบ"
งา ๑,น.,"ชื่อไม้ล้มลุกชนิดหนึ่ง ผลเป็นฝักมีเมล็ดเล็ก ๆ ชนิดเม็ดสีขาวเรียก งาด่อน หรืองาขาว ชนิดเมล็ดสีดำ เรียกงาดำ, ใช้ประกอบอาหาร หรือสกัดน้ำมัน"
งา ๒,น.,ฟันที่งอกออกจากปากช้างพลาย ลักษณะนามเรียก กิ่ง
งา ๓,น.,ส่วนหนึ่งของเครื่องดักสัตว์ เช่น ลอบ หรือไซทำเป็นซี่ ๆ ปลายสอบเข้าหากันเพื่อไม่ให้ปลาที่เข้าไปแล้วออกมาได้
งาก ๆ,ว.,มีเสียงดังเช่นนั้น เช่น ไห้งาก ๆ = ร้องไห้โฮ ๆ
ง้าง,ก.,"เหนี่ยวให้อ้าออก, งัดออก, ดึงออก"
งาด,ก.,ซา หรือ ทิ้งช่วง (ใช้แก่ฝน)
งาน ๑,น.,สิ่งหรือเรื่องที่ทำ
งาน ๑,น.,การพิธีหรือการรื่นเริงที่คนมาชุมนุมกัน
งาน ๒,น.,มาตราวัดเนื้อที่เท่ากับร้อยตารางวา หรือสี่ร้อยตารางเมตร
งาน ๓,น.,"พื้นที่นาซึ่งมีคันกั้นโดยรอบ, ส่วนมากว่า ไฮ่"
งาน ๔,ก.,"ระราน, ข่มเหง, ก่อวิวาท, แกล้งทำให้ผิดใจ, ดื้อ"
งาบ ๆ,ว.,อาการที่อ้าปากแล้วหุบเข้าช้า ๆ เป็นอาการของคน และสัตว์ที่จวนจะตาย
งาม,ว.,ลักษณะที่เห็นแล้วชวนยินดี ชวนพึงใจ
ง่าม ๑,น.,ลักษณะหรือสิ่งแยกออกเป็น ๒ หรือ ๓ เป็นต้น
ง่าม ๒,น.,ชื่อมดขนาดเล็กชนิดหนึ่ง มีสีน้ำตาลแก่จนเกือบดำตลอดตัว อยู่กันเป็นฝูงใหญ่ ๆ มีกรามเห็นเป็นง่ามใหญ่
ง่ามขาคน,น.,ไม้ง่ามสำหรับฝังเป็นประตูรั้วให้คนเข้าออกได้ โดยไม่ต้องปิดเปิด ใช้กันวัวควายเข้าออกได้
งามแงบ,ว.,"เหลือเฟือ, เหลือล้น"
ง่ามแดง,น.,มดชนิดหนึ่ง
งามถ่อ,น.,ลักษณะหัวที่มีผมเถิกเข้าไป เป็น ๒ แฉกเหมือนง่ามถ่อ
งามปลอด,ว.,งามไม่มีที่ติ
งามป่อยล่อย,ว.,ลักษณะใบหน้างาม ขาวเป็นรูปไข่
งามปิ่นวิ่น,ว.,ลักษณะใบหน้างามรูปไข่ ประกอบด้วยท่าทางงดงาม
งามเปิ่นเวิ่น,ว.,ลักษณะใบหน้ากว้างกลมเหมือนพระจันทร์เต็มดวง
งามแป่นแว่น,ว.,ลักษระใบหน้าแบบเรียบเหมือนดอกบัวบานบนผิวน้ำ
งามย้อย,ว.,ลักษณะงามอย่างสง่า
งามเลิด,ว.,งามอย่างลึกซึ้ง
งามหน้า,ว.,น่าขายหน้า
งามอาด,ว.,"น่ารัก, สวยงาม"
งามอาดหลาด,ว.,ลักษณะผิวขาวงาม สูงและได้สัดส่วน
งามอ่ำท่ำ,ว.,ลักษณะงาม ดำขำ
งามอี่หลี,ว.,ลักษณะงามแท้
งาย,น.,เวลาอาหารเช้า ตาปกติราว ๗.๐๐ - ๙.๐๐ น.
ง่าย,ว.,"สะดวก, ไม่ยาก"
งายแก่,น.,"เวลาอาหารเช้าที่สายมาก, ประมาณ ๙.๐๐ - ๑๐.๐๐ น. ถ้าสายมากกว่านี้ว่างายเงิก หรืองายตาเหลือก"
