มายคีง,ว.,ร่างกายเริ่มอ้วน
มายา,น.,"มายา, การลวง, การแสร้งทำ, เลห์กล"
ม้าย้า,ว.,ลักษณะแตกเป็นรอยกว้างและลึก
มายากล,ก.,"การแสดงออก, การเล่นกล"
มายาวี,น.,"ผู้มีมารยา, ผู้มีเลห์เหลี่ยมทำให้ลุ่มหลง, เจ้าเลห์ (ป., ส.)"
มาร,น.,"เทวดาจำพวกหนึ่ง มีใจบาปหยาบช้าคอยกีดกันไม่ให้ทำบุญ, ยักษ์ ในพระพุทธศาสนาหมายถึงผู้กีดกันบุญกุศล มี ๕ อย่าง เรียกว่า เบญจพิธมาร คือ ขันธมาร กิเลสมาร อภิสังขาารมาร มัจจุมาร เทวบุตรมาร โดยปริยายหมายถึง ผู้ที่เป็นอุปสรรคขัดขวาง (ป., ส.)"
มาร-,น.,"เทวดาจำพวกหนึ่ง มีใจบาปหยาบช้าคอยกีดกันไม่ให้ทำบุญ, ยักษ์ ในพระพุทธศาสนาหมายถึงผู้กีดกันบุญกุศล มี ๕ อย่าง เรียกว่า เบญจพิธมาร คือ ขันธมาร กิเลสมาร อภิสังขาารมาร มัจจุมาร เทวบุตรมาร โดยปริยายหมายถึง ผู้ที่เป็นอุปสรรคขัดขวาง (ป., ส.)"
มารค,น.,"ทาง เช่น สถลมาคร (ป., ส.)"
มารดร,น.,แม่
มารดา,น.,แม่
มารผจญ,ก.,มารยกทัพมารบ โดยปริยาย หมายความว่า ขัดขวางไม่ให้สำเร็จประโยชน์
มารยา,น.,"มายา, การลวง, การแสร้งทำ, เลห์กล"
มารยาท,น.,"มารยาท, กิริยาวาจาที่ถือว่าเรียบร้อย (ป., ส.)"
มารวิชัย,น.,"ผู้มีชัยแก่มารคือ พระพุทธเจ้า, เรียกพระพุทธเจ้าปางชนะมารว่า พระมารวิชัย คือประปางนั่งขัดสมาธิ พระหัตถ์ขวาลาดพระเพลา เรียกผิดเพี้ยนไปเป็นพระปางสะดุ้งมารก็มี"
มารวิชิต,น.,"ผู้มีชัยแก่มารคือ พระพุทธเจ้า, เรียกพระพุทธเจ้าปางชนะมารว่า พระมารวิชัย คือประปางนั่งขัดสมาธิ พระหัตถ์ขวาลาดพระเพลา เรียกผิดเพี้ยนไปเป็นพระปางสะดุ้งมารก็มี"
มารศรี,น.,"นาง, นางงาม"
มารสังคม,น.,ผู้เป็นภัยต่อสังคม
มาราธิราช,น.,พญามาร
ม้าเร็ว,น.,คนขี่ม้าซึ่งกองทัพจัดไว้สำหรับสืบเหตุการณ์ข่าวคราวของข้าศึกแล้วต้องรีบมาแจ้งแก่เจ้าหน้าที่ผู้ใหญ่ของตน
มาลัย,น.,ดอกไม้ที่ร้อยเป็นพวง
มาลา,น.,ดอกไม้
มาลา,น.,หมวก
มาลา,น.,สร้อยคอ
มาลา,น.,"สาย, แถว"
ม้าลาย,น.,ม้าประเภทหนึ่ง มีลายสีดำขาวพาดขวางลำตัวตัดกัน
มาลี ๑,น.,"ผู้แต่งด้วยพวงดอกไม้, เพศหญิงใช้ มาลินี (ป., ส.)"
มาลี ๒,น.,ดอกไม้ทั่วไป
ม้าว,น.,"กำไรต้นแขน, พาหุรัด"
ม่าวม่าว,ว.,เสียงร้องดังอย่างนั้นของแมว หรือเสือโคร่ง
มาศ,น.,ทองคำ
มาส,น.,"พระจันทร์, เดือน (ป., ส.)"
มาสก,น.,"มาตราเงินในครั้งโบราณ ห้ามาสกเป็นหนึ่งบาท (ป., ส.)"
ม้ำ,ก.,เม้ม เช่น มุ้มปาก
มำมำ,ว.,"ซ้ำซาก, บ่อย เช่น จ่มมำมำ = บ่นซ้ำซาก"
มิ,ว.,ไม่
มิกกิ๊ก,ว.,ลักษณะอ้วนเตี้ยม่อต้อขนาดเล็ก
มิค-,น.,สัตว์ป่ามีกวาง อีเก้ง (ป.)
มิคลุทกะ,น.,"พรานเนื้อ, คนที่เที่ยวฆ่าสัตว์ป่าเป็นอาชีพ (ป.)"
มิคลุทะ,น.,"พรานเนื้อ, คนที่เที่ยวฆ่าสัตว์ป่าเป็นอาชีพ (ป.)"
มิคสัญญี,น.,ยุคหนึ่งที่มีแต่รบราฆ่าฟันเบียดเบียนกัน (ป.)
มิคสิระ,น.,"ดาวฤกษ์ดวงที่ ๕, เดือนที่ ๑ แห่งจันทรคติ, เดือนอ้าย ตกราวเดือน ธันวาคม (ป.)"
มิคะ,น.,สัตว์ป่ามีกวาง อีเก้ง (ป.)
มิคี,น.,"แม่เนื้อ, นางเนื้อ (ป.)"
มิ่ง ๑,น.,สิ่งที่เป็นสิริมงคล
มิ่ง ๒,ว.,เสียงดังในหูเวลาถูกตบหู หรือเวลาลมออกหู
มิ่ง ๓,ว.,"สลดวูบ, หน้ามืด"
มิ้งกิ้ง,ว.,"ลักษณะสิ่งของที่กลม หรือมนใหญ่ เช่น มึนตาม้งก้ง = เบิกตากว้าง, ถ้าขนาดเล็กว่า ม้องก้อง, ขนาดจิ๋วว่า มิ้งกิ้ง"
มิ่งขวัญ,น.,สิ่งหรือผู้เป็นที่รักหรือเคารพนับถือ
มิ่งมิตร,น.,"เพื่อนรัก, เมียรัก"
มิจฉา,ว.,"ผิด (ป., ส.)"
มิจฉากัมมันตะ,น.,ประพฤติการอันผิด (ป.)
มิจฉาชีพ,น.,การหาเลี้ยงชีวิตไปในทางผิด (ป.)
มิจฉาทิฐิ,น.,ความเห็นผิดทางธรรม (ป.)
มิจฉาวาจา,น.,ประพฤติวจีทุจริต (ป.)
มิจฉาวายามะ,น.,ความพยายามผิด (ป.)
มิจฉาสติ,น.,ความระลึกในทางผิด (ป.)
มิจฉาสมาธิ,น.,"สมาธิผิด, ความตั้งใจผิด (ป.)"
มิจฉาสังกัปปะ,น.,ความดำริในทางผิด (ป.)
มิจฉาอาชีวะ,น.,การเลี้ยงชีพในทางผิด
มิด,ว.,"สงัด, ไม่มีเสียง"
มิด,ว.,"เงียบ, สงัด, นิ่ง, ไม่มีเสียง"
มิดจ้อย,ว.,เงียบกริบ
มิดจั๊ด,ว.,เงียบกริบ
มิดจันลัน,ว.,เงียบสนิท
มิดจี่ลี่,ว.,เงียบสนิท
มิดช้อยม้อย,ว.,"เงียบหงอย, เงียบเหงา"
มิดแมด,ว.,อาการที่มองเห็นเพียงแวบเดียว เช่น เห็นพอลิดแลด
มิดออนชอน,ว.,"เงียบหงอย, เงียบเหงา"
มิดอ่อยช้อย,ว.,"เงียบหงอย, เงียบเหงา"
มิตร,น.,"เพื่อนรักใคร่คุ้นเคย (ป., ส.)"
มิตร-,น.,"เพื่อนรักใคร่คุ้นเคย (ป., ส.)"
มิตรจิต,น.,ความมีน้ำใจเอื้อเฟื้อเสมือนเพื่อนรัก
มิตรภาพ,น.,ความเป็นเพื่อนรัก (ส.)
มิตรสหาย,น.,เพื่อนฝูง
มิถุน,น.,"กลุ่มดาวราศีที่ ๓ (ป., ส.)"
มิถุนายน,น.,เดือน ๖ ตามสุริยคติซึ่งขึ้นต้นด้วยเดือนมกราคม มี ๓๐ วัน
มิทธะ,น.,"ความท้อแท้, ความเซื่องซึทม (ป., ส.)"
มิ้ม ๑,น.,ผึ้งขนาดเล็ก อาศัยอยู่รวมกันเป็นกลุ่ม ทำรังในที่โล่งแจ้งเป็นแผ่นเดี่ยว ๆ เมื่อเลี้ยงลูกโตแล้วจะทิ้งรังไปหาที่ใหม่ต่อไป
มิ้ม ๒,ก.,"เม้ม, ปิดริม, พับริม เช่น มิ้มปาก, มิ้มผ้า"
มิลักขะ,น.,คนป่าเถื่อน (ป.)
มิสกะ (มิดสะ-),ก.,"เจือ, ปน, คละ"
มี้,น.,"ไม้ต้นประเภทหนึ่ง มี ๓ ชนิด คือ หมากมี้ฝ้าย, หมากมี้หนัง, หมากมี้น้ำเผิง = ขนุน"
มี ๑,ก.,"ถือเป็นเจ้าของ, กอบด้วย, เป็น, ปรากฎ, เกิด, คงอยู่"
มี ๒,ว.,"ไม่, มิ"
มี ๓,ว.,"รวย, มั่งคั่ง"
มีแก่ใจ,ก.,"เอาใจเอื้อเฟื้อเผื่อแผ่, มีน้ำใจ"
มีชื่อ,ว.,มีเกียรติยศชื่อเสียง
มีชู้,ก.,มีคู่รัก
มีเซีย,น.,"ตะไกร, กรรไกร"
มีด,น.,"เครื่องสำหรับฟัน, ผ่า, จัก, เหลา ฯลฯ มีหลายชนิด เช่น มีดขอ หรือ ปะขอ = พร้าขอ, มีดซุย = มีดพก, มีดแถ = มีดโกน, มีดตัด, มีดกะไต หรือ มีดเซีย = กรรไตร, กรรไกร, มีดสะนาก = มีดผ่าหมาก"
มีดตัด,น.,กรรไกร
มีดตัด,น.,"ตะไกร, กรรไกร"
มีน,น.,"ปลา, กลุ่มดาวราศีที่ ๑๒ (ป., ส.)"
มี่นัน,ว.,อื้ออึง
มีนาคม,น.,เดือนที่ ๓ ตามสุริยคติ ซึ่งขึ้นต้นด้วยเดือนมกราคม มี ๓๑ วัน
มี้เพ็ง,น.,วันขึ้น ๑๕ ค่ำ
มีหน้ามีตา,ว.,"มีคนนับถือ, มีเกียรติ, ได้รับความยกย่อง"
มีเฮือน,ว.,"มีครอบครัว, แต่งงานแล้ว"
มึก,ว.,ดำ = หมึก เช่น น้ำมึก
มึง,ส.,สรรพนามบุรุษที่สอง
มึด,ว.,"มาก, ปี๋ เช่น ดำมึด"
มึน ๑,น.,โรคเหน็บชา
มึน ๒,ว.,"ชา, เป็นเหน็บ"
มึน ๓,ว.,"หน้าด้าน, ทนทาน, ไม่อาย"
มึนเซีย,น.,ความรู้สึกชาตามอวัยวะต่าง ๆ เนื่องจากฤทธิ์สุรา หรือโรคเหน็บชา
มึนทึน,ว.,"หน้าด้าน, ทนทาน, ไม่อาย"
มึบมับ,ว.,อาการปวดหนึบ ๆ
มึย,ก.,"คลี่ออก, ขยายออก, คลาย มลาย"
มึย,ว.,"เกือบ, จวนเจียน"
มืด,ว.,"ขาดแสงสว่าง, มีแสงสว่างน้อย"
มืดค่ำ,น.,เวลาพลบค่ำขมุกขมัว
มืดซุ้มล้าว,น.,เวลาพลบค่ำขมุกขมัว
มืดแปดด้าน,ก.,"ไม่รู้เรื่อง, ไม่เข้าใจ, จนปัญญา"
มืดลืด,ว.,เกรอะกรัง
มืดหน้า,ว.,เวียนหัวมัวตาดูอะไรพร่าไปหมด
มืดอื้อตื้อ,ว.,มืดมิด
มืน,ก.,"ลืม, เปิด, แย้ม (ใช้กับตา) เช่น มืนตา = ลืมตา โบราณว่า มลืน"
มื่น ๑,น.,ต้นปอชนิดหนึ่ง ฝักเป็นเมือก = กระเจี๊ยบ
มื่น ๒,ก.,ลื่น โบราณว่า มลื่น
มืนลืน,ว.,อ้วนท้วนน่ารัก
มืย,?,ดู มาย
มืย,ว.,เสียงร้องเวลายิง หรือฟัดเฉียดไป
มือ,น.,อวัยวะส่วนหนึ่งของร่างกายอยู่ต่อแขน สำหรับจับ
มื้อ ๑,น.,"วัน, เวลา"
มื้อ ๒,น.,ลักษณะนามของวัน เช่น สองมื้อสามมื้อ
มื้อก่อน,น.,วันซืน
มื้อตึ่ง,น.,วันถัดไปจากวันมะเรื่อง
มื่อตื่น,น.,วันถัดไปจากวันมะเรื่อง
มื้อแถ,น.,วันโกน
มือนาง,น.,ส้อม เช่น ช้อนมือนาง = ช้อนส้อม
มื้อนี้,น.,วันนี้
มือลิง,น.,"ไม้สำหรับติดข้างในเรืออยู่ระหว่างกง หรือ ต่อจากกง, ส้อมคู่กับช้อน"
มื้อวาน,น.,วันวาน
มื้อเว็น,น.,กลางวัน
มือไว,ว.,ขี้ขโม
มือเสือ,น.,ไม้สำหรับคุ้ยตะกุยสิ่งต่าง ๆ
มือเสือ,น.,ชื่อมันชนิดหนึ่ง
มือหนัก,ว.,อาการที่ใช้มือทำอะไรอย่างรุนแรง หรือไม่ประณีตบรรจง
มื้อหนึ่ง,น.,มะเรื่อง
มื้ออื่น,น.,พรุ่งนี้
มื้อฮือ,น.,มะรืน
มุ ๑,ก.,"ประคบ, ทุบเบา ๆ"
มุ ๒,ก.,มุ่งเอาจริงจังไปทางเดียว
มุ ๆ สี ๆ,ว.,"ไม่โลดโผน, ไม่ชอบเอาเรื่อง"
มุก ๑,น.,หอยทะเลกาบคู่อยู่ตามแนวปะการังให้ไข่มุกและมุกซีก
มุก ๒,น.,กล้วยชนิดหนึ่ง เรียกกล้วยมุก = กล้วยหักมุม
มุก ๓,ว.,"อ้วน, ล่ำ, อวบ ใช้กับสิ่งของ"
มุกดา,น.,"ไข่มุก, ชื่อรัตนะอย่างหนึ่งในพวกนพรัตน์สีหมอกอ่อน ๆ (ส., ป.)"
มุกดาหาร ๑,น.,สร้อยไข่มุก
มุกดาหาร ๒,น.,จังหวัดหนึ่งในภาคตะวันออกเฉียงเหนือ
มุข ๑,น.,"หน้า, ปาก, ทาง, หัวหน้า, ส่วนของตึกหรือเรือนที่ยื่นออกมาจากส่วนใหญ่ อยู่ด้านหน้า (ป., ส.)"
มุข ๒,ก.,"ปั้นเรื่องขึ้น, พูดความจริง"
มุง,ก.,เอาวัตถุมีกระเบื้องหรือจากเป็นต้น ขึ้นปิดส่วนบนของเรือน หรือหลังคาเพื่อกันแดดกันฝน
มุง,ก.,รุมกันเข้าไปดูอย่างไม่มีระเบียบ
มุ้ง,น.,ผ้าหรือสิ่งอื่นที่ขึ้นสำหรับกางกันยุง หรือป้องกันยุง
มุ่ง ๑,ก.,"หมาย, ตั้งใจไว้, ปอง, หมายตา, มองเห็น"
มุ่ง ๒,ว.,"สุกใส, รุ่งเรือง, สวยงาม"
มุ่ง ๓,ว.,เสียงดังอย่างนั้น เช่น เสียงฆ้องขนาดใหญ่
มุงคุล,น.,สิ่งที่นำความสุขความเจริญมาให้ = มงคล (ป.)
มุจลินท์ ๑,น.,ต้นจิก
มุจลินท์ ๒,น.,"สระใหญ่ในป่าหิมพานต์ซึ่งของสระประกอบด้วย ต้นจิก (ป., ส.)"
มุญจนะ,ก.,"การแก้, การเปลื้อง, การปลด, การปล่อย (ป.)"
มุด,ก.,"เอาหัวลอดเข้าไป, เอาหัวดำลงในแม่น้ำ"
มุดมอด,ก.,"ดับ, ฉิบหาย"
มุดหัว,ก.,"หลบ, ซ่อน"
มุตตา,น.,"ไข่มุก, ชื่อรัตนะอย่างหนึ่งในพวกนพรัตน์สีหมอกอ่อน ๆ (ส., ป.)"
มุตโต,น.,คาถาที่ทำให้เรียนหนังสือเก่ง
มุทะลุ,ก.,"หุนหันพันแล่น, โกรธแล้วทำลงไปอย่างไม่คำนึงถึงเหตุผลหรือไม่ยับยั้ง"
มุทิตา,น.,ความมีจิตพลอยยินดีในลาบยศสรรเสริญสุขของผู้อื่น เป็นข้อ ๑. ในพรหมวิหาร ๔ คือ เมตตา กรุณา มุทิตา อุเบกขา (ป.)
มุน,น.,"ที่ปรึกษา, ผู้แนะนำ, ผู้มีศักดิ์ (กร่อนมาจากคำว่า มุนตรี)"
มุ่น,ว.,"ละเอียด, แหลก, ไม่เป็นระบเบียบ"
มุนนาย,น.,ข้าราชการผู้ใหญ่
มุ่นม่าน,น.,โรคคันชนิดหนึ่งเป็นฝื่นขึ้นตามผิวหนัง = ลมพิษ
มุ่นมี,ก.,"ป่นปี้, เหลวแหลก"
มุ่นมีสีไฟ,ก.,"ป่นปี้, เหลวแหลก"
มุนิ,น.,"นักปราชญ์, ฤษี, พระสงฆ์ (ป., ส.)"
มุนินทร์,น.,"จอมนักปราชญ์, พระพุทธเจ้า (ป., ส.)"
มุนี,น.,"นักปราชญ์, ฤษี, พระสงฆ์ (ป., ส.)"
มุบ ๆ,ว.,หนุบหนับ
มุบ ๆ,ว.,อาการของปากที่เผยอขึ้นลงอย่างรวดเร็ว เช่น หย้ำมุบ ๆ
มุบ ๆ,ว.,อาการปวด เช่น ปวดมุบ ๆ
มุบ ๆ,ว.,อาการกระตุก เช่น เต้นมุบ ๆ
มุบ ๆ,ว.,ลักษณะอ่อนนุ่มของวัตถุ เช่น อ่อนมุบ ๆ
มุบมับ,ว.,อาการเคลื่อนที่ขึ้น ๆ ลง = งุบงับ ๆ
มุบม้าย,ว.,อาการเห็นลาง ๆ ไม่ชัดเจน
มุบมิบ,ก.,คุยหรือตกลงกันโดยไม่ให้ผู้อื่นรู้
มุบมู้มุบม้าย,ว.,"อาการเห็นไม่ชัด, ลับ ๆ ล่อ ๆ , เห็นเพียงแวบเดียว"
มุ้ม,ก.,เม้ม เช่น มุ้มปาก
มุม ๑,น.,นกชนิดหนึ่งจำพวกนกเปล้า
มุม ๒,น.,แมลงชนิดหนึ่ง เรียกแมงมุม = แมลงมุม
มุม ๓,น.,"ที่ระหว่างเส้นตรงมาจดกัน, ซอกระหว่างฝาทั้งคู่จดกัน ส่วนมากว่า แจ"
มุม ๔,ว.,"สกปรก, เปรอะเปื้อน, ลักษณะมีสีดำปนแดง"
มุมเม้า,ว.,"สกปรก, เปรอะเปื้อน, ลักษณะมีสีดำปนแดง"
มุ่ย,ว.,ลักษณะสีขาวปนสีฟ้าและเหลือง
มุย ๑,น.,ต้นไม้ประเภทหนึ่งใบเล็กมีหนาม เปลือกหนา มี ๒ ชนิด คือ มุยแดง และมุยขาว
มุย ๒,น.,เครา
มุย ๓,ว.,เสียงร้องเวลายิง หรือฟัดเฉียดไป
มุรธา,น.,"หัว, ยอด"
มุสา,ว.,"เท็จ, ปด (ป.)"
มุสาวาท,น.,"การพูดปด, คำเท็จ (ป.)"
มุสิก,น.,หนู
มู้,ว.,"ขึ้นรา, เหม็นอับ"
มูก ๑,น.,น้ำเมือกที่ไหลออกทางจมูก เรียกว่า น้ำมูก
มูก ๒,น.,พันธุ์ไม้ มีหลายชนิด เช่น มูกหลวก มูกมัน มูกเจี้ย มูกช้าง = โมก
มูกเลือด,น.,โรคที่มีมูกและเลือดในลำไส้ติดออกมากับอุจจาระ = โรคบิดอย่างแรง
มูกหมั้น,น.,"โรคบิด, ถ่ายเป็นมูกเป็นเลือด"
มูคะ,ว.,"ใบ้, เงียบ, ไม่มีเสียง (ป., ส.)"
มู่ง,ว.,เสียง เช่น เสียงฆ้องขนาดใหญ่ เรียกฆ้องนั้นว่า ฆ้องมู่ง หรือฆ้องโหม่ง
มูด ๑,ก.,ตีอย่างหนัก เช่น เอาไม้มูดหัว
มูด ๒,ว.,เปียกโชก
มูด ๓,ว.,ลักษณะหน้าตาบูดบึ้ง เช่น หน้าบูดมูดยูด
มูดยูด,ว.,หน้าตาบูดบึ้ง
มูตร,น.,"น้ำปัสสาวะ, น้ำเบา, เยี่ยว (ส.)"
มูน ๑,น.,มรดก
มูน ๒,ว.,มาก
มูนมัง,น.,มรดก
มูมมาม,ว.,อาการที่กินอาหารอย่างเปื้อนเปรอะเลอะเทอะ
มู้มี้,น.,การเล่นจ้ำจี้
มู้ยู้,ว.,ลักษณะของที่นูนขึ้นจนแตกระแหง
มู้ยู้,ว.,หน้าตาบูดบึ้ง
มูล ๑,น.,"โคน, ราก, เค้า, ต้น, ที่ตั้ง, เดิม (ป.)"
มูล ๒,ว.,"ทั้งหมด, ทั้งสิ้น (ป., ส.)"
มูล ๓,น.,"อุจจาระสัตว์, ขี้หรือเศษของสิ่งต่าง ๆ"
มูลค่า,น.,ราคา
มูลฐาน,น.,"พื้นฐาน, รากฐาน, เค้ามูล (ป.)"
มูลดก,น.,มรดก
