ฮีน,น.,เครื่องจักสานขนาดใหญ่ฉาบด้วยดินเหนียวสำหรับเก็บข้าวเปลือก = พ้อม
ฮีบ,ว.,"เร่ง, รีบ, ด่วน"
ฮีไฮ,น.,แมลงชนิดหนึ่งในจำพวกจั่กจั่น ตัวเล็กกว่าปีกเขียวใส = เรไร
ฮึ,อุ.,เสียงที่เปล่งออกมาจาแสดงความไม่พอใจ หรือ ตกใจ
ฮึดฮัด,ว.,"ลักษณะอาการของคนโกรธงุ่นง่าน, อาการของความอึดอัดใจ"
ฮึดฮาด,ว.,"ลักษณะอาการของคนโกรธงุ่นง่าน, อาการของความอึดอัดใจ"
ฮึน,ว.,มีรสขมปนเปรี้ยว
ฮึ่น ๆ,ว.,เสียงของฟ้าร้อง เช่น ฟ้าร้องฮึ่น ๆ
ฮึม,ว.,"ตกชุกจนแฉะ, ไม่ขาดสาย (ใช้แก่ฝน) เช่น ฝนฮึม"
ฮึม ๆ,ว.,เสียงเช่นนั้น เช่ เสียงขู่คำรามอยู่ในลำคอ
ฮื่อ,อุ.,เสียงที่เปล่งออกมาเมื่อตกใจ หรือนึกอะไรขึ้นได้
ฮื้อ,ก.,"รื้อ, ลอก, เปิด, ถอดออกจากสิ่งที่เป็นรูปร่างแล้ว, เก็บ"
ฮือ ๑,น.,"มะรืน, วันถัดจากวันพรุ่งนี้ เรียก มื้อฮือ = มะรืน"
ฮือ ๒,ว.,เสียงไล่ให้วัวควายเดินไป
ฮือ ๆ,ว.,เสียงเช่นนั้น เช่น เสียงร้องไห้ฮือ ๆ = โฮ ๆ
ฮื้อ ๆ,ว.,"เสียงดังเช่นนั้น เช่น เสียงคำรา, เสียงที่เปล่งออกแสดงการห้ามหรือทักท้วง"
ฮื้อแขนเสื้อ ๑,ก.,ถลกแขนเสื้อ
ฮื้อนา ๑,ก.,พื้นที่นาที่รกร้าง
ฮื้อส้าง ๓,ก.,ลอกบ่อ
ฮื้อสาด ๔,ก.,"รื้อเสื่อ, เก็บเสื่อ"
ฮุ,ก.,"ถู, ขัด, เสียดสี"
ฮุก,ก.,"ถู, ขัด, เสียดสี"
ฮุง,ว.,แสงที่ปรากฏบนท้องฟ้าเป็นแถบ ๗ สี รูปวงโค้ง = รุ้งกินน้ำ
ฮุ่ง,ว.,"สว่าง, สุกใส, แจ้ง, รุ่ง"
ฮุ้ง ๑,น.,ชื่อเหยี่ยวขนาดใหญ่
ฮุ้ง ๒,น.,"แสงที่ปรากฏบนท้องฟ้าเป็นแถบโค้งสีต่าง ๆ ๗ สี คือ ม่วง คราม น้ำเงิน เขียว เหลือง ส้ม แดง, ส่วนมากว่าฮุ้งกินน้ำ"
ฮุ่งหา,ก.,"คิดถึง, ห่วงหา, อยากพบ"
ฮุ่งหุย,ก.,"กระวนกระวาย, กระหายออก เช่น ""คะนิงนงค์ศรี ฮุ่งหุยเห็นหน้า"""
ฮุ่งเฮือง,ว.,รุ่งเรือง
ฮุด ๑,ว.,"ดุ, ตลุย เช่น ไถฮุด = ไถดะ"
ฮุด ๒,ว.,"ดื้อรั้น, มุทะลุ, ดุดัน"
ฮุน,ก.,"รุน, ดุนไป, ดันไป, ผลัก"
ฮุ่น ๑,น.,"รุ่น, สมัย, คราว"
ฮุ่น ๒,น.,พืชที่เกิดขึ้นใหม่ที่แผ้วถางแล้ว
ฮุนฮ้าย,ว.,ร้ายแรง
ฮุนแฮง,ว.,รุนแรง
ฮุบหู่,ว.,"เลือนลาง, หรุบหรู่"
ฮุม ๑,น.,ชื่อต้นไม้ชนิดหนึ่ง ยอดและผลกินได้ = ต้นมะรุม
ฮุม ๒,ก.,"รุม, รวมหัวกัน, กลุ่มรุม"
ฮุ่ม ๆ,ว.,"รุ่ม ๆ , ร้อนเล็กน้อย = คึงฮุ่ม"
ฮุมป่า,น.,ชื่อต้นไม้ชนิดหนึ่ง = ขี้อาย
ฮุย,ว.,สีน้ำตาลอ่อน
ฮุ่ย ๑,ว.,ลักษณะได้กลิ่นเพียงเบาๆ เช่น หอมฮุ่ย
ฮุ่ย ๒,ว.,ลักษณะของควันหรือไอเล็กน้อย
ฮู,น.,"รู, ของที่ลึกเข้าไปในเนื้อ สิ่งของ หรือในดิน"
ฮู้ ๑,ก.,"เข้าใจ, รู้, ทราบ"
ฮู้ ๒,ว.,"ว่านอนสอนง่าย, เชื่อง, แสนรู้, ไม่ดื้อ"
ฮูก,น.,ชื่อนกชนิดหนึ่ง
ฮู้ความ,ว.,"เข้าใจ, รู้เรื่อง"
ฮู้จักความ,ก.,"รู้เดียงสา, ฉลาด"
ฮู้จักมักแกว่น,ก.,"รู้จักคุ้นเคย, รู้จักมักจี่"
ฮูด ๑,ก.,รูด
ฮูด ๒,ว.,ลักษณะริมฝีปากมีแผลเป็นขรุขระ เช่น ปากฮูด
ฮูน ๆ,ว.,"สุกใส, แวววาวเป็นประกาย ใช้สำหรับขนาดใหญ่, ถ้าขนาดเล็กว่า ฮอง ๆ"
ฮูม,ว.,มีเสียงเช่นนั้น เช่น ช้างฮ้องฮูม ๆ
ฮู้เมื่อ,ว.,รู้สึกตัว
ฮู้เมื่อตึง,ว.,รู้สึกตัว
ฮูฮา,น.,หมอดู
ฮูฮา ๑,น.,ชื่อพรรณไม้ชนิดหนึ่ง = เสนียด
ฮูฮา ๒,น.,"หมอดู, หมอบอกฤกษ์ยาม = โหรา"
เฮ,ก.,"อื้ออึง, อึกทึก, เฮฮา"
เฮ่ง,ก.,"รีบ, บังคับให้เร็ว"
เฮ่ง,ก.,"รีบ, เร่ง, รวดเร็ว"
เฮ็ด,ก.,ทำ เช่น เฮ็ดเวียก = ทำงาน
เฮ็ว,ว.,"ไว้, เร็ว, รีบ, ด่วน, เร็วไว, เร็วเร่ง"
เฮ็วไว,ว.,"ไว้, เร็ว, รีบ, ด่วน, เร็วไว, เร็วเร่ง"
เฮ็วเฮ่ง,ว.,"ไว้, เร็ว, รีบ, ด่วน, เร็วไว, เร็วเร่ง"
เฮอน,ก.,"กระวนกระวาย, กรสับกระส่าย, ทุรนทุราย"
เฮอะ,น.,สวะหรือเศษขยะที่ลอยตามน้ำ
เฮา,ส.,"ผม, ฉัน, เรา (ทั้งผู้พูดและผู้ฟัง)"
เฮ้า ๑,น.,ปีระกา (โบ.)
เฮ้า ๒,ว.,"อบอวล, หอมตลบ, เร้า"
เฮา ๆ,น.,คำบอกให้ช้างเดิน
เฮ้าโฮม,ก.,"มารวมกัน, มาชุมนุมกัน"
เฮาะ,ก.,"ถู, สี, ระ"
เฮี่ย,ก.,"หลุด, ตก, ร่วงหล่น"
เฮี้ย,น.,ไม้ไผ่ชนิดหนึ่งปล้องยาวไม่มีหนาม
เฮียก,ว.,เรียก
เฮียง,ว.,"เคียงคู่, เรียงกัน = เรียง"
เฮียน ๑,ก.,"ร่ำ, บ่น, ฝึกหัด, รับความรู้ = เรียน"
เฮียน ๒,ก.,"เรียน, บอกให้รู้"
เฮียม,ส.,คำแทนตัวผู้พูด ใช้สำหรับผู้ชายพูดกับผู้หญิงที่รัก
เฮียว,ว.,เล็กลงไปตามลำดับ = เรียว
เฮียวไม้,น.,"เรียวไม้, กิ่งไม้เล็กๆ"
เฮียวหนาม,น.,เรียวไม้หรือกิ่งไม้เล็กๆ ที่มีหนามติดอยู่
เฮี่ยฮวาย,ว.,"เรี่ยราด, เกลื่อนกลาด, กระจาย"
เฮื่อ,ว.,"เรื่อ, มาก, อร่าม, สะพรั่ง เช่น ""คอกไม้บานเฮื่อทั่วไป"""
เฮื้อ,ว.,"รก, ร้าง, เรื้อ เช่น เข้าเฮื้อ = ข้าวเปลือกที่ตกอยู่ในนางอกขึ้นเอง, นาเฮื้อ = นาที่ทิ้งเฮื้อไว้นาน"
เฮือ ๑,น.,เรือ
เฮือ ๒,น.,ตัวหมากรุกที่ตั้งอยู่้นแถวหรือปลายแถวเดินตามแถวได้ตลอด
เฮือง,ว.,"เรือง, รุ่งเรือง"
เฮื้อง ๑,ก.,"เลื่องลือ, ชื่อดัง, รุ่งเรือง"
เฮื้อง ๒,ก.,"ยุยง, ใส่ความ, ใส่ไคล้"
เฮื้องใส่,ก.,ยุให้รักให้ชอบกัน
เฮือด,น.,สัตว์เล็กๆ ชนิดหนึ่งอยู่ตามที่นอน กัดกินเลือดคน = เรือด
เฮือน,น.,เรือน
เฮื้อน,น.,โรคเรื้อนมีหลายชนิด บางชนิดทำให้นิ้วมือนิ้วเท้ากุด เรียกว่า เรื้อนกุฏฐัง บางชนิดทำให้ผิวหยาบคันเป็นต้น
เฮื้อนกวาง ๑,น.,ชื่อโรคผิวหนังชนิดหนึ่ง = เรื้อนกวาง
เฮื้อนกวาง ๒,น.,ชื่อต้นไม้ชนิดหนึ่ง
เฮือนโข่ง,น.,เรือนเปิดมีแต่พื้นและหลังคาไม่กั้นฝา
เฮือนครัว,น.,โรงหรือเรือนที่ใช้เป็นที่ปรุงอาหาร
เฮือนไฟ,น.,"เรือนครัว, ครัว"
เฮือนโล่ง,น.,เรือนเปิดมีแต่พื้นและหลังคาไม่กั้นฝา
เฮือนอย้าว,น.,"เรือนชั่วคราว, เรือนที่ไม่มีหน้าจั่ว (ดู อย้าว)"
เฮือบิน,น.,เครื่องบิน
เฮื้อย,ว.,ลักษณะของสิ่งที่ยาว เช่น ยาวเฮื้อย = ยาวเฟื้อย
เฮื้อย ๆ ๑,ว.,"เนิบนาบ, พูดยานคาง"
เฮื้อย ๆ ๒,ว.,ช้า ๆ หรือเอื่อย เช่น ย่างเฮื้อย ๆ = เดินเอื่อย ๆ
เฮือเหาะ,น.,เครื่องบิน
เฮฺยาผี,ก.,เซ่นผี
แฮ ๑,น.,ผ้าแพรชนิดหนึ่ง
แฮ่ ๑,น.,แร่ (ดู หินแฮ่)
แฮ ๒,น.,ถั่วชนิดหนึ่ง = ถั่วแระ
แฮ่ ๒,น.,รกของเด็ก =
แฮ ๓,ก.,"เตรียมไว้, จัดไว้"
แฮ ๔,ว.,"เร่ง, รีบ, ด่วน"
แฮก ๑,ว.,"แรก, ต้น, เดิมที, ประเดิม"
แฮก ๒,ก.,"ตั้งต้น, เริ่ม, ผูกมิตร"
แฮกนา,น.,พิธีเริ่มไถนาเพื่อเป็นสิริมงคลสำหรับปีนั้น = แรกนา
แฮกเสี่ยว,น.,พิธีผูกเสี่ยว
แฮคำ,น.,ผ้าแพรปักดิ้นทอง
แฮ้ง,น.,ชื่อนกชนิดหนึ่ง รูปร่างคล้ายเหยี่ยวแต่โตกว่า กินสัตว์ที่ตายแล้วเป็นอาหาร = อีแร้ง
แฮง ๑,น.,"กำลัง, ความสบาย"
แฮ่ง ๑,น.,"กิ่งไม้ที่ไม่มีไป, ส่วนมากกว่า แฮ่งไม้"
แฮง ๒,ว.,"แข็งแรง, มีกำลัง, ศักดิ์สิทธิ์"
แฮ่ง ๒,น.,แคร่ เช่น แฮ่งเกียน = แคร่บนเกวียน
แฮ่ง ๓,ว.,"ยิ่ง, มาก"
แฮด ๑,น.,สัตว์ป่าชนิดหนึ่งรูปร่างคล้ายหมูแต่โตกว่า มีนอที่สันจมูกหนึ่งนอบ้าง สองนอบ้าง หนังหนาแข็งแรงมาก = แรด
แฮด ๒,น.,"ชื่อพุ่มไม้ชนิดหนึ่ง, ส่วนมากเรียก ขี้แฮด"
แฮด ๓,ว.,อาการที่รู้สึกแสบหรือระคายในลำคอเรียกว่าแฮดคอ
แฮน,น.,"พืชที่เกาะอยู่ตามต้นไม้จำพวกหนึ่ง (โบราณว่ามี ๓๒ ชนิด เป็นของหายาก) ใช้สำหรับทำยา มีลักษณะคล้ายตัวสัตว์ต่างๆ เรียกชื่อตามสัตว์ที่คล้ายคลึง เช่น แฮนงูเห่า, แฮนงูทำทาน"
แฮม,น.,วันข้างแรม
แฮมคืน,ก.,"ค้างคืน, แรมคืน"
แฮ้ว,น.,เครื่องดักสัตว์ชนิดหนึ่ง = แร้ว
แฮะ ๑,ก.,เฉียดไป เช่น ย่างแฮะไป = เดินเฉียดไป
แฮะ ๒,ว.,"ใกล้, ชิด เช่น นาแฮะบ้าน"
โฮ ๑,ก.,"ส่งเสียงดัง, เฮฮา, ร้องไห้"
โฮ ๒,อุ.,ร้องออกมาด้วยความตกใจ หรือพิศวง
โฮก,ว.,เสียงดังเช่นนั้น เช่น เสียงของเสือร้อง
โฮง,น.,"เรือนหลังใหญ่, บ้านเรือนเจ้านายตั้งแต่ชั้นเจ้าเมืองขึ้นไป, ที่อยู่ของข้างต้น ม้าต้น"
โฮงกระบอง,น.,แท่นสำหรับเสียบวางได้เวลาตามไฟ
โฮงคำ,น.,"ปราสาท, ท้องพระโรง, พระราชมรเฑียร, พระที่นั่ง"
โฮแซว,ก.,ส่งเสียงเฮฮาด้วยความสนุกสนาน
โฮบ,ก.,"รวบของหลายอย่างเข้ารวมกัน, เอามือสองข้างโอบกอด=รวบ"
โฮม,ก.,"รวมเข้าด้วยกัน, ชุมนุม = รวม"
โฮมเฮ้า,ก.,"ถู, สี, ระ"
โฮย ๑,ก.,"โรย, โปรย, หว่าน"
โฮย ๒,ก.,"โชย, อบอวล"
ไฮ่,ก.,เทของลงไปในภาชนะที่แคบ ๆ = กรอก
ไฮ้,ว.,ขัดสน
ไฮ ๑,น.,ทองคำ
ไฮ่ ๑,น.,ที่ดินสำหรับปลูกพืชในป่าดอน = ไร่
ไฮ ๒,น.,ความเปล่งปลั่งบนใบหน้า
ไฮ่ ๒,ก.,เทของลงไปในภาชนะที่แคบ ๆ = กรอก
ไฮ ๓,น.,"ต้นไม้ประเภทหนึ่ง = ไทร มีหลายชนิด เช่น หย่อง, ไฮคำ, ไฮมี้, ไฮหิน"
ไฮ ๔,น.,สัตว์เล็กๆ ชนิดหนึ่ง = ไร
