หลับมืน,น.,"""หลับแล้วลืม(ตา)”"
หลับมืน,น.,ชื่อพืชตรงกับชุมเห็ดเทศ ดู เล็บมืน
หลับลวด,ก.,หลับตาย
หลับลุก,ก.,ตื่น ตื่นขึ้นจากหลับ
หลับหล้ม,ก.,หลับสนิท
หลับหลึ่ง,ก.,นอนขี้เซา
หลัว,น.,ฟืน ฟืนที่ผ่าจากท่อนไม้
หลั้ว,น.,พลั่ว - เสียมหรือเครื่องมือที่ใช้คักดิน
หลั้ว,น.,พลั่ว - เสียมขนาดใหญ่ที่ใช้ตักทราย
หลัวก้อม,น.,ฟืนที่ได้จากการทอนกิ่งไม้ขนาดท่อนแขน
หลัวเสี้ยน,น.,เศษไม้ที่ผ่าออกเป็นชิ้นสำหรับล่อไฟให้ติดฟืนง่าย
หล้า,น.,แผ่นดิน
หล้า,น.,คำเรียกลูกคนสุดท้องหรือเรียกด้วยความเอ็นดู ว่า อี่หล้า หรือ ไอ่หล้า
หล้า,ก.,เสื่อมลง ทรุดโทรมลง
หล้า,ว.,ล่า
หล้า,ว.,ปลาย ท้าย
หล้า,ว.,สาย
หลาก,ก.,ลุ่มหลง วุ่นวายใจ คิดไม่ตก
หลาก,ว.,หลาก - มาก หลาย แปลก ประหลาด ก็เขียน
หลากคลา,ก.,เปลี่ยนแปลง กลายไปจากเดิม
หลากใจ,ว.,แปลกใจ
หลากหลาย,ว.,หลายอย่างต่าง ๆ กัน
หล่าคา,ก.,เปลี่ยนแปลง กลายไปจากเดิม
หลาง,ก.,ถอย คลายจากการต่อสู้ คลายความรัดกุม
หล้าง,ว.,ลาง บาง บ้าง สมควร น่าจะ พึงจะ เช่น หล้างดี นอน - สมควรจะนอนได้แล้ว
หล้างฅน,ว.,บางคน
หล้างเทื่อ,ว.,บางครั้ง บางคราว
หล้างแล้ว,ว.,​ เสร็จสิ้นสมบูรณ์ ครบถ้วนตามที่ควรจะเป็น สำเร็จรูป ถึงที่สุด
หล้างหง้าง,ว.,อาการที่สัตว์หรือสิ่งของขนาดใหญ่กระดกหรือล้มไปทางด้านข้าง
หล้างหง้าง,ว.,ลักษณะของที่ใหญ่งอคดวางหรือนอนแผ่และไม่เรียบ
หล้าตามหล้า,ว.,ในที่ลุด ลงท้าย
หลาน,น.,หลาน เรียกเด็กในรุ่นขนาดหลาน
หลานไพ้,น.,หลานสะใภ้ - ภรรยาของหลานชาย
หล้าน้ำ,ว.,ท้ายน้ำ - ด้านตรงข้ามกับต้นน้ำ
หลาบ,น.,แผ่นโลหะที่ทำเป็นแผ่นคล้ายใบลานใช้ในการจารึก ถ้าทำด้วยเงินเรียก หลาบเงิน
หลาบ,น.,ไม้ที่ใช้ขนาบ หรือกดทับสิ่งอื่นให้เข้ารูป
หลาบ,ก.,หลาบ เข็ด ขยาดกลัว
หลาบจำ,ก.,หลาบจำ - เข็ดหลาบและไม่กล้าทำอีกต่อไป
หลาบแวง,น.,รอดหรือคานไม้ที่วาง ลอดผ่านรูที่เจาะตามแนวยาวของเรือนมีหน้าที่รับแวงคีบ (เรือนกาแล หน้า ๓๘)
หลาม,ก.,กิริยาที่เอาของใส่กระบอกแล้วเผาไฟให้สุก โดยอนุโลม แผ่ออก ขยายออก เพิ่มตื้น ล้น แผ่เลยออกจากขอบเขต
หลาม,ว.,ลาม - ติดต่อกันไปเป็นพืด
หลามโหล้หลามโลด,ว.,มีมากเกินปกติ ล้นหลาม
หลามไหล,ว.,ต่อเนื่องกันไป
หลาย,ว.,หลาย - มาก
หล่าย,น.,ด้าน ฝ่าย ฟาก ข้าง
หล่ายคลอง,ว.,คนละฟากถนน
หล่ายท่า,น.,ฝั่งโน้น ฟากโน้น ฝังน้ำด้านตรงข้าม
หล่ายน้ำ,ว.,คนละฟากลำน้ำ
หล่ายหน้า,น.,คนละฟากแม่น้ำ
หลายหลาก,ว.,หลายอย่างต่าง ๆ กัน
หล่ายเหล้,ว.,เอียงกะเท่เร่
หล่ายเหล้,ว.,เย้ เอียง เอน ทำท่าจะล้ม
หลาว,น.,ไม้เสี้ยมปลายเพื่อใช้ในการขนข้าวหรือฟาง
หลาว,น.,เรียกการใช้หลาวขนฟ่อนข้าวเรียก หาบเข้าหลาว และเรียกไม้ที่เสี้ยมปลายแหลมใช้เป็นอาวุธสำหรับแทง
หลาวเหล็ก,น.,ทิศที่โหรถือว่าไม่ดี
หล่าเหล้,ว.,เอียงกะเท่เร่
หล่าเหล้,ว.,เย้ เอียง เอน ทำท่าจะล้ม
หล่าไหลหลง,ก.,ลุ่มหลง วุ่นวายใจ คิดไม่ตก
หลำ,ก.,ถลำ หลง พลั้งปากพูด เผลอ พลัดไปที่อื่น ติดค้างคาอยู่
หลิ่ง,น.,ตลิ่ง ที่ลาด ที่ชัน
หลิ่ง,ก.,เอน โอน น้อม (โบ)
หลิ่ง,ก.,ดู มองดู เล็ง
หลิ่ง,ว.,ลาด ชัน
หลิ่งดู,ก.,เล็งดู มองดู ชำเลืองดู
หลิ่งน้อม,ก.,เอนเอียง มักใช้ในความหมายว่าใฝ่ในการกุศล
หลิ่งน้ำ,น.,ตลิ่ง ฝั่งน้ำ
หลิ่งหลู้,ว.,เอนลู่ โอนเอียง คล้อยตาม
หลิด ๆ,ว.,อาการที่ทางน้ำเล็ก ๆ ไหลริน ๆ อาการที่ นัยน์ตาเคลื่อนไหวไปมาในท่าทีที่ไร้เดียงสา เรียกตาไหลหลิด ๆ ดู หลวาด ๆ
หลิ้น,ก.,(โบ)เล่น ปรกติใช้ เหล้น
หลิ้ม,น.,ลิ่ม - ไม้หรือเหล็กสำหรับขัดให้แน่น แท่ง ก้อน
หลิ้ม,ลัก.,เรียกสิ่งที่เป็นลิ่ม เช่น ฅำสองหลิ้ม ทองสองแท่ง
หลิ้มประตู,น.,สลักหรือดาลประตู
หลิ่ว,ก.,หลิ่ว - ทำให้เหลือเพียงหนึ่งอย่างหลิ่วตา
หลี,ว.,ดี ดีมาก เช่น ดีหลี - ดีมาก
หลี่,น.,ตะเกียง - หน่อของพืชที่สามารถแยกไปปลูกได้
หลี้,น.,กรวย - เครื่องใช้ที่มีลักษณะกลวง โคนเล็กและยาวส่วนปากบานใช้กรอกของเหลวลงในภาชนะปากแคบ ดูเพิ่มเติมที่ ส้อหล้อ
หลี้,น.,ลูกของหลีดคือหลานของเหลน
หลีก,ก.,หลีก - หลบสิ่งกีดขวาง เว้น เลี่ยง
หลีด,น.,ลูกของเหลน
หลีบ,น.,กลีบอย่างกลีบส้มหรือกระเทียม
หลึก,ว.,ดื้อรั้น โง่ ทึ่ม
หลึกหลึน,ว.,ดื้อรั้น โง่ ทึ่ม
หลึ่ง,น.,ชื่อสัตว์เลี้ยงลูกด้วยนม ๒ ชนิด ดู หลึ่งหมา และ หลึ่งหมู
หลึ่ง,ก.,ดื้อด้านไม่เชื่อฟัง
หลึ่งหมา,น.,หมาหริ่ง
หลึ่งหมู,น.,หมูหริ่ง กล่าวกันว่ามีความทรหดมาก
หลึ่งหมู,ว.,ดื้อ รั้น ไม่เชื่อฟัง
หลึน,น.,ส่วนของผิวหนังที่นูนแข็งขึ้นเป็นไต ก้อนที่แข็งเป็น
หลึน,น.,แนวอย่างดินที่ถูกคราดเป็นแนวในนา
หลึม,น.,ชั้นระดับ สิ่งที่เหลื่อมกันอยู่
หลืด,ว.,ชาชิน ด้าน ไม่สามารถทำให้ดีขึ้นได้
หลืบ,น.,ซีก ส่วน ชั้น ด้าน หลีบ - ช่องที่เป็นชั้นเข้าไป สิ่งที่เหลื่อมกันเป็นชั้น ๆ อย่างหลืบหลังคา
หลื้ม,ว.,ทู่ ไม่คม มักใช้กับมีดพร้า
หลุ,ก.,ทะลุ พัง ชำรุด
หลุก,น.,ระหัด - เครี่องวิดน้ำ
หลุก,น.,กังหันสำหรับวิดน้ำขึ้นสู่ที่สูง หมุนด้วยกำลังน้ำไหล
หลุกหลิก,ก.,​ กระสิก ไม่อยู่นิ่ง
หลุกหลิก,ก.,กระดุกกระดิก ส่ายไปมา เช่น หลุกหลิกหัวมนแคว็ด - ส่ายศีรษะจนเป็นวง คือปฏิเสธโดยเด็ดขาด
หลุด,ก.,หลุด - ออกจากที่ติดอยู่ พ้นจากการควบคุม
หลุท้อง,ก.,ท้องเสีย ท้องเดิน
หลุบ,ว.,ยุบลง ทรุดลง ขาดไป ไม่ครบ
หลุบทีน,ก.,ขาดทุน เสียทรัพย์ เข้าเนื้อ
หลุม,น.,หลุม - ที่ซึ่งมีลักษณะเป็นบ่อเล็ก
หลุ้ม,ก.,กลุ้ม รุม รุมล้อม
หลุ้ม,ว.,หรุบลู่ลง โล้น ลุ่น ไม่มีส่วน ยื่นออกเป็นที่เกะกะ
หลุ้ย,ก.,เลื้อย - คืบคลานไปด้วยอก เลื่อนออก คลายออก ค่อย ๆ หลุดออก
หลุ้ย,ว.,ทื่อ ไม่คม ร่อย เสื่อม คุณภาพ
หลุ้ยไพ,ก.,เลื้อยไป ไปด้วยอก
หลุ้ยหล้าย,ก.,เลื้อย - คืบคลานไปด้วยอก เลื่อนออก คลายออก ค่อย ๆ หลุดออก
หลุ้ยหล้ายเหลิ้ย,ก.,ค่อยๆ โรยตัวลง
หลุเลือด,ก.,ถ่ายอุจจาระเป็นเลือด
หลุหละ,ว.,ทรุดโทรม โกโรโกโส จวนจะพัง
หลุหละเหละ,ว.,ทรุดโทรม โกโรโกโส จวนจะพัง
หลุหลั่ง,ก.,เนื่องกันมาเป็นจำนวนมาก
หลุหลาก,น.,ปวง - โรคลงราก คือมีอุจจาระ ร่วงและอาเจียน
หลุฮาก,น.,ปวง - โรคลงราก คือมีอุจจาระ ร่วงและอาเจียน
หลู้,น.,อาหารที่ปรุงให้มีรสเผ็ดแต่มีน้ำมากกว่าเนื้อ เช่น หลู้แมลงมัน - คือการเอาไข่แมลงมันที่สด ๆ ปรุง มีรส เผ็ด โดยปริยายหมายถึงอาหารที่คล้ายลาบแต่มีส่วนน้ำมาก
หลู้,ว.,ลู่ - อาการที่เอนราบลงไปด้วยมีสิ่งอื่นบังคับให้เป็น เช่น อย่างข้าวลู่ลม
หลูด,ก.,หลุด - ออกจากที่ติดอยู่ พ้นจากการควบคุม
หลูด,ก.,หลุด - คลายออก เคลื่อนออกจากที่
หลูบ,ก.,รวม รุม ช่วยกันเป็นจำนวนมาก อย่างร่วมกันยกเสาวิหารลงหลุมเป็นต้น
หลูบ,ว.,จำนวนมาก
หลูบ,ว.,ลู่ลงมา ปกลงมา เช่น ดอกหลูบต้น - ดอกไม้ปกคลุมเต็มต้น
หลูบฅำ,ว.,พอกหรือหุ้มด้วยทองคำ เช่น ดาบฝักเงนฝักทอง
หลูบหลาบ,ว.,เหี่ยวเฉา เทิบทาบ
หลู้เพรี้ย,ก.,ชื่ออาหารคล้ายลาบแต่ใช้น้ำต้ม จากไส้อ่อนของวัวหรือควายเติมลงไปมาก
หลู้เลือด,น.,ชื่ออาหารคล้ายลาบแต่ใช้เลือดเคล้ากับใบตะไคร้เติมลงให้มาก บางตำรับนิยมเดิมน้ำกระเทียมดองลงไปด้วย
ห่วง,ก.,ห่วง เป็นกังวล
ห้วง,น.,ช่วง ระยะ ตอน
ห้วง,ก.,ขาดเป็นตอน มีอยู่เป็นบาง ตอน เรียกน้ำที่ท่วมขังว่า น้ำห้วง
ห่วงเข้า,ก.,พิธีเสี่ยงทายเพื่อให้ทราบว่าเด็กทารกที่คลอดใหม่นั้นคือผู้ใดกลับชาติมาเกิด
หวด,ก.,หวด - ฟาด ตี ตัดด้วยมีด ปัดซ้ายป่ายขวา
หวดหม่อน,น.,ตานหม่อน (พืช) (ธรรมราชานุวัตร)
หวน,ก.,หวน - เวียนกลับมา ทวนกลับ
ห้วน,ก.,หยุด ขาด ระงับ
ห้วน,ว.,ด้วน ขาด
หวย,น.,หวย
ห้วย,น.,ห้วย - ลำน้ำที่ไหลจากเขาเล็กกว่าแม่น้ำ
ห้วย,ว.,มีถิ่นกำเนิดจากห้วย เช่น บอนห้วย - บอนหรือยอดบอนที่เก็บจากห้วย
ห้วยแล้ง,น.,ลำห้วยที่มีน้ำเฉพาะฤดูฝน ส่วนฤดูแล้งจะไม่มีน้ำ
หว็อก,ว.,ไม่กลับคืน ไม่เหลียวหลัง เช่นไปหว็อก ๆ - ไปไม่เหลียวหลัง
หว็อด ๆ,ว.,อาการปลิวของสิ่งที่ทรงกลมและไม่ใหญ่ ดู หวิด ๆ และวื่น ๆ
หว็อบ,ว.,ดื่มน้ำ จมน้ำ
หว็อบ,ว.,ดื่มน้ำอย่างรวดเร็ว
หว็อบ ๆ,ว.,ดื่มน้ำบ่อย ๆ อย่างกระหาย เช่น กินน้ำหว็อบ ๆ
หวอม ๆ,ว.,อาการที่กินอาหารอย่างสงบและต่อเนื่อง
หวะ,ก.,หวะ - แตกออกเป็นชิ้นใหญ่ หลุดออก
หวะหวาก,ว.,เหวอะหวะ - เป็นรอยขาดขนาดใหญ่
หวัก,น.,นกกวัก ดูที่ กวัก
หวังไจ,ก.,หวัง - คาดหมาย คาดคะเนว่าจะได้
หวัน,ก.,พัน พัวพัน กอดรัด
หวั่นไหว,ก.,สั่น สะเทือน
หวั่นไหว,ว.,เบน เอนเอียง
หวาก,ก.,ขาดเป็นรูหรือเป็นโพรง ฉีก แหว่ง หลุด
หว่าง,น.,ระหว่าง คราว โอกาส ช่องว่างจากที่หนึ่งถึงที่หนึ่ง ระยะเวลาจากระยะหนึ่งถึงระยะหนึ่ง เวลา เวลาว่าง
หว่างกลาง,สัน.,ระหว่างกลาง
หว่างขา,น.,ในระหว่างขา
หว่างดอย,น.,ที่ราบหรือแอ่งระหว่างภูเขา
หว่างแล้ว,น.,ในช่วงเวลาที่ผ่านไป
หว่างหน้า,น.,โอกาสนี้ ระยะนี้ ขณะนี้ ปัจจุบันนี้
หว่างอาทิตย์,น.,ช่วงเวลาในสัปดาห์
หวาน,น.,ว่าน
หวาน,ว.,อร่อย มีรสเหมือนรสนํ้าตาล
หวาน,ว.,สนุกสนาน เพลิดเพลิน เช่น กินหวานทานม่วน - กินก็สนุก ทำบุญก็สนุก
หว่าน,น.,ถ้วย ชาม
หว่าน,ก.,หว่าน - โปรย ทำให้กระจาย เช่น หว่านกล้า - หว่านข้าวลงบนแปลงเพาะ
หวานเขมพระอินทร์,น.,โป๊ยเซียน ดูที่ เขมพระอินทร์
หวานเข้าใหม่,น.,เตยหอม
หวานงู,น.,ว่านงาช้าง
หวานจักเข้,น.,ลิ้นนาคราช
หวานตีนดิน (ธรรมราชานุวัตร),น.,ต้นเปราะหอม
หวานนกขุ้ม,น.,ว่านนกคุ่ม
หวานนอนหลับ,น.,ว่านหาวนอน
หวานนางบัวป้อง,น.,เอื้องดินฟ้าม้าน
หวานบ่าต้อ,น.,ว่านแสงอาทิตย์
หวานปู่ย่า,น.,โบตั๋น
หวานผักปัง (ธรรมราชานุวัตร),น.,โสม (พืช)
หวานแผ่นดินเอยน,น.,"ต้นเปราะ, เปราะหอมหัวและใบมีกลิ่นหอมใช้เป็นอาหารและทำยาได้"
หวานไฟไหม้,น.,ว่านหางจระเข้
หวานหอม,น.,"ต้นเปราะ, เปราะหอมหัวและใบมีกลิ่นหอมใช้เป็นอาหารและทำยาได้"
หวานหอม,น.,เปราะหอม
หวาย,น.,หวาย
หว่าย,ก.,บ่าย เบน เอน เลี้ยว ตีโค้ง
หว่าย,ก.,บ่าย เบน เอน เลี้ยว กลับ
หว้าย,ก.,ว่าย - แหวกไปในน้ำหรือในอากาศ
หว่ายงว้าย,ก.,เหลียว เอี้ยว เบน หัน
หว้ายท่า,ก.,เรือจะออกหรือกลับท่าเดิม
หว้ายบก,ก.,กระดึบตัวบนพื้นดิน
หวายหอม (ธรรมราชานุวัตร),น.,หวายตะค้า
หวาว,ก.,หวามวาบ รู้สึกวาบหวิวอย่างยืนบนชะง่อนผา
หวาวตา,ก.,ดูแล้วเกิดความรู้สึกวาบหวิว เช่น ยืนบนที่สูงมองลงมาข้างล่างรู้สึกวาบหวิว
หวิด,ก.,ไม่ถึง
หวิด,ว.,หวิด - เฉียด จวนเจียน เกือบจะ ไม่ครบ
หวิด ๆ,ว.,ลักษณะอย่างธงที่โบกสะบัดระยิบระยับ
หวิดคลาด,ว.,ขาดเหลือ ไม่ครบ ไม่พอ
หวิดชวด,ว.,ขาดมือ ไม่พอใช้
หวิดมือ,ว.,ขาดมือ ไม่พอใช้
หวิ้น,น.,มาตราเงินโบราณเท่ากับสิบสองสตางค์
หวิ้ว ๆ,ว.,หวิว ๆ อาการและเสียงอย่างลมพัด
หวี,น.,หวี - สิ่งที่เป็น ซี่ ๆใช้สางผมและเส้นด้าย
หวี,ล.,เรียกสิ่งที่เป็นกลุ่มมีขั้วติดเรียงกันอยู่อย่างกล้วย
หวี,ก.,หวี - สาง แต่งผมด้วยหวี
หวีผมแบะ,ก.,หวีผมแสกกลาง
หวีผมป้าย,ก.,หวีผมปัดไปด้านใดด้านหนึ่ง
หฬิทวัลลีนคระ,น.,หมายถึง เมืองศรีสัชนาลัยสวรรคโลก
หอ,น.,หอ - เรือน ซึ่งใช้เฉพาะกิจการอย่างใดอย่างหนึ่ง
หอ,น.,โรคคันที่ง่ามเท้า
หอ,น.,โรคที่เกิดกับพืชมีหัวซึ่งจะเป็นรอยเจาะที่ผิวมีลักษณะเป็นรอยแผลหรือพรุนทำให้รสชาติเปลี่ยนไป
ห่อ,ก.,ห่อ - พัน หรือหุ้มสิ่งของด้วยใบไม้หรือกระดาษ
ห่อ,ล.,เรียกของที่หุ้มด้วยใบไม้หรือกระดาษ
ห่อ,ว.,คำลงท้ายประโยคบอกเล่าใช้ในบางท้องที่
ห้อ,น.,จีนฮ่อ - คือ คนจีนที่อพยพเข้าสู่ประเทศไทยทางบก มักนับถือศาสนาอิสลาม
ห้อ,น.,เรียกพรรณไม้พุ่มยืนต้นชนิดหนึ่งว่า บ่าห้อ
หอก,น.,หอก - อาวุธสำหรับแทง ทำด้วยโลหะมีด้ามยาว ดูเพิ่มที่ หรอก และ เสน้า
หอกโจก,น.,หอกซัด
หอกโจกขอช้าง,น.,หอกซัด ขอช้าง
หอกำ,น.,หอบัญชาการ กองบัญชาการ
หอฅำ,น.,ปราสาท ราชวัง เรือนของเจ้า ผู้ครองแคว้น
หอง,สัน.,ของ แห่ง เช่น ของหองไผ - ของของใคร คำเติมหน้าคำกริยาเพื่อยํ้าความหมาย เช่น น้อง หองบ่ฟัง - ก็น้องไม่เชื่อนี่นา
ห้อง,น.,ข้อความเรื่องหนึ่งๆ หรือตอนหนึ่งๆ คราว ตอน
