หมออยา,น.,หมอรักษาและทำยา สมุนไพรตามตำราเมืองและอาจใช้คาถาอาคมประกอบด้วย
หม้ออ่าง,น.,อ่าง - ภาชนะดินเผา มักมีขนาดใหญ่ก้นเตี้ยปากผาย
หม้ออุ่ง,น.,โอ่งขนาดบรรจุประมาณ ๑๐ ลิตร ทรงป้อมปากแคบ
หม้ออุ้บ,น.,หม้อขนาดค่อนข้างเล็กมีฝาปิด
หม้อแอ่ง,น.,ภาชนะดินเผาขนาดเล็ก ก้นเตี้ยปากผาย มักใช้ในการอาบน้ำทารก เป็นต้น
หมัง,ว.,สภาพกลางเก่ากลางใหม่
หมั้ง,ว.,สภาพกลางเก่ากลางใหม่
หมัด,น.,ตัวหมัด
หมัด,น.,ไร - ฝุ่นผงชิ้นเล็ก ๆ ละออกเช่น หมัดไฟ - ลูกไฟที่แตกออกจากฟืนหรือถ่านไฟแดง
หมัดฅำ,น.,ประกายทอง นวลทอง ไรทองเม็ดเล็ก ๆ
หมัดไฟ,น.,ไร - ฝุ่นผงชิ้นเล็ก ๆ ละออกเช่น หมัดไฟ - ลูกไฟที่แตกออกจากฟืนหรือถ่านไฟแดง
หมัน,น.,มาตราเงินเท่ากับเหรียญ
หมัน,น.,ด้ายหรือเชือกอุดรูที่แตก หรือรอยต่อประสานให้เขาสนิทใช้กับเรือ
หมัน,ว.,หมัน - ไม่มีลูก ไม่มีผล
หมั่น,ก.,หมั่น - ขยัน อุตสาหะ ไม่อยู่นิ่งเฉย
หมั่น,ว.,บ่อย เช่น หมั่นมาแอ่วเน่อ - มาเที่ยวบ่อย ๆ นะ
หมั้น,น.,เขตจังหวัดแพร่เรียกฝรั่งที่เป็นไม้ผลว่า บ่าหมั้น
หมั้น,ก.,มอบสิ่งของให้ฝ่ายหญิงเพื่อแสดงว่าจะแต่งงานด้วย
หมั้น,ว.,มั่น แน่นอน แน่นหนา รัดกุม
หมั่นไก่,สำนวน.,แสร้งทำเป็นขยัน
หมั้นคุง,ว.,มั่นคง - แน่นและทนทาน ไม่กลายเป็นอย่างอื่น
หมั้นตึ้ง,ว.,มั่นคง แน่นหนา
หมั้นเที่ยง,ว.,แน่นอน ไม่เอนเอียง
หมั้ว,ก.,มั่ว - สุมรวมกันอยู่
หมา,น.,สุนัข
หม่า,ก.,หม่า - หมัก แช่ให้อ่อนตัว อย่างแช่ขาวเหนียวเพื่อนึ่ง ในวันรุ่งขึ้น เสื้อผ้าที่ใส่แล้วแช่น้ำทิ้งไว้ค้างคืนแล้วไม่ชัก
หม้า,ว.,ใหญ่โต ยิ่งใหญ่ สง่างาม เป็นที่น่ารื่นรมย์
หมาก,น.,คำนำหน้าเรียกผลไม้ต่าง ๆ ตลอดจนสิ่งที่มีลักษณะกลมป้อมที่พอจะถือในกำมือได้ คำนี้อาจออกเสียงเป็น หมะ หม่า บะ บ่า ก็ได้ แต่ในพจนานุกรมนี้จะใช้เพียง บ่า ต้นหมาก
หมาก,น.,เรียกชื่อเฟิร์นชนิดหนึ่งว่า กูดหมาก
หมาก,น.,เรียกกล้วยไม้ชนิดหนึ่งว่า เอื้องหมาก
หมากก่อ,น.,ผลมะก่อ ดู ก่อ
หมากเก็บ,น.,การละเล่นของเด็กที่ใช้ก้อนกรวด เป็นต้น โยนแล้วเก็บ
หมากแก่ว,น.,ลูกเต๋า ดูที่ แก่ว
หมากข้าม,น.,ชื่อการเล่นอย่างหนึ่งคล้ายหมากฮอส แต่เล่นข้ามเพื่อไปแทนที่อีกฝ่ายหนึ่งให้เร็วที่สุด
หมากขี้เบ้า,น.,ปลอกดักแด้ชนิดหนึ่ง ดู ขี้ซว่า และ ขี้เบ้า
หมากขี้เบ้า,น.,ดอกไม้ไฟชนิดหนึ่ง
หมากแขว่น,น.,ต้นกำจัด ดู แขว่น
หมากคำ,น.,ลูกกลมๆ ที่ร้อยเป็นพวงสำหรับการนับในเวลาบริกรรมภาวนา
หมากจับ,น.,กระจับ - ชื่อพรรณไม้ล้มลุกน้ำ ดู แหง่ง บ่า
หมากจีบพลูแหล้ม,น.,หมากพลูที่เตรียมไว้เป็นคำ ๆ
หมากดิบ,น.,ผลหมากที่ยังไม่แก่ใช้เคี้ยวกับปูนและพลู
หมากต้อ,น.,ตะกร้อ ดู ต้อ
หมากต้อง,น.,กระท้อน ดู ต้อง และ ตีน
หมากต้อม,น.,กระดุม ดู บ่าต่อม
หมากแตก,น.,ต้นกระทงลาย ดู แตก
หมากถบ,น.,ประทัด เครื่องเล่นสำหรับเด็ก ดู บอกถบ
หมากถั่ว,น.,ถั่วชนิดต่าง ๆ ดู ถั่ว
หมากทัน,น.,ต้นพุทรา ผลพุทรา ดู ทัน
หมากนับ,น.,ลูกประคำ ดู ประคำ ผคำ และ บ่านับ
หมากนิม,น.,ต้นสะบ้า ลูกสะบ้า ดู นิม บ่า
หมากเบง,น.,พุ่มหมาก - หมากที่จัดเป็นพุ่มเพื่อถวายพระ
หมากปัด,น.,ลูกปัด
หมากผาง,น.,มะปราง ดู ปราง
หมากพันสาม,น.,หมากไหมจำนวน ๑๓ เส้นใช้ในพิธีกรรมเป็นค่ายกครู คู่กับเบี้ยพันสาม
หมากพู้,น.,ต้นหมากผู้หมากเมีย - ใช้ทำยาได้นิยมใช้ยอดใส่แจกันและใช้ช่อดอกใส่แกงแค
หมากม่วน,น.,ต้นท้อ ผลท้อ ดู ม่วน
หมากลาง,น.,ขนุน (ไทใหญ่) ดู หนุน
หมากสักกา,น.,สกา ดู สกา
หมากสุก,น.,ผลหมากที่สุกแล้ว
หมากสุก,ว.,สีเหลืองปนแดง
หมากสุบ,น.,หมากที่ทำไว้เป็นคำ ๆ มักปรากฏคู่กับ พลูแหล้ม เป็น หมากสุบพลูแหล้ม อย่างที่หญิงสาวเตรียมไว้ไห้คนรัก
หมากสุ่ม,น.,พุ่มหมาก
หมากเสียบ,น.,หมากดิบที่นำมาผ่าเป็นชิ้นแล้วร้อยเป็นแถวยาวประมาณ ๑ ศอก ตากแห้งมัดรวมกันไว้กินนาน ๆ
หมากหมื่น,น.,หมากไหมจำนวน ๑๐ เส้น
หมากหิ่ง,น.,กระพรวน ดู บ่าหิ่ง
หมากเหม้า,น.,ต้นเม่าสร้อย ต้นหมากเม่า
หมากเหม้าดง,น.,ต้นมะม่วงดง
หมากไหม,น.,หมากดิบที่นำมาผ่าเป็นชิ้นแล้วร้อยเป็นแถวยาวประมาณ ๑ ศอก ตากแห้งมัดรวมกันไว้กินนาน ๆ
หมากเอียก,น.,หมากเอียด หมากร้าง
หมากเอียก,น.,ต้นหมากลางลิง
หมาโก้ง,น.,สุนัขที่มีลายเป็นด่างดวงโต ๆ
หมาง,น.,หมาง - หมองใจ ผิดใจกัน ห่างเหินจากกัน
หม่าง,ก.,พยายามทำในสิ่งที่เกินกำลังความสามารถ เช่น หม่างขุดบวกฅนเดียว - ขุดบวกน้ำด้วยลำพังตนเอง
หม่าง,ว.,จาง น้อย อ่อน เช่น น้ำแต้มหม่าง - สีที่ใช้ทานั้นจางลง
หม้างหง้าง,ว.,ลักษณะของที่ใหญ่งอคดวางหรือนอนแผ่และไม่เรียบ
หมาจี้จอก,น.,สุนัขจิ้งจอก
หมาด,น.,เรียกไม้หรือเหล็กแหลมที่ใช้เจาะ อย่างไม้แหลมที่ใช้เจาะจมูกควายเพื่อสนตะพาย เป็นต้น
หมาด,น.,รอยนูนอย่างรอยที่ถูกตีด้วยไม้เรียว เป็นต้น
หมาด,ว.,หมาด - แห้งไม่สนิท เกือบแห้ง
หมาดหม้อม,ว.,(กวี) หม่นหมอง ไม่สดชื่น
หมาดหม้อมหมองคระนิง,ว.,(กวีนิพนธ์) ได้แต่คิดถึงจนหม่นหมอง
หมาต๋าสี่,น.,สุนัขที่มีลายเป็นดวงขนาดดวงตาอยู่เหนือตามทั้งสองโดยปริยายเรียกคนสวมแว่นด้วยความเกลียดชัง
หมาตีนเท้า,น.,สุนัขที่ปลายเท้าทั้งสี่มีสีขาว
หมาน,ว.,ฉมัง ชะงัด แม่น มีโชคดี เช่น ค้าม่วนขายหมาน - คือค้าขายดี ไต้เงินมาก ดักแร้วหมาน - ดักสัตว์ด้วยแร้วได้ผลดี
หม้าน,น.,ม่าน - เรียกผ้าที่ใช้ห้อยกั้นห้องเป็นต้นว่า ผ้าหม้าน ดูเพิ่มเติมที่ ผ้ากั้ง
หม้านหล้าน,ว.,อาการที่สิ่งใหญ่โผล่หรือแลบไปมา เช่น ผีตาเหลือกหม้านหล้าน - ผีลืมตาเหลือบแลอยู่วูบวาบ ดูเพิ่มเติมที่ แหม้นแหล้น
หมาใน,น.,สุนัขป่า
หมาผี,น.,หมาจิ้งจอก
หมาผี,น.,สุนัขจิ้งจอก
หมาแม่ด้อง,น.,สุนัขตัวเมียที่ยังต้องให้นมลูกอยู่จะเห็นว่าผอมและนมยาน
หมาย,น.,หมาย - หนังสือราชการที่ใช้กะเกณฑ์เกาะกุม หรือเรียกตัว เช่น หมายเราเจ้าเมืองแก้วมายังจีนฮี้ - หนังสือในราชการของเจ้าเมืองแก้วที่มีไปถึงชาวจีนคนหนึ่งชื่อฮี้
หมาย,ก.,หมาย - มุ่ง ตั้งใจ กำหนด คาดหมายว่าจะได้ผล
หมาย,ก.,หมาย - ทำเครื่องหมายหรือขีดไว้เป็นกำหนด ทำให้เห็นชัดว่าต่างไปจากคนอื่น
หม้าย,น.,หญิง หรือชายที่คู่สมรสเสียชีวิตแล้ว (ถ้าเลิกกับคู่สมรสเรียก ร้าง)
หมายใจ,ก.,มุ่งหมาย กำหนดไว้ในใจ
หมายตา,ก.,มองไว้ มองไว้ให้จำได้ แม่นยำ
หมายทาน,ก.,กัลปนา - เจาะจงให้ แสดงเจตนาอย่างแน่วแน่ในการให้ทาน ดู อยาดน้ำหมายทาน
หมายมี,ว.,เป็นต้นว่า อาทิ มักใช้ในการกล่าว เวนทาน เป็นการจำแนกรายละเอียด เช่น สัทธาพายนอกหมายมีพ่อแฅว่นกับแม่หลวงเปนเค้าพร้อมกับลูกเต้าเหล่าหลาน - ศรัทธาฝ่ายฆราวาสประกอบด้วยกำนันเป็นหัวหน้าพร้อมกับภรรยาและบุตรหลาน
หมายุย,น.,สุนัขขนปุย
หมาเยียหีแม่,*น.,คำด่าว่าคนผู้นั้นเสพสังวาสกับมารดาของตน
หมารุย,น.,สุนัขขนปุย
หมาเลน,น.,สุนัขที่มีลายขวางเป็นทาง โดยมากสีน้ำตาลดำสลับบนสีน้ำตาล
หมาเหยือง,น.,เถาหมามุ่ย
หม่ำ,ก.,กิน (ใช้แก่เด็กทารก)
หม่ำ ๆ,ก.,กินใช้แก่ทารก
หมิ้ง,ก.,ไม่พอใจ โกรธ ฉุนเฉียว ลืมสติไปชั่วขณะ
หมิ่น,น.,เขม่าไฟ
หมิ่น,ว.,ในที่เกือบตก เกือบพลาด
หมิ่นแชม,ว.,หมิ่นเหม่ เสี่ยงอันตราย
หมิ่นหม้อ,น.,มินหม้อ ดินหม้อ - เขม่า ดำที่ดิดก้นหม้อ
หมิบ,ก.,ปิดริม งับริม เม้มอย่างเม้มปาก
หมี,ก.,รุม
หมี,ว.,​ ไม่ นิยมใช้ในกวีนิพนธ์
หมี,น.,หมี
หมี่,ว.,​ ไม่ นิยมใช้ในกวีนิพนธ์
หมี่,น.,หอมหรือกระเทียมที่เจียวแล้ว ใช้โรยหน้าเพื่อปรุงและแต่งอาหาร
หมี่,น.,ชื่อพรรณไม้ต้นชนิดหนึ่ง ใบคล้ายใบเต็งผลกลมเป็นพวง มีเมือก รากใช้ทำยา
หมี่,น.,แมลงหวี่ - ชื่อแมลงขนาดเล็ก ดูที่ พริ้ง ภิ้ง
หมี่,น.,ชื่ออาหารที่ใช้เส้นขนมจีนผัดผสมเครื่องปรุง เรียก หมี่ หรือ เข้าหมี่
หมี่,น.,แป้งที่ทำเป็นเส้นแล้วตากแห้ง
หมี่,ก.,ประดับประดา ตกแต่ง ปรุงให้ดีขึ้น
หมี่,ก.,จุ่มหมัก
หมี่,ก.,ซักเฉพาะจุด
หมี้,ว.,ดำ ดำสนิท เช่น ฟันดำมี้ - มีฟันเป็นสีดำสนิท
หมี้,ว.,ดำมาก ๆ สีดำมาก ๆ
หมึ,ก.,รุมกันเข้าไป กรูกันเข้าไป กลุ้มรุม
หมึ,ก.,เอาผ้าแช่น้ำไว้ครู่หนึ่งแล้วจึงชัก
หมึก,น.,น้ำสำหรับสักลวดลายตามตัว (ถ้าหมายถึงหมึกหรือสีตามความหมายปัจจุบัน แต่ก่อนใช้น้ำแต้ม) เรียกการสักลายตามตัวว่า สับหมึก
หมึก,ก.,เอาผ้าจุ่มน้ำแล้วหมักไว้ก่อนซัก
หมึกขาก้อม,น.,การสักตามขาให้ลายความยาวขนาดกางเกงขาสั้น
หมึกขาตัน,น.,การสักตามขาให้มีลวดลายแน่นโดยตลอด
หมึกขายาง,น.,การสักตามขาให้ลวดลายยาวถึงข้อเท้า
หมึกขาลาย,น.,การสักตามขาให้มีลวดลาย
หมึน,?,ดู หมืน
หมึนหู,ว.,มีเสียงเซ็งแซ่อื้ออึงชวนรำคาญ
หมืน,ก.,ผื่นที่ขึ้นตามเนื้อตัว
หมืน,ก.,นิ่ง เฉย ไม่กระดิก
หมื่น,น.,ชื่อตำแหน่งราชการเหนือตำแหน่งพัน สามารถบังคับบัญชา เจ้าพัน ได้สิบนาย
หมื่น,น.,ฐานันดรประทวนระดับต้นที่เจ้าประเทศราชสามารถแต่งตั้งได้ ซึ่งมีด้วยกัน ๔ ระดับ คือ หมื่น แสน ท้าว พระยา
หมื่น,ว.,จำนวนนับเท่ากับ ๑๐ พัน
หมื่น,ว.,มาตราวัดน้ำหนักเท่ากับ ๑๒ กิโลกรัม
หมื่นเข้าสาร,น.,เรียกข้าวจำนวน ๑๐ ลิตรว่า หมื่นเข้าสาร
หมืนซึ่งลึ่ง,ว.,นิ่งเฉยอย่างไม่มีความรู้สึก
หมืนเซ่อเล่อ,ว.,นิ่งเฉยอย่างไม่มีความรู้สึก
หมื่นด้ง,น.,ชื่อขุนนางที่พญาติโลกราชให้ความนับถือมาก
หมื่นด้งนคอร,น.,ชื่อขุนนางที่พญาติโลกราชให้ความนับถือมาก
หมื่นเวียก,น.,เจ้าหน้าที่ผู้เกณฑ์แรงงาน
หมื่นหนังสือ,น.,อาลักษณ์
หมืนหู,ว.,รำคาญหู หนวกหู
หมื้อ,น.,ขุยไม้ชุดสำหรับล่อประกายไฟให้ติด
หมื้อ,น.,เครื่องกรอง ประกอบด้วยสำลีหรือผ้าเกรอะแยกน้ำออกจากกาก
หมื้อ,น.,ในเรื่อง จันทรคราสชาดก หมายถึงสิ่งที่ทำเป็นถุงใช้สวมศีรษะเพื่อเป็นเครื่องประดาน้ำ
หมุก,น.,กลุ่ม พรวน พวก เช่น อี่นั้นบ่าวล่นทวยก้นเปนหมุก - สาวคนนั้นมีหนุ่ม ๆ วิ่งตามหลังเป็นพรวน
หมุด,น.,หมุด - เครื่องสำหรับตรึงหรืออุดรู บางท้องถิ่นออกเสียงเป็น
หมุน,ก.,หมุน - หันเวียนหรือทำให้หันเวียนไปโดยรอบ
หมุ้น,น.,แมลงชนิดหนึ่งจำพวกริ้ร ตัวเล็ก ๆ กัดคัน
หมุ้น,ก.,มุ่น หมกมุ่น
หมุ้น,ก.,ดื้อรั้นที่จะเคลื่อนจากที่ใดที่หนึ่ง แหวกเข้าไป ฝ่าเข้าไป ไม่ยอมถอย
หมุ้นไฟ,ก.,เอาขี้เถ้ากลบถ่านไฟไว้ให้ไฟติดอยู่ เพื่อใช้โอกาสต่อไป
หมุ้ม,ก.,มวนงอเข้า
หมุ้ม,ว.,มวนงอเข้า
หมุม ๆ,ว.,อาการที่เคี้ยวอาหารตุ้ย ๆ คือ กินอาหารคำโต ๆ และกินเรื่อย ๆ ดูเพิ่มเติมที่ หมอม ๆ
หมุย,น.,เสันฝอยอย่างพู่หรือหนวด
หมุ้ย,ก.,กริยาที่ปลาที่ผุดขึ้นมาหายใจที่ผิวน้ำทำให้เกิดเป็นวง
หมุ้ย,ว.,ลักษณะที่เคลื่อนไหวหรือผุดขึ้นจากส่วนล่างเป็นปริมาณมากอย่างน้ำที่วนขึ้นมาจากท้องน้ำในช่วงน้ำหลาก
หมุ้ย ๆ,ว.,ใช้ประกอบคำว่า เปื่อย เป็น เปื่อยหมุ้ย ๆ - เปื่อยจนอาจทำให้ขาดได้ง่าย
หมุยคาง,น.,เครา
หมุยปาก,น.,หนวด
หมุยพร้าว,น.,ใยหรือฝอยกาบมะพร้าว
หมู่,น.,หมู่ - กลุ่ม พวก หมวด
หมู่,ลัก.,เรียกสิ่งที่อยู่เป็นกลุ่ม
หมู่ชุม,น.,พวกพ้อง มิตรสหาย
หมูทอก,น.,หมูโทน หมูที่อยู่เดี่ยว
หมู่เรา,ว.,พวกเดียวกัน แบบกันเอง
หมูสี,น.,ชื่อมะพร้าวพันธุ์หนึ่ง
หมูสี,น.,เรียกตาไม้เสาเรือนที่สูงจากพื้นประมาณศอกหนึ่ง
หมู่เฮา,ว.,พวกเดียวกัน แบบกันเอง
หย้น,ก.,ย่น - ร่นให้สั้นหรือให้เร็วขึ้น
หย้น,ว.,ยู่ยี่ หด ไม่เรียบ
หยวาม,ก.,ตะปบ ตะครุบ คว้า ฉวย
หย้อ,ก.,ย่อ - ทำให้สั้นลงหรือเล็กลง
หย้อ,ก.,กระทบกระเทียบ ประชด แดกดัน
หย็อก,ว.,ขี้ริ้ว ซอมซ่อ รุ่งริ่ง ไม่สง่า
หย้อแฅวบ,ว.,โดยย่อ โดยสรุป พอเข้าใจโดยสังเขป
หย้อง,ว.,ผอม แบบบาง
หย้องแหย้ง,ก.,กระย่องกระแย่ง - ไม่มั่นคง
หย้องแหย้ง,ว.,กร้องแกร้ง - อาการเดินที่ทำเอวคดไปมาเรียกว่า ย่างด้องแด้ง
หย้องแหย้ง,ว.,แบบบาง ไม่แข็งแรง อาการเดินที่ทำเอวคอดเอวอ่อน
หยอด,ว.,แคระ แกร็น ไม่เจริญเท่าที่ควร
หยอดหย้อ,ว.,แคระแกร็น
หยอม,ว.,ผอม บอบบาง
หย่อม,น.,หย่อม - หมู่เล็ก ๆ กองเล็ก ๆ ดูเพิ่มที่ หยุ่ม
