เห็ดไข่นก,น.,เห็ดไข่นก
เห็ดไข่ห่าน,น.,เห็ดไข่ห่าน
เห็ดไคร้,น.,เห็ดตับเต่า
เห็ดโฅน,น.,เห็้ดโคน
เห็ดซาง,น.,เห็ดซาง
เห็ดด่าน,น.,เห็ดหล่ม
เห็ดแดง,น.,เห็ดแดง
เห็ดตามอด,น.,เห็ดตีนตุ๊กแกหรือเห็ดแคลง
เห็ดแต๊บ,น.,เห็ดตีนตุ๊กแกหรือเห็ดแคลง
เห็ดถอบ,น.,เห็ดเผาะ
เห็ดถั่วเน่า,น.,เห็ดที่ขึ้นตามกองกากถั่วเหลือง
เห็ดถ่าน,น.,เห็ดถ่าน
เห็ดน้ำแป้ง,น.,เห็ดน้ำแป้ง
เห็ดน้ำหมาก,น.,เห็ดน้ำหมาก
เห็ดปอดม้า,น.,ชื่อเห็ดชนิดหนึ่ง
เห็ดปอดม้า,สำนวน.,เรียกอวัยวะเพศชาย
เห็ดปุมหมู,น.,เห็ดพุงหมู
เห็็ดพี่น้องหลาย,น.,เห็ดร่างแห
เห็ดแพรด,น.,เห็ดแพด
เห็ดฟาน,น.,เห็ดฟาน
เห็ดเฟือง,น.,เห็ดฟาง
เห็ดมัน,น.,เห็ดมัน ดู มัน
เห็ดลม,น.,เห็ดลม
เห็ดหน้างัว,น.,เห็ดหน้างัว
เห็ดหน้าม่อย,น.,เห็ดหน้าม่วงหรือหน้าม่อย
เห็ดหล่ม,น.,เห็ดหล่ม
เห็ดหอม,น.,เห็ดที่ขึ้นตามไม้ก่อ
เห็ดหอม,น.,ชื่อเห็ด ๒ ชนิด ชนิดแรกหมายถึงเห็ดหล่ม ส่วนชนิดที่สองเป็นเห็ดขนาดย่อมที่เพาะขึ้นจากไม้ก่อ มีสีน้ำตาล รสดี กลิ่นหอมมีราคาสูง
เห็ดหัวเข่า,น.,เห็ดจัน หรือเห็ดตับเต่าขาว
เห็ดหำหมา,น.,เห็ดหำหมา
เห็ดหิ่งห้อย,น.,เห็ดหิ่งห้อยหรือเห็ดน้ำหมึก
เห็ดหูลวะ,น.,เห็ดหูหนู ดู หูลวะ
เหไดค็เหนั้น,*ว.,เป็นไงเป็นกัน
เหตุ,น.,สิ่งที่ทำให้เกิดผล เค้ามูลเรื่อง
เหน,น.,อีเห็น
เหน,ก.,เห็น - ปรากฏแก่ตา พบปรากฏในคัมภีร์ บางครั้งในการใช้ทั่วไปใช้ หัน
เหนคูก,น.,ชะมดแผง
เหนง,ก.,กด ทับ กดขี่ ข่มเหง
เหนงหนีบ,ก.,ข่มเหง บังคับ
เหนงหนีบ,ก.,กดขี่ ข่มเหง
เหนงหนีบ,ว.,เดือดร้อนอย่างยิ่ง
เหน็ด,น.,เหน็บ - อาการชาที่ขาเพราะนั่งนาน ๆ
เหน็ด,ว.,ดีจริง เด็ดจริง ๆ
เหน็ดขนาด,ว.,ดีอย่างถึงขนาด
เหน็ดไน,ว.,คมในฝัก
เหน่น,ก.,กดลง อัดลง ดันลง
เหน็บ,ก.,เหน็บ - เสียบ สอดไว้ในที่บังคับ
เหน็บดอก,ก.,นำดอกไม้มาทัด
เหนอ้ม,น.,ชะมด
เหน้า,ว.,รุ่น หนุ่ม สาว มักใช้ร่วมกับคำ หนุ่ม
เหนาะ,ก.,เทียบ ยื่นไปถึงที่ มอบให้โดยผู้รับมอบไม่ต้องกระดิกไปจากที่เดิม
เหนาะแหนะ,ว.,เตาะแตะ - อาการเคลื่อนไปข้างหน้าอย่างไม่มั่นคง พัวพันกับสิ่งที่อยู่โดยรอบ
เหนาะแหนะน่องแน่ง,ว.,เตาะแตะ - อาการเคลื่อนไปข้างหน้าอย่างไม่มั่นคง พัวพันกับสิ่งที่อยู่โดยรอบ
เหนียง,น.,เหนียง - เนื้อหรือหนังห้อยอยู่บริเวณคอ เช่น นก วัว
เหนียง,น.,ต้นกะรังตังกวาง (ธรรมราชานุวัตร)
เหนี่ยง,ก.,คลึง - ทำให้เหนียวหรือปั้นเป็นก้อนกลม
เหนียบ,น.,เรียกไม้ที่ใช้กลัดว่า ไม้เหนียบ
เหนียบ,ก.,เย็บ กลัด ร้อย จัดทำเป็นห่ออย่างห่อขนม จัดตกแต่งเครื่องไทยทาน
เหนียม,ก.,เหนียม - กระดาก เก้อ เขิน
เหนียว,น.,ดินเหนียว
เหนียว,ว.,เหนียว - เป็นยางติดสิ่งอื่นได้ ทนทานไม่หักหรือขาดง่าย ไม่ยุ่ย ไม่เปื่อย
เหนี่ยว,น.,ชื่อลูกแมลงปอในระยะที่เป็นตัวแก้วอาศัยอยู่ในน้ำ กินได้
เหนือ,น.,ทิศเหนือ
เหนือ,ว.,อยู่ในที่หรือฐานะสูงกว่าสิ่งอื่น ตรงข้ามกับใต้
เหนื่อย,ก.,รู้สึกตะครั่นตะครอ
เหมน,ก.,เหม็น
เหมน,ว.,มีกลิ่นไม่ดี
เหม้น,น.,เม่น
เหมนส้ม,ว.,เหม็นเปรี้ยว - มีกลิ่น คล้ายอาหารบูด
เหมนส้มเหมนบูด,ว.,มีกลิ่นเปรี้ยวกลิ่นบูด เพราะการหมักหมม
เหมย,ว.,ปรือ - ลักษณะตาที่หรี่ลงเพราะง่วง
เหมย,ว.,ลักษณะผิวที่นุ่มเนียนละมุนละไม เรียก เนื้อเหมย
เหมยขาบ,น.,น้ำค้างแข็ง
เหมยขาบ,น.,น้ำค้างที่แข็งตัวเพราะเย็นจัด
เหมยผง,น.,หิมะ - ละอองไอน้ำที่แข็งตัวเพราะความเย็นจัด
เหมาะ,ว.,พอดี งาม สวย อร่อย เพราะ
เหมาะแหมะหม้อแหม้,ว.,พับเพียบ อย่างไม่กระดิกกระเดี้ย ทรุดลง
เหมาะแหมะหม้อแหม้,ว.,ลงนั่งกับที่ด้วยความเรียบร้อย
เหมี้ยง,น.,เมี่ยง - ต้นชาชนิดหนึ่งขึ้นตามหุบเขาในเขตร้อน ยอดอ่อนนึ่งให้สุกแล้วหมักให้ได้ที่ใช้ม้วนห่อเกลือเพื่ออมหลังอาหาร
เหมี้ยง,ว.,หม่นหมอง เป็นทุกข์
เหมี้ยงส้ม,น.,เมี่ยงหมักได้ที่แล้วนำมาจุ่มในน้ำปรุงให้มีรสเปรี้ยว
เหมียด,ก.,เก็บรวบรวม จัดให้เข้าที่
เหมียดครัว,ก.,เก็บรวบรวมข้าวของ ให้เข้าที่
เหมียดตีนสิ้น,ก.,จัดชายผ้าซิ่นให้เรียบร้อย
เหมี้ี้ยงหวาน,น.,เมี่ยงที่เติมเครื่องปรุงให้มีรสหวานนำ
เหมือง,น.,เหมือง - ร่องน้ำที่ขุดขึ้นเพื่อชักน้ำไปเพี่อการเกษตร
เหมืองกิน,น.,ลำคลองที่ส่งน้ำเข้านา
เหมืองขี้นา,น.,ล่าคลองที่ระบายน่าออกจากนา
เหมืองขี้น้ำ,น.,ล่าคลองที่ระบายน่าออกจากนา
เหมืองฟู,น.,คลองชักน้ำเข้านาที่ยกระดับสูงกว่าพื้น
เหมืองเสีย,น.,ล่าคลองที่ระบายน่าออกจากนา
เหมืองเสียนา,น.,ล่าคลองที่ระบายน่าออกจากนา
เหมืองหน้อย,น.,คลองส่งน้ำจากสายหลัก เหมืองซอย คลองไส้ไก่
เหมืองหลวง,น.,คลองส่งน้ำสายหลัก
เหมือนพร่องบ่เหมือนพร่อง,ว.,ละมาย คลับคล้าย คลับคลา
เหย,ก.,ระเหย - อาการที่ของเหลวกลายเป็นไอ
เหย,*น.,คำขานรับ เอย คำตอบรับเวลาถูกเรียก คำออกเสียงแสดงความเอ็นดูหรือรักใคร่ เช่น ลูกเหย
เห้ย,ก.,ระเหย - อาการที่ของเหลวกลายเป็นไอ
เหยิง,ก.,ฉวย คว้า กระชาก
เหยิงหยาง,ก.,ฉวย คว้า กระชาก
เหยิม,ว.,เชื่องช้า ยืดยาด งุ่มง่าม
เหยื่อ,น.,เหยื่อ - เครื่องล่อ อาหารของสัตว์คู่กับ หย้า ซึ่งเป็นอาหารของสัตว์กินพืช เนื้อหรือผักที่ดักออกจากน้ำแกง
เหยื้อ,น.,หยากเยื่อ - เศษสิ่งของที่ทิ้งแล้ว
เหยือง,น.,เรียกหมามุ่ยว่า หมาเหยือง
เหยือง,ก.,รังเกียจ ขยะแขยง
เหรา,น.,สัตว์ในนิยายมีรูปครึ่งนาคครึ่งมังกร
เหล็ก,น.,เหล็ก - ธาตุลำดับที่ ๒๖ สัญลักษณ์ Fe เป็นโลหะของแข็งสีขาวเป็นเงาคล้ายเงินใช้ประโยชน์ได้มาก
เหล็็กคีบ,น.,คีม - เครื่องมือที่ใช้จับสิ่งของ
เหล็กโคน,น.,ตะปู - หมุดเหล็กอย่างที่ ใช้ตรึงสิ่งอื่นให้แน่น
เหล็กโคน,น.,ตะปู
เหล็กฅ่วง,น.,บิดหล่า สว่านเจาะไม้ชนิดที่ใช้มือบิดเป็นเกลียว
เหล็็กฅ่วน,น.,บิดหล่า สว่านเจาะไม้ชนิดที่ใช้มือบิดเป็นเกลียว
เหล็กฅวยหมู,น.,สว่านขนาดใหญ่เท่าและคล้ายอวัยวะสืบพันธุ์ของพ่อหมู
เหล็็กเฅี่ยน,น.,เหล็กที่ใช้ในการกลึงวัตถุอื่นให้ขึ้นรูป
เหล็กจาร,น.,อุปกรณ์ที่ใช้ในการจารคัมภีร์ใบลาน ลักษณะเป็นแกนเหล็กฝังอยู่ในแท่งไม้
เหล็กชี,น.,สว่านขนาดเล็ก
เหล็กซี,น.,ตะไบเหล็ก
เหล็กน้ำชืน,น.,เหล็กที่ไม่แกร่ง คือบู้ง่ายเหมือนตะกั่ว
เหล็กปิ่น,น.,ตะปู - หมุดเหล็กอย่างที่ ใช้ตรึงสิ่งอื่นให้แน่น
เหล็กปิ่น,น.,ตะปู
เหล็กไผ่,น.,เครื่องมือดัดฟันเลื่อย
เหล็กพิวดำ,น.,เหล็กน้ำพี้ - เหล็กที่มีความแกร่งสูงมาก
เหล็กพึด,น.,เหล็กงัด คือ ชะแลง
เหล็กไฟ,น.,หินเหล็กไฟ - เหล็กที่ใช้กระแทกกับหินให้เกิดประกายไฟ
เหล็กไฟกับหมุด,น.,เหล็กไฟที่ใช้กระแทกกับหินและชุดไฟที่ใช้จุด
เหล็กเสียบพริก,น.,เหล็กขนาดเล็กแบนข้างเล็กน้อย ใช้เสียบพริกเพื่อปิ้งไฟให้เกรียมและมีกลิ่นดี
เหล็กหมาด,น.,บิดหล่า
เหล็กหลวา,น.,เหล็ก หลวา - เหล็ก สีเหล็ก
เหล็กไหล,น.,ดีบุก แผ่นดีบุก สังกะสี แผ่นสังกะสี โลหะชนิดหนึ่งเชื่อกันว่ามีฤทธิ์ตามธรรมชาติและอาจยึดได้เมื่อใช้ไฟจากเทียนลน
เหลน,น.,เหลน - ลูกของหลานที่เป็นลูกของลูก
เหล้น,ก.,เล่น - ทำเพื่อสนุกหรือผ่อนอารมณ์
เหล้นก้น,ก.,หักหลัง
เหล้นกล,ก.,การเล่นที่ลวงตาให้เห็นเป็นจริง ใช้ การเหล้นยักและ
เหล้นกัน,ก.,เป็นชู้กัน
เหล้นโกงเกง,ก.,เล่นไม้สูง
เหล้นขี้แหนด,ก.,เล่นเอาเถิด เล่นไล่จับ
เหล้นไข่โจ้น,ก.,เล่นช่วงชัย (ธรรมราชานุวัตร)
เหล้นไข่เต่า,ก.,เล่นกาฟักไข่
เหล้นง่าว,ก.,เล่นโง่ ๆ เล่นอย่างไม่มีความคิด
เหล้นชักส้าว,ก.,เล่นชักเย่อ
เหล้นชุ่งชา,ก.,เล่นชิงช้า มักใช้ สิกชุ่งชา มากกว่า
เหล้นชู้,ก.,คบชู้ มีชู้
เหล้นโดล่า,ก.,เล่นต้องเต (พระธรรมราชานุวัตร)
เหล้นเทย,ก.,เล่นต้องเต
เหล้นน้ำ,ก.,เล่นน้ำ ว่ายน้ำ เล่นสาดน้ำยามสงกรานต์
เหล้นบ่รู้บึดรู้เมื่อ,ก.,เล่นโดยไม่รู้จักกาลเทศะ
เหล้นบ่าคอน,ก.,เล่นโยนลูกช่วง
เหล้นบ่าบ้า,ก.,เล่นสะบ้า
เหล้นเบี้ย,ก.,เล่นการพนัน
เหล้นเบี้ี้ยเสียของ,ก.,เล่นการพนัน
เหล้นภ้าย,ก.,เล่นไพ่
เหล้นเมียเพิ่น,ก.,เป็นชู้กับเมียเขา
เหล้นยอกเย้อ,ก.,เล่นชักคะเย่อ
เหล้นแสง,ก.,เล่นเสือกินวัว
เหลนหน้อย,น.,เหลนหน้อย - คำที่ผู้เข้าทรงมักใช้เรียกผู้ไปหา
เหล้นหน้า,ก.,ยั่วเย้า เย้าแหย่
เหล้นหน้าเหล้นตา,ก.,ยั่วเย้า เย้าแหย่
เหล้นหมา หมาเลียหน้า เหล้นม้า ม้าดีด,สำนวน.,ลดตัวไปคลุกคลีกับผู้น้อยกว่าหรือต่ำกว่า ทำให้เขาไม่เกรงกลัว
เหล้นหมากรกหมากสกา,ก.,เล่นหมากรุก เล่นสกา
เหล้นหลายครัว,ก.,เล่นขายของ
เหล้นหวย,ก.,ชื้อสลากกินแบ่ง
เหล้นอี่โช่ง,ก.,เล่นหยอดหลุม ทอยกอง
เหล้นอุ้มลี้,ก.,เล่นซ่อนหา
เหลม,น.,เข็มขนาดใหญ่อย่างที่ใช้เย็บกระสอบหรือร้อยพวงมาลัย
เหลม,น.,เหล็กแหลมหรือสิ่งแหลมยาว หญ้าหนวดฤๅษี
เหล้ม,ล.,สำหรับเรียกของที่ยาวเรียวเช่น หลัก เสา ซุง และใช้เรียกของบางชนิดเช่น เกวียน สมุด หนังสือ
เหลมเหม้น,น.,ขนเม่น นิยมใช้ฉีกหน่อไม้ให้เป็นเส้นเพื่อปรุงอาหารหรือใช้ประดับมวยผม
เหล้อ,ว.,ตาเข ตาส่อน เรียกว่า ตาเหล้อ
เหลา,ก.,เหลา - ทำให้เกลี้ยงหรีอแหลมด้วยเครื่องมือมีมีด
เหลา,ก.,เกลาหรือเรียบเรียงคำประพันธ์ให้ไพเราะมากขึ้น
เหล่า,น.,พวก หมู่ กลุ่ม
เหล่า,น.,ป่า ป่าละเมาะ ที่รกด้วยต้นไม้และเครือวัลย์
เหล้า,น.,เหล้า - น้ำเมาที่กลั่นหรือหมักแล้ว
เหล้าเด็ด,น.,เหล้าเข้ม - เหล้าที่ได้จากการกลั่นในตอนแรก ๆ
เหล้าเถื่อน,น.,เหล้าที่ประชาชนปรุงดื่มเอง
เหล้าน้ำขาว,น.,สาโท - น้ำเมาที่ยังไม่ได้กลั่น
เหล่าป่าขี้,น.,ดงท้ายบานสำหรับเป็นที่ถ่ายอุจจาระของชาวบานเรียกว่า เหล่าป่าขี้
เหล้าภาษี,น.,เหล้าที่เสียภาษีแล้ว เหล้าโรง
เหล้าหัวเด็ด,น.,เหล้าเข้ม - เหล้าที่ได้จากการกลั่นในตอนแรก ๆ
เหล้าเหื่อ,น.,เหล้ากลั่น (เหื่อ - เหงื่อ)
เหล้าไห,น.,เหล้าหมักในไหซอง
เหลาะ,น.,เปลือกหุ้ม อย่างเปลือกไข่
เหลาะแหละ,ว.,เหลวไหล ไม่จริงจัง
เหลาะแหละล่องแล่ง,ว.,เหลวไหล ไม่จริงจัง
เหลิง,ก.,เหลิง - คะนอง ลืมตัว
เหลิด็,ว.,มีเมือกลื่นอย่างปลาไหล
เหลิมหน้า,น.,กระบังหน้า กรอบ ประดับใบหน้า
เหลียก,น.,แหลก ละเอียด อย่างน้ำพริกที่ตำแล้ว
เหลียกหล้ม,ว.,แหลกพินาศ แหลกใช้การได้แล้ว ดูเพิ่มเติมที่ หล้ม
เหลียกแหลว,ว.,แหลกละเอียด ดูเพิ่มเติมที่ แหลว
เหลี่ยง,น.,กลีบอย่างกลีบส้มหรือกระเทียม
เหลี่ยง,น.,เสี่ยง ส่วน ชิ้น พู กลีบอย่างกลีบส้ม
เหลี้ยม,ก.,เสียมทำให้แหลม
เหลี้ยม,ว.,แหลม - มีปลายเสี้ยม คม ฉลาด
เหลียว,ก.,เหลียว - ผินไปทางขวาหรือซ้ายอย่างเอี้ยวคอหันหลังกลับ กลับ
เหลียววกเหลียววัก,ก.,เลิกลั่ก หน้าตื่น เหลียวหน้าเหลียวหลัง
เหลือ,ก.,เหลือ - เกิน เกินต้องการ ยังอยู่ ไม่หมด
เหลือก,น.,ตัวเหลือบ
เหลือก,ก.,เหลือก - ทำให้ลูกตาดำอยู่ข้างบนอย่างเหลือกตา
เหลือก,ว.,แหลก ละเอียด (ใช้บางท้องที่ ทั่วไปใช้ เหลียก)
เหลือขะไจ,ว.,พ้นที่จะรีบให้ทันการได้
เหลือคำ,ว.,ดื้อรั้น ไม่ฟังคำสั่งสอน
เหลือคำคึด,ว.,เกินความคิด พ้นความสามารถ
เหลือง,ว.,เหลือง - สีอย่างสีขมิ้น
เหลื้อง,ก.,เยื้องไป คลาดเคลื่อนไปเล็กน้อย
เหลื้อง,ว.,มีลายเป็นด่างดวง เป็นประกาย
เหลืองเข้าหมิ้น,ว.,สีเหลืองแบบสีขมิ้น
เหลือไจ,ว.,ไม่เป็นดั่งใจปรารถนา
เหลื้อน,ก.,ขับทำนองเสนาะ (ศิลาจารึกหลัก ๑ ใช้ เลื่อน)
เหลื้อน,ว.,สีเทาปนน้ำเงิน สีฟ้า สีน้ำเงิน
เหลือบ,น.,ตัวเหลือบ ดู เหลือก
เหลือบ,ก.,เหลือบ - ชำเลืองดู ชายตาดู
เหลือบ,ว.,สีเลื่อมพราย
เหลื่อม,ก.,ปกบัง งำ ให้ความคุ้มครอง
เหลื่อม,ว.,เหลื่อม - เลยเข้าไป ล้ำไป ล้ำกัน
เหลื้อม,ว.,เลื่อม - เป็นประกาย เป็นเงามัน
เหลื้อมมาบ ๆ,ว.,เป็นมันวาบ เป็นประกายวูบวาบ
เหลื้อมไส,ก.,เลื่อมใส - มีความเชื่อถือ มีจิตยินดี
เหลือสะไจ,ว.,พ้นที่จะรีบให้ทันการได้
เหลือสากกาก,ว.,ลักษณะตาเหลือกซึ่งเกือบไม่เห็นตาดำ
เหลือเหื่อ,ว.,เหลือขอ เอาไว้ไม่อยู่ ดื้อเกินกำลัง
เหว,ว.,เอน เอียง ไปมาไม่อยู่นิ่ง
เหว,ว.,เปล่า เปลี่ยว
