สมอง 0,น.,มันสมอง ส่วนมากว่า กระหมอง โดยปริยาย หมายถึง สติปัญญา ความคิด
สมอร่องแร่ง 0,น.,เขม่าที่ติดอยู่ตามหิ้งบนเตาไฟ
ส้มออบแอบ 0,น.,ไม้เถาชนิดหนึ่งใบกรอบ มีรสเปรี้ยว
สมอ้าง 0,ก.,รับรองถ้อยคำที่เขากล่าว
ส้มโอ 0,น.,ชื่อส้มชนิดหนึ่ง
ส้มโอ 1,น.,ส้มชนิดหนึ่ง ผิวผลมีต่อมน้ำมัน กลิ่นฉุน ผลรสเปรี้ยว หรือหวาน ขนาดโตกว่าส้มเช้ง
สมฮู้ 0,ก.,"สมรู้ร่วมคิด, เป็นใจกัน"
ส้มโฮง 0,น.,ไม้ยืนต้นขนาดกลางถึงขนาดใหญ่ดอกเล็ก ๆ ออกเป็นช่อใหญ่ กลิ่นเหม็นเหมือนกลิ่นอุจจาระ ใช้ใบและเปลือกผลทำยาได้ เมล็ดทำน้ำมัน = สำโรง
สมัก 0,น.,"คนใช้, ข้าเฝ้า (ข.)"
สมัคร 0,ก.,"เข้าพวก, เข้าด้วย, อาสา, ยินยอม, ปลงใจ, เต็มใจ"
สมัครใจ 0,ก.,"เต็มใจ, ปลงใจ หรือยินยอมโดยเห็นดีด้วย"
สมัครสมาน 0,ก.,"ปรองดอง, สามัคคีกลมเกลียวกัน"
สมังคี 0,ว.,"ประกอบด้วย, บริบูรณ์ด้วย, พร้อมเพรียง"
สมัช 0,น.,"การประชุม, การพบปะ, การมหรสพ"
สมัชชา 0,น.,"การประชุมเพื่อประโยชน์อย่างใดอย่างหนึ่งโดยเฉพาะ, ที่ประชุม (ป.)"
สมัญญา 0,น.,"ชื่อ, สมญา (ป.)"
สมัญเญศ 0,น.,"ชื่อ, สมญา (ป.)"
สมัตถ์ 0,น.,ความสามารถ
สมัน 0,น.,ชื่อสัตว์สี่เท้าชนิดหนึ่งจำพวกเนื้อและกวาง
สมันต์ 0,ว.,"พร้อม, โดยรอบ, ใกล้เคียง (ป., ส.)"
สมัย 0,น.,"คราว, ยุค, ครั้ง, เวลาอันเหมาะ"
สมัยพร 0,น.,"พิธีเลือกคู่ของกษัตริย์สมัยโบราณ, การเลือกผัวของนางกษัตริย์สมัยโบราณ"
สมา 0,น.,"ปี (ป., ส.)"
สมา 1,ก.,"ขอขมา, ขอโทษผู้ใหญ่ ส่วนมากว่า สมมา"
สมาคม 0,น.,"แหล่ง หรือองค์การ ซึ่งเป็นที่ชุมนุมของคณะบุคคลโดยมีจุดมุ่งหมายบางประการ, ที่ประชุม, การพบปะ"
สมาคม 1,ก.,"คบหา, ติดต่อเกี่ยวข้อง (ป., ส.)"
สมาจาร 0,น.,"ความประพฤติ, ความประพฤติที่ดี, ประเพณี (ป., ส.)"
สมาช 0,น.,"ที่ประชุม, การประชุม, สมาคม (ป., ส.)"
สมาชิก 0,น.,"บุคคลซึ่งเป็นหน่วยหนึ่งของคณะบุคคล, บุคคลซึ่งเป็นลูกค้าหรือขาประจำ (ป., ส.)"
สมาทาน 0,น.,"การถือเอาหรือรับเอาเป็นข้อปฏิบัติอย่างการสมาทานศีล, ความมั่นหมาย"
สมาธิ 0,น.,"ความตั้งมั่นแห่งจิต, ความแน่วแน่ในการสำรวมใจ (ป., ส.)"
สมาน 0,ก.,"เชื่อมหรือทำให้ติดกัน, ทำให้สนิท, ผูกพัน เช่น สมานแผล, สมานไมตรี"
สมาน 1,ว.,"อันหนึ่งอันเดียวกัน, เหมือนกัน, เสมอกัน, เท่ากัน (ป., ส.)"
สมานคติ 0,น.,"การดำเนินอย่างเดียวกัน, การเห็นพ้องกัน"
สมานคุณ 0,น.,ความยินดีเท่ากัน
สมานโคตร 0,น.,"สกุลเดียวกัน, ครอบครัวเดียวกัน"
สมานฉันท์ 0,ก.,"เห็นพ้องกัน, พอใจร่วมกัน"
สมานชน 0,น.,คนชั้นเดียว หรือชาติเดียวกัน
สมานชาติ 0,ว.,เป็นชนิดเดียว
สมานสังวาส 0,น.,การอยู่ร่วมกัน (ใช้แก่พระสงฆ์ หมายความว่า ทำสังฆกรรมร่วมกันได้)
สมาบัติ 0,น.,"การบรรลุฌาน, การเข้าฌาน มี ๘ ชั้น คือ รูปฌาร ๔ อรูปฌาน ๔, ความสำเร็จ (ป., ส.)"
สมาโยค 0,น.,"การประชุม, การร่วม, การติดต่อ (ป., ส.)"
สมารมภ์ 0,น.,"ความพยายาม, ความตั้งใจ, การออกแรง, ประกอบกิจการ (ป., ส.)"
สมาส 0,น.,"การเอาศัพท์ตั้งแต่สองคำขึ้นไปมาต่อเป็นศัพท์เดียวกัน ตามหลักไวยากรณ์บาลี สันสกฤต, การประสม (ป., ส.)"
สม่ำเสมอ 0,ว.,"ราบเรียบ, เป็นปรกติ"
สมิง 0,น.,เสือซึ่งกลายร่างจากคนที่มีวิชาอาคมแก่กล้าเรียก เสือสมิง
สมิง 1,น.,"ตำแหน่งขุนนางผู้ใหญ่ฝ่ายรามัญ, คนเก่งกล้า, ผู้ปกครอง, เจ้าเมือง"
สมิงพราย 0,น.,"เจ้าผี, ผีซึ่งมีร่างเป็นเสือ"
สมิงมิ่งชาย 0,น.,"ชายผู้กล้าหาญ, ชายชาติทหาร"
สมิงสาว 0,น.,หญิงสาวผู้เก่งกล้า
สมิต 0,น.,"ใบไม้ ๓ ชนิด ที่ถวายพระเจ้าแผ่นดินในพิธีอภิเษก คือ ใบมะม่วง ใบทองและใบมะยม, กิ่งแห้งของต้นไม้บางชนิด เช่น ต้นโพธิ์ ใช้เป็นเชื้อไฟในพิธีโหมกูณฑ์ (ส.)"
สมิต 1,ว.,"ยิ้ม, เบิกบาน (ป.)"
สมิต 2,ว.,"ประสม, รวบรวม (ป., ส.)"
สมิติ 0,น.,"ที่ประชุม, สมาคม (ป., ส.)"
สมิทธิ์ 0,ว.,"สำเร็จพร้อม, สมบูรณ์, มั่นคง, สัมฤทธิ์ (ป.)"
สมิทธิ 0,น.,"ความสำเร็จพร้อม, ความมั่นคง"
สมี 0,น.,พระภิกษุผู้ที่ต้องอาบัติหนัก คือ ปาราชิก
สมีปะ 0,ว.,ใกล้ (ป.)
สมุก 0,น.,ถ่าน หรือเขม่าประสมขี้รักสำหรับทาสิ่งต่าง ๆ
สมุก 1,น.,ภาชนะสานชนิดหนึ่งก้นสี่เหลี่ยม ปากกลม มีฝาครอบสำหรับใส่สิ่งของต่าง ๆ
สมุจจัย 0,น.,"การรวบรวม, การสะสม, การพอกพูน, เป็นชื่อคัมภีร์บาลีคัมภีร์หนึ่ง"
สมุจเฉท 0,น.,"การตัดขาด, การละทิ้ง, การจำกัด (ป., ส.)"
สมุจเฉทปหาน 0,น.,การตัดกิเลสได้อย่างเด็ดขาดอย่างพระอรหันต์
สมุฏฐาน 0,น.,"การตั้งขึ้น, การเกิดขึ้น, ที่เกิด, ต้นเหตุ"
สมุด 0,น.,"กระดาษที่ทำเป็นเล่ม ส่วนมากมีเส้นบรรทัด, สมัยโบราณ หมายถึง หนังสือ"
สมุดข่อย 0,น.,สมุดไทยที่ทำด้วยเปลือกข่อย
สมุดไทย 0,น.,กระดาษข่อยที่พับเป็นชั้น ๆ
สมุทร 0,น.,ทะเล (ส.)
สมุทรก 0,น.,ชาวทะเล
สมุทรยาตร 0,น.,การเดินทะเล
สมุทรยาน 0,น.,เรือเดินทะเล
สมุทรเสนา 0,น.,"ทหารฝ่ายทะเล, ลูกเสือที่ฝึกวิชาการช่วยรบทางทะเล"
สมุทัย 0,น.,"ต้นเหตุ, ที่เกิด (ทุกข์) (ป., ส.)"
สมุน 0,น.,"ลูกน้อง, คนรับใช้, คนในบังคับ"
สมุน 1,น.,จากหรือกะแชง หรือใบไม้ที่ใช้มุงหลบหลังคา
สมุน 2,น.,หมอที่ทำพิธีเบิกไพรเพื่อป้องกันภัยในป่า
สมุน 3,น.,สวะหญ้า ขนาดใหญ่ที่ชายฝั่ง
สมุนพระราม 0,น.,"ลิง, เด็กที่ซุกซน"
สมุนไพร 0,น.,พืชที่ใช้ทำเครื่องยาซึ่งหาได้ตามพื้นบ้าน (ไม่นับเครื่องเทศ)
สมุลแว้ง 0,น.,ไม้ยืนต้นขนาดกลางถึงขนาดใหญ่ใบหนาคล้ายใบอบเชย เปลือกมีกลิ่นหอมฉุน ใช้ทำยามี ๒ ชนิด ชนิดหนึ่งเปลือกบาง อีกชนิดหนึ่งเปลือกหนา
สมุห์ 0,น.,"หมู่, กอง, ทั้งหมด, ที่ประชุม, หัวหน้า, ตำแหน่งพระฐานานุกรมหรือใบฎีกา"
สมุหกลาโหม 0,น.,ตำแหน่งข้าราชการชั้นอัครมหาเสนาบดีฝ่ายทหารครั้งโบราณ ส่วนมากว่า เมืองแสน
สมุหเทศาภิบาล 0,น.,ผู้สำเร็จราชการมฌฑลสมัยก่อน
สมุหนาม 0,น.,คำนามที่รวมเป็นพวก หรือหมวดหมู่
สมุหนายก 0,น.,ตำแหน่งข้าราชการชั้นอัครมหาเสนาบดีฝ่ายพลเรือนครั้งโบราณ ส่วนมากว่า เมืองจัน
สมุห์บัญชี 0,น.,หัวหน้าพนักงานบัญชี
สมุหประธาน 0,น.,เสนาบดีชั้นจตุสดมภ์ ครั้งโบราณ คือ เวียง วัง คลัง นา
สมุหพระราชพิธี 0,น.,หัวหน้าพระราชพิธี
สมุหองครักษ์ 0,น.,หัวหน้าองครักษ์
สมุหะ 0,น.,"หมู่, กอง, ทั้งหมด, ที่ประชุม, หัวหน้า, ตำแหน่งพระฐานานุกรมหรือใบฎีกา"
สมุุคค์ 0,น.,"ตลับ, กล่อง, หีบ, กระเช้า, ตะกร้า (ป.)"
สโมธาน 0,น.,"การประชุม, การรวมกัน (ป.)"
สโมสร 0,น.,สถานที่สำหรับร่วมประชุมคบหากัน
สโมสร 1,ก.,"ประชุม, ร่วมชุมนุม"
สโมสรสันนิบาต 0,น.,งานชุมนุมร่วมกันทางสังคม
สยด 0,ก.,"ครั่นคร้าม, หวาดเสียว, เสียวใจ"
สยดสยอง 0,ก.,"ครั่นคร้าม, หวาดเสียว, หวาดกลัว ขนพองสยองเกล้า"
สยดแสยง 0,ก.,"ครั่นคร้ามและขยะแขยง, น่ากลัวและน่าเกลียด"
สยนะ 0,น.,"ที่นอน, การนอน, การหลับ"
สยบ 0,ก.,"ซบลง ฟุบลง, ข่มลง"
สยมพร 0,น.,"พิธีเลือกคู่ของกษัตริย์สมัยโบราณ, การเลือกผัวของนางกษัตริย์สมัยโบราณ"
สยมภู 0,น.,"ผู้เกิดเองเป็นเอง, พระผู้เป็นเอง, พระพุทธเจ้า, พระอิศวร (ป.)"
สยอง 0,ก.,"หวาดกลัวจนขนลุกชูชัน, หวาดเสียว, ครั่นคร้าม"
สยอน 0,ก.,"หวาดเสียว, หวาดหวั่น, กลัว"
สยัมวรา 0,น.,หญิงที่เลือกคู่เองตามใจชอบ
สยาน 0,น.,"ที่นอน, การนอน, การหลับ"
สยาม 0,น.,"ชื่อเดิมของประเทศไทย, ประเทศไทย"
สยามรัฐ 0,น.,"ประเทศไทย, แคว้นไทย"
สยาย 0,ก.,"คลี่, คลาย, ขยาย, สางให้กระจายออก"
สยิว 0,ก.,รู้สึกหวิว ๆ ด้วยความเสียวซ่านหรือหวาดเสียว
สยุมพร 0,น.,"พิธีเลือกคู่ของกษัตริย์สมัยโบราณ, การเลือกผัวของนางกษัตริย์สมัยโบราณ"
สยุมภู 0,ว.,เป็นเองตามธรรมชาติ
สร 0,น.,"ศร, เสียง, ทำนาอง, หางเสียง"
สร 1,ว.,"จำได้, ระลึกได้, ทิพย์, แกล้วกล้า"
สร 2,ว.,"คำนำหน้าคำอื่นที่ใช้ในบทกลอนเพื่อให้สละสลวย เช่น สรดื่น, คำที่แผลงมาจากคำที่ขึ้นด้วยตัว ส ซึ่งใช้ในบทกลอน เช่น สนุก เป็น สรนุก"
สรก 0,น.,"จอก, ขัน (ป., ส.)"
สรง 0,ก.,"อาบน้ำ, รดน้ำ, ใช้สำหรับพระสงฆ์และเจ้านาย"
สรณคมน์ 0,น.,"การยึดเอาเป็นที่พึ่ง, ในพระพุทธศาสนาหมายถึง การถึงพระรัตนตรัย"
สรณะ 0,น.,"ที่พึ่ง, ที่พัก, ที่อาศัย, ส่วนมากหมายถึง พระพุทธ พระธรรม พระสงฆ์"
สรณะ 1,น.,"ความระลึก, ที่ระลึก, ความทรงจำ"
สรณาคมน์ 0,น.,"การยึดเอาเป็นที่พึ่ง, ในพระพุทธศาสนาหมายถึง การถึงพระรัตนตรัย"
สรดื่น 0,ว.,"เกลื่อนกลาด, ดาษดื่น"
สรทะ 0,น.,"ฤดูใบไม้ร่วง, สารทกาล (ป.)"
สรทึง 0,น.,แม่น้ำ
สรทึง 1,น.,"แม่น้ำ, ห้วย (ข.สตึง)"
สรนุก 0,ว.,สนุก
สรพะ 0,ว.,"ทั้งหมด, ทั้งปวง ใช้นำหน้าคำอื่น เช่น สรพางค์กายอวัยวะร่างกายทุกส่วน (ป.)"
สรพัน 0,ว.,"สารพัน, ทั้งหมด, ทั้งปวง"
สรภัญญะ 0,น.,"ทำนองสำหรับสวดคำที่เป็นฉันท์, ทำนองขับร้องทำนองหนึ่ง"
สรภู 0,น.,"จิ้งจก, ตุ๊กแก (ป.)"
สรร 0,ก.,"เลือก, คัด"
สรรค์ 0,น.,การสร้าง
สรรค์ 1,ก.,"สร้าง, แต่ง"
สรรทึง 0,น.,แม่น้ำ
สรรพ 0,ว.,"ทุกสิ่ง, ทั้งปวง, ทั้งหมด"
สรรพคุณ 0,น.,คุณสมบัติของสิ่งที่เป็นยา
สรรพนาม 0,น.,คำแทนชื่อ
สรรพางค์ 0,น.,"ทั่วร่าง, ทั่วตัว"
สรรเพชญ 0,น.,"ผู้รู้ทุกสิ่งทุกอย่าง, ผู้รู้แจ้ง, พระนามของพระพุทธเจ้า"
สรเลข 0,น.,ตำแหน่งข้าราชการหัวเมืองสมัยโบราณ
สรวง 0,น.,"ฟ้า, สวรรค์, เทวดา"
สรวง 1,ก.,"เซ่น, บูชา, บน"
สรวม 0,ก.,ขอ
สรวมชีพ 0,ก.,"ขอชีวิต, ของจงให้ชีวิตหรือปกป้องชีวิต"
สรวล 0,ก.,หัวเราะ
สรวลสันติ์ 0,ก.,หัวเราะด้วยความสุขใจ
สรวลเส 0,ก.,หัวเราะเฮฮา
สรเสริญ 0,ก.,"ยกย่อง, สรรเสริญ"
สรอย 0,ก.,"พูดเสริมขึ้นเมื่อลำตกบท หรือขัดจังหวะหมอลำเพื่อให้ขำขัน, ตลกสลับฉากหมอลำ"
สร้อย 0,น.,"เครื่องประดับที่ทำเป็นสายยาว ๆ ใช้คล้องคอ, ข้อมือ เป็นต้น"
สร้อย 1,น.,"หญิงคนรัก, ผู้หญิง"
สร้อย 2,น.,ชื่อปลาน้ำจืดชนิดหนึ่ง มีเกล็ด อยู่รวมกันเป็นฝูง ๆ
สร้อย 3,น.,ดอกไม้
สร้อย 4,น.,ขอคอสัตว์ เช่น สร้ายคอไก่
สร้อย 5,น.,คำที่เกิมหรือประกอบคำอื่นเพื่อให้ไพเราะหรือเต็มความ
สร้อย 6,ก.,"โศกเศร้า, หงอยเหงาเป็นทุกข์ไม่มีสุข"
สระ 0,ก.,"ละทิ้ง, ปล่อย, พลี เช่น สละชีพ"
สระ 1,น.,"บ่อน้ำขนาดใหญ่, แอ่งน้ำที่อยู่ระหว่างผา, แอ่งน้ำที่เกิดจากการขุด"
สระ 2,น.,"เสียง, เครื่องหมายพวกหนึ่งคู่กับพยัญชนะ"
สระ 3,ก.,"ชำระ, ฟอก, ล้าง โดยมากใช้กับร่างกาย, สละ, ปล่อย"
สระส่วย 0,ก.,"ชำระ, ล้าง, อาบ"
สร่าง 0,ก.,"หาย, ฟื้น, คลาย, ทุเลา ออกเสียงว่า ส่วง เช่น ส่วงไข้"
สร้าง 0,น.,"ที่ยกพื้น, พื้นที่ยกสูงไว้, ที่ยกพื้นสูงอยู่สี่มุมเมรุ สำหรับพระสงฆ์นั่งสวดอภิธรรม ซึ่งเรียกว่า คดสร้าง หรือ สำสร้าง"
สร้าง 1,ก.,"ก่อ, ปลูก, ทำให้เกิดหรือมีขึ้น"
สราญ 0,ว.,"สำราญ, เบิกบาน"
สราญจิต 0,ว.,"สำราญ, เบิกบาน"
สราญรมย์ 0,ว.,รื่นรมย์เบิกบานสำราญใข
สรีรกิจ 0,น.,การทำกิจเกี่ยวกับร่างกาย เช่น ถ่ายอุจจาระ
สรีรธาตุ 0,ก.,กระดูกของศพที่เผาแล้ว
สรีรวรรณ 0,น.,"สีกาย, ผิวพรรณ"
สรีรวิทยา 0,น.,ตำราว่าด้วยส่วนต่าง ๆ และหน้าที่ของร่างกาย
สรีรศาสตร์ 0,น.,ตำราว่าด้วยส่วนต่าง ๆ และหน้าที่ของร่างกาย
สรีรสัณฐาน 0,น.,"รูปร่าง, รูปพรรณสันฐาน"
สรีระ 0,น.,"ตัว, ร่างกาย, ศพ (ป.)"
สรุก 0,น.,เมือง (ข. หมู่บ้าน เขมร ออกเสียง สะเรอะ)
สรุกเกรา 0,น.,"บ้านนอก, ชาวบ้านนอก (ข.)"
สรุป 0,ก.,"รวมความ, รวบรัดเอาแต่ใจความ"
สรุสระ 0,ว.,"ขรุขระ, ไม่เรียบร้อย"
สรูป 0,ก.,"รวมความ, รวบรัดเอาแต่ใจความ"
สโรช 0,น.,"บัว, ดอกบัว (ส.)"
สฤษฎ์ 0,ก.,"ทำแล้ว, สำเร็จแล้ว, สร้างแล้ว (ส.)"
สฤษฎิ์ 0,น.,"การทำ, การสร้าง (ส.)"
สฤษฎี 0,น.,"การทำ, การสร้าง, การให้สำเร็จไป (ส.)"
สลด 0,ก.,"สิ้นสติ, หมดความรู้สึกตัว"
สลบไสล 0,ก.,"สิ้นสติไม่ติงกาย, หลับสนิทไม่รู้สึกตัว"
สลบเหมือด 0,ก.,สิ้นสติไม่รู้สึกตัว
สลวน 0,ก.,สาละวน ส่วนมากว่า สนละวน
สลวย 0,ว.,ลักษณะสิ่งที่ยาวอวบเรียงกันอยู่จำนวนมาก
สลวย 1,ว.,"ฉลวย, สวย, งาม มักใช้กับผมที่ยาวปะบ่า"
สลอง 0,ก.,"ฉลอง, ยกย่อง, สรรเสริญ, เสริมให้ดีขึ้น, ทำเป็นครั้งที่สอง"
สลอด 0,น.,ไม้พุ่มชนิดหนึ่ง ขนาดย่อมถึงขนาดกลาง สูงราว ๗-๘ ฟุต ใบกลมริมใบเป็นจักเล็ก ๆ มีใบเลี้ยง ใบมีสีสุก เหลืองแก่ ดอกเป็นช่อเล็ก ๆ สีขาว ผลกลมยาวเป็นสามพู ผลอ่อนสีเขียว ผลแก่สีเหลืองอมน้ำตาล เมล็ดเป็นยาถ่ายอย่างแรง
สลอดน้ำ 0,น.,ไม้เถาขนาดเล็กชนิดหนึ่งใบคายคล้ายใบข่อย ผลเล็ก ๆ คล้ายผลมะเดื่อ ทุกส่วนใช้ทำยาได้ ชอบขึ้นตามที่ลุ่มมีน้ำขัง
