คำ,POS,ความหมาย
อก 0,น.,(โบ) คำเรียกบุตรหญิงคนที่ ๖ คู่กับเรียกบุตรชายคนที่ ๖ ว่า ลก
อก 1,น.,เปิดอก อกกว้าง อกใหญ่ งาม ผึ่งผาย
อก 2,น.,"“อกพ่อเอย"" คำอุทานแสดงความรักความสงสาร"
อกไข 0,ว.,"“อกพ่อเอย"" คำอุทานแสดงความรักความสงสาร"
อกเจ้าพ่อ 0,ว.,"""อกแม่เอ๋ย"" คำอุทานแสดงความรักความสงสาร"
อกเจ้าพ่ออก 0,ว.,"""อกแม่เอ๋ย"" คำอุทานแสดงความรักความสงสาร"
อกเจ้าแม่ 0,ว.,ผู้ไม่รู้คุณที่ท่านผู้อื่นทำแก่ตน
อกเจ้าแม่อก 0,ว.,"คำอุทาน อย่างคำ ''พุทโธ่"""
อกตัญญู 0,น.,"คำอุทาน อย่างคำ ''พุทโธ่"""
อกพุทโถ พุทโธ 0,*อ.,ความชั่ว ความไม่ดี
อกพุทโธ 0,*อ.,ความลำเอียง ๔ อย่าง คือ ฉันทาคติ - ลำเอียงเพราะรัก โทสาคติ - ลำเอียงเพราะโกรธ ภยาคติ - ลำเอียงเพราะกลัว โมหาคติ - ลำเอียงเพราะเขลา
อกุสล 0,น.,ไม่ก้อง เรียกพยัญชนะที่มีเสียงไม่ก้องว่าพยัญชนะอโฆสะ คือ ก ข จ ฉ ฏ ฐ ต ถ ป ผ ศ ษ ส และห
อคติ 0,น.,ลักษณะศีรษะที่เถิกแต่ยังไม่ล้าน
อโฆสะ 0,ว.,อุ้ง อย่างอุ้งมือ
อง 0,ว.,อก อย่างอกไก่
อ้ง 0,น.,ลักษณะของที่เป็นอุ้งหรือแอ่ง เว้าเป็นภาชนะได้
อ้ง 1,น.,เบ้าตา
อ้ง 2,น.,ที่ซึ่งยุบลงหรือทำให้เป็นแอ่งมีขนาดใหญ่กว่าที่ควร อย่างที่นอนที่ยุบลงเป็นแอ่ง
องแก่นตา 0,น.,รูปโฉมอันงาม
อ้งขะหล้ง 0,น.,ส่วนของร่างกาย อวัยวะ ตัว รูปโฉม เช่น เสียองคะ - เสียโฉม พิการ
องค์คราน 0,น.,นิ้ว
องคะ 0,น.,รูปร่างงาม
องคุลี 0,น.,อุโมงค์
องฅาน 0,น.,ที่ซึ่งเป็นแอ่งโดยธรรมชาติ
องมง 0,น.,องอาจ กล้าหาญ ผึ่งผาย สง่างาม
อ้งหม้ง 0,น.,สายฟ้าแลบที่พ้นความคิด ไม่ควรคิด (สิ่งที่ไม่ควรคิด มี ๔ อย่าง คือ พุทธวิสัยของพระพุทธเจ้าทั้งหลาย ๑ ญาณวิสัยของผู้ได้ฌาน ๑ วิบากแห่งกรรม ๑ แนวความคิดเรื่องโลก ๑)
องอาจ 0,ว.,ต้นไทรเป็นที่พักอาศัยของคนเลี้ยงแพะ ชื่อต้นไม้ที่พระพุทธเจ้าประทับนั่งเสวย วิมุตติสุขเป็นเวลา ๗ วัน อยู่ทิศตะวันออกของต้นศรีมหาโพธิ
อจินเตยย 0,น.,อดทน อดกลั้น งดเว้น มีความทนทาน
อชปาลนิโครธ 0,น.,เสียงดังอึกทึก เสียงดังสนั่น
อด 0,ก.,หากทนลำบากจะได้รับผลดี
อ้ด ๆ 0,ว.,อดทนยิ่งนัก
อดเผ็ด กินหวาน อดสานได้ซ้า 0,สำนวน.,วอกแวก - อาการที่ส่ายไปส่ายมาไม่แน่นอน
อดมากนัก 0,ว.,อุตสาหะ บากบั่น ตั้งใจ อดทน
อดแว็ด 0,ว.,อุตสาห์ บากบั่น ตั้งใจ อดทน
อดสละ 0,ก.,ทนเอาไว้ มีความอดกลั้น
อดสะอดอดสา 0,ก.,จอแจ สับสนและมีเสียงดัง
อดเอา 0,ก.,อื้ออึง เอิกเกริก ครึกครื้น
อ้ดเอา 0,ว.,มึนตึง -ใช้ประกอบคำ หน้า หรือหน้าเคร่ง เป็นหน้าเคร่งอ้ดฮด
อ้ดเอ้า 0,ว.,อุตสาห์ บากบั่น ตั้งใจ อดทน
อ้ดฮ้ด 0,ว.,อุตสาห์ บากบั่น ตั้งใจ อดทน
อตสาห์ 0,ก.,อดีต - เวลาที่ล่วงไป แล้วผ่านไป
อตสาหะ 0,ก.,เดือนที่เพิ่มขึ้นในปีจันทรคติคือ ในปีนั้นมี ๑๓ เดือน หรือมีเดือน ๘ สองครั้ง
อตีตะ 0,น.,เรื่องราว คดี เหตุ โทษ
อธิกมาส 0,น.,วันที่เพิ่มเข้าในปีจันทรคติ คือในปีนั้น เดือน ๗ มี ๓๐ วัน
อธิกรณ์ 0,น.,อธิษฐาน - ตั้งใจมุ่งผลอย่างใดอย่างหนึ่ง ตั้งจิตปรารถนา ตั้งจิตขอร้องต่อสิ่งที่ตนถือว่าศักดิ์สิทธิ์เพื่อผลอย่างใดอย่างหนึ่ง
อธิกวาร 0,น.,อันตราย - เหตุที่ทำให้ถึงแก่ความแตกดับ
อธิกสุรทินะ 0,ก.,ไม่ใช่อัตตา ไม่ใช่ตัวตน
อนทราย 0,น.,กรรมที่เป็นบาปหนักที่สุดคือ ครุกรรม มี ๕ อย่าง คือ ๑. ฆ่าบิดา ๒. ฆ่ามารดา ๓. ฆ่าพระอรหันต์ ๔. ทำให้พระกายของพระพุทธเจ้าห้อเลือด ๕. ทำให้สงฆ์แตกแยกกัน
อนัตตา 0,ว.,เวลาในภายหน้ายังไม่มาถึง
อนันตริยกัมม์ 0,น.,ผู้ไม่มาสู่กามภพอีก - ชื่อพระอริยบุคคลชั้นที่ ๓
อนาคตะ 0,น.,ผู้ไม่มาสู่กามภพอีก - ชื่อพระอริยบุคคลชั้นที่ ๓
อนาคามิ 0,น.,ความประพฤติชั่ว ลามก
อนาคามี 0,น.,สงสาร สังเวช สลดใจ ไม่มีที่พึ่ง
อนาจาร 0,น.,ไม่ยั่งยืน ไม่เที่ยง
อนาถะ 0,ก.,ยินยอม ยอมให้ตกลง
อนิจจะ 0,ว.,ปกรณ์ที่พระอาจารย์ทั้งหลายแต่งแก้ หรืออธิบายเพิ่มเติม ฎีกา.
อนุญาต 0,ก.,เรียกคำให้พรของพระว่า คำอนุโมทนา ยินดีตาม พลอยยินดี
อนุฏีกา 0,ก.,คล้อยตาม
อนุโมทนา 0,น.,การระลึกถึง อารมณ์ที่ควรระลึกถึงเนือง ๆ มี ๑๐ อย่าง มี พุทธานุสสติคือระลึกถึงคุณของพระพุทธเจ้า เป็นต้น
อนุโลม 0,ก.,อบ
อนุสสติ 0,น.,ลักษณะของใหญ่ที่โค้งนูน
อบ 0,ก.,ลักษณะสิ่งของทรงกลมคุ่มอย่างชามวางคว่ำอยู่เป็นจำนวนมาก
อ้บพบ 0,ว.,แนะนำพร่ำสอนให้รู้และชำนาญ
อ้บพบอั้บพับ 0,ว.,การเฉลิมฉลอง หรือกระทำพิธีที่ศักดิ์สิทธิ์อย่างการกระทำพุทธาภิเษก
อบรม 0,ก.,การเฉลิมฉลอง หรือกระทำพิธีที่ศักดิ์สิทธิ์อย่างการกระทำพุทธาภิเษก
อบรมพระเจ้า 0,ก.,การที่สตรีในระยะอยู่ไฟอบไอยาสมุนไพรในกระโจมเพื่อให้ร่างกายแข็งแรงเร็วขึ้น
อบรมสมโภช 0,ก.,ที่ปราศจากความเจริญ ความฉิบหาย
อบอยา 0,ก.,ชั่ว ไม่เป็นมงคล
อบาย 0,น.,ภูมิที่ปราศจากความเจริญมี ๔ แห่ง คือ นรก เปรต อสุรกาย เดรัจฉาน
อปลักษณ์ 0,ว.,ทางแห่งความฉิบหาย
อปายภูมิ 0,น.,ยกโทษ
อปายมุข 0,น.,ให้ความไม่มีภัย
อภัย 0,ก.,เกิดดี มีตระกูลดี
อภัยทาน 0,ก.,หมวดแห่งคำสอนของพุทธศาสนาฝ่ายปรมัตกธรรมว่าด้วยจิต เจตสิก รูปนิพพาน เป็นปิฎกที่สามในพระไตรปิฎก
อภิชาต 0,ว.,อภิเษก - แต่งตั้งโดยพิธีรดน้ำ
อภิธัมมปิฏกะ 0,น.,(ลัวะ) แม่น้ำ แหล่งที่อาศัย เช่น อมกอย อมเมง ดูเพิ่มที่ โอม
อภิเสก 0,ก.,อม
อม 0,น.,(โบ) ครอบครอง เป็นเจ้าของ รวบรวม เก็บไว้ เจรจา สู่ขอ เฉพาะ ใกล้ ๆ กับ ด้วย
อม 1,ก.,ต้นเนียมงวงช้าง ใบมีกลิ่นหอม
อ่ม 0,ก.,เรียกชะมดเชียงว่า เหนอ้ม ดู เหน
อ้ม 0,น.,หอม มีกลิ่นหอม
อ้ม 1,น.,พระนิพพาน อมฤต - ไม่ตาย
อ้ม 2,ว.,ยักษ์ ผี ผู้ที่มิใช่คน
อมตะ 0,น.,ไร้เดียงสา
อมนุสสะ 0,น.,ชื่อวันที่ควรแก่การลงทุนค้าขาย การไปค้าขายต่างแดนหรือการซื่อสัตว์มาเลี้ยง
อมมือ 0,ว.,ไม่พูด หุบปาก
อมริสสโชค 0,น.,เถาชำมะนาด
อมลิ้น 0,ก.,กลัดหนอง มีหนองเกิดที่แผล
อ้มสาย 0,น.,ปืนใหญ่โบราณลำกล้องสั้น ในลิลิตยวนพ่าย ใช้ อมรา
อมหนอง 0,ก.,มักใช้กับ นั่ง หมายถึง นั่งยองๆ
อม็อก 0,น.,ช่วงที่สตรีต้องอยู่ไฟหลัง การคลอดบุตร
อย่องเขาะ 0,ก.,ผู้ไกลจากกิเลส
อยู่เดือน 0,น.,ความเป็นผู้ไกลจากกิเลส
อรหันต 0,น.,ผู้อยู่ป่า ชื่อคณะสงฆ์ที่ตั้งอารามอยู่ในป่าห่างจากที่ชุมชน
อรหันตะ 0,น.,ตำหนิ ติเตียน
อรัญญวาสี 0,น.,ผู้บรรลุธรรมวิเศษระดับต่าง ๆ
อริติเตียน 0,ก.,ทางอันประเสริฐอันเป็นทางดับทุกข์ มีองค์ ๘
อริยปุคคละ 0,น.,ความจริงของพระอริยะ ความจริงอันประเสริฐ ชื่อธรรมสำคัญหมวดหนึ่งในพุทธศาสนา
อริยมัคคะ 0,น.,ไม่อาย นอกจารีต มักหมาย ถึงนักพรตอย่างภิกษุผู้มักละเมิดพุทธบัญญัติ
อริยสัจจะ 0,น.,ห่วงเป็นกังวลถึง เผื่อแผ่ไปถึง รักษาสิ่งของไว้ไห้ผู้อื่น
อลัชชี 0,ว.,อวด - โอ้อวด สำแดงให้เห็น กล่าวชมเชย ยกย่อง
อ่วง 0,ก.,หยิ่ง ผยอง ทะนงว่าตัวเองเก่ง
อวด 0,ก.,แสดงว่ามีสง่าและเป็นหัวหน้า ดูเพิ่มที่ หนัก
อวดกล้าสะหาว 0,ก.,อวดดี - ทะนงใจว่าตัวดี ถือดีแสดงให้เห็นว่าตนเองดีโดยไม่เป็นจริง
อวดครึอวดหนัก 0,ก.,แสดงว่ามีทรัพย์มาก
อวดดี 0,ก.,แสดงว่าตนมีความรู้เและหลักแหลมมาก
อวดมั่งอวดมี 0,ก.,แสดงว่าตัวเองกล้าหาญ
อวดรู้อวดหลวัก 0,ก.,ยกย่อง เล่าลือกันทั่วไป
อวดหาน 0,ก.,อวล - คำที่ใช้แทนชื่อบุรุษที่ ๑ และที่ ๒ ในเชิงชู้สาว เช่น อวนพี่ - ตัวพี่ อวนยิง - น้องหญิงที่รัก
อวดอู้ 0,ก.,ส่งเสียงดัง มีเสียงอึกทึก
อวน 0,น.,คร่อม ครอบ ทับ กริยาที่เอาด้านหน้าหรือด้านบนวางคว่ำลง กก อย่างแม่ไก่กกไข่
อ่วน 0,ก.,ลักษณะของสิ่งใหญ่หรือทรงคุ่มป้อมคว่ำอยู่
อวบ 0,ก.,ลักษณะของแบนหรือยาวคว่ำลง อย่างคนนอนคว่ำ
อวบทบพบ 0,ว.,ร้อนอบอ้าว ร้อนขึ้นอย่างตอนที่ฝนจะตก
อวบทาบพาบ 0,ว.,อำพราง ปิดบัง
อวม 0,ว.,ให้ อย่างอวยพร
อวมอำ 0,ก.,สุรุ่ยสุร่ายใช้จ่ายมากเกินจำเป็น เกินสมควร ไม่เรียบร้อย ไม่สมควร
อวย 0,ก.,ชื่อตำราพิจารณาการลักขโมยและการลงโทษ
อ่วย 0,ก.,อุจจาระ
อวหาร 0,น.,ด่าง - กริยาที่ผ้าสีถูกน้ำแล้วเป็นรอยด่าง (ธรรมราชานุวัตร)
อว้า 0,น.,เสียงดังก้องกังวาน อย่างเสียงจากเครื่องขยายเสียงในระยะไกล
อวาน 0,ก.,แนวทรายใต้น้ำบริเวณหัวแหลมคุ้งน้ำ
อวาบ ๆ 0,ว.,แนวทรายใต้น้ำบริเวณหัวแหลมคุ้งน้ำ
อวาม 0,น.,ไออย่างไอน้ำ ระบายออก ผ่อนออก หายใจออก ให้ ปัน แบ่ง ถอด
อว่าม 0,น.,บ่าย เบน เอน เลี้ยว กลับ
อวาย 0,ก.,อก - อวัยวะ ด้านหน้าถัดคอลงมาและกัดท้องขึ้นไป
อวาย 1,น.,เหลียว เอี้ยว เบน หัน
อว่าย 0,ก.,บ่าย เบน เอน เลี้ยว ตีโค้ง
อว่าย 1,ก.,ไอดิน กลิ่นดิน
อว่าย 2,ก.,ไอปาก
อวายดิน 0,น.,การระบายลมขณะเล่นเครื่องเป่า
อวายปาก 0,น.,หันหน้าไป
อวายลม 0,น.,ชื่อนรกขุมต่ำสุด ไม่มีคลื่น
อว่ายหน้า 0,ก.,ความไม่รู้ ความมืดมน ความไม่รู้แจ้ง หมายถีงไม่รู้จักอริยสัจจ์ ๔
อวิจี 0,น.,การไม่เบียดเบียน
อวิชชา 0,น.,ไม่มีเวร
อวิหิงสา 0,น.,ชื่อต้นไม้หลายชนิด ดูเพิ่มเติมที่ ส้มสุก
อเวระ 0,ว.,อัศจรรย์
อโศก 0,น.,นับไม่ถ้วน ชื่อมาตรานับจำนวนที่ใหญ่ ที่สุดคือ โกฏิกำลัง ๒๐
อสจัน 0,น.,จำนวน ๘๐
อสังเขยยะ 0,น.,เรียกน้ำกามว่า น้ำอสุจิ ไม่สะอาด ไม่บริสุทธิ์
อสีติ 0,น.,ซากศพ ไม่สะอาด
อสุจิ 0,น.,สัตว์ในอบายภูมิพวกหนึ่ง ชอบเที่ยว ลอกหลอนคนคู่กับเปรต
อสุภะ 0,น.,การไม่คบหาสมาคม
อสุรกายะ 0,น.,อะไร
อเสวนะ 0,น.,ฉัน ข้า กู
อหัง 0,น.,เลิกแล้วต่อกัน
อหัง 1,สรรพ.,ออ - รวมกัน อยู่เป็นกระจุก คับคั่ง ส่งเสียงดังอย่างสับสน อย่างอึ่งหลาย ๆ ตัวร้อง
อโหสิ 0,ก.,อ้อ - คำอุทานแสดงการรับรู้หรือตอบรับ
ออ 0,ก.,ต้นอ้อ
อ่อ 0,*อ.,ข้างขึ้น เช่น ออก ๘ ค่ำ - ขึ้น ๘ ค่ำ และเรียกเดือนข้างขึ้นว่า เดือนออก คู่กับ เดือนแรม คือ ข้างแรม
อ้อ 0,น.,คำที่เติมหลัง พ่อ หรือ แม่ แปลว่า โยมอุปัฏฐาก
ออก 0,น.,ออก - อาการที่เคลื่อนไปข้างนอกหรือพ้นจากที่ปิดบัง เคลื่อนจากที่ พ้นภาวะ ผลิ แตกกิ่ง ผุดขึ้น โผล่ขึ้น ทำให้ดีขึ้น จ่าย ตรงข้ามกับเข้า
ออก 1,น.,การปรุงอาหารประเภทหนึ่ง ใช้ใบตองหลายชั้นเย็บเป็นภาชนะวางบนถ่านไฟร้อน การปรุงใช้น้ำไม่มากและใช้เวลาไม่นาน ปัจจุบันเรียกการปรุงอาหารไม่จำกัดชนิดของภาชนะแต่ใช้ น้ำน้อยแล้วใช้ไฟต่ำเช่นเดียวกับกรรมวิธีนี้ว่า อ็อก ด้วย
ออก 2,ก.,"ทำให้ใช่สุกโดยการ ''อ็อก"" ซึ่ง มักจะเดิมน้ำพริกที่ตำจากพริกสด กวนผสมในไข่ด้วย"
อ็อก 0,*น.,(ข้าว) ตกรวงหรือมีรวง
อ็อกไข่ 0,*ก.,จ่ายทรัพย์
ออกงวง 0,ก.,(ยกทัพ) ออกไปหา (ข้าศึก)
ออกเงิน 0,ก.,วุ้นที่เกิดจากดินในนาเมื่อได้รับน้ำหรือฝนในระยะต้น ๆ ดูฝน
ออกชู 0,ก.,เลิกอยู่ไฟ
ออกดิน 0,น.,ออกหัด เป็นหัด มีผื่น แดงขึ้นตามตัว
ออกเดือน 0,ก.,ลักษณะของสิ่งเล็กน้อยที่กลมกลึงสมรูป ลักษณะเป็นปุ่มเป็นปมขนาดย่อม มักใช้ ตันอ็อกต็อก เล็กและหนักแน่นหรือกลมกลึง
ออกแดง 0,ก.,เนื้ออ่อนส่วนคอของต้นตาล ใช้เป็นอาหารได้
อ็อกต็อก 0,ว.,เป็นโรคอีคำอีแดง
ออกตาล 0,น.,เป็นโรคอีสุกอีใส มีตุ่มใสขึ้น
ออกตุ่มแดง 0,ก.,ไก่น้ำ - ชื่อนกชนิดหนึ่ง
ออกตุ่มไส 0,ก.,ขึ้นจากน้ำ อาการที่ปลาบ้วนน้ำให้เห็นเป็นรอยบนผิวน้ำ
ออกน้ำ 0,น.,ออกจากบ้าน
ออกน้ำ 1,ก.,"ปรุงปลาเป็นอาหารโดยวิธี ""อ็อก"" นิยมใช้ปลาปรุงร่วมกับมะเขือยาวหั่นเป็นชิ้น ปรุงกับน้ำพ่ริกที่ตำจากพริกสด"
ออกบ้าน 0,ก.,ลักษณะเป็นปุ่มนูนขนาดย่อม ดูเพิ่มที่ อุกปุก
อ็อกปลา 0,*ก.,เนื้ออ่อนส่วนคอของมะพร้าว ใช้ทำอาหารได้
อ็อกป็อก 0,ว.,อาการที่แม่ไก่พาลูกน้อยออกจากรังเพื่อเริ่มชีวิต อาการที่สัตว์ปีกบินจากรัง
ออกพล้าว 0,น.,ขึ้นรา มีเชื้อราขึ้น
ออกรัง 0,ก.,หน้าแล้ง
ออกรา 0,ก.,เข้าสู่ฤดูแล้ง
ออกแล้ง 0,น.,เรียกวันที่สิ้นการจำพรรษาแห่งพระสงฆ์ คือวันขึ้น ๑๕ ค่ำ เดือน ๑๑ ช่วงเวลาหลังจากการออกพรรษาแล้ว
ออกแล้ง 1,ก.,ออกไปจากเมือง
ออกวัสสา 0,น.,เป็นฝีเพราะไข้ทรพิษ ดูเพิ่มที่ สับสุก
ออกเวียงไพ 0,ก.,เป็นโรคอีสุกอีใส มีตุ่มใสขึ้น
ออกสุก 0,ก.,รู้ลึกอุ่นใจ หรือคาดหมายว่าจะได้สิ่งดี
ออกไส 0,ก.,หน้า เป็นผู้นำเป็นผู้รับผิดชอบ
อ็อกหน็อก 0,ว.,ลักษณะของสิ่งที่ทิ้งไว้เป็นกองเล็กอย่างกองผ้าขี้ริ้ว
ออกหน้า 0,ก.,ลักษณะกองเล็กกองน้อยหลาย ๆ กอง
