อ็อกหย็อก 0,ว.,อาการที่ปลาผุดขึ้นโผล่หัวเหนือผิวน้ำ
อ็อกหย็อกแอ็กแหย็ก 0,ว.,มันสมอง
ออกหัว 0,ก.,กระดอง - ส่วนแข็งที่หุ้มสัตว์บางชนิด เช่น ปูหรือเต่า
ออกออ 0,น.,คำสั่งที่ควาญช้างสั่งให้ช้างใช้งางัดไม้ซุง
ออง 0,น.,กระดอง - ส่วนแข็งที่หุ้มสัตว์บางชนิด เช่น ปูหรือเต่า
ออง 1,น.,กระทงที่ยกขอบสูงไม้งอมีเชือกร้อยใช้ผูกวัวหรือควายเช้ากับแอก
อ้อง 0,น.,ลักษณะของสิ่งเล็กที่เป็นแอ่ง อย่างกระดองสัตว์ เช่น กระดองปู ถ้าของสิ่งใหญ่เป็นแอ่งใช้ อ้ง
อ้อง 1,น.,ของสิ่งเล็กที่เป็นแอ่งอย่างอุ้งมือ แอ่งนํ้าขนาคเล็ก
อ้อง 2,น.,ลักษณะของที่เป็นอุ้งและมีขอบสูง
อ้องขะหล้อง 0,น.,เสียงร้องไห้ของทารก
อ้องขะหล้อง 1,น.,เปล่งปลั่ง - ใช้สำหรับของสิ่งเล็ก เช่น แก้มใสอ่องต่อง
อ่องแง้ 0,น.,เปล่งปลั่ง - ใช้สำหรับของสิ่งเล็ก เช่น แก้มใสอ่องต่อง
อ่องต่อง 0,ว.,กระโถนน้ำหมาก
อ้องต้อง 0,ว.,ภาชนะอย่างกระทงกาบหมากที่เย็บขึ้นสำหรับบ้วนน้ำมาก บางครั้งหมายถึงกระโถนด้วย
อองน้ำหมาก 0,น.,ลักษณะของสิ่งแบนหรือปากผายที่พองหรือป่องกลาง ขนาดย่อม
อ้องน้ำหมาก 0,น.,ลักษณะของที่ป่องหรือนูนขนาดเล็ก
อ่องพ่อง 0,น.,การเล่นเลียนแบบทารกที่นอนหงายยกมือเท้าโบกไปมา
อ้องย่อง 0,ว.,ใช้เรียกท่าว่ายน้ำท่ากรรเชียงด้วย
อ่องแล 0,น.,เสียงร้องไห้ของทารก
อ่องแล 1,น.,เสียงร้องไห้ของทารก
อ่องแล 2,น.,ลักษณะของที่เป็นอุ้งและมีขอบสูง
อ่องแว้ 0,น.,ของสิ่งเล็กที่เป็นแอ่งอย่างอุ้งมือ แอ่งนํ้าขนาคเล็ก
อ้องหม้อง 0,น.,ลักษณะของที่เป็นอุ้งและมีขอบสูง
อ้องหม้อง 1,น.,มันสมอง
อ้องหล้อง 0,น.,กร้องแกร้ง - อาการเดินที่ทำเอวคดไปมาเรียกว่า ย่างด้องแด้ง
อ่องออ 0,น.,อ้อนแอ้น แบบบาง อาการกรีดกราย ลักษณะที่เดินเอื่อย ๆ ทอดอารมณ์
อ้องแอ้ง 0,ว.,ลักษณะของที่ไม่สูงแต่กลมกลึงสมรูป ถ้าสูงใหญ่ใช้ อึ้ทึ
อ้องแอ้ง 1,ว.,กำลังพอดี พอเหมาะอย่าง หนาวอ้อดฮ้อด - หนาวพอทนได้
อ้อดท้อด 0,ว.,ผิวสีดำ มอยอ็อดฮ็อด - ผิวคล้ำขำคม
อ้อดฮ้อด 0,ว.,สีชมพู
อ้อดฮ้อด 1,ว.,ก่อน ก่อนหน้า ครั้งก่อน เวลานานมาแล้ว ออนหลัง - เกือบลืม
ออน 0,ว.,ยอมรับในอำนาจ
ออน 1,ว.,อ่อน ไม่กระด้าง นิ่มนวล
อ่อน 0,ว.,ยอมยกให้เป็นใหญ่กว่าตน
อ่อน 1,ว.,อ้อน - พร่ำร้องขอ ออดอ้อน ร้องสำออย ร้องไห้อย่างเด็กอ่อน
อ่อน 2,ก.,ขาไม่มีกำลัง
อ้อน 0,ก.,ชื่อพรรณไม้เถาชนิดหนึ่ง
อ่อนขา 0,ว.,เข็ดฟัน
ออนขาว 0,น.,เข็ดฟัน - เสียวฟัน เพราะกินของเปรี้ยว
อ่อนเขี้ยว 0,ว.,แขนไม่มีกำลัง
อ่อนเขี้ยว 1,ว.,ยอมอ่อนให้ ออมมือ ออมแรง ดู อ่อนหื้อ
อ่อนแขน 0,ว.,ขาไม่มีกำลัง
อ่อนฅ่อ 0,ก.,อ่อนใจ - เหนื่อยใจ ระอาใจ ท้อใจ
อ่อนแฅ่งอ่อนขา 0,ว.,เรื่อย ๆ เพราะพริ้ง สวย งาม นิ่มนวล เช่น เดิก็มาออนชอน ดาวหมองหม่นฝ้า - ความดึกค่อย ๆ โรยตัวมาถึงและเหล่าดวงดาวรุบรู่ในหมู่เมฆ
อ่อนไจ 0,ก.,เครือออน พวงประดิษฐ์
ออนซอน 0,ว.,นำทาง
ออนแดง 0,น.,ยอมยกให้เป็นใหญ่กว่าตน
ออนทาง 0,ก.,นิ่มนวล อ่อนโยน
อ่อนน้อม 0,ก.,เปื่อย ไม่เหนียว ไม่กระด้าง
อ่อนม้อย 0,ว.,เปื่อย ไม่เหนียว ไม่กระด้าง
อ่อนมุ้ย ๆ 0,ว.,ก่อนผู้อื่น
อ่อนหมุ้ย ๆ 0,ว.,ง้อ - ขอคืนดีด้วย ลดทิฏฐิ
ออนหมู่ 0,ว.,ต่อให้ ยอมให้มีสิทธิพิเศษบางประการ
อ่อนหา 0,ก.,อ่อนใจ - เหนื่อยใจ ระอาใจ ท้อใจ
อ่อนหื้อ 0,ก.,นิ่มนวล งดงาม
อ่อนอกอ่อนใจ 0,ก.,อ่อนหวาน นิ่มนวล ละมุนละไม
อ่อนอ้วน 0,ว.,ร้องไห้หรือร้องไห้อ้อนกระซิก ๆ
อ่อนอ้อย 0,ว.,บริเวณของผาแคบที่น้ำไหลแรงและมักมีโพรงอยู่ใต้น้ำ
อ้อนอะฮิ ๆ 0,ก.,ลักษณะของส่วนปากภาชนะหรือของที่แคบหรือสอบเข้า
ออบ 0,น.,แช่มช้า นุ่มนวล
อ้อบ 0,ว.,ลักษณะของสิ่งเล็กทรงกลมที่คว่ำอยู่ ดูเพิ่มที่ อ้บพบ
อ้อบช้อย 0,ว.,อ้อปัญญา - อ้อในพิธีที่ช่างซอ หรือนักขับดัดทำขึ้น โดยจะเอาน้ำผึ้งใส่ในปล้องอ้อในพิธีนี้แล้วทำพิธี จากนั้นให้ผู้เข้าพิธีกินน้ำผึ้งในปล้องอ้อ กล่าวกันว่า ผู้ที่ผ่านพิธีนี้จะมีสมองปลอดโปร่ง มีความคิด และปฏิภาณโล่งตลอดเหมือนปล้องอ้อและถ้อยคำที่ขับซอนั้นจะหวานไพเราะเหมือนน้ำผึ้ง อ้อผะหยา ก็เขียน
อ้อบพ้อบ 0,ว.,กระปุก - ภาชนะรูปป้อม ๆ เตี้ย ๆ ขนาดเล็กโดยมากมีปากแคบก้นปอด
อ้อประยา 0,น.,ตะเกียงน้ำมันก้าดที่ทำจากกระป๋องนม
ออม 0,น.,เคี่ยว - ต้มนาน ๆ และใช้ไฟไม่สูง ใช้เวลานาน
ออม 1,น.,อ้อม - โอบรอบ ตีวงโค้ง ดักหน้า ห่อหุ้ม
อ่อม 0,ก.,ไม่พูดตรง ๆ
อ้อม 0,ก.,ไม่ตรง วกวน คดเคี้ยว
อ้อม 1,ก.,คลุ้ง ตลบ - ใช้กับการบรรยายลักษณะควันหรือฝุนควันที่คลุ้งในปริมาณไม่มาก ถ้าคลุ้งตลบเรียก อุ้ม
อ้อม 2,ว.,เรียกมาตราวัดของกลมขนาดใหญ่ โดยใช้คนโอบ เช่น ไม้ยางไหย่สามอ้อม - ต้นยางโตขนาดสามคนโอบ
อ้อม 3,ว.,ขลุกอยู่ด้วยก้น
อ้อม 4,ล.,โอบรอบ การวัดขนาดของสิ่งใหญ่โดยใช้แขนโอบให้ปลายนิ้วที่งสองมือแตะกัน
อ่อมกัน 0,ก.,กะทัดรัด แต่ค่อนข้างจะหย่อนกว่า อ้อมต้อม
อ้อมจอด 0,น.,กะทัดรัด พอดี พอเหมาะพอสม ใช้กับของสิ่งเล็ก
อ้อมซ้อม 0,น.,ประคบประหงม ดูแลทะนุถนอมอย่างยิ่ง
อ้อมต้อม 0,ว.,ลักษณะของลสิ่งที่ขดจนเป็นวงหรือกลมแน่น มักใช้ตามหลัง มน เป็น มนอ้อมหล้อม คือกลมตะล่อมป้อม
ออมเปาะออมปอย 0,ก.,ลักษณะของกลมหลายขนาดวางคละกันอยู่
อ้อมหล้อม 0,ว.,โกร๋น มีน้อย เบาบาง อย่างมีผมน้อย เช่น หัวออย - ผมโกร๋น
อ้อมหล้อมแอ้มแหล้ม 0,ว.,ให้อาหาร เช่น อ่อยเข้าไก่ - ให้อาหารแก่ไก่ โปรย โรย พรำ เช่น ฝนอ่อย ล่อด้วยเหยื่อ ถ้าโปรยของ ละเอียดใช้ อุ่ย หรือ หุ่ย
ออย 0,ว.,โปรยอย่างโปรยข้าวให้ไก่
อ่อย 0,ก.,ต้นอ้อย ใช้หีบเอาน้ำหวานเรียก น้ำอ้อย
อ่อย 1,ก.,กลิ่นโชยมาเป็นครั้งคราว
อ้อย 0,น.,อ้อยแดง - ชื่ออ้อยที่เปลือกลำต้นและใบสีม่วงแดงใช้ทำยาได้
อ่อย ๆ 0,ว.,อ้อยขาไก่ - ชื่อพันธุ์อ้อยขนาดเล็กชนิดหนึ่ง
อ้อยคำ 0,น.,ต้นกุ๊ก – ไม้ล้มลุกชนิดหนึ่ง
อ้อยแฅ่งไก่ 0,น.,ต้นอ้อยช้าง ชื่อเดิมของดอยสุเทพคือ ดอยอ้อยช้าง เนื่องจากมีต้นอ้อยช้างมาก และมีภาษาบาลีว่า อุจฉุปัพพตะ
อ้อยช้าง 0,น.,นิ่มนวล น่ารัก เช่น ออยม่อยเนื้อ เจ้าไหลหลิดตา คือเจ้าผู้ผิวงามน่ารัก ซึ่งเหลือบแลสายตาเป็นประกายงามอยู่ไปมา
อ้อยช้าง 1,น.,เถาชะเอม
ออยม่อย 0,ว.,อ้อยชนิดที่มีขนาดโตมาก
อ้อยสามสวน 0,น.,คำอุทานแสดงความสงสารแกมสมเพช
อ้อยหก 0,น.,มีเสียงดังอ้อแอ้ เสียงดังอย่างคนพูดไม่เป็นคำ
อ้ออ้อย 0,ว.,เสียงที่เปล่งออกมาเพราะความอึดอัดทุกข์ร้อน ใช้ตามหลัง คัด เป็น คัดอ้ะ ๆ อึดอัดมาก จุกมาก
อ้อแอ้ออแอ 0,ว.,กระจุกกระจิก เล็ก ๆ น้อย ๆ
อ้ะ ๆ 0,ว.,กระจุกกระจิก เล็ก ๆ น้อย ๆ
อะจิกอะจ็อก 0,ก.,ส่งเสียงกระแอมกระไอเพื่อให้โปร่งคอหรือเพื่อให้ผู้อื่นรู้
อะจิกอะจ็อก 1,ว.,ส่งเสียงกระแอมกระไออย่างเป็นสัญญาณให้รู้
อะรืออะแรม 0,ก.,กระแอม
อะรืออะแรม 1,ว.,งู ๆ ปลา ๆ นิด ๆ หน่อย ๆ เล็ก ๆ น้อย ๆ ทีเล่นทีจริง
อะแรม 0,ก.,รู้สึกปวด ๆ หาย ๆ ในท้อง
อะล็อกค็อกแค็ก 0,ว.,ปวด ๆ หาย ๆ ในท้อง
อะล็อกอะล่อย 0,ว.,ประปราย หรอมแหรม ควรใช้ พรอนแพรน
อะล็อกอะล่อย 1,ว.,พลอมแพลม หรอมแหรม
อะลอนพรอนแพรน 0,ว.,หรอมแหรม - ลักษณะของสิ่งที่มีอยู่ประปราย
อะลอนพรอนแพรน 1,ว.,หร็อมแหร็ม หยอมแหยม - ไม่หนาแน่น
อะลอนพรอนแพรน 2,ว.,หรอมแหรม - ลักษณะของสิ่งที่มีอยู่ประปราย
อะลอนภอนแภน 0,ว.,โอ๊ย - คำอุทานแสดงว่าเจ็บปวด
อะลอนภอนแภน 1,ว.,โอ๊ย - คำอุทานแสดงว่าเจ็บปวด
อะลา 0,ว.,ลักษณะกลิ่นที่เหม็นเอียน ชวนคลื่นเหียนอย่างกลิ่นเหม็นเขียว เป็นต้น
อะล๊า 0,ว.,ตั้งขึ้น ชูขึ้นอย่างไม่เป็นระเบียบ หรอมแหรม
อะลิ้งอะธิ้ง 0,ว.,พะรุงพะรัง
อะลิมซิมซี่ 0,ว.,ลวก ๆ ไม่เข้าที่เข้าทาง
อะลุงธุงนัง 0,ว.,ลวก ๆ ไม่เข้าที่เข้าทาง
อะลูบ่าธู 0,ว.,ลักษณะของเหลวข้น ๆ เขละ ๆ
อะลูอะธู 0,ว.,เขบ็จขบวน ท่าทาง ท่วงที ระเบียบวางโต ผึ่งผาย องอาจ แสดงท่าหยิ่งหรือไว้ยศ
อะเลอะเมอะมะ 0,ว.,เบ๊อะบ๊ะ แผ่ออก ขยายออกอย่างไม่มีรูปแบบหรือไม่น่าดู อย่างพุงหลาม
อะเละ 0,น.,เสียงร้องไห้ของทารก
อะเลิมเภิมเภิ้อ 0,ว.,อะไร สิ่งใด
อะแล 0,น.,อะไร สิ่งไหน
อะสัง 0,น.,ลักษณะของโปร่ง ที่วางกองอยู่อย่างไม่เรียบร้อย ถ้ากองแน่นทึบเรียก อุหยุ
อะสัง 1,ว.,เกะกะ เก้ง ๆ ก้าง ๆ
อะหยะ 0,ว.,อะไร สิ่งใด
อะหยะอ่างย่าง 0,ว.,อะไร สิ่งไหน
อะหยัง 0,น.,อะไรอย่างใด อะไร หรือ
อะหยัง 1,ว.,อะไรอย่างใด อะไร หรือ
อะหยังชาได 0,ว.,อะไรอย่างนั้น
อะหยังชาหา 0,ว.,กระจุกกระจิก
อะหยังอย่างอั้น 0,ว.,กระจุกกระจิก เล็ก ๆ น้อย ๆ
อะหยิกอะหย็อก 0,ว.,กระจุกกระจิก เล็ก ๆ น้อย ๆ
อะหยิกอะหย็อก 1,ก.,เป็นตะปุ่มตะป่ำ
อะหยิกอะหย็อก 2,ว.,ขรุขระ เป็นตะปุ่มตะป่ำ
อะหลกขกขัก 0,ว.,ขรุขระ เป็นตะปุ่มตะป่ำ
อะหลกขกขัก 1,ว.,ก๊อก ๆ แก็ก ๆ เล็ก ๆ น้อย ๆ ไม่เป็นชิ้นเป็นอัน
อะหลกปกปัก 0,ว.,ก๊อก ๆ แก็ก ๆ เล็ก ๆ น้อย ๆ ไม่เป็นชิ้นเป็นอัน
อะหล็อกก๊อกแก็ก 0,น.,ก๊อก ๆ แก็ก ๆ เล็ก ๆ น้อย ๆ ไม่เป็นชิ้นเป็นอัน
อะหล็อกจ็อกแจ็ก 0,น.,ปวด ๆ หาย ๆ ในท้อง
อะหล็อกป็อกแป็ก 0,น.,กระต่องกระแต่ง - อาการที่แขวนอยู่และแกว่งไปมา ไม่เป็นหลักเป็นฐานแน่นอน
อะหล็อกอะหล่อย 0,ว.,ซอกแซก ดั้นด้น สอดแทรก
อะหล่องต่องแต่ง 0,ว.,เฉื่อย ๆ เอื่อย ๆ เรื่อย ๆ เปื่อย ๆ ไม่จริงจังรีบร้อน
อะหล่องต่องแต่ง 1,ว.,ก๊อก ๆ แก็ก ๆ เล็ก ๆ น้อย ๆ ไม่เป็นชิ้นเป็นอัน
อะหล่องต่องแต่ง 2,ว.,เถลไถล แชเชือน บิดพลิ้ว หลีกเลี่ยงความรับผิดชอบ
อะหล็อดป็อดแป็ด 0,น.,แอบหนีไป
อะหลอดสอดแสด 0,ว.,ลักษณะของสิ่งเล็กที่อ่อน ปวกเปียก กะปลกกะเปลี้ย อ่อนเปลี้ย ระทดระทวย
อะหลอดสอดแสด 1,ว.,เป็นชิ้นเล็กชิ้นน้อย
อะหลอบปอบแปบ 0,ว.,เป็นชิ้นเล็กชิ้นน้อย เช่น ตัดเป็นก้อมเป็นแก้ม
อะหล้อมก้อมแก้ม 0,ว.,ชิ้นเล็กชิ้นน้อย
อะหล้อมก้อมแก้ม 1,ว.,ลวก ๆ ลน ๆ ผสมปนเปทั้งรีบร้อนและไม่เรียบร้อย
อะหล้อมก้อมแก้ม 2,ว.,เก้ง ๆ ก้าง ๆ เกะๆ กะ ๆ
อะหลากสากเสก 0,ว.,หลวมโพรกเพรก - ลักษณะอย่างสวมเสื้อผ้าที่โตโคร่งคร่าง
อะหล้างก้างเก้ง 0,ว.,กระจุกกระจิก เล็ก ๆ น้อย ๆ
อะหลาบตาบเตบ 0,ว.,กระจุกกระจิก เล็ก ๆ น้อย ๆ
อะหลิกจิกจ็อก 0,ว.,เล็ก ๆ น้อย ๆ
อะหลิกปิกป็อก 0,ว.,กระจุมกระจิ๋ม
อะหลิกปิกป็อก 1,ว.,กระจุมกระจิ๋ม
อะหลิดจิ้ดจ็อด 0,ว.,กระท่อนกระแท่น ไม่เป็นชิ้นเป็นอัน
อะหลิดอะหล็อด 0,ว.,กระจุกกระจิก
อะหลิ่นติ่นต่อน 0,ว.,รุ่ย ๆ ร่าย ๆ ไม่เสมอกัน ไม่เรียบร้อย
อะหลุกจุกจิก 0,ว.,คำอุทานแสดงความตื่นเต้นและสนุกสนาน
อะหลุ่ยตุ่ยต่าย 0,ว.,ตะปุ่มตะป่ำ
อะหลุ้ยหลุ้ยหลุ้ย 0,ว.,ไม่ละเอียด
อะหลูดจูดจีด 0,ว.,อร่อย - มีรสดี น่าประทับใจใน รสชาติหรือสีสัน
อะหลูบบูบบาบ 0,ว.,อะไร สิ่งไหน
อะห่อย 0,ว.,ไร้สาระ
อะหัง 0,ว.,ดู - อะเลิมเภิมเภ้อ
อะเหลาะเบาะแบะ 0,ว.,ลักษณะผลงานที่ทำอย่างลวกๆ พอให้เสร็จเท่านั้น
อะเหลิ่มเผิ่มเผ้อ 0,?,คำอุทานแสดงว่าประหลาดใจและตื่นเต้น
อะโหลกโกกเกก 0,ว.,เสียงร้องไห้กระซิก ๆ
อะโหลโลโล 0,ว.,ส่งเสียงกระแอมกระไอเพื่อให้โปร่งคอหรือเพื่อให้ผู้อื่นรู้
อะฮิ ๆ 0,ว.,ส่งเสียงกระแอมกระไออย่างเป็นสัญญาณให้รู้
อะฮืออะแฮม 0,ก.,กระแอม
อะฮืออะแฮม 1,ว.,อักษร ตัวหนังสือ
อะแฮม 0,ก.,จำนวนนับอย่างสูง คือ ๑ มีศูนย์ตามหลัง ๔๒ ตัว
อักขระ 0,น.,กองทัพที่มีกระบวนพร้อมมูล
อักโขภิณี 0,น.,อัคคสาวก - สาวกผู้เป็นเลิศ หมายถึงพระสารีบุตร (อัครสาวกเบื้องขวา) และพระโมคคัลลานะ (อัครสาวกเบื้องซ้าย)
อักโขภิณี 1,น.,ไฟ
อัคคสาวกะ 0,น.,ส่วน ภาคแห่งร่างกาย โอ
อัคคี 0,น.,ชื่อแคว้นใหญ่แคว้นหนึ่งใน ๑๖ แคว้นแห่งชมพูทวีปมีนครหลวงชื่อจัมปา
อังคะ 0,น.,ชื่อวันที่ ๓ ของสัปดาห์
อังคะ 1,น.,ตำรานพเคราะห์นับเอาเป็นดาวพระเคราะห์ดวงที่ ๓ ชื่อดาวเคราะห์ดวงที่ ๔ ในระบบสุริยะ
อังคาร 0,น.,ถวายอาหารแก่พระภิกษุ
อังคาร 1,น.,ชื่อนิกายที่ ๔ ในบรรดานิกาย ๕ แห่งพระสุตตันตปิฎก
อังคาส 0,ก.,ไหว้
อังคุตตรนิกายะ 0,น.,อัญเชิญ เชิญด้วยความเคารพ
อังชุลี 0,ก.,เชิญ - แสดงความประสงค์เพื่อขอให้ทำอย่างใดอย่างหนึ่ง
อังเชิญ 0,ก.,อัญเชิญ เชิญด้วยความเคารพ
