โย้ง 0,น.,เรียกชื่อกางเกงเป้ายานแบบจีน เตี่ยวย้ง เตี่ยวสะดอ
โยงขัน 0,ก.,ไหว้ครู
โย่งฅว่าง 0,ก.,งัดทิ้ง โยนทิ้ง
โย่งฅว่าง 1,ว.,"มักใช้ประกอบคำ ""หายใจ"" เป็น หายใจโย่งฅว่าง - หายใจหอบ"
โย่งซัด 0,ว.,"มักใช้ประกอบคำ ""หายใจ"" เป็น หายใจโย่งฅว่าง - หายใจหอบ"
โยงๆ 0,ว.,เปล่งปลั่ง สุกใส ใช้กับสิ่งใหญ่ เช่น เดือนแจ้งใสโยงๆ (พระจันทร์แจ่มกระจ่าง)
โย่งๆ 0,ว.,อาการที่ของสิ่งใหญ่ลอยขึ้นเรื่อยๆ
โยชนะ 0,น.,โยชน์ - ชื่อมาตราวัดเท่ากับ ๔๐๐ เส้น
โยชนา 0,น.,ชื่อคัมภีร์บาลีประเภทหนึ่ง ซึ่งบอกสัมพันธ์ศัพท์บาลีว่าศัพท์ไหนเข้ากับศัพท์ไหนในต้นฉบับนั้นๆ เช่น โยชนาฎีกาสังคหะ
โยด 0,ว.,ยวด - เป็นที่สุด มักใช้ประกอบกับคำอื่นเป็น ยึ่งโยด
โยต่างกลอน 0,น.,จันทันพราง - ตัวไม้เครื่องบนเรือนที่ไม่อยู่ตรงกับขื่อดังปรกติ
โยน 0,ก.,กระโดดโลดเต้น คึกคะนอง
โยน 1,น.,ชื่อของชาวไทล้านนา
โยนก 0,น.,ชื่อของคนเผ่าไทยวน
โยนกนคร 0,น.,หมายถึงเมืองเชียงแสน
โยยา 0,ว.,ชั่วช้า ไพร่
โยยาสามานย์ 0,น.,คนชั่วช้า คนเลว ไพร่
โยะๆ 0,ว.,อาการขย่มยวบๆ อย่างหาบของหนัก ยักแย่ยักยัน
ไย 0,น.,ใย - สิ่งที่เป็นเส้นเล็กๆ บางๆ เช่น ใยบัว ลวดขนาดเล็กอย่างที่ใช้ขนเป็นลานจักรของนาฬิกาข้อมือ คลื่นความกังวานของเสียง
ไย 1,ว.,กังวาน ใช้กับเสียงอย่างเสียงกระดิ่ง
ไย 2,*น.,ไฉน อะไร ทำไม
ไย่ 0,ว.,อาการที่ี่แตกกระจัดกระจาย (ศิลาจารึกหลักที่หนึ่งใช้ หนียะย่ายผ้ายจะแจ)
