คำ,POS,ความหมาย
ซกทก 0,ว.,ซบเซา จับเจ่า มักตามหลังคำว่า เหงา แปลว่า ซึมเซา ใช้กับสิ่งที่มีขนาดใหญ่
ซง 0,ก.,บัง แอบ แฝง
ซง 1,ว.,อยู่ในที่ไกลผู้คน
ซงซ่อน 0,ก.,ซุกซ่อน หลบลี้
ซด 0,ก.,ซุ้อน - เรียงกันเป็นชั้นๆ เช่น จุมปากลีบซด - จำปากลีบซ้อน
ซด 1,ว.,จำนวนขั้นของหลังคาวิหาร หรือล้านนาแบบล้านนา เช่น วิหาร ๓ ชั้น เรียกว่า วิหาร ๓ ซด
ซน 0,ก.,ผลัก ดัน โผล่ออกมา
ซ้น 0,ก.,เร่งเร้า ยัด ดันเข้า ขับเข้า กระทุ้ง ทำให้เร็วขึ้น
ซ้น 1,ก.,เคล็ด - กระดูกเคลื่อน เช่น แขนซ้น
ซนไฟ 0,ก.,ซนไฟ - ดันฟืนที่ไหม้ไฟบ้างแล้วเข้าไปในกองไฟ
ซบ 0,ก.,ฟุบหน้าลงไป
ซบ 1,ว.,หงอยเหงา ไม่เบิกบาน
ซบเซาเหงาหมอง 0,ว.,หงอยเหงา ไม่เบิกบาน
ซบเซาเหงาอยู่ 0,ว.,หงอยเหงา ไม่เบิกบาน
ซวก 0,ก.,กระซวก กระหน่ำ ทิ่มหรือแทงลงไป
ซวก 1,ก.,ล้างชำระ ซัก - อาการที่นำเอาวัสดุไปจุ่มน้ำขึ้นๆ ลงๆ
ซวง 0,ก.,โอบ กอด
ซวง 1,ก.,บางแห่งแปลว่า สละ ละทิ้ง ซึ่งน่าจะเป็นความหมายของ ซวาง
ซวด 0,ก.,ชวด หมดหวัง ผ่านไปแล้ว
ซ่วย 0,ก.,ล้าง ชำระด้วยน้ำ
ซ่วย 1,ก.,ล้าง ชำระให้สะอาดด้วยน้ำ
ซ้วย 0,ว.,เอียง เฉียง ไม่ตรงตามกำหนด
ซ้วย 1,ว.,ลักษณะที่เป็นมุมแหลมออกไป
ซ่วยสี 0,ก.,ชำระ ขัดสี
ซวะ 0,ก.,ชะ ชำระ ล้างข้าวที่หม่าหรือแช่ไว้เพื่อให้หมดกลิ่นก่อนนำไปนึ่ง
ซวะ 1,ก.,วาง สละ ละไว้
ซวะไซว้ 0,ว.,ขวักไขว่ สับสน รวดเร็ว บ่อยๆ
ซวะไซว้ 1,ว.,บ่อยๆ ขวักไว่ สับสน รวดเร็ว
ซว่า 0,ว.,ซ่า ซู่
ซว้า 0,ก.,ผัดโดยใช้น้ำมันหรือน้ำเล็กน้อย ตั้งไฟแล้วพลิกกลับไปมา
ซว้า 1,ก.,อาการที่ี่นำเอาอาหารที่ปรุงแล้วลงผัดในน้ำมันร้อนเป็นการปรุงรสอีกครั้งหนึ่ง
ซวาง 0,ก.,สละ ละ ปล่อย วาง
ซว้าง 0,ก.,ซ้อน - เรียงกันเป็นชั้นๆ เช่น จุมปากลีบซด - จำปากลีบซ้อน
ซวาง 1,ก.,สละ วาง ปล่อย
ซวาด 0,ก.,โฉบ เฉี่ยว เฉียด
ซวาด 1,ก.,โชยกลิ่น
ซว่าน 0,ก.,กระวนกระวาย กระสับกระส่าย พล่านพลุ่งพล่าน วุ่นวาย
ซว่าน 1,ก.,ซ่าน แผ่ กระจาย ฟุ้ง
ซว่านสู้ 0,ก.,ใส่จริตแสดงท่าทีให้รู้ว่าพอใจ ร่าน
ซว้าน้ำมัน 0,ก.,อาการที่ี่นำเอาอาหารที่ปรุงแล้วลงผัดในน้ำมันร้อนเป็นการปรุงรสอีกครั้งหนึ่ง
ซวาม 0,ว.,คลำ ใช้มือควานหาหรือสัมผัสในที่มืดหรือมองไม่เห็น
ซอ 0,น.,การขับโต้ตอบระหว่างชายหญิงโดยมีปี่ชุดเป่าคลอ
ซ้อ 0,น.,ต้นซ้อ (ลป.)
ซอก 0,น.,บ้าง ปลอกรัด
ซอก 1,ก.,ย่ำ ซอยเท้า เหยียบลงซ้ำๆ ในที่เดิม กระทุ้ง กระหน่ำ
ซอก 2,ก.,เสาะแสวงหา
ซอกคอ 0,ก.,พูด คุยอย่างไม่รู้จักเลิก (สำนวน)
ซ็อกท็อก 0,ว.,ซอกซ่อ หม่นหมอง ซบเซา จับเจ่า มักตามหลังคำว่า เหงา แปลว่า ซึมเซา ใช้กับสิ่งที่มีขนาดเล็ก
ซอกนา 0,ก.,เหยียบย่ำหญ้าให้จมเลนเพื่อมิให้ขึ้นมารบกวนต้นข้าว
ซอกร่องกล้า 0,ก.,ย่ำดินเพื่อเตรียมหว่านพันธุ์ข้าว
ซอกว้อง 0,ก.,เรียกการที่ใช้มือจับอวัยวะเพศชายแล้วรูดเข้าออก
ซอกว้อง 1,ก.,อาการที่กำอวัยวะเพศชายรูดไปมาเพื่อสำเร็จความใคร่
ซอคร่าว 0,น.,คำประพันธ์ประเภทคร่าวที่นำมาขับเป็นลำนำ ส่วนใหญ่นิยมนำเรื่องชาดกมาขับเป็นลำนำ
ซอฅ่าว 0,น.,คำประพันธ์ประเภทคร่าวที่นำมาขับเป็นลำนำ ส่วนใหญ่นิยมนำเรื่องชาดกมาขับเป็นลำนำ
ซอง 0,น.,ภาชนะสานคล้ายตะกร้าลักษณะแคบทรงสูง
ซอง 1,น.,เรียกไหทรงสูงไม่ป่องมากว่า ไหซอง
ซอง 2,น.,เครื่องใช้ที่มีลักษณะแคบทรงสูงสำหรับสอดใส่สิ่งของ เช่น ซองพลู
ซอง 3,น.,ลักษณะนามเรียกเครื่องใช้ที่มีลักษณะแคบทรงสูงอย่างซองบุหรี่
ซ้อง 0,ว.,สลอน โผล่ขึ้นให้เห็นชัด เช่น หัวยอซ้อง - ยกหัวชูสลอน
ซ่องแซ่ง 0,ก.,กระย่องกระแย่ง - ไม่มั่นคง
ซ่องแซ่ง 1,ว.,กระย่องกระแย่ง ทำกิริยาไม่น่าดู เช่น เมาเหล้าซ่องแซ่ง
ซ้องพ้อง 0,ว.,อาการที่หม่นหมองซบเซา ใช้กับสถานที่ เช่น วัดนี้หมองซ้องพ้องเงียบเหงา
ซ้องพ้อง 1,ว.,ออกราซ้องพ้อง - ขึ้นรา มีเชื้อราขึ้นเต็มไปหมด
ซองหน้า 0,ว.,ต่อหน้า เฉพาะหน้า
ซ่องหน้า 0,ว.,เฉพาะหน้า ต่อหน้า
ซอน 0,ก.,แทรกเข้าไปในระหว่าง พูดแทรกในขณะที่คนอื่นกำลังสนทนากันอยู่ขอเพื่อแต่งงาน ชอ
ซอน 1,ก.,แทรก แซม เบียดเสียด พูดแทรก
ซ่อน 0,ก.,ซ่อน แอบ แฝง ปิดบัง
ซ้อน 0,ก.,วางทับกัน
ซ้อน 1,ว.,เรียกคู่ครองว่า คู่ซ้อน (กวี)
ซ้อนเซื้อม 0,ว.,เป็นคู่ร่วมนอน เป็นคู่ครอง
ซอนลอน 0,ว.,สะพรั่ง สลอน เห็นได้ชัด
ซอนหลังคา 0,ก.,ซ่อมแซมหลังคาส่วนที่รั่ว
ซอบ 0,ก.,พอใจ ถูกใจ
ซอบพอ 0,ก.,ถูกกัน ปรองดองกัน เข้ากันได้ดี
ซอบสู้ 0,ก.,พอใจ มักใช้ในด้านความรู้สึกเกี่ยวกับเรื่องชู้สาว
ซอม 0,ก.,เรียงอย่างซอมพลู หรือ ซอมอ้อย
ซ่อม 0,ว.,เรียกอาการที่ตาฟางหรือมองเห็นไม่ชัดว่า ตาซ่อม
ซ้อม 0,น.,เรียกสากครกกระเดื่องที่ใช้ ซ้อมเข้า ว่า สากซ้อม
ซ้อม 1,ก.,การกระทำในภายหลังเพื่อให้สิ่งนั้นละเอียดหรือสมบูรณ์ เช่น ซ้อมเข้า - ทำข้าวกล้องให้เป็นข้าวสาร
ซอมภอ 0,น.,ต้นหางนกยูงไทย
ซอมภอหลวง 0,น.,ต้นหางนกยููงฝรั่ง
ซ้อมเอื้อง 0,ก.,เคี้ยวเอื้อง
ซ้อแมว 0,น.,ต้นซ้อ (ลป.)
ซอย 0,ก.,หั่น ตัด แล่ ฝาน
ซ้อย 0,น.,ลักษณะนามใช้เรียกสิ่งที่เสียบร้อยเข้าเป็นพวงอย่างพวงปลา
ซ้อย 1,ก.,เสื่อมลง โทรมลง เรียวลง
ซ้อย 2,ก.,เสียบร้อยเป็นพวง
ซ้อย 3,ว.,ปลาย สุดท้าย
ซ้อย 4,ว.,น้อย เล็ก
ซ้อยล้อย 0,ว.,แต่ลำพัง ผู้เดียว
ซ้อยล้อย 1,ว.,ลักษณะสิ่งเล็กที่กลมยาวหรือสลวยเรียงกันอยู่หรือตั้งอยู่อย่างมีระเบียบ งาม สลวย
ซะ 0,ก.,ชะ ชำระ
ซะ 1,ก.,ถ่าย รุ เอาออก สระ
ซะ 2,ก.,เฆี่ยน ตี ตบ ฟาด
ซะ 3,ก.,กิน (สำนวน)
ซะเฅียน 0,น.,ต้นตะเคียน
ซะง้า 0,น.,ปีมะเมีย - ปีนักษัตรที่มีม้าเป็นสัญลักษณ์
ซะชา 0,ก.,ถัก อย่างถักลวดเป็นตาๆ แทนกรอบพระเครื่อง
ซะไซ้ 0,ว.,ขวักไขว่ สับสน รวดเร็ว บ่อยๆ
ซะไซ้ 1,ว.,บ่อยๆ ขวักไว่ สับสน รวดเร็ว
ซะเดน 0,ก.,กระเด็น
ซะทาง 0,น.,เลือนมาจาก สตางค์ (ยืม - สตางค์)
ซะพะ 0,น.,สรรพ - ทั้งหมด ทั้งสิ้น
ซะพะ 1,ว.,ทั้งหมด ทั้งปวง
ซะพัด 0,ก.,สะพัด - ล้อม ปิดล้อม ปิดกั้น
ซะพาย 0,ก.,สะพาย แขวนบ่า ห้อยเฉียงบ่า
ซะเพลา 0,น.,เรือสำเภาใช้แล่นด้วยใบ ซะเพา
ซะไพ้ 0,น.,สะใภ้ หญิงที่มาแต่งงานกับลูกหรือญาติของตน
ซะร่าง 0,น.,สรีระ ร่างกาย
ซะลน 0,ก.,พบโดยกะทันหันหรือบังเอิญ
ซะล้อ 0,น.,เครื่องดนตรีคล้ายซอด้วงของไทยภาคกลาง
ซะล้อ 1,น.,เครื่องดนตรีชนิดหนึ่งคล้ายซออู้
ซะล้อ 2,น.,ซอชนิดหนึ่งของล้านนา
ซะลาบ 0,ว.,อาการที่อ่อนเปลี้ยไม่มีแรง
ซะล่ำ 0,ว.,นานพอควร
ซะลุ้มซะลิ้ม 0,ว.,มืดตอนโพล้เพล้
ซะเล 0,ก.,โซเซ ถลา
ซะเล 1,ก.,เซ ซวดเซ
ซะเลซะลำ 0,ว.,เซ ซวนเซ หัวซุกหัวซุน
ซะเลิ้น 0,น.,ขั้น ชั้น ระดับ ทางลาดชัน
ซะหน้า 0,ก.,ทำให้ขายหน้า ประจาน มักพูดติดกันว่า ซะหน้าซะตา
ซัก 0,น.,ตีน ประคำดีควาย
ซัก 1,ก.,ซัก ชำระ ทำให้สะอาดด้วยน้ำ
ซัก 2,ว.,สัก เพียง ราว
ซักคำเทื่อ 0,*น.,คำลงท้ายแสดงการปฏิเสธ / สักครั้ง
ซักเทื่อ 0,ว.,สักที สักครั้ง
ซักบึด 0,ว.,สักครู่ ชั่วขณะ
ซักบึดซักเมื่อ 0,ว.,ชั่วครู่ชั่วยาม
ซักหน้อย 0,ว.,สักเล็กน้อย แม้แต่น้อย
ซักหว่าง 0,ว.,สักระยะหนึ่ง ชั่วคราว
ซั้ง 0,น.,ราวเกาะ หลัก ร้าน ที่พัก ที่วาง เป็นหลักแก่สิ่งอื่น
ซังแซว 0,น.,นกแซงแซว
ซัด 0,ก.,ซัด ปา เหวี่ยง ทิ้ง กระทำ (สำนวน)
ซัดตาหัน 0,ก.,ทอดสายตามอง เหลือบไปเห็น จ้องมองดู
ซัดโบ้ะซัดบ้ะ 0,ก.,ทิ้งไม่เป็นระเบียบ
ซั้น 0,ว.,กระชั้น ใกล้ ชิด
ซั้น 1,ว.,ชัดเจน รอบคอบ
ซับ 0,น.,บริเวณที่ดินซึ่งมีน้ำซึมอยู่ภายใต้
ซับ 1,น.,ทรัพย์สิน
ซับ 2,ก.,สับ - เอาสิ่งมีคมเช่นมีดฟันลงไป ใช้มีด เป็นต้น ฟันถี่ๆ แต่ไม่ใช้กำลังมาก
ซับซี่ 0,ก.,กระซิบ
ซับซี่ 1,ว.,ลับ ไม่ควรแก่การแพร่งพราย
ซับซี่ 2,ก.,กระซิบกระซาบ ซุบซิบ
ซับซี่ 3,ก.,กระซิบกระซาบ
ซับซี้ 0,ก.,กระซิบกระซาบ ซุบซิบ
ซัพพะ 0,น.,สรรพ - ทั้งหมด ทั้งสิ้น
ซา 0,น.,ต้นชา มักหมายถึงชาข่อยที่นิยมปลูกเป็นรั้วบ้าน
ซ้า 0,น.,ตะกร้า
ซาก 0,น.,ของเหลือเดน ซากศพ
ซากตาย 0,ว.,เดนตาย รอดมาจากตาย (โดยมากใช้เป็นคำด่า)
ซากร่า 0,ว.,เดนห่า รอดมาจากโรคอหิวาต์
ซากฮ่า 0,ว.,เดนห่า รอดมาจากโรคอหิวาต์
ซ้าเข้าวัด 0,ก.,นำเอาอาหารไปถวายพระภิกษุ
ซาง 0,น.,โรคซาง
ซาง 1,น.,ไม้ไผ่หลายชนิด
ซาง 2,น.,ชื่อเห็ดชนิดหนึ่ง (ล.)
ซาง 3,น.,กูดซาง - ชื่อเฟิร์นชนิดหนึ่ง
ซาง 4,น.,กว่างชนิดหนึ่งมี ๕ เขา
ซ่าง 0,น.,ต้นซ่าง
ซางก้นเหี่ยว 0,น.,โรคตานขโมย
ซางคำ 0,น.,ต้นพญาไม้สมุลแว้ง
ซางคำ 1,น.,ชื่อพรรณไม้ยืนต้นชนิดหนึ่ง
ซางฅำ 0,น.,ต้นพญาไม้
ซางจิง 0,น.,ชื่อพรรณไม้ยืนต้นชนิดหนึ่ง
ซางจิง 1,น.,ต้นพญาไม้
ซางราง 0,ว.,ลักษณะสีแดงรางๆ หรือค่อนไปทางสีแดงหรือเห็นได้ในระยะใกล้หรือขนาดใหญ่
ซ่างล่าง 0,ว.,สล้าง - ลักษณะของสิ่งที่ใหญ่ยาวมีแต่โครง
ซ้างวง 0,น.,ตะกร้าที่มีหูโค้ง
ซางหอม 0,น.,ชื่อพรรณไม้ยืนต้นชนิดหนึ่ง
ซางหอม 1,น.,ต้นพญาไม้
ซางหอม 2,น.,ต้นพญาไม้สมุลแว้ง
ซาน 0,ก.,เหาะไปด้วยกำลังฤทธิ์ น่าจะมาจาก ฌาน
ซาบ 0,ก.,กระซิบ
ซาบ 1,ก.,กระซิบ กระซาบ
ซาบ 2,ก.,กระซิบกระซาบ ซุบซิบ
ซาบ 3,ก.,กระซิบกระซาบ
ซ้าเพาะ 0,น.,ชื่อภาชนะสานชนิดหนึ่งใช้ในการขนหิน หรือขนดิน เรียกว่า ซ้าหีควาย
ซ้าเพาะ 1,น.,ตะกร้าทรงป้อมที่ไม่ใหญ่นัก เมื่อใส่ของแล้วพอที่ถือ หิ้ว หรือ เพาะ คือ กระเดียดไปได้
ซ้าเพียด 0,น.,กระบุง กระบุงขนาดย่อม
ซาย 0,น.,ทราย
ซ้าย 0,ว.,ด้านที่อยู่ตรงข้ามกับขวา
ซายขี้เป็ด 0,น.,ทรายถม
ซายขี้เป็ด 1,น.,ทรายสกปรกปนดิน ปนหิน ใช้ถม
ซายถม 0,น.,ทรายสกปรกปนดิน ปนหิน ใช้ถม
ซายมาน 0,น.,ทรายละเอียดที่น้ำพัดพาไปรวมเป็นสันคลื่นในลำน้ำ
ซายมุก 0,น.,ทรายชนิดผงละเอียดปนโคลน
ซ้ายล้าย 0,ว.,ลักษณะของสิ่งใหญ่กลมยาว ตั้งอยู่หรือเรียงกันอยู่โดยมีระเบียบ อย่างเสา หรือแถวต้นไม้ เป็นต้น
ซายหยะ 0,น.,ทรายหยาบ
ซายอ่อน 0,น.,ทรายละเอียด
ซ้าล้อม 0,น.,ชะลอม
ซาลู 0,น.,ผ้าขาวบางเนื้อดี
ซาลู 1,น.,ผ้าสาลู ผ้าขาวบางเนื้อดี
ซาว 0,ว.,จำนวนยี่สิบ
ซ้าว 0,ว.,เสียงเกรียวกราว เสียขรม เซ็งแซ่
ซ้าว ๆ 0,ว.,เสียงเกรียวกราว เสียขรม เซ็งแซ่
ซาวห้า 0,ว.,จำนวนยี่สิบห้า สลึง
ซ้าหลัว 0,น.,ตระกร้าสำหรับบรรจุฟืน
ซ้าหวด 0,น.,ภาชนะสาน ปากผายเล็กน้อย ใช้สำหรับล้างข้าวที่แช่ไว้ค้างคืน
ซ้าหีฅวาย 0,น.,ตะกร้าที่สานโปร่งเป็นอุ้ง ใช้ขนดินหรือหิน มีขนาดเล็กกว่าบุ้งกี๋
ซำ 0,ก.,เคลื่อนไหวอย่างเหยาะๆ เบาๆ หรือนิ่มนวล วิ่งเหยาะ สำบัดย่าง - อาการที่ม้าวิง่ยกเท้าก้าวช้า แต่เร็วกว่าเดิน
ซำ 1,ก.,เย็บถี่ๆ ย้ำด้วยจักรเย็บผ้า
ซ่ำ 0,ก.,กระทุ้งเบาๆ ย้ำเบาๆ เหยียบถี่ๆ เร็ว เดินเร็วๆ
ซ้ำ 0,น.,พื้นที่ชุ่มชื้น
ซ้ำ 1,ก.,กระทำอย่างเดียวกันอีก
ซ้ำ 2,ว.,ยิ่ง มากขึ้น เช่น ซ้ำอู้ค็ซ้ำบ่เข้าใจ - ยิ่งพูดยิ่งไม่เข้าใจ
ซ้ำ 3,ว.,หมด สิ้น ไม่เหลือ เช่น กินเสี้ยงกินซ้ำ - กินจนหมดไม่เหลือ
ซ้ำ 4,ว.,บาง บ้าง ใช้ประกอบหน้าคำนาม หมายความว่า ไม่ใช่ทั้งหมด คือ เป็นส่วนย่อยหรือเป็นส่วนหนึ่งของส่วนรวม เช่น ซ้ำฅนค็มา ซ้ำฅนก็บ่มา บางคนก็มา บางคนก็ไม่มา
ซ้ำซุย 0,ก.,ซ้ำเติม
ซ้ำซุย 1,ก.,คุกคาม
ซ้ำเทื่อ 0,ว.,บางครั้ง บางเวลา
ซำน้อย 0,ก.,วิ่งเหยาะ
ซำน้อยซอยตีน 0,ก.,วิ่งเหยาะ
ซ้ำพร่อง 0,น.,บางคน เช่น ซ้ำพร่องว่าดี ซ้ำพร่องว่าบ่ดี - บางคนว่าดี บางคนว่าร้าย
ซ่ำพีกซ่ำพัก 0,ก.,เดินจ้ำอ้าวๆ
ซ้ำร้าย 0,ว.,ร้ายขึ้นไปอีก หนักกว่าเก่า เลวกว่าเดิม
ซิงริง 0,ว.,ลักษณะสีแดงรางๆ มัวๆ หรือค่อนไปทางสีแดง อย่างแสงไฟริบหรี่ ใช้กับสิ่งของขนาดเล็กหรือเห็นได้ในระยะไกล
ซิด 0,ก.,ใช้มีดเฉือนไปแต่เพียงเล็กน้อย
ซิด 1,ว.,ชิด ใกล้ แนบ ติด
ซิดซั้น 0,ว.,ถี่ยิบ ติดๆ กัน (กวีนิพนธ์)
ซิดซี 0,ว.,ใกล้ชิด ประชิด แนบ ติด
ซิบซี้ 0,ก.,กระซิบ
ซิบซี้ 1,ก.,กระซิบกระซาบ ซุบซิบ
ซิบซี้ 2,ก.,กระซิบกระซาบ
ซิม 0,ก.,แทรกเข้าไปในระหว่าง เติมส่วนที่ขาด เพิ่ม เช่น ซิมนา - ปลูกข้าวกล้าแซมส่วนที่เสียหาย
ซิมนา 0,ก.,นำเอาข้าวกล้ามาปลูกซ่อมส่วนที่เสียหายอย่างที่ถูกปูกัดไป
ซิหี้ 0,ว.,ลักษณะสีแดงรางๆ มัวๆ หรือค่อนไปทางสีแดง อย่างแสงไฟริบหรี่ ใช้กับสิ่งของขนาดเล็กหรือเห็นได้ในระยะไกล
ซิๆ 0,ว.,อาการที่ี่ฝนตกพรำๆ ถ้าฝนตกมาก ว่า ฝนตกซึกๆ
ซี 0,ก.,เฉียด เฉี่ยว ชิด ใกล้
ซี 1,ก.,ตะไบ กรอ ทำให้เรียบด้วยเครื่องมืออย่างตะไบ
ซีก 0,น.,มาตราเงินที่ยืมมาจากกรุงเทพฯ เท่ากับครึ่งเฟื้อง
ซีก 1,น.,ซีก
