ซีก 2,ล.,จำนวนซีก
ซีเนาะซีแน 0,ก.,กระจู่กระจี๋ เคล้าเคลีย
ซีโอย 0,น.,แก่นไม้ข่อยเป็นต้นหั่นแล้วบดให้คลายขี้เลื่อยหยาบคั่วผสมน้ำอ้อย ปนยาฉุน เพื่อทำให้รสของยาฉุนอ่อนลง
ซึกซัก 0,ว.,โชก โชกโชน เปียกจนทั่ว
ซึกซัก 1,ว.,ติดขัด สับสน แออัด อย่างการจราจรที่ติดขัด อาการก้าวเดินที่ไม่สะดวก ซึ่งอาจเกิดจากร่างกายหรือเสื้อผ้าไม่สมดุลก็ได้
ซึกๆ 0,ว.,ลักษณะน้ำที่ย้อย
ซึกๆ 1,ว.,ฝนที่ตกหนักเรียกว่า ฝนตกซึกๆ
ซึง 0,น.,พิณชนิดหนึ่งของล้านนา
ซึง 1,ว.,มาก นาน มักใช้กับฝนอย่างที่ตกมากและเป็นเวลานาน
ซึ่งลึ่ง 0,ว.,เหม่อลอย มึนซึม มึนงง
ซึ่งลึ่ง 1,ว.,ตกตะลึง จังงัง อาการเหม่อลอย อาการเชิดหน้าเพื่อฟังหรือคิดอย่างใจลอย
ซื่อ 0,ว.,ตรง ไม่คด ซื่อสัตย์
ซื้อ 0,ก.,เอาเงินตราแลกกับสิ่งของ
ซื้อ 1,ว.,ร่มครึ้ม เยือกเย็น มักใช้กับคำ เอยน เป็น เอยนซื้อ
ซื่อแซ็ด 0,ว.,ตรงแน่ว
ซุก 0,ก.,ยัด มุด แทก หมกซ่อนไว้
ซุก 1,ก.,เสียบ แทง ปักคาไว้
ซุกซอก 0,ก.,ทะลวง กระซวกหรือกระแทกถี่ๆ เข้าไปในรูหรือระหว่างช่องว่างที่คับแคบ
ซุกซ็อก 0,ก.,ซุกซ่อนเอาไว้ตามมุม
ซุกซ่ำ 0,ก.,ทะลวง กระซวกหรือกระแทกถี่ๆ บนวัตถุพื้นเรียบ
ซุกซ้ำ 0,ก.,ซ้ำเติม ทำให้เดือดร้อนมากขึ้น
ซุกซู่ 0,ก.,เขย่า สั่น ทำให้สะเทือน
ซุกซู่ 1,ก.,เขย่า สั่น ทำให้สะเทือน
ซุน 0,ว.,ยื่นออก เผยออก มักใช้กับฟัน เช่น เขี้ยวซุน - ฟันเขยิน
ซุ่น 0,ก.,ขัดจังหวะ รบกวนโดยรู้เท่าไม่ถึงการณ์
ซุนซาน 0,ว.,โพลน มักใช้ประกอบกับหัวหงอก เป็น หัวหงอกหัวซุนซาน - ผมหงอกขาวโพลน
ซุบซาบ 0,ก.,กระซิบ
ซุบซาบ 1,ก.,กระซิบ กระซาบ
ซุบซาบ 2,ก.,กระซิบกระซาบ ซุบซิบ
ซุบซาบ 3,ก.,กระซิบกระซาบ
ซุม 0,ก.,สูญไป สูญเปล่า
ซุม 1,ว.,มาก จำนวนมาก รวมกันอยู่เป็นจำนวนมาก
ซุ่ม 0,ก.,ซุ่ม - แอบ บัง แฝง เร้น
ซุ่ม 1,ก.,แอบ บัง แฝง เร้นไม่ให้เห็น
ซุ่ม 2,ว.,พร่า ฟาง มองไม่เห็นถนัด มักใช้บอกอาการตาฟางว่า ตาซุ่ม
ซุ้ม 0,น.,สิ่งที่เป็นพุ่ม โดยมากปกคลุมด้วยต้นไม้หรือเถาวัลย์
ซุ้ม 1,น.,ที่อยู่หรือที่พักที่ทำขึ้นเป็นการชั่วคราว
ซุ้ม 2,น.,สิ่งที่สร้างขึ้นให้ต้นไม้ปกคลุม
ซุ้ม 3,น.,สิ่งที่สร้างขึ้นเป็นซุ้มเพื่อความสวยงาม
ซุ้มซิ้ม 0,ว.,โพล้เพล้ เวลาที่จวนจะมืดหรือจวนจะสว่าง
ซุมทีน 0,ก.,ขาดทุน เสียทรัพย์ เข้าเนื้อ
ซุมทีน 1,ก.,ขาดทุน เข้าเนื้อ เสียทรัพย์
ซุ่มมืด 0,ว.,แอบหรือหลบอยู่ในเงามืดหรือความมืด
ซุ้มลุ้ม 0,น.,โพล้เพล้
ซุมหิน 0,น.,ต้นซุมหิน
ซุย 0,ก.,อาการที่ผลักดันสิ่งของให้เคลื่อนไปตามน้ำ
ซุย 1,ก.,การซื้อขายที่ดิน
ซุย 2,ก.,สิ่งของระหว่างญาติพี่น้องในราคามิตรภาพ ไม่แพง
ซุ้ย 0,ก.,จูบ ดม ใช้จมูกสูดกลิ่นด้วยความรัก
ซุยซาย 0,ว.,รุ่ยร่าย รุ่มร่าม (กวีนิพนธ์)
ซุยซ้ำ 0,ก.,คุกคาม
ซุ้ยๆ 0,ว.,เอื่อยๆ อย่างที่ลมพัดหรือน้ำไหลเอื่อยๆ
ซู่ 0,ว.,เสียงที่มักใช้ไล่ตะเพิดไก่ เป็นต้น
ซูด 0,ก.,โฉบ เฉี่ยว เฉียด กิริยาที่นกโผลงจากอากาศมาจับของ
ซู่วัน 0,ว.,ทุกวัน
เซงซา 0,ว.,มีชื่อเสียงเลื่องลือ
เซงซา 1,ว.,เสียงอื้ออึง
เซ้ย 0,ก.,หยอกเข้า เย้าแหย่ว คำพูดเย้าแหย่เพื่อแสดงถึงความพอใจ เช่น เมื่อ ช่างซอ ขับซอถูกใจก็จะตะโกนว่า เซ้ย
เซเล็ก 0,น.,บุหรี่ที่ใช้ยาฉุนมวนด้วยใบกาบหมากหรือตองอ่อนนาบ โดยมี ซีโอย หรือ ขี้โอย เติมลงในยาฉุนนั้นด้วย
เซ่อเล่อ 0,ว.,กะเล่อกะล่า อีรุงตุงนัง
เซ่อเล่อ 1,ว.,ตกตะลึง จังงัง อาการเหม่อลอย อาการเชิดหน้าเพื่อฟังหรือคิดอย่างใจลอย
เซ่อเล่อสึ่งหลึ่ง 0,ว.,ตกตะลึง จังงัง อาการเหม่อลอย อาการเชิดหน้าเพื่อฟังหรือคิดอย่างใจลอย
เซอะ 0,ว.,เซ่อ ทึ่ม
เซา 0,ก.,หยุดพัก
เซาแรง 0,ก.,หยุดพักเอาแรง
เซาะ 0,ก.,เสาะ - แสวงหา ค้นหา
เซาะ 1,ก.,กัดเซาะ ทำให้กร่อนไปทีละน้อยอย่างน้ำกัดฝั่ง
เซาะไซ้ 0,ก.,สืบเสาะ แสงวงหา ค้นหา
เซาะไซ้เหยื่อหย้า 0,ก.,แสวงหาอาหาร (เหยื่อ - อาหารประเภทเนื้อ หย้า - หญ้า - อาหารประเภทผักหรือพืช)
เซาะมาหาว่า 0,ก.,ทำมาหากิน ทำการเลี้ยงชีวิต
เซาะแมะ 0,ก.,ทรุดลง ยุบลงอย่างหมดเรี่ยวแรง
เซาะว่า 0,ก.,หาเรื่องหรือความมาพูด
เซาะว่าหากิน 0,ก.,ทำมาหากิน การเลี้ยงชีวิต
เซาะว่าหากิน 1,ก.,ทำมาหากิน ทำการเลี้ยงชีวิต
เซาะหา 0,ก.,แสวงหา ค้นหา
เซาะหาที่ 0,สำนวน.,รนหาที่ หาเรื่องเดือดร้อนใส่ตัวเอง
เซาะหามาว่า 0,ก.,หาคำพูดมาว่ากัน ทะเลาะกัน
เซิง 0,น.,แนวทาง
เซิง 1,น.,ฝ่าย
เซิง 2,น.,เชื้อสาย พงศ์พันธุ์
เซิ่ง 0,บ.,ซึ่ง - คำสำหรับนำหน้านามที่เป็นผู้ถูกกระทำ เช่น เจ้ากุมมารค็สั่งอำลาเซิ่งแม่แห่งตน - กุมารนั้นก็กล่าวอำลามารดาของตน (กวีนิพนธ์)
เซิงลาย 0,น.,แบบอย่าง
เซิงลาย 1,น.,เทือกเถา พงศ์พันธุ์
เซี้ยม 0,น.,ฝาเฟี้ยม - ฝาเป็นประตูกั้นน้ำหน้าเรือน
เซี้ยม 1,น.,ลูกฟัก - บานในกรอบประตู หน้าต่าง
เซื้อม 0,น.,เฟี้ยม - ฝาที่ทำเป็นบานๆ พับได้
เซื้อม 1,น.,ลูกฟัก - บานในกรอบประตู หน้าต่าง
เซื้อม 2,น.,ห้อง ที่รโหฐาน
เซื้อม 3,น.,เฟี้ยม
เซื้อมซ้อน 0,ว.,เป็นคู่ร่วมนอน เป็นคู่ครอง
เซื้อมซ้อน 1,ก.,เป็นคู่ผัวเมีย เป็นคู่ครอง (กวีนิพนธ์)
เซื้อมสาย 0,น.,เฟี้ยม - ฝาที่ทำเป็นบานๆ พับได้
แซ 0,น.,กระเทย หญิงหรือชายลักเพศ
แซ 1,น.,กะเทย คนครึ่งหญิงครึ่งชาย
แซก 0,ก.,แทรก
แซง 0,น.,ลายผ้าที่เป็นทางตามยาว
แซง 1,น.,สิ่งที่เป็็นทางยาว
แซง 2,น.,แบบอย่าง แบบแผน แนว แนวทาง
แซง 3,ว.,ลายเป็นทาง
แซ้ง 0,ว.,เรียว โด่ง ยาวเรียวและโด่งอย่างจมูก
แซ้ง 1,ว.,สลอน ยาว เรียว ใช้บรรยายของขนาดเล็ก เช่น จมูก หรือหนาม เป็นต้น
แซ็ด 0,ก.,เฉือน ฝาน เฉี่ยวไปในปริมาณหรือระยะมากกว่า ซิด
แซ็ด 1,ว.,มักใช้ประกอบคำ ซื่อ เป็น ซื่อแซ็ด - ตรงแน่ว
แซม 0,น.,ชื่่อกว่างชนิดหนึ่งตัวเล็กกว่า กว่างโซ้ง
แซม 1,ก.,แทรกขึ้นหรือเสียบเข้าในระหว่าง พูดเสริมหรือสอดแทรก
แซ่ม 0,ก.,บ่น พร่ำพูด
แซว 0,น.,กรรเชียงเรือ หางเสือเรือ
แซว 1,น.,นกแซงแซว
แซว 2,ก.,พายเรือถ้าถือหางเสือเรือว่า ชักแซว
แซว 3,ว.,แหลมคม เช่น ปิดแซว - ดินสอแหลม
แซว 4,ว.,ปัญญาไว
แซว่ 0,น.,สลักลูกดาล กลอนอย่างกลอนประตู
แซ่ว 0,ว.,เชี่ยว อย่างน้ำเชี่ยว
แซ่ว 1,ว.,แกร่ว - จำทนอยู่ด้วยความรำคาญ
แซว้ง 0,ว.,เรียว โด่ง ยาวเรียวและโด่งอย่างจมูก
แซว้ง 1,ว.,สลอน ยาว เรียว ใช้บรรยายของขนาดเล็ก เช่น จมูก หรือหนาม เป็นต้น
แซะ 0,น.,เครื่องมือจับสัตว์น้ำชนิดหนึ่ง
แซะ 1,ก.,ช้อนหรือตักขึ้น
แซะ 2,ก.,เรียกการเจริญสัมพันธไมตรีระหว่างแคว้นว่า สืบส้อนคำเมือง
แซะ 3,น.,เครื่องมือใช้ช้อนจับปลาเล็กหรือสัตว์น้ำ เช่น ลูกอ๊อด สานด้วยไม้ไผ่มีคันถือคล้ายคันช้อนหรือชะนาง
แซะสาลา 0,น.,ต้นกระบอก
โซ่ 0,ว.,เสียงที่มักใช้ไล่ตะเพิดไก่ เป็นต้น
โซ้ 0,ก.,ผัดอย่างตีน้ำมัน
โซ้ 1,ก.,ผัดโดยใช้น้ำมันหรือน้ำเล็กน้อย ตั้งไฟแล้วพลิกกลับไปมา
โซ้ 2,ก.,อาการที่ี่นำเอาอาหารที่ปรุงแล้วลงผัดในน้ำมันร้อนเป็นการปรุงรสอีกครั้งหนึ่ง
โซ้ง 0,น.,เรียกกว่างชนิดหนึ่งที่มักเลี้ยงไว้หนีบหรือชนกันว่า กว่างโซ้ง
โซ้น้ำมัน 0,ก.,ผัดโดยใช้น้ำมันหรือน้ำเล็กน้อย ตั้งไฟแล้วพลิกกลับไปมา
โซ่ย 0,ก.,ล้าง ชำระด้วยน้ำ
โซ่ย 1,ก.,ล้าง ชำระให้สะอาดด้วยน้ำ
โซะๆ 0,ว.,ลักษณะที่น้ำหยดลงเป็นปริมาณมาก เช่น นั่งไห้น้ำตาย้อยโซะๆ - ร้องไห้น้ำตาไหลพราก
ไซ 0,น.,ไซ ลอบ - เครื่องสานสำหรับจับปลา
ไซ 1,น.,งูไซ
ไซ 2,น.,หญ้าไซ
ไซ้ 0,ก.,คัด เลือก เลือกเด็ดเอาส่วนอ่อนของผัก เอาขี้ของปลาหรือแมลงออกเพื่อปรุงอาหาร ไซ้
ไซบั้ง 0,น.,ไซชนิดหนึ่งคล้ายลอบนอน ก้างยาวประมาณ ๒๕ คูณ ๖๐ เซนติเมตร โดยมากมีงาสองอัน
ไซบ่าหลอด 0,น.,ไซชนิดหนึ่่งสานเป็นรูปเพรียวยาวมนหัวท้ายมีงาสำหรับให้ปลาตอนหัวค่อนมาทางกลางตัว
ไซหัวหมู 0,น.,ไซชนิดหนึ่งสานเป็นรูปทรงกระบอก มีงาตอนหัว
