มาฆปูชา 0,น.,"การทำบุญพิเศษทางพุทธศาสนาในวันเพ็ญเดือนมาฆะเพื่อระลึกถึงเหตุการณ์สำคัญ ๔ ประการ ประการ คือ ๑. วันเพ็ญดวงจันทร์เสวยมาฆะฤกษ์ (ดวงจันทร์เดินมาถึงดาวฤกษ์ชื่อมาฆะ) ๒. พระสงฆ์ ๑,๒๕๐ รูปมาประชุมกันโดยมิได้นัดหมาย ๓. พระสงฆ์ที่มีมาประชุมนั้นล้วนได้รับเอหิภิกขุอุปสัมปทา ๔. ท่านเหล่านั้นเป็นอรหันต์ทั้งสิ้น"
มาฆะ 0,น.,ชื่อเดือนที่ ๓ แห่งจันทรคติ (ล้านนาเป็นเดือน ๕) ตกราวเดือนกุมภาพันธ์
ม้าง 0,ก.,ม้าง - ล้าง ทำลาย รื้อ ประหาร งัด ง้าง ขุด ตัก ศัพท์ไทดั้งเดิมว่า - มล้าง
ม่างค่าง 0,ว.,ลักษณะการเคลื่อนไหวอันเก้งก้างของสิ่งที่เกะกะกีดขวาง
ม้าจกคอก 0,น.,การฟ้อนรำคล้ายลาวกระทบไม้
มาจน 0,ก.,มาทำให้หยุดชะงัก มาประจวบ มักใช้ในตอนเริ่มกล่าวถึงที่มาของชาดก
มาชู 0,ก.,มาหา มาใกล้ มาสู่
มาไช 0,ก.,มาเยี่ยม
มาณวะ 0,น.,ชายหนุ่ม ชายรุ่น
มาณวิกา 0,น.,หญิงสาว หญิงรุ่น
มาด 0,น.,กำมะถัน
มาตราว่า 0,สัน.,หากว่า แม้นว่า ถึงว่า
ม้าตั่งไหม 0,น.,ชื่อเครื่องไม้หน้าบันวิหารมีลักษณะเป็นเสาสั้นต่อเสริมจากขื่อเพื่อรองรับเครื่องไม้ตัวอื่น
มาตา 0,น.,แม่
ม้าต่างไหม 0,น.,ชื่อเครื่องไม้หน้าบันวิหารมีลักษณะเป็นเสาสั้นต่อเสริมจากขื่อเพื่อรองรับเครื่องไม้ตัวอื่น
มาติกา 0,น.,บาลีที่เป็นแม่บท เช่น สวดมาติกา แม่บท เหมือง ทางน้ำไหล
มาทางลุ่ม 0,ว.,ลงไป น้อยกว่า น้อยกว่านั้น
มาน 0,น.,โรคที่ทำให้ท้องโต มีหลายชนิด เช่น มานน้ำ
มาน 1,น.,เรียกอาการที่หญิงมีครรภ์แก่ว่า พามาน
ม่าน 0,น.,ชนชาติพม่า
ม้าน 0,ก.,ครึ่งแห้งครึ่งสด เหี่ยวเพราะถูกความร้อน ช้ำ ฟก
ม้านแดด 0,ว.,ผิวเกรียมเพราะถูกแดดเผา
มานทาง 0,น.,ท้องไม่มีพ่อ
มานน้ำ 0,น.,โรคท้องมาน
มานรุง 0,น.,โรคท้องมาน
มานวะ 0,น.,ชายหนุ่ม
มานะ 0,น.,ความพยายาม ความตั้งใจจริง ความถือตัว
ม้าบ้อง 0,น.,เรียกผีชนิดหนึ่งว่า ผีม้าบ้อง กล่าวกันว่า เป็นคนที่แสดงอาการคะนองเหมือนม้าวิ่งไปมาในเวลากลางคืนเพื่อหาของคาวมากิน
ม้าเบี้ย 0,น.,หอยเบี้ยที่ประดิษฐ์เป็นรูปม้าเพื่อถวายเป็นเครื่องไทยทาน
มาเปลือง 0,ก.,มาจากที่ไกล เดินทางมาไกล
ม่าม 0,น.,เรียกข้าวที่เคี้ยวป้อนแก่ทารกว่า เข้าม่าม
ม่าม 1,ก.,เคี้ยวให้ละเอียด อย่างเคี้ยวข้าวป้อนทารก
ม่าม 2,ก.,เรียกการนุ่งผ้าหยักรั้งว่า เฟ็ดม่าม
ม่าม 3,ก.,เคี้ยวข้าวให้แหลกเพื่อป้อนแก่ทารก
ม้าแม่ 0,น.,ม้าตัวเมีย หญิงคนทรงเจ้า
มาย 0,ก.,คลี่ออก เบาไป คลาย
มาย 1,น.,เรียกแมลงเม่าขนาดเล็กว่า แมลงมาย
มาย 2,ก.,คลาย ขยาย ผ่อน ลดลง ศัพท์ไทดั้งเดิมว่า มลาย
ม่าย 0,ก.,แสดงอาการกรีดกรายเพื่อให้ผู้ที่ตนหมายปองรู้ความในใจ กรีดกรายอย่างอาการไก่แจ้ตัวผู้ป้อตัวเมีย
มายา 0,น.,มารยา การลวง การแสร้งทำ เล่ห์กล เรียกมายาเรื่องชู้สาว
มาร 0,น.,เทวดาจำพวกหนึ่งมีใจบาป คอยกีดกันมิให้คนทำบุญในทางพุทธศาสนาหมายถึงผู้กีดกันการบุญกุศล มี ๕อย่าง คือ ขันธมาร กิเลสมาร อภิสังขารมาน มัจจุมาร เทวบุตรมาร
มาลา 0,น.,ดอกไม้ หมวก สร้อยคอ สายแถว
มาลี 0,น.,ผู้แต่งตัวด้วยพวงดอกไม้
มาลี 1,ว.,ร้อยกรองแล้ว
มาไลย 0,น.,ดอกไม้ที่ร้อยเป็นพวง
ม้าว 0,น.,เครื่องประดับแขน พาหุรัด มักปรากฏเป็น ม้าวใส่แขน แหวนใส่ก้อย
ม้าว 1,น.,เชือกที่ใช้มัดฟ่อนข้าว
ม้าว 2,น.,กำไลมือ
ม้าวแขน 0,น.,เชือกที่ใช้มัดฟ่อนข้าว
มาสกะ 0,น.,ชื่อมาตราเงินครั้งโบราณ ๕ มาสกะ (มาสก) เป็น ๑ บาท
ม่ำ 0,ก.,เรียกการนุ่งผ้าหยักรั้งว่า เฟ็ดม่าม
ม่ำ 1,น.,เรียกข้าวที่เคี้ยวป้อนแก่ทารกว่า เข้าม่ำ
ม่ำ 2,ก.,เคี้ยวข้าวให้แหลกเพื่อป้อนแก่ทารก
ม้ำ 0,ก.,เม้มอย่างเม้มปาก
ม้ำมึก 0,ก.,กลั้นใจหรืออดทนทำสิ่งใดสิ่งหนึ่งทั้งๆ ที่ไม่อยากทำ หมายมั่นปั้นมือ
มิ 0,ว.,ไม่ นิยมใช้ในกวีนิพนธ์
มิกคิก 0,ว.,ลักษณะสิ่งของขนาดเล็กแต่ล่ำสันแข็งแรง
มิคะ 0,น.,สัตว์ป่ามีกวาง อีเก้ง มักเขียนเป็น มิคคะ
มิ่ง 0,ว.,อันเป็นที่รัก อันเป็นสิริมงคล มักปรากฏในกวีนิพนธ์ ดูความหมายใน ไทดำ ไทขาว
มิจฉา 0,ว.,ผิด
มิจฉาจาร 0,น.,การประพฤติผิด มักหมายถึงประพฤติผิดในกาม
มิจฉาทิฏฐะ 0,น.,ความเห็นผิดทางธรรม
มิด 0,ว.,หายไปจนหมดสิ้น เช่น คันแหงแตกบ้าง ขออยฅืนแทบมิด - หากมีรอยร้าวจะขอซ่อมแซมให้หายรอย
มิตต์แก้วสหายฅำ 0,น.,มิตรสนิท มิตรผู้ทรงเกียรติ เสมือนญาติผู้ใกล้ชิด
มิถิลารัฏฐะ 0,น.,หมายถึงแคว้นฮุนหนำ หนองแส หอแต
มิ้น 0,น.,มิ้ม - ชื่อผึ้งขนาดเล็ก ผึ้งงานยาวประมาณ ๕ มิลลิเมตร อกกว้างประมาณ ๒.๕ มิลลิเมตร อาศัยอยู่รวมกันเป็นกลุ่ม ทำรังในที่โล่งแจ้งเป็นแผ่นเดี่ยวๆ มีขนาดตั้งแต่ฝ่ามือจนถึง ๓๐ เซนติเมตร เมื่อเลี้ยงลูกโตแล้วจะทิ้งรังไปหาที่ใหม่ต่อไป
มิลักขะ 0,น.,ชนเผ่าลัวะ หรือละว้า พบในตำนานเมืองล้านนา (อรุณรัตน์)
มี 0,ว.,ไม่ นิยมใช้ในกวีนิพนธ์
มี 1,ก.,ถือเป็นเจ้าของ เป็น ปรากฏ เกิด คงอยู่
มี 2,ว.,รวย ไม่เปล่า
มี่ 0,ว.,อึกทึก เสียงแซ่ นัน มี่นัน ก็ว่า มักใช้ประกอบกับมัน เป็น มี่นัน เช่น หน้าบ่มีมี่บ่มีมัน - หน้าไม่มีชีวิตชีวา
มี้ 0,ว.,ดำ ดำสนิท เช่น ฟันดำมี้ - มีฟันเป็นสีดำสนิท
มี้ 1,ว.,ดำมาก ๆ สีดำมาก ๆ
มีคาว่า 0,สำนวน.,มีจริงหรือว่า
มีคำคึด 0,ก.,รู้คิด - เข้าใจคิดอ่าน มีความคิด
มีใจ 0,ก.,อยาก ต้องการ
มีใจร่อ 0,ก.,มีจิตผูกพัน รักใคร่
มีใจรอด 0,ก.,มีเยื่อใย ยังระลึกถึงอยู่
มีใจหิด 0,ก.,รู้สึกกระสับกระส่ายเล็กน้อย กังวลใจ
มีด 0,น.,มีด เครื่องมือสำหรับฟัน ผ่า จัก เหลา ฯลฯ มีชื่อเรียกต่างๆ
มีดขูด 0,น.,มีดโกน มีดเทาะ ก็ว่า
มีดขูด 1,น.,ลมเพชฌฆาต เรียกลมที่พัดอยู่ระหว่างบรรยากาศกับเทวโลกว่า ลมมีดขูด ผู้ใดที่เหาะหรือบินขึ้นไปถึงระดับที่ลมนี้พัดอยู่จะถูกพัดให้คอขาดตาย
มีดคึก 0,ว.,ถมึงทึง ใช้ประกอบคำว่า ล่ำ ซึ่งแปลว่าอ้วนท้วนแข็งแรง ใช้กับสิิ่งที่มีขนาดใหญ่
มีดฅมบาง 0,น.,มีดขนาดเล็กสันบาง ใช้สำหรับปอกหรืองานประณีต
มีดงก 0,น.,พร้าโต้ - มีดปลายงุ้ม สันหนา ด้ามสั้น
มีดโงง 0,น.,มีดที่ดัดให้โค้งมีด้ามยาว ใช้สำหรับฟันหญ้า
มีดซอยอยวก 0,น.,มีดยาวที่ใช้หั่นหยวกและผักอื่นๆ เพื่อเป็นอาหารของหมู
มีดซอยอยา 0,น.,มีดที่เป็นแผ่นเหล็กแบนบางไม่มีด้าม นิยมทำจาใบเลื่อยใช้ในการหั่นยาสูบ
มีดซุย 0,น.,มีดพก - มีดเล็กปลายแหลม ใช้เป็นมีดพก
มีดดาบ 0,น.,ดาบ
มีดเทาะ 0,น.,มีดโกน
มีดบาง 0,น.,มีดขนาดเล็กสันบาง ใช้สำหรับปอกหรืองานประณีต
มีดปลายว้าย 0,น.,มีดปลายเรียว
มีดยับ 0,น.,กรรไกร ว่านหางช้าง เรียกว่า หวานมีดยับ
มีดเหลา 0,น.,มีดตอก - มีดเล็กปลายแหลมคล้ายมีดพกแต่สั้น มีด้ามยาวและงอนใช้เหงาหรือถากแต่งให้ผิววัตถุเรียบ
มีต้นว่า 0,ว.,เป็นต้นว่า
มี่นัน 0,ว.,เสียงที่เกรียวกราว มีเสียงอื้ออึง
มีมาก 0,ก.,มีเป็นจำนวนมาก
มีหน้ามีตา 0,ว.,มีเกียรติยศชื่อเสียง
มีหว่าง 0,ว.,มีเวลาว่าง ไม่มีธุระ (ไม่มีเวลาใช้ - บ่มีหว่าง)
มีหั้นชะแล 0,*ว.,มีอยู่อย่างนั้น เป็นอย่างนั้น มีอยู่ที่นั่นจริง มักปรากฏท้ายข้อความในเอกสารประเภทตำนาน
มึง 0,สรรพ.,บุรุษที่ ๒ ใช้แทนผู้ที่เราพูดด้วย อย่างที่พระเวสสันดรใช้คำเรียกตนเองว่า คูพี่ และเรียกนางมัทรีว่า มึงนาง
มึ้ง 0,ว.,รู้ตัว ระมัดระวัง รอบคอบ มักใช้ในเชิงปฏิเสธ เช่น บ่มึ้ง บ่ทันมึ้ง คือไม่ได้ระวังตัว
มึ่งมั่งมึงมัง 0,ก.,มึน - เมาอ่อนๆ รู้สึกวิงเวียน รู้สึกตื้อในสมอง
มึ่งมั่งมึงมัง 1,ก.,วิงเวียนศีรษะ
มึ้งรู้มึ้งตื่น 0,ก.,สะลึมสะลือ ยังไม่รู้สึกตัวดีเต็มที่
มืด 0,ว.,มืด
มืดซุ้มซิ้ม 0,ว.,โพล้เพล้ มืด ขมุกขมัว
มืดฟ้ามัวดิน 0,ว.,มากมายจนนับไม่ถ้วน
มืดมัว 0,ว.,เปี่ยมด้วยโมหจริต ไม่ดำรงอยู่ในครรลองที่ดีงาม
มืดสะลุ้ม 0,ว.,ยามมืดที่เช้าไต้เข้าไฟซึ่งจะมืดกว่า มืดซุ้มซิ้ม
มืดสะลุ้มสะลิ้ม 0,ว.,ยามมืดที่เช้าไต้เข้าไฟซึ่งจะมืดกว่า มืดซุ้มซิ้ม
มืดสะลุ้มสะลิ้ม 1,ว.,จวนสว่าง จวนมืด ทัศนวิสัยไม่ดี มัวๆ ซัวๆ
มืดหน้าลายตา 0,ว.,หน้ามืด วิงเวียน
มืน 0,น.,ปอมืน ปอชายอดแดง ยาบมืน ยาบเลียง ก็ว่า
มืน 1,ก.,ลืม - เปิด แย้ม ใช้แก่ตา เช่น มืนตา - ลืมตา
มื่น 0,ว.,ลื่น มื่น
มื่น 1,น.,ต้นกระบก
มื่น 2,ก.,ลื่น
มื่น 3,ว.,มีลักษณะเรียบเกลี้ยงเป็นมันเป็นเมือก
มือ 0,น.,มือ โดยปริยายใช้เรียกหนวดของไม้เลื้อยบางชนิดที่ใช้เกาะสิ่งอื่น เช่น มือผักแฅบ - หนวดของเถาตำลึง
มื้อ 0,น.,คราว ครั้ง หน กำหนดนัดหมาย เวลา ฤกษ์ การเข้าเวร การอยู่ยาม เช่น ไพเข้ามื้อ ไปอยู่เวร ถ้า ไพส่งเข้ามื้อ - คือการที่นำอาหารไปถวายพระที่วัดตามที่ได้ตกลงมอบหมายกันไว้ ลงแขกงานที่ทำให้แก่ผู้อื่นเพื่อให้ผู้นั้นทำงานเช่นเดียวกันแก่ตนในโอกาสต่อไป เรียกว่า เอามื้อ ถ้าไปชดใช้แรงงานดังกล่าวเรียก ส้ายมื้อ
มื้อจันทร์วันดี 0,น.,ฤกษ์งามยามดี
มือดี 0,ว.,มือเก่า - มีความชำนาญหรือช่ำชองมาก
มือบอน 0,ว.,อาการที่มืออยู่ไม่สุข ชอบขีดเขียนตามกำแพงหรือเด็ดดอกไม้ใบไม้ เป็นต้น
มือพร่ายตีนพร่าย 0,ว.,มืออ่อนตีนอ่อนเพราะตกใจกลัวหรือเสียกำลังใจ
มือยาว 0,ว.,มือไว - ขี้ขโมย
มือหน่อ 0,น.,นิ้วมือที่สั้นกุดโดยธรรมชาติหรือมีนิ้วเกิน ๕ นิ้ว
มือห่างตีนห่าง 0,ว.,สุรุ่ยสุร่าย สะเพร่า ไม่ระมัดระวัง
มือเหมือนงวงช้างหน้อย 0,ว.,มือซน - มืออยู่ไม่สุข มักหมายเอามือที่ชอบหยิบโน่นจับนี่อยู่เสมอ
มุ 0,ก.,ซบ อย่างวบหน้าลงกับท่อนแขน
มุก 0,น.,สมุก - ถ่านหรือขี้เถ้าผสมกับขี้รักใช้ทาสิ่งต่างๆ ฝุ่นผงละอองละเอียด ปุ๋ยคอกที่ได้จากมูลสัตว์มักปรากฏคู่กับคำอื่นเป็น ฝุ่นมุก
มุก 1,ว.,เรียกเขาวัวควายที่เขาใหญ่และสั้นว่า เขามุก
มุกคิก 0,ก.,งุบงิบ สรุปเอาง่ายๆ อุปโลกน์
มุข 0,น.,หน้า ปากทาง หัวหน้า ส่วนของตึกหรือเรือนที่ยื่นออกมาจากส่วนใหญ่ อยู่ด้านหน้า
มุง 0,ก.,มุง - เอาวัตถุ เช่น กระเบื้องปิดส่วนบนของเรือนหรือหลังคาเพื่อกันแดดกันฝน
มุ่ง 0,ก.,มุ่ง - หมาย ตั้งใจ ปอง
มุ้ง 0,น.,ซุ้ม - ที่อยู่หรือที่พักซึ่งโดยมากปกคลุมด้วยเถาวัลย์หรือฟาง โคคลาน - ชื่อพรรณไม้เถา ปอเกวียน ก็ว่า
มุ้ง 1,ว.,คลุ้ง ฟุ้ง ใช้กับควันหรือฝุ่น
มุงฅา 0,ว.,มีหญ้าคาเป็นวัสดุปิดส่วนบนของเรือนหรือหลังคา
มุงดินขอ 0,ว.,มีกระเบื้องดินเผาเป็นวัสดุส่วนบนของเรือนหรือหลังคา
มุงตอง 0,ว.,มีใบพลวงหรือใบเหียงที่กรองเป็นตับปิดส่วนบนของเรือนหรือหลังคา
มุ้งๆ 0,ว.,โขมง - คำที่ใช้ขยายแสดงว่ามีฝุ่นหรือควันคลุ้ง
มุจจลินทะ 0,น.,ต้นจิดชื่อสระใหญ่ในป่าหิมพานต์ซึ่งมีต้นจิกขึ้นโดยรอบ
มุด 0,น.,ชุดสำหรับจุดไฟ ละมุด ละมุดฝรั่ง เรียก บ่ามุด
มุด 1,ก.,หลบ ซ่อน หายไป เช่น ฝีมุดแล้ว - ฝียุบตัวลงแล้ว
มุด 2,น.,หมุด - เครื่องสำหรับตรึงหรืออุดรู บางท้องถิ่นออกเสียงเป็น
มุทิตา 0,น.,ความมีจิตใจพลอยยินดีในความสำเร็จของผู้อื่น
มุทู 0,ว.,อ่อน กรุณา มีใจเมตตา
มุ่น 0,ก.,หมก ซุก หาย หมด แหลก
มุ่น 1,ว.,ละเอียด
มุนิ มุนี 0,น.,นักปราชญ์ ผู้รู้ ฤๅษี พระสงฆ์
มุบ 0,ก.,ยุบลง เม้ม ขลิบอย่างขลิบริมเสื่อ
มุม 0,ว.,ดำ สีดำ
มุ่ม 0,ว.,ทู่
มุย 0,น.,ขวาน
มุ่ย 0,ว.,สีม่วงอมฟ้า
มุ่ย 1,ว.,ป่วน ลักษณะน้ำที่ทะลักขึ้นจากตาน้ำหรือไหลม้วนตัวขึ้นมาให้เป็นบนผิวน้ำ
มุยขี้หลื้ม 0,น.,ขวานทื่อ ขวานที่ไม่คมแล้ว ขึ้นสนิม
มุยแง่ม 0,น.,ขวานชนิดมีง่ามสำหรับถอนตะปูได้ มักหมายถึงชนิดที่ตัวขวานไม่มีลักษณะคอด
มุยโบะหลัว 0,น.,ขวานที่ใช้สำหรับผ่าฟืน
มุยปลาสะเด็ด 0,น.,ขวานอย่าง มุยแง่ม แต่มีลักษณะคอดบริเวณที่ใส่ด้ามกับลำตัวของขวาน
มุยแม่ 0,น.,ขวานชนิดที่ไม่มีง่ามถอนตะปู
มุ้ยๆ 0,ว.,ป่วน ลักษณะน้ำที่ทะลักขึ้นจากตาน้ำหรือไหลม้วนตัวขึ้นมาให้เป็นบนผิวน้ำ
มุลละ 0,น.,มูล เค้า โคน
มุสา 0,ว.,เท็จ ปด ไม่จริง
มูก 0,น.,น้ำเมือกที่เหนียวข้น น้ำเมือกที่ไหลออกทางทวารหนัก น้ำเมือกที่ไหลออกทางจมูกเรียกว่า ขี้มูก
มูก 1,น.,ลักษณะมะพร้าวที่ผลมีเนื้ออ่อนเป็นวุ้นเรียกว่า บ่าพล้าวขี้มูก
มูก 2,น.,ต้นโมก
มูกมัน 0,น.,ต้นโมกมัน
มูคะ 0,ว.,ใบ้ เงียบ ไม่มีเสียง
