คำ,POS,ความหมาย
มกคก 0,ว.,ลักษณะของสิ่งที่มีสัณฐานใหญ่และนูน
มกระ 0,น.,มังกร ชื่อดาวราศีที่ ๑๐
มคธภาสา 0,น.,ภาษาของชาวมคธ ซึ่งหมายถึงภาษาบาลี
มคธะ 0,น.,แคว้นมคธ - ชื่อเคว้นหนึ่งในอินเดียสมัยพุทธกาล ปัจจุบันนิยมเรียก พิหาร
มณฑก 0,น.,มณฑป - เรือนยอดที่มีรูปสี่เหลี่ยมกบ
มณี 0,น.,แก้วมณี หม้อน้ำ
มณีกัก 0,น.,ชื่อที่นิยมใช้เป็นชื่อม้าในวรรรคดี แปลว่ามีดวงตาดั่งดวงมณี ซึ่งมักเขียนว่า
มณีกักขิ์ 0,น.,ชื่อที่นิยมใช้เป็นชื่อม้าในวรรรคดี แปลว่ามีดวงตาดั่งดวงมณี ซึ่งมักเขียนว่า
มณีกาก 0,น.,ชื่อที่นิยมใช้เป็นชื่อม้าในวรรรคดี แปลว่ามีดวงตาดั่งดวงมณี ซึ่งมักเขียนว่า
มณีกาบ 0,น.,ชื่อที่นิยมใช้เป็นชื่อม้าในวรรรคดี แปลว่ามีดวงตาดั่งดวงมณี ซึ่งมักเขียนว่า
มด 0,น.,มด
มด 1,น.,หมอผี หมอเวทมนตร์ ซึ่งมักเรียก พ่อมด แม่มด
มด 2,น.,ผีบรรพบุรุษของเผ่าไทยวน มักใช้ร่วมกับ ผีเฝง ซึ่งเป็นผีบรรพบุรุษของเผ่ามอญ ผีมดผีเมง ซึ่งหมายถึงผีบรรพบุรุษ
มดง่าม 0,น.,มดคันไฟ
มดง่ามแดง 0,น.,มดคันไฟ
มดดำ 0,น.,มดดำ
มดแดงน้อย 0,น.,มดคันไฟ
มดแดงไฟ 0,น.,มดคันไฟ
มดตะขีด 0,น.,กามโรค
มดน้ำอ้อย 0,น.,มดตาลาน
มดรี่ 0,น.,มดชนิดหนึ่งคล้ายมดส้ม ตัวดำ ไข่กินได้
มดลม 0,น.,มดชนิดหนึ่งก้นแหลม กัดเจ็บ มีพิษ
มดลิ้น 0,น.,มดตะนอย
มธุ 0,น.,น้ำหวาน น้ำผึ้ง
มธุปายาสะ 0,น.,ข้าวปายาสเจือน้ำผึ้ง ใช้เป็นของหวานในงานรื่นเริง
มน 0,ก.,มน วน
มน 1,ว.,กลม โค้งๆ ไม่เป็นเหลี่ยม
มนแคว็ด 0,ว.,กลมดิก
มนต์ 0,ก.,เสกด้วยคาถา
มนตรี 0,น.,ที่ปรึกษา ข้าราชการชั้นผู้ใหญ่
มนต์สวาธ 0,ก.,เสกด้วยคาถา (กวีนิพนธ์)
มนต์สวาธต้อง 0,ก.,เสกด้วยคาถา (กวีนิพนธ์)
มนไพมนมา 0,ก.,วนเวียนไปมา เคว้งคว้าง
มนะ 0,น.,ใจ
มนุสส์ 0,น.,คน มนุษย์
มโน 0,น.,ใจ
มโนรถะ 0,น.,ความหวัง ความประสงค์
มโนรา 0,น.,ชื่อตัวละครเอกฝ่ายหญิงในเรื่องสุธนชาดก
มโนสิลา 0,น.,ศิลาอ่อนที่บดให้ละเอียดผสมเป็นสีทาสิ่งอื่นได้ อีกนัยหนึ่งว่าสารหนูแดง เรียกหินลายสีแดง
มบ 0,ก.,ยุบลง เม้ม ขลิบอย่างขลิบริมเสื่อ
มยัง 0,น.,พวกเรา เราทั้งหลาย
มยุระ 0,น.,นกยูง
มรณธัมม์ 0,น.,มีความตายเป็นของธรรมดา
มรณะ 0,น.,ความตาย
มระ 0,น.,ความตาย
มลมุลทิน 0,ว.,ความมัวหมอง
มละ 0,ก.,ละ ทิ้ง
มละ 1,น.,ความมัวหมอง ความสกปรก มลทิน
มละ 2,ว.,ไม่บริสุทธิ์
มลัก 0,ก.,มัก - ชอบ รัก พอใจ ลัก ลอบ ปรกติใช้ มัก
มล้า 0,น.,ม้า
มล้า 1,น.,ไกหรือสิ่งประดิษฐ์ที่ยื่นออกมาเพื่อใช้รองรับสิ่งอื่นอย่างไกคันร่มที่ดีดตัวออกมาจากคันเพื่อรับโครงร่มมิให้เลื่อนตก คันสำหรับค้ำยัน
มล่าน 0,น.,ชนชาติพม่า
มลาย 0,ก.,คลี่ออก เบาไป คลาย
มลาย 1,ก.,คลาย ขยาย ผ่อน ลดลง ศัพท์ไทดั้งเดิมว่า มลาย
มลารัฎฐะ 0,น.,นครหลวงพระบางหรือล้านช้างแต่ไม่ปรากฏบ่อย
มลื่น 0,ว.,ลื่น มื่น
มลื่น 1,ว.,มีลักษณะเรียบเกลี้ยงเป็นมันเป็นเมือก
มวก 0,น.,น้ำที่ได้จากการแช่ข้าวเรียกว่า น้ำเข้ามวก
มวก 1,น.,เถามวกเขา
มวก 2,ว.,มีสีอย่างน้ำที่ได้จากการแช่ข้าว
ม่วน 0,น.,ต้นทอ บ่าม่วน (ล.)
ม่วน 1,ว.,ไพเราะ สนุก เพลิดเพลิน สะดวก
ม้วน 0,ก.,ม้วน
ม่วนงัน 0,ว.,สนุกสนาน รื่นเริง
ม่วนเพราะ 0,ว.,ไพเราะ
ม่วนเหล้น 0,ว.,สนุกสนานกับการเล่น
ม่วนอกม่วนใจ 0,ว.,สบายใจ ปลื่มใจ กระหยิ่ม ลิงโลด
ม้วย 0,น.,เรียกวันที่เป็นอัปมงคล ตามตำราโหราศาสตร์
ม้วย 1,ก.,ม้วย - ตาย สิ้นสุด มอดหมด
ม่วยตาน 0,น.,ต้นเนียม
ม้วยมล้าง 0,ก.,ตาย
ม้วยม้าง 0,ก.,ตาย
มวล 0,ว.,มวล - ทั้งหมด ทั้งสิ้น ทั้งปวง
มวลหมู่ 0,ว.,ทั้งปวง ทั้งหมด
มหัณณวะ 0,น.,ทะเลใหญ่ ห้วยน้ำใหญ่
มหันคะ 0,ว.,ใหญ่ มาก ยิ่ง
มหา 0,น.,คำเรียกภิกษุที่สอบไล่ได้ตั้งแต่เปรียญธรรม ๓ ประโยคขึ้นไป แล้วได้รับพัดยศพระราชทานจากพระมหากษัตริย์ คำเรียกภิกษุด้วยความยกย่อง
มหา 1,ว.,ใหญ่ ยิ่งใหญ่
มหาขนาน 0,น.,คำเรียกเจ้านายเชียงตุงที่เคยบวชเป็นภิกษุ มีความรู้มาก คนธรรม ถ้ามีความรู้มากก็เรียก
มหาจาง 0,น.,ชื่อพรรณไม้ยืนต้นชนิดหนึ่ง
มหาจาง 1,น.,ต้นพญาไม้สมุลแว้ง
มหาชาต 0,น.,เรียกเวสสันตระชาดกว่า มหาชาด
มหานิล 0,น.,แก้วสีดำมีค่ามาก
มหาบัวพิตร 0,น.,คำแทนพระนามพระเจ้าแผ่นดิน
มหาพน 0,น.,ชื่อกัณฑ์ที่ ๗ ของมหาชาติ ว่าด้วยเรื่องป่าใหญ่
มหารัฏฐะ 0,น.,แคว้นใหญ่ เชียงใหม่ - ลำพูน (ตำนาน)
มหารัฏฐะ 1,น.,ในตำนานมักหมายถึงเมืองเชียงใหม่ - ลำพูน
มหาราชะ 0,น.,คำใช้เรียกเพื่อเฉลิมพระเกียรติพระเจ้าแผ่นดิน
มหาราชะ 1,น.,ชื่อกัณฑ์ที่ ๑๐ ของมหาชาติเรียกว่า มหาราช
มหิยังคณะ 0,น.,ภูเขา เนินดิน หมายถึง เมืองยองในเขตประเทศพม่า
มเหสักขะ 0,น.,เทวดาผู้ใหญ่ ผู้มีศักดิ์ใหญ่
มเหสี 0,น.,ชายาของพระเจ้าแผ่นดิน
มโหสถ 0,น.,ชื่อตัวเอกในชาดกเรื่องมโหสถ ยกแก้ไข้อย่างชะงัด
มโหสรบ 0,น.,มหรสพ - การเล่นรื่นเริง
มโหฬาร 0,ว.,กว้างใหญ่ ยิ่งใหญ่
ม่อ 0,ว.,คล่อง สะดวก ไม่ติดขัด
มอก 0,น.,ขนาด มาตรฐาน ตัวอย่าง
มอก 1,*น.,วิธีการปรุงอาหารใช้ปูนาตำคั้นเอาน้ำตั้งไฟให้สุกปรุงรสด้วยน้ำพริก เติมข้าวคั่วเพื่อให้น้ำแกงข้น
มอก 2,ว.,ขนาด เท่า เสมอ
ม็อก 0,ว.,เป็นผงละเอียด
มอกกำพอ 0,ว.,พอดี กำลังดี พอเหมาะ
มอกก่ำพอ 0,ว.,พอดี กำลังดี พอเหมาะ
ม็อกค็อก 0,ว.,ลักษณะของสิ่งที่มีสัณฐานเตี้ยเล็กแต่ล่ำสันหรือเข้มแข็ง
มอกค่อมพอ 0,ว.,พอดี กำลังดี พอเหมาะ
มอกจับ 0,ว.,ขนาดพอดี พอเหมาะ ขนาดเครือๆ ไม่คับไม่หลวม
มอกปู 0,*น.,วิธีการปรุงอาหารใช้ปูนาตำคั้นเอาน้ำตั้งไฟให้สุกปรุงรสด้วยน้ำพริก เติมข้าวคั่วเพื่อให้น้ำแกงข้น
มอกม่วน 0,ว.,พอสนุก แค่สนุก ไม่จริงจัง
มอง 0,น.,ครก กระเดื่อง ตาข่ายสำหรับจับปลา
มอง 1,น.,กระเทย - คนที่มีจิตใจและกิริยาอาการตรงข้ามกับเพศของตน
มอง 2,น.,ท่อนไม้ขนาดใหญ่ ใช้เป็นหลักปักเรียงรายเพื่อทำเขื่อน
มอง 3,น.,กระเทย หญิงหรือชายลักเพศ
มอง 4,น.,พ้อม - ภาชนะสานขนาดใหญ่
มอง 5,น.,กะเทย คนครึ่งหญิงครึ่งชาย
ม้อง 0,น.,ที่นอนของสัตว์ที่มีลักษณะเป็นแอ่ง แอ่งผ้าหรือฟางที่ขดเป็นวงกลมให้สัตว์ เช่น ลูกสุนัขนอน โดยปริยายหมายถึงการนอนและที่นอนของเด็กด้วย
ม้อง 1,ก.,นอน ใช้กับเด็กเล็ก
มองคร่อ 0,น.,โรคหลอดลมโปร่ง มีเสมหะคั่งอยู่มากกว่าปรกติในส่วนที่พองทำให้มีอาการไอเรื้อรัง จะไอหนักเวลาเช้ามืด ห้ามผู้ที่เป็นโรคนี้บวชเป็นภิกษุ
มองเซิง 0,น.,ฆ้องชุดซึ่งมีจำนวน ๕- ๑๒ ใบ มีค้อน ๕- ๑๒ อันสำหรับตีร่วมแกนกัน มีขนาดลดหลั่นกัน
มองน้ำ 0,น.,ครกกระเดื่องที่ใช้พลังน้ำในการตำข้าว
ม่องล่อง 0,ว.,ฟู ลอย เป็น ฟูม่องล่อง ลอยม่องล่อง
มองๆ 0,ว.,ลักษณะไฟดวงเล็กที่สว่างเพียงเล็กน้อยในระยะไกล
มองๆ เมียงๆ 0,ว.,ลักษณะไฟดวงเล็กที่สว่างเพียงเล็กน้อยในระยะไกล
มอด 0,น.,ตัวมอด
มอด 1,ก.,มอด - จวนจะดับ ดับ มักใช้กับไฟ
มอด 2,ก.,ลอด อย่างมุดลอดรั้วบ้าน
มอด 3,ว.,เรียกหน้าที่มีแผลเป็นอย่างมอดเจาะ เช่น หน้าคนที่เป็นโรคฝีดาษว่า หน้ามอด
ม็อดแม็ด 0,ว.,ลักษณที่ฝนตกประปราย
มอน 0,น.,ใจกลาง ส่วนสำคัญ
มอน 1,น.,มอญ - ชนชาติหนึ่งในภาษาตระกูลมอญ - เขมร หรือคนที่มีเชื้อสายมาจากพวกมอญ - เขมร
มอน 2,น.,มรณ์ มรณา ความตาย
มอน 3,น.,ต้นหม่อน
มอน 4,ว.,ล้วนๆ ไม่มีอย่างอื่นเจือปน เช่น เลือกเอาค่ามอนชิ้น - เลือกเอาแต่เนื้อดีๆ ล้วนๆ
ม่อน 0,น.,เนินเขา ยอดเขา
ม่อน 1,ลัก.,ใช้เรียกภูเขาแต่ละลูก
ม่อน 2,สรรพ.,ใช้แทนตัวผู้พูดเพื่อแสดงความอ่อนน้อมอย่างยิ่ง
ม้อน 0,น.,ใจกลาง ส่วนสำคัญ
ม้อน 1,ว.,ล้วนๆ ไม่มีอย่างอื่นเจือปน เช่น เลือกเอาค่ามอนชิ้น - เลือกเอาแต่เนื้อดีๆ ล้วนๆ
ม้อน 2,น.,ตัวไหม
ม้อน 3,น.,ต้นหม่อน
ม้อน 4,ว.,สิ่งที่คัดเลือกแล้ว ของพิเศษ
มอนไข่ 0,น.,ไข่แดงอย่างไข่แดงของไข่ไก่
มอนไข่ 1,ว.,สีอย่างสีไข่แดง
มอนตาเขียว 0,น.,นัยน์ตาอันดำขลับเหมือนนิลมณี
มอนตาเขียว 1,สรรพ.,คำใช้เรียกเด็กหญิงหรือหญิงที่ตนรัก
ม่อนน้อย 0,สรรพ.,ข้าพเจ้าซึ่งเป็นผู้น้อย
มอบ 0,*น.,วิธีการปรุงอาหารใช้ปูนาตำคั้นเอาน้ำตั้งไฟให้สุกปรุงรสด้วยน้ำพริก เติมข้าวคั่วเพื่อให้น้ำแกงข้น
มอบ 1,ก.,ซ่อน แอบ ลี้ มอบ - ยกให้เป็นกรรมสิทธิ์ ซึ่งคำนี้ไม่ค่อยปรากฏการใช้
มอบ 2,ก.,วิธีปรุงอาหารอย่างหนึ่ง
มอบเวน 0,ก.,มอบให้ มอบหมายให้ โอนสิทธิให้
มอบเวนเคน 0,ก.,มอบให้ มอบหมายให้ โอนสิทธิให้
มอบเวนวาง 0,ก.,มอบให้
มอบส่อง 0,ก.,แอบดู
มอบอั้บ 0,ก.,มอบให้เป็นกรรมสิทธิ์
มอบอั้บปลงปัน 0,ก.,มอบให้เป็นกรรมสิทธิ์
มอบๆ คลานๆ 0,ก.,หมอบๆ คลานๆ อย่างที่แฝงกายในการล่าสัตว์ พินอบพิเทา
มอม 0,น.,สัตว์ในวรรณคดีคล้ายสุนัขพันธุ์เซี่ยงไฮ้ หรือสิงโตเชิดของจีน ใช้ประดับศาสนสถาน
มอม 1,ว.,แปด - เปื้อนด้วยสีมัวๆ ดำๆ
มอย 0,ว.,คล้ำ หรี่ลง เสื่อมโทรมลง
ม่อย 0,ก.,ม่อย - เผลอตัว เคลิ้มหลับ
ม่อย 1,ว.,สีหน้าไม่สดชื่น
ม้อยๆ 0,ว.,ลักษณะที่ค่อยๆ หรี่หลับลงทีละน้อย ลักษณะที่ไปสู่ความสนิทนิ่งทีละน้อย เช่น เดิก็มาม้อยๆ
มอรณ์ 0,น.,ความตาย การตาย
มะม้อย 0,ว.,ลักษณะที่ค่อยๆ หรี่หลับลงทีละน้อย ลักษณะที่ไปสู่ความสนิทนิ่งทีละน้อย เช่น เดิก็มาม้อยๆ
มะรังควาน 0,น.,ผีร้าย
มะลู 0,น.,ผึ่ง - เครื่องมือใช้ถากไม้คล้ายจอบ
มะหาว 0,น.,ชื่อปลาชนิดหนึ่ง
มะห้าว 0,น.,ชื่อปลาชนิดหนึ่ง
มะหิ่ง 0,น.,กระดิ่งขนาดเล็ก
มัก 0,ก.,ชอบ พอใจ ถูกใจ
มักกัน 0,ก.,ชอบกัน แอบเป็นชู้กัน
มักขิกา 0,น.,แมลงวัน ชื่อของแม่เฒ่าที่อุปการะเจ้าก่ำกาดำในชาดกเรื่อง ก่ำกาดำ
มักคัก 0,ว.,ลักษณะของคนที่ล่ำสันแต่ค่อนข้างเตี้ยเล็ก
มักว่า 0,สัน.,อันว่า หากว่า คือ คือเป็น ที่ต้องว่า เป็นคำใช้อธิบายศัพท์หรือความ
มักอย้อง 0,ก.,ชอบแต่งตัว ชอบหรูหรา
มัคคะ 0,น.,ทาง
มั่ง 0,ก.,มี มีมาก
มั่ง 1,ว.,คำประกอบคำว่า เขียว เป็น เขียวมั่ง หรือ เขียวมั่งๆ แปลว่า เขียวปัด
มั่ง ๆ 0,ว.,ใส เป็นเงาวูบวาบ
มังกอร 0,น.,สัตว์ในนิยายจีนรูปร่างคล้ายงูแต่มีตีนเขา มีดาวราศีที่ ๑๐ ใน ๑๒ ราศี (ยืม - มังกร ล้านนาใช้ ลวง)
มังคละ 0,น.,เหตุที่นำมาซึ่งความเป็นมงคล พิธีมงคล
มังคลัตถทีปนี 0,น.,ชื่อคัมภีร์ฉบับหนึ่งที่พระสิริมังคลาจารย์แห่งนครเชียงใหม่แต่งไว้เมื่อประมาณ พ.ศ. ๒๐๖๗
มังสะ 0,น.,เนื้อของคนและสัตว์
มัจจุราชะ 0,น.,เจ้าแห่งความตายคือพญายมราช
มัชชะ 0,น.,น้ำเมา ของเมา
มัชฌะ 0,น.,ท่ามกลาง
มัชฌิมปเทสะ 0,น.,ประเทศอินเดีย หมายถึงอินเดียส่วนที่เจริญ
มัชฌิมะ 0,ว.,ปานกลาง
มัชฌิมาปฏิปทา 0,น.,ทางสายกลาง
มัด 0,ก.,มัด
มัด 1,ลัก.,เรียกของบางอย่างที่ผูกรัดเข้าด้วยกัน
มัดจ็อก 0,ก.,มัดรวบเป็นกระจุก
มัดจ่องแอววอก 0,ก.,ผูกที่สะเอวเหมือนผูกลิงหรือมัดกบ
มัดสะทก 0,ก.,ผูกเป็นเงื่อนกระตุก
มัน 0,น.,เรียกส่วนที่อยู่ในร่างกายของคนและสัตว์ มีลักษณะนุ่มๆ หยุ่นๆ มีน้ำมันอยู่ในตัว เช่น มันหมู
มัน 1,น.,ชื่อเห็ดชนิดหนึ่ง ไม้เถาชนิดที่มีหัว
มัน 2,สรรพ.,เรียกบุรุษที่ ๓ เอกพจน์
มัน 3,ว.,เป็นมัน มีลักษณะเรียบลื่น
มันแกว 0,น.,มันเทศ
มันแกวละแวก 0,น.,มันแกว
มันแกวลาว 0,น.,มันแกว
มันชวาก 0,น.,มันมือเสือ มันอ้อน มันมุ้ง มันอีมุ่ง
มันตา 0,น.,มนตร์ - ความรู้ ปัญญา
มันต้าง 0,น.,มันสำปะหลัง
มันปลา 0,น.,ต้นกันเกรา
มันปู 0,น.,ต้นกันเกรา
มันมู้ 0,น.,ว่านพระฉิม
มันยึ 0,ว.,มักประกอบหลัง มัน เป็น มันยึ แปลว่า เป็นมันย่อง มีมันหรือน้ำมันมากเกินไป
มันละแวก 0,น.,มันแกว
มันห้อ 0,น.,มันฮ่อ
มันอ้อน 0,น.,ชื่อพรรณไม้ล้มลุกเลื้อย มีหัวรับประทานได้ด้วยการนำมานึ่งให้สุก
มันอะลู 0,น.,มันฝรั่ง
มัมมิละ 0,น.,ชนเผ่าหนึ่งอยู่ทางอินเดียตอนใต้ ชนเผ่าพื้นเมือง
มัว 0,ว.,มัว - ไม่แจ่ม ฟาง ไม่มืดไม่สว่าง มักใช้ประกอบคำ เมา เป็น มัวเมา หรือ เมามัว แปลว่า ติดใจ เป็นห่วง
มา 0,ก.,มา
มา 1,ว.,ใช้ประกอบกับคำกริยาหมายถึงอาการที่ต่อเนื่องเรื่อยมาจนถึงปัจจุบันหรือสู่จุดหมาย เช่น เมินมาแล้ว - นานมาแล้ว
ม้า 0,น.,ม้า
ม้า 1,น.,ไกหรือสิ่งประดิษฐ์ที่ยื่นออกมาเพื่อใช้รองรับสิ่งอื่นอย่างไกคันร่มที่ดีดตัวออกมาจากคันเพื่อรับโครงร่มมิให้เลื่อนตก คันสำหรับค้ำยัน
มาก 0,ว.,หลาย ตรงข้ามกับน้อย มักใช้ในภาษากวี ทั่วไปนิยมใช้ นัก
ม้าขี่ 0,น.,ที่สำหรับนั่ง คนทรง
