คำ,POS,ความหมาย
รก 0,น.,"รก, อวัยวะสำหรับหล่อเลี้ยงห่อหุ้มเด็กในครรภ์ แนบอยู่กับมดลูก มีสายล่ามมาที่สะดือเด็ก."
รก 1,น.,สิ่งที่เป็นเส้นคล้ายรากไม้ที่ห้อยอยู่ตามกิ่งไม้บางอย่าง หรือบางทีเป็นแผ่นห่อกาบไม้ เช่น รกพร้าว.
รก 2,ว.,"รกรุงรัง, ที่กระจัดกระจายอยู่เกลื่อนกลาดไม่เป็นระเบียบเรียบร้อย."
รก 3,ว.,หาเรื่อง เช่น หาที่รก - ไปหาเรื่องกับคนอื่น.
รกช้าง 0,น.,"กะทกรก, ชื่อไม้พุ่มรอเลื้อย ตามลำต้นมีหนามห่างๆ ใบรูปไข่หรือรี ๆ ดอกเล็กสีขาว อยู่เป็นกระจุกที่ง่ามใบ ผลกลมหรือรีขนาดเท่าเม็ดบัว เขื่อง ๆ เป็นสมุนไพร"
รกแร็ก 0,ว.,"ไม่เป็นชิ้นเป็นอัน, ไม่อยู่นิ่ง, ชักช้า, กะปริดกะปรอย เช่น ฝนตกสกแส็ก - ฝนตกกะปริดกะปรอย"
รกแร็ก 1,ว.,"กะปริดกะปรอย, อาการที่ฝนตกน้อย ๆ, ตก ๆ หยุด ๆ (ดู สกแส็ก)"
รกอกรกใจ 0,ว.,"กวนใจ, ไม่สบายใจ."
รง 0,ว.,เสื่อม ใช้กับเครื่องรางของขลัง เช่น เครื่องรางรง – เครื่องรางเสื่อมอิทธิฤทธิ์.
รด 0,ก.,เท ราด สาด ฉีด หรือโปรยน้ำหรือของเหลวไปยังสิ่งใดสิ่งหนึ่งเพื่อให้เปียกหรือให้เปียกชุ่ม.
รดท่อน 0,ก.,ล้างตัวเพียงท่อนบน.
รดอก 0,ว.,"ยุ่งใจ, รำคาญใจ."
รถ 0,ก.,"ยานที่มีล้อสำหรับเคลื่อนไป, ยานพาหนะซึ่งเดินด้วยกำลังเครื่องยนต์ กำลังไฟฟ้า หรือพลังงานอื่น."
รถกุดัง 0,น.,รถบรรทุก (ภ.ก.)
รถกุดัง 1,น.,รถบรรทุกขนาดใหญ่ชนิดหนึ่ง.
รถเกราะ 0,น.,รถถัง
รถขุด 0,น.,รถแบ็คโฮลด์
รถเครื่อง 0,น.,รถจักรยานยนต์.
รถงาน 0,น.,รถบรรทุก (ภ.ก.)
รถจอหนัง 0,น.,รถบรรทุกชักลากไม้ มีกรอบลี่เหลี่ยมคล้ายจอหนังอยู่ด้านหลัง (ก.บ.)
รถจอหนัง 1,น.,รถฉายหนังเร่.
รถจิ๊ปยักษ์ 0,น.,รถบรรทุกขนาดใหญ่ ที่รูปทรงส่วนหน้าของรถคล้ายรถจิ๊ปขนาดเล็ก ปัจจุบันรถประเภทนี้ไม่มีให้เห็นแล้ว (ภ.ก.).
รถดุน 0,น.,รถแทรกเตอร์ที่มีใบมีดหน้า สำหรับเกลี่ยดิน
รถตักดิน 0,น.,รถแบ็คโฮลด์
รถถีบ 0,น.,รถจักรยาน
รถทอดิน 0,น.,รถแทรกเตอร์ที่มีใบมีดหน้า สำหรับเกลี่ยดิน
รถเท 0,น.,รถบรรทุกชนิดหนึ่ง ที่ยกตัวถังเทของที่บรรทุกได้.
รถป๊าเก๊ 0,น.,"รถนั่งส่วนบุคคล, รถเก๋ง (ภ.ก., พ.ง.)."
รถโป้ต้อง 0,น.,รถรับจ้างสองแถว.
รถโพ้ถ้อง 0,น.,รถรับจ้างสองแถว.
รถมาสด้า 0,น.,รถสองแถว.
รถแม็คโค 0,น.,รถแบ็คโฮลด์
รถรุน 0,น.,รถเข็น.
รถล้อรี่ 0,น.,รถบรรทุก (ภ.ก.)
รถล้อลี่ 0,น.,"รถบรรทุก (ขนาดใหญ่ ๖ ล้อขึ้นไปไม่รวมรถปิกอัพ) (ภ.ก., พ.ง.)"
รถวิน 0,น.,รถบรรทุกชักลากไม้ มีกรอบลี่เหลี่ยมคล้ายจอหนังอยู่ด้านหลัง (ก.บ.)
รน 0,ก.,อาการร้องขู่ในสำคอ ใช้กับสัตว์ เช่น เสือมฺรน - เสือคำราม
รน 1,น.,เรือน (ดู เริน).
รน 2,ก.,"รีบร้อน, ร้อนรน, นิ่งอยู่ไม่ได้, เร่าร้อน."
รน 3,น.,"บ้านเรือน, โรงเรือน เช่น บนเริน - บนบ้าน, ชั้นบน"
รบ 0,ก.,"สู้รบ, สู้กัน, ต่อสู้ในทางศึก."
รบ 1,ก.,ทะเลาะ เช่น แด็กรบกันเล่า - เด็กทะเลาะกันอีก.
ร่ม 0,น.,"ร่ม, สิ่งที่ใช้สำหรับกางกันแดด กันฝน มีด้ามสำหรับถือ."
ร่มค้างคาว 0,น.,ร่มผ้าสีดำคันใหญ่ ๆ เป็นร่มที่ผู้มีอันจะกินใช้ในสมัยก่อน (ภ.ก.)
ร่มดาษ 0,น.,ร่มที่ทำจากกระดาษ คนทั่วไปจะใช้ร่มชนิดนี้ เพราะราคาถูก (ภ.ก.).
ร่มดาษ 1,น.,"ร่มเงา, บริเวณที่แดดส่องไม่ถึง."
ร่มดาษ 2,ก.,"ไม่ทำตามระเบียบกติกา หรือสัญญาที่ตกลงไว้ เช่น ร่มโรงเรียน - หนีโรงเรียน, ร่มเบี้ย - ยืมเงินแล้วไม่ใช้คืน."
ร่มไฟ 0,น.,เมรุที่สร้างเป็นเสาสี่เสามีผ้าหรือกระดาษสีขาวทำเป็นเพดาน (ดู สามส้าง).
ร่มไฟ 0,น.,เมรุที่สร้างเป็นเสาสี่เสา มีผ้า หรือกระดาษสีขาวทำเป็นเพดาน
รวก 0,น.,เรียกลูกอ๊อดหรือลูกของสัตว์ครึ่งบกครึ่งน้ำ ในช่วงที่เป็นตัวอ่อนยังมีหางอยู่ว่า “ ลูกรวก ”
รวก 1,น.,ชื่อไม้ไผ่ชนิดหนึ่ง ขึ้นเป็นกอ ลำเล็กเรียวยาว ไม่มีหนามเรียก “ ไผ่รวก ”.
รวง 0,น.,ช่อ (ใช้กับข้าว).
รวง 1,ลัก.,ช่อ เช่น ข้าว ๓ รวง - ข้าว ๓ ช่อ.
รวง 2,ลัก.,ฝัก เช่น คง ๓ รวง - ข้าวโพด ๓ ฝัก.
ร่วง 0,ก.,"ร่วงหล่น, ตก เช่น ใบไม้ร่วง, ปีนี้แด็กสอบร่วงกันเป็นแถว – ปีนี้เด็กสอบตกกันเป็นแถว."
รวด 0,น.,หนองที่เป็นก้อนแข็งอยู่ในเนื้อ เกิดกับแผลอักเสบเรื้อรัง
รวน 0,ก.,"โยกคลอน, ไม่แน่น เช่น ฟันรวนหมดแล้ว."
รวน 1,ก.,เอาเนื้อสดหรือปลาสดหั่นเป็นชิ้น แล้วคั่วให้พอสุกเพื่อเก็บเอาไว้แกง เป็นต้น เช่น รวนหมู - เอาเนื้อหมู มาผัดน้ำมันพอสุกเพื่อเก็บเอาไว้ทำกับข้าวมื้อต่อไป.
รวน 2,ก.,"รบกวน, หาเรื่องทะเลาะ, แสดงกิริยา หรือวาจาชวนวิวาท เช่น มึงอย่าไปรวนเขาเลย."
รวน 3,ก.,ขยับไปมาเพื่อให้เข้าที่ โดยปริยายหมายถึงหารือ เพื่อหาข้อตกลง เช่น ไหนมารวนกันแลถี - ลองมาหาข้อตกลงกันดีกว่า.
ร่วม 0,ก.,มีส่วนร่วมอยู่ด้วยกัน.
ร่วมลงโรง 0,สำ.,ตกลงใจร่วมด้วย.
รส 0,น.,กลิ่น เช่น ซากนี้ส่งรสแล้ว - ศพนี้ส่งกลิ่นแล้ว.
รส 1,น.,"รส, สิ่งที่รู้ได้ด้วยลิ้น."
รอ 0,น.,"เขื่อนหรือคันดินกั้นน้ำ, หลักปักกันกระแสน้ำ."
รอ 1,ก.,รองรับด้วยมือ เช่น อย่าเอามือไปรอน้ำ.
รอก 0,น.,"กระรอก, สัตว์เลี้ยงลูกด้วยนม มีฟันแทะ ส่วนใหญ่ตาโต และหูใหญ่ หางยาวเป็นพวง กินผลไม้."
รอก 1,น.,กระดึงแขวนคอวัว หรือควาย (ส.ข.).
รอก 2,น.,"ลูกรอก, เครื่องผ่อนแรง รูปคล้ายล้อ มีแกนหมุนได้ รอบตัวที่แกนเป็นร่องสำหรับให้เส้นเชือก หรือเส้นลวดเดินได้สะดวก ใช้สำหรับยก ลาก หรือดึงของหนักให้เบาแรงและสะดวกคล่องขึ้น."
ร็อก 0,น.,ชื่อปาล์ม วงศ์ Palmae ใบประกอบรูปฝ่ามือ ดอกเล็ก ออกเป็นช่อแยกแขนงตามง่ามใบ ผลค่อนข้างกลม สีน้ำเงินแกมเขียว.
ร็อกคี่ 0,น.,ก้น (ดู วาน น.).
ร็อกคี่ 0,น.,"ก้น, ตะโพก, ทวาร"
รอกลอย 0,ก.,นำกลอยที่ผ่านการหมักเกลือไว้แล้ว ใส่ภาชนะโปร่งไปวางไว้ให้น้ำไหลผ่าน.
รอกลอย 1,ก.,รอคอย.
รอเก๊าะ 0,น.,"บุหรี่, ยาสูบที่ใช้ใบตองหรือกระดาษมวนใบยาที่หั่นเป็นฝอย"
รอเก๊าะ 1,น.,บุหรี่ (ดู ยาสูบ).
รอง 0,ก.,รองรับ เช่น เอาถุ้งไปรองน้ำ - เอาถังไปรับน้ำ.
ร้อง 0,ก.,"ร้อง, เปล่งเสียงดัง, โดยปริยายหมายถึงออกเสียงดังเช่นนั้น."
รองคอ 0,น.,คนถัดไปจากคนแรก ส่วนมากใช้ในวงการพนัน.
รองคอ 1,น.,รองเจ้าอาวาส.
รองคอ 0,น.,รองเจ้าอาวาส
ร็องแง็ง 0,น.,การละเล่นอย่างหนึ่งของชาวไทยมุสลิม.
ร็องแฉ็ง 0,ว.,ไม่เป็นระเบียบ เช่น แตงตัวร็องแร็ง - ไม่เอาใจใส่กับการแต่งเนื้อแต่งตัว
รองทรง 0,น.,ทรงผมผู้ชายที่ตัดข้างล่างสั้นข้างบนยาว.
รองรัง 0,ก.,การเอาไข่ไก่ไปใส่ไว้ในรัง เพื่อล่อให้ไก่มาวางไข่ โดยปริยายหมายถึงการได้กำไรไว้เป็นทุน ในตอนต้นแล้ว.
รองรัง 1,ก.,การเล่นการพนันที่ถือข้างฝ่ายเสียเปรียบซึ่งลงทุนน้อยแต่เมื่อชนะจะได้ผลตอบแทนมาก.
รองรัง 2,ว.,ถัดไป.
ร้องเรือ 0,น.,เพลงกล่อมเด็ก
ร่องแร่ง 0,ว.,"ไม่มีที่อยู่แน่นอน, เทียวไปเทียวมา เช่น อยูหนี้ดีหวาไม่พักร่องแร่ง - อยู่ที่นี่ดีกว่าไม่ต้องเทียวไปเทียวมา."
ร็องแร็ง 0,ว.,ไม่เป็นระเบียบ เช่น แตงตัวร็องแร็ง - ไม่เอาใจใส่กับการแต่งเนื้อแต่งตัว
ร้องส่ง 0,ก.,เป็นการร้องในการสวดพระมาลัยหน้าศพตอนย่ำรุ่งในคืนสุดท้ายของการบำเพ็ญกุศลศพ เพื่อปลุกญาติของผู้ตายให้ลุกขึ้นมาฟัง โดยผู้ร้องจะต้องรู้ประวัติผู้ตายเป็นอย่างดี แล้วนำมาพรรณนาเป็นเพลงร้องส่ง เพื่อให้ญาติได้สำนึก.
รอด 0,น.,"คาน, ไม้ที่สอดรูเสาทั้งคู่สำหรับรับกระดานพื้นเรือน."
รอดกลิ้ง 0,น.,"ตง, ไม้รับตง (พ.ง.)."
รอดขัด 0,น.,ไม้รอดที่ช่วยรับตงของเรือนที่มีใต้ถุนสูงอยู่ระหว่างรอดของเสา จะใส่ไว้สักกี่ตัวขึ้นอยู่กับน้ำหนักของที่เก็บไว้ในห้องนั้น.
รอดขัด 1,ก.,"ไม่ตาย, ผ่านพ้นความตายมาได้, เอาชีวิตรอดมาได้ เช่น แม่ตายแต่ลูกรอด."
รอดขัด 2,ว.,"ได้, สำเร็จ, พ้นไป เช่น ไปไม่รอด - ทำไม่สำเร็จ, พารอด - สามารถเลี้ยงได้."
รอดหยิวรอดกา 0,สำ.,ปลอดภัย ตรงกับสำนวนที่ว่า รอดปากเหยี่ยวปากกา.
ร่อน 0,ก.,"ร่อน, แยกของละเอียดออกจากของหยาบโดยใช้เครื่องแยก มีเลียง เป็นต้น แกว่งยักย้ายไปมา เช่น ร่อนแร่."
ร้อน 0,ว.,"ร้อน, มีความรู้สึกตามผิวหนังเหมือนถูกไฟ เป็นต้น, ตรงข้ามกับเย็น, กระวนกระวายใจ, เร่งรีบ, ช้าอยู่ไม่ได้"
ร้อนทุกข์ 0,ก.,"วิตก, ทุกข์ร้อน, เป็นกังวล."
ร้อนพุง 0,สำ.,"เคือง, มีเรื่องร้อนใจ เช่น กูร้อนพุงกับคนนี้จริง."
ร้อนไม่หลอด 0,สำ.,บ้า ๆ บอ ๆ เช่น คนที่พูดพลางหัวเราะไปพลางทั้งที่ไม่ได้ตลกอะไรเลย (ภ.ก.).
ร้อนวาน 0,สำ.,ร้อนตัว เช่น เขาไม่ได้ว่าตัวที ตัวร้อนวานขึ้นเอง.
ร้อนวาว 0,ว.,ร้อนวาบ.
ร้อนหัวอก 0,สำ.,กระหายน้ำ
รอฟัน 0,ก.,กรอฟัน เช่น หมอฟันเอาหินมารอฟันเสียวจัง - หมอฟันเอาที่กรอฟันมากรอเสียวมาก.
รอม 0,ก.,ทำให้ปลายทั้ง ๒ ข้างโค้งเข้าหากัน.
รอม 1,ว.,ปลายทั้ง ๒ ข้างโค้งเข้าหากัน (ภ.ก).
รอมฎอน 0,น.,เดือนที่ ๙ ของฮิจเราะห์ศักราช ซึ่งชาวมุสลิมทั้งโลกจะถือศีลอดเป็นเวลา ๑ เดือน.
รอย 0,น.,"รอย, ลักษณะที่เป็นเส้น เป็นริ้ว หรือลวดลาย เป็นต้น ที่ปรากฏอยู่บนพื้นสิ่งใดสิ่งหนึ่ง."
รอย 1,น.,"ของที่คนอื่นทำไว้, ของเหลือเป็นเดน เช่น กูไม่ทำรอยหมันแหละ - กูไม่ทำต่อจากมันแหละ"
รอยควาย 0,*น.,ชื่อขนมชนิดหนึ่ง
รอยเดนรอยชาน 0,น.,"ของเหลือจากผู้อื่น, ของที่ผ่านมือผู้อื่นมาก่อน."
รอยตีนนก 0,น.,ริ้วรอยที่เกิดขึ้นตามใบหน้าคนแก่
รอยตีนผี 0,น.,ริ้วรอยที่เกิดขึ้นตามใบหน้าคนแก่
รอเยาะ 0,น.,ชื่ออาหารชาวไทยมุสลิมภาคใต้อย่างหนึ่ง (ป.น.).
รอแย 0,น.,ส่วนประกอบท้ายเรือกอและ ใช้สำหรับผูกยึดหางเสือ (ป.น.).
ร่อแร่ 0,ว.,"ป่วยหนัก, เจ็บมาก."
ระ 0,น.,"มะระ, ชื่อไม้เถาชนิดหนึ่ง ผลขรุขระ รสขม กินได้มี ๒ ชนิด คือ มะระจีน ผลโต และมะระขี้นก ผลเล็ก"
ระ 1,ก.,การเอามือหรือเท้าไปลากกระทบอะไรบางอย่าง เช่น รั้วสังกะสีที่เป็นลูกคลื่นให้เกิดเสียงดัง (ภ.ก.)
ระ 2,ก.,"ตัดออก เช่น หลิดกล้วย, หลิดตาไม้ไผ่"
ระ 3,น.,มะระ (ดู มฺระ).
ระ 4,ก.,ตัดออก (ดู หลิด ก. ๑.).
ระ 5,ก.,ทำให้เรียบ เช่น ระเพดาน - กวาดเพดาน.
ระ 6,ก.,ผ่าน เช่น เดินระมา - เดินผ่านมา.
ระ 7,ก.,"ไต่ไป, เลื้อยไป เช่น ไม้เถาระขึ้นเครือ"
ระ 8,ก.,การเอามือหรือเท้าไปลากกระทบอะไรบางอย่าง เช่น สังกะสีที่เป็นลูกคลื่น (ดู หระ ก.).
ระ 9,ว.,เรี่ยราด เช่น หลนระทาง - ตกเรี่ยราดมาตลอดทาง.
ระกันหม้อ 0,น.,"เสวียนรองหม้อ, ของใช้ชนิดหนึ่งทำด้วยหญ้า หวายหรือฟาง เป็นต้น ถักหรือมัดเป็นวงกลม มักมีหู ๒ ข้าง สำหรับหิ้ว ใช้รองก้นหม้อที่หุงต้มด้วยเตาฟืนหรือเตาถ่าน"
ระกันหม้อ 1,น.,เสวียนรองหม้อ (ดู กัน น. ๑.).
ระแก็ด 0,น.,เนื้อไม้ที่ตัดออกเป็นชิ้น ๆ.
ระคาพุง 0,ก.,"อิ่ม, หายหิว (น.ธ.)."
ระคาพุง 1,ว.,โล่งใจ.
ระฆี 0,น.,แป้งข้าวหมาก
ระฆี 1,น.,แป้งข้าวหมาก (ดู แป้งหล้าหมาก).
ระงัน 0,ก.,"ตรงเข้าใส่, กระโดดเข้าหา (น.ธ., ย.ล., ป.น.)."
ระงับ 0,น.,"ต้นไมยราบ, ชื่อไม้ล้มลุก ใบคล้ายใบกระเฉด เมื่อถูกกระเทือนก็หุบราบไป"
ระงับ 1,น.,ต้นไมยราบ (ดู งับ น.).
ระจ๋น 0,น.,ยาเบื่อ (ดู ราจุน น.).
ระจ๋น 0,น.,"ยาเบื่อ, ยาพิษ (ม. racun)"
ระดอก 0,ว.,"มือเปล่า, เปล่า ๆ เช่น มาระดอกไม่พาไหรเลย - มามือเปล่า ๆ ไม่เอาอะไรมาเลย (น.ธ.)."
ระดอก 0,ว.,"เปล่า, ไม่มีอะไร, ว่าง ๆ"
ระดับ 0,ก.,"จัดแจง, เตรียม (ดู ตับ ก. ๑.)."
ระดับ 0,ก.,"จัดแจง, เตรียม, ลำดับ, ตกแต่ง"
ระเดือด 0,ก.,เดือดดาล. ว. มากยิ่ง. (ภ.ก.).
ระตึ๋งระแต๋ง 0,ว.,พันกันยุ่ง (ดู กะตึ๋งกะแต๋ง).
ระตึ๋งระแต๋ง 0,ว.,พันกันยุ่ง
ระทา 0,น.,เชิงเทียนทำด้วยไม้ไผ่ เครื่องบูชาเทพเจ้า โดยใช้ติดเทียนและธงทิวในพิธีรับเจ้าเมือง และใช้ติดเฉพาะเทียนในพิธีไหว้หน้าบ้าน ลักษณะเป็นพุ่ม ๓ ชั้น ชั้นละ ๔ หน้า คล้ายต้นดอกไม้ไฟ สูงประมาณ ๔ - ๕ เมตร ชั้นล่างสุดมีลักษณะโค้งคล้ายระฆังควํ่า (น.ธ.).
ระนาด 0,น.,เฝือกสำหรับห่อศพ.
ระนาด 1,น.,"ระนาด, เครื่องปีพาทย์ชนิดตี ประกอบด้วยลูกระนาด ทำด้วยไม้ร้อยเชือกหัวท้ายเข้าเป็นผืน ใช้แขวนบนรางระนาด หรือทำด้วยเหล็ก หรือทองเหลือง ใช้วางเรียงบนรางระนาด มีไม้ประกับหัวท้าย ลูกระนาดเรียงขนาดสั้นยาวตามลำดับเสียง มีตั้งแต่ ๑๗ - ๒๑ ลูก"
ระนึงตึ๋งแต๋ง 0,ว.,พะรุงพะรัง (น.ธ.).
ระบู 0,น.,ย่านลิเภา (ดู ย่านยี่เพา).
ระบู 0,น.,ย่านลิเภา
ระโบะ 0,น.,เชื้อใช้ติดไฟของตะบันไฟหรือเหล็กไฟตบ (น.ธ.).
ระโปะ 0,น.,ทุเรียนกวน (ดู เรียนเคี่ยว).
ระโปะ 1,น.,ทุเรียนกวน
