คำ,POS,ความหมาย
สก 0,น.,"อุบาสก, อุบาสิกา, ฆราวาส."
สก 1,ว.,เปียกโชก
สก 2,ว.,"สะเด็ด, แห้งน้ำ เช่น สกน้ำ - สะเด็ดน้ำ."
สกครุ 0,ว.,สกปรก เช่น แด็กคนนี้อยู่สกมกจัง - เด็กคนนี้สกปรกมาก
สกโครก 0,ว.,สกปรก เช่น แด็กคนนี้อยู่สกมกจัง - เด็กคนนี้สกปรกมาก
สกมก 0,ว.,สกปรก เช่น แด็กคนนี้อยู่สกมกจัง - เด็กคนนี้สกปรกมาก
สกแส็ก 0,ว.,"ไม่เป็นชิ้นเป็นอัน, ไม่อยู่นิ่ง, ชักช้า, กะปริดกะปรอย เช่น ฝนตกสกแส็ก - ฝนตกกะปริดกะปรอย"
สกแส็ก 1,ว.,"อัตคัด, ขาดแคลน."
สกแส็ก 2,ว.,"รบกวนโดยไม่จำเป็น, วางตัวไม่เหมาะสม."
สกแส็ก 3,ว.,"กุกกัก, เสียงเบา ๆ ที่เกิดจากการเคลื่อนไหวเล็กน้อย"
สกแส็กซกแซ็ก 0,ว.,"กุกกัก, เสียงเบา ๆ ที่เกิดจากการเคลื่อนไหวเล็กน้อย"
สกุ๋น 0,น.,มดลูก (ดู กุน น. ๑.).
สกุ๋น 0,น.,"มดลูก, อวัยวะภายในอันเป็นที่ตั้งครรภ์"
สง 0,น.,"พระสงฆ์, ภิกษุในพระพุทธศาสนา."
สง 1,ก.,"ส่ง, ทำให้สิ่งใดสิ่งหนึ่งเคลื่อนพ้นจากที่หนึ่งไปยังอีกที่หนึ่ง เพื่อให้ถึงผู้รับหรือเป้าหมายด้วยอาการต่าง ๆ กัน เช่น สงข้าม - ส่งข้าม, สงผาน - ส่งผ่าน, สงตอ - ส่งต่อ."
สง 2,ก.,เอาของขึ้นจากน้ำเพื่อให้น้ำสะเด็ด เช่น สงข้าว.
สง 3,ก.,"สุก, แก่จัด (สำหรับหมาก)."
สง 4,ก.,อาบน้ำ (ใช้แก่บรรพชิตและเจ้านาย).
สงครีพ 0,น.,"สุครีพ, ชื่อตัวละครในรามเกียรติ์ (ภ.ก.)."
สงครู 0,ก.,การร้องบทมโนราห์โรงครูเพื่อส่งครูมโนราห์ที่มาชุมนุมกันกลับไปสู่ที่เดิมของครูนั้น ๆ.
สงพระ 0,น.,พิธีส่งเจ้าซึ่งจะทำในคืนสุดท้าย (ขึ้น ๙ ค่ำ เดือน ๙ ) ของการกินผักหรือกินเจ.
สงเม่น 0,น.,รูที่เม่นอาศัยอยู่
สงเม่น 1,น.,รูที่เม่นอาศัยอยู่ (ดู ฉ็องแม่น).
ส่งรส 0,ว.,เริ่มมีรส
สงสการ 0,ก.,"ปลงศพ, ทำศพ, ฌาปนกิจ."
สง่า 0,ว.,"มาก ใช้ได้ทั้งในเรื่องดีและไม่ดี เช่น ดีสง่า - ดีมาก, เบฺร่อสง่า - โง่มาก (ส.ต.)."
สดาย 0,ก.,"เสียดาย, รู้สึกเสียใจในสิ่งที่ควรได้แต่ไม่ได้หรือในสิ่งที่ควรทำแต่ไม่ทำ, อาลัยถึงสิ่งที่จากไป."
ส้น 0,น.,"ส้น, ส่วนท้ายของเท้า, ส่วนท้ายของบางสิ่งบางอย่าง"
ส้นตีน 0,น.,"ส้น, ส่วนท้ายของเท้า, ส่วนท้ายของบางสิ่งบางอย่าง"
ส้นไม่ถึงดิน 0,สำ.,"ลำพอง, เย่อหยิ่ง, จองหอง."
ส้นเริก 0,สำ.,หวาดระแวง
สบ 0,น.,ภาชนะสานด้วยหวายเป็นรูปกลม ใช้ใส่มะพร้าว เข้าหนีบในกรามช้าง
สบ 1,น.,ตรงรอยต่อ เช่น หัวสบ - หัวต่อ.
สบ 2,น.,"ศพ, ซากผี, ร่างคนที่ตายแล้ว."
สบ 3,น.,ภาชนะสานด้วยหวาย เป็นรูปทรงกลม ใช้ใส่มะพร้าวเข้าหนีบในกรามช้าง (ดู กันพร้าว).
สบ 4,ก.,"ยุบ, ทุเลา, สงบ เช่น คลื่นสบแล้ว - คลื่นสงบแล้ว."
สบแจ้ง 0,น.,ช่วงเวลาใกล้สว่าง
สบแจ้ง 1,น.,เพียบหนัก เช่น เขาสบแล้ว - เขามีอาการเพียบหนักแล้ว (พ.ท.).
สบดิ 0,น.,สมประดี (ดู สับเดะ น.).
สบดิ 1,น.,สมประดี
สบเดะ 0,น.,สมประดี (ดู สับเดะ น.).
สบเดะ 1,น.,สมประดี
สม 0,ก.,"สะสม, ผสม, รวบรวมให้เพิ่มมากขึ้นเรื่อย ๆ เช่น สมเบี้ยไว้เพื่อเรียนหนังสือ – สะสมเงินไว้เพื่อเรียนหนังสือ."
สม 1,ก.,ปนกัน
สม 2,ว.,"สมน้ำหน้า, เป็นคำแดกดันหรือซ้ำเติมว่าควรได้รับผลร้ายเช่นนั้น"
ส้ม 0,น.,"ส้ม, ชื่อไม้พุ่มหรือไม้ต้นขนาดเล็กหลายชนิด ใบ ดอกและผิวผลมีต่อมน้ำมัน กลิ่นฉุน ผลรสเปรี้ยวหรือหวาน กินได้."
ส้ม 1,ก.,"ทำให้เปรี้ยว เช่น ปลาส้ม, กุ้งส้ม, แกงส้ม."
ส้มกบ 0,น.,ชื่อไม้ต้นขนาดใหญ่ คล้ายประดู่
ส้มกบ 1,น.,ชื่อไม้ต้นขนาดใหญ่ชนิดหนึ่ง (ดู ยายตุหงัน).
ส้มเก็ดหลา 0,น.,"ส้มจี๊ด, ส้มชนิดหนึ่ง ลักษณะคล้ายส้มเขียวหวาน ผลเล็กกว่ามะนาว รสเปรี้ยว"
ส้มเกลี้ยง 0,น.,ส้มเขียวหวาน.
ส้มแก็ดล่า 0,น.,ส้มจี๊ด.
ส้มขาม 0,น.,มะขาม
ส้มขี้ม้า 0,น.,ส้มเขียวหวานชนิดหนึ่ง มีขนาดเท่าผลมะนาว.
ส้มแขก 0,น.,ผลไม้ชนิดหนึ่ง ผลกลมคล้ายชะมวงหั่นเป็นชิ้นบาง ๆ ตากแห้งเป็น สีดำ ใช้ในการปรุงอาหาร
ส้มควาย 0,น.,ผลไม้ชนิดหนึ่ง ผลกลมคล้ายชะมวงหั่นเป็นชิ้นบาง ๆ ตากแห้งเป็น สีดำ ใช้ในการปรุงอาหาร
สมค้าน 0,ก.,ร่วมคัดค้าน.
ส้มเคยขาว 0,น.,ส้มชนิดหนึ่ง ลักษณะอย่างส้มจุก รสเปรี้ยวจัดอย่างมะนาว.
ส้มงั้ว 0,น.,"มะงั่ว, ชื่อไม้ต้นขนาดเล็ก ผลคล้ายส้มโอ รสเปรี้ยวจัดใช้ประสมกับขมิ้นเพื่อย้อมผ้า"
สมจร 0,ก.,การผสมพันธุ์ของงู เช่น งูคาบกัน
สมจร 1,ก.,การผสมพันธุ์ของงู.
ส้มจุก 0,น.,ส้มชนิดหนึ่งขนาดเท่าส้มเกลี้ยง ตรงขั้วมีลักษณะเป็นปุ่มนูนขึ้นมา.
ส้มเช้า 0,น.,ต้นควํ่าตายหงายเป็น (ก.บ.).
ส้มซ้า 0,น.,ส้มชนิดหนึ่ง คล้ายส้มโอ แต่เนื้อกินไม่ได้เพราะเปรี้ยวมาก มักใช้สระผมและใช้เป็นยาสมุนไพร.
ส้มตรีด 0,น.,ชื่อมะม่วงป่าชนิดหนึ่ง ผลมียางมาก รสเปรี้ยว
ส้มตรีด 1,น.,มะม่วงป่าชนิดหนึ่ง ผลมียางมาก รสเปรี้ยว.
ส้มนาว 0,น.,"มะนาว, ชื่อไม้พุ่ม ผลเล็ก ๆ รสเปรี้ยว ใช้ปรุงอาหาร"
ส้มนาว 1,น.,มะนาว
ส้มนาวควาย 0,น.,ส้มชนิดหนึ่ง คล้ายมะนาวแต่ผลโต เปลือกหนา.
ส้มเนรา 0,น.,"ต้นสำมะงา, ชื่อไม้พุ่ม ขึ้นตาป่าชายเลน ใช้ทำยาได้"
ส้มโบ 0,น.,"ส้มโอ, ชื่อไม้พุ่มหรือไม้ตันใบ ดอก และผิวผลมีต่อมน้ำมัน กลิ่นฉุน ผลรสเปรี้ยว หรือหวาน กินได้"
ส้มโบ้ 0,น.,ส้มโอ.
ส้มปน 0,ก.,"ปะปนกัน, คละกัน."
ส้มปริง 0,น.,"มะปริง, ชื่อไม้ต้น คล้ายมะปราง แต่ผลมีรสเปรี้ยว"
ส้มปริง 1,น.,มะปริง
ส้มปาก 0,ว.,เปรี้ยวปาก.
ส้มปู 0,น.,ชื่อไม้ต้นขนาดย่อม ใบคล้ายใบโพ ออกดอกเป็นช่อใหญ่ สีแดงปนขาว
ส้มเปิด 0,น.,ปลาเสือ
ส้มแป้น 0,น.,ส้มเขียวหวาน.
สมพรม 0,น.,ชื่อแกงชนิดหนึ่งใส่ผักหลาย ๆ อย่างปนกัน
สมพ้อง 0,ก.,สมประสงค์.
สมพันธุ์ 0,น.,การผสมพันธุ์ของสัตว์ใหญ่ เช่น วัว ควาย ม้า เป็นต้น
สมพาด 0,น.,การผสมพันธุ์ของสัตว์ใหญ่ เช่น วัว ควาย ม้า เป็นต้น
ส้มพี 0,น.,"กะลุมพี, ชื่อปาล์มชนิดหนึ่งจำพวกสละ ระกำ ขึ้นในป่าพรุและที่ชื้นแฉะทางภาคใต้ ผลเป็นช่อใหญ่และแน่น ปลายผลตัดผิวเหลืองเกลี้ยงเป็นมัน ไม่มีหนาม เยื่อหุ้มเม็ดขาว รสเปรี้ยว ๆ ฝาด ๆ กินได้ ยางในลำต้นเหนียว ใช้ติดกระดาษแทนกาวได้"
ส้มพี 1,น.,กะลุมพี.
ส้มพูด 0,น.,"มะพูด, ชื่อไม้ต้นชนิดหนึ่ง ใบหนาเป็นมัน ผลกลมเป็นพู ๆ รสเปรี้ยว นิยมนำมาใส่แกงหรือน้ำพริก"
ส้มพูด 1,น.,มะพูด.
ส้มเฟือง 0,น.,มะเฟือง.
ส้มไฟ 0,น.,มะไฟ.
สมภาร 0,น.,"สมภาร, พระที่เป็นเจ้าอาวาส."
ส้มมวง 0,น.,ชะมวง.
ส้มมะดีงา 0,น.,ต้นสำมะงา (ดู ส้มเนรา).
ส้มมั้ว 0,น.,มะงั่ว.
ส้มมั่วผี 0,น.,มะกรูด.
ส้มม่า 0,น.,"กระเจี๊ยบแดง (ภ.ก., พ.ง.)"
ส้มเม่า 0,น.,ชื่อไม้ต้นขนาดเล็กถึงขนาดกลาง ผลเล็ก ๆ เท่าหัวไม้ขีดไฟ เป็นช่อ มีรสเปรี้ยว กินได้.
ส้มเม่า 1,สำ.,พูดจาเอาสาระไม่ได้.
ส้มยุม 0,น.,มะยม.
สมรม 0,น.,สวนที่ปลูกผลไม้หลายชนิดคละกัน.
สมรม 1,น.,ชื่อแกงชนิดหนึ่งใส่ผักหลาย ๆ อย่างปนกัน
สมลม 0,น.,ชื่อแกงชนิดหนึ่งใส่ผักหลาย ๆ อย่างปนกัน
ส้มลุ 0,น.,"ต้นอุโลก, ชื่อไม้ต้นขนาดใหญ่ ยอดอ่อนสีแดงเรื่อขึ้นตามป่าราบทั่วไป เนื้อไม้สีขาว ใช้ทำยาได้"
ส้มลุ 1,น.,ต้นอุโลก (ดู ลาตา).
ส้มส้ม 0,สำ.,คนที่มีอารมณ์โกรธง่าย ไม่อยู่กัปร่องกับรอย กราดเกรี้ยว เช่น สาวหั้นส้มส้มฉานไม่สู้แหลง - ผู้หญิงคนนั้นโกรธง่าย ฉันไม่กล้าพูดด้วย.
ส้มสูก 0,น.,ผลไม้นานาชนิด.
สมเส 0,ก.,การประสมประเส
ส้มเสี้ยว 0,น.,กระเจี๊ยบ.
สมแส็ด 0,น.,"สมเสร็จ, สัตว์เลี้ยงลูกด้วยนมเป็นสัตว์กีบคี่ขนาดใหญ่ สำตัวตอนกลางสีขาว ส่วนหัวและส่วนท้ายสีดำ ขอบหูสีขาว จมูกและริมฝีปากบนยื่นยาวออกมาคล้ายงวง ยืดหดเข้าออกไต้ หางสั้น ลูกเกิดใหม่ตัวมีลายสีขาวตามยาว กินหญ้าใบไม้และผลไม้."
สมแส็ด 1,น.,ชื่อพันธุ์ไม้ขนาดเล็กชนิดหนึ่ง.
สมห้อง 0,น.,บทอัศจรรย์ในวรรณกรรมและกลอนหนังตะลุง.
สมห้อง 1,ว.,"เหมาะสม, เท่ากัน, เสมอกัน."
สมห้อง 2,ว.,สมน้ำหน้า (ดู สาสม).
ส้มเห็ด 0,น.,ต้นอุโลก (ดู ลาตา).
ส้มเห็ด . 0,น.,"ต้นอุโลก, ชื่อไม้ต้นขนาดใหญ่ ยอดอ่อนสีแดงเรื่อขึ้นตามป่าราบทั่วไป เนื้อไม้สีขาว ใช้ทำยาได้"
ส้มโอ 0,น.,"ส้มโอ, ชื่อไม้พุ่มหรือไม้ตันใบ ดอก และผิวผลมีต่อมน้ำมัน กลิ่นฉุน ผลรสเปรี้ยว หรือหวาน กินได้"
สมัย 0,น.,"เวลา, คราว. สมัยถ้วยหู, สมัยปิ้งพรก"
สมัย 1,สำ.,"โบราณ, นานมาแล้ว."
สมาหยัง 0,น.,การสวดมนต์ที่ชาวมุสลิมแสคงความเคารพต่อพระเจ้าวันละ ๕ ครั้ง (ดู ละหมาด).
สมาหยัง 0,น.,"ละหมาด, ช่วงเวลาที่ชาวมุสลิมทำพิธีแสดงความเคารพต่อพระเจ้าทั้งทางกายและจิตใจวันละ ๕ เวลา"
สมี 0,น.,ชื่อไม้ล้มลุกชนิดหนึ่ง ดอกสีเหลือง มีประสีน้ำตาล ใบคล้ายใบโสน ใช้ทำยาและใช้ในพิธีกูณฑ์
สมี 1,น.,พระที่ถูกบังคับให้ลาสิกขาเพราะผิดวินัย.
สยา 0,น.,ชื่อไม้เนื้ออ่อนชนิดหนึ่ง ใช้ทำเครื่องเรือนได้.
สรรพดอก 0,น.,น้ำผึ้งรวง (น.ธ.).
สรรพมด 0,น.,ตัวนิ่ม (น.ธ.).
สรรพยอด 0,น.,ค่าง (น.ธ.).
สรรพราก 0,น.,เม่น (ดู ท้าวพันราก).
สรรพราก 0,น.,เม่น
สระหัว 0,น.,"ทำบุญรดน้ำ, อาบน้ำให้ผู้ที่เคารพอย่างเป็นพิธี."
สระหัวบะดัน 0,น.,พิธีกรรมส่วนหนึ่งของการเกิดที่พ่อแม่ของเด็กที่เกิดใหม่จะต้องทำความสะอาดหรือขอขมาต่อหมอตำแย (น.ธ.).
สระหัวบะดัน 1,ก.,สระผม.
สร้างเรื่อง 0,ก.,"ทำพิษ, ให้ผลร้าย"
สวด 0,น.,หวด. ภาชนะสำหรับนึ่งของให้สุก ทำด้วยดินเผา มักมีไม้ไผ่สาน เป็นส่วนประกอบเมื่อใช้นึ่งข้าวเหนียว.
สวด 1,น.,"ลูกสวาด, ชื่อไม้เถาเนื้อแข็ง ลำต้นมีหนาม ฝักมีหนามละเอียด เมล็ดกลม เปลือกแข็งสีเทาอมเขียว."
สวด 2,ก.,"ท่องหนังสือเป็นทำนองแบบโบราณ, อ่าน."
สวด 3,ก.,"สวดมนต์ เช่น สวดด้าน - สวดโอ้เอ้วิหารราย, สวดญัติ - สวดญัตติจตุตฺถกรรม, สวดมงคลเริน, สวดรน - สวดทำบุญบ้าน."
สวด 4,ก.,"นินทาว่าร้าย, ดุด่า, ว่ากล่าว."
สวดนา 0,น.,พิธีกรรมอย่างหนึ่งที่ทำหลังดำนาเสร็จแล้ว เพื่อให้ข้าวในนาเจริญงอกงามและได้ผลดี.
สวดพระมาลัย 0,น.,ทำนองสวดหนึ่ง ใช้สวดในงานศพ
สวดมาลัย 0,ก.,สวดพระมาลัย.
สวน 0,น.,"สวน, บริเวณที่ปลูกต้นไม้ผลเป็นจำนวนมาก."
สวน 1,น.,"ส่วน, สิ่งที่แบ่งจากสิ่งรวม, การเข้าร่วม, แผนก, ย่อย, ฝ่าย."
สวน 2,ก.,อาการเคลื่อนที่ไปตรงข้ามในเส้นทางเดียวกัน เช่น เดินสวนกัน.
สวน 3,ก.,"เอาสายสวนใส่ทางช่องปัสสาวะให้เข้าไปในกระเพาะปัสสาวะเพื่อให้ปัสสาวะออก, เอาลูกสวนใส่ทวารหนัก แล้วบีบน้ำยาหรือน้ำสบู่ให้เข้าไปในสำไส้ใหญ่ เพื่อกระตุ้นให้ลำไส้ใหญ่บีบตัวให้อุจจาระออกมา."
สวน 4,ว.,"อาการที่พูดย้อนตอบทันที, สวนคำ."
สวน 5,ว.,"เดี่ยว, หนึ่งเท่านั้นไม่มีอื่นอีก เช่น มาแตสวน - มาคนเดียว."
สวนหลาง 0,น.,คนไทย
ส้วย 0,ว.,ซวย (ดู โส้ย).
ส้วย 0,ว.,"ซวย, อับโชค, โชคร้าย, เคราะห์ร้าย, ดวงไม่ดี (จ., ภ.ก.)"
ส่วยอ้า 0,น.,มะม่วง (ดู ม่วง น. ๑.).
สวะ 0,น.,เครื่องมือชนิดหนึ่ง ถักเป็นตาข่าย สำหรับจับกุ้ง ใช้ดันไปในน้ำตื้น (ดู ระวะ น. ๑.).
สวะ 0,น.,เครื่องมือชนิดหนึ่ง ลักษณะเป็นตาข่ายสำหรับจับกุ้ง มีคันจับ ๒ ข้างใช้ดันไปในน้ำตื้น
สวา 0,น.,ละมุดฝรั่ง ผลสุกรสหวาน สีน้ำตาล กินได้ (ม. sawa nila)
สวา 1,น.,ลิง
สวาด 0,น.,ชื่อไม้เถาเนื้อแข็ง ลำต้นมีหนาม ฝักมีหนาม ละเอียดเมล็ดกลม เปลือกแข็งสีเทาอมเขียว
สวาปาม 0,ก.,ขยุ้มกินด้วยมืออย่างตะกละ.
สวาปาม 0,ก.,ขยุ้มกินด้วยมืออย่างตะกละ
สอ 0,น.,"ตอ, โคนของต้นไม้ที่ลำต้นถูกตัดหรือหักลงแล้ว, สิ่งบางอย่าง เช่น เสาหรือหลักที่ปักไว้หรือที่ยังเหลือแต่โคนเมื่อบางส่วนถูกตัด หัก หรือกร่อนไป."
สอ 1,ก.,"อุด, ยา (ก.บ.)."
สอ 2,ว.,ขาว.
สอ 3,ว.,มาก เช่น ปลามาออกันสอ - ปลามารวมกันมาก.
ส้อ 0,น.,"ประสาทส่วนที่อยู่ภายในของฟัน, เขี้ยว งา หรือเขา (ช.พ.)."
ส้อ 1,น.,อาหารสำหรับกินรองท้อง (ดู เสาะ น.).
ส้อ 2,ก.,คำสั่งให้วัวควายเดินเข้าข้างในตรง ๆ ใช้ในการไถนา (น.ธ.).
สอก 0,น.,"ข้อศอก, ส่วนของแขนตรงข้ามกับข้อพับ."
สอก 1,น.,มาตราวัดตามวิธีประเพณีไทย ๑ ศอก เท่ากับ ๒ คืบ ซึ่งนับจากช่วงแขนตั้งแต่ปลายสุดของข้อพับไปถึงปลายนิ้วกลาง.
สอก 2,ก.,"ลดลง, พร่องลง เช่น น้ำสอก - น้ำลด."
สอก 3,ว.,"ซูบซีด, ผอม เช่น ไข้สองสามวันสอกไป ราสา - ป่วยสองสามวันซูบไปเยอะ"
สอง 0,น.,จำนวนหนึ่งบวกหนึ่ง.
ส่อง 0,ก.,"ส่อง, ฉายแสง เช่น แดดส้องหน้า - แดดส่องหน้า."
สองกุก 0,ก.,การรับบทกลอนมโนราห์ที่ยํ้าวรรคหลัง ๒ ครั้ง.
สองกุก 1,ลัก.,เรียกเสียงขันของนกเขา (ดู กุก ลัก.).
สองดอง 0,น.,เรียกปูก่อนลอกคราบว่า ปูสองดอง.
สองดอง 1,น.,ดินที่น้ำไหลลอดใต้ดิน.
