ตีลี่ 0,น.,"นกเด้าลม, ชื่อนกชนิดหนึ่ง ตัวเล็กสีลายน้ำตาล ตัวเรียวเล็ก หางยาว มักชอบยกหางขึ้น ๆ ลง ๆ พร้อมกับโคลงไปมาเวลาเดิน อกขาว ก้นแดง ชอบหากินในทุ่งนาที่ไถแล้ว"
ตีลี่ 1,น.,ชื่อนกชนิดหนึ่ง (ดู เดาลม).
ตีสวน 0,ว.,ตามลำพัง (ดู แตสวน).
ตีสวน 0,ว.,"ตามลำพัง, ต่างหาก, แต่ลำพัง, คนเดียว, เดียวดาย เช่น ฉานมาแต่สวน - ฉันมาคนเดียว"
ตีเสียหวา 0,ก.,สรุปความว่า.
ตีหม้อ 0,ก.,มีเพศสัมพันธ์กับหญิงบริการ.
ตี้หมา 0,น.,ภาชนะตักน้ำทำด้วยวัสดุต่าง ๆ เช่น ทำด้วยใบจากเรียก “ หมาจาก ” ทำด้วยกาบหมาก กาบเหลา ชะโอนเรียก “ หมาต้อ ” ทำด้วยโลหะพวกสังกะสีเรียก “ หมาถั้ง ” ทำด้วยพลาสติก เรียก “ หมาพลาสติก ” หมาที่ทำด้วยใบจากกาบหมากกาบเหลาชะโอน มี ๒ ชนิด ชนิดที่หูยืด ๒ ข้างไขว้กัน เรียก “ หมาโผ้ ” ชนิดที่ทำหูสอดเข้าหากันเรียก “ หมาเหมีย ”
ตี้หมา 1,น.,ภาชนะตักน้ำทำด้วยวัสดุต่าง ๆ (ดู หมา น. ๒.).
ตีหลำ 0,น.,ถาด (ดู ถาด).
ตีหัวขาหัก 0,สำ.,เป็นคำกล่าวเพื่อหยอกล้อหรือดุด่าด้วยติดตลก เช่น อย่าดื้อเดียวกูตีหัวขาหัก – อย่าดื้อกูตีหัวขาหัก.
ตีห้า 0,น.,ต้นฉำฉา (ดู ก้ามปู น. ๓.).
ตีห้า 0,น.,"ต้นฉำฉา, ชื่อไม้ต้นขนาดใหญ่ เรือนยอดทึบแผ่สาขากว้าง ดอกเป็นพู่ สีชมพู ฝักแก่สีน้ำตาลไหม้ รสหวาน ๆ"
ตีเหล็ก 0,น.,"นกตีทอง, ชื่อนกโพระดกพันธุ์เล็กที่สุด ตัวเขียว คอเหลือง อกแดง หน้าผากแดง ขอบตาเหลือง ชอบทำรังในโพรงไม้ กินผลไม้ ชอบเกาะบนต้นไม้สูง"
ตีเหล็ก 1,ว.,ร้องเสียง “ป๊ก ๆ” เป็นจังหวะสม่ำเสมอ (ภ.ก.).
ตีฮีเต้อ 0,น.,กุลีที่ทำงานซ่อมรางรถไฟ
ตีฮีเต้อ 1,น.,กุลีที่ทำงานซ่อมรางรถไฟ (ดู ตีดือ).
ตึก 0,น.,อาคารที่ก่อสร้างด้วยอิฐปูน เป็นต้น.
ตึก 1,น.,"น้ำ (ข. ทึก, ส.ฎ.)."
ตึก 2,น.,ดินและหญ้าที่เกาะตัวกันแน่นลอยอยู่เหนือผิวน้ำ
ตึก 3,ว.,"เสียงดังเช่นนั้น เช่น ใจเต้นตึก ๆ, เสียงดังตึก ๆ, เดินดังตึก ๆ."
ตึง 0,น.,"ต้นกระทิง, ชื่อไม้ต้นชนิดหนึ่ง ใบและผลคล้ายสารภีแต่ใบเป็นสันมาก และผลกลมกว่า เปลือก เมล็ดแข็ง"
ตึง 1,น.,ต้นกากะทิง (ดู ทึง น.).
ตึ้งตึ่ง 0,ก.,จำนองของ.
ตึ้งตึ่ง 1,ว.,อึด ใช้ประกอบคำ พอง.
ตึม 0,ว.,ในทันทีทันใด เช่น น้ำหักป้องตึมเดียวช่วยไม่ทัน – น้ำทำลายทำนบพังในทันทีแก้ไขไม่ทัน.
ตึหลำ 0,น.,"ถาด, ภาชนะใส่ของทำด้วยไม้หรือโลหะ เป็นต้น รูปเตี้ย แบน มีขอบ"
ตืง 0,น.,ชื่อไม้เถาชนิดหนึ่ง
ตือ 0,น.,ปลาเนื้ออ่อนพันธุ์หนึ่ง
ตื่อค้า 0,น.,ขาหมู
ตื่อต่อ 0,น.,กระเพาะหมู
ตื่อถาว 0,น.,"จอบ, เครื่องมือสำหรับขุดดินพรวน หรือถากดิน ทำด้วย เหล็กหน้าแบนกว้าง มีด้ามยาว"
ตื่อถาว 1,น.,จอบ (ดู จอบ).
ตือแบ็ง 0,น.,ความเพียร (ป.น.)
ตือแบ็ง 1,น.,ความเพียร (ดู ตะเป็น).
ตือโร้ 0,น.,"หน้าจั่ว, เครื่องบนของเรือนที่ยึดด้านสกัดหลังคา สำหรับกันลมและแดดฝน มีรูปเป็นสามเหลี่ยม"
ตือโร้ 1,น.,หน้าจั่ว (ดู จั้ว น.).
ตื่อฮ้วน 0,น.,ไส้หมู
ตุก 0,น.,"พิสมร, เครื่องรางชนิดหนึ่ง รูปสามเหลี่ยม หรือ สี่เหลี่ยม ร้อยสายสำหรับป้องกันอันตราย"
ตุก 1,น.,หม้อดินขนาดเล็ก สำหรับเด็กเล่น.
ตุก 2,น.,กลองชาตรีขนาดเล็ก ใช้บรรเลงดนตรีหนังตะลุงเรียก “กลองตุก”
ตุก 3,น.,พิสมร (ดู ทิดหมอน).
ตุก 4,ก.,"กระตุก, ชักเข้ามาโดยเร็วทันที, อาการที่กล้ามเนื้อหดและยืดตัวขึ้นเองทันที."
ตุก 5,ก.,ต้มปลาทั้งตัวโดยไม่ได้เอาไส้ออกจนน้ำแห้ง.
ตุกแก 0,น.,"ตุ๊กแก, ชื่อสัตว์เลื้อยคลาน หัวโต หางยาว ตีนเหนียว สามารถเกาะตามผนังเรียบได้ ร้องเสียงดัง ออกหากินในเวลากลางคืน"
ตุกแก 1,น.,ตุ๊กแก (ดู ตกแก).
ตุ๊กตา 0,น.,ปลากระเบนพันธุ์หนึ่ง ขนาดเล็ก เงี่ยงมีพิษ
ตุ๊กตา 1,น.,ชื่อกล้วยไม้อิงอาศัยบนต้นไม้อื่น วงศ์ Orchidaceae ใบเดี่ยวแต่ละลำมี ๑ ใบ ดอกสีขาวนวลถึงขาวแกมเหลือง.
ตุ๊กตา 2,น.,ปลากระเบนพันธุ์หนึ่ง ขนาดเล็ก เงี่ยงมีพิษ (ดู จ้งหม้ง น. ๑.).
ตุกติก 0,สำ.,มีชั้นเชิง
ตุกติก 1,สำ.,มีชั้นเชิง (ดู กุกกิก สำ.)
ตุกแตน 0,น.,"ตั๊กแตน, ชื่อแมลง ลำตัวยาว มีขนาดต่างกัน อาจมีปีกหรือไม่มีปีกก็ได้ พวกที่มีปีกจะมี ๒ คู่ ปากเป็นชนิดกัดกิน อกมีลักษณะต่างกันมาก อาจกว้างใหญ่ แคบ ยาวหรือสั้นก็มี ขาอาจเหมือนกันหมด มีหลายชนิด เช่น ตุกแตนขวัญข้าว, ตุกแตนโทง, ตุกแตนหัวหมู, ตุกแตนกระ, ตุกแตนขี้หมา"
ตุง 0,ก.,"หกคะเมน, ตีลังกา"
ตุง 1,ก.,หกคะเมน (ดู ขวิด).
ตุง 2,ก.,"กระดก, ชูชันขึ้น เช่น ไขตุง - อวัยวะเพศชายแข็งตัวกระดกขึ้น"
ตุ้ง 0,น.,กระพุ้งแก้ม.
ตุ้ง 1,น.,ติ่งหรือเม็ดกลม ๆ ที่เกิดจากการเป็นแผลตามร่างกาย.
ตุ้ง 2,น.,ส่วนปลายใบของต้นหม้อข้าวหม้อแกงลิงที่ใช้ดักจับสัตว์.
ตุ้ง 3,น.,ตุ้มหูแบบหนึ่ง.
ตุ้ง 4,น.,"ตุ้งก่า, หม้อสำหรับสูบกัญชา."
ตุ้ง 5,ก.,กระดก (ดู ตุง ก. ๒.).
ตุ้ง 6,ว.,เสียงกลอง.
ตุ้ง 0,ก.,"กระดก, ชูชันขึ้น เช่น ไขตุง - อวัยวะเพศชายแข็งตัวกระดกขึ้น"
ตุ้งติ้ง 0,ว.,"สะบัดสะบิ้ง, เล่นตัว, ดีดดิ้น, กระตุ้งกระติ้ง ไม่สำรวม"
ตุ้งติ้ง 1,ว.,สะบัดสะบิ้ง (ดู ดุ้งดิ้ง ว. ๑.).
ตุ้งติ้ง 2,ว.,แกว่งไปแกว่งมา เช่น ห้อยตุ้งติ้ง.
ตุ้งติ้ง 3,ว.,"รุงรัง, กะรุ่งกะริ่ง."
ตุ้งถึงตังถึง 0,สำ.,ได้ยินเสียงกลองไม่ได้ เป็นต้องไปให้ถึง หมายถึง ฝักใฝ่ในการดูการละเล่น (ภ.ก.).
ตุ้งพลก 0,สำ.,มีมหรสพแสดงที่ไหนไปที่นั่น.
ตุ้งแล้วกลอง 0,สำ.,เออออตามกัน.
ตุด 0,น.,"ตะกรุด, เครื่องรางอย่างหนึ่ง ทำด้วยโลหะหรือใบลาน เป็นต้น ลงคาถาอาคมแล้วม้วนเป็นรูปกลมยาวและกลวง"
ตุด 1,น.,กระบอกไม้ไผ่ขนาดยาว ใช้เป่าลูกดอก
ตุด 2,น.,"หูด, ปม, โรคผิวหนังชนิดหนึ่งขึ้นเป็นไตแข็ง"
ตุด 3,น.,กระบอกไม้ไผ่ขนาดยาว ใช้เป่าลูกดอก (ดู ตรูด น. ๒.).
ตุด 4,น.,ตะกรุด (ดู กรุด น. ๒.).
ตุด 5,ก.,เป่าไม้ซางลูกดอกหรือสิ่งอื่นที่มีลักษณะเดียวกัน.
ตุด 6,ก.,เป่ามนตร์แช่งไม่ให้ประสบความสำเร็จ โดยเปล่งเสียงออกว่า “ตุด”
ตุด 7,ก.,ทำให้เสียชีวิต เช่น โจรคนนี้ต้องตุดเสีย - มึงโจรคนนี้ต้องฆ่าเสีย.
ตุด 8,ก.,สบประมาท เช่น กูตุดเสีย – มึงคงทำสิ่งนี้ไม่ได้.
ตุด 9,ก.,"ยุยง, ส่งเสริม."
ตุด 10,ก.,"ชงัก, จนมุม, เถียงไม่ขึ้น (ภ.ก.)."
ตุด 11,ลัก.,"ใช้กับสิ่งที่มีขนาดเล็กหรือจำนวนน้อย อาจหมายถึงลูก เช่น ไม่มีลูกสักตุด - ไม่มีลูกสักคน, ได้ปลา ๒ ตุด - ได้ปลาเล็ก ๒ ตัว."
ตุดง 0,น.,หมวกทำด้วยใบจากหรือใบเตย.
ตุ้น 0,ว.,"เตี้ย, สั้นม่อท่อ"
ตุ้น 1,ว.,เตี้ย (ดู หลุ้นตุ้น).
ตุบ 0,ก.,ฮุบเหยื่อ ใช้กับปลา เช่น ปลาตุบแบ็ด - ปลาฮุบเบ็ด.
ตุบ 1,ว.,"มาก เช่น เนียนตุบ - ละเอียดมาก, พังยับเยิน."
ตุบติบ 0,ว.,ดิบ.
ตุม 0,น.,ปลาตะเพียนทอง.
ตุม 1,น.,"ต้นตาตุ่ม, ชื่อไม้ต้นยางมีพิษ กินทำให้ท้องเดิน เข้าตาทำให้ตาบอด."
ตุม 2,น.,"ตุ่ม, ภาชนะสำหรับขังหรือใส่น้ำ ก้นสอบ ปากแคบกว่าโอ่ง."
ตุม 3,น.,ชื่อปลาน้ำจืดชนิดหนึ่ง อยู่ในจำพวกปลาตะเพียน ไม่มีหนวด กระโดงครีบหลัง แข็งและหยักเป็นฟันเลื่อย ลำตัวมีลายพาดสีดำ มีมากในทะเลสาบบริเวณทะเลน้อย จังหวัดพัทลุง.
ตุม 4,น.,"ตาไม้, รอยของต้นไม้ตรงที่เคยแตกกิ่ง."
ตุม 5,ว.,"เพิ่งงอก, ยังไม่บาน, ตูม เช่น เขาตุม - เขาสัตว์ที่เพิ่งงอก, ดอกตุม - ดอกตูม"
ตุ้มคง 0,น.,ชื่อไม้ต้นชนิดหนึ่ง (ดู ตาเสือ).
ตุ้มคง 0,น.,ชื่อไม้ต้นชนิดหนึ่ง เนื้อไม้สีแดง แข็งและหนัก ใช้ในการก่อสร้าง
ตุ้มต้ำตุ้มต้ำ 0,ว.,อาการใช้เท้าตีน้ำเสียงดัง เช่น เด็ก ๆ หัดว่ายน้ำเอาตีนตีน้ำตุ้มต้ำตุ้มต้ำ.
ตุมพระ 0,น.,ชื่อไม้ต้นขนาดกลาง เป็นไม้เนื้ออ่อนขนาดใหญ่ ผลคล้ายหมากที่ปอกเปลือกแล้ว กินได้
ตุ้มหู 0,น.,"เครื่องประดับหู, ต่างหู"
ตุ้มหู 1,น.,ต่างหู (ดู ทองหู).
ตุ่ย 0,น.,การพนันชนิดหนึ่ง ที่เกิดจากการต้องการขายสินค้าของพ่อค้า โดยให้ผู้ซื้อหรือผู้เข้าร่วมเล่นหลาย ๆ คนช่วยกันออกเงินหรือซื้อรวมผู้ซื้อ แต่ละคนจะออกเงินไม่ถึงราคาของสินค้า แต่เมื่อรวมกันทุกคนจะมากกว่า จากนั้นก็มีการจับสลาก ใครจับได้ก็ได้สินค้านั้นไป.
ตุ่ย 1,ลัก.,"คู่. (จ., ภ.ก.)."
ตุ้ย 0,น.,อวัยวะเพศหญิง
ตุ้ย 1,น.,อวัยวะเพศหญิง (ดู เคย น. ๒.).
ตุ้ยต๊าว 0,ก.,"กลับบ้าน (จ., ภ.ก.)."
ตุ้ยต๊าว 1,สำ.,ตาย เช่น อ่าแปะคนนั้นตุ้ยต๊าวไปแล้ว – อาแป๊ะคนนั้นตายไปแล้ว บางทีอาจใช้อีกสำนวนหนึ่ง คือ ไปตึ่งซั้ว เช่น อ่าแปะคนนั้นไปตึ่งซั้วแหล่ว – อาแป๊ะคนนั้นตายแล้ว.
ตุ้ยบิ่น 0,ว.,ตรงกันข้าม
ตุ้ยหมิ่น . 0,ว.,ตรงกันข้าม
ตุลิก 0,ก.,"สะกิด, เอาปลายเล็บหรือสิ่งที่คล้ายคลึงกัน เขี่ย แตะหรือขีดข่วนแต่เบา ๆ เพื่อให้รู้ตัวหรือเพื่อให้สิ่งที่ไม่ต้องการหลุดออกไป."
ตุหงิน 0,น.,เทวดา.
ตุหงิน 1,ว.,"โทน, ตัวเดียว เช่น หมูเถือน ตุหงัน -หมูป่า, โทน, ไขตุหงัน - อัณฑะเม็ดเดียว"
ตุหนา 0,น.,ชื่อปลาชนิดหนึ่ง คล้ายปลาไหล
ตุหรน 0,น.,"หมีขอ, หมีกระรอก (ป.น.)"
ตุหรน 1,ว.,นานช้า.
ตุหลาน 0,ก.,โกรธมาก (ภ.ก.).
ตุเหรียก 0,ก.,ผ่าไม้ออกเป็นชิ้นเล็ก ๆ (ดู เตรียก ก.).
ตุเหรียก 1,ก.,ผ่าไม้ออกเป็นชิ้นเล็ก ๆ
ตู 0,น.,"ประตู, ช่องทางเข้า - ออกของบ้านเรือน เป็นต้น มีบานเปิดปิดได้, ช่อง, ทาง, โดยปริยายหมายถึงสิ่งที่มีลักษณะคล้ายคลึงเช่นนั้น"
ตู้ 0,น.,เครื่องใช้สำหรับเก็บหรือใส่สิ่งของมักมีชั้นมีบานปิดเปิดได้
ตูก 0,น.,ชื่อนกชนิดหนึ่ง คล้ายนกกะปูด แต่ตัวเล็กกว่า.
ตูก 1,ก.,ตะโกนกรอกใส่หูให้ตกใจ
ตูก๋ง 0,ว.,"สั้น, ด้วน (น.ธ.)."
ตูกั๋ง 0,น.,นายช่าง (น.ธ.).
ตู่โก้ 0,น.,หมูพ่อพันธุ์ (ภ.ก.).
ตู่โก้ 1,*น.,"สแลง. คำเรียกผู้ชายที่มีภรรยาหลายคน (จ., ภ.ก.)."
ตู่โก๋ 0,น.,"ชุด, ภาชนะสานด้วยหวาย หรือเถาวัลย์เป็นตาห่าง รูปกลมยาว สำหรับใส่หมูเป็น"
ตู่โก๋ 1,น.,ชุดหมู (ดู โก๋ น. ๑.).
ตู่โก๋ 0,น.,ชุดหมู
ตู่ค้า 0,น.,ขาหมู (ดู ตื่อค้า).
ตู่ค้า . 0,น.,ขาหมู
ตูด 0,น.,เขาควายที่ใช้เป่าให้สัญญาณ
ตูด 1,น.,เขาควายที่ใช้เป่าให้สัญญาณ (ดู อูด น. ๑.).
ตูด 2,น.,รูก้น.
ตูด 3,ว.,หมดเกลี้ยง เช่น เกลี้ยงตูดเลย - หมดเกลี้ยงเลย.
ตูด 4,ว.,คำปฏิเสธอย่างไม่สุภาพ.
ตู่ต่อ 0,น.,กระเพาะหมู (ดู ตื่อต่อ).
ตู่ต่อ 1,น.,เครื่องสูบน้ำขนาดใหญ่ใช้ในการทำเหมืองฉีด มีรูปร่างคล้ายกระเพาะหมู.
ตู่ต่อ . 0,น.,กระเพาะหมู
ตู้ตี้ 0,ก.,แหย่ให้จั๊กจี้
ตู้ตี้ 1,ก.,แหย่ให้จั๊กจี๊ (ดู จู้จี้ ก.).
ตู้ตี้ 2,ก.,ซุบซิบ เช่น สองคนหนั้นตู้ตี้ไหรกัน - สองคนนั้นซุบซิบอะไรกัน
ตู่ถาว 0,น.,จอบ (ดู จอบ).
ตู่ถาว 0,น.,"จอบ, เครื่องมือสำหรับขุดดินพรวน หรือถากดิน ทำด้วย เหล็กหน้าแบนกว้าง มีด้ามยาว"
ตูน 0,น.,น้ำตก (ดู โตน น.).
ตูน 1,น.,"เหรียญ เช่น ตางค์ตูน - เงินเหรียญ, ตูนบาท - เหรียญบาท, ตูนห้า - เหรียญห้า."
ตูน 2,น.,น้ำตก เช่น โตนบริพัตร - น้ำตกบริพัตร
ตู่บู๊เล้ง 0,น.,"ไส้ไก่ยางรถจักรยาน (จ., ภ.ก.)."
ตู่โบ้ 0,น.,"แม่หมู (จ., ภ.ก.)."
ตู่โบ้ 1,น.,ชื่อขนมหวานคล้ายแกงบวด (ดู ตูโบ้เจียะเจียะ).
ตู่โบ้ 2,น.,ชื่อขนมหวานคล้ายแกงบวด (ภ.ก.)
ตู่โบ้เจียะเจียะ 0,น.,ชื่อขนมหวานคล้ายแกงบวด (ภ.ก.)
ตู้โบด 0,น.,ชื่อเรือชนิดหนึ่ง (ดู บด น. ๒.).
ตู้โบด 0,น.,ชื่อเรือต่อชนิดหนึ่งรูปเรียว หัวท้ายเรียว
ตูพรัด 0,น.,ฟ้าร้องครั้งแรกของฤดูมรสุมตะวันตกเฉียงใต้.
ตูม 0,น.,"มะตูม, ชื่อไม้ต้น ต้นและกิ่งมีหนาม ใบเป็นใบประกอบ มีใบย่อย ๓ ใบ นิยมใช้ในพิธีการมงคล ผลกลมทุย รสหวานเจือเผ็ด ใช้ทำยาได้."
ตูม 1,น.,พลุ
ตูม 2,ว.,เสียงดังเช่นนั้น
ตูโมะ 0,ก.,ทำให้แหลก (ดู ตะโบะ ก. ๑.).
ตูโมะ . 0,ก.,"ทำให้แหลก, ตำให้เปลือกหลุดออก"
ตูรุน 0,น.,ประตูเลื่อนแบบโบราณ.
ตูรุน 1,สำ.,"โบราณมาก เช่น คนสมัยตูรุน - คนสมัยเก่า, คิดเหมือนคนสมัยตูรุน - คิดเหมือนคนโบราณ."
ตู้โร้ 0,น.,"หน้าจั่ว, เครื่องบนของเรือนที่ยึดด้านสกัดหลังคา สำหรับกันลมและแดดฝน มีรูปเป็นสามเหลี่ยม"
ตู้โร้ 1,น.,หน้าจั่ว (ดู จั้ว น.).
ตูลม 0,น.,"ประตูลม, เรียกอวัยวะส่วนที่อยู่ระหว่างนิ้วมือนิ้วเท้า."
ตู้ลอย 0,น.,ตู้ใส่เสื้อผ้าที่ทำเป็นโครงเหล็กใช้แขวนผ้าไว้ด้านในและด้านนอกจะหุ้มด้วยผ้าแทนไม้ มีซิปรูดปิดเปิดได้.
ตูเล 0,ก.,รับไม่อั้น เช่น เบอหมายเลขนี้เปิดตูเลเลย – หวยหมายเลขนี้รับแทงไม่อั้น.
ตูเล 1,ลัก.,"ลักษณนามเรียกจำนวนลำดับของหวยใต้ดินที่ ผู้ซื้อซื้อไว้, จำนวนครั้งของการต่อรองในการเล่นการพนัน, จำนวนครั้งที่เตะลูกบอลเข้าประตู."
ตูหนัง 0,ก.,"หมั้น (เทียบ ตุนาหงัน, ม. tunang ; ภ.ก.)"
ตูหนา 0,น.,ชื่อปลาชนิดหนึ่ง คล้ายปลาไหล
