ระพา 0,น.,กิ่งไม้ที่สุมไว้ในน้ำ เพื่อให้ปลามาอาศัยหรือซ่อนตัว เพื่อให้ดักจับง่ายขึ้น (ดู ราพา น. ๒.).
ระพา 0,น.,กิ่งไม้ที่สุมไวัในน้ำเพื่อให้ปลามาอาศัยหรือซ่อนตัวเพื่อให้ดักจับง่ายขึ้น
ระมน 0,ก.,นิมนต์ (น.ธ.).
ระมัง 0,ว.,"กะประมาณ, คาดคะเน (น.ธ.)."
ระมัด 0,น.,ปลาดุกลำพัน (น.ธ.).
ระมัน 0,น.,น้ำมัน.
ระมัน 1,ก.,อาการที่เหวี่ยงของลงมาจากบ่า
ระไมรอด 0,น.,ชื่อไม้พุ่ม หรือไม้ยีนต้นขนาดเล็ก วงศ์ Stilaginaceae ใบเดี่ยวเรียงสลับ ดอกเล็กมาก ไม่มีกลีบดอก สีเขียวอ่อน ผลแก่สีแดงคลํ้าถึงดำ รูปไข่เบี้ยว.
ระยำ 0,ว.,"ยับเยิน, ย่อยยับ, เสียหาย"
ระยำ 1,ว.,"เลว, เสียหายยับเยิน."
ระยำหมา 0,ว.,เลวมาก.
ระเย็น 0,ว.,ขยัน (ดู ราเย็น ว. ๑.).
ระเย็น 0,ว.,ขยัน เช่น แด็กคนนี้ราเย็นจริง (เทียบ ม. rajin)
ระวะ 0,น.,เครื่องมือชนิดหนึ่ง ลักษณะเป็นตาข่ายสำหรับจับกุ้ง มีคันจับ ๒ ข้างใช้ดันไปในน้ำตื้น
ระวะ 1,น.,"ช่องน้ำ, ช่องระบายน้ำลงสู่ทะเล"
ระวะ 2,น.,ชื่อพืชจำพวกกล้วยชนิดหนึ่ง ในจำพวกกล้วยน้ำ (ป.น.).
ระวิง 0,น.,เครื่องมือดักปลาในโป๊ะหรือเล้า รูปคล้ายสวิง (น.ธ.)
ระวิง 1,น.,"เครื่องปั่นด้าย, เครื่องสำหรับเอาเข็ดด้าย หรือไหมสวม เพื่อกระจายเส้นด้ายออกจากกัน เมื่อเวลาสาวเส้นด้ายจะได้ ออกเป็นเส้น ๆ ไม่ขาด ไม่ยุ่ง (น.ธ.)"
ระสาย 0,น.,"สาหร่าย มีหลายชนิด เช่น สายใบ - สาหร่ายใบ, สายหางรอก - สาหร่ายหางกระรอก, สายหางม้า - สาหร่ายหางม้า"
ระสาย 1,น.,สาหร่ายขนาดใหญ่ (ดู สาย น. ๑.).
ระหะ 0,ก.,กินอย่างตะกละ เป็นคำพูดประชด
ระหะ 1,ก.,กินอย่างตะกละ เป็นคำพูดประชด (ดู ทะหะ).
ระหัน 0,น.,ชื่อไม้ต้นชนิดหนึ่ง ขึ้นตามฝั่งน้ำลำคลอง ใบเป็นมันคล้ายจำปี แต่เรียวและนิ่มกว่า ดอกสีเหลือง ผลกลมเป็นพวงคล้ายมะไฟ เมล็ดเอามาทำเป็นยา แก้โรคคันและหิดได้
ระหัน 1,น.,ชื่อไม้ต้นชนิดหนึ่ง (ดู หัน น.).
ระเห็ดระเหิน 0,ว.,"อยู่ไม่เป็นที่, เร่ร่อน (น.ธ.)."
ระแหมด 0,ว.,"มาก, ยิ่ง เช่น คนเดินหัวระแหมด - คนเดินหัวสลอน (ย.ล., ป.น.)"
ระแหม๊ะ 0,น.,ขวานถากไม้ (ส.ต.).
ระโหะ 0,ก.,"พัง, ทลาย (น.ธ.)."
ระอักระเอ 0,ว.,มากมายก่ายกอง
ระอักระเอ 1,ว.,มากมายก่ายกอง (ดู กองลุย).
ระอิด 0,ว.,"ตระหนี่, ถี่ถ้วน"
ระอิด 1,ว.,"ตระหนี่, ถี่ถ้วน (ดู ละเอียด)."
ระอิด 0,ว.,ตระหนี่
ระเอิด 0,ว.,"ตระหนี่, ถี่ถ้วน (ดู ละเอียด)."
ระเอิด 0,ว.,"ตระหนี่, ถี่ถ้วน"
รัก 0,น.,ชื่อไม้ยืนต้น วงศ์ Anacardiaceae ใบเดี่ยว เรียงเวียนสลับเป็นกลุ่มตามปลายกิ่ง ดอกเล็ก สีชมพูอ่อน ผลค่อนข้างกลมหรือรูปไข่ ยางเป็นพิษ ใช้รองพื้น หรือทาสีต่าง ๆ.
รัก 1,น.,ชื่อไม้พุ่ม ดอกใช้ร้อยกรอง ยางเป็นพิษ.
รัก 2,ก.,"มีใจผูกพันด้วยความห่วงใย, มีใจผูกพันด้วยความเสน่หา, มีใจผูกพันฉันชู้สาว."
รักขบ 0,ก.,"ถูกยางรักแล้วคันเป็นผื่น, ยางรักกัดผิวเนื้อ."
รักขบ 1,สำ.,การลงโทษเพราะความรัก ลูกที่พ่อแม่รักมาก เมื่อถูกพ่อแม่เฆี่ยนตีจะว่า “ รักขบ ”.
รักเข้าทีศอก เกลียดออกทีวา 0,สำ.,ความรักเป็นสิ่งที่เกิดได้ยาก และต้องใช้เวลานาน แต่ความเกลียดเป็นสิ่งที่เกิดขึ้นได้ง่ายในเวลาอันรวดเร็ว.
รักตี้ 0,น.,"รักแร้, ส่วนของร่างกายที่อยู่ใต้โคนแขนเหนือสีข้างขึ้นไป (ช.พ.)"
รักแร้แดง 0,น.,บริเวณใต้ขาหน้าต่อกับหน้าอกของวัวควาย
รักษา 0,ก.,"เลี้ยงดู, เลี้ยง เช่น รักษาหมู - เลี้ยงหมู."
รักษา 1,ก.,บำบัดรักษา.
รักอาธรรม์ 0,ก.,"ลำเอียง, ไม่ยุติธรรม เช่น แม่รักอาธรรม์รักน้องคนเดียว - แม่ลำเอียงรักแต่น้องคนเดียว."
รัง 0,น.,ชื่อไม้ต้นขนาดใหญ่ เนื้อไม้แข็ง ใช้ในการก่อสร้าง.
รั้ง 0,ก.,"ดึง, หน่วงเหนี่ยงไว้, เหนี่ยว, ชักมา."
รั้ง 1,ว.,"ที่ถูกทอดทิ้ง, ร้าง เช่น นารั้ง - นาร้าง."
รังกับ 0,น.,ชื่อปาล์มชนิดหนึ่งขึ้นตามป่า
รังเกียด 0,น.,ชื่อพืชชนิดหนึ่ง
รังไก่ 0,น.,ชื่อเฟินชนิดหนึ่ง ขึ้นตามป่าร้างทั่วไป.
รังขาว 0,น.,"ไม้กะลอ, ชื่อไม้ต้นขนาดย่อม มักขึ้นในป่าใส ในที่ชุ่มชื้น."
รังขาว 1,ก.,ใช้กิ่งไม้ปิดกั้นทางน้ำไหล เพื่อให้น้ำไหลช้าลงหรือเพื่อให้สัตว์น้ำว่ายไปในทิศทางที่ต้องการ (ภ.ก.).
รังไข่ 0,น.,ถุงอัณฑะ.
รังค่าย 0,น.,ชื่อปาล์มชนิดหนึ่ง คล้ายเตย ลำต้นตรง
รังตัง 0,น.,"ต้นตำแย, ชื่อไม้ล้มลุก มีขนตามลำต้นและใบ ถูกเข้าคันและเป็นผื่นตามผิวหนัง"
รังตังกวาง 0,น.,ต้นตำแยชนิดหนึ่ง อยู่ในป่าขนาดใหญ่กว่าต้นตำแยธรรมดา
รังตังไก 0,น.,ตำแยชนิดหนึ่ง
รังตังช้าง 0,น.,ชื่อไม้ขนาดกลาง ขอบใบเป็นจัก มีขนเป็นพิษชาวป่ามักปลูกไว้เป็นรั้วบ้าน เพื่อกันขโมย
รังท้อง 0,น.,หูน้ำหนวก (ดู ช้างท้อง).
รังท้อง 0,น.,"หูน้ำหนวก, หูที่มีน้ำอยู่ในช่องหูซึ่งมีอาการอักเสบ มีกลิ่นเหม็น อาจมีลักษณะใส เป็นมูกข้นหรือเป็นหนอง"
รังทัง 0,น.,"ต้นตำแย, ชื่อไม้ล้มลุก มีขนตามลำต้นและใบ ถูกเข้าคันและเป็นผื่นตามผิวหนัง"
รังทัง 1,ก.,อาการของไก่ที่กำลังจะหาที่ไข่ไปที่นั่นบ้าง ที่นี่บ้าง เช่น แม่ไก่รังทัง - แม่ไก่ไข่ไม่เป็นที่.
รังทัง 2,สำ.,ร่าน.
รังทังกวาง 0,น.,ต้นตำแยชนิดหนึ่ง อยู่ในป่าขนาดใหญ่กว่าต้นตำแยธรรมดา
รังทังไก 0,น.,ตำแยชนิดหนึ่ง
รังทังช้าง 0,น.,ชื่อไม้ขนาดกลาง ขอบใบเป็นจัก มีขนเป็นพิษชาวป่ามักปลูกไว้เป็นรั้วบ้าน เพื่อกันขโมย
รั้งท้าย 0,น.,ที่นั่งท้ายรถจักรยาน (ดู ร้านท้าย).
รั้งท้าย 1,ว.,"สุดท้าย, หลังสุด."
รั้งท้าย 2,น.,ที่นั่งท้ายรถจักรยาน
รั้งบาง 0,น.,ชื่อเพลงกาหลอ.
รังเบน 0,น.,ช่องขา (ก.บ.).
รังรุ้ง 0,น.,ชื่อพืชชนิดหนึ่ง (ดู รังเกียด).
รังรุ้ง 0,น.,ชื่อพืชชนิดหนึ่ง
รังหยาว 0,ก.,"รำคาญ, หงุดหงิด, โกรธ, โมโห, หาเรื่อง, อาละวาด เช่น คนนั้นขี้รังหยาว – คนนั้นขี้โกรธ."
รัด 0,ก.,"โอบรอบหรือพันให้กระชับ, คับ, ตึง."
รัดคอ 0,น.,อเส.
รัดดวง 0,น.,"ริดสีดวง, ชื่อโรคจำพวกหนึ่งมีหลายชนิด เกิดในช่องตา จมูก ทวารหนัก เป็นต้น"
รัดดวง 1,ก.,"ถูกชะตา, ถูกใจ เช่น มวยคู่นี้ชกได้แรงอกถูกรัดดวงจ้าน."
รัดดวง 2,สำ.,ใช้เป็นคำด่าว่า “ อ้ายรัดดวง ”.
รัดดวง 3,สำ.,"รสนิยม, สบอารมณ์ เช่น ไอ้หมอนั่นไม่ถูกรัดดวงกับกูเลย - คนนั้นไม่สบอารมณ์กับผมเลย,"
รัดพัด 0,ก.,ที่คาดพุง
รัน 0,ก.,ดันออกไป เช่น เอาไม้สั้นมารันขี้ ขี้จะกระเด็นมาเปื้อนตัวเอง.
รับ 0,ก.,"รับ, ยื่นมือออกถือเอาสิ่งของที่ผู้อื่นส่งให้, ถือเอาสิ่งของที่ผู้อื่นส่งมาให้, ต้อนรับ."
รับ 1,ก.,"ยอมตาม, ยอมรับ, ยอมรับสภาพ, ตกลงตาม."
รับตายาย 0,น.,พิธีเซ่นสรวงบรรพบุรุษในวันสารทภาคใต้
รับบท 0,ก.,การร้องรับกลอนของลูกคู่มโนราห์ หรือเพลงบอกหรือการละเล่นอื่น ๆ.
รับเปรต 0,น.,พิธีเซ่นสรวงบรรพบุรุษในวันสารทภาคใต้
รับสุภาพ 0,ก.,รับสารภาพ
รับเออรับนอ 0,สำ.,เออออห่อหมก.
รั้ว 0,น.,"รั้ว, เครื่องล้อมกั้นเป็นเขตบ้าน เป็นต้น มักทำด้วยเรียวไผ่ ต้นไม้ขนาดเล็ก หรือสังกะสี."
รั้วไก่ 0,น.,"เขาวงกต, รั้วที่ปักเป็นทางวกวนไปมารอบภูเขา หรือเจดีย์ในงานวัด"
รั้วไก่หลง 0,น.,"เขาวงกต, รั้วที่ปักเป็นทางวกวนไปมารอบภูเขา หรือเจดีย์ในงานวัด"
รัวรัว 0,ว.,ระริกระรี้ (ภ.ก.).
รัวรัวเหมือนไม้คั่วเม่า 0,สำ.,ระริกระรี้.
รั้วหลง 0,น.,"เขาวงกต, รั้วที่ปักเป็นทางวกวนไปมารอบภูเขา หรือเจดีย์ในงานวัด"
รา 0,น.,"ยี่หร่า, ชื่อไม้ล้มลุกชนิดหนึ่ง ใช้เป็นเครื่องเทศ (ภ.ก.) มีหลายชนิด ได้แก่ ราขาว, ราดำ, ราแดง."
รา 1,น.,"รา, ชื่อเรียกพืชชั้นตาที่ไม่มีคลอโรฟิลล์และสำต้น ใบ ราก ที่แท้จริง ส่วนมากเจริญเป็นเส้นใย สืบพันธุ์โดยใช้สปอร์ อาศัยอยู่บนซากพืช หรือสัตว์ ขึ้นเบียน หรืออยู่ร่วมกับพืชอื่นก็มี."
รา 2,น.,"เครื่องรา, เครื่องเทศชนิดหนึ่งที่ใช้ผสมเครื่องแกง ประเภทเนื้อสัตว์ ให้มีกลิ่นหอม น่ารับประทาน มีขายตามร้านขายยาแผนโบราณ."
รา 3,ก.,ผูกรั้ว (ภ.ก.).
รา 4,ก.,"ค่อย ๆ เลิกไป, น้อยลง, อ่อนลง."
รา 5,ก.,ปักเบ็ดเป็นแนวไป (ภ.ก.).
ร้า 0,น.,"ชื่ออาหารชนิดหนึ่งทำด้วยปลาหมักเกลือ เรียก "" ปลาร้า ""."
ราก 0,น.,เทือกเถาเหล่ากอ.
ราก 1,น.,"ราก, ส่วนของต้นไม้ ตามปกติอยู่ในดิน มีหน้าที่ดูดอาหารเลี้ยงลำต้น, โดยปริยายเรียกสิ่งที่มีลักษณะคล้ายคลึงเช่นนั้น."
รากโจด 0,น.,"รากแก้ว, รากเดิม, รากที่เป็นหลักหยั่งลึกลงไปในดินของต้นไม้บางชนิด"
รากโจด 1,น.,ต้นตระกูล.
รากตับ 0,ว.,ขี้เกียจ
รากตับ 1,ว.,ขี้เกียจ (ดู ขี้คร้าน).
รากแตก 0,ก.,"อาเจียน, อ้วก, สำรอกออกทางปาก"
รากไทร 0,น.,ชื่อข้าวพันธุ์พื้นเมือง (ก.บ.).
รากบัว 0,น.,ไหลของบัว
รากพาน 0,น.,"รากฝอย, รากที่เป็นเส้นเล็ก ๆ แตกออกจากรากแก้ว."
รากไม้ไผ่ 0,น.,วุ้นเส้น.
รากไม้ไผ่ 1,ก.,"อาเจียน, อ้วก, สำรอกออกทางปาก"
รากไม้ไผ่ 0,น.,วุ้นเส้น
รากแห้ง 0,น.,ชื่อข้าวพันธุ์พื้นเมือง (ก.บ.).
รากโหมด 0,น.,ชื่อข้าวพันธุ์พื้นเมือง (ก.บ.).
รากัน 0,น.,"เพื่อน, เกลอ (ส.ต.)"
ราแกงไก่ 0,น.,ชื่อพืชชนิดหนึ่ง ใบมีกลิ่นหอม ใช้ปรุงรสแกงเผ็ด (ช.พ.).
ราเคย 0,น.,"ต้นสาบเสือ, ชื่อไม้ล้มลุก เป็นวัชพืชชิ้นทั่วไป ใบมีกลิ่นเหม็น ใช้ทำยาได้"
ราเคย 1,น.,ต้นสาบเสือ (ดู ขี้ไก น. ๓.).
ราเคย 2,ก.,สานเสื่อ.
ราง 0,น.,"ร่อง, ร่องที่ขุดเป็นทางสำหรับให้น้ำไหล เช่น รางน้ำ."
ร่าง 0,น.,"รูปทรง, โครง, ตัว เช่น ร่างดี - รูปร่างสมส่วน."
ร่าง 1,ก.,ทำเป็นรูปโครงขึ้น เพื่อลอก คัด ตัดหรือแต่งในภายหลัง.
รางกบ 0,น.,ไม้ตัวกบ
รางครึ่ง 0,น.,ลังถึง
รางครึ่ง 1,น.,ลังถึง.
ร่างคันหาม 0,ก.,ทำคานหาม.
รางจืด 0,น.,ชื่อไม้เถา ต้นขนาดโหระพา ดอกสีม่วงอ่อน ออกเป็นช่อห้อย ใช้ทำยาแก้เมา แก้พิษ.
รางซึ่ง 0,น.,ลังถึง
รางซึ่ง 1,น.,ลังถึง.
รางถึง 0,น.,ลังถึง
รางถึง 1,น.,ลังถึง.
รางทัด 0,น.,"รางบรรทัด, เครื่องมือสำหรับตีเส้นเป็นบรรทัด"
รางนาด 0,น.,"ระนาด, เครื่องปีพาทย์ชนิดตี ประกอบด้วยลูกระนาด ทำด้วยไม้ร้อยเชือกหัวท้ายเข้าเป็นผืน ใช้แขวนบนรางระนาด หรือทำด้วยเหล็ก หรือทองเหลือง ใช้วางเรียงบนรางระนาด มีไม้ประกับหัวท้าย ลูกระนาดเรียงขนาดสั้นยาวตามลำดับเสียง มีตั้งแต่ ๑๗ - ๒๑ ลูก"
รางนาด 1,น.,ระนาด
รางนึ่ง 0,น.,ลังถึง.
รางพัด 0,ก.,ที่คาดพุง
รางพัด 1,ก.,คาดผ้าที่พุง (ดู รัดพัด).
รางไม้ขีด 0,น.,กลักไม้ขีด
รางยาง 0,น.,กระบะใส่น้ำยางเพื่อใช้ทำยางแผ่น (ดู เบ้ายาง).
รางยาง 0,น.,กระบะโลหะสี่เหลี่ยมผืนผ้า ก้นแบนใช้ใส่น้ำยางพารากับน้ำกรด เพื่อให้น้ำยางแข็งตัว
รางราง 0,ว.,ยํ่ารุ่ง.
รางราง 1,ว.,"ไม่กระจ่าง, ไม่ชัดเจน เช่น เห็นรางราง, ภาพรางราง."
ร่างร้าน 0,น.,คานหามศพ.
ร่างร้าน 1,น.,"นั่งร้าน, โครงร่างที่ทำด้วยไม้หรือโลหะสำหรับนั่ง หรือปีนป่ายในการก่อสร้างสิ่งสูง ๆ."
รางหมู 0,น.,ราง หรือไม้ที่ขุดหรือต่อให้เป็นร่องยาว ๆ หรือปล้องไม้ไผ่ผ่าซีก มีด้านสลักหัวท้าย สำหรับใส่อาหารหมู.
รางหมู 1,น.,ว่าวชนิดหนึ่ง.
รางหมู 2,น.,อุปกรณ์การเล่นหมากขุม ทำเป็นรูปคล้ายเรือ.
รางหมู 3,น.,"กระบะ, ภาชนะที่ทำเป็นรางยาวคล้ายกระบะ."
ราจุน 0,น.,"ยาเบื่อ, ยาพิษ (ม. racun)"
ราจุน 1,ก.,วางยาเบื่อ เช่น หมาฉันโถกราจุนเสียแหล่ว - หมาฉันถูกวางยาเบื่อตายเสียแล้ว
ราจุ๋น 0,น.,"ยาเบื่อ, ยาพิษ (ดู ราจุน น.)."
ราจุ๋น 0,น.,"ยาเบื่อ, ยาพิษ (ม. racun)"
ราชครูดำ 0,น.,ชื่อไม้พุ่มชนิดหนึ่ง
ราด 0,น.,"เงินค่ายกครู, ค่าแสดงมหรสพ, ค่าตอบแทนผู้ทำคลอด (เทียบ ม. pengeras)"
ราด 1,น.,"คราด, เครื่องมือทำไร่นาใช้วัวหรือควายลาก ลักษณะเป็นคาน มีซี่ห่าง ๆ กัน มีคันซักสำหรับ ลากขี้หญ้าและทำให้ดินที่ไถแล้วร่วนซุย, เครื่องมือสำหรับชักหรือลากขี้หญ้าหรือหยากเยื่อทำเป็นซี่ ๆ มีด้ามสำหรับจับชักหรือลากไป"
ราด 2,ก.,"ราด, เทของเหลว ๆ เช่นน้ำให้กระจายแผ่ไปหรือ ให้เรี่ยรายไปทั่ว เช่น ราดน้ำ - เทน้ำ."
ร้าด 0,ก.,"ลื่น, ไถลลื่น, ถาก ๆ เช่น พออ๊วนหัวเหลี่ยวหมันขุบร้าด - (ขี่จักรยาน) พอหักหัวเลี้ยวกลับหรือกลับรถมันก็ไถลลื่น, ฮือไม่พอร้าด ๆ - ฮือไม่หรอกพอถาก ๆ (ภ.ก.)."
ราดโรง 0,น.,"เงินค่ายกครู, ค่าแสดงมหรสพ, ค่าตอบแทนผู้ทำคลอด (เทียบ ม. pengeras)"
ราดำ 0,น.,ยี่หร่าพันธุ์หนึ่ง
ราโดด 0,น.,ชื่อสาหร่ายชนิดหนึ่ง กินได้.
ราตับ 0,ว.,ขี้เกียจ
ราตับ 1,ว.,"เกียจคร้าน, ไม่อยากทำงาน"
ราตับ 2,ว.,ขี้เกียจ (ดู ขี้คร้าน).
ราน 0,ก.,"ร้าว, ปริ เช่น แก้วนี้ปรัดแต้ว - แก้วใบนี้ร้าวแล้ว"
