ราน 1,ก.,ระราน ประพฤติเป็นพาลเกเร ทำให้เดือดร้อน เช่น หมึงเที่ยวรานเพื่อนโหยะ - มึงเที่ยวระรานเพื่อนเสมอ
ราน 2,ก.,การตัดกิ่งกระโดงหรือกิ่งที่แตกออกตรงขึ้นไปจากกิ่งใหญ่ของต้นไม้ไม่ให้สูงขึ้นไปอีก โดยนัยหมายถึงการที่หัวหน้าทำให้บุคคลในสังกัดไม่สามารถก้าวหน้าในตำแหน่งหน้าที่ (ภ.ก.).
ราน 3,ก.,ตัดหรือฟันกิ่งไม้ออก.
ราน 4,ก.,"ร้าว, ปริ (ดู ปรัด)."
ร่าน 0,น.,หนอนผีเสื้อ มีขนปกคลุมเต็มลำตัว เมื่อถูกเข้าจะปล่อยน้ำพิษ ทำให้เกิดอาการแสบร้อนและคัน
ร่าน 1,น.,ชื่อหนอนชนิดหนึ่ง มีขนปกคลุมเต็มตัว เมื่อถูกเข้าจะปล่อยน้ำพิษทำให้เกิดอาการแสบร้อนและคัน เมื่อเจริญวัยจะเข้าดักแด้และฟักออกมาเป็นผีเสื้อกลางคืน.
ร่าน 2,ก.,"ดิ้นจะออกจากที่ขัง เช่น ปลาตัวนี้ร่านจัง - ปลาตัวนี้ดิ้นจะออกจากที่ขังไป, วัวร่านคอก - วัวดิ้นจะออกจากคอก."
ร่าน 3,ก.,"อยาก, ต้องการอย่างมาก มักเป็นคำด่าผู้หญิงที่มีความต้องการเพศชายอย่างเห็นชัด."
ร้าน 0,น.,"ร้านหรือหลักสำหรับให้ไม้เถาขึ้นเกาะ เช่น ค้างถั่ว, ค้างพลู"
ร้าน 1,น.,"เตียง, แคร่, ที่สำหรับนอนหรือตั้งสิ่งของ มี ๔ ขา รูปสี่เหลี่ยมผืนผ้า."
ร้าน 2,น.,ร้านค้า.
ร้าน 3,น.,เรียกสิ่งที่ปักเสามีไม้พาดข้างบนให้ต้นไม้เลื้อยว่า “ ร้าน ” (ดู ค้าง น.).
รานก้าน 0,ก.,ระราน ประพฤติเป็นพาลเกเร ทำให้เดือดร้อน เช่น หมึงเที่ยวรานเพื่อนโหยะ - มึงเที่ยวระรานเพื่อนเสมอ
รานก้าน 1,ก.,ระราน (ดู ราน ก. ๑.).
ร้านงัน 0,น.,"ร้านที่ทำขึ้นเพื่อเอาน้ำผึ้งมาเทใส่, เครื่องรองรับ (ก.บ., พ.ง.)."
ร้านจั่บโห่ย 0,น.,ร้านขายของชำ
รานโดง 0,ก.,ระราน ประพฤติเป็นพาลเกเร ทำให้เดือดร้อน เช่น หมึงเที่ยวรานเพื่อนโหยะ - มึงเที่ยวระรานเพื่อนเสมอ
ร้านท้าย 0,น.,ที่นั่งท้ายรถจักรยาน
ร้านวิ่ง 0,น.,ที่ดักปลาคล้ายเล่ แต่ไม่รับน้ำ ใช้สำหรับให้ปลากระโดดลงที่ดักจับ
ร้านวิ่ง 1,น.,เฝือกที่ทำขึ้นเป็นร้านสำหรับดักปลา.
ราบ 0,น.,ชนิดของคำประพันธ์ คือ กาพย์สุรางคนางค์ บางทีเรียก ราบ ๒๘
ราบ 1,น.,"ต้นสะแกแสง, ชื่อไม้ต้นชนิดหนึ่ง ใช้ทำยาได้."
ราบ 2,ว.,"คุ้น, ไม่ดุ เช่น วัวราบ - วัวคุ้น."
ราบ 3,ว.,เรียบเสมอพื้นไม่มีลุ่ม ๆ ดอน ๆ.
ราพา 0,น.,"กิ่งไม้ที่ลอยน้ำมา, สวะ."
ราพา 1,น.,กิ่งไม้ที่สุมไวัในน้ำเพื่อให้ปลามาอาศัยหรือซ่อนตัวเพื่อให้ดักจับง่ายขึ้น
ราพา 2,น.,ไม้ที่มีกิ่งก้านสาขามากปกคลุมเป็นบริเวณกว้าง (พ.ง.).
ราพา 3,ว.,แผ่กางยาว เช่น เขาควายราพา - เขาควายแผ่กางยาว.
ราพาย 0,ว.,ถดถอย เช่น คนนั้นทำงานราพาย - คนนั้นตอนแรกทำงานดีแต่ตอนหลังรามือลง.
ราโพ 0,น.,ชื่อไม้จำพวกอ้อ ลำต้นขนาดหัวแม่มือ เป็นปล้อง
ราม 0,ก.,ชื่อไม้พุ่มขนาดเล็ก มีลูกสีดำคล้ายลูกหว้า ลูกและยอดกินได้ เด็กนิยมใช้เป็นกระสุนยิงเล่น.
ราม 1,ว.,ขนาดซึ่งยังไม่โตเต็มที่ เช่น กุ้งราม - กุ้งที่ยังไม่โตเต็มที่.
ร่าม 0,ก.,ร้องไห้ (ดู ร่ำ).
ร่าม 0,ก.,"ร้องไห้, คร่ำครวญ เช่น อย่าร่ำแหล้น้องเหอ - อย่าร้องไห้ซิน้อง"
รามร่าม 0,ว.,"รุ่มร่าม, ไม่รัดกุม เช่น นุ่งผ้ารามร่าม."
รามร่าม 1,ว.,สอดแทรกในกิจการของคนอื่น เช่น อย่าไปรามร่ามเรื่องของคนอื่น.
ร่ามร่าม 0,ว.,ห่าม ๆ.
ร่ามร่าม 1,ว.,ทำอย่างขอไปที สักแต่ว่าให้เสร็จ.
รามา 0,น.,ชื่อไม้ต้นชนิดหนึ่ง ลูกคล้ายมะไฟ (ดู ละไม).
ราย 0,น.,รายการ เช่น ไปแลรายตะ - ไปดูรายการซิ.
ราย 1,น.,"บัญชี, สมุดหรือกระดาษสำหรับจดรายการต่าง ๆ ไว้เป็นหลักฐาน เช่น มึงลงรายแล้วยัง - มึงลงบัญชีแล้วหรือยัง."
ร่าย 0,น.,ชื่อคำประพันธ์ประเภทร้อยกรองแบบหนึ่ง.
ร่าย 1,ก.,"ไต่, เลียบไป เช่น ร่ายไม้ - ไต่กิ่งไม้, ร่ายเสา - เลียบเสาไฟ."
ร่าย 2,ก.,"ไปดู, ไปเลื่อน."
ร่าย 3,ก.,บริกรรมเวทมนตร์คาถาเพื่อทำให้ศักดิ์สิทธิ์.
ร่าย 4,ก.,ดิ้นจะออกจากที่ขัง.
ร่าย 5,ก.,"ไร้, ขัดสน, ไม่มี ปราศจาก."
ร้าย 0,ว.,ดุร้าย เช่น หมาร้าย - สุนัขดุ.
ร้าย 1,ว.,ซุกซน เช่น เด็กหนี้ร้ายจริง - เด็กคนนี้ซุกซนจริง.
ร้าย 2,ว.,"เก่า, ไม่ดี เช่น มึงหยิบผ้าร้ายที - มึงหยิบผ้าขี้ริ้วให้ที, ผ้านุ่งผืนนี้ร้ายแล้ว - ผ้าถุงผืนนี้เก่าแล้ว."
ร้ายกวาง 0,น.,ชื่อไม้ล้มลุกชนิดหนึ่ง.
ร้ายก๊าย 0,ว.,"อัปลักษณ์, ไม่สวย, ไม่มีความน่าพิสมัยเลย (ภ.ก.)."
ร่ายควาย 0,ก.,ย้ายที่ล่ามควายจากที่หนึ่งไปยังอีกที่หนึ่ง (ช.พ.).
ร่ายคอก 0,ก.,เรียกกิริยาของสัตว์ที่พยายามทำลายคอกขังเพื่อออกจากคอก.
ร่ายเชียก 0,ก.,กิริยาที่วัวกระชากหรือดึงเชือกให้ขาดอยู่เสมอ.
ร่ายเซ็น 0,สำ.,"ไม่มีแรง, อ่อนเพลียมาก."
รายตีน 0,ก.,"ปัสสาวะ, อุจจาระ (ช.พ.) เช่น ไปรายตีน -ไปปัสสาวะไปอุจจาระ"
ร่ายแตระ 0,น.,ทำนองการร้องบทอย่างหนึ่งของมโนราห์ ก่อนที่จะเริ่มรำทำบทหรือรำตีบท.
รายท่า 0,ก.,"ปัสสาวะ, อุจจาระ (ช.พ.) เช่น ไปรายตีน -ไปปัสสาวะไปอุจจาระ"
รายท่า 1,ก.,"ปัสสาวะ, อุจจาระ (ดู รายตีน)."
ร่ายนอ 0,สำ.,"ไม่มีแรง, อ่อนเพลียมาก."
รายนา 0,น.,อากรค่านา.
ร่ายเบ็ด 0,ก.,ตรวจเบ็ดว่าติดปลาหรือไม่.
ร้ายฝา 0,สำ.,ไม่มีที่อยู่.
ร่ายมนต์ 0,ก.,"ท่องมนตร์, ท่องคาถา."
รายมันดิน 0,น.,ภาษีบำรุงท้องที่ (ดู มันดิน น. ๑.).
รายมันดิน 1,ก.,"จัด, เรียง เช่น ช่วยรายหมากทีตะ - ช่วยจัดหมากเพื่อตากทีเถอะ (น.ศ.)."
รายมันดิน 0,น.,"ภาษีบำรุงท้องที่ เช่น ไปเสียมันดิน -ไปเสียภาษี, ใบมันดิน - ใบเสร็จบำรุงท้องที่ (น.ธ., ป.น., ย.ล.)"
รายมาย 0,ว.,"มากเรื่องมากความ, พร่ำไม่รู้จบ."
รายมาย 1,ว.,"การใช้วาจาก้าวร้าว, พูดจาไม่รู้จักจบสิ้น, พูดกระทบกระเทียบคนอื่น."
ร่ายไม้ 0,ก.,เด็กหัดเดิน.
ร่ายวัว 0,ก.,ย้ายที่ล่ามวัวจากที่หนึ่งไปยังอีกที่หนึ่ง.
รายสาย 0,ว.,"รุงรัง, ระลงมาเป็นสาย ใช้กับผม เช่น ผีสาวผมยาวรายสาย."
ร้ายหร็องแหร็ง 0,ว.,"เก่ามากจนใช้การไม่ได้, ขาดจนไม่มีชิ้นดี"
ร้ายหล็องแหล็ง 0,ว.,"เก่ามากจนใช้การไม่ได้, ขาดจนไม่มีชิ้นดี"
รายอ 0,น.,ลูกหินกลม ๆ ที่เด็กใช้สำหรับเล่น.
รายอ 1,น.,ชื่อเสื้อแบบหนึ่งของชาวไทยมุสลิม.
รายอ 2,น.,"ฮารีรายอ, พิธีกรรมออกบวชของชาวไทยมุสลิม"
รายัน 0,น.,อุปกรณ์ใช้กับเรือเซียด และเรือผีหลอก รายัน ทำด้วยอวน ตัดให้เท่ากับความยาวของลำเรือ ความสูงของรายันเรือเซียดกุ้ง ประมาณ ๕๐ เซนติเมตร ส่วนรายันของเรือผีหลอกให้มีความสูง พอที่ปลาใหญ่จะกระโดดข้ามไม่ได้ ใช้ด้ามไม้ปักไว้ที่กาบเรือ ป้องกันกุ้งปลากระโดดเลยไป.
ราเย็น 0,ว.,ขยัน เช่น แด็กคนนี้ราเย็นจริง (เทียบ ม. rajin)
ราเย็น 1,ว.,เกียจคร้าน (ส.ข.).
ราร่า 0,ว.,"ซุ่มซ่าม, รุ่มร่าม, ยุ่มย่าม (น.ศ.)."
ราว 0,น.,"แนว, ทาง, เครื่องยึดเหนี่ยวสำหรับเกาะหรือขึ้นลง เป็นต้น."
ร้าว 0,ก.,"ร้าว, ปริ เช่น แก้วนี้ปรัดแต้ว - แก้วใบนี้ร้าวแล้ว"
ร้าว 1,ก.,"ร้าว, ปริ (ดู ปรัด)."
ร้าว 2,ว.,"อักเสบ, มีพิษกำเริบ เนื่องจากบาดแผล เป็นต้น เช่น โลกดันฟกเพราะร้าวแผล – ไข่ดันบวมเพราะฤทธิ์แผล, เป็นฝีเจ็บทำให้ร้าวไข้ - เป็นฝีเจ็บทำให้ป่วยเป็นไข้."
ราวกุ้ง 0,ก.,วิธีจับกุ้งก้ามกราม ทำนองเดียวกับราวเบ็ด แต่ใช้สลักไม้ไผ่แทนตาเบ็ด สลักไม้ไผ่ยาวประมาณ ๒ นิ้ว โตกว่าก้านไม้ขีดไฟนิดหน่อย เอาเนื้อมะพร้าวสุกทั้งแท่ง กว้างยาวประมาณ ๑ นิ้ว เสียบเข้าไปใช้เป็นเหยื่อล่อกุ้งให้มากิน พายเรือไปตามสายราวกุ้ง ค่อย ๆ ดึงขึ้นมาแล้วใช้สวิงตักกุ้งที่มากินเหยื่อ.
ราวขาว 0,น.,"มีข่าว, ข่าวลือ, ได้ข่าวว่า เช่น ราวขาวว่านายกอี้มา - ได้ข่าวว่านายกจะมา."
ราวเด้อ 0,น.,ชื่อการเล่นชนิดหนึ่ง ฝ่ายเล่นตีลูกตะกร้อหรื ลูกบอล (ลูกเทนนิส) แล้ววิ่งวนรอบลาน ฝ่ายรับรับลูกแล้วขว้างให้ถูกผู้ที่ตีลูก ถ้าไม่ถูกก็ต้องเป็นฝ่ายรับต่อ
ราวท้อง 0,น.,ส่วนหน้าของท้อง ส่วนมากใช้กับปลา.
ราวไท 0,น.,"ราโท, ไม้กระดานเรียบที่ประกบบนกาบเรือบางชนิดสำหรับกันน้ำเข้าเรือ หรือเดินเลียบข้างเรือ."
ราวนม 0,น.,บริเวณนม.
ราวเบ็ด 0,น.,สายเบ็ดที่เกี่ยวเหยื่อผูกไว้ทำเป็นเบ็ดราว ห่างกันประมาณ ๒ เมตร ต่อเบ็ด ๑ ตา สายเบ็ดยาว ประมาณ ๒๐ วา.
ราวผ้า 0,น.,ที่ตากผ้าขึงด้วยวัสดุยาว เช่น เชือก ลวด หวาย เป็นต้น.
ราวหนู 0,น.,"สะพานหนู, ตัวไม้ที่วางทาบตามยาวบนเชิงกลอนเพื่อรองรับชายกระเบื้อง."
ราวหนู 1,น.,เรียกไม้โหะ และเชือกหรือลวด เป็นต้น ที่ขึง สำหรับพาดหรือตากผ้า.
ราวิง 0,น.,ชื่อเครื่องดักปลาในโป๊ะหรือเล้า รูปคล้ายสวิง (ดู ระริง น. ๑.).
ราไว 0,น.,สายเบ็ดราว
ราไว 1,น.,สายเบ็ดราว (ดู ลาไว).
ราสา 0,ว.,"มาก, มากมาย, มาก เช่น วันนี้จับปลาได้ราสา - วันนี้จับปลาได้มาก."
ร่าหลาม 0,ว.,กินมูมมาม.
ราหูกินจันทร์ 0,น.,จันทรุปราคา
ราหูกินจันทร์ 1,น.,จันทรุปราคา (ดู จับจันทร์).
ราหูจับจันทร์ 0,น.,จันทรุปราคา
ราหูจับจันทร์ 1,น.,จันทรุปราคา (ดู จับจันทร์).
ราหูอมจันทร์ 0,น.,จันทรุปราคา
ราหูอมจันทร์ 1,น.,จันทรุปราคา (ดู จับจันทร์).
รำ 0,น.,"รำ, ผงเยื่อหรือละอองเมล็ดข้าวสาร."
รำ 1,ก.,"รำ, แสดงท่าเคลื่อนไหวโดยมีลีลาและแบบท่าเข้ากับจังหวะเพลงร้อง หรือเพลงดนตรี."
ร่ำ 0,ก.,"ร้องไห้, คร่ำครวญ เช่น อย่าร่ำแหล้น้องเหอ - อย่าร้องไห้ซิน้อง"
ร่ำ 1,ว.,อยากจะ เช่น หมั้นร่ำอี้ไป - มันอยากจะไป
รำเก็บเท้า 0,น.,ท่ารำมโนราห์ท่าหนึ่ง จะเคลื่อนเท้าโดยไม่ยกขา.
รำแก้เหฺมฺรย 0,น.,"พิธีกรรมรำแก้บน, รำถวายครอบเทริดใหญ่"
รำแก้เหฺมฺรย 1,น.,"พิธีกรรมรำแก้บน, รำถวายครอบเทริดใหม่."
รำแข 0,น.,ชื่อไม้ ผลชนิดหนึ่ง ผลคล้ายสะท้อน แต่เล็กกว่า เมล็ดของผลซึ่งกินได้คล้ายมะไฟ รสหวาน
รำแข 1,น.,ชื่อไม้ผลชนิดหนึ่ง (ดู ปุย น. ๓.).
รำเคย 0,น.,"ต้นสาบเสือ, ชื่อไม้ล้มลุก เป็นวัชพืชชิ้นทั่วไป ใบมีกลิ่นเหม็น ใช้ทำยาได้"
รำเคย 1,น.,ต้นสาบเสือ (ดู ขี้ไก น. ๓.).
รำทำ 0,ว.,พึมพำ
รำทำ 1,ว.,"กระเสาะกระแสะเช่น หมันเจ็บรำทำ - มันป่วยกระเสาะกระแสะ (พ.ง., ภ.ก.)."
รำทำ 2,ว.,พึมพำ (ดู งุมงำ ว.).
รำนา 0,น.,"กลองรำมะนา, กลองขึงหน้าเดียว รูปกลมแป้น."
รำในวร 0,สำ.,มีแต่ได้ไม่มีเสีย.
ร่ำปา 0,น.,เมล็ดผักชี (ส.ต.).
รำมะแข 0,น.,ชื่อไม้ ผลชนิดหนึ่ง ผลคล้ายสะท้อน แต่เล็กกว่า เมล็ดของผลซึ่งกินได้คล้ายมะไฟ รสหวาน
รำมะแข 1,น.,ชื่อไม้ผลชนิดหนึ่ง (ดู ปุย น. ๓.).
ร่ำร่า 0,ว.,"ยากจน, น่าสงสาร (ภ.ก.)."
ร่ำร่า 1,ว.,รุงรัง (ช.พ.).
ร่ำร่ำ 0,ว.,อยากจะ เช่น หมั้นร่ำอี้ไป - มันอยากจะไป
ร่ำลือ 0,ก.,"คิดว่า, รู้สึกว่า."
ร่ำลือ 1,ว.,เข้าใจว่า.
รำหนัง 0,ก.,"เล่นหนัง, เชิดหนัง (ก.บ., พ.ง., ภ.ก.)."
รำหนาด 0,น.,"รำมะนาด, ชื่อโรคชนิดหนึ่งเกิดตามรากฟัน ทำให้เหงือกบวมเป็นหนอง"
รำหรา 0,ก.,อาการจะเป็นจะตายเท่า ๆ กัน (ภ.ก.).
รำเหยียบลูกนาว 0,น.,การรำเพื่อตัดไม้ข่มนามของมโนราห์ในพิธีโรงแข่งหรือประชันโรง นิยมรำหลังจากรำเฆี่ยนพราย หรือเฆี่ยนรูป
รำเหยียบลูกนาว 1,ก.,การรำเพื่อตัดไม้ข่มนามของมโนราห์ (ดู ถีบลูกนาว น.).
ริ้งริ้ง 0,ว.,ไกลลิบตา เช่น ไปริ้งริ้งไปแล้ว.
ริ้งโร 0,น.,ชื่อปาล์มชนิดหนึ่ง ต้นเล็กเนื้อแข็ง มีข้อคล้ายหวาย
ริ้งโร 1,น.,ชื่อปาล์มชนิดหนึ่ง (ดู ยี้รู).
ริ้งไร 0,น.,"เรไร, ชื่อจักจั่นสีน้ำตาล ตัวผู้มีอวัยวะพิเศษทำให้เกิดเสียงสูงและตํ่า มีกังวานสลับกันไปได้หลายระดับ"
ริ้งไร 1,น.,เอ็นใต้ส่วนหัวอวัยวะเพศชาย.
ริดดวง 0,น.,"ริดสีดวง, ชื่อโรคจำพวกหนึ่งมีหลายชนิด เกิดในช่องตา จมูก ทวารหนัก เป็นต้น"
ริดดวง 1,น.,ริดสีดวง (ดู รัดดวง น. ๑.).
ริน 0,ก.,เทให้ไหลออกเรื่อย ๆ ทีละน้อย.
ริ่นริ่น 0,ว.,"เรื่อย ๆ, เบา ๆ, เช่น น้ำไหลคิ่นคิ่น, ลมพัดมาคิ่นคิ่น"
ริ่นริ่น 1,ว.,"เรื่อย ๆ, เบา (ดู คิ่นคิ่น.ว. ๑.)."
ริ่ว 0,ว.,ความรู้สึกเมื่อลมออกจากผิวหนัง เมื่อทาน้ำมันหม่อง หรือน้ำมันมวย.
ริ่ว 1,ว.,ความรู้สึกเหมือนมดไต่ (ส.ข.).
ริ้ว 0,น.,เรียกนาแต่ละแนวที่ประกอบด้วยแปลงเล็ก ๆ หลายแปลงติดต่อกัน.
ริ้ว 1,น.,"เส้นลายหรือสิ่งอื่นที่มีลักษณะเป็นรอย ๆ เป็นทาง ๆ เป็นแถว หรือเป็นแนวยาวไป, แถบ."
ริ้ว 2,ลัก.,เรียกด้ายที่ทำไว้เป็นขด ด้าย ๑ ริ้ว มี ๑๐ ขด.
ริ้ว 3,ลัก.,ลักษณนามเรียกสิ่งที่มีลักษณะเป็นรอย ตัดกรีดเป็นแถวหรือเป็นแนวยาวไปว่า ริ้ว เช่น ปลาแห้ง ๕ ริ้ว.
ริวกิว 0,น.,ปลากดทะเลพันธุหนึ่ง (ดู บอหย็อง).
ริวกิว 0,น.,ชื่อกดทะเลพันธุ์หนึ่ง ไม่มีเกล็ด มีหนวด. (ป.น.)
