สี๋น 0,น.,"วิญญาณ เช่น กิ่มสี๋น - ป้ายสถิตวิญญาณ, เจี่ยสี๋น - พระที่มาเข้าทรงเป็นพระแท้, เก๊สี๋น - คนทรงแกล้งทำเป็นพระเข้าทรง ถือว่าเป็นพระปลอม (ภ.ก.)."
สีนทุ่ม 0,ก.,ตัดทิ้ง.
สีนหัว 0,ก.,วิธีทำปลาโดยวิธีตัดหัวปลา.
สีนาง 0,น.,"ตุ๊กตา, เด็กผู้หญิงที่น่ารักคล้ายตุ๊กตา."
สีนาง 1,น.,ชื่อการเล่นของเด็กอย่างหนึ่งโดยใช้ตุ๊กตาเป็นตัวประกอบ.
สีน้ำตาลไหม้ 0,ว.,สีน้ำตาลแก่.
สีน้ำผึ้ง 0,ว.,สีน้ำตาล.
สีน้ำเล 0,ว.,สีน้ำเงินอ่อน.
สีนิล 0,ว.,สีดำ.
สีบานค่ำ 0,ว.,สีดอกบานเย็น (น.ธ.)
สีบานเช้า 0,ว.,สีขาว (น.ธ.)
สีบานเย็น 0,ว.,สีดอกบานเย็น (น.ธ.)
สีปูนแห้ง 0,ว.,"สีชมพูอ่อนเกือบขาว, สีชมพูอมส้ม."
สีเปลือกหมากสุก 0,ว.,สีส้ม.
สีพัน 0,น.,ชื่อไม้พุ่มชนิดหนึ่ง ดอกสีแดง ผลเป็นพวง รสเปรี้ยว กินได้
สีพุด 0,น.,จระเข้ (น.ธ.).
สีโพตาน 0,ว.,สีดอกพุดตาน.
สีฟัน 0,น.,ชื่อไม้พุ่มชนิดหนึ่ง (ดู แตดลีง น. ๑.).
สีฟันนางแอ 0,น.,ชื่อไม้ต้นขนาดใหญ่ ผลขนาดลูกหว้า เมื่อสุกจะมีสีแดง นกชอบกิน เนื้อไม้ใช้ทำเครื่องเรือน
สีฟันนางแอ 1,น.,ชื่อไม้ต้นขนาดใหญ่ (ดู คอแห้ง น.).
สีมายัง 0,น.,ชื่อข้าวพันธุ์พื้นเมือง (ก.บ.).
สีมีดหม้อ 0,ว.,สีดำ.
สีมือ 0,น.,"ฝีมือ, ความสามารถหรือทักษะและชั้นเชิงในการปฏิบัติการใด ๆ."
สีแม็ดปริง 0,ว.,สีม่วงเข้ม.
สียอดกล้วย 0,ว.,สีเขียวอ่อน.
สีรัก 0,น.,ชื่อข้าวพันธุ์พื้นเมือง (ก.บ.).
สีลังสาด 0,ว.,สีนวลคล้ายสีลางสาดสุก.
สีสุก 0,น.,ชื่อไม้ไผ่ชนิดหนึ่ง มีหนาม นิยมนำไปใช้ทำกระบอกข้าวหลาม
สีเสียด 0,น.,"สีเสียด, สารที่สกัดจากเนื้อไม้ของต้นสีเสียด ใช้ผสมปูนกินกับหมาก"
สีเสียด 1,น.,สีเสียด (ดู ขี้เสียด น. ๒.).
สีหมัน 0,น.,ชื่ออาหารอย่างหนึ่งทำด้วยมะพร้าวคั่วกุ้งฝอย เป็นต้น.
สีหมากสุก 0,ว.,สีแดง.
สีหมึง 0,ก.,"บ้าบิ่น, ไม่ยับยั้งชั่งใจ."
สีหรง 0,ก.,"ส่ง, ดัน เช่น สีหรงหนังสือให้ที - ส่งหนังสือมาให้หน่อย."
สีหู 0,ว.,สีเม็ดมะปราง (น.ธ.).
สีหูสีตา 0,สำ.,สี่หูสี่ตา หมายถึง ผู้หญิงมีครรภ์.
สีเหรา 0,น.,"สุเหร่า, ที่ประชุมทำศาสนกิจของมุสลิม (ม. surau)."
สีโหนด 0,ว.,สีดำอมน้ำตาลเหมือนเปลือกตาลสุก.
สีอาน 0,น.,ชื่อกล้วยไม้ดินพันธุ์หนึ่ง.
สีอิฐ 0,ว.,สีส้มคล้ายแผ่นอิฐดินเผา.
สีอิด 0,ว.,เหนียวเหนอะหนะ (น.ธ.)
สึก 0,ก.,"ลาสิกขา, ลาจากสมณเพศ"
สึกสึก 0,ว.,เปียกโชก
สึกสึก 1,ว.,เปียกโชก (ดู สก ว.).
สึเก็ด 0,ว.,"ขี้เหนียว, ตระหนี่"
สึง 0,น.,ลังถึง
สึง 1,น.,ลังถึง (ดู ซึ่ง น. ๑.).
สึ่งก๊าม 0,น.,มะนาว (ภ.ก.).
สึ่งปั่ว 0,น.,ลูกคิด (ภ.ก.)
สึดาย 0,ว.,"ขี้เหนียว, ตระหนี่"
สึนะ 0,ก.,"อาการท้องอืด, จุกแน่น"
สึนะพุง 0,ว.,ท้องอืด
สึนะพุง 1,ว.,ท้องอืด.
สึแมะ 0,ก.,ฆ่าโดยวิธีเชือดคอ (น.ธ.)
สึหงัน 0,ก.,หมั่นไส้ (น.ธ.).
สึหมัก 0,ก.,สำลัก (ดู หฺมฺลัก).
สึหมัก 0,ก.,สำลัก
สึเหลียบ 0,น.,ภาชนะสานด้วยใบไม้ ใช้สำหรับใส่อาหาร (ดู เตียบ น. ๑.).
สึเหลียบ 0,น.,ภาชนะสานด้วยใบไม้ เช่น ใบตาล ใบเตย ใช้สำหรับใส่อาหาร
สึเหลือด 0,ก.,"ลื่น, อาการที่พลาดไถลหรือเคลื่อนไปได้คล่องบนพื้นที่เรียบเกลี้ยง ซึ่งมีลักษณะเป็นมันเป็นเมือก"
สึเหลือด 1,ก.,ลื่น (ดู มฺลื่น).
สึโอะ 0,ว.,"ร้อน, อบอ้าว (น.ธ.)"
สืด 0,ก.,สูด เช่น สืดขี้มูก - สูดน้ำมูก
สืบ 0,ก.,ต่อเนื่องเป็นลำดับ.
สืบ 1,ก.,"เสาะหา, แสวงหา."
สืบโยด 0,ก.,สืบหาตระกูล.
สืบหูก 0,ก.,ต่อเส้นด้ายที่จะทอผ้ากับเส้นด้ายที่ติดอยู่กับฟืม.
สือ 0,ว.,แตกเนื้อหนุ่ม ใช้กับสัตว์ (ดู เสอ).
สือ 0,ว.,"รุ่น, แตกเนื้อหนุ่ม (ใช้กับสัตว์) เช่น ไกเสอ - ไก่รุ่น, วัวเสอ - วัวหนุ่ม"
สื้อว่า 0,สัน.,ถ้าว่า (ภ.ก.).
สื่อหรัด 0,ว.,อาการหนัก (น.ธ.).
สุกใจ 0,ก.,"วิตกกังวลใจ, รู้สึกเสียใจในเรื่องที่ผ่านมา."
สุกใจ 1,ก.,วิตกกังวลใจ (ดู อุกขิด).
สุกมุก 0,ว.,สกปรก เช่น แด็กคนนี้อยู่สกมกจัง - เด็กคนนี้สกปรกมาก
สุกมุก 1,น.,จมูกไก่.
สุกมุก 2,น.,เรียกหญิงที่ตายเนื่องจากคลอดบุตร แต่บุตรไม่ตาย.
สุกมุก 3,ว.,สกปรก (ดู สกมก).
สุงสิง 0,ก.,"ดุ, อารมณ์เสีย (ใช้กับสัตว์) (ช.พ.)"
สุงสิง 1,ก.,วิสาสะกันอย่างสนิทสนม.
สุ้งสี 0,น.,"ราศี, ความสง่างาม, ลักษณะดีงามของคน, โดยปริยายหมายความว่า ความอิ่มเอิบ, ความภาคภูมิ เช่น “ พระสมีที่บวชใหม่ สุ้งสีงามสุดกำลัง ” (สุบินสำนวนเก่า)."
สุด 0,ก.,"สิ้น, หมด, เสร็จ เช่น ขี้สุดแหล่ว - ถ่ายอุจจาระเสร็จแล้ว."
สุดเชียก 0,สำ.,ไปเที่ยวหรือทำอะไรจนอิ่มตัวแล้วก็จะกลับมาบ้านเอง คล้ายวัวควายที่เดินออกไปและเล็มหญ้าจนสุดสายเชือก (ภ.ก.).
สุดเชียก 1,ว.,"ปลาย, ท้าย."
สุดแบ็ด 0,ก.,ผูกเบ็ดด้วยเงื่อนตะกรุดเบ็ด
สุดแบ็ด 1,ก.,ผูกเบ็ดด้วยเงื่อนตะกรุดเบ็ด (ดู ตรุด ก.).
สุน 0,ก.,"ดัน, สวน (ดู สูน ก. ๑.)."
สุน 1,ก.,"ดัน, ผลัก, สวน เช่น สูนไม้ฟืน - ดันฟืนเข้าไป, สูนวาน - สวนทวาร"
สุนชุน 0,น.,ชื่องูชนิดหนึ่ง
สุนสิน 0,ก.,"ดุ, อารมณ์เสีย (ใช้กับสัตว์) (ช.พ.)"
สุนสิน 1,ก.,"ดุ, อารมณ์เสีย (ดู สุงสิง ก. ๑.)."
สุบ 0,ก.,ดูด
สุบ 1,ก.,ผูกเบ็ดด้วยเงื่อนตะกรุดเบ็ด
สุบ 2,ก.,ดูด (ดู ฉุบ ก. ๒.).
สุบ 3,ก.,ผูกเบ็ดด้วยเงื่อนตะกรุดเบ็ด (ดู ตรุด ก.).
สุพัน 0,น.,"กำมะถัน, ธาตุสีเหลือง ติดไฟง่าย กลิ่นเหม็นฉุน ใช้ทำยา ทำดินปืน"
สุภาพ 0,ก.,สารภาพ.
สุภาพ 1,ว.,"เรียบร้อย, อ่อนโยน, ละมุนละม่อม."
สุ่ม 0,น.,"สุ่ม, เครื่องมือจับปลาชนิดหนึ่ง มักสานด้วยไม้ไผ่เป็นตา ๆ ลักษณะเป็นทรงกระบอก ด้านบนสอบเข้ามีช่องให้ล้วงมือลงไปได้ มีหลายชนิด เช่น สุ่มหนง - สุ่มธรรมดา, สุ่มออ - สุ่มขนาดเล็กผูกซี่ถี่ ๆ สำหรับครอบปลาที่รวมอยู่กันมาก ๆ."
สุ่ม 1,ก.,"สุ่มปลา, อาการที่เอาสุ่มครอบเพื่อจับปลา เป็นต้น."
สุ่ม 2,ก.,วางทับซ้อน ๆ กันลงไปจนสูงเป็นกองอย่างไม่มีระเบียบ.
สุ่ม 3,ว.,"อาการที่ทำโดยไม่แน่ใจว่าจะถูกหรือไม่, ไม่เฉพาะเจาะจง."
สุ่มวง 0,ก.,สุ่มปลาเป็นกลุ่มใหญ่ ๆ โดยตีวงล้อมเข้าหากัน.
สุ้มสิ้ม 0,ก.,"ซุบซิบ, ตกลงกันเงียบ ๆ ทำพอดีพอร้าย เช่น ซุ่มซิ่มสุ้มสิ้ม ไม่พักทิ่มข้าวสาร ไปกับพี่ตะน้อง เราไม่ต้องทำงาน - ซุบซิบกันเงียบ ๆ ชายหญิงหนีตามไป โดยไม่ต้องเตรียมงานแต่งงาน"
สุ้มสิ้ม 1,ก.,ซุบซิบ (ดู ซุ้มซิ้มสุ้มสิ้ม).
สุมใส 0,น.,ป่าละเมาะที่ถางเพื่อทำสวนทำไร่ ถ้ามีไม้งอกขึ้นมาใหม่เรียก “ ป่าใส ”
สุมไส 0,น.,ป่าละเมาะ (ดู ไส น.).
สุ่มใหญ่กรวมหนอง 0,สำ.,วางอำนาจเกินตัว.
สุย 0,น.,สวิตช์.
สุ้ย 0,ก.,ดุ้นติดกัน เช่น ตงกับคาน
สุ้ย 1,ก.,ตีตะปูโดยวิธีทแยงให้ไม้ใหญ่ ๒ ดุ้นติดกัน (ดู ฉุ้ย ก. ๑.).
สุหรา 0,ก.,"คํ้าประกัน, จำนำ, จำนอง (ดู หรา ก. ๑.)."
สุหรา 0,ก.,"คํ้าประกัน, จำนำ, จำนอง (ส.ฎ., น.ศ., ส.ข.)"
สุเหร้ง 0,ว.,"ทแยง, เฉียง (ดู สิเหร้ง)."
สุเหร้ง 0,น.,ชื่อปาล์มชนิดหนึ่ง ใบใช้เย็บมุงหลังคา
สุโหร่ง 0,น.,ผ้าโสร่ง
สุโหร่ง 1,น.,ผ้าโสร่ง (ดู ผ้าถุง).
สู 0,น.,คำเรียกญาติของชาวไทยมุสลิม หมายถึง น้า หรือ อา (ภ.ก.).
สู 1,สรรพ.,"บุรุษที่ ๒ เจ้า, แก, มึง."
สู้ 0,น.,โซ่ (ดู โส้ น. ๑.)
สู้ 1,ก.,รอง เช่น สู้น้ำฝน - รองน้ำฝน.
สู้ 2,ก.,"กล้า, ไม่กลัว, ไม่ครั่นคร้าม."
สู้ 3,น.,"โซ่, โลหะมีเหล็ก เป็นต้น ที่เกี่ยวกันเป็น ข้อ ๆ เป็นสายยาวสำหรับผูกล่ามแทนเชือก"
สูงขะ 0,ก.,"เงื้ออาวุธด้วยมือทั้งสองข้างขึ้นเหนือศีรษะเพื่อจามลง (ต.ร., ก.บ.)"
สูงขะ 1,ก.,ไหว้แบบถวายบังคม (ดู ฉูงาม ก. ๒.).
สูงงาม 0,ก.,"เงื้ออาวุธด้วยมือทั้งสองข้างขึ้นเหนือศีรษะเพื่อจามลง (ต.ร., ก.บ.)"
สูงงาม 1,ก.,"ไหว้แบบถวายบังคม, เคารพโดยการกราบไหว้"
สูงงาม 2,ก.,ไหว้แบบถวายบังคม (ดู ฉูงาม ก. ๒.).
สูงชา 0,ก.,"เงื้ออาวุธด้วยมือทั้งสองข้างขึ้นเหนือศีรษะเพื่อจามลง (ต.ร., ก.บ.)"
สูงชา 1,ก.,ไหว้แบบถวายบังคม (ดู ฉูงาม ก. ๒.).
สูงพระ 0,ก.,"เงื้ออาวุธด้วยมือทั้งสองข้างขึ้นเหนือศีรษะเพื่อจามลง (ต.ร., ก.บ.)"
สูงพระ 1,ก.,ไหว้แบบถวายบังคม (ดู ฉูงาม ก. ๒.).
สูงโม่ง 0,ว.,ผอมสูง
สูงาม 0,ก.,"ไหว้แบบถวายบังคม, เคารพโดยการกราบไหว้"
สูงาม 1,ก.,ไหว้แบบถวายบังคม (ดู ฉูงาม ก. ๒.).
สูน 0,น.,ตัวเลข ๐.
สูน 1,น.,ลูกปืน.
สูน 2,ก.,"ดัน, ผลัก, สวน เช่น สูนไม้ฟืน - ดันฟืนเข้าไป, สูนวาน - สวนทวาร"
สูน 3,ก.,"ทำให้หายไป, ยุบ, ถอดออก เช่น สูนฝี - เอาปูนมาทาวงรอบฝี เพื่อให้ฝียุบ."
สูน 4,ว.,"เสีย, ไม่ดี, ผิดปกติ เช่น เที่ยวจนสูนคน - เที่ยวจนเสียคน."
สูน 5,ว.,ปกติ เช่น เครื่องหมันก่าเดินสูนดี - เครื่องยนต์ก็เดินปกติดี (ภ.ก.).
สูนคน 0,สำ.,เสียคน.
สูบยา 0,น.,"บุหรี่, ยาสูบที่ใช้ใบตองหรือกระดาษมวนใบยาที่หั่นเป็นฝอย"
สูบยา 1,น.,บุหรี่ (ดู ยาสูบ).
สู้สะ 0,ก.,"ติดขัด, ไม่สะดวก (ก.บ.)."
สูไหร้ 0,น.,พวกสู ออกเสียงเป็นซูไหร้ เช่น โบ้ซูไหร้ - พวกสู (ส.ต.).
เส 0,น.,"สี่, จำนวนสามบวกหนึ่ง"
เส 1,น.,สี่ (ดู สี น. ๒.).
เส 2,น.,"อเส, ตัวไม้ซึ่งประกอบยึดเสาส่วนบนของเรือน, ไม้ยึดหัวกงเรือ."
เส่ 0,น.,"วิธีการ, วิธีปฏิบัติตามหลักการเป็นขั้นตอนอย่างมีระบบ."
เส่ 1,ก.,ท่าทาง.
เส่ 2,ว.,มีหลัก เช่น อู่เส่ - อยู่อย่างมีหลัก. (ภ.ก.).
เส้ 0,น.,"ค่าเช่าที่ตั้งแผงลอย เช่น เก็บเส้ - เก็บค่าเช่าที่ตั้งแผงลอย (จ., ภ.ก.)."
เสก 0,ก.,"เป่ามนตร์, ร่ายคาถาอาคม."
เสก 1,ก.,ปลุกเสก.
เสกโจ 0,น.,พิธีทางไสยศาสตร์ทำเพื่อเสกหนังให้เข้าไปอยู่ในท้องของผู้อื่น.
เสกสา 0,ว.,"สำบาก, เวทนา (ดู เสดสา)."
เสกสา 0,ว.,"สำบาก, ตกยาก, เวทนา เช่น อยู่อย่างเสดสา - อยู่อย่างลำบาก (เทียบ ม. siksa)"
เส็กเส็ก 0,ก.,ยุ่ง เช่น อย่ามาเด็กเด็ก - อย่ามายุ่ง.
เส็กเส็ก 1,ว.,กะปริบกะปรอย.
เสง 0,ก.,ตกลง (ภ.ก.).
เสง 1,ว.,ห้อยย้อยลงมามาก.
เสง 2,ว.,"เลียนแบบ, ทำหรือพยายามทำให้เหมือนหรือคล้ายคลึงกับแบบอย่าง, ทำสำเร็จ (ภ.ก.)"
เส่งข้วน 0,ว.,"เหมือนกัน (จ., ภ.ก.)."
เส้งเคร้ง 0,สำ.,เป็นคำตำหนิผู้ที่ไม่ยอมพัฒนาตนเองให้ดีขึ้น
เส็งเคร็ง 0,สำ.,เป็นคำตำหนิผู้ที่ไม่ยอมพัฒนาตนเองให้ดีขึ้น
เส่งลี่หลาง 0,น.,"พ่อค้า (จ., ภ.ก.)."
เส่งสีด 0,ว.,"เลียนแบบ, ทำหรือพยายามทำให้เหมือนหรือคล้ายคลึงกับแบบอย่าง, ทำสำเร็จ (ภ.ก.)"
เส่งสีด 1,ว.,เลียนแบบ (ดู เสง ว. ๒).
เสด็ด 0,น.,ไม้พายคนข้าว (ป.น.).
เสดเดด 0,ว.,"ละเอียดลออ, พิถีพิถัน"
เสดเดด 1,ว.,พิถีพิถัน (ดู สีดดีด).
เสดสา 0,ว.,"สำบาก, ตกยาก, เวทนา เช่น อยู่อย่างเสดสา - อยู่อย่างลำบาก (เทียบ ม. siksa)"
เสน 0,น.,ชื่อลิง ตัวใหญ่ ลีน้ำตาลแดง หน้าแดง ก้นแดง หางสั้นมาก.
เสน 1,น.,สีแดงระเรื่ออย่างสีของปาน.
เสน 2,น.,ปานแดงประเภทนูนลาม ขยายตัวเร็ว.
เส้น 0,น.,ชื่อไม้ล้มลุกชนิดหนึ่ง ดอกสีเหลือง.
เส้น 1,น.,สิ่งที่มีลักษณะเป็นสาย แถว แนว ที่ไม่จำกัดความยาว
เส้น 2,น.,"เส้นเอ็น, เอ็น."
เส้น 3,น.,มาตราวัดความยาว มีขนาด ๒๐ วา เป็น ๑ เส้น.
เส้น 4,ก.,"เซ่น, บวงสรวง, ไหว้ เช่น เส้นเจ้าที่ - บวงสรวงเจ้าที่."
เส้น 5,ลัก.,เรียกสิ่งที่มีลักษณะยาว เช่น เชียก ๒ เส้น - เชือก ๒ เส้น.
เส้นแกงจืด 0,น.,วุ้นเส้น
เส้นแกงจืด 1,น.,วุ้นเส้น.
เส้นแกงร้อน 0,น.,วุ้นเส้น
เส้นแกงร้อน 1,น.,วุ้นเส้น.
เส้นถ่าวหลาง 0,น.,เส้นสำคัญของการเล่นเตย ซึ่งหัวหน้าของฝ่ายรับจะยืนเฝ้าอยู่ เป็นเส้นหน้าสุดของตารางที่ต่อด้วยเส้นทแยงทั้งสองที่คล้ายหัวลูกศร (ภ.ก.).
เส้นหมี่ขาว 0,น.,"หมี่, เรียกแป้งข้าวเจ้าที่โรยเป็นเส้นลงในน้ำเดือด พอสุกแล้วนำมาตากแห้ง"
เส้นหมี่ขาว 1,น.,หมี่หุน
เส้นหมี่เหลือง 0,น.,เรียกเส้นหมี่ที่ทำจากแป้งสาลีเป็นเส้นเล็ก ๆ เล็กกว่าเส้นหมี่ฮกเกี้ยน มักโรยด้วยแป้ง เก็บไว้ได้นาน
เส้นหมี่เหลือง 1,น.,เส้นหมี่ (สีเหลือง).
เส้บ้อ 0,น.,"ภรรยาน้อย (จ., ภ.ก.)."
เส่ล้อง 0,น.,"ชา, ชาร้อน ( เทียบ อ. ceylon ; ภ.ก.)."
เส่ล้องหงู่เล้งสึ้ง 0,น.,ชาเย็น.
เส่ล้องอ้อ 0,น.,ชาดำร้อน.
เส่ล้องอ้อฉ่าม 0,น.,ชาผสมกาแฟ โดยมีสัดส่วนของชามากกว่ากาแฟ.
เส่ล้องอ่อสึ้ง 0,น.,ชาดำเย็น.
เสว 0,ว.,"เถลไถล, ชักช้า, อืดอาด (ภ.ก.)."
เส้วตี่ 0,น.,"น้องชายคนเล็ก (จ., ภ.ก.)."
เส้วหม่อย 0,น.,"น้องสาวคนเล็ก (จ., ภ.ก.)."
เส้หยี่ 0,ว.,"ขี้เกรงใจ, เล่นตัว (ภ.ก.)."
เส้ห่าน 0,น.,"คนเล็ก (จ., ภ.ก.)."
เสอ 0,ว.,"รุ่น, แตกเนื้อหนุ่ม (ใช้กับสัตว์) เช่น ไกเสอ - ไก่รุ่น, วัวเสอ - วัวหนุ่ม"
เสา 0,น.,"เสา, ท่อนไม้สำหรับใช้เป็นหลักหรือเป็นเครื่องรองรับสิ่งอื่นมีเรือน เป็นต้น, เรียกสิ่งอื่น ๆ ที่มีลักษณะเช่นนั้น."
เสา 1,น.,วันเสาร์.
เส้า 0,น.,ก้อนเส้า.
เส้า 1,น.,เสาที่ใช้รองรับกังหันให้หมุนรับทิศทางลมได้คล่อง
เสากลาง 0,น.,เสาเอก
เสาค้ำ 0,น.,เสาสำหรับใช้คํ้ายันเพื่อความแข็งแรงยิ่งขึ้น.
เสาดั้ง 0,น.,เสาที่วางคร่อมรอดขึ้นไปรับขื่อ
