สังหรี 0,น.,"สังฆการี, เจ้าพนักงานผู้มีหน้าที่เกี่ยวกับสงฆ์ในงานหลวง"
สังหวาน 0,น.,"สว่าน, เครื่องมือช่างไม้ปลายเป็นเกลียวแหลม สำหรับเจาะไช"
สังหวาน 1,น.,สว่าน (ดู ดอกบิด).
สังเหมือนสังขี้มูก 0,สำ.,สังแล้วไม่ปฏิบัติตาม.
สังเหฺยา 0,น.,ลางสังหรณ์ เช่น โร้สึกสังเหฺยาใจ - รู้สึกน่าจะมีอะไรเกิดขึ้นสักอย่าง.
สังแหยว 0,น.,"ชะมด, อีเห็น, ชื่อสัตว์เลี้ยงลูกด้วยนม หน้าแหลม ตัวเรียว สีเทาหรือน้ำตาล มีลายจุดสีดำตามยาวทั่วตัว หางและขนหางยาว มีลาย เป็นปล้อง มีต่อมกลิ่นใกล้เครื่องเพศ มักออกหากินในเวลากลางคืน, โดยปริยายหมายถึงสัตว์อื่นที่มีลักษณะคล้ายนี้"
สังแหย้ว 0,น.,"ชะมด, อีเห็น, ชื่อสัตว์เลี้ยงลูกด้วยนม หน้าแหลม ตัวเรียว สีเทาหรือน้ำตาล มีลายจุดสีดำตามยาวทั่วตัว หางและขนหางยาว มีลาย เป็นปล้อง มีต่อมกลิ่นใกล้เครื่องเพศ มักออกหากินในเวลากลางคืน, โดยปริยายหมายถึงสัตว์อื่นที่มีลักษณะคล้ายนี้"
สังแหย้ว 1,น.,ชะมด (ดู มูสัง).
สังแหย้ว 2,น.,"แมวหนุ่มที่ชอบเที่ยวไปหาตัวเมียไม่ยอมกลับบ้าน, แมวตัวผู้ รูปร่างใหญ่ หน้าตาดุ (ดู คราว น.)."
สังแหย้ว 0,น.,"เรียกแมวหนุ่มที่ชอบเที่ยวไปหาตัวเมียไม่ยอมกลับบ้าน, แมวตัวผู้ที่แก่ รูปร่างใหญ่ หน้าตาดุ น่ากลัว และมีหนวดยาว"
สังแหย้วอยู่ใน 0,สำ.,หญิงที่มีครรภ์.
สัด 0,น.,ภาชนะรูปทรงกระบอก ทำด้วยไม้หรือสานด้วยไม้ไผ่ใช้ตวงข้าว.
สัด 1,น.,ชื่อมาตราตวงโบราณ ๒๕ ทะนานเป็น ๑ สัด มีอัตราเท่ากับ ๑ ถัง หรือ ๒๐ ลิตร.
สัด 2,ก.,อาการที่สัตว์ตัวเมียเกิดกระสัน เมื่อถึงช่วงหรือฤดูกาลผสมพันธุ์ เรียกว่า เป็นสัด.
สัดกรู 0,น.,ศัตรู (ภ.ก.).
สัดจร 0,ก.,"สมจร, ร่วมประเวณี, เร่สมสู่."
สัดดี 0,น.,บทไหว้บูชาครู มี ๒ อย่าง คือ
สัดดีน้อย 0,น.,"ไหว้ครูก่อนทำพิธีอย่างย่อ เช่น ก่อนมอบตัวเป็นศิษย์, ก่อนหยิบหนังสือขึ้นอ่าน เป็นต้น."
สัดดีใหญ่ 0,น.,"ไหว้ครูตอนทำพิธีสำคัญ เช่น ไหว้พระภูมิเจ้าที่, พิธีครอบมือของนักแสดง."
สัน 0,น.,สิ่งที่มีลักษณะนูนสูงเป็นแนวยาว เช่น สันหลังคา.
สัน 1,น.,ส่วนหนาของมีดหรือขวานซึ่งอยู่ตรงข้ามกับคม.
สัน 2,ก.,"ไหวถี่ ๆ, ทำให้ไหวถี่ ๆ เช่น ขลาดจนตัวสัน - กลัวจนตัวสั่น."
สันจิต 0,ก.,"คิด, เข้าใจเอาว่า, ทึกทักเอาว่า."
สันจิต 1,ว.,"สำคัญเอาว่า, กระสัน, คะนึง, คิดผูกพันอยู่, มีใจจดจ่ออยู่."
สันพร้า 0,น.,ชื่อไม้ต้นขนาดใหญ่ ผลขนาดลูกหว้า เมื่อสุกจะมีสีแดง นกชอบกิน เนื้อไม้ใช้ทำเครื่องเรือน
สันพร้านางแอ 0,น.,ชื่อไม้ต้นขนาดใหญ่ (ดู คอแห้ง น.).
สันเหมือนผีเข้า 0,สำ.,ตัวสั่นมาก.
สันเหมือนผีเข้า 1,สำ.,ดัดจริต แต่กิริยาค่อนข้างมากกว่า ทำนองเดียวกับคำว่า แร่ด.
สับ 0,ก.,ซอย เช่น ซัวะไพ่ - ซอยไพ่
สับ 1,ก.,"สับ, เอาของมีคม เช่น มีดหรือขวานฟันลงไปโดยแรงหรือซอยถี่ ๆ (น.ธ.)."
สับ 2,ก.,เปลี่ยนแทนที่กัน เช่น เอาของมาสับกัน - เอาของมาแลกกัน.
สับ 3,ก.,ซอย (ดู ซัวะ ก.).
สับ 4,ก.,"ดุ, ด่า, ว่ากล่าว (ภ.ก., พ.ง.)"
สับ 5,ก.,ประดิดประดอย (ดู เดะ ก. ๑.).
สับเงา 0,ก.,อาการของไก่ชนที่ถูกคู่ต่อสู้จิกจนงง แทนที่จะจิกคู่ต่อสู้กลับจิกเงาที่ทอดอยู่กับพื้น (ภ.ก.)
สับเงา 1,ก.,อาการที่ไก่ชนถูกคู่ต่อสู้จิกจนงง (ดู จิกเงา).
สับดิ 0,น.,สมประดี (ดู สับเดะ น.).
สับดิ 1,น.,สมประดี
สับเดะ 0,ก.,"ประดิดประดอย, พิจารณาหาวิธี เช่น มึงลองเดะทำแลถี - มึงลองหาวิธีทำดูซิ, ทำเดะอยู่นั่นแหละ – ประดิดประดอยทำอยู่นั่นแหละ"
สับเดะ 1,น.,สมประดี
สับเทือก 0,ก.,ใช้จอบปรับพื้นนาสำหรับดำนา (น.ธ.).
สับเบี้ย 0,ก.,แลกเงินย่อย
สับเบี้ย 1,ก.,แลกเงินย่อย.
สับพี 0,น.,พระสวดให้พร.
สับรุก 0,น.,"ต้นสาบเสือ, ชื่อไม้ล้มลุก เป็นวัชพืชชิ้นทั่วไป ใบมีกลิ่นเหม็น ใช้ทำยาได้"
สับรุก 1,น.,ต้นสาบเสือ (ดู ขี้ไก น. ๓.).
สับรุก 2,ก.,กินรุก (การเล่นหมากรุก).
สับสับ 0,ว.,"รับเอาผลประโยชน์ที่คนอื่นทำไว้เรียบร้อยแล้ว, ชุบมือเปิบ."
สับหก 0,ก.,โกหก (น.ศ.).
สับหก 1,ว.,"อารมณ์ไม่สมํ่าเสมอ, กระเง้ากระงอด."
สัมมะดีงา 0,น.,"ต้นสำมะงา, ชื่อไม้พุ่ม ขึ้นตาป่าชายเลน ใช้ทำยาได้"
สัมสาม 0,ว.,"ลามก, สัปดน, หยาบโลน, อุตรินอกแบบ."
สัมสาม 1,ว.,อารมณ์ไม่สมํ่าเสมอบางครั้งดีบางทีร้าย
สั่วก้า 0,น.,"รางทรายสำหรับล้างแร่ (จ., ภ.ก.)."
สั่วเก้ง 0,น.,"รางทรายด้านบนของเหมืองฉีด (จ., ภ.ก.)."
สั่วคุ้ย 0,น.,"ทำนบเปิดปิดน้ำให้ดิน แร่ และน้ำไหล ไปตามรางแร่ (จ., ภ.ก.)."
สั่วป้อง 0,น.,"เหมืองฉีด (จ., ภ.ก.)."
สา 0,น.,"ประสา, อย่าง, ธรรมเนียม, วิสัยที่เป็นไป เช่น สาจีน - ธรรมเนียมจีน."
สา 1,ก.,"เดียงสา, รู้ผิดรู้ชอบตามปกติสามัญ (มักใช้ในความปฏิเสธ) เช่น เด็กไม่โรัสา - เด็กไร้เดียงสา."
สา 2,ก.,"รู้สึก เช่น สากลัว - รู้สึกกลัว, สาใจ - ระแวง, คลางแคลงใจ, สาขึ้ง - รู้สึกโกรธ."
สา 3,ก.,"สะอิดสะเอียน, ขยะแขยง."
สา 4,ว.,ตามประสา.
สา 5,ว.,"น่าจะ เช่น สาไม่มาที - คงจะยังไม่มา, สาไม่อยู่ - น่าจะไม่อยู่."
สาก 0,น.,"สาก, เครื่องสำหรับตำ ใช้คู่กับครก เช่น สากทิ่มข้าว - สากตำข้าว, สากเบือ - ไม้ตีพริก, สากกะเบือ."
สาก 1,ว.,"ระคาย, หยาบ เช่น มือสาก - มือระคาย."
สาก 2,ว.,เสียงดังเช่นนั้น.
สาก 3,สำ.,คำด่า หมายถึง อวัยวะเพศชาย.
สากกี้ 0,น.,"ปุ้งกี๋, เครื่องสาน ทำด้วยหวาย หรือพลาสติก รูปคล้ายเปลือกหอยแครง สำหรับใช้โกยดิน"
สากเชเคย 0,น.,สากตำกะปิ.
สากซ้อมสาร 0,น.,สากตำข้าวสาร ยาวประมาณเมตรครึ่ง กลางคอดสำหรับใช้มือจับ.
สากทิ่มจูด 0,น.,สากใช้ตำกระจูด.
สากทุบ 0,น.,สากที่มีลักษณะเหมือนค้อน สำหรับทุบ หรือตำข้าวเปลือกให้เป็นข้าวกล้อง.
สากเบือ 0,น.,อวัยวะเพศชาย
สากี้ 0,น.,ปุ้งกี๋ (ดู สะกี้).
ส้ากี้ 0,น.,"ปุ้งกี๋, เครื่องสาน ทำด้วยหวาย หรือพลาสติก รูปคล้ายเปลือกหอยแครง สำหรับใช้โกยดิน"
สาคลาย 0,ก.,ทุเลา (ดู คลาย ก. ๒.).
สาคลาย 0,ก.,"หาย, พ้นจากโรค, ทุเลา, ผ่อนคลาย, สบายใจขึ้น"
สาคู 0,น.,ชื่อปาล์ม กาบใบมีทั้งมีหนามและไม่มีหนาม ใบใช้มุงหลังคา ไส้ในลำต้นแก่ใช้ทำแป้งที่ใช้เป็นอาหารได้ (ม. sagu).
ส้างกรวด 0,น.,นกกระทาดง
ส้างกรวด 1,น.,นกกระทาดง (ดู สังสีโรก).
สางคลาง 0,น.,"สังคัง, โรคผิวหนังชนิดหนึ่งที่เกิดจากเชื้อรา ลักษณะเป็นผื่นแดง มีสะเก็ด มีอาการคันมาก มักเป็นบริเวณในร่มผ้า"
สางคลาง 1,น.,สังคัง (ดู สังคัง).
ส้างโฉด 0,น.,นกกระทาดง
ส้างโฉด 1,น.,นกกระทาดง (ดู สังสีโรก).
ส่าจ่ำ 0,น.,"คนเฝ้ารางแร่ช่วงที่ ๓ (จ., ภ.ก.)."
สาจี้หญาบ 0,ก.,รู้สึกไม่พอใจขึ้นมาทันที.
ส้าซู่ 0,ว.,ดันทุรัง (ภ.ก.).
สาด 0,น.,"เสื่อ, เครื่องสานชนิดหนึ่งสำหรับปูนั่งและนอน."
สาดคล้า 0,น.,เสื่อที่สานด้วยเปลือกของต้นคล้า.
สาดจูด 0,น.,เสื่อที่สานด้วยกระจูด.
สาดทราย 0,สำ.,ล้างหนี้.
สาดบาด 0,ว.,"อุจาดตา, ทิ้งไว้เกลื่อนกลาดอย่างไม่เห็นคุณค่า เช่น ข้าวราคาแพงอย่าทิ้งจาดบาด"
สาดบาด 1,น.,"ไข้สันนิบาต, ไข้ชนิดหนึ่งมีอาการสั่นเทิ้มชัก กระตุกและเพ้อ."
สาดบาด 2,น.,"โรคห่า, โรคระบาดอย่างร้ายแรง เป็นเหตุให้คนตายจำนวนมาก เช่น อหิวาตกโรค, กาฬโรค."
สาดบาด 3,ว.,ทิ้งไว้เกลื่อนกลาดอย่างไม่เห็นคุณค่า (ดู จาดบาด ว. ๒.).
สาดหนัง 0,น.,เสื่อที่ทำจากหนังวัวหรือหนังควายตากแห้งใช้ปูนั่งหรือปูนอนเพื่อป้องกันศัตรูโดยเฉพาะนายหนังตะลุงที่มีชื่อเสียงมาก ต้องเอาสาดหนังปูนั่งเวลาแสดงด้วย นอกจากนั้นยังใช้ตากข้าวเปลือก และสิ่งของอื่นได้ด้วย.
สาดหนัง 1,ก.,"ซัดไป, วักน้ำหรือตักน้ำซัดออกไปโดยแรง, ซัดหรือกระเซ็นเข้ามา, ส่องแสงเข้ามา, กระจาย เช่น สาดน้ำ."
สาตัว 0,ก.,รู้สึกตัว.
สาตัว 1,ก.,ร้อนตัว ทำนอง “ วัวสันหลังหวะ ”.
สาทา 0,ก.,สะทกสะท้าน (ดู สะทา).
สาทา 0,ก.,"สะทกสะท้าน, รู้สึกเกรงกลัวจนตัวสั่น"
สาทู 0,น.,ชื่อสัตว์ชนิดหนึ่ง คล้ายหนู กลิ่นสาบมาก
สาโท 0,น.,ชื่อสัตว์ชนิดหนึ่ง คล้ายหนู กลิ่นสาบมาก
สาน 0,ก.,"ประสาน, ทำให้เข้ากันสนิท, เชื่อม."
สาน 1,ก.,"จักสาน, ผูกมัดหรือสานสิ่งต่าง ๆ เช่น สานสาด - สานเสื่อ."
สาน 2,ก.,"ชน, ปะทะ."
ส้าน 0,น.,"ต้นมะตาด, ชื่อไม้ต้น ใบใหญ่ ผลกลม ๆ มียาง เป็นเลือดหรือเมือก ดอกสีเหลือง."
สานไถ 0,น.,ลิ่มรองบนส่วนต่อของคันไถกับหางไถ.
สาบ 0,น.,"ต้นสาบเสือ, ชื่อไม้ล้มลุก เป็นวัชพืชชิ้นทั่วไป ใบมีกลิ่นเหม็น ใช้ทำยาได้"
สาบ 1,น.,ต้นสาบเสือ (ดู ขี้ไก น.๓.).
สาบ 2,น.,"แมลงสาบ, ชื่อแมลงชนิดหนึ่ง รูปร่างรูปไข่ ค่อนข้างแบนราบ หัวซ่อนอยู่ใต้อก หนวดยาวคล้ายเส้นด้าย ขายาว มีหนามคลุม ตัวเต็มวัยมีทั้งปีกและไม่มีปีก มักอาศัยอยู่ตามบ้านเรือน"
สาบ 3,น.,กลิ่นเหม็นชนิดหนึ่ง เช่น กลิ่นเสื้อผ้าที่ใช้แล้ว แต่ยังไม่ได้ซัก กลิ่นตัว.
ส้าบน 0,น.,สบู่ (ดู ส้าบู).
ส้าบน 0,น.,สบู่
สาบแร้งสาบกา 0,น.,"ชื่อไม้ล้มลุก มี ๒ ชนิด ชนิดหนึ่งคล้ายต้นยาสูบใบเป็นขน มีกลิ่นฉุน ดอกสีฟ้าอ่อน, อีกชนิดหนึ่ง ดอกสีขาว ต้นสูงกว่าชนิดแรก"
สาบสั้น 0,สำ.,"คนใจแคบ, ไม่เอื้อเฟื้อ"
สาบเสือ 0,น.,"ต้นสาบเสือ, ชื่อไม้ล้มลุก เป็นวัชพืชชิ้นทั่วไป ใบมีกลิ่นเหม็น ใช้ทำยาได้"
สาบเสือ 1,น.,ต้นสาบเสือ (ดู ขี้ไก น. ๓).
สาบเหมือนแร้งแก 0,สำ.,"เหม็นสาบมาก, เรียกผู้ที่กลิ่นตัวแรง"
สาบเหมือนลูกอ้อ 0,สำ.,เรียกคนที่ศีรษะมีกลิ่นเหม็นเนื่องจากไม่ได้สระผมว่าหัวสาบเหมือนลูกอ้อ.
สาบเหมือนลูกอ้อ 1,ก.,"สาปแช่ง, นิมิตรูปด้วยเวทมนตร์คาถา."
สาบเหมือนสาทู 0,สำ.,"เหม็นสาบมาก, เรียกผู้ที่กลิ่นตัวแรง"
ส้าบู 0,น.,สบู่
ส้าโบ 0,น.,สบู่ (ดู ส้าบู).
ส้าโบ 0,น.,สบู่
สาม 0,น.,"สาม, จำนวนสองบวกหนึ่ง."
ส่ามก๊อก 0,น.,"ชื่อการพนันชนิดหนึ่ง ใช้ตัวหมากรุกจีน ซึ่งทำจากไม้หรือพลาสติกมาเล่น (ภ.ก., พ.ง.)"
สามกุก 0,ลัก.,ลักษณนามเรียกการขันของนกเขา.
สามควน 0,น.,ชื่อตะกวดชนิดหนึ่ง มีพิษ กัดถึงตาย
ส่ามเซ้ง 0,น.,"นักเลง, อันธพาล (ก.บ., ภ.ก., พ.ง)."
ส่ามเซ้ง 1,น.,"สำรับที่จัดไว้ไหว้เจ้าหรือผีบรรพบุรุษประกอบด้วยเส้น บะหมี่ หมู ไก่ (ภ.ก., พ.ง.)."
สามเดือน 0,น.,"บานไม่รูโรย, ชื่อไม้ล้มลุกลำต้นค่อนข้างแข็ง แตกแขนงเป็นพุ่มเล็ก ๆ ดอกกลมสีขาว ชมพู หรือม่วงแดง"
สามเดือน 1,น.,บานไม่รู้โรย (ดู กุนหนี).
สามเดือน 2,น.,ชื่อข้าวพันธุ์พื้นเมือง (ก.บ.).
สามน้ำ 0,น.,ลุ่มน้ำซึ่งเป็นที่รวมของน้ำจืด น้ำกร่อยและน้ำเปรี้ยว เช่น ลุ่มน้ำปากพนัง.
สามน้ำ 1,สำ.,ลักษณะหญิงดีโดยปริยายหมายถึง น้ำคำดี น้ำใจดี และน้ำมือดี.
สามน้ำไม่เปื้อย 0,สำ.,เชื่องช้า อืดอาดยืดยาด
สามพอน 0,น.,ชื่อไม้ต้นขนาดใหญ่ชนิดหนึ่ง ใช้ทำเครื่องเรือนได้.
สามรอยต่อ 0,น.,"ต้นเพชรสังฆาต, ชื่อไม้เถาชนิดหนึ่ง เถาเป็นเหลี่ยม ผิวใบเรียบ ใช้ทำยาได้"
สามโลกควน 0,น.,ชื่อสัตว์จำพวกเรไร ขนาดตัวโตกว่า ปีกสีน้ำตาล ส่งเสียงดังมาก
สามโลกควน 1,น.,ชื่อสัตว์จำพวกเรไรขนาดตัวโตกว่า (ดู แหย้งแหย้ว).
สามส้าง 0,น.,เมรุที่สร้างเป็นเสาสี่เสา มีผ้า หรือกระดาษสีขาวทำเป็นเพดาน
สามสิบ 0,น.,ชื่อไม้เถา มีเหง้าและรากใต้ดินคล้ายกระชาย ลำต้นบนดินเลื้อยพัน มีหนามแหลม ใบเดี่ยวเป็นเส้นแคบยาว เรียงสลับ ดอกสีขาว เป็นช่อ ผลค่อนข้างกลมสีแดงหรือสีม่วงแดง.
สามสิบกลีบ 0,น.,กระเพาะย่อยอาหารในสัตว์จำพวกเคี้ยวเอื้อง.
สามสิบสองหาบ 0,น.,ชื่อไม้ล้มลุกจำพวกหญ้าชนิดหนึ่ง ใบเดี่ยวมนรียาว ขอบใบเป็นจัก ต้นและใบมีขน ออกดอกเป็นกระจุกสีม่วงอ่อน
สาเมฺล่อ 0,สำ.,สมน้ำหน้า
สาย 0,น.,"สาหร่าย มีหลายชนิด เช่น สายใบ - สาหร่ายใบ, สายหางรอก - สาหร่ายหางกระรอก, สายหางม้า - สาหร่ายหางม้า"
สาย 1,น.,สิ่งที่มีลักษณะเป็นเส้นเป็นแนวยาว.
สาย 2,ก.,"ส่าย, แกว่งไปมา, ย้ายมา."
สาย 3,ว.,"สาย (เวลา), ช้ากว่าเวลาที่กำหนด."
สาย 4,ลัก.,"เส้น, แนว เช่น สายคอ ๒ สาย - สร้อยคอ ๒ เส้น, ลำน้ำ ๒ สาย."
สาย 5,ลัก.,เถา เช่น ชั้น ๒ สาย - ปิ่นโต ๒ เถา.
สายข้าว 0,น.,เชือกสำหรับผูกทุ่นอวนลอย.
สายคอ 0,น.,สร้อยคอ.
สายคะนง 0,น.,"สายซุง, เชือกที่ใช้ผูกว่าว"
สายคัก 0,น.,สายบังเหียน.
สายค่าย 0,น.,รั้ว
สายไค 0,น.,เชือกที่ผูกติดกับกระโจมแห.
สายใจ 0,น.,อวัยวะเพศชาย
สายใจ 1,สำ.,อวัยวะเพศชาย (ดู หัวดอ).
สายดือ 0,น.,สายสะดือ.
สายเดียง 0,น.,"สายราว, เชือกที่ขึงไว้ตากผ้าตามระเบียงบ้าน, ราวตากสบงจีวรของพระสงฆ์ ซึ่งใช้หวายทั้งเส้น"
