ยุทโธปกรณ์,น.,วัสดุอุปกรณ์ทั้งปวงและยุทธภัณฑ์ทุกชนิดซึ่งใช้ในราชการทหาร รวมทั้งเครื่องมือยานยนต์ ชิ้นส่วนอะไหล่สาธารณูปโภคอันจำเป็นเพื่อปฏิบัติการรบหรือเพื่อดำรงและสนับสนุนกิจกรรมทางทหารโดยไม่คำนึงถึงว่าจะมีความมุ่งหมายทางธุรการหรือทางการรบ.
ยุบ,ก.,"ทรุด เช่น ดั้งจมูกยุบ, บุบเข้าไป เช่น หัวกะโหลกยุบ หน้าหม้อรถยนต์ยุบ, ลด, ลดลง, เช่น พุงยุบ ฝียุบ, เรียกจังหวะรำของโขนละครเมื่อทำตัวให้เตี้ยลงหลังจากยืดตัวขึ้นก่อนแล้ว"
ยุบ,ก.,"เลิก, ยกเลิก, เช่น ยุบกระทรวง ยุบตำแหน่ง"
ยุบ,ก.,ทำให้หลอมละลายเพื่อทำให้เป็นอีกอย่างหนึ่ง เช่น ยุบกำไลทำแหวน.
ยุ่บ,ว.,"อาการที่เคลื่อนไหวกระดุบกระดิบของสัตว์เล็ก ๆ อย่างหนอน มด ปลวก จำนวนมาก ๆ เช่น มดขึ้นยุ่บ หนอนไต่ยุ่บยั่บ, โดยปริยายใช้แก่คนจำนวนมาก ๆ เช่น ที่สนามหลวงคนเดินขวักไขว่ยุ่บยั่บไปหมด."
ยุบข้อ,น.,"ท่ากายบริหารอย่างหนึ่งมี ๒ แบบ แบบหนึ่งเริ่มด้วยท่านอนทอดตัวลงเกือบถึงพื้น มือและปลายเท้าทั้ง ๒ ข้างยันพื้นไว้ งอแขนให้ศอกแนบลำตัว หน้าเงย แล้วเหยียดแขนพร้อมกับยกตัวขึ้น แล้วงอแขนพร้อมทั้งลดตัวลงกลับไปอยู่ในท่าเดิม อีกแบบหนึ่งเริ่มด้วยท่านอน มือและปลายเท้าทั้ง ๒ ข้างยันพื้นไว้ แขนเหยียดตรง หน้าเงย แล้วงอแขนให้ศอกแนบลำตัวพร้อมกับทอดตัวลงเกือบถึงพื้น แล้วเหยียดแขนพร้อมทั้งยกตัวขึ้นกลับไปอยู่ในท่าเดิม, ภาษาปากว่า วิดพื้น."
ยุบยอบ,ก.,"น้อยลง, จนลง, ขัดสนลง, เช่น ใช้เท่าไร ๆ เงินก็ไม่ยุบยอบ."
ยุบยับ,ว.,"อาการที่เสียแล้วเสียอีก, ย่อยยับ, เช่น เสียเงินยุบยับ."
ยุ่บยั่บ,ว.,"อาการที่เคลื่อนไหวกระดุบกระดิบของสัตว์เล็ก ๆ อย่างหนอน มด ปลวก จำนวนมาก ๆ เช่น มดขึ้นยุ่บ หนอนไต่ยุ่บยั่บ, โดยปริยายใช้แก่คนจำนวนมาก ๆ เช่น ที่สนามหลวงคนเดินขวักไขว่ยุ่บยั่บไปหมด."
ยุบยิบ,ว.,"ละเอียดเกินไป, ถี่ถ้วนเกินไป, เช่น ตรวจยุบยิบ คิดยุบยิบทุกบาททุกสตางค์"
ยุบยิบ,ว.,อาการคันน้อย ๆ ทั่วทั้งตัวหรือเฉพาะบริเวณใดบริเวณหนึ่ง เช่น คันยุบยิบไปทั้งตัว คันจมูกยุบยิบ.
ยุบล,น.,"ข้อความ, เรื่องราว."
ยุพ-,ว.,"หนุ่ม, สาว."
ยุพดี,น.,"หญิงรุ่น, หญิงสาว."
ยุพยง,น.,"หญิงกำลังสาวสวย, นางงาม."
ยุพเยาว์,น.,"หญิงกำลังสาวสวย, นางงาม."
ยุพราช,น.,รัชทายาทที่พระมหากษัตริย์ทรงสถาปนาขึ้นเป็นตำแหน่งสมเด็จพระยุพราช โดยพระราชทานยุพราชาภิเษกหรือโดยพิธีอย่างอื่นสุดแท้แต่จะทรงพระกรุณาโปรดเกล้าฯ.
ยุพเรศ,น.,"นางกษัตริย์, หญิงสาวสวย."
ยุพา,น.,หญิงสาวสวย.
ยุพาน,น.,หญิงสาวสวย.
ยุพาพาล,น.,หญิงสาวสวย.
ยุพาพิน,น.,หญิงสาวสวย.
ยุ่มย่าม,ว.,"ยุ่ง, เกะกะไม่เป็นระเบียบเรียบร้อย, เช่น หนวดเครายุ่มย่าม"
ยุ่มย่าม,ว.,"อาการที่เข้าไปยุ่งเกี่ยวในเรื่องที่มิใช่หน้าที่ของตน เช่น เขาชอบเข้าไปยุ่มย่ามในเรื่องของคนอื่น, อาการที่เข้าไปยุ่งเกี่ยวในสถานที่หวงห้ามหรือในที่ที่ตนไม่มีหน้าที่เกี่ยวข้อง เช่น ห้ามเข้าไปยุ่มย่ามในเขตหวงห้าม เขาชอบเข้าไปยุ่มย่ามในสถานที่ราชการ."
ยุไม่ขึ้น,ก.,หนุนเท่าไร ๆ ก็ไม่ยอมทำตาม.
ยุ่ย,ว.,ผุหรือเปื่อยจนสลายตัวได้ง่าย เช่น ไม้เนื้อยุ่ย ดินยุ่ย.
ยุ้ย,ว.,ยื่นโป่งออกมาอย่างน่ารักน่าเอ็นดู เช่น แก้มยุ้ย เด็กพุงยุ้ย.
ยุยง,ก.,ยุหรือส่งเสริมให้ทำในสิ่งที่ไม่ดีหนักขึ้น เช่น ยุยงให้หนีโรงเรียน ยุยงให้เล่นการพนัน.
ยุแยง,ก.,ยุให้ทั้ง ๒ ฝ่ายแตกกัน.
ยุแยงตะแคงแซะ,ก.,ยุให้ทั้ง ๒ ฝ่ายแตกกัน.
ยุแยงตะแคงรั่ว,ก.,ยุให้ทั้ง ๒ ฝ่ายแตกกัน.
ยุแยงตะแคงแส่,ก.,ยุให้ทั้ง ๒ ฝ่ายแตกกัน.
ยุรบาตร,ก.,"เดิน, ใช้ว่า ยะยุรบาตร ก็มี."
ยุรยาตร,ก.,"เดิน, แผลงเป็น ยวรยาตร หรือ ยัวรยาตร ก็มี."
ยุว-,น.,ชายหนุ่ม.
ยุว-,ว.,"หนุ่ม, รุ่น."
ยุวชน,น.,เด็กวัยรุ่น.
ยุวดี,น.,"หญิงรุ่น, หญิงสาว."
ยุวราช,น.,พระราชกุมารที่ได้รับอภิเษกหรือทรงรับแต่งตั้งอยู่ในตำแหน่งที่จะสืบราชสมบัติเป็นพระเจ้าแผ่นดินต่อไป.
ยุวราชา,น.,พระราชกุมารที่ได้รับอภิเษกหรือทรงรับแต่งตั้งอยู่ในตำแหน่งที่จะสืบราชสมบัติเป็นพระเจ้าแผ่นดินต่อไป.
ยุวา,น.,ชายหนุ่ม.
ยุวา,ว.,"หนุ่ม, รุ่น."
ยุวาน,น.,ชายหนุ่ม.
ยุวาน,ว.,"หนุ่ม, รุ่น."
ยุส่ง,ก.,หนุนให้ทำโดยไม่ห้ามปราม.
ยุหงิด,น.,มุหงิด.
ยุหบาตร,น.,กระบวนทัพ.
ยุแหย่,ก.,ยุให้ทั้ง ๒ ฝ่ายแตกกัน.
ยุแหย่,ก.,ยุให้เขาแตกกัน เช่น ยุแหย่ให้เขาแตกสามัคคี.
ยุให้รำตำให้รั่ว,ก.,"ยุให้แตกกัน, ยุให้ผิดใจกัน."
ยู,น.,ไม้ยุงปัดทำด้วยต้นขัดมอน เรียกว่า ไม้ยู.
ยู่,ก.,"บู้, ย่น, เยิน, เช่น ฟันต้นไม้เสียมีดยู่ คมมีดยู่."
ยูง ๑,น.,"ชื่อนกขนาดใหญ่ชนิด Pavo muticus Linn. ในวงศ์ Phasianidae หงอนขนบนหัวเป็นกระจุก หนังข้างแก้มสีเหลือง ขนส่วนคอ หลัง ตลอดถึงปลายหางสีเขียว ในฤดูผสมพันธุ์ตัวผู้จะมีขนคลุมโคนขนหางด้านบนยื่นยาวและมีแวว เพื่อใช้รำแพนให้ตัวเมียสนใจ อาศัยอยู่ตามป่าโปร่ง ปรกติใกล้ลำธารที่มีหาดทราย มักร้องตอนเช้าหรือพลบคํ่า ทำรังแบบง่าย ๆ ตามพื้นดิน กินเมล็ดพืช แมลง และสัตว์ขนาดเล็ก ในประเทศไทยมี ๒ ชนิดย่อย คือ ยูงใต้ (P.m. muticus Linn.) และยูงเหนือ (P.m. imperator Delacour), ยูงไทย ก็เรียก."
ยูง ๒,น.,"ชื่อไม้ต้นขนาดใหญ่ชนิด Dipterocarpus grandiflorus (Blanco) Blanco ในวงศ์ Dipterocarpaceae เนื้อไม้ใช้ในการก่อสร้าง, ยางยูง ก็เรียก."
ยูงไทย,น.,ดู ยูง ๑.
ยูงฟ้อนหาง,น.,ชื่อท่ารำแบบหนึ่ง โดยมือทั้งสองตั้งวง แขนตึงส่งไปด้านหลัง เอียงศีรษะข้างใดก็ได้.
ยูงอินเดีย,น.,ชื่อนกขนาดใหญ่ชนิด Pavo cristatus Linn. ในวงศ์ Phasianidae ลักษณะทั่วไปคล้ายนกยูงไทย แต่หงอนขนบนหัวแผ่เป็นรูปพัด หนังข้างแก้มสีขาว ขนส่วนคอและอกด้านบนสีน้ำเงิน กินเมล็ดพืช แมลง และสัตว์ขนาดเล็ก เป็นนกที่นำเข้ามาในประเทศไทย มีถิ่นกำเนิดในประเทศอินเดีย.
ยูโด,น.,ศิลปะการต่อสู้และป้องกันตัวอย่างหนึ่งของชาวญี่ปุ่นโดยไม่ต้องใช้อาวุธ.
ยูถะ,น.,"ฝูง, หมู่."
ยูถิกา,น.,ต้นพุทธชาด.
ยูปะ,น.,เสาที่ปักอยู่กลางโรงพิธีสำหรับผูกสัตว์ที่จะบูชายัญ.
ยู่ยี่,ว.,อาการที่ย่นหรือยับจนเสียรูป เช่น ผ้ายับยู่ยี่ ขยำกระดาษเสียยับยู่ยี่
ยู่ยี่,ว.,อาการที่หน้าตาไม่สดชื่นแจ่มใส เช่น ตื่นนอนมาใหม่ ๆ หน้าตายู่ยี่.
ยูรยาตร,ก.,"เดิน, แผลงเป็น ยวรยาตร หรือ ยัวรยาตร ก็มี."
ยูริก,น.,กรดอินทรีย์ชนิดหนึ่ง มีสูตร C_5H_4N_4O_3 ลักษณะเป็นของแข็ง ไม่มีสี ละลายนํ้าได้เล็กน้อย มีปรากฏอยู่เป็นจำนวนน้อยในปัสสาวะและในโลหิต ผู้ที่ป่วยเป็นโรคเกาต์ คือมีอาการบวมปวดบริเวณข้อกระดูก จะปรากฏมีเกลือโซเดียมและโพแทสเซียมของกรดนี้เกาะอยู่ที่ข้อกระดูกนั้น ๆ เรียกว่า กรดยูริก.
ยูเรนัส,น.,"ชื่อดาวเคราะห์ดวงที่ ๗ ในระบบสุริยะ มองไม่เห็นด้วยตาเปล่า อยู่ห่างดวงอาทิตย์ประมาณ ๒,๘๗๐ ล้านกิโลเมตร มีเส้นผ่าศูนย์กลาง ๕๐,๘๐๐ กิโลเมตร, ดาวมฤตยู ก็เรียก."
ยูเรเนียม,น.,ธาตุลำดับที่ ๙๒ สัญลักษณ์ U เป็นโลหะ ลักษณะเป็นของแข็ง สีขาว เนื้อแข็ง หลอมละลายที่ ๑๑๓๒ °ซ. เป็นธาตุกัมมันตรังสีที่มีปรากฏในธรรมชาติ ใช้ประโยชน์เป็นเชื้อเพลิงนิวเคลียร์.
ยูโรเพียม,น.,ธาตุลำดับที่ ๖๓ สัญลักษณ์ Eu เป็นโลหะ ลักษณะเป็นของแข็ง สีเทา เนื้ออ่อนมาก หลอมละลายที่ ๘๒๖ °ซ. ใช้ประโยชน์นำไปดูดกลืนนิวตรอนเพื่อควบคุมปฏิกิริยานิวเคลียร์ ใช้ประกอบเป็นตัวเรืองแสงในเครื่องรับโทรทัศน์สีเป็นต้น.
ยูษะ,น.,นํ้าต้มจากผักต่าง ๆ.
เย้,ว.,"เอียงจนเสียรูปโดยมีอาการทำท่าจะทลายลง เช่น ห้องแถวเย้จวนจะพัง, เฉ, ไม่ตรง, เบนหรือเอียงไป, เช่น เขียนหนังสือแถวเย้."
เย ๆ,ว.,เสียงร้องไห้ของเด็ก ๆ ที่ทอดเสียงยาว ๆ และไม่ใคร่หยุด เรียกว่า ร้องเย ๆ.
เยง,ก.,"กลัว, เกรง, ใช้ว่า แยง ก็มี."
เยซู,น.,นามศาสดาของศาสนาคริสต์.
เย็ด,ก.,ร่วมประเวณี.
เย็น ๑,น.,เวลาใกล้คํ่า ประมาณ ๑๖-๑๘ นาฬิกา.
เย็น ๒,ว.,"มีความรู้สึกตามผิวหนังเหมือนถูกน้ำแข็งเป็นต้น, หนาว, หายร้อน, ตรงข้ามกับ ร้อน"
เย็น ๒,ว.,ไม่รู้สึกกระวนกระวาย เช่น เย็นใจ.
เย็นเจี๊ยบ,ว.,เย็นมาก เช่น น้ำแข็งเย็นเจี๊ยบ.
เย็นใจ,ก.,"สบายใจ, ไม่ยุ่งใจ, ไม่ต้องกังวลใจ, ไม่ร้อนใจ, เช่น เรื่องนี้เย็นใจได้ สำเร็จแน่."
เย็นฉ่ำ,ว.,เย็นชุ่มชื้น เช่น หลังฝนตกอากาศเย็นฉ่ำ.
เย็นเฉียบ,ว.,เย็นจัด เช่น หน้าหนาวน้ำในลำธารเย็นเฉียบ.
เย็นเฉื่อย,ว.,เย็นเพราะลมพัดมาเรื่อย ๆ เช่น ตรงนี้ลมพัดเย็นเฉื่อย
เย็นเฉื่อย,ว.,มีอารมณ์เรื่อย ๆ ช้า ๆ เช่น เขาเป็นคนอารมณ์เย็นเฉื่อย.
เย็นชา,ว.,"แสดงอาการเฉยเมยไม่สนใจใยดี เช่น เดี๋ยวนี้เขาแสดงอาการเย็นชา, ชาเย็น ก็ว่า."
เย็นชืด,ว.,"เย็นอย่างสิ่งไม่มีชีวิต เช่น เขานอนตายตัวเย็นชืด, เย็นจนหมดรสชาติ เช่น แกงเย็นชืด."
เย็นชื่น,ว.,เย็นสบาย เช่น ฝนตกใหม่ ๆ อากาศเย็นชื่น.
เย็นชื้น,ว.,เย็นอย่างมีไอน้ำซึมซาบอยู่ เช่น ฝนตกติดกันหลายวันอากาศเย็นชื้น.
เย็นตา,ว.,"ชื่นตา, สบายตา, ดูแล้วสบายใจ, เช่น สีเขียวอ่อนเย็นตา."
เย็นตาโฟ,น.,อาหารแบบจีนอย่างหนึ่งคล้ายก๋วยเตี๋ยว แต่ใส่ผักบุ้ง ปลาหมึกแช่ด่าง เต้าหู้ เลือดหมู ลูกชิ้นปลา แมงกะพรุน และน้ำเต้าหู้ยี้หรือซอสมะเขือเทศ.
เย็นเตาโฟ,น.,อาหารแบบจีนอย่างหนึ่งคล้ายก๋วยเตี๋ยว แต่ใส่ผักบุ้ง ปลาหมึกแช่ด่าง เต้าหู้ เลือดหมู ลูกชิ้นปลา แมงกะพรุน และน้ำเต้าหู้ยี้หรือซอสมะเขือเทศ.
เย็นยะเยือก,ว.,"อาการที่รู้สึกหนาวสะท้านถึงขั้วหัวใจ, เย็นเยือก หรือ เยือก ก็ว่า."
เย็นเยียบ,ว.,"อาการที่รู้สึกเย็นจับขั้วหัวใจเพราะหวาดกลัวเป็นต้น เช่น เข้าไปในป่าช้ากลางคืนรู้สึกเย็นเยียบ, เยียบเย็น ก็ว่า."
เย็นเยือก,ว.,"อาการที่รู้สึกหนาวสะท้านถึงขั้วหัวใจ เช่น บนยอดดอยน้ำค้างตกเย็นเยือก หน้าหนาวอากาศบนภูเขาเย็นเยือก, เย็นยะเยือก หรือ เยือก ก็ว่า."
เย็นวาบ,ว.,อาการที่รู้สึกเย็นในทันทีทันใดแล้วก็หายไป เช่น ลมพัดกระโชกเข้ามารู้สึกเย็นวาบ.
เย็นวูบ,ว.,อาการที่ความเย็นมากระทบตัวโดยฉับพลันแล้วก็หายไป เช่น เข้าไปในห้องปรับอากาศรู้สึกเย็นวูบ.
เย็นหู,ว.,"รื่นหู, ไม่ขัดหู, ฟังแล้วสบายใจ, เช่น พูดจาไพเราะนุ่มนวลฟังแล้วเย็นหู เสียงเขาฟังแล้วเย็นหู."
เย็บ,ก.,"ทำให้ติดกันโดยใช้เข็มร้อยด้ายหรือเชือกเป็นต้นแทงขึ้นแทงลง เช่น เย็บผ้า เย็บกระสอบ, ใช้ตอกหรือหวายเป็นต้นที่มีปลายแหลมแทงขึ้นลงเพื่อร้อยสิ่งใดสิ่งหนึ่งให้ติดกัน เช่น เย็บจาก, ใช้เครื่องอุปกรณ์กดทำให้กระดาษติดกันด้วยลวดเย็บ เช่น เย็บกระดาษ, กลัดให้ติดกันด้วยไม้กลัดเป็นต้น เช่น เย็บกระทง."
เย็บกี่,ก.,ใช้ด้ายเย็บแผ่นกระดาษด้วยวิธีร้อยทีละปึกเล็ก ๆ เพื่อประกอบเข้าเป็นเล่มในลักษณะที่ทำให้เปิดเล่มได้เต็มที่.
เย็บจักร,ก.,เย็บด้วยจักร.
เย็บด้าย,ก.,ใช้ด้ายเย็บแผ่นกระดาษเพื่อประกอบเข้าเป็นเล่ม.
เย็บแบบ,ก.,เย็บกลีบดอกไม้ติดบนใบตองเป็นรูปต่าง ๆ.
เย็บปาก,ก.,ปิดปากเงียบไม่ยอมพูด.
เย็บแผล,ก.,ทำให้แผลติดกันโดยใช้เอ็นหรือไหมเย็บ หรือใช้ปลิงเกาะ.
เย็บมือ,ก.,เย็บด้วยมือ.
เย็บมุงหลังคา,ก.,เย็บอก.
เย็บล้มตะเข็บ,ก.,เรียกวิธีเย็บผ้าแบบหนึ่ง โดยเย็บ ๒ ครั้ง เมื่อเย็บครั้งหนึ่งแล้ว จับตะเข็บให้ราบลง แล้วเย็บลงไปบนตะเข็บนั้นอีกครั้งหนึ่ง.
เย็บลวด,ก.,ใช้ลวดเย็บแผ่นกระดาษเพื่อประกอบเข้าเป็นเล่ม.
เย็บเล่ม,ก.,ใช้ด้ายหรือลวดเย็บแผ่นกระดาษเพื่อประกอบเข้าเป็นเล่ม.
เย็บสวน,ก.,เย็บกลีบดอกไม้และใบไม้บนใบมะพร้าวหรือก้านกล้วยทำเป็นแถบยาวสำหรับประดับตกแต่งงานเครื่องสด.
เย็บอก,ก.,"ใช้ด้ายหรือลวดเย็บแผ่นกระดาษตามแนวกึ่งกลาง เพื่อพับประกอบเข้าเป็นเล่ม, เย็บมุงหลังคา ก็เรียก."
เยภุย-,ว.,"มาก, ชุกชุม."
เยภุยนัย,น.,วิธีที่คนส่วนมากใช้.
เยภุยยะ,ว.,"มาก, ชุกชุม."
เยภุยสิกา,น.,ความเห็นข้างมาก.
เย้ย,ก.,พูดหรือกระทำให้ได้อาย ให้เจ็บใจ ให้โกรธ.
