ต่อปากหลากคำ,ก.,พูดยันกันเพื่อพิสูจน์ความจริง.
ตอม,ก.,"กิริยาที่แมลงตัวเล็ก ๆ เช่นแมลงวันเป็นต้นมาเกาะหรือจับหรือบินวนเวียนอยู่ใกล้ ๆ สิ่งใดสิ่งหนึ่ง, โดยปริยายหมายถึงกิริยาอาการที่คล้ายคลึงเช่นนั้น เช่น สาวสวยคนนี้มีชายหนุ่มมารุมตอมมาก."
ต่อม,น.,เม็ดที่ขึ้นตามตัว
ต่อม,น.,อวัยวะของคนและสัตว์ ทำหน้าที่สร้างและหลั่งสารที่มีประโยชน์และมีโทษต่อร่างกาย มี ๒ ชนิด คือ ต่อมไร้ท่อ และ ต่อมมีท่อ.
ต๋อม,ว.,"เสียงอย่างของหนักขนาดเล็กตกลงไปในนํ้า, โดยปริยายหมายความว่า เงียบไป (ใช้แก่กริยาหาย ว่า หายต๋อม)."
ต้อมต๊อก,น.,"ชื่อไม้ล้มลุก ๒ ชนิดในสกุล Physalis วงศ์ Solanaceae คือ ชนิด P. angulata L., ต้อมต๊อก ก็เรียก, และชนิด P. minima L. ใช้ทำยาได้, ทุงเทง หรือ หญ้าต้อมต๊อก ก็เรียก."
ต่อมน้ำ ๑,น.,ฟองอากาศที่ผุดขึ้นปุด ๆ เหนือนํ้า.
ต่อมน้ำ ๑,น.,ดูใน ต่อม.
ต่อมน้ำ ๒,น.,"ชื่อหนึ่งของดาวฤกษ์จิตรา มี ๑ ดวง, ดาวตาจระเข้ ดาวไต้ไฟ ดาวเสือ หรือ ดาวจิตระ ก็เรียก."
ต่อมโลหิต,น.,เลือดระดูผู้หญิง.
ตอม่อ,น.,"เสาขนาดสั้น มักใช้ไม้ไผ่ปักขึ้นสำหรับรับรอดในเรือนเครื่องผูก, ส่วนบนของฐานรากที่รองรับโครงสิ่งก่อสร้าง, เสาตอม่อ ก็ว่า"
ตอม่อ,น.,"เสาชาน เสาแคร่ หรือเสาช่วยค้ำจุนเรือนโดยปักแนบกับเสาเรือน, เสาตอม่อ หรือ เสาหมอ ก็ว่า"
ตอม่อ,น.,ใช้ว่า ตะม่อ ก็มี.
ต่อมือ,ก.,ยื่นมือขวาออกไปรับของ โดยมือซ้ายประคองแขนขวา (ใช้แก่กิริยาที่ผู้น้อยทำต่อผู้ใหญ่ หรือฆราวาสชายทำต่อภิกษุเพื่อแสดงความนอบน้อม).
ต่อย,ก.,"ชก เช่น ต่อยปาก, เอาของแข็งหรือของหนักตีหรือทุบให้ลิ ให้แตก ให้หลุดออก เช่น ต่อยหิน ต่อยมะพร้าว"
ต่อย,ก.,ใช้เหล็กในที่ก้นแทงเอา เช่น ผึ้งต่อย มดตะนอยต่อย
ต่อย,ก.,โดยปริยายหมายความว่า ทำแตก เช่น เด็กเอาจานไปต่อยเสียแล้ว.
ต้อย ๑,ว.,"จ้อย, เตี้ย, เล็ก, น้อย, เช่น ไก่ต้อย."
ต้อย ๒,ว.,"ตามกันไปติด ๆ, ตามหลังไปติด ๆ, เช่น เดินตามต้อย ๆ."
ต้อย ๆ,ว.,"ตามกันไปติด ๆ, ตามหลังไปติด ๆ, เช่น เดินตามต้อย ๆ."
ต้อยตริ่ง,น.,ชื่อเพลงไทยสำเนียงลาว อัตรา ๒ ชั้น หน้าทับสองไม้
ต้อยตริ่ง,น.,ชื่อเพลงไทยประเภทเพลงโหมโรง.
ต้อยต่ำ,ว.,"มีฐานะความเป็นอยู่หรือตำแหน่งหน้าที่ด้อยกว่ากันมากจนเทียบกันไม่ได้, ต่ำต้อย ก็ว่า."
ต้อยติ่ง,น.,"ชื่อไม้ล้มลุก ๒ ชนิดในวงศ์ Acanthaceae คือ ชนิด Hygrophila erecta (Burm. f.) Hochr. ดอกเล็ก สีม่วงแดง เมล็ดใช้ทำยาพอกฝี, ต้อยติ่งไทย ก็เรียก และชนิด Ruellia tuberosa L. ดอกใหญ่ สีม่วงนํ้าเงิน, อังกาบฝรั่ง ก็เรียก."
ต้อยตีวิด,น.,"ชื่อนกขนาดเล็กชนิด Vanellus indicus (Boddaert) วงศ์ย่อย Charadriinae ในวงศ์ Charadriidae ปากยาว หัวสีดำ ขนบริเวณหูสีขาว มีติ่งเนื้อสีแดงพาดระหว่างตาผ่านหน้าผาก ขายาวสีเหลือง วางไข่ในแอ่งตื้น ๆ บนพื้นดิน กินแมลงและสัตว์ขนาดเล็ก ร้องเสียงแตแต้แว้ด, กระต้อยตีวิด ต้อยตีวิด หรือ แต้แว้ด ก็เรียก."
ต่อยหอย,น.,ดู พูดเป็นต่อยหอย.
ตอแย,ก.,เซ้าซี้อย่างต่อเนื่องน่ารำคาญ เช่น นายคนนี้ฉันเดินหนีมาแล้วยังตามมาตอแยอยู่ได้
ตอแย,ก.,ข้องแวะ เช่น คนขี้โมโหอย่าไปตอแยด้วย.
ต่อแย้ง,ก.,"ต่อสู้กัน, สู้รบกันไปมา, เช่น รุมกันพุ่งกันแทง เข้าต่อแย้งต่อยุทธ์ โห่อึงอุจเอาไชย (ลอ)."
ตอร์ปิโด,น.,"อาวุธประเภทลูกระเบิดที่ยิงให้พุ่งไปใต้นํ้า เพื่อทำลายที่หมายในการศึก, ลักษณนามว่า ลูก."
ต่อรอง,ก.,ขอลดหรือเพิ่มเงื่อนไขเพื่อให้เป็นที่ยอมรับของทั้ง ๒ ฝ่าย เช่น ต่อรองราคา ต่อรองเงื่อนไข.
ต้อลม,น.,โรคตาซึ่งเชื่อว่าเกิดจากการถูกลมและแดดบ่อย เป็นผลให้เยื่อหุ้มหัวตาหนาตัว มีสีเหลืองอ่อน อาจกลายเป็นต้อเนื้อได้.
ต่อล้อต่อเถียง,ว.,โต้เถียงยอกย้อนกันไปมา.
ต้อลำไย,น.,โรคตาซึ่งเกิดจากกระจกตาขุ่น.
ต้อลิ้นหมา,น.,โรคตาซึ่งเกิดจากเยื่อตางอกไปบนกระจกตา.
ต่อว่า,ก.,"ตำหนิว่าทำไม่ถูกต้อง, ตำหนิว่าไม่เป็นไปตามที่พูดหรือที่ให้สัญญาไว้."
ต่อว่าต่อขาน,ก.,"ต่อว่า, โต้ตอบซึ่งกันและกัน, เช่น สองคนนั้นกำลังต่อว่าต่อขานกันลั่นบ้าน."
ต่อสาย,ก.,"ติดต่อสื่อสารโดยการหมุนหรือกดเลขหมายบนแป้นเครื่องโทรศัพท์, ต่อโทรศัพท์ ก็ว่า."
ต่อสู้,ก.,"สู้เฉพาะหน้า, รบกัน, ตีรันกัน."
ต่อไส้ ๑,ก.,ประทังชีวิตให้ยืนยาวต่อไปอีกชั่วระยะหนึ่ง. (ดู เบี้ยต่อไส้ ประกอบ).
ต่อไส้ ๑,ก.,ดูใน ต่อ ๒.
ต่อไส้ ๒,น.,ชื่อไม้พุ่มชนิด Allophylus cobbe (L.) Raeusch. ในวงศ์ Sapindaceae ใบเป็นใบประกอบ มีใบย่อย ๓ ใบ ใช้ทำยาได้.
ต่อหน้า,ว.,"ซึ่งหน้า, เฉพาะหน้า."
ต่อหน้าต่อตา,ว.,"ซึ่งหน้า, เฉพาะหน้า."
ต่อหน้ามะพลับ ลับหลังตะโก,ว.,"ต่อหน้าทำเป็นดี แต่พอลับหลังก็นินทาหรือหาทางทำร้าย, หน้าไหว้หลังหลอก ก็ว่า."
ต้อหิน,น.,โรคตาซึ่งเกิดจากความดันภายในลูกตาสูง เป็นผลให้ประสาทตาเสีย.
ตอแหล,ก.,"พูดเท็จ, พูดปั้นเรื่อง, (มักใช้เป็นคำด่า)"
ตอแหล,ก.,ช่างพูดและแสดงกิริยาน่ารัก (ใช้เฉพาะเด็กที่สอนพูด).
ต่อให้,สัน.,"ถึงแม้, แม้แต่, เช่น เรื่องนี้ร้ายแรงมาก ต่อให้เทวดาก็ช่วยไม่ได้."
ต่ออายุ,ก.,"ทำพิธีเพื่อให้มีอายุยืนตามความเชื่อที่มีมาแต่โบราณ, ต่อชะตา หรือ ต่อชาตา ก็ว่า."
ตะ,ก.,ทา ฉาบ หรือแต้มด้วยปรอทที่มีเนื้อทองปนอยู่แล้วไล่ด้วยความร้อนให้ปรอทคายทองติดกับเนื้อโลหะนั้น เช่น พานถมตะทอง ขันถมตะทอง.
ตะกรน ๑,น.,อุปกรณ์ของเครื่องทอผ้า ใช้อย่างกระสวย แต่เป็นกระบอกมีหลอดด้ายอยู่ข้างใน.
ตะกรน ๒,น.,"ขี้ตะกอนที่จับเกรอะอยู่ที่ก้นภาชนะ, กากโลหะที่หลอมแล้วติดอยู่ตามก้นเบ้า, ตะกรัน ก็ว่า."
ตะกรวย,น.,ภาชนะสานด้วยตอก ตาห่าง ๆ คล้ายตาชะลอม ทรงกระบอกปากกลม ก้นมน เช่น เมื่อข้าพเจ้าตัดศีรษะกามะนีขาดแล้ว จะได้รับเอาศีรษะมิให้ทันตกลงถึงดิน ใส่ในตะกรวยซึ่งแขวนไปกับข้างม้านั้นเข้ามาถวายพระองค์ (ราชาธิราช สมิงพระรามอาสา).
ตะกร้อ,น.,ลูกกลมสานด้วยหวายเป็นต้นเป็นตา ๆ สำหรับเตะ
ตะกร้อ,น.,ชื่อกีฬาชนิดหนึ่งที่ใช้ตะกร้อเป็นอุปกรณ์ เช่น ตะกร้อลอดบ่วง ตะกร้อข้ามตาข่าย เซปักตะกร้อ
ตะกร้อ,น.,เครื่องมือสอยผลไม้ ทำด้วยไม้ หวาย หรือไม้ไผ่เป็นซี่ รูปรีคล้ายกาบปลี ตรงปากมีฟันสำหรับสอย นำมาต่อกับด้ามไม้ไผ่
ตะกร้อ,น.,"เครื่องสานยาชัน รูปคล้ายปุ้งกี๋ แต่เล็กกว่า ใช้วิดนํ้าเรือ, กร้อ ก็เรียก"
ตะกร้อ,น.,เครื่องสานรูปทรงกระบอก สำหรับใส่ไว้ในไหหมักน้ำปลาเป็นต้น เพื่อกรองเอาส่วนที่เป็นน้ำ
ตะกร้อ,น.,เครื่องสานมีรูปคล้ายคลึงเช่นนั้น สำหรับสวมปากม้าหรือปากหมาเป็นต้น
ตะกร้อ,น.,"เครื่องดับไฟสานเป็นรูปรีคล้ายปลีกล้วย พันผ้าชุบนํ้า มีด้ามยาว สำหรับดับและคลึงลูกไฟที่มาติดหลังคา บางทีเขียนเป็น กระตร้อ ก็มี เช่น ให้ตรวจเอาพร้าขอกระตร้อน้ำ จงทุกที่พนักงานให้สรัพไว้ (สามดวง), กะต้อ ก็เรียก."
ตะกร่อม,น.,"เครื่องมือครอบจับปูทะเล ตามชายฝั่งทะเล ใช้ไม้ไผ่ต้นเดียวผ่าตอนปลายออกเป็น ๔ ซี่ เหลาซี่เหล่านั้นให้อ่อน เอาวงแหวนทำด้วยไม้ไผ่ หวาย หรือลวด ใส่ในหว่างซี่เหล่านั้นเพื่อบังคับให้ถ่างออก, กะกร่อม หรือ ตะกร่อม ก็เรียก."
ตะกรัน,น.,ดู ตะกรน ๒.
ตะกรับ ๑,น.,"ดินเผาหรือเหล็กเป็นแผ่นเจาะเป็นรู ๆ สำหรับรองถ่านเพื่อให้ลมเดินผ่านได้และขี้เถ้าตกลงข้างล่าง ใช้กับเตาที่ใช้ถ่านหรือฟืนเช่นเตาอั้งโล่, รังผึ้ง ก็ว่า"
ตะกรับ ๑,น.,เหล็กทำเป็นซี่ ๆ มีด้ามจับ สำหรับปิ้งปลาเป็นต้น.
ตะกรับ ๒,น.,ชื่อกกชนิด Cyperus procerus Rottb. ในวงศ์ Cyperaceae ลำต้นเป็นสามเหลี่ยม ใบยาวและแคบ ดอกสีนํ้าตาล.
ตะกรับ ๓,น.,"ชื่อปลาทะเลหรือนํ้ากร่อยชนิด Scatophagus argus (Linn.) ในวงศ์ Scatophagidae ลำตัวสั้น แบนข้าง หัวทู่ ปากเล็ก หางมน เกล็ดเล็กสากมือ สีพื้นลำตัวมีแตกต่างกันมาก อาจเป็นสีเขียว เทา หรือนํ้าตาล ครึ่งบนของลำตัวสีเข้มกว่าและมีแถบสีเทาเข้มหรือดำพาดขวางหลายแนว และแตกเป็นจุดที่ด้านล่างหรือเป็นแต้มเป็นจุดทั่วตัว ครีบต่าง ๆ มีสีเหลืองอ่อนอมเทา, กระทะ หรือ เสือดาว ก็เรียก."
ตะกรับ ๓,น.,ปลากระตรับ. (ดู หมอช้างเหยียบ).
ตะกร้า,น.,ภาชนะสานโปร่งสำหรับใส่สิ่งของ มีรูปต่าง ๆ มีหูหิ้วหรือไม่มีก็ได้.
ตะกราม,น.,ชื่อนกขนาดใหญ่ชนิด Leptoptilos dubius (Gmelin) ในวงศ์ Ciconiidae เป็นนกกระสาที่ใหญ่ที่สุด ปากใหญ่แข็งแรงปลายแหลมตรง หัวสีแดงส้ม ตลอดหัวและลำคอไม่มีขน ตัวสีเทา มีถุงหนังสีส้มห้อยอยู่ทางด้านหน้าของคอ และมีพู่ขนสีขาวรอบฐานคอ ขายาว กินปลาและสัตว์นํ้าจืด.
ตะกรุด,น.,"เครื่องรางอย่างหนึ่ง ทำด้วยโลหะหรือใบลานเป็นต้น โดยปรกติลงคาถาอาคมแล้วม้วนเป็นรูปกลมยาวและกลวง, กะตรุด กะตุด หรือ กระตรุด ก็ว่า."
ตะกรุม ๑,น.,ชื่อนกขนาดใหญ่ชนิด Leptoptilos javanicus (Horsfield) ในวงศ์ Ciconiidae รูปร่างคล้ายนกตะกราม แต่ขนาดเล็กกว่า หัวและคอสีเหลือง ไม่มีถุงหนังและพู่ขนสีขาวที่คอ กินปลาและสัตว์น้ำจืด.
ตะกรุม ๒,น.,ชื่อต้นไม้ชนิดหนึ่ง ใช้ทำยาได้.
ตะกรุมตะกราม,ก.,กิริยาที่ทำไปอย่างผลีผลาม ไม่สำรวมในการบริโภคเป็นต้น.
ตะกละ,ว.,"มักกิน, กินไม่เลือก, เห็นแก่กิน, มักใช้รวมกันว่า ตะกละตะกลาม หมายความว่า อยากกินมาก ๆ, จะกละจะกลาม ก็ว่า."
ตะกลาม,ว.,"มักกิน, กินไม่เลือก, เห็นแก่กิน, มักใช้รวมกันว่า ตะกละตะกลาม หมายความว่า อยากกินมาก ๆ, จะกละจะกลาม ก็ว่า."
ตะกวด,น.,"ชื่อสัตว์เลื้อยคลานชนิด Varanus bengalensis (Gray) ที่พบในประเทศไทยคือ ชนิดย่อย V. b. nebulosus (Gray) ในวงศ์ Varanidae จมูกอยู่ใกล้ตา ปากและคอค่อนข้างยาว ลิ้นแยกเป็น ๒ แฉกยาว ลำตัวกลมยาว สีนํ้าตาลเหลือง หางยาว ซ่อนตัวตามโพรงไม้ในป่า มักหากินตามพื้นดิน ไม่ค่อยลงน้ำ ปีนต้นไม้ได้ดี กินอาหารได้หลากหลายทั้งสัตว์ ซากสัตว์ และพืช, แลน หรือ จะกวด ก็เรียก."
ตะกอ ๑,น.,ส่วนของเครื่องทอผ้า ประกอบด้วยก้านไม้ ๒ อัน ซึ่งมีด้ายร้อยระหว่างก้านไม้ สำหรับแยกเส้นด้ายยืนดึงให้ขึ้นลงเพื่อให้ขัดกับเส้นด้ายพุ่ง.
ตะกอ ๒,ว.,"เพิ่งจะรุ่นหนุ่มรุ่นสาว, ใช้แก่คนหรือสัตว์ (ปรัดเล), ใช้ว่า สะกอ ก็มี"
ตะกอ ๒,ว.,"แรกรุ่น, มักใช้เข้าคู่กับคำ รุ่น หรือ หนุ่ม เป็น รุ่นตะกอ หนุ่มตะกอ."
ตะกอน,น.,สิ่งที่ละลายปนอยู่ในนํ้าหรือของเหลวอื่นแล้วจับตัวตกจมลงนอนก้นภาชนะเป็นต้น
ตะกอน,น.,เศษหิน ดิน แร่ และอินทรียวัตถุที่เกิดจากกระบวนการผุสลายและพังทลาย วัสดุเหล่านี้ถูกน้ำ ลม หรือธารน้ำแข็งพามาสะสม.
ตะกัง,น.,"ชื่อโรคลมชนิดหนึ่ง ตามตำราแพทย์แผนโบราณว่า ทำให้มีอาการปวดหัวเวลาเช้า ๆ ปวดกระบอกตา เมื่อเห็นแดดจะลืมตาไม่ขึ้น เรียกว่า ลมตะกัง, ปะกัง ก็ว่า."
ตะกั่ว,น.,แร่จำพวกโลหะ มีลักษณะอ่อน ละลายตัวง่าย มีหลายชนิดด้วยกัน ได้แก่ ตะกั่วเกรียบ คือ ตะกั่วกรอบ ตะกั่วนม คือ ตะกั่วอ่อน
ตะกั่ว,น.,"ดีบุก (ปรัดเล, ปาเลกัว)"
ตะกั่ว,น.,ธาตุลำดับที่ ๘๒ สัญลักษณ์ Pb เป็นโลหะสีขาวแกมนํ้าเงิน ลักษณะเป็นของแข็ง เนื้ออ่อน หลอมละลายที่ ๓๒๗.๔ °ซ. ใช้ประโยชน์ผสมกับโลหะอื่นให้เป็นโลหะเจือ สารประกอบของตะกั่วใช้ในอุตสาหกรรมสีทา ตะกั่วและสารประกอบของตะกั่วเป็นพิษต่อร่างกาย.
ตะกั่วเกรียบ,น.,ตะกั่วที่ประสมโลหะบางอย่างเช่นสังกะสี นิยมใช้ทำพระเครื่อง.
ตะกั่วขาว,น.,ดู ตะกั่วนม.
ตะกั่วดำ,น.,ดีบุก.
ตะกั่วแดง,น.,"สารประกอบประเภทออกไซด์ของตะกั่ว มีสูตร Pb_3O_4 ลักษณะเป็นผงละเอียดสีแดงเข้ม ใช้ประโยชน์ในอุตสาหกรรมทำสีทา และทำแก้ว, เสน ก็เรียก."
ตะกั่วตัด,ว.,สีนกพิราบหรือสีเทาอมฟ้า.
ตะกั่วนม,น.,"ตะกั่วขาว, ตะกั่วที่มีเนื้อบริสุทธิ์, บริสุทธิ์ ก็เรียก."
ตะกาง,น.,เครื่องดักจระเข้อย่างหนึ่ง ใช้เบ็ดตัวเดียวหรือหลายตัวผูกรวมกัน เบ็ดนี้เกี่ยวเหยื่อไว้ ใช้เชือกซึ่งปลายข้างหนึ่งผูกเบ็ดแล้วโยงไว้กับทุ่นซึ่งเป็นปล้องไม้ไผ่ขนาดใหญ่ ปลายเชือกอีกข้างหนึ่งผูกกับหลักที่อยู่บนบก
ตะกาง,น.,เครื่องล่อใจ
ตะกาง,น.,สะกาง ก็เรียก.
ตะกาด ๑,น.,ที่ดินซึ่งอยู่หลังหาดชายทะเลขึ้นไป แต่มีนํ้าเค็มซึมขึ้นไปถึงได้.
