ยาประสะ,น.,ยาประเภทหนึ่งซึ่งตามปรกติเข้าเครื่องยาสิ่งหนึ่งซึ่งเป็นตัวหลัก มีปริมาณเท่ากับเครื่องยาอื่น ๆ อีกหลายอย่างรวมกัน เรียกชื่อตามเครื่องยาที่เป็นหลัก เช่น ยาประสะขิง คือ เข้าขิงครึ่งหนึ่งกับเครื่องยาอื่น ๆ อีกครึ่งหนึ่ง แต่มีบางชนิดเครื่องยาที่เป็นตัวหลักมีปริมาณไม่ถึงครึ่งหนึ่งของเครื่องยาทั้งหมด เช่น ยาประสะกานพลู.
ยาประสะน้ำนม,น.,ยาบำรุงแม่ลูกอ่อนให้มีน้ำนมมาก.
ยาเป่า,น.,ยาผงใช้เป่าเข้าลำคอ แก้เจ็บคอ.
ยาโป๊,น.,ยาชูกำลังให้กระชุ่มกระชวยเหมือนเป็นหนุ่มสาวขึ้น.
ยาแผนโบราณ,น.,ยาที่มุ่งหมายสำหรับใช้ในการประกอบโรคศิลปะแผนโบราณ หรือการบำบัดโรคสัตว์ ซึ่งอยู่ในตำรายาแผนโบราณที่รัฐมนตรีว่าการกระทรวงสาธารณสุขประกาศ หรือยาที่รัฐมนตรีว่าการกระทรวงสาธารณสุขประกาศเป็นยาแผนโบราณ หรือยาที่ได้รับอนุญาตให้ขึ้นทะเบียนตำรับยาเป็นยาแผนโบราณ.
ยาแผนปัจจุบัน,น.,ยาที่มุ่งหมายสำหรับใช้ในการประกอบวิชาชีพเวชกรรม การประกอบโรคศิลปะแผนปัจจุบัน หรือการบำบัดโรคสัตว์.
ยาฝอย,น.,ดู ยาจืด.
ยาฝิ่น,น.,ยาเสพติดชนิดหนึ่งทำจากยางฝิ่น.
ยาแฝด,น.,ยาหรือสิ่งที่ผู้หญิงให้ผัวกินเพื่อให้หลงรักตัวคนเดียว.
ยาพิษ,น.,สิ่งที่มีพิษมาก กินหรือฉีดเข้าร่างกายเป็นต้นแล้วอาจทำให้ถึงตายได้.
ยาม,น.,ชื่อส่วนแห่งวัน ยามหนึ่งมี ๓ ชั่วโมง รวมวันหนึ่งมี ๘ ยาม
ยาม,น.,ในบาลีแบ่งกลางคืนเป็น ๓ ยาม ยามหนึ่งมี ๔ ชั่วโมง เรียกว่า ปฐมยาม มัชฌิมยาม และปัจฉิมยาม
ยาม,น.,ช่วงแห่งวัน เป็นเวลายามละชั่วโมงครึ่ง กลางวันมี ๘ ยามตามลำดับคือ สุริยะ ศุกระ พุธะ จันเทา เสารี ครู ภุมมะ สุริยะ กลางคืนมี ๘ ยามตามลำดับคือ รวิ ชีโว ศศิ ศุโกร ภุมโม โสโร พุโธ รวิ
ยาม,น.,"คราว, เวลา, เช่น ยามสุข ยามทุกข์ ยามเช้า ยามกิน"
ยาม,น.,"คนเฝ้าสถานที่หรือระวังเหตุการณ์ตามกำหนดเวลา เช่น แขกยาม ไทยยาม คนยาม, เรียกอาการที่อยู่เฝ้าสถานที่หรือระวังเหตุการณ์เช่นนั้น ว่า อยู่ยาม หรือ เฝ้ายาม."
ยาม-,น.,ชื่อส่วนแห่งวัน ยามหนึ่งมี ๓ ชั่วโมง รวมวันหนึ่งมี ๘ ยาม
ยาม-,น.,ในบาลีแบ่งกลางคืนเป็น ๓ ยาม ยามหนึ่งมี ๔ ชั่วโมง เรียกว่า ปฐมยาม มัชฌิมยาม และปัจฉิมยาม
ยาม-,น.,ช่วงแห่งวัน เป็นเวลายามละชั่วโมงครึ่ง กลางวันมี ๘ ยามตามลำดับคือ สุริยะ ศุกระ พุธะ จันเทา เสารี ครู ภุมมะ สุริยะ กลางคืนมี ๘ ยามตามลำดับคือ รวิ ชีโว ศศิ ศุโกร ภุมโม โสโร พุโธ รวิ
ยาม-,น.,"คราว, เวลา, เช่น ยามสุข ยามทุกข์ ยามเช้า ยามกิน"
ยาม-,น.,"คนเฝ้าสถานที่หรือระวังเหตุการณ์ตามกำหนดเวลา เช่น แขกยาม ไทยยาม คนยาม, เรียกอาการที่อยู่เฝ้าสถานที่หรือระวังเหตุการณ์เช่นนั้น ว่า อยู่ยาม หรือ เฝ้ายาม."
ย่าม ๑,น.,"เครื่องใช้สำหรับใส่สิ่งของ ทำด้วยผ้า มีหูหรือสายในตัวสำหรับสะพาย, ถุงย่าม ก็ว่า."
ย่าม ๒,ก.,"เหิม, ทะยาน, ได้ใจ, เช่น ย่ามใจ."
ยามกาลิก,น.,ของที่พระสงฆ์เก็บไว้ฉันได้ชั่วคราวเพียงวันหนึ่งกับคืนหนึ่ง ได้แก่ นํ้าอัฐบาน. (ป.). (ดู กาลิก).
ยามเกา,น.,"ชื่อหนึ่งของดาวฤกษ์ปุนัพสุ มี ๓ ดวง, ดาวตาเรือชัย ดาวหัวสำเภา ดาวสะเภา ดาวสำเภาทอง หรือ ดาวปุนัพพสู ก็เรียก."
ยามตูดชาย,น.,เวลาบ่าย.
ยามพาด,น.,เวลาเช้า.
ยามโยค,น.,เวลาที่ประกอบด้วยฤกษ์.
ยามสามตา,น.,ชื่อวิธีจับยามของหมอดู ใช้นับตามหลัก ๓ หลัก คือ อาทิตย์ จันทร์ และอังคาร เวียนกันไป โดยนับขึ้นต้นที่อาทิตย์ ถ้าวันจับยามเป็นวันข้างขึ้น ให้นับเวียนขวาจากอาทิตย์ไปยังจันทร์และอังคาร ถ้าวันจับยามเป็นวันข้างแรม ให้นับเวียนซ้ายจากอาทิตย์ไปยังอังคารและจันทร์ แล้วทำนายตามตำรายามสามตาหรือตรีเนตร.
ยามะ,น.,"ชื่อสวรรค์ชั้นที่ ๓, เทวดาในชั้นนี้เรียกว่า ยามเทวบุตร."
ยามักการ,น.,ชื่อเครื่องหมายบังคับให้อ่านพยัญชนะควบ มีรูปดังนี้ ๎ ใช้ในหนังสือบาลีรุ่นเก่า เช่น กต๎วา ทิส๎วา ในปัจจุบันใช้เครื่องหมายพินทุแทน เป็น กตฺวา ทิสฺวา.
ยามา,น.,ชื่อสวรรค์ชั้นที่ ๓ แห่งสวรรค์ ๖ ชั้น มีท้าวสุยามเป็นใหญ่ในชั้นนี้. (ดู ฉกามาพจร ประกอบ).
ยามิก,น.,"คนเฝ้ายาม, คนเฝ้ายามเวลากลางคืน."
ยาย,น.,"แม่ของแม่, เมียของตา, หญิงที่เป็นญาติชั้นเดียวกับแม่ของแม่หรือที่อายุรุ่นราวคราวเดียวกับยาย, (ปาก) คำเรียกหญิงสูงอายุอย่างไม่ค่อยเคารพนับถือ เช่น ยายป้า ยายแก่ ยายคุณหญิง หรือเรียกหญิงรุ่นราวคราวเดียวกันอย่างเป็นกันเอง เช่น ยายปุก ยายกุ้ง หรือเรียกเด็กหญิงที่ตนเอ็นดูรักใคร่ เช่น ยายหนู."
ย้าย,ก.,"ทำให้เคลื่อนจากที่หนึ่งไปยังอีกที่หนึ่ง เช่น ย้ายเก้าอี้ไปไว้มุมห้อง เขาโดนย้ายไปอยู่ชายแดน, เปลี่ยนไปสู่อีกที่หนึ่ง เช่น ย้ายบ้าน ย้ายห้องประชุม ย้ายสำมะโนครัว."
ย้าย,ว.,อาการที่ร่างกายบางส่วนเคลื่อนไหวไปมาข้างโน้นทีข้างนี้ทีตามจังหวะการเดินเป็นต้น เช่น เดินย้ายสะโพก.
ยายทวด,น.,แม่ของตาหรือของยาย.
ยายี,ก.,"เบียดเบียน, รบกวน."
ยาเยีย,ก.,"รักษา, บำรุง."
ยาระบาย,น.,ยาถ่ายอย่างอ่อน.
ยารุ,น.,ยาถ่ายอย่างแรง.
ยารุน,น.,ยาระบายอย่างอ่อน.
ยาลูกกลอน,น.,ยาที่ปั้นเป็นก้อนกลมเพื่อกลืนกิน.
ยาว,ว.,"ลักษณะของสิ่งใด ๆ มีกำหนดระยะจากจุดหนึ่งถึงอีกจุดหนึ่งที่ขยายออกไปไม่ได้แล้ว เช่น ถนนยาว ๓๐ กิโลเมตร เชือกยาว ๒ เมตร, ลักษณะส่วนหนึ่งของสิ่งใด ๆ มีกำหนดระยะยืดหรือยืนเป็นเส้นตรงจากจุดหนึ่งไปถึงอีกจุดหนึ่งมากกว่าอีกสิ่งหนึ่ง เมื่อมีการเปรียบเทียบกัน, ไม่สั้น เช่น เสื้อแขนยาว กางเกงขายาว กระโปรงยาว, นาน (ใช้แก่เวลา) เช่น หน้าร้อนกลางวันยาวกว่ากลางคืน."
ย้าว,น.,เหย้า.
ยาวกาลิก,น.,ของที่พระสงฆ์เก็บไว้ฉันได้ชั่วคราวตั้งแต่เช้าถึงเที่ยงวัน ได้แก่ ข้าวปลาอาหาร. (ดู กาลิก).
ยาวความ,ว.,ต่อความให้ยืดยาวออกไปโดยไม่จำเป็น เช่น อย่าพูดให้ยาวความ.
ยาวชีวิก,น.,"ของที่พระสงฆ์เก็บไว้ฉันได้เสมอไป ไม่มีจำกัดกาล, ตามวินัยบัญญัติได้แก่ของที่ใช้ประกอบเป็นยาสงเคราะห์เข้าในคิลานปัจจัย."
ยาวบั่น สั้นต่อ,ก.,"รักจะอยู่ด้วยกันนาน ๆ ให้ตัดความคิดอาฆาตพยาบาทออกไป รักจะอยู่กันสั้น ๆ ให้คิดอาฆาตพยาบาทเข้าไว้, รักยาวให้บั่น รักสั้นให้ต่อ ก็ว่า."
ยาวเฟื้อย,ว.,ยาวมาก (มักใช้แก่สิ่งที่เป็นเส้นอย่างผมหรือหางไก่เป็นต้น) เช่น ผมยาวเฟื้อย ไก่ฟ้าหางยาวเฟื้อย.
ยาวยืด,ว.,"อาการที่ของเหลวและเหนียวไหลย้อยยาวลงมา, ยาวมากไม่รู้จักจบ (มักใช้แก่ข้อความหรือเรื่องราวที่ยาวเกินไป) เช่น เรื่องนี้ยาวยืดเล่าไม่รู้จักจบ."
ยาวรี,ว.,"กลมยาวเรียวและมีหัวท้ายเหมือนเมล็ดข้าวสาร, ยาวเรียวไปอย่างใบข้าว คือ โคนโตปลายเรียวเล็ก."
ยาวเหยียด,ว.,"ทอดตรงออกไปเต็มเหยียด เช่น นอนยาวเหยียด, ยาวเป็นแถวเป็นแนวไปไกล เช่น ขบวนยาวเหยียด, ยาวมากเกินไป เช่น พรรณนาสรรพคุณเสียยาวเหยียด."
ยาวัส,น.,"ฟ่อนหญ้า, หญ้าหรืออาหารสำหรับสัตว์."
ยาสมุนไพร,น.,ยาที่ได้จากพฤกษชาติ สัตว์ หรือแร่ ซึ่งมิได้ผสม ปรุง หรือแปรสภาพ.
ยาสลบ,น.,สารเคมีที่ใช้ในการแพทย์เพื่อทำให้สลบ.
ยาสั่ง,น.,ยาพิษจำพวกหนึ่งที่เชื่อกันว่า ถ้าผู้ใดกินเข้าไปแล้วจะต้องตาย เมื่อไปกินอาหารที่กำหนดหรือตามเวลาที่กำหนดไว้.
ยาสามัญประจำบ้าน,น.,ยาแผนปัจจุบันหรือยาแผนโบราณ ที่รัฐมนตรีว่าการกระทรวงสาธารณสุขประกาศเป็นยาสามัญประจำบ้าน.
ยาสีฟัน,น.,สิ่งที่เป็นผงหรือครีมเป็นต้นใช้สีฟันเพื่อรักษาฟันให้สะอาดและแข็งแรง.
ยาสุมหัว,น.,ยาที่ใช้สมุนไพร เช่น ว่านเปราะ หัวหอม โขลกพอกกระหม่อมเด็กแก้หวัด.
ยาสูบ ๑,น.,ยาสำหรับสูบ มีทั้งที่เป็นมวนและที่เป็นเส้นสำหรับสูบกล้อง.
ยาสูบ ๑,น.,ดูใน ยา.
ยาสูบ ๒,น.,ชื่อไม้ล้มลุกชนิด Nicotiana tabacum L. ในวงศ์ Solanaceae ใบหั่นเป็นเส้นใช้กินกับหมากหรือมวนสูบ ทำเป็นผงใช้เป่าหรือสูดดม.
ยาสูบ ๒,น.,ใบของต้นยาสูบ (Nicotiana tabacum L.) ที่หั่นเป็นเส้น ทำให้แห้งแล้วใช้ใบตองหรือใบจากมวนสูบ.
ยาเส้น,น.,ยาสูบชนิดหนึ่งที่หั่นใบยาเป็นเส้น ๆ หรือเป็นชิ้นเล็ก ๆ สำหรับมวนสูบหรือใส่กล้องสูบ.
ยาเส้นปรุง,น.,ใบยาซึ่งมิใช่ใบยาพันธุ์ยาสูบพื้นเมืองหรือยาอัด ซึ่งได้หั่นเป็นเส้นและปรุงหรือปนด้วยวัตถุอื่นนอกจากน้ำ.
ยาเสพติด,น.,ยาหรือสารเคมีซึ่งเมื่อเสพหรือฉีดเข้าสู่ร่างกายติดต่อกันชั่วระยะเวลาหนึ่งก็จะติด ก่อให้เกิดพิษเรื้อรัง ทำให้ร่างกายและจิตใจเสื่อมโทรม เช่น ฝิ่น กัญชา เฮโรอีน ยานอนหลับ สุรา.
ยาเสพติดให้โทษ,น.,สารเคมีหรือวัตถุชนิดใด ๆ รวมทั้งพืช ซึ่งเมื่อเสพเข้าสู่ร่างกาย แล้วทำให้เกิดผลต่อร่างกายและจิตใจในลักษณะสำคัญ เช่นต้องเพิ่มขนาดการเสพขึ้นเป็นลำดับ มีอาการถอนยาเมื่อขาดยา.
ยาไส้,ก.,ประทังความหิว.
ยาไส้,ก.,ประทังความหิว เช่น หากินไม่พอยาไส้.
ยาหม้อ,น.,ยาไทยที่ประกอบด้วยสมุนไพร กระดูกสัตว์ และเครื่องยาอื่น ๆ ใส่หม้อต้มแล้วกินน้ำที่เคี่ยวจนงวดเพื่อบำบัดโรค.
ยาหม่อง,น.,น้ำมันหม่อง.
ยาหม้อใหญ่,น.,สิ่งที่น่าเบื่อ เช่น วิชาคำนวณเป็นยาหม้อใหญ่.
ยาหมู่,น.,ยาที่ประกอบด้วยสิ่งต่าง ๆ ที่เป็นของแข็ง มีแก่นไม้ เขี้ยวงา กระดูก เป็นต้น ใช้ฝนกินแก้ร้อนในและผิดสำแลง.
ยาหยัง,ก.,ชนะศัตรู.
ย่าหยา,น.,"เรียกหญิงลูกครึ่งจีนกับมลายูที่เกิดในมลายูและอินโดนีเซียว่า ย่าหยา, คู่กับ บ้าบ๋า."
ยาหยี,น.,น้องรัก.
ยาหัด,ว.,"ชั่ว, ไม่ดี, หยาบ, ไม่งาม."
ยาเหน็บ,น.,ยาที่ใช้สอดเข้าไปในช่องทวารหนักเพื่อให้อุจจาระออก.
ยาเหลือง,น.,ยาน้ำชนิดหนึ่งสีเหลือง สำหรับใส่แผลเรื้อรัง.
ยาอัด,น.,ส่วนใดส่วนหนึ่งของต้นยาสูบซึ่งได้ป่นหรือย่อยและทำเป็นแผ่นโดยมีวัตถุอื่นเจือปนด้วยหรือไม่ก็ตาม.
ยาอุทัย,น.,ยาสำหรับหยดลงน้ำ มีสีชมพูทำให้น้ำมีกลิ่นหอมชื่นใจ.
ย่ำ,ก.,"เหยียบหนัก ๆ ซํ้า ๆ เช่น ย่ำโคลน ย่ำเลน, เดินในลักษณะคล้ายคลึงเช่นนั้น."
ย้ำ,ก.,พูดหรือทำซํ้า ๆ (เพื่อเน้นให้แน่น ให้กระชับ ให้มั่นคง) เช่น พูดยํ้า ยํ้าหัวตะปู.
ย้ำ,ว.,อาการที่กัดเบา ๆ เพียงให้บุบหรือเป็นรอยช้ำ เช่น หมากัดย้ำ แต่ไม่เข้า เคี้ยวพอย้ำ ๆ.
ยำ ๑,ก.,"เคล้าคละ, ปะปน."
ยำ ๑,น.,ชื่อกับข้าวอย่างหนึ่งที่ปรุงโดยเอาผักและเนื้อสัตว์เป็นต้นมาเคล้าเข้าด้วยกัน เช่น ยำเนื้อ ยำเล็บมือนาง ยำปลากรอบ.
ยำ ๒,ก.,"เคารพ, นับถือ."
ย้ำ ๆ,ก.,พูดหรือทำซํ้า ๆ (เพื่อเน้นให้แน่น ให้กระชับ ให้มั่นคง) เช่น พูดยํ้า ยํ้าหัวตะปู.
ย้ำ ๆ,ว.,อาการที่กัดเบา ๆ เพียงให้บุบหรือเป็นรอยช้ำ เช่น หมากัดย้ำ แต่ไม่เข้า เคี้ยวพอย้ำ ๆ.
ย่ำกลอง,ก.,ตีกลองถี่ ๆ หลายครั้งเพื่อบอกเวลา.
ยำเกรง,ก.,"เกรงกลัวเพราะความเคารพนับถือ, ยำเยง ก็ว่า."
ยำขโมย,น.,ยำเนื้อย่างใส่แตงกวา ปรุงรสเปรี้ยว เค็ม เผ็ด.
ย่ำขี้เทือก,ก.,"ย่ำดินโคลนพื้นนาที่จะตกกล้าให้อ่อนเหลว, ย่ำเทือก ก็เรียก."
ย่ำเขี้ยว,ก.,จมเขี้ยว เช่น เด็กถูกสุนัขกัดย่ำเขี้ยว.
ย่ำค่ำ,ก.,ตีกลอง ฆ้อง หรือระฆังถี่ ๆ หลายครั้งเพื่อบอกเวลาในเวลาค่ำ (ราว ๑๘ นาฬิกา).
ย่ำค่ำ,น.,เวลาค่ำราว ๑๘ นาฬิกา.
ย่ำฆ้อง,ก.,ตีฆ้องถี่ ๆ หลายครั้งเพื่อบอกเวลา.
ย่ำต๊อก,ก.,เดินไปเรื่อย ๆ เพราะไม่มีรถหรือค่ารถเป็นต้น เช่น เงินหมดกระเป๋าเลยต้องเดินย่ำต๊อกกลับบ้าน.
ยำทวาย,น.,ยำชนิดหนึ่ง มีผักลวก เช่น ผักบุ้ง หัวปลี ถั่วงอก ราดด้วยหัวกะทิน้ำพริกรสเปรี้ยว เค็ม หวาน และโรยงาคั่ว.
ย่ำเท้า,ก.,เหยียบหนัก ๆ ซ้ำ ๆ อยู่กับที่.
ย่ำเท้าอยู่กับที่,ก.,"ไม่ก้าวหน้า, ไม่รุดหน้า, เช่น ทำงานมาหลายปีแล้ว ยังย่ำเท้าอยู่กับที่ ไม่ได้เลื่อนตำแหน่งเสียที."
ย่ำเทือก,ก.,"ยํ่าดินโคลนพื้นนาที่จะตกกล้าให้อ่อนเหลว, ย่ำขี้เทือก ก็เรียก."
ย่ำเป็นเทือก,ก.,ย่ำกันไปมาจนเปื้อนเปรอะเลอะเทอะเหมือนเปรอะด้วยขี้เทือก.
ยำยาม,ก.,ชมเชย.
