บูชา,ก.,"แสดงความเคารพบุคคลหรือสิ่งที่นับถือด้วยเครื่องสักการะ มีดอกไม้ ธูป เทียน เป็นต้น เช่น บูชาพระ บูชาเทวดา บูชาไฟ, ยกย่องเทิดทูนด้วยความนับถือหรือเลื่อมใสในความรู้ความสามารถ เช่น บูชาวีรบุรุษ บูชาความรู้ บูชาฝีมือ"
บูชา,ก.,"ซื้อพระพุทธรูป วัตถุมงคล หรือสิ่งที่ถือว่าขลังหรือศักดิ์สิทธิ์ เช่น พระพุทธรูปองค์นี้บูชามาเท่าไร, เช่า ก็ใช้."
บูชากัณฑ์เทศน์,ก.,ติดกัณฑ์เทศน์ด้วยจตุปัจจัยไทยธรรมเป็นต้น.
บูชาพระ,ก.,แสดงความเคารพพระพุทธรูปด้วยเครื่องสักการะ มีดอกไม้ ธูป เทียน เป็นต้น
บูชาพระ,ก.,"ซื้อพระพุทธรูปหรือพระเครื่องไปบูชา, เช่าพระ ก็ว่า."
บูชายัญ,น.,"การบูชาของพราหมณ์อย่างหนึ่ง, การเซ่นสรวงด้วยวิธีฆ่าคนหรือสัตว์เป็นเครื่องบูชา."
บูชายัญ,ก.,เซ่นสรวงด้วยวิธีฆ่าคนหรือสัตว์เป็นเครื่องบูชา.
บูชิต,ว.,บูชาแล้ว.
บูด,ว.,มีรสเปรี้ยวและมีกลิ่นเหม็นเปรี้ยวแสดงว่าเสีย (ใช้แก่อาหาร) เช่น ข้าวบูด แกงบูด
บูด,ว.,ทำหน้าแสดงอาการไม่พอใจ เรียกว่า ทำหน้าบูด.
บูดบึ้ง,ว.,ทำหน้าบึ้งแสดงอาการไม่พอใจ.
บูดเบี้ยว,ว.,ทำหน้านิ่วแสดงอาการเจ็บปวดเป็นต้น.
บูดู,น.,น้ำที่ได้จากปลาหมักจนเปื่อย ต้มสุกแล้วปรุงรส มี ๒ ชนิด คือ บูดูแบบเค็ม เป็นเครื่องจิ้มกับผักสด และบูดูแบบหวาน สำหรับคลุกกับข้าวยำปักษ์ใต้.
บู่ทะเล,น.,ดู บู่.
บู่ทะเล,น.,"ชื่อปลาไม่มีเกล็ดชนิด Batrachoides grunniers (Bloch) และ Batrachomoeus trispinosus (Günther) ในวงศ์ Batrachoididae ปากกว้าง หัวทู่แบนลง ลำตัวกลมยาว มีสีนํ้าตาลเป็นด่างดวงทั่วไป ขนาดยาวได้ถึง ๓๐ เซนติเมตร ครีบท้องอยู่เยื้องไปข้างหน้าครีบอก หางกลม เฉพาะชนิดแรกมีรูที่มุมบนด้านในของครีบอก อาศัยอยู่ตามพื้นท้องทะเล, กบ บู่ทะเล ผีหลอก หรือ อุบ ก็เรียก."
บู้บี้,ว.,"ยู่ย่นเข้าไปจนผิดรูป, มักใช้เข้าคู่กับ บุบบิบ เป็น บุบบิบบู้บี้."
บูร,น.,"บุระ, กำแพงที่มีป้อมค่าย เช่น ตรีบูร, หอ, วัง, เมือง เช่น ทางใดพงาเอารสราช เจ้าจักยาตรยงงบูร (ม. คำหลวง มหาราช)."
บูรณ์,ว.,เต็ม.
บูรณ-,ว.,เต็ม.
บูรณภาพ,น.,ความครบถ้วนบริบูรณ์ เช่น บูรณภาพแห่งดินแดน บูรณภาพแห่งอาณาเขต.
บูรณมี,น.,วันเพ็ญ เช่น วิสาขบูรณมี คือ วันเพ็ญเดือน ๖.
บูรณะ,ก.,"ซ่อมแซมทำให้กลับคืนดีเหมือนเดิม เช่น บูรณะวัด, มักใช้เข้าคู่กับ ปฏิสังขรณ์ เป็น บูรณปฏิสังขรณ์."
บูรณาการ,น.,กระบวนการผสมผสานเชื่อมโยงองค์ความรู้ตั้งแต่ ๒ องค์ความรู้ขึ้นไปเข้าด้วยกันอย่างสอดคล้องเป็นระบบ.
บูรพ์,ว.,"ก่อน, แรก, เบื้องหน้า"
บูรพ์,ว.,ตะวันออก.
บูรพะ,ว.,"ก่อน, แรก, เบื้องหน้า"
บูรพะ,ว.,ตะวันออก.
บูรพา,ว.,"ก่อน, แรก, เบื้องหน้า"
บูรพา,ว.,ตะวันออก.
บูรพาจารย์,น.,"อาจารย์ในเบื้องต้น คือ บิดามารดา, อาจารย์คนก่อน ๆ ของสถาบันการศึกษา."
บูรพาษาฒ,น.,เดือน ๘ แรก.
บูรี,น.,เมือง.
เบ้,ก.,"บิด, ไม่ตรง, เช่น ทำปากเบ้"
เบ้,ก.,ทำหน้าแสดงอาการผิดหวัง ไม่เห็นด้วย ไม่พอใจ หรือเจ็บปวด เป็นต้น.
เบ่ง,ก.,"ตะเบ็ง เช่น เบ่งเสียง, พยายามขับดันสิ่งเช่นอุจจาระปัสสาวะเป็นต้นให้ออกมา เช่น เบ่งอุจจาระเบ่งปัสสาวะ เบ่งลูก, ทำให้พองตัวขึ้นหรือขยายตัวออก เช่น อึ่งอ่างเบ่ง เบ่งกล้าม"
เบ่ง,ก.,"อวดว่ามีอำนาจ, อวดทำเป็นใหญ่."
เบญกานี ๑,น.,ชื่อเรียกก้อนแข็ง ๆ หรือปุ่มหูดที่เกิดตามใบของไม้ก่อชนิด Quercus infectoriaOliv. ในวงศ์ Fagaceae เกิดจากการวางไข่ของแมลงชนิด Cynips tinctoria ในวงศ์ Cynipidae รสฝาดจัด ใช้ทำยาได้ เรียกว่า ลูกเบญกานี.
เบญกานี ๒,น.,"ชื่อไม้พุ่มชนิด Polyscias scutellaria (Burm.f.) Fosberg ในวงศ์ Araliaceae แผ่นใบแบน ขอบใบห่อขึ้นเล็กน้อย ใบด้านบนเป็นลายด่างสีขาวนวล เขียว และเขียวอ่อนปนกัน, ครุฑกระทง ก็เรียก."
เบญจ-,ว.,"ห้า, ลำดับที่ ๕ เช่น นาเบญจะ หัวเมืองเบญจะ. (ป. ปญฺจ"
เบญจ-,ส.,"ปญฺจนฺ), มักใช้เป็นส่วนหน้าสมาส."
เบญจก,น.,หมวด ๕ เช่น ขันธเบญจก.
เบญจกัลยาณี,ว.,"ที่มีลักษณะงาม ๕ ประการ คือ ๑. ผมงาม ๒. เนื้องาม (คือ เหงือกและริมฝีปากแดงงาม) ๓. ฟันงาม ๔. ผิวงาม ๕. วัยงาม (คือ งามสมวัย), เรียกหญิงที่มีลักษณะเช่นนั้น ว่า หญิงเบญจกัลยาณี."
เบญจกามคุณ,น.,เครื่องผูกอันบุคคลพึงใคร่ ๕ คือ รูป เสียง กลิ่น รส และสิ่งที่ถูกต้องด้วยกาย.
เบญจกูล,น.,เครื่องยา ๕ อย่าง คือ ขิง ดีปลี ช้าพลู สะค้าน เจตมูลเพลิง.
เบญจขันธ์,น.,กอง ๕ คือ รูป เวทนา สัญญา สังขาร วิญญาณ.
เบญจครรภ,น.,เต้าน้ำ เป็นเครื่องราชูปโภค ตามราชประเพณีของไทยใช้สำหรับพระมหากษัตริย์ทรงรับนํ้าอภิเษกหรือบรรจุน้ำพระพุทธมนต์หรือน้ำเทพมนตร์.
เบญจคัพภ์,น.,เต้าน้ำ เป็นเครื่องราชูปโภค ตามราชประเพณีของไทยใช้สำหรับพระมหากษัตริย์ทรงรับนํ้าอภิเษกหรือบรรจุน้ำพระพุทธมนต์หรือน้ำเทพมนตร์.
เบญจคีรีนคร,น.,ชื่อหนึ่งของเมืองราชคฤห์ มีภูเขา ๕ ลูกล้อมรอบ คือ ๑. ภูเขาปัณฑวะ ๒. ภูเขาคิชฌกูฏ ๓. ภูเขาเวภาระ ๔. ภูเขาอิสิคิลิ ๕. ภูเขาเวปุลละ.
เบญจโครส,น.,สิ่งที่ได้จากนมโค ๕ อย่าง คือ นมสด นมส้ม เนยใส เนยข้น เปรียง.
เบญจดุริยางค์,น.,"ปี่พาทย์เครื่องห้า มี ๒ ชนิด คือ เครื่องอย่างเบาใช้ประกอบการเล่นละครพื้นเมืองชนิดหนึ่ง และเครื่องอย่างหนักใช้ประกอบการเล่นโขนชนิดหนึ่ง, เครื่องอย่างเบามี ปี่ไฉน ๑ ทับ ๒ (ตัวผู้ ๑ ใบ ตัวเมีย ๑ ใบ) กลองตุ๊ก ๑, เครื่องอย่างหนักมี ปี่ใน ๑ ระนาดเอก ๑ ฆ้องวงใหญ่ ๑ กลองทัด ๑ คู่ ตะโพน ๑ ฉิ่ง ๑."
เบญจธรรม,น.,"ธรรมะ ๕ ประการ คือ เมตตา ทาน ความสำรวมในกาม สัจจะ สติ, คู่กับ เบญจศีล."
เบญจบรรพต,น.,เขา ๕ ยอด คือ เขาหิมาลัย.
เบญจพรรณ,ว.,"๕ สี, ๕ ชนิด"
เบญจพรรณ,ว.,"หลายอย่างคละกัน ไม่เป็นสำรับ ไม่เป็นชุด เช่น ของเบญจพรรณ, เรียกต้นไม้ต่าง ๆ ที่ปลูกไว้ในที่แห่งเดียวกัน ว่า ไม้เบญจพรรณ, เรียกป่าที่มีไม้หลายพรรณคละกัน ว่า ป่าเบญจพรรณ."
เบญจพล,น.,กำลัง ๕ คือ ศรัทธา วิริยะ สติ สมาธิ ปัญญา.
เบญจเพส,ว.,ยี่สิบห้า เช่น อายุถึงเบญจเพส.
เบญจภูต,น.,ธาตุทั้ง ๕ คือ ดิน นํ้า ไฟ ลม อากาศ.
เบญจม-,ว.,"ครบ ๕, ที่ ๕."
เบญจมสุรทิน,น.,วันที่ ๕ แห่งเดือนทางสุริยคติ.
เบญจมาศ,น.,ชื่อไม้ล้มลุกหรือไม้พุ่มขนาดเล็กชนิด Chrysanthemum morifoliumRamat. ในวงศ์ Compositae ใบหนา ใต้ใบมีขนละเอียด รูปใบมีแบบต่าง ๆ ดอกเป็นช่อออกตามปลายกิ่ง มีหลายสี บางพันธุ์โต บางพันธุ์เล็ก บางพันธุ์กลีบดอกซ้อนถี่แน่น บางพันธุ์กลีบดอกยาวบิดเป็นเกลียว ใบหรือกลีบเมื่อขยี้ดมมีกลิ่นฉุน เฉพาะพันธุ์ดอกเล็ก สีขาวกลิ่นหอม เรียก เบญจมาศหนู หรือ เก๊กฮวย ดอกตากแห้งชงกับใบชาหรือต้มกับนํ้าตาล ใช้ดื่มแก้กระหาย.
เบญจมาศสวน,น.,"ชื่อไม้ล้มลุก ๒ ชนิดในสกุล Chrysanthemum วงศ์ Compositae ได้แก่ ชนิด C. indicum L. ดอกเล็ก สีเหลือง กลิ่นหอม, เบญจมาศสวน ก็เรียก, และชนิด C. morifolium Ramat. พันธุ์ดอกเล็ก สีขาว กลิ่นหอม, เบญจมาศหนู ก็เรียก, ทั้ง ๒ ชนิดใช้ดอกตากแห้งชงหรือต้มกับนํ้าตาล ใช้ดื่มแก้กระหาย."
เบญจมาศหนู,น.,"ชื่อไม้ล้มลุก ๒ ชนิดในสกุล Chrysanthemum วงศ์ Compositae ได้แก่ ชนิด C. indicum L. ดอกเล็ก สีเหลือง กลิ่นหอม, เบญจมาศสวน ก็เรียก, และชนิด C. morifolium Ramat. พันธุ์ดอกเล็ก สีขาว กลิ่นหอม, เบญจมาศหนู ก็เรียก, ทั้ง ๒ ชนิดใช้ดอกตากแห้งชงหรือต้มกับนํ้าตาล ใช้ดื่มแก้กระหาย."
เบญจรงค์,น.,"แม่สีทั้ง ๕ คือ ดำ แดง ขาว เขียว (คราม) เหลือง, เรียกเครื่องถ้วยชามที่เขียนลวดลายด้วยแม่สีทั้ง ๕ ว่า ถ้วยเบญจรงค์ ชามเบญจรงค์."
เบญจโลหกะ,น.,แร่ทั้ง ๕ คือ ทองคำ เงิน ทองแดง ตะกั่ว ดีบุก.
เบญจโลหะ,น.,"โลหะ ๕ ชนิด คือ เหล็ก ๑ ปรอท ๑ ทองแดง ๑ เงิน ๑ และทองคำ ๑, ถ้าเติมอีก ๒ ชนิด คือ เจ้า ๑ (เป็นคำตัดมาจาก “เจ้าน้ำเงิน” ว่าเป็นแร่ชนิดหนึ่งสีเขียวเป็นสีน้ำเงิน) และสังกะสี ๑ เรียกว่า สัตโลหะ, ถ้าเติมอีก ๒ ชนิด คือ ชิน ๑ และบริสุทธิ์ ๑ (คือ ทองแดงบริสุทธิ์) เรียกว่า นวโลหะ (ตำราสร้างพระพุทธรูป)."
เบญจวรรค,น.,"วรรคทั้ง ๕ ได้แก่ พยัญชนะตั้งแต่วรรค ก ถึงวรรค ป คือพยัญชนะตั้งแต่ ก ถึง ม, พระสงฆ์ ๕ รูป เรียกว่า สงฆ์เบญจวรรคหรือสงฆ์ปัญจวรรค ซึ่งสามารถทำสังฆกรรมบางอย่างได้เช่นรับกฐินหรืออุปสมบทพระภิกษุในถิ่นที่หาภิกษุได้ยาก."
เบญจวรรณ,ว.,"๕ สี, ๕ ชนิด."
เบญจวรรณ,น.,นกแก้วขนาดโตมีหลายสี.
เบญจวรรณห้าสี,น.,"ชื่อกลอนกลบทแบบหนึ่ง บังคับเสียงพยัญชนะตัวเดียวใน ๕ คำแรกของทุกวรรค เช่น จอมจักรเจ้าแจ้งเจาะฟังเพราะพร้อง จวนจิตรจ่องจนใจสงไสยสนิท (ศิริวิบุลกิตติ์), โบราณเขียนเป็น เบญจวรรณห้าศรี ก็มี."
เบญจศก,น.,เรียกปีจุลศักราชที่ลงท้ายด้วยเลข ๕ เช่น ปีกุน เบญจศก จุลศักราช ๑๓๔๕.
เบญจศีล,น.,"ศีล ๕ คือ ๑. งดเว้นจากการฆ่าสัตว์ ๒. งดเว้นจากการลักทรัพย์ ๓. งดเว้นจากการประพฤติผิดในกาม ๔. งดเว้นจากการพูดเท็จ ๕. งดเว้นจากการเสพสุราเมรัยและของมึนเมา, คู่กับ เบญจธรรม."
เบญจะ,ว.,"ห้า, ลำดับที่ ๕ เช่น นาเบญจะ หัวเมืองเบญจะ. (ป. ปญฺจ"
เบญจะ,ส.,"ปญฺจนฺ), มักใช้เป็นส่วนหน้าสมาส."
เบญจา,น.,"แท่นมีเสารับเพดานดาดและระบายผ้าขาว, แท่นซ้อน ๕ ชั้นลดหลั่นกัน มักใช้ประดิษฐานบุษบกหรือพระโกศ."
เบญจางค์,น.,อวัยวะทั้ง ๕ คือ หน้าผาก ๑ มือ ๒ เข่า ๒
เบญจางค์,น.,ส่วนทั้ง ๕ คือ ราก เปลือก ใบ ดอก ผล.
เบญจางค-,น.,อวัยวะทั้ง ๕ คือ หน้าผาก ๑ มือ ๒ เข่า ๒
เบญจางค-,น.,ส่วนทั้ง ๕ คือ ราก เปลือก ใบ ดอก ผล.
เบญจางคประดิษฐ์,น.,การกราบโดยให้อวัยวะทั้ง ๕ คือ เข่าทั้ง ๒ มือทั้ง ๒ และหน้าผาก จดลงกับพื้น.
เบญญา,น.,ปัญญา.
เบญพาด,น.,ตัวไม้ที่คุมกันเข้าเป็นเครื่องคํ้ายันเสาตะลุงให้มั่นคง.
เบ็ด,น.,เครื่องมือสำหรับตกปลา หรือ กุ้ง รูปเป็นขอสำหรับเกี่ยวเหยื่อ ส่วนมากมีเงี่ยง.
เบ็ดเตล็ด,ว.,"เล็ก ๆ น้อย ๆ หลาย ๆ อย่างรวมกัน เช่น ของเบ็ดเตล็ด, โดยปริยายหมายความว่า ไม่สู้จะสำคัญอะไรนัก เช่น เรื่องเบ็ดเตล็ด."
เบ็ดราว,น.,เบ็ดที่ผูกไว้กับเชือกหรือแท่งไม้ยาวประมาณ ๑ ศอก แล้วนำไปผูกห้อยไว้กับเชือกราว โดยเว้นระยะห่างกันเป็นตอน ๆ เพื่อนำไปหย่อนลงในแม่น้ำลำคลอง.
เบ็ดเสร็จ,ว.,"รวมด้วยกัน, รวมหมดด้วยกัน, เช่น รวมเบ็ดเสร็จ ราคาเบ็ดเสร็จ, ครบถ้วนทุกรูปทุกแบบ เช่น สงครามเบ็ดเสร็จ"
เบ็ดเสร็จ,ว.,เรียกภาษีสิ่งของต่าง ๆ นอกจากข้าวที่ส่งออกไปนอกประเทศ ว่า ภาษีเบ็ดเสร็จ.
เบน,ก.,ออกจากหรือทำให้ออกจากแนวทางเดิม เช่น หัวเรือเบนออก เบนหัวเรือ เบนความคิด เบนความสนใจ เบนสายตา.
เบนซิน,น.,นํ้ามันเชื้อเพลิงชนิดหนึ่ง ซึ่งนำไปใช้โดยทำให้ไอของนํ้ามันผสมกับอากาศเข้าไปจุดระเบิดด้วยประกายไฟฟ้าจากหัวเทียนในเครื่องยนต์ชนิดเผาไหม้ภายใน.
เบรก,น.,เครื่องห้ามล้อ.
เบรก,ก.,ห้ามล้อ.
เบริลเลียม,น.,ธาตุลำดับที่ ๔ สัญลักษณ์ Be เป็นโลหะ ลักษณะเป็นของแข็งสีขาว หลอมละลายที่ ๑๒๗๗ °ซ. ใช้ประโยชน์นำไปผสมกับโลหะอื่นให้เป็นโลหะเจือ ซึ่งทนทานต่อการผุกร่อน.
เบรียน,ก.,"ให้เรียน, สอน, เช่น อาจเบรียนภิกษุสงฆ์ทั้งหลาย (จารึกสยาม)."
เบส,น.,"สารเคมีซึ่งทำปฏิกิริยากับกรด แล้วให้ผลเป็นเกลือหรือเกลือกับนํ้าเท่านั้น, สารเคมีที่มีสมบัติรับโปรตอนมาจากสารอื่นได้, สารเคมีที่มีสมบัติจ่ายอิเล็กตรอนคู่หนึ่งให้แก่สารอื่นได้, สารเคมีซึ่งเมื่อละลายนํ้าแล้วให้ไฮดรอกไซด์ไอออน (OH-), สารละลายที่เปลี่ยนสีลิตมัสสีแดงเป็นสีนํ้าเงินได้."
เบ้อ,ว.,กว้างใหญ่และลึก (ใช้แก่แผล) เช่น ถูกฟันเป็นแผลเบ้อ.
เบอร์,น.,หมายเลขลำดับ.
เบอร์คีเลียม,น.,ธาตุลำดับที่ ๙๗ สัญลักษณ์ Bk เป็นธาตุกัมมันตรังสีที่นักวิทยาศาสตร์สร้างขึ้น ไม่มีปรากฏในธรรมชาติ.
เบ้อเร่อ,ว.,ใหญ่โตกว่าปรกติ.
เบ้อเร่อเท่อ,ว.,ใหญ่โตกว่าปรกติ.
เบ้อเริ่ม,ว.,ใหญ่โตกว่าปรกติ.
เบ้อเริ่มเทิ่ม,ว.,ใหญ่โตกว่าปรกติ.
เบ๊อะ,ว.,เปิ่น.
เบอะ ๑,ว.,"กว้างใหญ่และลึก เช่น แผลเบอะ, มาก เช่น ปากหนาเบอะ เหลือเบอะ."
เบอะ ๒,ว.,ซึมเซ่อ เช่น หน้าเบอะ.
เบ๊อะบ๊ะ,ว.,เปิ่น.
เบอะบะ ๑,ว.,อ้วนใหญ่เทอะทะไม่ได้ส่วน เช่น รูปร่างเบอะบะ.
เบอะบะ ๒,ว.,ซึมเซ่อ เช่น หน้าตาเบอะบะ.
