ปุ๋ย ๒,ว.,อาการที่เชือกขาดไปโดยง่ายดาย เช่น ขาดปุ๋ย
ปุ๋ย ๒,ว.,อาการที่หลับง่ายดายอย่างสบาย เช่น หลับปุ๋ย.
ปุยกระโดน,น.,"ชื่อไม้ต้นชนิด Careya sphaerica Roxb. ในวงศ์ Lecythidaceae ชอบขึ้นในป่าเบญจพรรณที่ชุ่มชื้น ดอกมีเกสรเพศผู้จำนวนมากเป็นพู่คล้ายดอกชมพู่ ขาว หอม ดอกบานเต็มที่กว้าง ๕-๘ เซนติเมตร ผลค่อนข้างกลม ใบอ่อนใช้เป็นผัก เปลือกใช้เบื่อปลาหรือทุบเป็นแผ่นปูหลังช้าง, โดน จิก ปุย ปุยกระโดน ปุยขาว หรือ ผ้าฮาด ก็เรียก."
ปุยขาว,น.,"ชื่อไม้ต้นชนิด Careya sphaerica Roxb. ในวงศ์ Lecythidaceae ชอบขึ้นในป่าเบญจพรรณที่ชุ่มชื้น ดอกมีเกสรเพศผู้จำนวนมากเป็นพู่คล้ายดอกชมพู่ ขาว หอม ดอกบานเต็มที่กว้าง ๕-๘ เซนติเมตร ผลค่อนข้างกลม ใบอ่อนใช้เป็นผัก เปลือกใช้เบื่อปลาหรือทุบเป็นแผ่นปูหลังช้าง, โดน จิก ปุย ปุยกระโดน ปุยขาว หรือ ผ้าฮาด ก็เรียก."
ปุ๋ยคอก,น.,ปุ๋ยที่ได้จากมูลสัตว์และเศษซากพืชรองคอก.
ปุ๋ยเคมี,น.,ปุ๋ยที่ผลิตขึ้นโดยกระบวนการทางเคมีให้มีธาตุอาหารหลักเพียงธาตุเดียวหรือหลายธาตุ
ปุ๋ยเคมี,น.,ปุ๋ยวิทยาศาสตร์.
ปุยฝ้าย,น.,"ชื่อหนึ่งของดาวฤกษ์บุษยะ มี ๕ ดวง, ดาวพวงดอกไม้ ดาวดอกบัว ดาวโลง ดาวปู ดาวสมอสำเภา ดาวสิธยะ ดาวบุษย์ ดาวปุษยะ หรือ ดาวปุสสะ ก็เรียก"
ปุยฝ้าย,น.,ชื่อขนมชนิดหนึ่ง มีลักษณะคล้ายขนมถ้วยฟู แต่เนื้อละเอียดและนุ่มกว่า
ปุยฝ้าย,น.,ชื่อกะท้อนพันธุ์หนึ่ง.
ปุ๋ยวิทยาศาสตร์,น.,ปุ๋ยเคมี.
ปุ๋ยหมัก,น.,ปุ๋ยที่ได้จากนำเศษอินทรียวัสดุมากองสุมไว้ รดน้ำให้ชื้นและทิ้งไว้ให้เกิดการสลายตัวโดยการกระทำของจุลินทรีย์ อาจผสมสารเคมีเข้าไปด้วยเพื่อให้มีธาตุอาหารเพิ่มขึ้นหรือให้อินทรียวัสดุสลายตัวเร็วขึ้น.
ปุ๋ยอินทรีย์,น.,ปุ๋ยที่ได้จากพืชและซากสัตว์.
ปุรณะ,ก.,บูรณะ.
ปุรพ-,ว.,"บุพ, บุพพะ."
ปุรพผลคุนี,น.,"ดาวฤกษ์ที่ ๑๑ มี ๒ ดวง เห็นเป็นรูปแรดตัวผู้หรือเพดานตอนหน้า, ดาววัวตัวผู้ หรือ ดาวงูเมีย ก็เรียก."
ปุรพษาฒ,น.,"ดาวฤกษ์ที่ ๒๐ มี ๓ ดวง เห็นเป็นรูปปากนกหรือช้างพลาย, ดาวสัปคับช้าง หรือ ดาวราชสีห์ตัวผู้ ก็เรียก."
ปุระ,น.,บุระ.
ปุราณ,ว.,"บุราณ, โบราณ."
ปุราณะ,น.,ชื่อคัมภีร์ในศาสนาฮินดู.
ปุริมพรรษา,น.,ดู บุริมพรรษา.
ปุเรจาริก,ว.,"เป็นเครื่องนำหน้า, เป็นอารมณ์, เป็นหัวหน้า."
ปุโรหิต,น.,พราหมณ์ที่ปรึกษาของพระมหากษัตริย์ในทางนิติ คือ ขนบธรรมเนียมจารีตประเพณี.
ปุลลิงค์,น.,"เพศของคำในภาษาบาลีสันสกฤต ที่ไม่จัดเป็นอิตถีลิงค์และนปุงสกลิงค์ เช่น กิมิ (หนอน, แมลง) ตาป (ความเดือดร้อน, ความรำคาญ), ปุลลิงค์ หรือ ปุลลึงค์ ก็ว่า."
ปุลลึงค์,น.,"เพศของคำในภาษาบาลีสันสกฤต ที่ไม่จัดเป็นอิตถีลิงค์และนปุงสกลิงค์ เช่น กิมิ (หนอน, แมลง) ตาป (ความเดือดร้อน, ความรำคาญ), ปุลลิงค์ หรือ ปุลลึงค์ ก็ว่า."
ปุลินท์,น.,ชาวป่าชาวเขา.
ปุลู,น.,"เรียกขวานชนิดหนึ่ง มีบ้องที่หัวบิดได้ สำหรับตัดหรือถาง ว่า ขวานปุลู, ปูลู หรือ โยน ก็เรียก."
ปุโลปุเล,ก.,"พูดหรือทำพอให้เสร็จ ๆ ไปโดยไม่ต้องการรายละเอียด, ประโลประเล ก็ว่า."
ปุษยะ,น.,"ดาวฤกษ์ที่ ๘ มี ๕ ดวง เห็นเป็นรูปปุยฝ้าย พวงดอกไม้ ดอกบัว หรือโลง, ดาวปุยฝ้าย ดาวพวงดอกไม้ ดาวดอกบัว ดาวโลง ดาวปู ดาวสมอสำเภา หรือ ดาวสิธยะ ก็เรียก."
ปุสสะ,น.,"ดาวฤกษ์ที่ ๘ มี ๕ ดวง เห็นเป็นรูปปุยฝ้าย พวงดอกไม้ ดอกบัว หรือโลง, ดาวปุยฝ้าย ดาวพวงดอกไม้ ดาวดอกบัว ดาวโลง ดาวปู ดาวสมอสำเภา หรือ ดาวสิธยะ ก็เรียก."
ปุฬวะ,น.,หนอน.
ปู่,น.,"พ่อของพ่อ, ผัวของย่า, ญาติผู้ชายหรือชายที่นับถือชั้นปู่."
ปู ๑,น.,ชื่อสัตว์ไม่มีกระดูกสันหลังในชั้น Crustacea อันดับ Decapoda มีหลายวงศ์ หายใจด้วยเหงือก หัวและอกรวมกันเป็นลำตัว ท้องแบนพับอยู่ใต้อก เรียก จับปิ้งหรือตะปิ้ง มีรยางค์ขา ๕ คู่ คู่แรกเป็นขาก้าม พบอาศัยอยู่บนบกในน้ำจืด และทะเล เช่น ปูดำหรือปูทะเล ปูม้า ปูแสม
ปู ๑,น.,"ชื่อหนึ่งของดาวฤกษ์บุษยะ มี ๕ ดวง, ดาวปุยฝ้าย ดาวพวงดอกไม้ ดาวดอกบัว ดาวโลง ดาวสิธยะ ดาวสมอสำเภา ดาวบุษย์ ดาวปุษยะ หรือ ดาวปุสสะ ก็เรียก."
ปู ๒,ก.,"วางทอดลงเป็นพื้น เช่น ปูกระดาน ปูหินอ่อน, วางแผ่ลงกับพื้น เช่น ปูเสื่อ ปูผ้า."
ปู่ครู,น.,ตำแหน่งสมณศักดิ์ครั้งกรุงสุโขทัยเป็นราชธานี.
ปูจ๋า,น.,ชื่อกับข้าวอย่างหนึ่ง เอาเนื้อปูผสมเครื่องกับไข่แล้วใส่กระดองปูนึ่งหรือทอด.
ปู่เจ้า,น.,"ผู้เฒ่าที่คนเคารพนับถือ, เจ้าปู่ ก็ว่า"
ปู่เจ้า,น.,เทพารักษ์ เช่น เขาใส่สมญาเรา ปู่เจ้า (ลอ).
ปูชกะ,น.,ผู้บูชา.
ปูชนีย-,ว.,"น่านับถือ, น่าบูชา, เช่น ปูชนียวัตถุ ปูชนียบุคคล."
ปูชนียสถาน,น.,สถานที่เนื่องด้วยศาสนา ซึ่งเป็นที่ควรแก่การเคารพบูชา เช่น วัดพระศรีรัตนศาสดาราม พระปฐมเจดีย์.
ปูชนียะ,ว.,"น่านับถือ, น่าบูชา, เช่น ปูชนียวัตถุ ปูชนียบุคคล."
ปูชา,น.,บูชา.
ปูชิต,ก.,บูชิต.
ปูด ๑,น.,"ชื่อนกขนาดกลางในวงศ์ Cuculidae ปากแหลมสั้นหนา ตาสีแดง ลำตัวเพรียว หัว คอ และลำตัวมีขนสีดำ ปีกสั้นสีน้ำตาลแดง หากินตามพื้นป่าโปร่ง บินได้ในระยะสั้น ๆ ร้องเสียง “ปูด ๆ ” มี ๓ ชนิด คือ กะปูดใหญ่ [ Centropus sinensis (Stephens)] กะปูดเล็ก [ C. bengalensis (Gmelin)] และกะปูดนิ้วสั้น ( C. rectunguisStrickland), ปูด หรือ กระปูด ก็เรียก, พายัพเรียก ก้นปูด."
ปูด ๒,ว.,นูนเบ่งขึ้นมาในลักษณะอย่างดินปูด หน้าปูด
ปูด ๒,ว.,เสียงดังเช่นนั้น.
ปูด ๓,ก.,พูดหรือเผยความลับเพราะทนเก็บไว้ไม่ได้.
ปูดกกส้มมอ,น.,โกฐพุงปลา. (ดู โกฐพุงปลา ที่ โกฐ).
ปูติ,ว.,"บูด, เน่า."
ปูติลดา,น.,"เถาหัวด้วน, กระพังโหม."
ปู่ทวด,น.,พ่อของปู่หรือของย่า.
ปูน ๑,น.,"หินปูนหรือเปลือกหอยเมื่อถูกเผาจนสลายตัว, ปูนกินกับหมากหรือปูนแดง ในคำเช่น ป้ายปูน ปูนกัดปาก, ปูนขาว ในคำว่า ฉาบนํ้าปูน"
ปูน ๑,น.,ปูนซีเมนต์ ในคำเช่น เทปูน โบกปูน.
ปูน ๒,น.,"คราว, รุ่น, เช่น คนมีอายุปูนพ่อปูนแม่."
ปูน ๒,ว.,"เทียบ, เทียม, ปาน, เปรียบ, เพียง."
ปูน ๓,ก.,"แจก, ปัน, ให้, เช่น ปูนบำเหน็จ."
ปูน ๔,น.,เถาวัลย์ปูน.
ปูนขาว,น.,ปูนสุก ใช้ผสมกับปูนซีเมนต์ ทราย และนํ้า สำหรับฉาบทาฝาผนัง.
ปูนซีเมนต์,น.,วัสดุใช้ในการก่อสร้างชนิดหนึ่ง ลักษณะเป็นผง เมื่อผสมคลุกกับนํ้าแล้วทิ้งไว้จะเกิดปฏิกิริยาเคมีเป็นผลให้เกิดการก่อตัวและแข็งตัวได้ องค์ประกอบเคมีที่สำคัญคือ แคลเซียมซิลิเกต แคลเซียมอะลูมิเนต และแคลเซียมอะลูมิโนเฟอร์ไรต์ ใช้ประโยชน์เพื่อทำคอนกรีต ปูนฉาบ หรือ ปูนก่อ.
ปูนดิบ,น.,"ปูนที่ได้จากการเผาหินปูนหรือเปลือกหอยจนสลายตัว, ปูนไฟ ก็เรียก."
ปูนแดง,น.,ปูนสุกที่เมื่อผสมกับผงขมิ้นและนํ้าจะเป็นสีแดง สำหรับป้ายพลูกินกับหมาก.
ปูนปลาสเตอร์,น.,แคลเซียมซัลเฟต (CaSO_4· H_2O) ที่มีลักษณะเป็นผงสีขาวคล้ายปูนขาว ได้จากการเผายิปซัม (CaSO_4·2H_2O) ให้ร้อนถึง ๑๒๐ °-๑๓๐ °ซ. เมื่อนำไปผสมกับนํ้าแล้วทิ้งไว้จะแข็งตัวได้เร็วมาก ใช้ประโยชน์ในการนำไปทำแม่พิมพ์ รูปปั้น เป็นต้น หรือพอกอวัยวะไม่ให้เคลื่อนไหวในการรักษากระดูกหัก.
ปูนปั้น,น.,เรียกลวดลายประดับตามอาคารหรือสิ่งก่อสร้างที่ทำจากปูน ว่า ลายปูนปั้น.
ปูนเปียก,น.,เรียกภาพเขียนผนังอาคารหรือสิ่งก่อสร้างที่เขียนขณะผนังยังชื้นอยู่ ว่า ภาพปูนเปียก.
ปูนผิว,น.,ปูนขาวอย่างละเอียดใช้ฉาบทาพื้นนอกให้ขาวเป็นนวล.
ปูนเพชร,น.,ปูนชนิดหนึ่ง ทำด้วยปูนขาวผสมทรายละเอียด นํ้ากาวหนัง และนํ้าเชื้อนํ้าตาล ใช้ปั้นรูปต่าง ๆ เช่น หน้าบัน ลายกระหนก หัวนาค.
ปูนไฟ,น.,"ปูนที่ได้จากการเผาหินปูนหรือเปลือกหอยจนสลายตัว, ปูนดิบ ก็เรียก."
ปูนสอ,น.,"ปูนขาวที่ผสมกับทรายและนํ้ากาวหนังหรือนํ้าอ้อยเป็นต้น สำหรับเชื่อมอิฐหรือหิน, ปูนขาวหรือปูนซีเมนต์ผสมกับทรายและนํ้า สำหรับเชื่อมอิฐหรือหิน."
ปูนสุก,น.,"ปูนดิบที่ถูกความชื้นในอากาศหรือพรมนํ้าแล้วแตกละเอียดเป็นผงขาว, ปูนขาว ก็เรียก."
ปูนแห้ง,น.,เรียกสีชมพูอย่างหนึ่งคล้ายสีปูนกินกับหมากเมื่อแห้ง ว่า สีปูนแห้ง.
ปู่น้อย,น.,น้องชายของปู่.
ปูม ๑,น.,"จดหมายเหตุของโหร, เรียกสมุดบันทึกรายการต่าง ๆ เกี่ยวกับการเดินเรือหรือการเดินอากาศ เช่น เดินทางจากไหนถึงไหน วันที่เดินทาง จำนวนชั่วโมง ฯลฯ ว่า สมุดปูมเดินทาง."
ปูม ๒,น.,ผ้าไหมชนิดหนึ่งมีดอกเป็นตา ๆ.
ปูมโหร,น.,"ตาตารางแผนที่แสดงลำดับการเคลื่อนไหวของดาวพระเคราะห์แต่ละวัน, ปฏิทินโหราศาสตร์ ก็เรียก."
ปู่ย่า,น.,ดู ช้าเลือด.
ปู้ยี่ปู้ยำ,ว.,"ชอกชํ้า, ยับเยิน."
ปูระ,ก.,บุรณะ.
ปูลู ๑,น.,"เรียกขวานชนิดหนึ่ง มีบ้องที่หัวบิดได้ สำหรับตัดและถาก ว่า ขวานปูลู, ปุลู หรือ โยน ก็เรียก."
ปูลู ๒,น.,ดู เต่าปูลู ที่ เต่า ๑.
ปูเล ๑,น.,เรียกส่วนล่างของทางใบที่หุ้มรอบลำต้นหมากเมื่อแก่จัดแล้วหลุดลงมา ว่า กาบปูเล.
ปูเล ๒,น.,วิธีการจับสัตว์น้ำอย่างหนึ่ง โดยใช้ผ้าหนา ๆ ห่อทรายม้วนเป็นลำยาวแล้วใช้คนประมาณ ๑๐ คนดันผ้าไปตามหาดทรายหรือชายตลิ่งตื้น ๆ เพื่อต้อนปลาขึ้นไปบนฝั่ง.
ปูวา,น.,ขนม เช่น ปูวาต้มแดงต้มขาว (กฎหมายเก่า).
เป้,ว.,"เอน, ตะแคง, เบี้ยว, ไม่ตรงที่."
เป้,น.,เครื่องหลังของทหารตำรวจเป็นต้น.
เป๋,ว.,"บิดไป เช่น ขาเป๋, ไถลไป, เฉไป, เช่น ขี่จักรยานเป๋เข้าข้างทาง, เอียงมากไปข้างใดข้างหนึ่ง เช่น หวีผมเป๋, มักใช้เข้าคู่กับคำ ไป๋ เป็น เป๋ไป๋ หรือ ไป๋เป๋."
เปก ๑,ว.,เสียงดังอย่างเสียงเคาะไม้.
เป๊ก ๑,ว.,เสียงดังอย่างเสียงเคาะไม้.
เปก ๒,น.,"คำกำกับชื่อปีในวิธีนับศักราชของไทยทางเหนือ ตรงกับเลข ๕, เขียนเป็น เบิก ก็มี."
เป๊ก ๒,น.,หมุดสำหรับตรึงสิ่งต่าง ๆ มีกระดาษเป็นต้น.
เป๊ก ๓,ว.,ใช้ประกอบคำ แข็ง ว่า แข็งเป๊ก หมายความว่า แข็งมาก.
เป๊ก ๔,น.,ภาชนะสำหรับตวงเหล้า ทำด้วยแก้วหรือโลหะ ขนาดถ้วยนํ้าชาเล็ก ๆ ประมาณ ๑๘ ซีซี.
เป่ง,ว.,พองขึ้นหรือนูนขึ้นเต็มที่ เช่น บวมเป่ง ท้องเป่ง.
เป๋ง,ว.,ใช้ประกอบคำอื่นหมายความว่า ยิ่งกว่าปรกติ เช่น ตรงเป๋ง ตึงเป๋ง
เป๋ง,ว.,เสียงดังเช่นนั้น.
เป้ง ๑,น.,"ชื่อปาล์ม ๓ ชนิดในสกุล Phoenix วงศ์ Palmae ก้านใบมีหนาม คือ เป้งทะเล ( P. paludosa Roxb.) ขึ้นตามชายทะเล, เป้งดอย ( P. loureiroiKunth) ขึ้นตามป่าดอน, และ เป้งบก ปุ่มเป้ง หรือ ปุ้มเป้ง ( P. acaulis Roxb.) ขึ้นในป่าเต็งรัง."
เป้ง ๒,ว.,โต เช่น มดเป้ง
เป้ง ๒,ว.,ถูกอย่างจัง เช่น ชนเป้ง
เป้ง ๒,ว.,เสียงดังอย่างเสียงตีด้วยไม้แรง ๆ.
เป็ด ๑,น.,ชื่อสัตว์ปีกจำพวกนกขนาดเล็กถึงขนาดใหญ่ มีหลายวงศ์ ปากแบน ตัวมีหลายสี เช่น นํ้าตาล ขาว เขียว ขนาดเล็กกว่าห่าน มีพังผืดนิ้วแบบตีนพัดและตีนกลีบช่วยในการว่ายนํ้า ว่ายนํ้าเก่ง กินปลา พืชนํ้า และสัตว์เล็ก ๆ เฉพาะเป็ดที่เลี้ยงตามบ้านมีต้นตระกูลมาจากเป็ดหัวเขียว ( Anas platyrhynchosLinn.) ในวงศ์ Anatidae.
เป็ด ๒,น.,"ชื่อไม้ล้มลุก ๒ ชนิดในสกุล Alternanthera วงศ์ Amaranthaceae เรียกว่า ผักเป็ด คือ ผักเป็ดขาว [ A. sessilis (L.) DC.] ใบสีเขียว กินได้และใช้ทำยาได้, ผักเป็ดไทย ก็เรียก และผักเป็ดแดง [ A. bettzickiana (Regel) G. Nicholson] ใบสีแดง ปลูกเป็นไม้ประดับ."
เป็ด ๓,น.,"ชื่อเรือต่อหรือเรือขุดต่อกระดานเสริมกราบชนิดหนึ่ง หัวท้ายแบน ๆ ก็มี หัวท้ายแหลมก็มี กลางป่องดูรูปร่างคล้ายเป็ด, อีเป็ด ก็เรียก."
เป็ดก่า,น.,ชื่อนกเป็ดนํ้าขนาดใหญ่ชนิด Cairina scutulata (Müller) วงศ์ย่อย Anatinae ในวงศ์ Anatidae หัวและคอสีขาวประดำ อกสีเขียวเกือบดำ ทำรังในโพรงไม้ริมลำธารในป่า มักเกาะนอนบนต้นไม้สูง ๆ เวลาบินจะเห็นแถบสีขาวที่ปีกได้ชัดเจน ร้องเสียง “ก่า ๆ ” เป็นนกเป็ดนํ้าที่ใหญ่ที่สุดในประเทศไทย.
เป็ดแก้ว,น.,"ชื่อปลาทะเลหรือนํ้ากร่อยชนิด Plotosus lineatus (Thunberg) และ P. canius (Hamilton) ในวงศ์ Plotosidae มีเงี่ยงที่ครีบอกและครีบหลังตอนแรก ส่วนครีบหลังตอนที่ ๒ ต่อเนื่องกับครีบก้นและครีบหางยาว, สามแก้ว ปิ่นแก้ว หรือ เป็ดแก้ว ก็เรียก."
เป็ดขันประชันไก่,น.,ผู้ที่มีความรู้ความสามารถน้อยแต่อวดแสดงแข่งกับผู้ที่มีความรู้ความสามารถสูง.
เป็ดถบ,น.,เป็ดกายสิทธิ์.
