บายศรี,น.,เครื่องเชิญขวัญหรือรับขวัญ ทำด้วยใบตอง รูปคล้ายกระทง เป็นชั้น ๆ มีขนาดใหญ่เล็กสอบขึ้นไปตามลำดับ เป็น ๓ ชั้น ๕ ชั้น ๗ ชั้น หรือ ๙ ชั้น มีเสาปักตรงกลางเป็นแกน มีเครื่องสังเวยวางอยู่ในบายศรีและมีไข่ขวัญเสียบอยู่บนยอดบายศรี มีหลายอย่าง เช่น บายศรีตอง บายศรีปากชาม บายศรีใหญ่.
บายศรีปากชาม,น.,บายศรีตองที่จัดวางลงปากชาม.
บายสุหรี,น.,สระนํ้า.
บ่ายหน้า,ก.,"เปลี่ยนไปสู่ทิศทางใดทิศทางหนึ่ง, หันหน้า, เช่น บ่ายหน้าไปทางทิศเหนือ, มุ่งหน้า เช่น ยามเย็นชาวนาบ่ายหน้ากลับบ้าน."
บ้ายอ,ว.,ชอบให้คนเยินยอ.
บาร์ ๑,น.,หน่วยวัดความกดอากาศ ๑ บาร์มีค่าเท่ากับ ๑๐๖ ดายน์ต่อตารางเซนติเมตร หรือ ๑๐๕ นิวตันต่อตารางเมตร
บาร์ ๑,น.,หน่วยวัดความดึงดูดของโลก ๑ บาร์มีค่าเท่ากับ ๙๘๐.๖๑๖ เซนติเมตรต่อวินาที ทุก ๆ วินาที.
บาร์ ๒,น.,ร้านขายเครื่องดื่มประเภทมีแอลกอฮอล์ มักมีดนตรีและที่ให้ลูกค้าเต้นรำด้วย.
บารนี,ว.,"ยิ่ง, นัก, มาก"
บารนี,ว.,ดั่งนี้ เช่น อันว่าพระญาติท่ววไท้ บมิหวังไหว้พระตถาคต ใจแลไปกรรกษ บารนี (ม. คำหลวง ทศพร).
บารมี,น.,คุณความดีที่ควรบำเพ็ญมี ๑๐ อย่าง คือ ทาน ศีล เนกขัมมะ (การออกจากกาม คือ บวช) ปัญญา วิริยะ ขันติ สัจจะ อธิฏฐาน เมตตา อุเบกขา เรียกว่า ทศบารมี
บารมี,น.,"คุณความดีที่ได้บำเพ็ญมา, คุณสมบัติที่ทำให้ยิ่งใหญ่, เช่นว่า ชมพระบารมี พระบารมีปกเกล้าฯ พ่ายแพ้แก่บารมี."
บาร์เรล,น.,หน่วยวัดความจุของของเหลว ซึ่งเมื่อใช้กับการวัดปริมาตรนํ้ามันปิโตรเลียม ๑ บาร์เรล = ๓๖ แกลลอนในประเทศอังกฤษ ส่วนในสหรัฐอเมริกา ๑ บาร์เรล = ๔๒ แกลลอน.
บาร์เลย์,น.,ข้าวบาร์เลย์. (ดู ข้าวบาร์เลย์ ที่ ข้าว).
บารอมิเตอร์,น.,เครื่องมือที่ใช้วัดความกดอากาศ อาจประกอบด้วยปรอท หรือตลับโลหะสุญญากาศ แล้วแต่ความมุ่งหมายและความสะดวกที่จะนำไปใช้.
บ้าระบุ่น,น.,"นกปรอด เช่น เค้าโมงขมิ้นบ่าวขุน บ้าระบุ่นโกญจากระทาขัน (รามเกียรติ์ ร. ๑), โบราณเขียนเป็น บารบุน ก็มี เช่น จินโจ้กระจาบเวียน บารบุนและเบญจวรรณ (บุณโณวาท)."
บ้าระห่ำ,ว.,"มุทะลุ, ทะลึ่งตึงตัง."
บ้าร่าท่า,ว.,อาการที่บานเต็มที่ เรียกว่า บานบ้าร่าท่า.
บาเรียน,น.,"ผู้เล่าเรียน, ผู้รู้ธรรม, ผู้คงแก่เรียน, เปรียญ."
บาเรียม,น.,ปืนใหญ่โบราณชนิดหนึ่ง.
บาล,ก.,"เลี้ยง, รักษา, คุ้มครอง, ปกครอง, เช่น บาลเมือง, โดยมากใช้เป็นคำหลังสมาส เช่น โลกบาล รัฐบาล นครบาล โคบาล นิรยบาล."
บ้าลำโพง,ว.,"บ้าเพราะกินเมล็ดลำโพง มีอาการซึมหรือพูดพล่าม, โดยปริยายหมายความว่า พูดโผงผาง ตึงตัง หรือแสดงกิริยาโมโหโกรธา เช่น พูดจาบ้าลำโพงโป้งไป (คาวี), ทำโมโหโกรธาบ้าลำโพง เที่ยวโป้งโหยงหยาบช้าสาธารณ์ (พิเภกสอนบุตร)."
บาลี,น.,ภาษาที่ใช้เป็นหลักในพระพุทธศาสนานิกายเถรวาท
บาลี,น.,"คัมภีร์พระไตรปิฎก, พุทธพจน์, เรียกว่า พระบาลี."
บ้าเลือด,ว.,บันดาลโทสะอย่างไม่กลัวตายเมื่อถูกทำร้ายถึงเลือดตกยางออก.
บ่าว,น.,คนรับใช้
บ่าว,น.,ชายหนุ่ม
บ่าว,น.,"เรียกชายผู้เข้าพิธีสมรส ว่า เจ้าบ่าว, คู่กับ หญิงผู้เข้าพิธีสมรส ซึ่งเรียกว่า เจ้าสาว."
บ่าวขุน ๑,น.,ชื่อวิธีนุ่งผ้า นุ่งห้อยชายข้างหนึ่งอย่างพระยายืนชิงช้านุ่ง.
บ่าวขุน ๒,น.,ชื่อนกชนิดหนึ่ง เช่น บ่าวขุนกางเขนเขจร (สมุทรโฆษ).
บ่าวไพร่,น.,คนรับใช้.
บาศ,น.,บ่วง เช่น นาคบาศ เชือกบาศ.
บาศก์,น.,"ลูกเต๋า, ลูกสกา, ใช้ว่า ลูกบาศก์."
บาสเกตบอล,น.,ชื่อกีฬาชนิดหนึ่ง ผู้เล่นแบ่งเป็น ๒ ฝ่าย ฝ่ายละ ๕ คน ผู้เล่นแต่ละฝ่ายต้องพยายามโยนลูกบอลลงในห่วงตาข่ายของฝ่ายตรงข้าม นับคะแนนตามจำนวนครั้งที่โยนลูกลงห่วงได้.
บ้าสมบัติ,ว.,ที่เห็นอะไร ๆ เป็นของมีค่าไปทั้งหมด
บ้าสมบัติ,ว.,ที่ชอบสะสมสิ่งของต่าง ๆ ไว้มากจนเกินความจำเป็น.
บ้าหมู ๑,น.,ดู ลมบ้าหมู ๑ ที่ ลม ๑.
บ้าหมู ๒,น.,ดู ลมบ้าหมู ๒ ที่ ลม ๑.
บาหลี ๑,น.,ห้องเล็ก ๆ ที่อยู่ท้ายเรือสำเภา.
บาหลี ๒,น.,"ชื่อเกาะหนึ่งของประเทศอินโดนีเซีย อยู่ทางตะวันออกของเกาะชวา, เรียกประชาชนชาวเกาะนั้น ว่า ชาวบาหลี."
บ้าหว่า,น.,เครื่องประดับข้อมืออย่างหนึ่ง เช่น บ้าหว่าทองผูกสองข้างแขนนั้น (ขุนช้างขุนแผน).
บ้าหอบฟาง,ว.,"บ้าสมบัติ เห็นอะไร ๆ เป็นของมีค่าจะเอาทั้งนั้น, อาการที่หอบหิ้วสิ่งของพะรุงพะรัง."
บ้าห้าร้อยจำพวก,ว.,บ้ามากมายหลายประเภท.
บ๋ำ,ว.,บุ๋ม.
บำเทิง,ว.,"บันเทิง, เบิกบาน, รื่นเริง, ยินดี, เช่น อาจให้เลื่องโลกดำเลิง หฤทัยบำเทิง คือทิพยโลกศุลี (อนิรุทธ์)."
บำนาญ,น.,"เงินตอบแทนที่ได้รับราชการหรือทำงานมาเป็นเวลานาน ซึ่งจ่ายเป็นรายเดือนจนตลอดชีวิตเมื่อออกจากงาน, โบราณใช้ว่า เบี้ยบำนาญ, (กฎ) เงินตอบแทนความชอบที่ได้รับราชการมาซึ่งจ่ายเป็นรายเดือน เมื่อออกจากราชการแล้ว."
บำบวง,ก.,"บนบาน, เซ่นสรวง, บูชา, เช่น สนธยากรภุมบุษ ปบังคมบำบวงสรณ พระไทรบริมณ ฑลเทพยสิงศักดิ์ (อนิรุทธ์)."
บำบัด,ก.,"ทำให้คลาย, ทำให้หาย, เช่น บำบัดทุกข์, ทำให้ทุเลาลง เช่น บำบัดโรค."
บำโบ,ก.,ลูบไล้ (อนันตวิภาค).
บำโบย,ก.,ลูบไล้ (อนันตวิภาค).
บำโบล,ก.,ลูบไล้ (อนันตวิภาค).
บำเพ็ญ,ก.,"ทำให้เต็มบริบูรณ์, เพิ่มพูน, (มักใช้ในเรื่องเกี่ยวกับศาสนา) เช่น บำเพ็ญบุญ บำเพ็ญบารมี"
บำเพ็ญ,ก.,"ประพฤติ, ปฏิบัติ, เช่น บำเพ็ญตนให้เป็นประโยชน์ บำเพ็ญพรต."
บำราบ,ก.,"ปราบ, ทำให้ราบ, ทำให้กลัว."
บำราศ,ก.,"หายไป, จากไป, พรากไป, ปราศจาก, โบราณเขียนเป็น บำราส ก็มี เช่น ใจรักบำราสนฤบดีเปลือง จิตตข้าทุราทวา (อนิรุทธ์). (แผลงมาจาก ปราศ)"
บำรุง,ก.,"ทำให้งอกงาม, ทำให้เจริญ, เช่น บำรุงต้นไม้ บำรุงบ้านเมือง"
บำรุง,ก.,รักษาให้อยู่ในสภาพที่ดี เช่น บำรุงสุขภาพ บำรุงร่างกาย เงินค่าบำรุง.
บำรุงขวัญ,ก.,ทำพิธีเช่นรดนํ้ามนต์ให้ เสกเป่าให้ หรือทำการอย่างใดอย่างหนึ่ง เช่นกล่าวปลุกใจเพื่อให้ขวัญดี มีใจกล้าหาญ.
บำรู,ก.,"ตกแต่ง, บำรุง"
บำรู,ก.,ประ เช่น ช้างบำรูงา ว่า ช้างประงา.
บำเรอ,ก.,"ปรนนิบัติให้เป็นที่ชอบใจ, เรียกหญิงที่ปรนนิบัติเช่นนั้นว่า นางบำเรอ"
บำเรอ,ก.,บูชา เช่น บำเรอไฟ.
บำเรอเชอภักดิ์,ก.,ตั้งใจรับใช้ เช่น อันว่าอมิดดาก็อยู่บำเรอเชอภักดิ์ (ม. คำหลวง ชูชก).
บำหยัด,ก.,ประหยัด เช่น บำหยัดหยาบพึงเยงยำ (กฤษณา).
บำเหน็จ,น.,"รางวัล, ค่าเหนื่อย, ค่าความชอบเป็นพิเศษ, เช่น ปูนบําเหน็จ, เงินตอบแทนที่ได้รับราชการหรือทํางานมา ซึ่งจ่ายครั้งเดียวเมื่อออกจากงาน"
บำเหน็จ,น.,เงินตอบแทนความชอบที่ได้รับราชการมาซึ่งจ่ายครั้งเดียว เมื่อออกจากราชการแล้ว
บำเหน็จดำรงชีพ,น.,เงินที่จ่ายให้แก่ผู้รับบำนาญเพื่อช่วยเหลือการดำรงชีพโดยจ่ายให้ครั้งเดียว และเมื่อรับไปแล้วจะถูกนำไปหักออกจากบำเหน็จตกทอด.
บำเหน็จดำรงชีพ,น.,เงินที่จ่ายให้ทายาทเมื่อข้าราชการหรือผู้รับบำนาญตายโดยจ่ายให้ครั้งเดียว ในกรณีไม่มีทายาท จะจ่ายให้แก่ผู้ซึ่งผู้ตายระบุไว้.
บิ,ก.,"ทำให้แตกออกหรือหลุดออกเป็นชิ้น ๆ ด้วยนิ้ว เช่น บิขนมปัง, แตกออกหรือหลุดออกด้วยอาการคล้ายคลึงเช่นนั้น."
บิกู,น.,ภิกขุ เช่น พราหมณ์ชีบีกูน้อยใหญ่ (อิเหนา).
บิกูปะระมาหนา,น.,ภิกษุกับพราหมณ์ เช่น พราหมณ์ชีบีกูประมาหนา (อิเหนา ร. ๑).
บิกูปะระหมั่นหนา,น.,ภิกษุกับพราหมณ์ เช่น พราหมณ์ชีบีกูประมาหนา (อิเหนา ร. ๑).
บิฐ,น.,"ตั่ง, ที่นั่งชนิดหนึ่ง รูปสี่เหลี่ยม มีเท้า มีพนักอิงบ้างไม่มีบ้าง, เช่น พระที่นั่งภัทรบิฐ."
บิณฑ-,น.,ก้อนข้าว.
บิณฑบาต,น.,อาหาร (ใช้แก่พระภิกษุสามเณร) เช่น รับบิณฑบาต.
บิณฑบาต,ก.,"กิริยาที่พระภิกษุสามเณรรับของที่เขานำมาใส่บาตร, โดยปริยายหมายถึง กิริยาที่พระภิกษุสามเณรขอหรือขอร้อง เช่น เรื่องนี้ขอบิณฑบาตให้เลิกแล้วต่อกัน."
บิด ๑,ก.,"หมุนให้เป็นเกลียวอย่างบิดผ้า, หมุนไปทางใดทางหนึ่ง เช่น บิดลูกบิด"
บิด ๑,ก.,"เผล้ไปจากสภาพปรกติ เช่น ล้อรถบิด, ทำให้ผิดไปจากสภาพความจริง เช่น บิดข้อความ"
บิด ๑,ก.,"หลีกเลี่ยงเพราะความเกียจคร้านเป็นต้น เช่น บิดงาน บิดการ, เอานิ้วมือบีบเนื้ออย่างแรงทำนองแหนบแล้วหมุน เช่น บิดเนื้อ บิดหู"
บิด ๑,ก.,กิริยาที่ปลากัดหรือปลาเข็มเอาปากต่อปากกัดกันจนติดแล้วกลับตัวไปมา.
บิด ๑,น.,ลักษณนามเรียกอาการที่ปลากัดหรือปลาเข็มเอาปากต่อปากกัดกันแล้วกลับตัวไปมาเช่นนั้นแต่ละยก ว่า ๒ บิด ๓ บิด.
บิด ๒,น.,โรคลำไส้ใหญ่อักเสบ มีอาการปวดมวนและอุจจาระเป็นมูกเลือด.
บิดขวา,ว.,เรียกอาการที่ห่มจีวรโดยม้วนชายด้านข้างทั้ง ๒ ให้เป็นลูกบวบหันเข้าทางขวา ว่า ห่มบิดขวา.
บิดขี้เกียจ,ก.,บิดร่างกายไปมาเพราะความเกียจคร้านหรือเพื่อแก้เมื่อยเป็นต้น.
บิดจะกูด,ว.,อาการที่บิดไปบิดมาไม่ยอมทำอะไรหรือไม่ยอมทำตามสั่ง.
บิดซ้าย,ว.,เรียกอาการที่ห่มจีวรโดยม้วนชายด้านข้างทั้ง ๒ ให้เป็นลูกบวบหันออกทางซ้าย ว่า ห่มบิดซ้าย.
บิดตะกูด,ว.,อาการที่บิดไปบิดมาไม่ยอมทำอะไรหรือไม่ยอมทำตามสั่ง.
บิดเบี้ยว,ว.,บิดจนผิดรูปผิดร่างไปมาก เช่น หน้าตาบิดเบี้ยว รูปร่างบิดเบี้ยว.
บิดเบือน,ก.,ทำให้ผิดแผกไปจากเดิมหรือจากข้อเท็จจริง.
บิดพลิ้ว,ก.,หลีกเลี่ยงไม่ปฏิบัติตามสัญญาหรือปฏิบัติไม่ตรงตามข้อตกลง.
บิดร,น.,พ่อ.
บิดไส้,ก.,ใช้เวทมนตร์ทำให้เกิดอาการเจ็บปวดในท้องคล้ายลำไส้ถูกบิด.
บิดหล่า,น.,เครื่องมือชนิดหนึ่งสำหรับเจาะไม้ ปลายมีคม คล้ายสว่าน ใช้มือดึงเชือกที่พันด้ามให้หมุน.
บิดหัวลูก,น.,โรคบิดที่เป็นแก่หญิงมีครรภ์แก่จวนจะคลอด.
บิดา,น.,"พ่อ (ใช้ในภาษาทางการ), โดยปริยายหมายความว่า ผู้ให้กำเนิด เช่น บิดาแห่งประวัติศาสตร์."
บิตุ,น.,"พ่อ, ใช้เป็นคำหน้าสมาส เช่น บิตุฆาต บิตุราช."
บิตุจฉา,น.,"อา (ผู้หญิง), ป้า (ญาติฝ่ายพ่อ)."
บิตุรงค์,น.,พ่อ.
บิตุเรศ,น.,พ่อ.
บิตุละ,น.,"อา (ผู้ชาย), ลุง (ญาติฝ่ายพ่อ)."
บิตุลา,น.,"อา (ผู้ชาย), ลุง (ญาติฝ่ายพ่อ)."
บิตุลานี,น.,"อา (ผู้หญิง), ป้า (ญาติฝ่ายพ่อ)."
บิ่น,ก.,แตกลิไปเล็กน้อย (ที่คม ที่แง่ หรือที่ยอด) เช่น มีดบิ่น ชามปากบิ่น.
บิ่น,ว.,"บ้าอย่างหุนหันพลันแล่น, บ้าบิ่น ก็ว่า."
บิน ๑,ก.,"ไปในอากาศด้วยกำลังปีกหรือเครื่องยนต์เป็นต้น เช่น นกบิน เครื่องบินบิน, โดยปริยายหมายถึง การไปโดยลักษณะคล้ายคลึงเช่นนั้น เช่น จานบิน"
บิน ๑,ก.,เรียกหน่อไม้ที่ขึ้นสูงจนเป็นลำ แต่ยอดยังมีกาบหุ้มอยู่ แก่เกินกิน ว่า หน่อไม้บิน.
บิน ๒,น.,"ชื่อปลาทะเลในสกุล Parexocoetus และ Cypselurus วงศ์ Exocoetidae ปากอยู่ปลายสุดของหัว เชิดขึ้นเล็กน้อย ตาโต หัวและด้านหลังแบนลงเล็กน้อยเป็นเหลี่ยมด้านท้องเกือบกลม ครีบหลังและครีบก้นอยู่ค่อนไปทางหางซึ่งเป็นแฉกลึกโดยแฉกล่างยาวกว่าแฉกบน ครีบอกใหญ่ใช้ร่อนถลาไปเหนือผิวนํ้าคล้ายปีก ลำตัวยาวเพรียว ส่วนบนลำตัวสีเขียวหรือนํ้าเงิน ข้างท้องสีขาวเงิน อาศัยอยู่บริเวณผิวนํ้า ขนาดยาว ๑๐-๓๐ เซนติเมตร, ปลาบิน ก็เรียก."
บินยา,น.,"ชื่อไม้ต้นขนาดใหญ่ชนิด Mangifera caesia Jack ในวงศ์ Anacardiaceae ดอกสีม่วงอ่อนผลสุกกินได้, บินยา หรือ ลำยา ก็เรียก."
บินหลา,น.,นกกางเขนบ้าน. (ดู กางเขน).
บิลเลียด,น.,ชื่อกีฬาในร่มอย่างหนึ่ง เล่นบนโต๊ะรูปสี่เหลี่ยมผืนผ้าปูสักหลาด มีหลุมกรุตาข่าย ๖ หลุมที่มุมทั้ง ๔ และตรงกลางด้านยาว ผู้เล่นใช้ไม้ยาวซึ่งเรียกว่า คิว แทงลูกกลม ๓ ลูก ลูกสีขาว ๒ ลูก ลูกสีแดง ๑ ลูก ให้ได้แต้มตามกติกา.
บิวเรตต์,น.,หลอดแก้วยาว ปลายล่างมีลูกบิดให้ปิดเปิดได้ ข้างหลอดมีขีดบอกปริมาตรสำหรับวัดของเหลวที่ไขออก ใช้ประโยชน์ในการวิเคราะห์ทางเคมี.
บิศาจ,น.,"ปิศาจ, ปีศาจ, ผี."
บิสมัท,น.,ธาตุลำดับที่ ๘๓ สัญลักษณ์ Bi เป็นโลหะ ลักษณะเป็นของแข็งสีขาวอมแดง เปราะ หลอมละลายที่ ๒๗๑.๓ °ซ. เป็นตัวนำความร้อนและไฟฟ้าที่เลว มีสมบัติพิเศษ คือ ขยายตัวเมื่อแข็งตัว ใช้ประโยชน์นำไปผสมกับโลหะอื่นให้เป็นโลหะเจือ ซึ่งหลอมละลายที่อุณหภูมิตํ่า.
