ปรัตยูษ,ว.,"ปัจจูส, เช้ามืด, ใกล้รุ่ง."
ปรัตยูห์,น.,"อันตราย, ความขัดข้อง."
ปรัตเยก,ว.,ปัจเจก.
ปรัน,ก.,เอาของใหญ่กระแทกหรือดันเข้าไปในของเล็ก (มักใช้เป็นคำด่า).
ปรั่น,ว.,เสียงแปร้น เช่น ร้องก้องปรั่นประดิรพยทั่วแล (ม. คำหลวง สักบรรพ).
ปรั้น,ว.,เสียงแปร้น เช่น ร้องก้องปรั่นประดิรพยทั่วแล (ม. คำหลวง สักบรรพ).
ปรับ ๑,ก.,"บอก, เล่า."
ปรับ ๒,ก.,"เปรียบ, เทียบ"
ปรับ ๒,ก.,"ทำให้อยู่ในสภาพที่เหมาะหรือดีขึ้น, ทำให้เรียบ, ทำให้เสมอ"
ปรับ ๒,ก.,"ลงโทษให้ใช้เงินเพราะทำผิด, ลงโทษให้เป็นแพ้"
ปรับ ๒,น.,โทษทางอาญาสถานหนึ่ง ซึ่งผู้กระทำความผิดต้องชำระเงินตามจำนวนที่ศาลกำหนด หรือตามที่ผู้มีอำนาจเปรียบเทียบได้เปรียบเทียบ.
ปรับทุกข์,ก.,"บอกเล่าความทุกข์, พรรณนาถึงความทุกข์."
ปรับโทษ,ก.,กำหนดโทษที่จะลง.
ปรับปรุง,ก.,แก้ไขให้เรียบร้อยยิ่งขึ้น.
ปรับไหม,ก.,ให้ผู้กระทำผิดหรือกระทำละเมิดชำระเงินค่าสินไหมทดแทนหรือค่าปรับ.
ปรับอากาศ,ว.,ที่ปรับอุณหภูมิและความชื้นของอากาศด้วยอุปกรณ์ที่เรียกว่าเครื่องปรับอากาศ.
ปรับอาบัติ,ก.,เอาโทษเป็นผิดตามพระวินัย (ใช้แก่พระภิกษุ).
ปรัมปรา,ว.,"สืบ ๆ กันมา, เก่าก่อน."
ปรัศจิม,น.,ปัจฉิม.
ปรัศนา,น.,ปัญหา.
ปรัศนี,น.,"เครื่องหมายวรรคตอนรูปดังนี้ ?, เครื่องหมายคำถาม ก็เรียก"
ปรัศนี,น.,สิ่งที่เป็นเงื่อนงำต้องหาคำตอบ.
ปรัศว์,น.,"ข้าง, สีข้าง, ราชาศัพท์ใช้ว่า พระปรัศว์"
ปรัศว์,น.,"เรียกอาคาร ๒ หลังที่อยู่ขนานกัน ซึ่งอยู่ต่อท้ายพระที่นั่งที่เป็นประธาน ว่า พระปรัศว์ เช่น ในหมู่พระมหามณเฑียร มีพระที่นั่งเทพสถานพิลาสเป็นพระปรัศว์ขวา พระที่นั่งเทพอาศน์พิไลเป็นพระปรัศว์ซ้าย, โบราณเขียนว่า พระปลัด ก็มี."
ปรัสสบท,น.,"“บทเพื่อผู้อื่น”, ในตำราไวยากรณ์บาลีและสันสกฤตใช้เป็นเครื่องหมายให้ทราบว่าเป็นกริยากรรตุวาจก เช่น สูโท โอทนํ ปจติ = พ่อครัวหุงอยู่ซึ่งข้าวสุก, ปจติ เป็นกริยาปรัสสบท, ตรงข้ามกับ อัตตโนบท."
ปร่า,ว.,ลักษณะของรสที่ไม่กลมกล่อมไม่แน่ชัดว่าเป็นรสอะไร เช่นรสแกงที่มีเครื่องปรุงไม่เหมาะส่วน.
ปรากฏ,ก.,สำแดงออกมาให้เห็น.
ปรากฏการณ์,น.,การสำแดงออกมาให้เห็น.
ปรากรม,น.,"ความเพียร, ความบากบั่น."
ปรากฤต,น.,ภาษาพื้นเมืองในอินเดียสมัยโบราณซึ่งสืบเนื่องมาจากภาษาตระกูลอริยกะ.
ปราการ,น.,กำแพงสำหรับป้องกันการรุกราน.
ปราคภาร,น.,เงื้อมภูเขา.
ปราคาร,น.,ตึกใหญ่.
ปราง,น.,แก้ม
ปราง,น.,มะปราง.
ปรางค์,น.,"สิ่งก่อสร้างมียอดสูงขึ้นไปมีรูปทรงคล้ายฝักข้าวโพดและมีฝักเพกาปักอยู่ข้างบน, ถ้าเป็นเจดีย์มียอดเช่นนั้น เรียกว่า เจดีย์ยอดปรางค์."
ปรางคณะ,น.,"คณะ, สำนัก"
ปรางคณะ,น.,สนาม
ปรางคณะ,น.,พื้นอย่างพื้นเรือน.
ปรางค์ปรา,น.,ตัดมาจาก ปรางค์ปราสาท.
ปราจีน,น.,ทิศตะวันออก.
ปราชญ์,น.,ผู้มีปัญญารอบรู้.
ปราชญา,น.,ปัญญา.
ปราชัย,น.,ความพ่ายแพ้.
ปราชัย,ก.,พ่ายแพ้.
ปราชาปัตยวิวาหะ,น.,การสมรสวิธีหนึ่งที่บิดายกลูกสาวให้เจ้าบ่าวโดยปราศจากการเรียกร้องอย่างใดอย่างหนึ่งจากเจ้าบ่าว.
ปราชิต,ก.,แพ้.
ปราณ,น.,ลมหายใจ
ปราณ,น.,"สัตว์มีชีวิต, ชีวิต, ใจ."
ปราณี,น.,"ผู้มีชีวิต, สัตว์, คน."
ปราด,ก.,เดินหรือวิ่งตรงเข้าไปหรือออกมาอย่างรวดเร็ว เช่น ปราดเข้าไป ปร๊าดออกมา.
ปราด,ว.,อาการที่เดินหรือวิ่งตรงเข้าไปหรือออกมาอย่างรวดเร็ว เช่น เดินปราด วิ่งปร๊าด.
ปร๊าด,ก.,เดินหรือวิ่งตรงเข้าไปหรือออกมาอย่างรวดเร็ว เช่น ปราดเข้าไป ปร๊าดออกมา.
ปร๊าด,ว.,อาการที่เดินหรือวิ่งตรงเข้าไปหรือออกมาอย่างรวดเร็ว เช่น เดินปราด วิ่งปร๊าด.
ปราดเปรียว,ว.,"ว่องไว, คล่องแคล่ว."
ปราดเปรื่อง,ว.,"มีความคิดแคล่วคล่องว่องไว, เปรื่องปราด ก็ว่า."
ปราติหารย์,น.,ปาฏิหาริย์.
ปราทุกรา,น.,"ปาทุกา, รองเท้า."
ปราน,น.,"โคตร, วงศ์."
ปรานี,ก.,เอ็นดูด้วยความสงสาร.
ปรานีตีเอาเรือ,ก.,เอ็นดูหรือเผื่อแผ่เขา แต่กลับถูกประทุษร้ายตอบ เช่น มุทะลุดุดันขันเหลือ ปรานีตีเอาเรือเสียอีกเล่า (สังข์ทอง).
ปรานีปราศรัย,ก.,ปรานี (มักใช้ในความปฏิเสธ) เช่น ใช้อย่างไม่ปรานีปราศรัย.
ปราบ,ก.,"ทำให้ราบ, ทำให้อยู่ในอำนาจ."
ปราบดาภิเษก,ว.,มีอภิเษกอันถึงแล้ว.
ปราบดาภิเษก,น.,พระราชพิธีขึ้นเสวยราชสมบัติหรือได้ราชสมบัติ.
ปราบปราม,ก.,ทำให้สงบราบคาบ.
ปราปต์,ก.,"ถึงแล้ว, ได้แล้ว."
ปราภพ,น.,ความฉิบหาย.
ปราม,ก.,ว่ากล่าวตักเตือนให้เกรงกลัว.
ปรามาส ๑,ก.,ดูถูก.
ปรามาส ๒,น.,"การจับต้อง, การลูบคลำ."
ปราโมช,น.,"ความบันเทิงใจ, ความปลื้มใจ, ปราโมทย์ ก็ใช้."
ปราโมทย์,น.,"ความบันเทิงใจ, ความปลื้มใจ, ปราโมช ก็ใช้."
ปราย,ก.,"ซัด, หว่าน, สาดให้กระจายไป, เช่น ปรายข้าวตอกดอกไม้, มักใช้เข้าคู่กับคำ โปรย เป็น โปรยปราย."
ปรารถนา,ก.,"มุ่งหมาย, อยากได้, ต้องการ."
ปรารภ,ก.,กล่าวถึง
ปรารภ,ก.,ตั้งต้น
ปรารภ,ก.,ดำริ.
ปรารมภ์,ก.,เริ่มแรก
ปรารมภ์,ก.,"วิตก, รำพึง, ครุ่นคิด."
ปราศ,ก.,"พ้นไป, ไม่มี."
ปราศจาก,ก.,"พ้นไป, ไม่มี."
ปราศรัย,น.,"การพูดด้วยไมตรีจิต, การแสดงอัชฌาสัยในระหว่างผู้ใหญ่ต่อผู้น้อยหรือผู้ที่เสมอกัน"
ปราศรัย,น.,คำปรารภ.
ปราศรัย,ก.,"พูดด้วยไมตรีจิต, พูดแสดงอัชฌาสัยระหว่างผู้ใหญ่ต่อผู้น้อยหรือผู้ที่เสมอกัน"
ปราศรัย,ก.,ปรารภ.
ปราษณี,น.,"ส้นเท้า, ราชาศัพท์ว่า พระปราษณี."
ปราษาณ,น.,หิน.
ปราสัย,ก.,ปราศรัย.
ปราสาท,น.,เรือนยอดซ้อนกันเป็นชั้น ๆ สำหรับเป็นที่ประทับเฉพาะพระมหากษัตริย์หรือเป็นที่ประดิษฐานสิ่งศักดิ์สิทธิ์.
ปรำ,ก.,ทำอาการดุจกระทุ้ง
ปรำ,ก.,เจาะจง
ปรำ,ก.,เทลงไปเร็ว ๆ ให้ปนกับของอื่น
ปรำ,ก.,รุมกล่าวโทษ.
ปริ- ๑,*ว.,"เป็นอุปสรรคในภาษาบาลีและสันสกฤต, ใช้นำหน้าศัพท์อื่นแปลว่า รอบ เช่น ปริมณฑล."
ปริ ๒,ก.,"แย้ม, ผลิ, แตกแต่น้อย."
ปริก ๑,น.,ส่วนยอดของฝาโถหรือผอบที่ทำด้วยทองอย่างหัวแหวนนพเก้า สำหรับสวมบนฝาโถหรือผอบ.
ปริก ๒,น.,ชื่อไม้ล้มลุกมีหัวใต้ดินชนิด Asparagus sprengeri Regel ในวงศ์ Asparagaceae ดอกสีขาว กลิ่นหอม ใช้ทำยาได้.
ปริกขาร,น.,บริขาร.
ปริกรรม,น.,บริกรรม.
ปริกรรม-,น.,บริกรรม.
ปริกรรมนิมิต,น.,“อารมณ์ในบริกรรม” คือ สิ่งที่ใช้เพ่งหรือนึกเป็นอารมณ์ในเวลาบริกรรม.
ปริกัป,ก.,กำหนด.
ปริกัลป-,น.,"ความตรึก, ความดำริ, ความกำหนดในใจ."
ปริกัลปมาลา,น.,ระเบียบกริยาในไวยากรณ์ที่บอกความคาดหมาย ความกำหนด.
ปริขา,น.,คู
ปริขา,น.,สนามเพลาะ.
ปริคณห์,น.,บริคณห์.
ปริจาค,น.,บริจาค.
ปริจาริกา,น.,บริจาริกา.
ปริเฉท,น.,บริเฉท.
ปริชน,น.,บริชน.
ปริซึม,น.,แท่งตันชนิดหนึ่ง ปลายทั้ง ๒ เป็นรูปหลายเหลี่ยมซึ่งมีพื้นที่เท่ากัน เป็นรูปแบบเดียวกันและขนานกันด้วย ส่วนด้านข้างทุกด้านของแท่งเป็นรูปสี่เหลี่ยมด้านขนาน
ปริซึม,น.,แท่งตันทำด้วยวัตถุโปร่งใส เช่นแก้ว หินควอตซ์ ปลายทั้ง ๒ เป็นรูปสามเหลี่ยมซึ่งมีพื้นที่เท่ากัน เป็นรูปแบบเดียวกันและขนานกันด้วย ส่วนด้านข้างทุกด้านของแท่งเป็นรูปสี่เหลี่ยมด้านขนาน ใช้ประโยชน์สำหรับหักเหแนวทางเคลื่อนที่ของแสง.
ปริญญา,น.,"ความกำหนดรู้, ความหยั่งรู้, ความรู้รอบ"
ปริญญา,น.,"ชั้นความรู้ขั้นมหาวิทยาลัยซึ่งประสาทให้แก่ผู้ที่สอบไล่ได้ตามที่กำหนดไว้, ถ้าประสาทแก่ผู้ทรงวิทยาคุณหรือผู้มีเกียรติตามที่เห็นสมควร เรียกว่า ปริญญากิตติมศักดิ์."
ปริญญาบัตร,น.,บัตรที่แสดงวิทยฐานะของผู้สำเร็จการศึกษาว่ามีศักดิ์และสิทธิ์ระดับปริญญา.
ปริณาม,น.,"การผันแปร, การเปลี่ยนแปลง, การย่อยไป."
ปริณามัคคิ,น.,ไฟธาตุที่ย่อยอาหาร.
ปริณามัคคิ,น.,ดู ปริณาม.
ปริณายก,น.,"ผู้นำบริวาร, หัวหน้า, ผู้เป็นใหญ่."
ปริต,ว.,น้อย.
ปริต-,ว.,น้อย.
ปริตตะ,ว.,น้อย.
ปริตโตทก,น.,"นํ้าพระปริตร, นํ้าพระพุทธ-มนต์."
ปริตทวีป,น.,"ทวีปน้อย, คู่กับ มหาทวีป."
ปริตยาค,ก.,บริจาค.
ปริตร ๑,น.,"ความต้านทาน, เครื่องป้องกัน"
ปริตร ๑,น.,"พระพุทธมนต์ในเจ็ดตำนานที่เรียกว่า สัตปริตร และสิบสองตำนานที่เรียกว่า ทวาทศปริตร, ตำนานหนึ่ง เรียกว่า ปริตรหนึ่ง."
ปริตร ๒,ว.,น้อย.
ปริทรรศน์,น.,"ชื่อกล้องชนิดหนึ่งที่ใช้มองดูสิ่งต่าง ๆ ซึ่งมีที่กำบังขวางกั้น หรือใช้มองดูสิ่งต่าง ๆ ที่อยู่เหนือระดับสายตาผู้มองได้โดยรอบ เช่น กล้องเรือดำนํ้า, กล้องตาเรือ ก็เรียก."
ปริทัยหัคคี,น.,ไฟธาตุที่ทำกายให้กระสับกระส่าย.
ปริทัศน์,น.,การวิจารณ์
ปริทัศน์,น.,หนังสือประเภทวารสารที่วิจารณ์ข่าวหรือเรื่องราวต่าง ๆ.
ปริเทพ,น.,"ปริเทวะ, ปริเทวนะ."
ปริเทพน์,น.,"ปริเทวะ, ปริเทวนะ."
ปริเทวนะ,น.,"ความครํ่าครวญ, ความรำพันด้วยเสียใจ, ความบ่นเพ้อ."
ปริเทวะ,น.,"ความครํ่าครวญ, ความรำพันด้วยเสียใจ, ความบ่นเพ้อ."
ปรินิพพาน,น.,"การดับรอบ, การดับสนิท, การดับโดยไม่เหลือ"
ปรินิพพาน,น.,เรียกอาการตายของพระพุทธเจ้าและพระอรหันต์.
ปริบ ๆ,ก.,"กะพริบถี่ ๆ เช่น ทำตาปริบ ๆ, กะปริบ ๆ ก็ว่า."
ปริบท,น.,บริบท.
ปริปันถ์,น.,"อันตราย, อันตรายในทางเปลี่ยว."
ปริปาก,ก.,แย้มปากพูดออกมา (มักใช้ในความปฏิเสธ) เช่น อย่าปริปากบอกใครนะ.
ปริพนธ์,ก.,"ผูก, แต่ง, ร้อยกรอง."
ปริพัตร,ก.,บริพัตร.
ปริพันธ์,ก.,บริพันธ์.
ปริพาชก,น.,"นักบวชผู้ชายนอกพระพุทธศาสนาประเภทหนึ่งในอินเดีย, เพศหญิงใช้ว่า ปริพาชิกา."
ปริพาชิกา,น.,นักบวชผู้หญิงนอกพระพุทธศาสนาประเภทหนึ่งในอินเดีย.
ปริภัณฑ์,น.,บริภัณฑ์.
ปริภาษ,ก.,บริภาษ.
ปริภาษณ์,ก.,บริภาษ.
ปริภุญช์,ก.,กิน.
ปริภูมิ,น.,เซตที่มีโครงสร้างบางอย่าง อาจเป็นโครงสร้างแบบเรขาคณิตหรือโครงสร้างแบบอื่นก็ได้.
ปริโภค,ก.,บริโภค.
ปริ่ม,ว.,"เสมอขอบ, เสมอพื้น, (ในลักษณะอย่างนํ้าที่ขึ้นเสมอขอบตลิ่งหรือดอกบัวที่โผล่ขึ้นเสมอพื้นนํ้าเป็นต้น)"
ปริ่ม,ว.,อาการที่มีความยินดีปลื้มใจ เช่น ปริ่มใจ ปริ่มยิ้ม ปริ่มเปรม.
ปริมณฑล,น.,"วงรอบ, จังหวัดรอบกรุงเทพมหานคร ได้แก่ นครปฐม นนทบุรี สมุทรสาคร สมุทรปราการ ฉะเชิงเทรา และปทุมธานี"
ปริมณฑล,น.,ความเรียบร้อย เช่น นุ่งห่มให้เป็นปริมณฑล.
ปริมัท,ก.,"นวด, บีบ, ขยำ."
ปริมาณ,น.,กำหนดความมากน้อยของจำนวน.
ปริมาตร,น.,ขนาดของสิ่งใด ๆ ที่มีรูปทรง ๓ มิติ และระบุปริมาณเป็นหน่วยลูกบาศก์ เช่น ลูกบาศก์เมตร ลูกบาศก์ฟุต.
ปริย-,ว.,ที่รัก.
ปริยรณ,น.,ผู้ชอบรบ.
ปริยวาท,น.,คำพูดเป็นที่รัก.
ปริยวาที,น.,ผู้มีถ้อยคำอ่อนหวาน.
ปริยัติ,น.,การเล่าเรียนพระไตรปิฎก.
ปริยัติธรรม,น.,ธรรมที่จะต้องเล่าเรียนได้แก่พระไตรปิฎก.
ปริยานุช,น.,น้องที่รัก.
ปริยาย,น.,"อย่าง, ทาง, หนทาง"
ปริยาย,น.,"การกล่าวอ้อมค้อม, นัยทางอ้อม, ตรงข้ามกับ นิปริยาย คือ อย่างตรง"
ปริยาย,น.,"การสอน, การเล่าเรื่อง."
ปริยาย,ว.,อ้อม
ปริยาย,ว.,เจตนากระทำที่มิได้แสดงออกอย่างชัดแจ้งแต่อนุมานได้จากพฤติกรรมที่แสดงออก.
ปริเยศ,ว.,ที่รัก.
ปริโยสาน,น.,"ที่สุดลงโดยรอบ (หมายความว่า ที่สุดหรือจบลงอย่างบริบูรณ์แล้ว), จบ."
ปริวรรต,ก.,หมุนเวียน เช่น ปริวรรตเงินตรา
ปริวรรต,ก.,"เปลี่ยนแปลง, เปลี่ยนไป, แปรไป."
ปริวรรต-,ก.,หมุนเวียน เช่น ปริวรรตเงินตรา
ปริวรรต-,ก.,"เปลี่ยนแปลง, เปลี่ยนไป, แปรไป."
ปริวรรตกรรม,น.,การหมุนเวียน.
ปริวัตร,ก.,ปริวรรต เช่น จะเชื้อเชิญพระดาบสให้ปริวัตรเป็นบรมกษัตริย์ (ม. กาพย์ สักบรรพ).
ปริวาร,น.,บริวาร.
ปริวาส,น.,"การอยู่ค้างคืน, การอยู่แรมคืน"
ปริวาส,น.,ชื่อกรรมที่ภิกษุต้องอาบัติสังฆาทิเสสต้องประพฤติ.
ปริวิตก,ก.,นึกเป็นทุกข์หนักใจ.
ปริเวณ,น.,บริเวณ.
ปริศนา,น.,สิ่งหรือถ้อยคำที่ผูกขึ้นเป็นเงื่อนงำเพื่อให้แก้ให้ทาย.
ปริศนาธรรม,น.,ปริศนาในทางธรรม.
ปริศนาลายแทง,น.,ข้อความที่เป็นปริศนาเป็นเครื่องแสดงขุมทรัพย์ที่ฝังอยู่ในดินเป็นต้น.
ปริศนาอักษรไขว้,น.,ปริศนาที่จะต้องตอบโดยการเติมคำลงในตารางสี่เหลี่ยมที่กำหนดให้ช่องละ ๑ อักษร แล้วให้อ่านได้ใจความทั้งในแนวยืนและแนวนอน.
ปริษการ,น.,บริขาร.
ปริษัท,น.,บริษัท.
