ปัจโจปการกิจ,น.,การที่บุคคลทำตอบแทนอุปการะของผู้อื่น.
ปัจโจสกาล,น.,เวลาเช้ามืด.
ปัจฉา,ว.,"ภายหลัง, เบื้องหลัง, ข้างหลัง."
ปัจฉาภัต,น.,เวลาภายหลังบริโภคอาหาร คือ ตั้งแต่เที่ยงแล้วไป.
ปัจฉาสมณะ,น.,สมณะผู้ตามหลัง คือ พระผู้น้อยมีหน้าที่เดินตามหลังพระผู้ใหญ่.
ปัจฉิม,ว.,ตะวันตก
ปัจฉิม,ว.,"ภายหลัง, ทีหลัง, ข้างหลังสุด."
ปัจฉิม-,ว.,ตะวันตก
ปัจฉิม-,ว.,"ภายหลัง, ทีหลัง, ข้างหลังสุด."
ปัจฉิมชน,น.,ชนที่เกิดภายหลัง.
ปัจฉิมทิศ,น.,ทิศตะวันตก.
ปัจฉิมพรรษา,น.,"“พรรษาหลัง”, ช่วงระยะเวลาที่ภิกษุเข้าอยู่จำพรรษาหลัง คือตั้งแต่วันแรม ๑ ค่ำ เดือน ๙ ถึงขึ้น ๑๕ ค่ำ เดือน ๑๒, คู่กับ บุริมพรรษา หรือ ปุริมพรรษา."
ปัจฉิมภาค,น.,ส่วนเบื้องปลาย.
ปัจฉิมยาม,น.,"ยามหลัง, ยามสุดท้าย, ในบาลีแบ่งคืนออกเป็น ๓ ยาม กำหนดยามละ ๔ ชั่วโมง เรียกว่า ปฐมยาม มัชฌิมยาม และปัจฉิมยาม ปัจฉิมยามกำหนดเวลาตั้งแต่ตี ๒ หรือ ๒ นาฬิกา ถึงย่ำรุ่ง หรือ ๖ นาฬิกา."
ปัจฉิมลิขิต,น.,"“เขียนภายหลัง” คือหนังสือที่เขียนเพิ่มเติมลงท้ายเมื่อเซ็นชื่อแล้ว, ใช้อักษรย่อว่า ป.ล."
ปัจฉิมวัย,น.,"วัยตอนปลาย, วัยชรา."
ปัจฉิมวาจา,น.,วาจาครั้งสุดท้าย.
ปัจถรณ์,น.,บรรจถรณ์.
ปัจนึก,น.,"ข้าศึก, ศัตรู."
ปัจยาการ,น.,อาการที่เป็นเหตุต่อเนื่องกัน คือ ปฏิจจสมุปบาท.
ปัจเวกขณ์,น.,"การเห็นลงจำเพาะ, การพิจารณา."
ปัชชร,ก.,ประชวร.
ปัชชุน,น.,เมฆ.
ปัญจ-,ว.,เบญจะ.
ปัญจก,น.,"เบญจก, หมวด ๕."
ปัญจกะ,น.,"เบญจก, หมวด ๕."
ปัญจนที,น.,แม่นํ้า ๕ สาย คือ ๑. คงคา ๒. ยมนา ๓. อจิรวดี ๔. สรภู ๕. มหี.
ปัญจม-,ว.,"เบญจม, ที่ ๕."
ปัญจมี,ว.,ที่ ๕.
ปัญจมีดิถี,น.,วัน ๕ คํ่า.
ปัญจวัคคีย์,น.,พวก ๕ คน เป็นคำเรียกพระสงฆ์ ๕ รูป มีพระอัญญาโกณฑัญญะเป็นต้น ที่ตามพระพุทธเจ้าออกบวช และได้เป็นพระอรหันต์ก่อนพวกอื่น.
ปัญจวีสติ,ว.,ยี่สิบห้า.
ปัญจสาขา,น.,กิ่งทั้ง ๕ คือ หัว ๑ แขน ๒ ขา ๒ ของลูกที่อยู่ในท้อง.
ปัญจะ,ว.,เบญจะ.
ปัญญัติ,ก.,บัญญัติ.
ปัญญา,น.,"ความรอบรู้, ความรู้ทั่ว, ความฉลาดเกิดแต่เรียนและคิด, เช่น คนมีปัญญา หมดปัญญา."
ปัญญาแค่หางอึ่ง,ว.,"มีความรู้น้อย, โง่."
ปัญญาชน,น.,คนที่มีความรู้หรือความฉลาดอันเกิดแต่การเรียนมามาก.
ปัญญาวิมุติ,น.,"ความหลุดพ้นด้วยปัญญา เป็นโลกุตรธรรมประการหนึ่ง, คู่กับ เจโตวิมุติ."
ปัญญาส-,ว.,ห้าสิบ.
ปัญญาอ่อน,น.,ภาวะที่มีระดับสติปัญญาด้อยหรือตํ่ากว่าปรกติ มักมีสาเหตุเกิดขึ้นในระหว่างพัฒนาการ ทำให้เด็กมีความสามารถจำกัดในด้านการเรียนรู้และมีพฤติกรรมปรับตัวไม่อยู่ในระดับที่ควรเป็น.
ปัญญาอ่อน,ว.,มีระดับสติปัญญาด้อยหรือต่ำกว่าปรกติ.
ปัญหา,น.,"ข้อสงสัย, ข้อขัดข้อง, เช่น ทำได้โดยไม่มีปัญหา, คำถาม, ข้อที่ควรถาม, เช่น ตอบปัญหา, ข้อที่ต้องพิจารณาแก้ไข เช่น ปัญหาเฉพาะหน้า ปัญหาทางการเมือง."
ปัญหาโลกแตก,น.,ปัญหาที่หาข้อยุติไม่ได้.
ปัฏ,น.,"ผืนผ้า, แผ่นผ้า."
ปัฏนะ,น.,ท่าเรือ.
ปัฐยาวัต,น.,"ชื่อฉันท์ชนิดหนึ่ง ซึ่งกำหนดด้วยอักษร ๓๒ คำ มี ๔ บาท บาทละ ๘ คำ, บัฐยาพฤต หรือ อัษฎกฉันท์ ก็เรียก."
ปัณฑรหัตถี,น.,"ชื่อช้างตระกูล ๑ ใน ๑๐ ตระกูล กายสีขาวดังเขาไกรลาส, ช้าง ๑๐ ตระกูล คือ ๑. กาฬาวกหัตถี ๒. คังไคยหัตถี ๓. ปัณฑรหัตถี ๔. ตามพหัตถี ๕. ปิงคลหัตถี ๖. คันธหัตถี ๗. มงคลหัตถี ๘. เหมหัตถี ๙. อุโบสถหัตถี ๑๐. ฉัททันตหัตถี."
ปัณณะ,น.,บรรณ.
ปัณณาส,ว.,ห้าสิบ.
ปัณณาสก์,ว.,หมวด ๕๐.
ปัณรส-,ว.,สิบห้า.
ปัณรสม-,ว.,ที่ ๑๕.
ปัณรสมสุรทิน,น.,วันที่ ๑๕.
ปัณรสี,ว.,ที่ ๑๕.
ปัณรสีดิถี,น.,วัน ๑๕ คํ่า.
ปัณหิ,น.,"ส้นเท้า, ราชาศัพท์ว่า พระปัณหิ."
ปัด ๑,ก.,ทำให้หมดไปด้วยการพัดหรือโบกเป็นต้น เช่น ปัดฝุ่น ปัดแมลงวัน
ปัด ๑,ก.,"เบนไป, เฉไป, เช่น พระอาทิตย์ปัดเหนือปัดใต้ ท้ายรถปัดไปทางหนึ่ง เดินขาปัด"
ปัด ๑,ก.,กระทบเรียดไป เช่น กิ่งไม้ปัดหลังคา
ปัด ๑,ก.,"เกลี่ยให้เสมอกัน, เกลี่ยให้เรียบ, เช่น ปัดขนตา ปัดคิ้ว ปัดแก้ม."
ปัด ๒,น.,เม็ดแก้วเป็นต้นมีรูตรงกลางสำหรับร้อยเป็นเครื่องประดับต่าง ๆ เรียกว่า ลูกปัด.
ปัด ๆ,ว.,"อาการที่โกรธกระฟัดกระเฟียด, อาการที่ดิ้นพราด ๆ อย่างปลาที่ถูกตี."
ปัด ๆ เป๋ ๆ,ว.,"ตุปัดตุเป๋, อาการที่เดินเฉไปเฉมา."
ปัดเกล้า,น.,ท่ารำชนิดหนึ่งแห่งหมอช้าง รำเมื่อนำช้างบำรูงาเสร็จครั้งแรกแล้ว.
ปัดขา,ก.,ทำให้ล้มหรือเสียหลัก.
ปัดแข้งปัดขา,ก.,ทำอย่างใดอย่างหนึ่งเพื่อให้เขาหลุดพ้นตำแหน่งหน้าที่หรือไม่ให้ได้เลื่อนฐานะตำแหน่งที่ควรจะได้.
ปัดเงา,ก.,ทำให้ขึ้นเงาเป็นมันวาวด้วยแปรงเป็นต้น.
ปัดซาง,ก.,เสกเป่าให้ซางหาย.
ปัดตลอด,ว.,มีขนขาวหรือดำเป็นแนวยาวไปตามสันหลังตั้งแต่หัวตลอดหาง เช่น แมวปัดตลอด
ปัดตลอด,ว.,เรียก “นะ” ที่เขียนเป็นอักษรขอม สำหรับลงและปลุกเสกให้แคล้วคลาดตลอดปลอดภัยว่า “นะปัดตลอด”.
ปัดไถม,น.,ฝ้าบาง ๆ ที่เกิดขึ้นทำให้เป็นมลทินหรือคลํ้ามัว.
ปัดเป่า,ก.,"ทำพิธีเสกเป่าเพื่อให้ความเจ็บไข้หาย, แก้ความลำบากขัดข้องให้หมดไป."
ปัดพิษ,ก.,เสกเป่าเพื่อให้พิษหมดไป.
ปัดรังควาน,ก.,"ทำพิธีขับไล่ผี, โดยปริยายหมายถึง ขับไล่อัปรีย์จัญไรให้พ้นไป."
ปัดเศษ,ก.,ทิ้งเศษเสียหรือเพิ่มเศษให้เข้าจำนวนเต็ม.
ปัดสวะ,ก.,"ทำอย่างขอไปที, ผลักให้พ้นหน้าที่ความรับผิดชอบของตนไป."
ปัตคาด,น.,ชื่อเส้นในร่างกายของคน ในตำราหมอนวดว่า ตั้งแต่ท้องน้อยถึงโคนขาทั้งด้านหน้าและด้านหลัง.
ปัตตะ,น.,บัตร
ปัตตะ,น.,บาตร.
ปัตตานีกะ,น.,"กองทัพเหล่าราบ, กองทัพทหารเดินเท้า, เป็นส่วนหนึ่งแห่งกระบวนทัพโบราณ ซึ่งเรียกว่า จตุรงคพล จตุรงคโยธา จตุรงคเสนา หรือ จตุรงคินีเสนา มี ๔ เหล่า ได้แก่ ๑. หัตถานึก (กองทัพช้าง, เหล่าทหารช้าง) ๒. อัศวานึก (กองทัพม้า, เหล่าทหารม้า) ๓. รถานึก (กองทัพเหล่ารถ) ๔. ปัตตานึก หรือปัตตานีกะ (กองทัพเหล่าราบ, กองทัพทหารเดินเท้า)."
ปัตตานึก,น.,"กองทัพเหล่าราบ, กองทัพทหารเดินเท้า, เป็นส่วนหนึ่งแห่งกระบวนทัพโบราณ ซึ่งเรียกว่า จตุรงคพล จตุรงคโยธา จตุรงคเสนา หรือ จตุรงคินีเสนา มี ๔ เหล่า ได้แก่ ๑. หัตถานึก (กองทัพช้าง, เหล่าทหารช้าง) ๒. อัศวานึก (กองทัพม้า, เหล่าทหารม้า) ๓. รถานึก (กองทัพเหล่ารถ) ๔. ปัตตานึก หรือปัตตานีกะ (กองทัพเหล่าราบ, กองทัพทหารเดินเท้า)."
ปัตตานุโมทนา,น.,การอนุโมทนาส่วนบุญที่ผู้อื่นให้.
ปัตตานุโมทนามัย,ว.,"สำเร็จด้วยการยินดีในความดีของผู้อื่น, เป็นธรรมข้อ ๑ ในบุญกิริยาวัตถุ ๑๐."
ปัตตาเวีย ๑,น.,"ชื่อเมืองในเกาะชวาสมัยโบราณ เดิมเรียกว่าเมืองกะหลาป๋า, ปัจจุบันคือ จาการ์ตา."
ปัตตาเวีย ๒,น.,ชื่อไม้พุ่มชนิด Jatropha integerrimaJacq. ในวงศ์ Euphorbiaceae ต้นเป็นพุ่มโปร่ง ดอกสีแดงและชมพู.
ปัตติ,น.,ส่วนบุญ.
ปัตติก,น.,"พลเดินเท้า, ทหารราบ."
ปัตติทาน,น.,การให้ส่วนบุญ.
ปัตติทานมัย,ว.,"สำเร็จด้วยการเฉลี่ยส่วนแห่งความดีให้แก่ผู้อื่น, เป็นธรรมข้อ ๑ ในบุญกิริยาวัตถุ ๑๐."
ปัตถร,น.,"บรรถร, ที่นอน, เครื่องปูลาด."
ปัตถะ,น.,"ชื่อมาตราตวงในภาษาบาลี แปลว่า แล่ง, กอบ, คือ ๒ ปัตถะ เป็น ๑ นาฬี (ทะนาน)."
ปัตนิ,น.,"หญิงแม่เรือน, เมีย. (ในตำราหมอดูว่า เนื้อคู่)."
ปัตนี,น.,"หญิงแม่เรือน, เมีย. (ในตำราหมอดูว่า เนื้อคู่)."
ปัตยัย,น.,ปัจจัย.
ปัตหล่า,น.,ผ้าริ้วทอด้วยไหมกับทองแล่งมีเนื้อบาง โดยมากทำเป็นเสื้อครุย.
ปัถพี,น.,"ปถพี, ปถวี."
ปัถวี ๑,น.,"ปถพี, ปถวี."
ปัถวี ๒,น.,ท้ายเรือพิธี เช่น หางตาเรือก็กลับไปข้างปัถวี (พงศ. เลขา).
ปัทม์,น.,ชื่อบัวหลวงพันธุ์หนึ่ง. (ดู บัว).
ปัทม-,น.,ชื่อบัวหลวงพันธุ์หนึ่ง. (ดู บัว).
ปัทมปาณี,น.,"ผู้มีดอกบัวในมือ คือ พระพรหม พระวิษณุ, ชื่อหนึ่งหรือปางหนึ่งของพระอวโลกิเตศวรโพธิสัตว์ พระหัตถ์ทรงดอกบัว."
ปัทมราค,น.,"พลอยสีแดง, ทับทิม."
ปัทมราช,น.,"พลอยสีแดง, ทับทิม."
ปัทมะ,น.,ชื่อสังขยาจำนวนสูง = ๑๐๐ โกฏิ.
ปัทมาสน์,น.,ฐานบัว (เช่นฐานพระพุทธรูปมีลายบัวควํ่าบัวหงาย).
ปัน,ก.,"แบ่ง เช่น ปันเป็นส่วน ๆ, แบ่งซื้อ ในคำว่า ขอปัน, แบ่งขาย ในคำว่า ปันให้."
ปั่น,ก.,"ทำให้หมุน, ทำให้เวียน, เช่น ปั่นแปะ ปั่นโป"
ปั่น,ก.,หมุน เช่น หัวปั่น.
ปั้น ๑,ก.,เอาสิ่งอ่อน ๆ เช่นขี้ผึ้งดินเหนียวเป็นต้นมาทำให้เป็นรูปตามที่ต้องการ เช่น ปั้นข้าวเหนียว ปั้นตุ๊กตา
ปั้น ๑,ก.,"สร้างขึ้น, เสกสรรขึ้น, เช่น ปั้นพยาน ปั้นเรื่อง"
ปั้น ๑,ก.,ชุบเลี้ยงและอบรมสั่งสอนให้เป็นคนดี เช่น ฉันปั้นเขามาจนได้ดี.
ปั้น ๑,น.,ลักษณนามเรียกสิ่งที่ปั้นเป็นก้อน ๆ เช่น ข้าวเหนียว ๓ ปั้น.
ปั้น ๒,น.,"ภาชนะดินสำหรับชงนํ้าชา มีพวยเหมือนกา, ป้าน ก็ใช้."
ปั้นจั่น,น.,"เครื่องยกของหนักประกอบด้วยเสาและรอกเป็นต้น, เครื่องจักรสำหรับยกของหนัก."
ปั้นจิ้มปั้นเจ๋อ,ว.,แสดงอาการกินหมากจัดเอาอย่างเขา
ปั้นจิ้มปั้นเจ๋อ,ว.,"เจ้าหน้าเจ้าตา, ดัดจริตเสนอหน้าหรือแสดงตัวผิดกาลเทศะ."
ปันจุเหร็จ,น.,เครื่องรัดเกล้าที่ไม่มียอด
ปันจุเหร็จ,น.,โจรป่า.
ปั้นเจ๋อ,ว.,เจ้าหน้าเจ้าตา.
ปั่นด้าย,ก.,เอาเส้นใยที่ทำให้ฟูตัวแล้วมาดึงให้ยืดเป็นเส้นพร้อมกับบิดเกลียวเพื่อให้เส้นใยเกาะตัวเป็นเส้นยาวติดต่อกัน.
ปั้นน้ำเป็นตัว,ก.,สร้างเรื่องเท็จให้เห็นเป็นจริงเป็นจังขึ้นมา.
ปั่นป่วน,ก.,"เคลื่อนไหวไปมาอย่างรุนแรงผิดปรกติ เช่น ทะเลปั่นป่วน, สับสนวุ่นวายผิดปรกติ เช่น ใจคอปั่นป่วน ท้องปั่นป่วน บ้านเมืองปั่นป่วน, ป่วนปั่น ก็ว่า."
ปั้นปึ่ง,ว.,ทำท่าเย่อหยิ่งไม่พูดจากับใคร.
ปั่นแปะ,น.,"ชื่อการพนันอย่างหนึ่ง เดิมใช้อีแปะ ปัจจุบันใช้สตางค์หรือเงินเหรียญปั่นให้หมุน แล้วใช้ฝ่ามือปิดไว้ ให้ทายว่าจะออกหัวหรือก้อย, อีกอย่างหนึ่งใช้อีแปะ สตางค์ หรือเงินเหรียญ ๒ อัน อันหนึ่งใส่ไว้ในอุ้งมือ แล้วปั่นอีกอันหนึ่งให้หมุน แล้วเอาฝ่ามือที่มีอีแปะ สตางค์ หรือเงินเหรียญตบลงไปบนอันที่กำลังหมุน ให้ทายว่า ออกหัว ก้อย หรือกลาง ถ้าออกหัว ๒ อัน เรียกว่า ออกหัว ถ้าออกก้อย ๒ อัน เรียกว่า ออกก้อย ถ้าออกหัวอันหนึ่งก้อยอันหนึ่ง เรียกว่า ออกกลาง."
ปั่นฝ้าย,ก.,"เอาใยฝ้ายเข้าติดกับไนแล้วหมุนเพื่อทำเป็นเส้นด้าย, ถ้าเป็นวัตถุอย่างอื่นเช่นไหมและปอ เรียกตามวัตถุนั้น ๆ ว่า ปั่นไหม ปั่นปอ, อีสานเรียกว่า เข็นฝ้าย."
ปั่นไฟ,ก.,"ผลิตไฟฟ้าด้วยเครื่องกำเนิดไฟฟ้า, เดินเครื่องกำเนิดไฟฟ้า."
ปั่นไฟ,น.,เรียกเครื่องกำเนิดไฟฟ้า ว่า เครื่องปั่นไฟ.
ปั้นยศ,ก.,ทำเจ้ายศเจ้าอย่าง.
ปั่นใย,น.,"ชื่อแมลงอันดับ Embioptera ลักษณะลำตัวเป็นรูปทรงกระบอก ยาว ๐.๕-๒.๐ เซนติเมตร เพศเมียทุกตัวและเพศผู้บางตัวไม่มีปีก ตีนมี ๓ ข้อ สามารถสร้างใยได้จากต่อมสร้างใยอยู่ที่ตีนข้อแรกของขาคู่หน้าที่โป่งพองออก อาศัยอยู่รวมกันเป็นกลุ่มภายในอุโมงค์ เส้นใยมักพบตามใต้เปลือกไม้ รอยแตกในดินและหิน ที่พบบ่อย เช่น ชนิด Oligotoma saundersii Westwood ในวงศ์ Oligotomidae, ชักใย ก็เรียก."
ปั้นลม,น.,"ชื่อไม้แผ่นที่พาดบนหัวแป ใช้ปิดริมหลังคาด้านหัวและท้ายเรือนกันลมตีเครื่องมุง, ป้านลม ก็ว่า."
ปั้นล่ำ,น.,ชื่อขนมทำด้วยแป้งเกลือกงา.
ปั้นล่ำ,ก.,อวดดี.
ปันส่วน,ก.,แบ่งเฉลี่ยตามส่วน.
ปันส่วน,ว.,ที่แบ่งเฉลี่ยตามส่วน เช่น ข้าวปันส่วน.
ปั้นสิบ,น.,"ของกินอย่างหนึ่ง ทำด้วยแป้งข้าวเจ้า ใช้แป้งห่อไส้แล้วม้วนบิดริมแป้งตรงที่ประกบกันให้เป็นลายเกลียว นึ่งหรือทอด, แป้งสิบ ก็เรียก."
ปั้นสีหน้า,ก.,แกล้งแสดงหน้าตาให้ผิดปรกติเพื่อลวงให้เขาหลงเชื่อ เช่น ไม่เจ็บแต่ปั้นสีหน้าให้เหมือนคนเจ็บ.
ปั้นหยา,น.,สิ่งปลูกสร้างซึ่งมีหลังคาเอนเข้าหาอกไก่ทั้ง ๔ ด้าน ไม่มีหน้าจั่ว เรียกว่า เรือนปั้นหยา.
ปั่นหัว,ก.,ทำให้งง (มาจากการกัดจิ้งหรีด โดยจับตัวที่แพ้มาปั่นหัวให้งง เพื่อจะได้สู้ต่อไป) เช่น ปั่นหัวจิ้งหรีด
ปั่นหัว,ก.,ยุให้ผิดใจกัน.
ปั้นเหน่ง,น.,เข็มขัด.
ปับ,ว.,เสียงดังอย่างเสียงถูกชกหรือต่อย
ปับ,ว.,"อาการที่เป็นไปอย่างฉับไว, ทันทีทันใด, เช่น วางปับ หยิบปับ, มักใช้เข้าคู่กับคำ ปุบ เป็น ปุบปับ."
