คำ,POS,ความหมาย
ป,?,พยัญชนะตัวที่ ๒๗ เรียกว่า ปอ ปลา เป็นอักษรกลาง ใช้เป็นพยัญชนะต้น และเป็นตัวสะกดในมาตรากบหรือแม่กบ เช่น บาป เนปจูน สัปดาห์.
ปก ๑,ก.,แผ่ออกคลุมเบื้องบน เช่น ตะไคร้ใบปกดิน.
ปก ๑,น.,"กระดาษหรือผ้าหรือหนังเป็นต้นที่หุ้มอยู่ภายนอกสมุดหรือหนังสือเป็นต้น, ใบปก ก็เรียก"
ปก ๑,น.,"แผ่นผ้าที่ติดปากกระเป๋าเสื้อ, แผ่นผ้าที่ติดกับคอเสื้อพับตลบลงมาหรือแบะออกทั้ง ๒ ข้าง เช่น ปกเชิ้ต ปกเสื้อนอก."
ปก ๒,น.,แว่นแคว้น เช่น ได้ขึ้นเสวยราชย์เป็นพระยาผ่านในปกเมืองเนืองทั้งปกเขม ครั้นเต็มสมบูรณ์สามสิบแปดข้าว เข้าศักราชเจ็ดร้อยห้าสิบแปด กลายท่านได้ปราบต์ทั้งปกกาวชาวด้านหนตีนเถิงฝั่งของ (จารึกวัดบูรพาราม).
ปก ๓,น.,ปลาแก้มชํ้า. (ดู แก้มชํ้า).
ปกกระพอง,น.,แผ่นผ้าที่ปิดตรงกระหม่อมของช้างหลวง.
ปกเกศ,ก.,"ปกเกล้า, คุ้มครอง."
ปกครอง,ก.,"ดูแล, คุ้มครอง, ระวังรักษา"
ปกครอง,ก.,บริหาร.
ปกคลุม,ก.,แผ่คลุมอยู่เบื้องบน.
ปกติ,ว.,"ธรรมดา เช่น ตามปกติ, เป็นไปตามเคย เช่น เหตุการณ์ปกติ, ไม่แปลกไปจากธรรมดา เช่น อาการปกติ, ปรกติ ก็ว่า."
ปกป้อง,ก.,คุ้มครองป้องกัน.
ปกปักรักษา,ก.,ดูแลรักษา.
ปกปิด,ก.,"ปิดไม่ให้รู้หรือไม่ให้เห็น, ปิดไว้เป็นความลับ."
ปกรณ์,น.,"คัมภีร์, ตำรา, หนังสือ."
ปกรณัม,น.,"ปกรณ์, เรื่อง, เช่น ปักษีปกรณัม."
ปการ,น.,"อย่าง, ชนิด."
ปกิณก-,ว.,"เรี่ยราย, เบ็ดเตล็ด, กระจาย, ระคนกัน, คละกัน, (มักใช้ประกอบหน้าศัพท์) เช่น ปกิณกคดี."
ปกิณกะ,ว.,"เรี่ยราย, เบ็ดเตล็ด, กระจาย, ระคนกัน, คละกัน, (มักใช้ประกอบหน้าศัพท์) เช่น ปกิณกคดี."
ปกีรณัม,ก.,"จำแนกหรือกระจายออกไป, เขียนเป็น ปกีรณำ ก็มี เช่น ปกีรณำพจนาดถ์."
ปโกฏิ,น.,"ชื่อมาตรานับ = ๑๐๐,๐๐๐,๐๐๐,๐๐๐,๐๐๐ (เท่ากับสิบล้านโกฏิ). (ป.). (ดู โกฏิ)."
ปง,ว.,"เสียงดังเช่นนั้น, ปงปัง ก็ว่า."
ป่ง,น.,"พื้นดินที่มีเกลือสินเธาว์ผุดเกรอะกรังอยู่, ป่าหรือดินที่มีป่ง เรียกว่า ป่าป่ง ดินป่ง, เรียกผีที่เชื่อว่ามีอยู่ในที่เช่นนั้น ว่า ผีป่ง, เรียกลักษณะที่นั่งบนห้างที่ใช้ไม้ขัดและผูกเป็นแคร่บนต้นไม้หรือบนกอไผ่เพื่อคอยเฝ้าดูหรือยิงสัตว์ที่มากินดินป่ง ว่า นั่งป่ง, โป่ง ก็ว่า."
ปงช้าง,น.,"ชื่อพรรณไม้ ๒ ชนิดในสกุล Stemona วงศ์ Stemonaceae คือ ชนิด S. collinsiae Craib เป็นไม้เถาล้มลุก, กะเพียดช้าง หรือ ปงช้าง ก็เรียก"
ปงปัง,น.,กลองสองหน้าขนาดเล็ก หน้ากลองกว้างประมาณ ๘ นิ้ว มีด้ามถือสำหรับกวัดแกว่งให้ลูกตุ้มกระทบหน้ากลองให้เกิดเสียง.
ปงปัง,ว.,"เสียงดังเช่นนั้น, ปง ก็ว่า."
ปฎล,น.,"หลังคา, เพดาน, ชั้น."
ปฏัก,น.,ประตัก.
ปฏิ-,*ว.,"คำอุปสรรคในภาษาบาลีใช้นำหน้าศัพท์อื่น แปลว่า เฉพาะ เช่น ปฏิทิน, ตอบ เช่น ปฏิพากย์, ทวน เช่น ปฏิโลม, กลับ เช่น ปฏิวัติ."
ปฏิกรณ์,น.,"เครื่องที่ใช้สำหรับก่อให้เกิดปฏิกิริยาแตกสลายทางนิวเคลียร์อย่างสมํ่าเสมอและควบคุมได้เพื่อผลิตพลังงาน สารกัมมันตรังสี เครื่องชนิดนี้มีหลายแบบ และใช้เชื้อเพลิงนิวเคลียร์ซึ่งมักเป็นแท่งยูเรเนียม, มักเรียกว่า เครื่องปฏิกรณ์ปรมาณู."
ปฏิกรรมสงคราม,น.,การชดใช้ค่าเสียหายที่ฝ่ายชนะสงครามเรียกร้องเอาจากฝ่ายแพ้.
ปฏิการ-,น.,"การสนองคุณ, การตอบแทนคุณ, คู่กับ อุปการะ"
ปฏิการ-,น.,การซ่อมแซม.
ปฏิการะ,น.,"การสนองคุณ, การตอบแทนคุณ, คู่กับ อุปการะ"
ปฏิการะ,น.,การซ่อมแซม.
ปฏิกิริยา,น.,การกระทำตอบสนอง
ปฏิกิริยา,น.,การกระทำต่อต้าน
ปฏิกิริยา,น.,ผลของการกระทำซึ่งเป็นเหตุให้เกิดกิริยาสะท้อนมาเป็นอีกอย่างหนึ่ง
ปฏิกิริยา,น.,การเกิดการเปลี่ยนแปลงทางเคมีของสาร.
ปฏิกูล,ว.,สกปรกน่ารังเกียจ เช่น สิ่งปฏิกูล.
ปฏิคคหิต,ก.,รับเอา เช่น เราก็ปฏิคคหิตด้วยศรัทธา (ม. คำหลวง วนปเวสน์).
ปฏิคคหิต,ว.,อันรับเอาแล้ว.
ปฏิคม,น.,"ผู้ต้อนรับ, ผู้รับแขก, ผู้ดูแลต้อนรับ."
ปฏิคหิต-,ก.,รับเอา เช่น เราก็ปฏิคคหิตด้วยศรัทธา (ม. คำหลวง วนปเวสน์).
ปฏิคหิต-,ว.,อันรับเอาแล้ว.
ปฏิคาหก,น.,"ผู้รับทาน หมายถึง สมณพราหมณ์ เช่น วันรุ่งพรุ่งนี้จะมีเหตุด้วยปฏิคาหก ยาจกจะมารับพระราชทาน (ม. ร่ายยาว กุมาร), คู่กับ ทายก คือ ผู้ถวายจตุปัจจัยแก่ภิกษุสามเณร."
ปฏิฆะ,น.,"ความคับแค้น, ความกระทบกระทั่ง, ความขึ้งเคียด (โทสะ)."
ปฏิชีวนะ,น.,เรียกยาประเภทที่มีสารที่สกัดจากผลผลิตของเชื้อจุลินทรีย์ ใช้ฆ่าหรือยับยั้งการแพร่พันธุ์ของแบคทีเรีย ว่า ยาปฏิชีวนะ.
ปฏิญญา,น.,การให้คำมั่นสัญญาหรือการแสดงยืนยันโดยถือเอาสิ่งศักดิ์สิทธิ์หรือความสุจริตใจเป็นที่ตั้ง.
ปฏิญญาสากลว่าด้วยสิทธิมนุษยชน,น.,การให้คำมั่นสัญญาหรือการแสดงยืนยันถึงสิทธิหรืออำนาจอันชอบธรรมของมนุษย์ซึ่งเป็นที่ยอมรับกันทั่วไป.
ปฏิญาณ,ก.,ให้คำมั่นสัญญา โดยมากมักเป็นไปตามแบบพิธี เช่น พิธีถวายสัตย์ปฏิญาณของข้าราชการเนื่องในวันเฉลิมพระชนมพรรษา.
ปฏิทิน,น.,แบบสำหรับดูวัน เดือน ปี.
ปฏิทินโหราศาสตร์,น.,"ตาตารางแผนที่แสดงการเคลื่อนไหวของดาวพระเคราะห์แต่ละวัน, ปูมโหร ก็เรียก."
ปฏิบถ,ว.,"ทวนทาง, สวนทาง."
ปฏิบัติ,ก.,"ดำเนินการไปตามระเบียบแบบแผน เช่น ปฏิบัติราชการ, กระทำเพื่อให้เกิดความชำนาญ เช่น ภาคปฏิบัติ"
ปฏิบัติ,ก.,กระทำตาม เช่น ปฏิบัติตามสัญญา
ปฏิบัติ,ก.,ประพฤติ เช่น ปฏิบัติสมณธรรม ปฏิบัติต่อกัน
ปฏิบัติ,ก.,ปรนนิบัติรับใช้ เช่น ปฏิบัติบิดามารดา ปฏิบัติครูบาอาจารย์.
ปฏิบัติการ,ก.,ทำงานตามหน้าที่.
ปฏิบัติการ,ว.,ที่ทดลองเพื่อพิสูจน์ข้อเท็จจริงตามทฤษฎีหรือฝึกงานเพื่อให้เกิดความชำนาญเป็นต้น เช่น ห้องปฏิบัติการ.
ปฏิบัติธรรม,ก.,ประพฤติตามธรรม
ปฏิบัติธรรม,ก.,เจริญภาวนา.
ปฏิบัติบูชา,น.,"การบูชาด้วยการปฏิบัติตามคำสั่งสอน, คู่กับ อามิสบูชา ซึ่งเป็นการบูชาด้วยสิ่งของ."
ปฏิปทา,น.,"ทาง, ทางดำเนิน, เช่น มัชฌิมาปฏิปทา คือ ทางสายกลาง"
ปฏิปทา,น.,ความประพฤติ เช่น พระภิกษุรูปนี้มีปฏิปทาน่าเลื่อมใส.
ปฏิปักษ์,น.,"ฝ่ายตรงกันข้าม, ข้าศึก, ศัตรู."
ปฏิปักษ์,ว.,ที่ตรงกันข้าม เช่น ฝ่ายปฏิปักษ์.
ปฏิปุจฉาพยากรณ์,น.,การจำแนกธรรมหรือพยากรณ์ปัญหาธรรมด้วยวิธีย้อนถาม.
ปฏิปุจฉาวาที,น.,ผู้จำแนกธรรมหรือพยากรณ์ปัญหาธรรมด้วยวิธีย้อนถาม.
ปฏิพัทธ์,ก.,"ผูกพัน, รักใคร่, เช่น มีจิตปฏิพัทธ์."
ปฏิพากย์,น.,"การกล่าวตอบ, การพูดโต้ตอบ, เช่น เพลงปฏิพากย์ คือ เพลงที่ร้องโต้ตอบกัน."
ปฏิภาค,น.,ส่วนเปรียบ.
ปฏิภาค,ว.,"เทียบเคียง, เหมือน."
ปฏิภาค-,น.,ส่วนเปรียบ.
ปฏิภาค-,ว.,"เทียบเคียง, เหมือน."
ปฏิภาคนิมิต,น.,“อารมณ์เทียบเคียง” คือ เมื่อพบเห็นสิ่งใดจนติดตาหลับตาเห็นแล้วอาจนึกทายส่วนหรือแบ่งส่วนแห่งสิ่งนั้นให้สมรูปสมสัณฐาน เรียกว่า ปฏิภาคนิมิต.
ปฏิภาณ,น.,เชาวน์ไวในการกล่าวแก้หรือโต้ตอบเป็นต้นได้ฉับพลันทันทีและแยบคาย.
ปฏิภาณ-,น.,เชาวน์ไวในการกล่าวแก้หรือโต้ตอบเป็นต้นได้ฉับพลันทันทีและแยบคาย.
ปฏิภาณกวี,น.,กวีผู้มีความสามารถในการแต่งร้อยกรองได้ฉับพลันทันที.
ปฏิภาณปฏิสัมภิทา,น.,"ปัญญาอันแตกฉานในปฏิภาณ คือ ความเข้าใจทำให้สามารถแก้ไขเหตุการณ์ได้ในเมื่อเกิดเหตุฉุกเฉิน หรือกล่าวโต้ตอบได้ทันท่วงที, เป็นธรรมข้อ ๑ ในปฏิสัมภิทา ๔ คือ ๑. อรรถปฏิสัมภิทา ๒. ธรรม-ปฏิสัมภิทา ๓. นิรุตติปฏิสัมภิทา ๔. ปฏิภาณปฏิสัมภิทา."
ปฏิภาณโวหาร,น.,การกล่าวเหมาะด้วยเหตุผลในทันที.
ปฏิมา,น.,"รูปเปรียบหรือรูปแทนองค์พระพุทธเจ้า คือ พระพุทธรูป, เรียกย่อมาจาก พุทธปฏิมา หรือ พุทธปฏิมากร."
ปฏิมากร,น.,"รูปเปรียบหรือรูปแทนองค์พระพุทธเจ้า คือ พระพุทธรูป, เรียกย่อมาจาก พุทธปฏิมา หรือ พุทธปฏิมากร."
ปฏิยุทธ์,ก.,"รบตอบ, สู้รบ."
ปฏิรพ,ก.,"ส่งเสียงเอาชัย, ร้องดัง, ร้องขู่."
ปฏิรูป,ว.,"สมควร, เหมาะสม, เช่น ปฏิรูปเทส คือ ถิ่นที่สมควร หรือ ถิ่นที่เหมาะสม"
ปฏิรูป,ว.,"เทียม, ไม่แท้, เช่น มิตรปฏิรูป."
ปฏิรูป,ก.,ปรับปรุงให้สมควร เช่น ปฏิรูปบ้านเมือง.
ปฏิรูป-,ว.,"สมควร, เหมาะสม, เช่น ปฏิรูปเทส คือ ถิ่นที่สมควร หรือ ถิ่นที่เหมาะสม"
ปฏิรูป-,ว.,"เทียม, ไม่แท้, เช่น มิตรปฏิรูป."
ปฏิรูป-,ก.,ปรับปรุงให้สมควร เช่น ปฏิรูปบ้านเมือง.
ปฏิโลม,ว.,ทวนกลับ.
ปฏิวัติ,น.,"การหมุนกลับ, การผันแปรเปลี่ยนหลักมูล"
ปฏิวัติ,น.,"การเปลี่ยนแปลงระบบ เช่น ปฏิวัติอุตสาหกรรม, การเปลี่ยนแปลงระบอบการบริหารบ้านเมือง เช่น ปฏิวัติการปกครอง."
ปฏิวาต,ว.,ทวนลม.
ปฏิวาท,น.,"คำโต้, คำคัดค้าน."
ปฏิเวธ,ก.,"เข้าใจตลอด, ตรัสรู้, ลุล่วงผลปฏิบัติ."
ปฏิสนธิ,ก.,"เกิดในท้อง, ถือกำเนิด."
ปฏิสวะ,น.,"การฝืนคำรับ, การรับแล้วไม่ทำตามรับ."
ปฏิสังขรณ์,ก.,ซ่อมแซมทำให้กลับคืนดีเหมือนเดิม (มักใช้เฉพาะวัดวาอาราม) เช่น ปฏิสังขรณ์วัด.
ปฏิสันถาร,น.,การทักทายปราศรัยแขกผู้มาหา (มักใช้แก่ผู้น้อย)
ปฏิสันถาร,น.,การต้อนรับแขก.
ปฏิสัมภิทา,น.,"ความแตกฉาน, ปัญญาอันแตกฉาน, มี ๔ อย่าง คือ อรรถปฏิสัมภิทา ธรรมปฏิสัมภิทา นิรุตติปฏิสัมภิทา ปฏิภาณปฏิสัมภิทา."
ปฏิเสธ,ก.,"ไม่รับ, ไม่ยอมรับ, เช่น ปฏิเสธการเชิญ, ไม่ยอมรับข้อเท็จจริง เช่น ปฏิเสธข้อกล่าวหา"
ปฏิเสธ,ก.,แสดงความหมายตรงกันข้ามกับยืนยัน รับ หรือ ยอมรับ.
ปฏิเสธข่าว,ก.,แสดงยืนยันว่าไม่เป็นไปตามนั้น.
ปฐพี,น.,แผ่นดิน.
ปฐพีวิทยา,น.,วิทยาศาสตร์แขนงหนึ่งที่ศึกษาเกี่ยวกับเรื่องดิน.
ปฐม,ว.,"ประถม, ลำดับแรก, ลำดับเบื้องต้น"
ปฐม,ว.,"ชั้นที่ ๑, เรียกเครื่องราชอิสริยาภรณ์ชั้นที่ ๑ ในตระกูลจุลจอมเกล้า ว่า ปฐมจุลจอมเกล้า ปฐมจุลจอมเกล้าวิเศษ."
ปฐม-,ว.,"ประถม, ลำดับแรก, ลำดับเบื้องต้น"
ปฐม-,ว.,"ชั้นที่ ๑, เรียกเครื่องราชอิสริยาภรณ์ชั้นที่ ๑ ในตระกูลจุลจอมเกล้า ว่า ปฐมจุลจอมเกล้า ปฐมจุลจอมเกล้าวิเศษ."
ปฐมกรรม,น.,กฎเบื้องต้นหรือข้อสำคัญ
ปฐมกรรม,น.,ชื่อพิธีแบบหนึ่งที่กษัตริย์ในครั้งโบราณกระทำแก่ผู้เป็นปรปักษ์.
ปฐมฌาน,น.,ฌานเบื้องต้น ได้แก่ ฌานที่ ๑ มีองค์ ๕ คือ วิตก วิจาร ปีติ สุข เอกัคตา.
ปฐมดุสิต,น.,ชื่อเพลงไทย อัตรา ๒ ชั้น หน้าทับปรบไก่
ปฐมดุสิต,น.,ชื่อเพลงไทยประเภทเพลงโหมโรง.
ปฐมทัศน์,น.,"การแสดงครั้งแรก, เรียกการแสดงละครหรือการฉายภาพยนตร์รอบแรก ว่า รอบปฐมทัศน์."
ปฐมเทศนา,น.,เทศนาครั้งแรกในพระพุทธศาสนา หมายถึง ธัมมจักกัปปวัตนสูตร
ปฐมเทศนา,น.,ชื่อพระพุทธรูปปางหนึ่ง เป็นพระพุทธรูปนั่งขัดสมาธิบ้าง นั่งห้อยพระบาทอย่างนั่งเก้าอี้บ้าง เครื่องหมายสำคัญอยู่ที่พระหัตถ์ขวา ทำนิ้วพระหัตถ์กรีดเป็นวงกลม ส่วนพระหัตถ์ซ้ายวางหงายอยู่บนพระเพลาบ้าง ถือชายจีวรบ้าง ทำท่าทางประคองพระหัตถ์ขวาบ้าง.
ปฐมนิเทศ,น.,การแนะนำชี้แนวเพื่อการศึกษาและการทำงานในเบื้องต้น.
ปฐมบุรุษ,น.,"บุรุษที่ ๑, ตามไวยากรณ์ ได้แก่ สรรพนามพวกที่ใช้แทนชื่อผู้พูด เช่น ข้า เรา แต่ตามไวยากรณ์บาลีหมายถึงพวกที่เราพูดถึง เช่น เขา."
ปฐมพยาบาล,น.,การปฏิบัติขั้นต้นยามฉุกเฉินตามวิธีแพทย์ก่อนลงมือรักษาพยาบาล.
ปฐมโพธิกาล,น.,กาลแรกตรัสรู้ คือ ระยะเวลานับตั้งแต่พระพุทธเจ้าตรัสรู้จนถึงทรงประดิษฐานพระพุทธศาสนาในแคว้นมคธ.
ปฐมยาม,น.,"ยามต้น, ในบาลีแบ่งคืนออกเป็น ๓ ยาม กำหนดยามละ ๔ ชั่วโมง เรียกว่า ปฐมยาม มัชฌิมยาม และปัจฉิมยาม ปฐมยามกำหนดเวลาตั้งแต่ย่ำค่ำ หรือ ๑๘ นาฬิกา ถึง ๔ ทุ่ม หรือ ๒๒ นาฬิกา."
ปฐมฤกษ์,น.,ช่วงเวลาแรกของฤกษ์.
ปฐมฤกษ์,ว.,เริ่มแรก เช่น ฉบับปฐมฤกษ์.
ปฐมวัย,น.,วัยต้น.
ปฐมสมโพธิ,น.,ชื่อคัมภีร์ว่าด้วยประวัติของพระพุทธเจ้า.
ปฐมสุรทิน,น.,วันที่ ๑ แห่งเดือนทางสุริยคติ.
ปฐมาษาฒ,น.,"เดือน ๘ แรก, (โบ) เขียนเป็น ปฐมาสาฒ ก็มี."
ปฐวี,น.,แผ่นดิน.
ปฐวีธาตุ,น.,ธาตุดิน เป็นธาตุ ๑ ในธาตุทั้ง ๔ คือ ๑. ปฐวีธาตุ = ธาตุดิน ๒. อาโปธาตุ = ธาตุน้ำ ๓. เตโชธาตุ = ธาตุไฟ ๔. วาโยธาตุ = ธาตุลม.
ปณต,ก.,ประณต.
ปณาม,ก.,ประณาม.
ปณิธาน,น.,ประณิธาน.
ปณิธิ,น.,ประณิธิ.
ปณีต,ว.,ประณีต.
ปด,ก.,"โกหก, พูดเท็จ, จงใจกล่าวคำที่ไม่จริง, โป้ปด ก็ว่า."
