คำ,POS,ความหมาย
ต,?,พยัญชนะตัวที่ ๒๑ เรียกว่า ตอ เต่า เป็นอักษรกลาง ใช้เป็นพยัญชนะต้น และเป็นตัวสะกดในมาตรากดหรือแม่กด เช่น จิต เมตตา ฟุต.
ตก ๑,ก.,"พลัดลง, หล่นลง, เช่น ตกบันได ตกต้นไม้"
ตก ๑,ก.,"ไหลลง, หยดลงมา, เช่น ฝนตก"
ตก ๑,ก.,ลดลง เช่น ฝีมือตก แรงตก พระอาทิตย์ตก
ตก ๑,ก.,ล่วงเข้าเวลา เช่น ตกเย็น ตกดึก
ตก ๑,ก.,เรียกสีที่ละลายออกหรือจางไปในเวลาซักหรือถูกแดดเป็นต้น ว่า สีตก
ตก ๑,ก.,อยู่ในภาวะที่ไม่น่าพอใจ เช่น ตกทุกข์ ตกระกำลำบาก ตกยาก
ตก ๑,ก.,มาถึง เช่น ของที่สั่งตกมาแล้ว
ตก ๑,ก.,ออก เช่น คำสั่งตกแล้ว ตกลูก
ตก ๑,ก.,ขาดหายไป เช่น เขียนหนังสือตก
ตก ๑,ก.,ไม่ได้ขึ้นยานพาหนะเพราะไปไม่ทันหรือไม่มีค่าโดยสาร เช่น ตกรถ ตกเรือ
ตก ๑,ก.,ลดลงตํ่า เป็นอาการแสดงว่ากลัว ยอมแพ้ หรือหมดกำลัง เป็นต้น เช่น คอตก หัวตก หางตก.
ตก ๑,ว.,สำเร็จ เช่น แก้ตก ปลงตก คิดตก.
ตก ๒,ก.,เอาเบ็ดเกี่ยวเหยื่อหย่อนลงไปให้ปลาหรือกุ้งกินแล้ววัดหรือสาวขึ้นมา เช่น ตกปลา ตกกุ้ง
ตก ๒,ก.,เอาเงินหรือสิ่งของให้ไปก่อน แล้วคิดเอาเป็นพืชผลภายหลังตามแต่จะตกลงกัน.
ตกกระ,ว.,มีลักษณะเป็นจุดดำ ๆ เล็กบ้างโตบ้างที่ผิวกายคน สัตว์ หรือสิ่งอื่น ๆ.
ตกกระไดพลอยโจน,ว.,เมื่อพลาดไปแล้วก็ยอมเลยตามเลยเพื่อไม่ให้เสียเชิง.
ตกกล้า,ก.,เพาะข้าวปลูกลงในแปลงเพาะกล้าสำหรับนาดำ.
ตกขอบ,ว.,"ที่สุดข้างใดข้างหนึ่ง เช่น ขวาตกขอบ, เต็มที่ เช่น ฮาตกขอบ."
ตกขาว,น.,"โรคระดูขาว, มุตกิด ก็เรียก."
ตกข่าว,ก.,ไม่รู้ข่าวที่คนอื่น ๆ รู้.
ตกข้าว,น.,วิธีการที่นายทุนรับซื้อข้าวตามจำนวนที่กำหนดกับชาวนาตอนที่ข้าวลัดใบแล้ว โดยตกลงกันว่านายทุนจะให้เงินแก่ชาวนาก่อน แล้วชาวนาจะให้ข้าวเปลือกแก่นายทุนหลังจากนวดข้าวเสร็จแล้ว.
ตกขุย,ก.,ออกผลเป็นเมล็ดเล็ก ๆ (ใช้แก่ไม้ไผ่).
ตกเขียว,น.,"วิธีการที่นายทุนทำสัญญาซื้อขายข้าวหรือผลไม้ตามที่ตกลงกันกับชาวนา ชาวสวน หรือชาวไร่เมื่อข้าวลัดใบหรือผลไม้ยังอ่อนอยู่ โดยตกลงกันว่านายทุนจะได้ข้าวเปลือกหรือผลไม้นั้นไปหลังจากนวดข้าวแล้วหรือเมื่อผลไม้นั้นแก่เต็มที่แล้ว เช่น ตกเขียวลำไย, โดยปริยายหมายถึงการที่พ่อแม่รับเงินจากนายทุนซึ่งจ่ายให้เป็นค่าตัวเด็กผู้หญิงไว้ล่วงหน้า แล้วนายทุนจะมารับตัวเด็กไปเพื่อค้าประเวณีเป็นการใช้หนี้คืนให้แก่นายทุน."
ตกคลัก,ก.,"อาการที่ปลาเป็นต้นมารวมกันอยู่ในบ่อหรือหนองที่นํ้างวด, ตกปลัก ก็ว่า"
ตกคลัก,ก.,ในการเล่นดวดหมายถึงลักษณะที่หมาก ๓ ตัวเดินไปถึงที่สุด มารวมกันอยู่ในตาสุดท้ายที่จะสุกออกพ้นกระดาน แต่ทอดแต้มออกไม่ได้
ตกคลัก,ก.,โดยปริยายหมายถึงอาการที่คนมารวมกันมาก ๆ ไปไหนไม่ได้.
ตกคลั่ก,ก.,"อาการที่ปลาเป็นต้นมารวมกันอยู่ในบ่อหรือหนองที่นํ้างวด, ตกปลัก ก็ว่า"
ตกคลั่ก,ก.,ในการเล่นดวดหมายถึงลักษณะที่หมาก ๓ ตัวเดินไปถึงที่สุด มารวมกันอยู่ในตาสุดท้ายที่จะสุกออกพ้นกระดาน แต่ทอดแต้มออกไม่ได้
ตกคลั่ก,ก.,โดยปริยายหมายถึงอาการที่คนมารวมกันมาก ๆ ไปไหนไม่ได้.
ตกค้าง,ว.,หลงเหลืออยู่.
ตกเครือ,ก.,ออกเครือ (ใช้แก่กล้วย).
ตกงาน,ก.,"ว่างงาน, ไม่มีงานทำ."
ตกจั่น,ก.,ออกดอก (ใช้แก่หมากและมะพร้าว).
ตกใจ,ก.,"สะดุ้งขึ้นโดยไม่รู้ตัวเมื่อได้ยินเสียงดัง ๆ หรือมีใครมาถูกต้องตัว, ใจหาย."
ตกดิน,ก.,อาการที่ดวงอาทิตย์ลับขอบฟ้าไป.
ตกตะกอน,ก.,มีตะกอนนอนก้น.
ตกตะลึง,ก.,"ตกใจจนพูดไม่ออก, แสดงอาการงงงัน."
ตกต่ำ,ก.,มีฐานะหรือค่าลดลงกว่าเดิม.
ตกแต่ง,ก.,"ประดับ, ปรุงจัดให้ดี, ทำให้งาม, เช่น ของตกแต่งบ้าน, ตบแต่ง ก็ว่า."
ต๊กโต,น.,ตุ๊กแก. (ดู ตุ๊กแก ๑).
ตกใต้เถรเทวทัต,ก.,ตกในนรกขุมตํ่าที่สุดคือมหาอเวจีนรก.
ตกถังข้าวสาร,ก.,ดู หนูตกถังข้าวสาร.
ตกทอง,น.,วิธีการหลอกลวงด้วยการใช้ทองปลอมที่มีน้ำหนักมากกว่าไปแลกเป็นทองแท้ที่มีน้ำหนักน้อยกว่า.
ตกท้องช้าง,ก.,ลักษณะที่สายป่านว่าวเป็นต้นหย่อนลง
ตกท้องช้าง,ก.,"ลวดบัวประกอบฐานผนังโบสถ์ หัวท้ายงอนขึ้น อ่อนลงตรงกลาง, ตกท้องสำเภา หรือ ท้องอัสดงคต ก็เรียก."
ตกท้องสำเภา,น.,"ลวดบัวประกอบฐานผนังโบสถ์ หัวท้ายงอนขึ้น อ่อนลงตรงกลาง, ตกท้องช้าง หรือ ท้องอัสดงคต ก็เรียก."
ตกทอด,ก.,"สืบต่อกันมาเป็นทอด ๆ, สืบต่อจากผู้หนึ่งไปยังอีกผู้หนึ่ง, เช่น มรดกตกทอด"
ตกทอด,ก.,เรียกบำเหน็จหรือบำนาญที่ตกแก่ทายาทของผู้รับบำเหน็จหรือบำนาญ ว่า บำเหน็จตกทอด หรือ บำนาญตกทอด.
ตกที่นั่ง,ก.,"ตกอยู่ในฐานะ, ตกอยู่ในภาวะ, (มักใช้ในทางไม่ดี) เช่น ตกที่นั่งลำบาก ตกที่นั่งเสียเงิน."
ตกนรกทั้งเป็น,ก.,ได้รับความลำบากแสนสาหัสเช่นคนที่ได้รับโทษทัณฑ์ในเรือนจำ.
ตกน้ำมัน,ว.,เรียกเสาที่มีนํ้ามันซึมออกมาว่า เสาตกนํ้ามัน.
ตกน้ำไม่ว่าย,ก.,ไม่ช่วยตัวเอง.
ตกน้ำไม่ไหลตกไฟไม่ไหม้,ก.,"ตกอยู่ในที่คับขันอย่างไรก็ไม่เป็นอันตราย เช่น คนดีตกน้ำไม่ไหล ตกไฟไม่ไหม้, เป็นคำเปรียบเทียบ หมายความว่า ตกอยู่ที่ใดก็ไม่สูญหาย เช่น ของหลวงตกนํ้าไม่ไหล ตกไฟไม่ไหม้."
ตกใน,ก.,อาการที่เลือดไม่ไหลออกข้างนอก ตกลงภายในเมื่อถูกแทงหรือฟันเป็นต้น เรียกว่า เลือดตกใน
ตกใน,ก.,โดยปริยายใช้เรียกอาการที่ต้องกลํ้ากลืนความทุกข์ไว้ ไม่แสดงออกมาว่า นํ้าตาตกใน.
ตกเบ็ด,ก.,"หย่อนเบ็ดล่อปลา, โดยปริยายหมายความว่า ล่อให้หลงโดยมีเครื่องล่อ."
ตกเบ็ด,น.,ชื่อการพนันอย่างหนึ่ง.
ตกเบิก,ก.,ได้รับเงินที่ค้างจ่ายย้อนหลัง.
ตกประหม่า,ก.,เกิดความรู้สึกสะทกสะท้านพรั่นใจ.
ตกปลอก,ก.,สวมปลอกที่ข้อตีนคู่หน้าของช้าง เพื่อล่ามไว้ไม่ให้ไปหากินไกลหลังจากที่ใช้งานแล้ว.
ตกปลัก,ก.,"อาการที่ปลาเป็นต้นมารวมกันอยู่ในบ่อหรือหนองที่นํ้างวด, ตกคลัก หรือ ตกคลั่ก ก็ว่า."
ตกปากตกคำ,ก.,"ตกลง, รับรอง, ตกปากลงคำ หรือ ตกปากรับคำ ก็ว่า."
ตกเป็น,ก.,กลายเป็น เช่น ตกเป็นข่าว ตกเป็นจำเลย.
ตกเป็นเบี้ยล่าง,ก.,"ตกเป็นรอง, เสียเปรียบ."
ตกเป็นพับ,ก.,เป็นอันจบกันไป.
ตกผลึก,ก.,กลายเป็นผลึก (ใช้แก่สารละลาย)
ตกผลึก,ก.,"โดยปริยายหมายความว่าลึกซึ้งแจ่มแจ้งจากการสะสมความรู้หรือความคิด เช่น เขาศึกษาประวัติศาสตร์ไทยอย่างจริงจังจนความรู้ตกผลึก, งวดเข้า เช่น คดีนี้จวนจะตกผลึก."
ตกผ้า,ก.,"มีประจำเดือน, ถึงผ้า ก็ว่า."
ตกพุ่มม่าย,ก.,อยู่ในฐานะที่เป็นม่าย.
ตกพุ่มม่าย,ว.,"เรียกชายหรือหญิงที่หย่าขาดจากความเป็นผัวเมียกันหรือฝ่ายใดฝ่ายหนึ่งตายจากไป, ตกพุ่มหม้าย หรือ เป็นม่าย ก็ว่า."
ตกฟอง,ก.,ออกไข่ เช่น ไก่ตกฟอง.
ตกฟาก,ก.,"เกิด, เรียกเวลาที่เด็กออกพ้นครรภ์มารดาว่า เวลาตกฟาก (พื้นเรือนโบราณโดยมากเป็นฟาก)"
ตกฟาก,ก.,โดยปริยายใช้ในลักษณะที่พูดคำเถียงคำไม่หยุดปาก ว่า เถียงคำไม่ตกฟาก.
ตกมัน,ว.,"ลักษณะที่ต่อมน้ำมันที่ขมับของช้างบวมโตและมีน้ำมันใส ๆ ไหลออกมา ช้างตัวผู้จะมีอารมณ์รุนแรง ก้าวร้าว ดุร้าย มีกลิ่นสาบฉุน, เรียกช้างที่มีอาการเช่นนั้น ว่า ช้างตกมัน."
ตกม้าตาย,ว.,"แพ้, เสียเชิง, เช่น ถ้าเตรียมตัวไม่ดี ถูกกรรมการซักเข้าหน่อยก็คงตกม้าตาย."
ตกมูก,ก.,อาการที่นํ้าเมือกไหลออกทางทวารหนัก.
ตกยาก,ก.,"ลำบาก, ยากจน, ขัดสน."
ตกรางวัล,ก.,ให้รางวัล.
ตกลง,ก.,"ยินยอมพร้อมใจ, ปลงใจ."
ตกล่องปล่องชิ้น,ก.,ตัดสินใจที่จะร่วมมือหรือร่วมชีวิตด้วย.
ตกลึก,ก.,ไปถึงน้ำลึกพ้นสันดอนออกไป
ตกลึก,ก.,"เข้าไปที่ลึก, สู่ที่ลึก, สู่ที่ลำบาก เช่น เห็นเขาตกเขาแตกมาตกลึก อนาถนึกแล้วน่าน้ำตาไหล (นิ. พระบาท)"
ตกลึก,ก.,โดยปริยายหมายความว่า ถลำลึกเข้าไปในเรื่องใดเรื่องหนึ่ง.
ตกลูก,ก.,ออกลูก (ใช้แก่สัตว์) เช่น ม้าขุนสุวรรณพินิจจัย ตกลูกศีรษะเดียว ตัวเป็น ๒ ตัว ๘ เท้า เดินชิงศีรษะกัน ไก่พระศรีมโหสธ ฟักฟองตกลูกตัวเดียว ๒ ศีรษะ (พงศ. จันทนุมาศ).
ตกเลือด,ก.,"แท้งลูก, อาการที่เลือดออกผิดธรรมดาเนื่องจากแท้งลูกเป็นต้น, ราชาศัพท์ว่า ตกพระโลหิต."
ตกว่า,ว.,"คือ, คือว่า, รวมความว่า, ลงความว่า, ถือเอาว่า, บางทีใช้ว่า ตก ก็มี เช่น ตกมีฤทธิไกรกว่าพี่ยา (อิเหนา)."
ตกศึก,ก.,"เข้าสู่ภาวะสงคราม, มีสงคราม."
ตกสนับ,ก.,อาการที่หญ้าโทรมล้มทับหญ้าที่ขึ้นใหม่.
ตกสะเก็ด,ก.,อาการที่เลือดและนํ้าเหลืองแห้งติดกรังอยู่ที่ปากแผล.
ตกแสก,ว.,ที่หวีแหวกกลางศีรษะ (ใช้แก่ผม) เช่น งามโศกตกแสกเมื่อยามเศร้า ปิ้มประหนึ่งจะเข้าประคองขวัญ (ขุนช้างขุนแผน).
ตกหนัก,ก.,"รับทุกข์, รับเคราะห์, รับภาระหรือหน้าที่หนัก."
ตกหนังสือ,ก.,เขียนคำที่ขาดเติมลง.
ตกหมก,ก.,อาการที่เลือดระดูเสียที่หมักหมมอยู่ข้างในไหลออกมา.
ตกหล่น,ก.,ขาดตกไปโดยไม่ตั้งใจ.
ตกหลุม,ก.,"ถูกลวงด้วยเล่ห์กลหรืออุบาย, เสียรู้, หลงกล."
ตกหลุมพราง,ก.,"ถูกลวงด้วยเล่ห์กลหรืออุบาย, เสียรู้, หลงกล."
ตกอับ,ก.,"ถึงที่อับจน, ถึงคราวชะตาตก."
ตง ๑,น.,ไม้เครื่องเรือนที่วางบนหลังคานสำหรับรองพื้นกระดานหรือฟาก.
ต๋ง ๑,ก.,"อาการที่เจ้าของบ่อนชักเอาเงินจากขาไพ่ที่เป็นผู้กินหรือลูกค้าที่แทงถูกในการพนันเช่นถั่ว โป, เรียกเงินที่ได้โดยวิธีนี้ ว่า เงินค่าต๋ง."
ตง ๒,น.,ชื่อไผ่ชนิด Dendrocalamus asper (Roem. et Schult.) Backer et K. Heyne ในวงศ์ Gramineae ลำต้นใหญ่ ไม่มีหนาม หน่อกินได้.
ต๋ง ๒,ก.,"อาการที่เอาเชือกผูกของหนัก ๆ เช่นเรือนแพ แพซุง ยึดหรือพันไว้กับหลักเป็นต้นบนตลิ่งแล้วค่อย ๆ ผ่อนไป, เอาเชือกเป็นต้นผูกของหนัก ๆ เช่นเสาไว้แล้วค่อย ๆ พยุงให้ตั้งขึ้นแล้วผ่อนลงหลุม, ขัดไว้ไม่ให้เลื่อนหลุดออกอย่างขัดไม้ขันชะเนาะ."
ตงฉิน,ว.,"ซื่อตรง, ซื่อสัตย์."
ตงิด,ว.,"เล็กน้อย, ทีละน้อย ๆ, (ใช้แก่ความรู้สึก) เช่น โกรธตงิด ๆ หิวตงิด ๆ."
ตงิด ๆ,ว.,"เล็กน้อย, ทีละน้อย ๆ, (ใช้แก่ความรู้สึก) เช่น โกรธตงิด ๆ หิวตงิด ๆ."
ตงุ่น,ว.,เรียกนํ้าตาลที่เคี่ยวจนเป็นยางอย่างนํ้าผึ้ง ว่า นํ้าตาลตงุ่น.
ตจ-,น.,"หนัง, เปลือกไม้."
ตจปัญจก-กรรมฐาน,น.,กรรมฐานอันบัณฑิตกำหนดด้วยอาการมีหนังเป็นลำดับที่ ๕ เป็นอารมณ์ คือ กรรมฐานที่ท่านสอนให้พิจารณาส่วนต่าง ๆ ของร่างกายได้แก่ ๑. ผม ๒. ขน ๓. เล็บ ๔. ฟัน และ ๕. หนัง ให้เห็นว่าเป็นของไม่เที่ยง.
ตจสาร,น.,ต้นไม้มีผิวเปลือกแข็งเช่นต้นไผ่.
ตด ๑,ก.,"อาการที่ลมระบายออกทางทวารหนัก, ผายลม."
ตด ๑,น.,ลมที่ออกจากทวารหนัก.
ตด ๒,น.,"ชื่อแมลงพวกด้วงหลายชนิดหลายสกุล ในวงศ์ Carabidae หัวและอกเล็ก แคบ ท้องโต ปีกแข็งคลุมส่วนท้องไม่หมด ลำตัวยาว ๒-๓ เซนติเมตร สีนํ้าตาลเหลืองหรือนํ้าตาลแก่ มีลายสีเข้มตามหัว อก และท้อง เมื่อถูกรบกวนสามารถปล่อยสารพิษประเภทควินอลออกมาทางก้นมีเสียงดัง ร้อนและมีควัน ที่สำคัญ เช่น ชนิด Pheropsophus occipitalis (MacLeay), P. javanus (Dejean), ปักษ์ใต้เรียก ขี้ตด."
ตดหมูตดหมา,น.,ดู ย่านพาโหม.
ตติย-,ว.,"ที่ ๓, คำรบ ๓, มักใช้ประกอบหน้าคำอื่น เช่น ตติยวาร คือ วาระที่ ๓."
ตถาคต,น.,"คำเรียกพระพุทธเจ้า, คำที่พระพุทธเจ้าใช้แทนพระองค์เอง."
ตน,น.,ตัว (ตัวคน) เช่น ตนเป็นที่พึ่งของตน
ตน,น.,ลักษณนามใช้เรียกฤๅษี อมนุษย์ หรือพวกกายสิทธิ์ เป็นต้น เช่น ฤๅษี ๒ ตน ยักษ์ตนหนึ่ง วิทยาธร ๓ ตน.
ต้น ๑,น.,"ลำของต้นไม้, เป็นชื่อรวมทั่วไปของต้นไม้และพืชผักต่าง ๆ เช่น ต้นมะขาม ต้นสัก ต้นหญ้า ต้นผักชี ต้นข้าว, ลักษณนามว่า ต้น เช่น มะม่วงต้นหนึ่ง ผักชี ๒ ต้น."
ต้น ๒,น.,ตอนแรก ๆ เช่น ต้นสัปดาห์ ต้นเดือน ต้นปี ต้นความ
ต้น ๒,น.,เรียกผู้ที่นับกันว่าเป็นผู้เริ่มต้นวงศ์สกุล ว่า ต้นวงศ์ ต้นสกุล
ต้น ๒,น.,เบื้องต้นของสิ่งที่มีลักษณะกลมยาว เช่น ต้นขา ต้นแขน.
ต้น ๒,ว.,แรก เช่น หน้าต้น
ต้น ๒,ว.,แรกเริ่ม เช่น แต่ต้น.
ต้น ๓,น.,คำนำหน้าชื่อเพลงไทย เช่น ต้นเพลงฉิ่ง ต้นเพลงยาว ต้นวรเชษฐ์.
ต้น ๔,ส.,สรรพนามบุรุษที่ ๒ ใช้เรียกพระภิกษุสามัญ เช่น ต้นอยู่วัดไหน.
ต้น ๕,ว.,เนื่องในพระเจ้าแผ่นดิน เช่น ประพาสต้น กฐินต้น ช้างต้น ม้าต้น.
