ชักสวด,ก.,นำอ่านหนังสือ.
ชักสายสิง,ก.,ดึงสายสิญจน์ในวันสารทซึ่งมีการโยงสายสิญจน์จากร้านเปรตไปที่พระสงฆ์ เมื่อพระยถาสัพพีจบจะดึงสายสิญจน์ให้หลุดจากร้านเปรต ตอนนี้เด็ก ๆ จะเริ่มชิงเปรตได้
ชักสายสิง,ก.,โยงสายสิญจน์.
ชักสูบ,ก.,ชักสูบลมในการตีเหล็ก.
ชักหนก,สำ.,มารยา
ชักหนก,สำ.,มารยา.
ชักหน้า,ว.,กระเง้ากระงอด
ชักหมูก,ก.,จูงหรือดึงวัวหรือควายให้เข้าไปชนกัน.
ชักหืด,ก.,หัวเราะและขำอย่างสุดขีด (ส.ฎ.).
ชักหุน,ว.,กระเง้ากระงอด
ชักเหมือน อ้ายทองเห็นผี,สำ.,ชักดิ้นชักงอ.
ชักเหมือน อ้ายทองเห็นผี,สำ.,"ดึง, ดึงออก, ดึงขึ้น, ดึงเอาออก, ดึงสายเชือก เป็นต้น. ที่ผูกอยู่กับสิ่งใดสิ่งหนึ่งเพื่อให้สิ่งนั้นเคลื่อนไหวไปตามต้องการ, ดึงเอามา, ดึงออก แล้วดันเข้า, นำ, นำเอามาอ้าง, ยกเอามาอ้าง, เอาออก, หักออก, ขยายแนวให้ยืดออก, สี."
ชักแห็ก,ว.,"กระบิดกระบวน, เล่นตัว"
ชักแห็ก,ว.,กระเง้ากระงอด
ชั่ง,น.,"ตาชั่ง, เครื่องชั่งสำหรับชั่งสิ่งของต่าง ๆ."
ชั่ง,ก.,กระทำให้รู้น้ำหนักโดยใช้เครื่องชั่งหรือตราชู.
ชั่ง,ว.,"มีชั้นเชิง, ฉลาด, เก่ง."
ชั่ง,ว.,"ปล่อย, วางธุระ."
ชั้ง,น.,ขนมจ้าง (ดู ซั้ง น. ๓.).
ชั้ง (พ.ท.),น.,"ขนมจ้าง, ชื่อขนมชนิดหนึ่ง ทำจากข้าวเหนียวห่อด้วยใบไผ่ แล้วต้ม"
ชังกั้ง,ว.,"ทะลึ่งตึงตัง, เกกมะเหรก, ขวางหูขวางตา."
ชังก้า,ว.,"องอาจ, จังก้า, เงื้อง่า, เล็งหา, เตรียมยิง หรือ เตรียมต่อสู้."
ชังก๋า,ก.,"หยั่ง, คาดคะเน, ชิมลาง, ทดลอง (น.ธ.)."
ชังนัง,น.,กิ่งไม้ที่สุมไว้ในลำคลองหรือหนองน้ำเพื่อล่อปลา (ดู หฺมฺรำ น. ๑.).
ชั่งปรือ,ว.,ทำไมจึงเป็นเช่นนั้น.
ชั่งมันแหละ,ว.,ปล่อยมันเถอะ
ชัน,น.,"ชัน, ยางไม้สำหรับยาเรือ เป็นต้น เช่น ชันยาง, ชันยอม"
ชัน,น.,"ชื่อนกประเภทหนึ่ง ตัวขนาดนกเขา อยู่กันเป็นฝูง มีหลายชนิด เช่น ชันหมาก, ชันไข่เป็ด, ชันพริก."
ชัน,น.,ชื่อขมิ้นชนิดหนึ่งเรียก “ขี้หมิ้นชัน” ใช้ย้อมผ้า ใส่แกง และใช้เป็นสมุนไพร.
ชัน,ก.,ยาให้ติดกัน เช่น ชันเรือ - ยาเรือรั่ว.
ชัน,ก.,"ตรงขึ้นไป, ไม่ลาด เช่น ชันเขา - ตั้งเข่าให้ตรง"
ชัน,ว.,ตั้งตรง เช่น บ้านนี้บันไดชันมาก - บ้านนี้บันไดตั้งตรงมาก.
ชั้น,น.,"ปิ่นโต, ภาชนะสำหรับใส่ของกินซ้อนกัน เป็นชั้น ๆ มีหูร้อยหิ้วได้"
ชั้น,น.,"หิ้งวางของ, ที่วางของซึ่งติดหรือแขวนไว้ข้างฝา."
ชั้น,น.,ชื่อขนมไทยชนิดหนึ่ง นึ่งสลับสีเป็นชั้น ๆ.
ชั้น,ว.,กระชั้น.
ชันเกราะ,น.,"ชัน, ยางไม้สำหรับยาเรือ เป็นต้น เช่น ชันยาง, ชันยอม"
ชันเกราะ,น.,ยางไม้สำหรับยาเรือ (ดู ชัน น. ๑.).
ชั้นฉาย,น.,การสังเกตเวลาด้วยมาตราวัดอย่างหนึ่งซึ่งเรียกว่า เหยียบชั้นคือเอาเท้าวัดเงาของตัวตนที่ยืนกลางแดด ครั้งโบราณกำหนดเวลาด้วยการวัดเงานั้นเป็นช่วงเท้า คือ ๑ ชั้นฉาย เท่ากับเงายาวชั่ว ๑ ช่วงเท้า.
ชันชี,ก.,"นัดหมาย, สัญญา, ตกลงกัน"
ชั้นติ,ก.,"สังเกต, พินิจ พิเคราะห์ เช่น ช่วยจันติดูที - ช่วยพินิจพิเคราะห์ดูที"
ชั้นติ,ก.,"สังเกต, พินิจพิเคราะห์ (ดู จันติ ก. ๒.)."
ชันตุ,น.,แผลเรื้อรังของไก่ชน (ดู ชันโต้ น. ๒.).
ชันตุ,น.,แผลเรื้อรังที่ข้างนอกหาย แต่ข้างในยังอักเสบอยู่ของไก่ชน ถ้าเป็นก้อนแข็งเรียกว่า “ชันโต้แห้ง” ถ้ามีน้ำอยู่ข้างในเรียกว่า “ชันโต้น้ำ”
ชันโต้,น.,"ชันนะตุ, ชื่อโรคชนิดหนึ่งเป็นที่ศีรษะ เกิดจากเชื้อราบ่นผิวหนังศีรษะก่อน แล้วลุกลามกินลึกลงไปถึงรากผมทำให้ผมร่วง"
ชันโต้,น.,แผลเรื้อรังที่ข้างนอกหาย แต่ข้างในยังอักเสบอยู่ของไก่ชน ถ้าเป็นก้อนแข็งเรียกว่า “ชันโต้แห้ง” ถ้ามีน้ำอยู่ข้างในเรียกว่า “ชันโต้น้ำ”
ชันนกเงียก,น.,ขี้ชันทำจากนกเงือก ใช้ผสมทำยาเสน่ห์
ชันนะตุ,ว.,คำล้อเด็กที่หัวเปื่อยเรื้อรังหรือเป็นแผลพุพองไปทั่วหัว
ชันนา,น.,ชื่อไม้ต้น จำพวกไม้ยาง
ชันเม็ด,น.,ปลาจะละเม็ด เป็นปลาทะเล รูปร่างป้อมค่อนข้างสั้น ลำตัวแบนข้างมาก หัวเล็กมน ปากเล็ก เกล็ดเล็ก มี ๒ ชนิด คือ จันเม็ดขาว และจันเม็ดดำ
ชันเม็ด,น.,ปลาจะละเม็ด (ดู จันเม็ด).
ชันโสด,ก.,"ชันสูตร, สอบสวนโดยเหตุผล, ตรวจตราเพื่อหาหลักฐานข้อเท็จจริง."
ชันโสด,ก.,"รังวัด, วัดที่ดิน."
ชับ,ว.,"แข็งแรง, ล่ำสัน, สันทัด, มั่นคง เช่น ทำให้ชับ - ทำให้แข็งแรง"
ชับ,ว.,"ถนัด, คล่อง เช่น ชับซ้าย - ถนัดซ้าย, ชับผึด - ถนัดมาก, ชำนาญมาก."
ชับชวน,ว.,"แข็งแรง, ล่ำสัน, สันทัด, มั่นคง เช่น ทำให้ชับ - ทำให้แข็งแรง"
ชับชวน,ว.,"แข็งแรง, ล่ำสัน (ดู ชับ ว. ๑.)."
ชับช้าง,น.,"กะทกรก, ชื่อไม้พุ่มรอเลื้อย ตามลำต้นมีหนามห่างๆ ใบรูปไข่หรือรี ๆ ดอกเล็กสีขาว อยู่เป็นกระจุกที่ง่ามใบ ผลกลมหรือรีขนาดเท่าเม็ดบัว เขื่อง ๆ เป็นสมุนไพร"
ชับชึก,ว.,"แข็งแรง, ล่ำสัน, สันทัด, มั่นคง เช่น ทำให้ชับ - ทำให้แข็งแรง"
ชับชึก,ว.,"แข็งแรง, ล่ำสัน (ดู ชับ ว. ๑.)."
ชับพลา,น.,ชื่อไม้พุ่มขนาดกลาง (ดู พลา).
ชัว,น.,"ไมโครโฟน, เครื่องขยายเสียงให้ดังขึ้น"
ชั่ว,น.,"ระยะ เช่น ชั่ว ๑ อง - ระยะทางหรือความสูงชั่วลำไม้ไผ่สำหรับพาดขึ้นต้นไม้ต่างบันได (พะอง) หนึ่ง, ชั่วหมาเอ้ง - ระยะทางไกลประมาณเสียงหมาร้องดังได้ยินถึง."
ชั่ว,ว.,"เลว, ทราม, ร้าย, ไม่ดี."
ชั้ว,น.,"ลิ้นชัก, ส่วนของตู้และโต๊ะ รูปคล้ายหีบไม่มีฝา ชักออกและผลักเข้าได้ (โบ.)"
ชั่วกัปชั่วกัลป์,น.,ช่วงเวลาที่ยาวนานมาก.
ชั่วโคตร,น.,"ชั่วอายุคน, ช่วงเวลาที่ยาวนานมาก."
ชั่วทายาด,ว.,ชั่วมาก.
ชั่วโหยะ,น.,"ตลอดกาล, เป็นนิจ, เสมอ"
ชั่วอายุ,น.,"ตลอดกาล, เป็นนิจ, เสมอ"
ชัวะ,ว.,"โชก, ทวี, มาก เช่น เปียกชวก - เปียกโชก, ถูกเบอร์กันชวก - ถูกหวยกันทั่วไป"
ชัวะ,ว.,"ประหม่า, กลัว (ดู ฉัวะ)."
ชัวะ,ว.,"ชุก, ดก เช่น เงาะเป็นชัวะ - เงาะออกผลดก."
ชัวะ,ว.,"โชก, มาก (ดู ชวก)."
"ชัวะ (ส.ต., ร.น.)",ก.,"ประหม่า, กลัว ( จ., ภ.ก., พ.ง.)."
ชา,น.,"ชา, ชื่อไม้ต้นขนาดเล็กขึ้นตามหุบเขาในเขตร้อน ใบใช้ชงเป็นเครื่องดื่ม."
ชา,น.,ชื่อไม้พุ่มหลายชนิด ใบเล็ก ที่ใช้ปลูกเป็นรั้ว.
ชา,น.,"พิธีบวงสรวง เช่น ชาบ้าน – พิธีบวงสรวงเทพเจ้าของหมู่บ้าน, ชาเริน - พิธีบวงสรวงซึ่งทำขึ้นที่บ้านใดบ้านหนึ่ง (น.ธ.)."
ชา,ก.,"พนัน, แข่งขัน เช่น กินหนมชากัน - กินขนมพนันกัน."
ชา,ก.,"ขับ, กล่อมให้นอน เช่น ชาน้อง - ขับกล่อมให้น้องนอน"
ชา,ก.,"ชา, อาการที่รู้สึกน้อยกว่าปกติ เนื่องจากเส้นประสาทสำหรับรับความรู้สึกถูกกด ถูกตัดขาด หรือถูกสารพิษ เช่น ตีนชามือชา – เท้าชามือชา."
ชา,ก.,พรรณนาชมเป็นบทกลอน.
ชา,สัน.,"เหตุเพราะ, ตั้งหน้าตั้งตา, อารามว่า เช่น ชานั่งมากหลังแขงเสียแล้ว - เพราะนั่งมากหลังแข็งเสียแล้ว."
ช่า,ก.,"เซาะ, ทำให้กร่อนหรือร่อยหรอไปทีละน้อย เช่น น้ำชะหละ - น้ำเซาะตลิ่ง."
ช่า,น.,กะชะ (ดู ชะ)
ช้า,ก.,"ขับ, กล่อมให้นอน เช่น ชาน้อง - ขับกล่อมให้น้องนอน"
ช้า,น.,คำเรียกนำหน้าพืชที่มีลักษณะคล้ายกัน แต่เอามาใช้ประโยชน์เช่นนั้นไม้ได้
ช้าขี้เหล็ก,น.,"ขี้เหล็กป่า, ต้นและใบมีขนาดเล็กกว่าขี้เหล็กธรรมดา ใบอ่อน ใช้แกงกินได้ แต่ขมกว่า."
ช่าง,น.,"ผู้ชำนาญในการฝีมือหรือศิลปะอย่างใดอย่างหนึ่ง เช่น ช่างทอง, ช่างไม้."
ช่าง,น.,การช่าง.
ช่าง,ว.,"ฉลาด, ดีแท้, เก่ง, มาก เช่น ช่างไปเห็น – ไปเห็นมาดีจริง, ช่างไปทำ - ไปทำมาดี, ช่างทำ - ทำเก่ง, ช่างเที่ยว - เที่ยวมาก, เที่ยวเก่ง."
ช้าง,น.,"แมงช้าง, ชื่อแมลงชนิดหนึ่ง ตัวเล็ก ๆ หัวสีแดง อาศัยอยู่ในฝุ่นหนา"
ช้าง,น.,แมงช้าง (ดู ไกเถน).
ช้าง,น.,"ช้าง, ชื่อสัตว์เลี้ยงลูกด้วยนม จมูกยื่นยาวเรียกว่า “งวง” ตัวผู้มีงายาว ตัวสีเทา กินพืช อยู่รวมกันเป็นโขลง"
ช้างกวม,น.,"ช้างพลายไม่มีงา, ช้างนรการ, ช้างสีดอ"
ช้างเกรียบ,น.,ชื่อช้างพันธุ์หนึ่งมีขนาดเล็ก อาศัยในที่ราบลุ่มของจังหวัดพัทลุง และนครศรีธรรมราช ปัจจุบันสูญพันธุ์ไปแล้ว
ช้างเกรียบ,น.,ช้างพันธุ์หนึ่งมีขนาดเล็ก อาศัยอยู่ในที่ราบลุ่มของจังหวัดพัทลุง และจังหวัดนครศรีธรรมราช.
ช้างขี้แดง,น.,ชื่อช้างพันธุ์หนึ่งมีขนาดเล็ก อาศัยในที่ราบลุ่มของจังหวัดพัทลุง และนครศรีธรรมราช ปัจจุบันสูญพันธุ์ไปแล้ว
ช้างขี้แดง,น.,ช้างพันธุ์หนึ่งมีขนาดเล็ก อาศัยอยู่ในที่ราบลุ่มของจังหวัดพัทลุง และจังหวัดนครศรีธรรมราช.
ช้างค่อม,น.,ชื่อช้างพันธุ์หนึ่งมีขนาดเล็ก อาศัยในที่ราบลุ่มของจังหวัดพัทลุง และนครศรีธรรมราช ปัจจุบันสูญพันธุ์ไปแล้ว
ช้างค่อม,น.,"แมงช้าง, ชื่อแมลงชนิดหนึ่ง ตัวเล็ก ๆ หัวสีแดง อาศัยอยู่ในฝุ่นหนา"
ช้างค่อม,น.,ช้างพันธุ์หนึ่งมีขนาดเล็ก อาศัยอยู่ในที่ราบลุ่มของจังหวัดพัทลุง และจังหวัดนครศรีธรรมราช.
ช้างค่อม,น.,แมงช้าง (ดู ไกเถน).
ช้างค่อม,น.,ช้างพันธุ์หนึ่งมีขนาดเล็ก อาศัยอยู่ในที่ราบลุ่มของจังหวัดพัทลุงและนครศรีธรรมราช.
ช้างเชียง,น.,ช้างที่กำลังมีท้อง.
ช้างท้อง,น.,"หูน้ำหนวก, หูที่มีน้ำอยู่ในช่องหูซึ่งมีอาการอักเสบ มีกลิ่นเหม็น อาจมีลักษณะใส เป็นมูกข้นหรือเป็นหนอง"
ช้างทึ่ง,น.,ชื่อแมลงปีกแข็ง สีน้ำเงินหรือเขียว ปีกมีจุดสีทอง.
ช้างปรุง,น.,ด้วงที่อาศัยอยู่บนต้นปรง.
ช้างพระอินทร์,น.,"แมงช้าง, ชื่อแมลงชนิดหนึ่ง ตัวเล็ก ๆ หัวสีแดง อาศัยอยู่ในฝุ่นหนา"
ช้างพระอินทร์,น.,แมงช้า (ดู ไกเถน).
ช้างพลายแม่,น.,ช้างพลายมีขนาย.
ช้างโพละ,น.,ชื่อช้างพันธุ์หนึ่งมีขนาดเล็ก อาศัยในที่ราบลุ่มของจังหวัดพัทลุง และนครศรีธรรมราช ปัจจุบันสูญพันธุ์ไปแล้ว
ช้างโพละ,น.,ช้างพันธุ์หนึ่งมีขนาดเล็ก อาศัยอยู่ในที่ราบลุ่มของจังหวัดพัทลุง และจังหวัดนครศรีธรรมราช.
ช้างร้องไห้,น.,ชื่อปาล์มชนิดหนึ่ง.
ช้างแล่นอย่ายุงหาง,สำ.,อย่าขัดขวางผู้มีอำนาจ.
ช้างสารซับมัน,น.,"ต้นกระแจะ, ชื่อไม้พุ่มหรือไม้ต้น ขึ้นในป่าเบญจพรรณ ต้นและกิ่งมีหนาม เปลือกขรุขระสีเทา ดอกเล็กสีขาวเป็นช่อสั้น กลิ่นหอมอ่อน."
ช้างหัวแดง,น.,ชื่อช้างพันธุ์หนึ่งมีขนาดเล็ก อาศัยในที่ราบลุ่มของจังหวัดพัทลุง และนครศรีธรรมราช ปัจจุบันสูญพันธุ์ไปแล้ว
ช้างหัวแดง,น.,ช้างพันธุ์หนึ่งมีขนาดเล็ก อาศัยอยู่ในที่ราบลุ่มของจังหวัดพัทลุง และจังหวัดนครศรีธรรมราช.
ช้างเหยียบ,น.,ปลาหมอตาล (ดู ชี้เติ้ง).
ช้างเหยียบ,น.,"ปลาหมอตาล, ชื่อปลาน้ำจืดชนิดหนึ่ง จำพวกปลากระดี่"
ช้างแหก,น.,ชื่อไม้ขนาดกลาง ขอบใบเป็นจัก มีขนเป็นพิษชาวป่ามักปลูกไว้เป็นรั้วบ้าน เพื่อกันขโมย
ช้างแหก,น.,ชื่อไม้ต้นขนาดกลาง (ดู รังตังช้าง).
ชาเฉย,น.,น้ำชา.
ชาด,น.,ชื่อไม้พุ่มชนิดหนึ่ง ใบคล้ายใบโพ ผลสีแดงเข้ม คล้ายเงาะ
ชาตรี,น.,มโนราห์ “ชองสะกาน่าใคร่ดู รำเป็นคู่ดูเกี่ยวพาด ชาตรีมีเกลื่อนกลาด ทุกภาษามาเล่นงาน” (สุวรรณหงส์).
ชาติ,น.,"วงศ์วาน, กำพืด, โคตร, วงศ์"
ชาติ,น.,"เหล่ากอ. เทือกเถา, เผ่าพันธุ์."
ชาติกา,สำ.,"ใจดำ, ชอบทำร้ายผู้อื่น, ชั่วร้าย."
ชาติโซ,ว.,เลวมาก.
ชาติดี,ว.,"ดี, วิเศษ."
ชาติดี,สำ.,ใช้เป็นคำประชด หมายถึง “เลว”.
ชาน,ว.,คำถามซ้ำ
ชาน,น.,"กาก, สิ่งที่เหลือเมื่อคั้นหรือคัดเอาส่วนดีออกแล้ว เช่น ชานอ้อย, ชานยา, ชานหมาก."
ชาน,น.,"นอกชาน, พื้นที่นอกชายคา."
ชาน,น.,ดุ้นฟืนที่ไฟไหม้ไม่หมด.
ช่าน,ก.,ออกซ้ำเหมือนเดิม ใช้ในการพนัน
ช่าน,ก.,ออกซ้ำเหมือนเดิม ใช้ในการพนัน (ดู บั้น ก. ๒.)
ชานตาย,ว.,"สมควรตาย, น่าจะตาย (ส.ข., ภ.ก., พ.ง.)."
ชานไฟ,น.,ไม้ฟืนที่ไฟไหม้ไปบ้างแล้ว.
ชานไฟ,น.,"ชานครัว, ระเบียงส่วนที่ต่อจากห้องครัว."
ชานไฟ,ว.,"สมควร, น่าจะ เช่น ชานถูกถีบ - น่าจะถูกเตะ."
ชานไฟ,ว.,คำถามซ้ำ (ดู ฉาน ว. ๒.).
ชานหมาก,น.,ชื่อเห็ดชนิดหนึ่ง ดอกสีส้ม กินได้ (ภ.ก.).
ช้าพลู,น.,ชื่อไม้เถา ใบคล้ายพลู กินได้ ต้นและใบมีรสเผ็ด รากและผลใช้ทำยาได้.
ชาม,น.,ภาชนะปากกว้าง ก้นไม่ลึก สำหรับใส่อาหาร.
ชาม,น.,ชื่อตัวตลกหนังตะลุง.
ช้าม,ก.,"ผสม, ปน (ดู ฉ้ำ ก.)."
"ช้าม (จ., ภ.ก., พ.ง.)",ก.,"ผสม, ปน เช่น โกปี้ฉ้ำ - กาแฟปนกับชา"
ชามแถม,น.,ชามใส่ข้าวไว้สำหรับเติม (ภ.ก.)
ชามผรัง,น.,"ชามฝรั่ง, ชามที่มีขนาดโตกว่าชามทั่วไป (ภ.ก.)."
ชาย,น.,ผู้ชาย
ชาย,น.,"ริม, ขอบ."
