คำ,POS,ความหมาย
ชก,น.,ชื่อปาล์มชนิดหนึ่ง ใบคล้ายใบสาคู ผลคล้ายลาน จั่นใช้ทำน้ำตาลทำนองเดียวกับมะพร้าว
ชก,น.,ชื่อปาล์มชนิดหนึ่ง (ดู ขีด น. ๑.).
ชก,ก.,ต่อยด้วยหมัดหรือกำปั้น.
ชก,น.,"ลูกชิด, ตาวหรือปาล์มชนิดหนึ่ง ใบคล้ายมะพร้าว ท้องใบขาว จั่นเป็นพวงห้อย ให้น้ำตาลทำนองมะพร้าว ออกผลเป็นทะลาย เนื้อในเมล็ดอ่อน เรียก ลูกชิด เชื่อมกินได้"
ชกเงื่อนตาย,ก.,ผูกเงื่อนตาย (ดู เชาะเงื่อนตาย).
ชกเงื่อนตาย,ก.,ผูกเงื่อนตาย
ชง,ก.,"งง, ฉงน, คิดไม่ออกเพราะยุ่งยากซับช้อน, ทำอะไรไม่ถูกเพราะยังยั้งสติไม่อยู่"
ชง,ก.,ผูกรั้งขา เช่น ชงวัว - ผูกรั้งขาวัว.
ชด,น.,ชื่อไม้ต้นขนาดกลาง ดอกมีกลิ่นเหม็น.
ชด,น.,เครื่องใช้ชนิดหนึ่ง ทำด้วยงวงของต้นจาก ทุบปลายให้แตกเป็นเส้นใย ใช้ทำความสะอาด กระบอกไม้ไผ่.
ชด,ก.,"ชดเชย, ทดรอง, ชดใช้."
ชด,ก.,"ประชด, แกล้งทำให้เกินควรหรือพูดแดกดัน เพราะความไม่พอใจ เช่น ทำชด - ทำประชด, พูดชด - พูดประชด."
ชด,ว.,งอน เช่น ท้ายชด - ก้นงอน.
ชน,ก.,ชิดจนติด เช่น นอนหัวชนกัน.
ชน,ก.,"ชน, โดนแรง ๆ เช่น ชนวัว, รถชน."
ชนขวบ,ก.,"บรรจบปี, ครบปี (น.ธ.)."
ชนวัว,น.,"การพนันชนิดหนึ่งเล่นโดยใช้ไพ่ป๊อก วิธีเล่น แจกไพ่คนละ ๕ ใบ จำนวนไพ่ ๓ ใบ รวมกัน ให้เท่ากับ ๑๐, ๒๐, ๓๐ อีก ๒ ใบ เป็นจำนวนเลขที่ต้องการคะแนน ถ้าไพ่ ๓ ใบรวมกันไม่ได้ ๑๐, ๒๐, ๓๐ ถือว่าไพ่เสีย"
ชนวัว,น.,การพนันชนิดหนึ่งเล่นโดยใช้ไพ่ป๊อก (ดู งุมงำ)
ชนวัวดิน,น.,"การเล่นของเด็กอย่างหนึ่งโดยวิธีปั้นดินเป็นรูปวัวใส่ผ้าขาวม้า เป็นต้น, เขย่าชายผ้าให้เคลื่อนไหวปะทะกัน."
ชนวัวหัวพร้าว,น.,การเล่นของเด็กอย่างหนึ่ง โดยเอาโคนทางมะพร้าวต่างหัววัวผูกเชือกเข้าชนกัน (บางถิ่นใช้วิธีเอาโคนทางมะพร้าวสอดเข้าชนกัน).
ชนหีน,น.,ชื่อนกชนิดหนึ่ง คล้ายนกกะงัง
ชนเหล็กขูด,น.,การปลุกเสกกระต่ายขูดมะพร้าวให้ชนกัน.
ชนเหล็กขูด,น.,วิธีขอฝนอย่างหนึ่งของชาวปะนาเระ โดยเอากระต่ายขูดมะพร้าวชนกันในวัด.
ชนเหล็กขูด,น.,"ได้แต้มเท่ากัน, ออกหน้าเดียวกัน."
ชบ,ก.,ชุบชีวิต.
ชบ,ก.,"เนรมิต, สร้างหรือบันดาลด้วยอำนาจ ฤทธิ์ หรืออภินิหารให้บังเกิดเป็นขึ้นมีขึ้นโดยฉับพลัน."
ชม,ก.,ล้อเล่นด้วยความรัก.
ชม,ก.,"สรรเสริญ, ยกย่อง."
ชม,ก.,"จูบ, แสดงความรัก เช่น อ้ายหนุ่มเราชมหีดเดียวร้องแล้ว - อ้ายหนูเราจูบนิดเดียวก็ร้อง."
ชมเกล่า (ร.น.),น.,"ส้มจี๊ด, ส้มชนิดหนึ่ง ลักษณะคล้ายส้มเขียวหวาน ผลเล็กกว่ามะนาว รสเปรี้ยว"
ชมชาติ,ก.,เสียหายหมด.
ชมชาติ,ก.,"พบ ใช้กับญาติหลาย ๆ คนมาพบพร้อมหน้าพร้อมตากัน, ชุมนุมญาติมิตร."
ชมชาติ,ก.,"กลับชาติ, การกล่าวตอนจบของหนังสือประเภทชาดก แล้วบอกว่าใครกลับชาติเป็นอะไร"
ชมพู่,น.,"ฝรั่ง (ผลไม้, เทียบ ม. jambu)"
ชมพู่,น.,"ชมพู่, ชื่อไม้ต้นขนาดกลาง ดอกเป็นฝอยยาว สีเขียว ขาว หรือชมพู สามเหลี่ยมกลม ก้นโต จุกสอบ เนื้อฉ่ำน้ำ รสหวานหรือเปรี้ยวอมหวาน มีทั้งผลสีเขียว ชมพู หรือสีน้ำตาลอมเขียว มีหลายชนิด เช่น ชมพู่เขียว,ชมพู่กะหลาป๋า, ชมพู่แดง, ชมพู่ขาว, ชมพู่ปากแดง, ชมพู่ย่าหวัน, ชมพู่ปู้เต้, ชมพู่น้ำดอกไม้, ชมพู่สาแหรก, ชมพู่แก้มแหม่ม"
ชมพู่,น.,ฝรั่ง (ดู ย่าหมู).
ชมพู่กัว,น.,"ฝรั่ง (ผลไม้, เทียบ ม. jambu)"
ชมพู่กัว,น.,ฝรั่ง (ดู ย่าหมู).
ชมพู่น้ำ,น.,ชมพู่น้ำดอกไม้ (ม. Puteh ; ส.ข.)
ชมพู่น้ำ,น.,ชมพูน้ำดอกไม้ (ดู ปูเต้).
ชมพู่ยาหวัน,น.,ชมพู่น้ำดอกไม้ (ม. Puteh ; ส.ข.)
ชมพู่ยาหวัน,น.,ชมพูน้ำดอกไม้ (ดู ปูเต้).
ชมพู่สวรรค์,น.,ชมพู่น้ำดอกไม้ (ม. Puteh ; ส.ข.)
ชมพู่สวรรค์,น.,ชมพูน้ำดอกไม้ (ดู ปูเต้).
ชมพู่หนวยมาก,น.,"ฝรั่ง (ผลไม้, เทียบ ม. jambu)"
ชมพู่หนวยมาก,น.,ฝรั่ง (ดู ย่าหมู).
ชมโพ่,น.,"ชมพู่, ชื่อไม้ต้นขนาดกลาง ดอกเป็นฝอยยาว สีเขียว ขาว หรือชมพู สามเหลี่ยมกลม ก้นโต จุกสอบ เนื้อฉ่ำน้ำ รสหวานหรือเปรี้ยวอมหวาน มีทั้งผลสีเขียว ชมพู หรือสีน้ำตาลอมเขียว มีหลายชนิด เช่น ชมพู่เขียว,ชมพู่กะหลาป๋า, ชมพู่แดง, ชมพู่ขาว, ชมพู่ปากแดง, ชมพู่ย่าหวัน, ชมพู่ปู้เต้, ชมพู่น้ำดอกไม้, ชมพู่สาแหรก, ชมพู่แก้มแหม่ม"
ชมโพ่,น.,ชมพู่ (ดู ชมพู่).
ชลี,น.,"ชะนี, ชื่อสัตว์เลี้ยงลูกด้วยนม แขนยาวมากไม่มีหาง ขนยาวนุ่ม เดินตัวตั้งตรงได้ ห้อยโหนอยู่ตามต้นไม้สูง ๆ ร้องเสียงดัง เสียงร้องแสดงถึงอาณาเขตของแต่ละคู่ แต่ละชนิดมีเสียงร้องไม่เหมือนกัน กินผลไม้และใบไม้"
ชลี,น.,ชะนี (ดู ลี).
ชวก,ว.,"โชก, ทวี, มาก เช่น เปียกชวก - เปียกโชก, ถูกเบอร์กันชวก - ถูกหวยกันทั่วไป"
ชวงชิมน้อย,น.,ต้นฟ้าทะลายโจร.
ชวด,น.,บิดาหรือมารดาของทวด.
ชวด,น.,ชื่อปีที่ ๑ ของรอบปีนักษัตร มีหนูเป็นเครื่องหมาย
ชวน,ก.,"จูงใจ, โน้มนำ เช่น ชวนกิน, ชวนเที่ยว."
ช่วย,ก.,ส่งเสริมเพื่อให้สำเร็จประโยชน์.
ช่อ,น.,"พวง, กระจุก."
ช่อ,น.,จั่นของตาล หมาก มะพร้าว เป็นต้น.
ช่อ,น.,พวงอาหารแห้งที่จัดถวายวัดในวันสารท (ภ.ก.).
ช่อ,ก.,ผูกรัดเข้าด้วยกัน (ดู เชาะ ก.).
ช่อ,ก.,จีบปาก.
ช่อ,ก.,ผูกรัดเข้าด้วยกัน
ชอก,ก.,"ขัดยอก, เคล็ด."
ชอก,ก.,ผูกรัดเข้าด้วยกัน (ดู เชาะ ก.).
ชอก,ก.,ผูกรัดเข้าด้วยกัน
ช็อก,น.,"ชอล์ก, เครื่องเขียนกระดานดำชนิดหนึ่งที่เป็นสีขาวหรือสีต่าง ๆ ทำจากแคลเซียมซัลเฟต ซึ่งได้จากเกลือจืดหรือยิปซั่มผสมน้ำ"
ช่อขาว,น.,ชื่อข้าวพันธุ์พื้นเมือง.
ช่อไข่เป็ด,น.,ชื่อข้าวพันธุ์พื้นเมือง.
ช่อแคล่,ก.,ห่อด้วยผ้าโดยรวบมุมทั้ง ๔ เข้าด้วยกัน
ชอง,น.,เชือกที่ถักปลายเป็นห่วง เพื่อให้สะดวกในการขึง เรียกตรงนั้นว่า “ชอง” เช่น สายธนู จะทำห่วงเอาไว้ทั้งสองด้านสำหรับคล้องขึงคันธนู.
ชอง,น.,เชือกที่คล้องโกก หรือไม้รูปโค้งที่พาดคอวัว หรือควาย สำหรับลากเลื่อน
ช่อง,น.,"ที่ว่างซึ่งเป็นที่เข้าออกได้, โอกาส."
ช้อง,น.,หญ้าชนิดหนึ่ง ชอบขึ้นในที่น้ำไหล ลักษณะเป็นทางยาวคล้ายช้องหรือปอยผม นิยมเอามาชุบแป้งรวมกับกุ้งแล้วทอด เรียก เบือทอด (ภ.ก.).
ช็อง,ก.,"ทะลึ่ง, ดื้อรั้น (ดู ช็องด็อง)."
ช็อง,ก.,อาการเดินผิดปกติเนื่องจากเท้าพิการ ต้องเดินด้วยปลายเท้า.
ช็อง,ว.,"ฉับพลัน, ฉับไว, เหมาะเหม็ง."
ช็อง,ก.,"ทะลึ่ง, ดื้อรั้น"
ช่องเขา,น.,"เส้นทางที่ใช้เป็นทางข้าม จากทิวเขาด้านหนึ่งไปยังอีกด้านหนึ่ง, ช่องทางที่อยู่ระหว่างเขา ๒ ลูก."
ช็องด็อง,ก.,"ทะลึ่ง, ดื้อรั้น"
ช้องน้องแน่ง,ว.,โซซัดโซเซ (ภ.ก.).
ช่องน้ำ,น.,ช่องระบายน้ำที่คันนา.
ช้องพลู,น.,ช้าพลู (น.ธ.).
ช้องแมว,น.,ชื่อไม้พุ่มชนิดหนึ่ง ลำต้นและกิ่งมีหนาม ดอกเหลืองออกเป็นช่อห้อย ผลคล้ายพุทรา เมื่อสุกสีเหลือง กินไม่ได้ (น.ธ.).
ชองเริน,น.,"มุมหรือช่องแคบ ๆ ในบ้าน, มุมที่เก็บสิ่งของเครื่องใช้ในบ้าน (น.ธ.)."
ช่องเล่,น.,ช่องที่เกิดจากฟันส่วนหน้าหักไป.
ช่อจังหวัด,น.,ชื่อข้าวพันธุ์พื้นเมือง.
ช่อดานงา,น.,ชื่อข้าวพันธุ์พื้นเมือง.
ช่อดำ,น.,ชื่อข้าวพันธุ์พื้นเมือง.
ช้อต,ก.,"สตาร์ตเครื่องยนต์, ติดเครื่องยนต์ (ภ.ก.),."
ช่อตอ,น.,ชื่อข้าวพันธุ์พื้นเมือง.
ชอน,น.,"แมงกระชอน, ชื่อแมลง ลำตัวยาว ขนาดย่อมกว่านิ้วก้อยเล็กน้อย สีน้ำตาล ปีกสั้น บินได้ในระยะใกล้ ขาคู่หน้าสั้นแบน รูปร่างคล้ายอุ้งมือ ปลายมีหนามแข็ง ใช้ขุดดินอาศัยอยู่ในดิน กินรากพืชและแมลงตัวเล็ก ๆ."
ชอน,น.,ดอกไม้ไฟชนิดหนึ่ง.
ชอน,น.,เครื่องมือช้อนปลาอย่างหนึ่ง.
ชอน,ก.,"ชอน, ไช เช่น แมงชอนต้นมะม่วง - แมงไชต้นมะม่วง"
ชอน,ก.,"แอบ, เร้น เช่น ปลาชอนขอน - ปลาแอบขอนไม้."
ชอน,ก.,ควานหา เช่น ชอนปลา - ควานหาปลา.
ช่อน,น.,"ปลาช่อน, ชื่อปลาน้ำจืด ลำตัวทรงกระบอก ส่วนท้ายแบนข้างเล็กน้อย มีเกล็ดในแนวเส้นข้างตัวด้านหลังลำตัวเป็นสีน้ำตาลเทาหรือค่อนข้างดำ ด้านข้างสีอ่อนกว่า และมีลายดำพาดเฉียง ท้องสีขาว ครีบต่าง ๆ มีจุดริ้วสีน้ำตาลดำ."
ช้อน,น.,"ช้อน, เครื่องใช้สำหรับตักของกิน มีที่จับยื่นออกมา"
ช่อนกลั้ง,น.,ชื่อปลาชนิดหนึ่งคล้ายปลาช่อน แต่ตัวเล็กกว่า ขนาดเท่าหัวแม่มือ
ช้อนเขียว,น.,ช้อนเคลือบมีสีเขียว.
ช้อนไขเป็ด,น.,ช้อนเคลือบมีสีส้มหรือสีขาว และมีขนาดใหญ่กว่าช้อนเขียว.
ช่อนไช,น.,ชื่อปลาน้ำจืดชนิดหนึ่งจำพวกปลาช่อนหัวแหลมกว่า.
"ช้อนปากโว้ง (ภ.ก., พ.ง.)",น.,"ทัพพี, เครื่องตักข้าวและแกงมีรูปร่างคล้ายช้อนแต่มีขนาดใหญ่กว่า (ส.ฎ.)."
ช้อนใหญ่,น.,"ทัพพี, เครื่องตักข้าวและแกงมีรูปร่างคล้ายช้อนแต่มีขนาดใหญ่กว่า (ส.ฎ.)."
ช่อนางพิม,น.,ชื่อข้าวพันธุ์พื้นเมือง.
ชอบ,ก.,"รักใคร่, รัก เช่น หนุ่มสาวชอบกัน - หนุ่มสาวรักกัน."
ชอบ,ก.,พอใจ.
ชอบกล,ว.,"ต้องด้วยชั้นเชิง, เข้าที, แปลก."
ชอบใจ,ก.,"น่าคิด, ถูกใจ, ยินดี, พอใจ."
ช่อปริง,น.,ชื่อข้าวพันธุ์พื้นเมือง.
ช่อพร้าว,น.,ชื่อข้าวพันธุ์พื้นเมือง.
ช่อพลีดำ,น.,ชื่อข้าวพันธุ์พื้นเมือง.
ชอม,ก.,ปักไม้เป็นรั้วล้อมต้นไม้เล็ก ๆ เพื่อป้องกันไม่ให้ถูกเหยียบย่ำหรือสัตว์กัดกิน (น.ธ.).
ช็อม,ว.,ไม่เต็มเต็ง
ช่อไม้ไผ่,น.,ชื่อข้าวพันธุ์พื้นเมือง.
ช่อละไม,น.,ชื่อข้าวพันธุ์พื้นเมือง.
ช่อโลกโก,ก.,"วิธีขมวดผ้าเข้าเป็นปม, การผูกมุมทั้งสองของชายผ้าขาวม้าเพื่อทำเป็นสะพายใส่ของ"
ช่ออ้ายพบ,น.,ชื่อข้าวพันธุ์พื้นเมือง.
ช่ออ้ายไหม,น.,ชื่อข้าวพันธุ์พื้นเมือง.
ชะ,น.,"กะชะ, ภาชนะสานโปร่งสำหรับใส่สิ่งของ มีรูปต่าง ๆ บางชนิดมีหูหิ้ว บางชนิดไม่มี"
ชะทน,น.,เครื่องใช้ใส่ปลาชนิดหนึ่ง
ชะทน,น.,เครื่องใช้ใส่ปลาชนิดหนึ่ง.
ชะบุญ,ว.,คำอธิษฐานขอบุญ.
ชะบุญ,อุ.,เดชะบุญ.
ชะเมา,น.,ชื่อไม้ต้นขนาดกลางถึงขนาดใหญ่ชนิดหนึ่ง ใช้ทำเครื่องเรือนได้
ชะเมา,น.,ชื่อไม้ต้นขนาดกลางถึงขนาดใหญ่ชนิดหนึ่ง ใช้ทำเครื่องเรือนได้ (ดู เม็ดดำ).
ชะโยง,น.,ตะกร้าแบบหนึ่งใช้สำหรับใส่ผลไม้ มีขอเกี่ยวกับกิ่งไม้ขณะเก็บ
ชะโรง,ก.,การปล่อยทีเด็ดของนักแสดงเพื่อดึงดูดผู้ชมจากโรงของคู่แข่งขันให้เข้ามายังโรงของตน.
ชะโรง,ก.,"ชำระ, ล้างให้สะอาด เช่น ชะแผล - ชำระแผล, ล้างแผล."
ชะโรง,ก.,"เซาะ, ทำให้กร่อนหรือร่อยหรอไปทีละน้อย เช่น น้ำชะหละ - น้ำเซาะตลิ่ง."
ชะล่อก๊อ,ว.,"เสนียดจัญไร, อุบาทว์ (เทียบ ส. “ฉลก – ผู้ฉ้อฉล”), (เทียบ ม. Chelaka)"
ชะล่อก๊อ,ว.,เสนียดจัญไร (ดู จะหลากา).
ชะลี,น.,ชะนี (ดู ลี).
ชะลูกเขียด,น.,อุปกรณ์ใส่ลูกเขียด สำหรับเป็นเหยื่อเบ็ด ทำด้วยไม้ไผ่สาน เป็นตะกร้าเล็ก ปากเล็กกลม เย็บมอบด้วยผ้า.
ชะหยะ,น.,ตะกร้าสำหรับใส่ขยะ.
ชะหิ้ว,น.,ตะกร้ามีหู (น.ศ.).
ชะหิ้ว,น.,กระทงใส่ขนมเข่ง.
ชะหิ้ว,ก.,"กระชาก, ดึง หรือฉุด หรือกระตุกโดยแรง, ชักเข้ามาโดยเร็วและแรง"
ชะอ้าน,ว.,"กระจัดกระจาย, ระเนระนาด (ป.น.)"
ชะอ้าน,ว.,กระจัดกระจาย (ดู อ้าน ว.).
ชะเอ,ว.,"กระจัดกระจาย, ระเนระนาด (ป.น.)"
ชะเอ,ว.,กระจัดกระจาย (ดู อ้าน ว.).
ชัก,ก.,"ชัก, อาการที่กล้ามเนื้อกระตุกอย่างกะทันหัน และรุนแรง มักมีอาการมือเท้าเกร็ง."
ชักคัก,ก.,ดึงสายบังเหียน.
ชักคัก,ก.,ผูกผ้าเตี่ยวซับระดู
ชักคัก,สำ.,"ตาย, ดิ้น.,"
ชักคัก,สำ.,ดื้อรั้น.
ชักดิกดิก,สำ.,ชักดิ้นเร่า ๆ.
ชักตอก,ก.,เหลาตอกหรือหวายโดยใช้ของมีคม ๒ อันปักบนท่อนไม้ให้คมห่างกันเท่ากับขนาดเส้นตอกที่ต้องการแล้วลากตอกเข้าระหว่างคมนั้น
ชักตา,ก.,ค้อน.
ชักตาแม่ผัว,น.,ปลาตาเดียว (ภ.ก.).
ชักทก,ว.,กระเง้ากระงอด
ชักทัด,ก.,ตีเส้น.
ชักนิทาน,ก.,นำเรื่องต่าง ๆ มาประกอบการพูด ทำนองคุยโม้.
ชักปาก,สำ.,พูดตามที่ถูกเสี้ยมสอน.
ชักผ้า,ก.,ดึงผ้าบังสุกุล.
ชักพระ,น.,พิธีลากพระโดยอัญเชิญพระพุทธรูปประดิษฐานบนบุษบกแล้วลาก ถ้าลากไปทางน้ำเรียก “ชักพระน้ำ” ถ้าลากไปทางบก เรียก “ชักพระบก”.
ชักยัน,ว.,เรื่อยเปื่อย เช่น แหลงชักยัน - พูดเรื่อยเปื่อย.
ชักย่าน,ก.,กิริยาที่เดินตามกันเป็นแถว เช่น มดชักย่าน - มดเดินตามกันเป็นแถว.
ชักยืด,ว.,พูดหรือทำอืดอาดยืดยาด.
ชักรีด,ก.,เหลาตอกหรือหวายโดยใช้ของมีคม ๒ อันปักบนท่อนไม้ให้คมห่างกันเท่ากับขนาดเส้นตอกที่ต้องการแล้วลากตอกเข้าระหว่างคมนั้น
ชักเรื่อง,ก.,นำเรื่องต่าง ๆ มาประกอบการพูด ทำนองคุยโม้.
ชักล้อ,*ก.,ลากเกวียน.
ชักเลียด,ก.,จักย่านลิเภาให้เส้นตอกมีขนาดเท่ากัน โดยผ่านเครื่องเกลาที่เจาะเป็นรู.
